Sheet: クエスト
F1: ミラクルニキのコーデ試算表 | H1: 作者： | I1: 佐衣 | K1: https://github.com/koala31/MiracleNikkiJp_chart
H3: ① テーマに合わせて条件をセットします。
A4: データファイルチェック | F4: タグ1 | H4: タグ重視+++ | K4: 華麗 | N4: シンプル | R4: セクシー | U4: ピュア | AA4: =LEFT(OFFSET('[MiracleNikkiJp_items.csv]MiracleNikkiJp_items'!R10C[-20],0,0,1,1),1) -> 華 | AB4: =LEFT(OFFSET('[MiracleNikkiJp_items.csv]MiracleNikkiJp_items'!R10C[-20],0,0,1,1),1) -> シ | AC4: =LEFT(OFFSET('[MiracleNikkiJp_items.csv]MiracleNikkiJp_items'!R10C[-20],0,0,1,1),1) -> エ | AD4: =LEFT(OFFSET('[MiracleNikkiJp_items.csv]MiracleNikkiJp_items'!R10C[-20],0,0,1,1),1) -> ア | AE4: =LEFT(OFFSET('[MiracleNikkiJp_items.csv]MiracleNikkiJp_items'!R10C[-20],0,0,1,1),1) -> 大 | AF4: =LEFT(OFFSET('[MiracleNikkiJp_items.csv]MiracleNikkiJp_items'!R10C[-20],0,0,1,1),1) -> キ | AG4: =LEFT(OFFSET('[MiracleNikkiJp_items.csv]MiracleNikkiJp_items'!R10C[-20],0,0,1,1),1) -> セ | AH4: =LEFT(OFFSET('[MiracleNikkiJp_items.csv]MiracleNikkiJp_items'!R10C[-20],0,0,1,1),1) -> ピ | AI4: =LEFT(OFFSET('[MiracleNikkiJp_items.csv]MiracleNikkiJp_items'!R10C[-20],0,0,1,1),1) -> ウ | AJ4: =LEFT(OFFSET('[MiracleNikkiJp_items.csv]MiracleNikkiJp_items'!R10C[-20],0,0,1,1),1) -> ク
A5: バランス表 | B5: =IF(AND('[MiracleNikkiJp_balance.csv]MiracleNikkiJp_balance'!R1C1="MiracleNikkiJp_balance.csv",'[MiracleNikkiJp_balance.csv]MiracleNikkiJp_balance'!R2C2=2),"OK","書式NG") -> OK | F5: タグ2 | H5: タグ重視+++ | K5: 評価しない | R5: 評価しない | AA5: =VLOOKUP(R5C11,'[MiracleNikkiJp_balance.csv]MiracleNikkiJp_balance'!R5C4:R13C6,2,FALSE) -> 0 | AB5: =VLOOKUP(R5C11,'[MiracleNikkiJp_balance.csv]MiracleNikkiJp_balance'!R5C4:R13C6,3,FALSE) -> 0 | AC5: =VLOOKUP(R7C11,'[MiracleNikkiJp_balance.csv]MiracleNikkiJp_balance'!R5C7:R13C9,2,FALSE) -> 0 | AD5: =VLOOKUP(R7C11,'[MiracleNikkiJp_balance.csv]MiracleNikkiJp_balance'!R5C7:R13C9,3,FALSE) -> 0 | AE5: =VLOOKUP(R9C11,'[MiracleNikkiJp_balance.csv]MiracleNikkiJp_balance'!R5C10:R13C12,2,FALSE) -> 0 | AF5: =VLOOKUP(R9C11,'[MiracleNikkiJp_balance.csv]MiracleNikkiJp_balance'!R5C10:R13C12,3,FALSE) -> 0 | AG5: =VLOOKUP(R5C18,'[MiracleNikkiJp_balance.csv]MiracleNikkiJp_balance'!R5C13:R13C15,2,FALSE) -> 0 | AH5: =VLOOKUP(R5C18,'[MiracleNikkiJp_balance.csv]MiracleNikkiJp_balance'!R5C13:R13C15,3,FALSE) -> 0 | AI5: =VLOOKUP(R7C18,'[MiracleNikkiJp_balance.csv]MiracleNikkiJp_balance'!R5C16:R13C18,2,FALSE) -> 0 | AJ5: =VLOOKUP(R7C18,'[MiracleNikkiJp_balance.csv]MiracleNikkiJp_balance'!R5C16:R13C18,3,FALSE) -> 0 | AK5: ←属性に対する倍率
A6: アイテム表 | B6: =IF(AND('[MiracleNikkiJp_items.csv]MiracleNikkiJp_items'!R1C1="MiracleNikkiJp_items.csv",'[MiracleNikkiJp_items.csv]MiracleNikkiJp_items'!R2C2=5),"OK","書式NG") -> OK | F6: 色1 | H6: 色重視+ | K6: エレガント | N6: アクティブ | R6: ウォーム | U6: クール | AA6: =IF(R[-1]C>=0,R[-1]C,R[-1]C*R9C22) -> 0 | AB6: =IF(R[-1]C>=0,R[-1]C,R[-1]C*R9C22) -> 0 | AC6: =IF(R[-1]C>=0,R[-1]C,R[-1]C*R9C22) -> 0 | AD6: =IF(R[-1]C>=0,R[-1]C,R[-1]C*R9C22) -> 0 | AE6: =IF(R[-1]C>=0,R[-1]C,R[-1]C*R9C22) -> 0 | AF6: =IF(R[-1]C>=0,R[-1]C,R[-1]C*R9C22) -> 0 | AG6: =IF(R[-1]C>=0,R[-1]C,R[-1]C*R9C22) -> 0 | AH6: =IF(R[-1]C>=0,R[-1]C,R[-1]C*R9C22) -> 0 | AI6: =IF(R[-1]C>=0,R[-1]C,R[-1]C*R9C22) -> 0 | AJ6: =IF(R[-1]C>=0,R[-1]C,R[-1]C*R9C22) -> 0 | AK6: ←反属性ペナルティを考慮した属性に対する倍率
F7: 色2 | H7: 色重視+ | K7: 評価しない | R7: 評価しない
A8: バージョン： | B8: beta4 | F8: スタイル | G8: ドレス | H8: ←評価を0に調整します。 | K8: 大人 | N8: キュート | Z8: ='[MiracleNikkiJp_balance.csv]MiracleNikkiJp_balance'!R[31]C[-25] -> 強さ | AA8: =LEFT('[MiracleNikkiJp_balance.csv]MiracleNikkiJp_balance'!R[31]C[-25],1) -> 華 | AB8: =LEFT('[MiracleNikkiJp_balance.csv]MiracleNikkiJp_balance'!R[31]C[-25],1) -> シ | AC8: =LEFT('[MiracleNikkiJp_balance.csv]MiracleNikkiJp_balance'!R[31]C[-25],1) -> エ | AD8: =LEFT('[MiracleNikkiJp_balance.csv]MiracleNikkiJp_balance'!R[31]C[-25],1) -> ア | AE8: =LEFT('[MiracleNikkiJp_balance.csv]MiracleNikkiJp_balance'!R[31]C[-25],1) -> 大 | AF8: =LEFT('[MiracleNikkiJp_balance.csv]MiracleNikkiJp_balance'!R[31]C[-25],1) -> キ | AG8: =LEFT('[MiracleNikkiJp_balance.csv]MiracleNikkiJp_balance'!R[31]C[-25],1) -> セ | AH8: =LEFT('[MiracleNikkiJp_balance.csv]MiracleNikkiJp_balance'!R[31]C[-25],1) -> ピ | AI8: =LEFT('[MiracleNikkiJp_balance.csv]MiracleNikkiJp_balance'!R[31]C[-25],1) -> ウ | AJ8: =LEFT('[MiracleNikkiJp_balance.csv]MiracleNikkiJp_balance'!R[31]C[-25],1) -> ク | AK8: ='[MiracleNikkiJp_balance.csv]MiracleNikkiJp_balance'!R[31]C[-25] -> * | AL8: ='[MiracleNikkiJp_balance.csv]MiracleNikkiJp_balance'!R[31]C[-25] -> ハートの数 | AM8: ='[MiracleNikkiJp_balance.csv]MiracleNikkiJp_balance'!R[31]C[-25] -> ハートによる倍数 | AN8: ='[MiracleNikkiJp_balance.csv]MiracleNikkiJp_balance'!R[31]C[-25] -> ハートによる加算 | AO8: ='[MiracleNikkiJp_balance.csv]MiracleNikkiJp_balance'!R[31]C[-25] -> * | AP8: ='[MiracleNikkiJp_balance.csv]MiracleNikkiJp_balance'!R[31]C[-25] -> タグの重要度 | AQ8: ='[MiracleNikkiJp_balance.csv]MiracleNikkiJp_balance'!R[31]C[-25] -> タグ一致による倍数 | AR8: ='[MiracleNikkiJp_balance.csv]MiracleNikkiJp_balance'!R[31]C[-25] -> タグ一致による加算 | AS8: ='[MiracleNikkiJp_balance.csv]MiracleNikkiJp_balance'!R[31]C[-25] -> * | AT8: ='[MiracleNikkiJp_balance.csv]MiracleNikkiJp_balance'!R[31]C[-25] -> 色の重要度 | AU8: ='[MiracleNikkiJp_balance.csv]MiracleNikkiJp_balance'!R[31]C[-25] -> 色一致による倍数 | AV8: ='[MiracleNikkiJp_balance.csv]MiracleNikkiJp_balance'!R[31]C[-25] -> 色一致による加算
D9: =IF(RC[3]="リスト全体","×","◯") -> ◯ | F9: 検索対象 | G9: 持っているアイテム | H9: ←所有考慮を切り替えます。 | K9: 評価しない | R9: 反属性減点 | V9: 1 | Z9: =T('[MiracleNikkiJp_balance.csv]MiracleNikkiJp_balance'!R[31]C[-25]) -> X | AA9: ='[MiracleNikkiJp_balance.csv]MiracleNikkiJp_balance'!R[31]C[-25] -> 0 | AB9: ='[MiracleNikkiJp_balance.csv]MiracleNikkiJp_balance'!R[31]C[-25] -> 0 | AC9: ='[MiracleNikkiJp_balance.csv]MiracleNikkiJp_balance'!R[31]C[-25] -> 0 | AD9: ='[MiracleNikkiJp_balance.csv]MiracleNikkiJp_balance'!R[31]C[-25] -> 0 | AE9: ='[MiracleNikkiJp_balance.csv]MiracleNikkiJp_balance'!R[31]C[-25] -> 0 | AF9: ='[MiracleNikkiJp_balance.csv]MiracleNikkiJp_balance'!R[31]C[-25] -> 0 | AG9: ='[MiracleNikkiJp_balance.csv]MiracleNikkiJp_balance'!R[31]C[-25] -> 0 | AH9: ='[MiracleNikkiJp_balance.csv]MiracleNikkiJp_balance'!R[31]C[-25] -> 0 | AI9: ='[MiracleNikkiJp_balance.csv]MiracleNikkiJp_balance'!R[31]C[-25] -> 0 | AJ9: ='[MiracleNikkiJp_balance.csv]MiracleNikkiJp_balance'!R[31]C[-25] -> 0 | AK9: ='[MiracleNikkiJp_balance.csv]MiracleNikkiJp_balance'!R[31]C[-25] -> * | AL9: ='[MiracleNikkiJp_balance.csv]MiracleNikkiJp_balance'!R[31]C[-25] -> 0 | AM9: ='[MiracleNikkiJp_balance.csv]MiracleNikkiJp_balance'!R[31]C[-25] -> 1 | AN9: ='[MiracleNikkiJp_balance.csv]MiracleNikkiJp_balance'!R[31]C[-25] -> 0 | AO9: ='[MiracleNikkiJp_balance.csv]MiracleNikkiJp_balance'!R[31]C[-25] -> * | AP9: =T('[MiracleNikkiJp_balance.csv]MiracleNikkiJp_balance'!R[31]C[-25]) -> タグ重視-super | AQ9: ='[MiracleNikkiJp_balance.csv]MiracleNikkiJp_balance'!R[31]C[-25] -> 0.1 | AR9: ='[MiracleNikkiJp_balance.csv]MiracleNikkiJp_balance'!R[31]C[-25] -> 0 | AS9: ='[MiracleNikkiJp_balance.csv]MiracleNikkiJp_balance'!R[31]C[-25] -> * | AT9: =T('[MiracleNikkiJp_balance.csv]MiracleNikkiJp_balance'!R[31]C[-25]) -> 色重視-super | AU9: ='[MiracleNikkiJp_balance.csv]MiracleNikkiJp_balance'!R[31]C[-25] -> 0.1 | AV9: ='[MiracleNikkiJp_balance.csv]MiracleNikkiJp_balance'!R[31]C[-25] -> 0
Z10: =T('[MiracleNikkiJp_balance.csv]MiracleNikkiJp_balance'!R[31]C[-25]) -> D | AA10: ='[MiracleNikkiJp_balance.csv]MiracleNikkiJp_balance'!R[31]C[-25] -> 2 | AB10: ='[MiracleNikkiJp_balance.csv]MiracleNikkiJp_balance'!R[31]C[-25] -> 2 | AC10: ='[MiracleNikkiJp_balance.csv]MiracleNikkiJp_balance'!R[31]C[-25] -> 2 | AD10: ='[MiracleNikkiJp_balance.csv]MiracleNikkiJp_balance'!R[31]C[-25] -> 2 | AE10: ='[MiracleNikkiJp_balance.csv]MiracleNikkiJp_balance'!R[31]C[-25] -> 2 | AF10: ='[MiracleNikkiJp_balance.csv]MiracleNikkiJp_balance'!R[31]C[-25] -> 2 | AG10: ='[MiracleNikkiJp_balance.csv]MiracleNikkiJp_balance'!R[31]C[-25] -> 2 | AH10: ='[MiracleNikkiJp_balance.csv]MiracleNikkiJp_balance'!R[31]C[-25] -> 2 | AI10: ='[MiracleNikkiJp_balance.csv]MiracleNikkiJp_balance'!R[31]C[-25] -> 2 | AJ10: ='[MiracleNikkiJp_balance.csv]MiracleNikkiJp_balance'!R[31]C[-25] -> 2 | AK10: ='[MiracleNikkiJp_balance.csv]MiracleNikkiJp_balance'!R[30]C[-25] -> * | AL10: ='[MiracleNikkiJp_balance.csv]MiracleNikkiJp_balance'!R[30]C[-25] -> 0 | AM10: ='[MiracleNikkiJp_balance.csv]MiracleNikkiJp_balance'!R[30]C[-25] -> 1 | AN10: ='[MiracleNikkiJp_balance.csv]MiracleNikkiJp_balance'!R[30]C[-25] -> 0 | AO10: ='[MiracleNikkiJp_balance.csv]MiracleNikkiJp_balance'!R[30]C[-25] -> * | AP10: =T('[MiracleNikkiJp_balance.csv]MiracleNikkiJp_balance'!R[30]C[-25]) -> タグ重視-super | AQ10: ='[MiracleNikkiJp_balance.csv]MiracleNikkiJp_balance'!R[30]C[-25] -> 0.1 | AR10: ='[MiracleNikkiJp_balance.csv]MiracleNikkiJp_balance'!R[30]C[-25] -> 0 | AS10: ='[MiracleNikkiJp_balance.csv]MiracleNikkiJp_balance'!R[30]C[-25] -> * | AT10: =T('[MiracleNikkiJp_balance.csv]MiracleNikkiJp_balance'!R[30]C[-25]) -> 色重視-super | AU10: ='[MiracleNikkiJp_balance.csv]MiracleNikkiJp_balance'!R[30]C[-25] -> 0.1 | AV10: ='[MiracleNikkiJp_balance.csv]MiracleNikkiJp_balance'!R[30]C[-25] -> 0
F11: ③ 種類を選択します。(同じ種類は続けて) | I11: ④ どれを採用するか考えます。 | Z11: =T('[MiracleNikkiJp_balance.csv]MiracleNikkiJp_balance'!R[31]C[-25]) -> C | AA11: ='[MiracleNikkiJp_balance.csv]MiracleNikkiJp_balance'!R[31]C[-25] -> 3 | AB11: ='[MiracleNikkiJp_balance.csv]MiracleNikkiJp_balance'!R[31]C[-25] -> 3 | AC11: ='[MiracleNikkiJp_balance.csv]MiracleNikkiJp_balance'!R[31]C[-25] -> 3 | AD11: ='[MiracleNikkiJp_balance.csv]MiracleNikkiJp_balance'!R[31]C[-25] -> 3 | AE11: ='[MiracleNikkiJp_balance.csv]MiracleNikkiJp_balance'!R[31]C[-25] -> 3 | AF11: ='[MiracleNikkiJp_balance.csv]MiracleNikkiJp_balance'!R[31]C[-25] -> 3 | AG11: ='[MiracleNikkiJp_balance.csv]MiracleNikkiJp_balance'!R[31]C[-25] -> 3 | AH11: ='[MiracleNikkiJp_balance.csv]MiracleNikkiJp_balance'!R[31]C[-25] -> 3 | AI11: ='[MiracleNikkiJp_balance.csv]MiracleNikkiJp_balance'!R[31]C[-25] -> 3 | AJ11: ='[MiracleNikkiJp_balance.csv]MiracleNikkiJp_balance'!R[31]C[-25] -> 3 | AK11: ='[MiracleNikkiJp_balance.csv]MiracleNikkiJp_balance'!R[30]C[-25] -> * | AL11: ='[MiracleNikkiJp_balance.csv]MiracleNikkiJp_balance'!R[30]C[-25] -> 1 | AM11: ='[MiracleNikkiJp_balance.csv]MiracleNikkiJp_balance'!R[30]C[-25] -> 1 | AN11: ='[MiracleNikkiJp_balance.csv]MiracleNikkiJp_balance'!R[30]C[-25] -> 0 | AO11: ='[MiracleNikkiJp_balance.csv]MiracleNikkiJp_balance'!R[30]C[-25] -> * | AP11: =T('[MiracleNikkiJp_balance.csv]MiracleNikkiJp_balance'!R[30]C[-25]) -> タグ重視- | AQ11: ='[MiracleNikkiJp_balance.csv]MiracleNikkiJp_balance'!R[30]C[-25] -> 0.9 | AR11: ='[MiracleNikkiJp_balance.csv]MiracleNikkiJp_balance'!R[30]C[-25] -> 0 | AS11: ='[MiracleNikkiJp_balance.csv]MiracleNikkiJp_balance'!R[30]C[-25] -> * | AT11: =T('[MiracleNikkiJp_balance.csv]MiracleNikkiJp_balance'!R[30]C[-25]) -> 色重視- | AU11: ='[MiracleNikkiJp_balance.csv]MiracleNikkiJp_balance'!R[30]C[-25] -> 0.9 | AV11: ='[MiracleNikkiJp_balance.csv]MiracleNikkiJp_balance'!R[30]C[-25] -> 0
A12: 整理番号 | B12: 指定 | C12: 所有 | D12: 通番 | E12: 指定があれば通番 | F12: 種類 | G12: 名前 | H12: 評価 | I12: 採用 | K12: 華 | L12: シ | M12: エ | N12: ア | O12: 大 | P12: キ | Q12: セ | R12: ピ | S12: ウ | T12: ク | U12: タグ | Y12: 色 | Z12: =T('[MiracleNikkiJp_balance.csv]MiracleNikkiJp_balance'!R[31]C[-25]) -> B | AA12: ='[MiracleNikkiJp_balance.csv]MiracleNikkiJp_balance'!R[31]C[-25] -> 4 | AB12: ='[MiracleNikkiJp_balance.csv]MiracleNikkiJp_balance'!R[31]C[-25] -> 4 | AC12: ='[MiracleNikkiJp_balance.csv]MiracleNikkiJp_balance'!R[31]C[-25] -> 4 | AD12: ='[MiracleNikkiJp_balance.csv]MiracleNikkiJp_balance'!R[31]C[-25] -> 4 | AE12: ='[MiracleNikkiJp_balance.csv]MiracleNikkiJp_balance'!R[31]C[-25] -> 4 | AF12: ='[MiracleNikkiJp_balance.csv]MiracleNikkiJp_balance'!R[31]C[-25] -> 4 | AG12: ='[MiracleNikkiJp_balance.csv]MiracleNikkiJp_balance'!R[31]C[-25] -> 4 | AH12: ='[MiracleNikkiJp_balance.csv]MiracleNikkiJp_balance'!R[31]C[-25] -> 4 | AI12: ='[MiracleNikkiJp_balance.csv]MiracleNikkiJp_balance'!R[31]C[-25] -> 4 | AJ12: ='[MiracleNikkiJp_balance.csv]MiracleNikkiJp_balance'!R[31]C[-25] -> 4 | AK12: ='[MiracleNikkiJp_balance.csv]MiracleNikkiJp_balance'!R[30]C[-25] -> * | AL12: ='[MiracleNikkiJp_balance.csv]MiracleNikkiJp_balance'!R[30]C[-25] -> 2 | AM12: ='[MiracleNikkiJp_balance.csv]MiracleNikkiJp_balance'!R[30]C[-25] -> 1 | AN12: ='[MiracleNikkiJp_balance.csv]MiracleNikkiJp_balance'!R[30]C[-25] -> 0 | AO12: ='[MiracleNikkiJp_balance.csv]MiracleNikkiJp_balance'!R[30]C[-25] -> * | AP12: =T('[MiracleNikkiJp_balance.csv]MiracleNikkiJp_balance'!R[30]C[-25]) -> 評価しない | AQ12: ='[MiracleNikkiJp_balance.csv]MiracleNikkiJp_balance'!R[30]C[-25] -> 1 | AR12: ='[MiracleNikkiJp_balance.csv]MiracleNikkiJp_balance'!R[30]C[-25] -> 0 | AS12: ='[MiracleNikkiJp_balance.csv]MiracleNikkiJp_balance'!R[30]C[-25] -> * | AT12: =T('[MiracleNikkiJp_balance.csv]MiracleNikkiJp_balance'!R[30]C[-25]) -> 評価しない | AU12: ='[MiracleNikkiJp_balance.csv]MiracleNikkiJp_balance'!R[30]C[-25] -> 1 | AV12: ='[MiracleNikkiJp_balance.csv]MiracleNikkiJp_balance'!R[30]C[-25] -> 0
A13: =IF(RC4<0,"",OFFSET(R51C,RC4,0,1,1)) -> 1 | B13: =T(OFFSET(R51C,RC4,0,1,1)) ->  | C13: =T(OFFSET(R51C,RC4,0,1,1)) ->  | D13: =IF(AND(R[-1]C6=RC6,R[-1]C5=0),IFERROR((R[-1]C4+1)+(MATCH(RC6,OFFSET(R51C6,R[-1]C4+1,0,(通番最大+1)-1-R[-1]C4,1),0)-1),-2),IF(RC5>0,RC5,MATCH(RC6,OFFSET(R51C6,0,0,通番最大+1,1),0)-1)) -> 1 | E13: =IF(R[-1]C6=RC6,0,IFERROR(MATCH(RC6,OFFSET(R51C5,0,0,通番最大+1,1),0)-1,0)) -> 0 | F13: ヘアスタイル | G13: =T(OFFSET(R51C,RC4,0,1,1)) ->  | H13: =IF(OR(AND(RC6="ドレス",R8C7<>"ドレス"),AND(OR(RC6="トップス",RC6="ボトムス"),R8C7="ドレス")),0,1)*OFFSET(R51C,RC4,0,1,1)*IFERROR(VLOOKUP(RC6,'[MiracleNikkiJp_balance.csv]MiracleNikkiJp_balance'!R5C1:R37C2,2,FALSE),VLOOKUP("アクセサリー",'[MiracleNikkiJp_balance.csv]MiracleNikkiJp_balance'!R5C1:R37C2,2,FALSE)) -> 0 | I13: ◯ | K13: =T(OFFSET(R51C,RC4,0,1,1)) ->  | L13: =T(OFFSET(R51C,RC4,0,1,1)) ->  | M13: =T(OFFSET(R51C,RC4,0,1,1)) ->  | N13: =T(OFFSET(R51C,RC4,0,1,1)) ->  | O13: =T(OFFSET(R51C,RC4,0,1,1)) ->  | P13: =T(OFFSET(R51C,RC4,0,1,1)) ->  | Q13: =T(OFFSET(R51C,RC4,0,1,1)) ->  | R13: =T(OFFSET(R51C,RC4,0,1,1)) ->  | S13: =T(OFFSET(R51C,RC4,0,1,1)) ->  | T13: =T(OFFSET(R51C,RC4,0,1,1)) ->  | U13: =T(OFFSET(R51C,RC4,0,1,1)) ->  | Y13: =T(OFFSET(R51C,RC4,0,1,1)) ->  | Z13: =T('[MiracleNikkiJp_balance.csv]MiracleNikkiJp_balance'!R[31]C[-25]) -> A | AA13: ='[MiracleNikkiJp_balance.csv]MiracleNikkiJp_balance'!R[31]C[-25] -> 5 | AB13: ='[MiracleNikkiJp_balance.csv]MiracleNikkiJp_balance'!R[31]C[-25] -> 5 | AC13: ='[MiracleNikkiJp_balance.csv]MiracleNikkiJp_balance'!R[31]C[-25] -> 5 | AD13: ='[MiracleNikkiJp_balance.csv]MiracleNikkiJp_balance'!R[31]C[-25] -> 5 | AE13: ='[MiracleNikkiJp_balance.csv]MiracleNikkiJp_balance'!R[31]C[-25] -> 5 | AF13: ='[MiracleNikkiJp_balance.csv]MiracleNikkiJp_balance'!R[31]C[-25] -> 5 | AG13: ='[MiracleNikkiJp_balance.csv]MiracleNikkiJp_balance'!R[31]C[-25] -> 5 | AH13: ='[MiracleNikkiJp_balance.csv]MiracleNikkiJp_balance'!R[31]C[-25] -> 5 | AI13: ='[MiracleNikkiJp_balance.csv]MiracleNikkiJp_balance'!R[31]C[-25] -> 5 | AJ13: ='[MiracleNikkiJp_balance.csv]MiracleNikkiJp_balance'!R[31]C[-25] -> 5 | AK13: ='[MiracleNikkiJp_balance.csv]MiracleNikkiJp_balance'!R[30]C[-25] -> * | AL13: ='[MiracleNikkiJp_balance.csv]MiracleNikkiJp_balance'!R[30]C[-25] -> 3 | AM13: ='[MiracleNikkiJp_balance.csv]MiracleNikkiJp_balance'!R[30]C[-25] -> 1 | AN13: ='[MiracleNikkiJp_balance.csv]MiracleNikkiJp_balance'!R[30]C[-25] -> 0 | AO13: ='[MiracleNikkiJp_balance.csv]MiracleNikkiJp_balance'!R[30]C[-25] -> * | AP13: =T('[MiracleNikkiJp_balance.csv]MiracleNikkiJp_balance'!R[30]C[-25]) -> タグ重視+ | AQ13: ='[MiracleNikkiJp_balance.csv]MiracleNikkiJp_balance'!R[30]C[-25] -> 1.1000000000000001 | AR13: ='[MiracleNikkiJp_balance.csv]MiracleNikkiJp_balance'!R[30]C[-25] -> 0 | AS13: ='[MiracleNikkiJp_balance.csv]MiracleNikkiJp_balance'!R[30]C[-25] -> * | AT13: =T('[MiracleNikkiJp_balance.csv]MiracleNikkiJp_balance'!R[30]C[-25]) -> 色重視+ | AU13: ='[MiracleNikkiJp_balance.csv]MiracleNikkiJp_balance'!R[30]C[-25] -> 1.1000000000000001 | AV13: ='[MiracleNikkiJp_balance.csv]MiracleNikkiJp_balance'!R[30]C[-25] -> 0
A14: =IF(RC4<0,"",OFFSET(R51C,RC4,0,1,1)) -> #N/A | B14: =T(OFFSET(R51C,RC4,0,1,1)) -> #N/A | C14: =T(OFFSET(R51C,RC4,0,1,1)) -> #N/A | D14: =IF(AND(R[-1]C6=RC6,R[-1]C5=0),IFERROR((R[-1]C4+1)+(MATCH(RC6,OFFSET(R51C6,R[-1]C4+1,0,(通番最大+1)-1-R[-1]C4,1),0)-1),-2),IF(RC5>0,RC5,MATCH(RC6,OFFSET(R51C6,0,0,通番最大+1,1),0)-1)) -> #N/A | E14: =IF(R[-1]C6=RC6,0,IFERROR(MATCH(RC6,OFFSET(R51C5,0,0,通番最大+1,1),0)-1,0)) -> 0 | F14: ドレス | G14: =T(OFFSET(R51C,RC4,0,1,1)) -> #N/A | H14: =IF(OR(AND(RC6="ドレス",R8C7<>"ドレス"),AND(OR(RC6="トップス",RC6="ボトムス"),R8C7="ドレス")),0,1)*OFFSET(R51C,RC4,0,1,1)*IFERROR(VLOOKUP(RC6,'[MiracleNikkiJp_balance.csv]MiracleNikkiJp_balance'!R5C1:R37C2,2,FALSE),VLOOKUP("アクセサリー",'[MiracleNikkiJp_balance.csv]MiracleNikkiJp_balance'!R5C1:R37C2,2,FALSE)) -> #N/A | I14: ◯ | K14: =T(OFFSET(R51C,RC4,0,1,1)) -> #N/A | L14: =T(OFFSET(R51C,RC4,0,1,1)) -> #N/A | M14: =T(OFFSET(R51C,RC4,0,1,1)) -> #N/A | N14: =T(OFFSET(R51C,RC4,0,1,1)) -> #N/A | O14: =T(OFFSET(R51C,RC4,0,1,1)) -> #N/A | P14: =T(OFFSET(R51C,RC4,0,1,1)) -> #N/A | Q14: =T(OFFSET(R51C,RC4,0,1,1)) -> #N/A | R14: =T(OFFSET(R51C,RC4,0,1,1)) -> #N/A | S14: =T(OFFSET(R51C,RC4,0,1,1)) -> #N/A | T14: =T(OFFSET(R51C,RC4,0,1,1)) -> #N/A | U14: =T(OFFSET(R51C,RC4,0,1,1)) -> #N/A | Y14: =T(OFFSET(R51C,RC4,0,1,1)) -> #N/A | Z14: =T('[MiracleNikkiJp_balance.csv]MiracleNikkiJp_balance'!R[31]C[-25]) -> S | AA14: ='[MiracleNikkiJp_balance.csv]MiracleNikkiJp_balance'!R[31]C[-25] -> 7 | AB14: ='[MiracleNikkiJp_balance.csv]MiracleNikkiJp_balance'!R[31]C[-25] -> 7 | AC14: ='[MiracleNikkiJp_balance.csv]MiracleNikkiJp_balance'!R[31]C[-25] -> 7 | AD14: ='[MiracleNikkiJp_balance.csv]MiracleNikkiJp_balance'!R[31]C[-25] -> 7 | AE14: ='[MiracleNikkiJp_balance.csv]MiracleNikkiJp_balance'!R[31]C[-25] -> 7 | AF14: ='[MiracleNikkiJp_balance.csv]MiracleNikkiJp_balance'!R[31]C[-25] -> 7 | AG14: ='[MiracleNikkiJp_balance.csv]MiracleNikkiJp_balance'!R[31]C[-25] -> 7 | AH14: ='[MiracleNikkiJp_balance.csv]MiracleNikkiJp_balance'!R[31]C[-25] -> 7 | AI14: ='[MiracleNikkiJp_balance.csv]MiracleNikkiJp_balance'!R[31]C[-25] -> 7 | AJ14: ='[MiracleNikkiJp_balance.csv]MiracleNikkiJp_balance'!R[31]C[-25] -> 7 | AK14: ='[MiracleNikkiJp_balance.csv]MiracleNikkiJp_balance'!R[30]C[-25] -> * | AL14: ='[MiracleNikkiJp_balance.csv]MiracleNikkiJp_balance'!R[30]C[-25] -> 4 | AM14: ='[MiracleNikkiJp_balance.csv]MiracleNikkiJp_balance'!R[30]C[-25] -> 1 | AN14: ='[MiracleNikkiJp_balance.csv]MiracleNikkiJp_balance'!R[30]C[-25] -> 0 | AO14: ='[MiracleNikkiJp_balance.csv]MiracleNikkiJp_balance'!R[30]C[-25] -> * | AP14: =T('[MiracleNikkiJp_balance.csv]MiracleNikkiJp_balance'!R[30]C[-25]) -> タグ重視++ | AQ14: ='[MiracleNikkiJp_balance.csv]MiracleNikkiJp_balance'!R[30]C[-25] -> 2 | AR14: ='[MiracleNikkiJp_balance.csv]MiracleNikkiJp_balance'!R[30]C[-25] -> 0 | AS14: ='[MiracleNikkiJp_balance.csv]MiracleNikkiJp_balance'!R[30]C[-25] -> * | AT14: =T('[MiracleNikkiJp_balance.csv]MiracleNikkiJp_balance'!R[30]C[-25]) -> 色重視++ | AU14: ='[MiracleNikkiJp_balance.csv]MiracleNikkiJp_balance'!R[30]C[-25] -> 2 | AV14: ='[MiracleNikkiJp_balance.csv]MiracleNikkiJp_balance'!R[30]C[-25] -> 0
A15: =IF(RC4<0,"",OFFSET(R51C,RC4,0,1,1)) -> #N/A | B15: =T(OFFSET(R51C,RC4,0,1,1)) -> #N/A | C15: =T(OFFSET(R51C,RC4,0,1,1)) -> #N/A | D15: =IF(AND(R[-1]C6=RC6,R[-1]C5=0),IFERROR((R[-1]C4+1)+(MATCH(RC6,OFFSET(R51C6,R[-1]C4+1,0,(通番最大+1)-1-R[-1]C4,1),0)-1),-2),IF(RC5>0,RC5,MATCH(RC6,OFFSET(R51C6,0,0,通番最大+1,1),0)-1)) -> #N/A | E15: =IF(R[-1]C6=RC6,0,IFERROR(MATCH(RC6,OFFSET(R51C5,0,0,通番最大+1,1),0)-1,0)) -> 0 | F15: コート | G15: =T(OFFSET(R51C,RC4,0,1,1)) -> #N/A | H15: =IF(OR(AND(RC6="ドレス",R8C7<>"ドレス"),AND(OR(RC6="トップス",RC6="ボトムス"),R8C7="ドレス")),0,1)*OFFSET(R51C,RC4,0,1,1)*IFERROR(VLOOKUP(RC6,'[MiracleNikkiJp_balance.csv]MiracleNikkiJp_balance'!R5C1:R37C2,2,FALSE),VLOOKUP("アクセサリー",'[MiracleNikkiJp_balance.csv]MiracleNikkiJp_balance'!R5C1:R37C2,2,FALSE)) -> #N/A | I15: ◯ | K15: =T(OFFSET(R51C,RC4,0,1,1)) -> #N/A | L15: =T(OFFSET(R51C,RC4,0,1,1)) -> #N/A | M15: =T(OFFSET(R51C,RC4,0,1,1)) -> #N/A | N15: =T(OFFSET(R51C,RC4,0,1,1)) -> #N/A | O15: =T(OFFSET(R51C,RC4,0,1,1)) -> #N/A | P15: =T(OFFSET(R51C,RC4,0,1,1)) -> #N/A | Q15: =T(OFFSET(R51C,RC4,0,1,1)) -> #N/A | R15: =T(OFFSET(R51C,RC4,0,1,1)) -> #N/A | S15: =T(OFFSET(R51C,RC4,0,1,1)) -> #N/A | T15: =T(OFFSET(R51C,RC4,0,1,1)) -> #N/A | U15: =T(OFFSET(R51C,RC4,0,1,1)) -> #N/A | Y15: =T(OFFSET(R51C,RC4,0,1,1)) -> #N/A | Z15: =T('[MiracleNikkiJp_balance.csv]MiracleNikkiJp_balance'!R[31]C[-25]) -> SS | AA15: ='[MiracleNikkiJp_balance.csv]MiracleNikkiJp_balance'!R[31]C[-25] -> 9 | AB15: ='[MiracleNikkiJp_balance.csv]MiracleNikkiJp_balance'!R[31]C[-25] -> 9 | AC15: ='[MiracleNikkiJp_balance.csv]MiracleNikkiJp_balance'!R[31]C[-25] -> 9 | AD15: ='[MiracleNikkiJp_balance.csv]MiracleNikkiJp_balance'!R[31]C[-25] -> 9 | AE15: ='[MiracleNikkiJp_balance.csv]MiracleNikkiJp_balance'!R[31]C[-25] -> 9 | AF15: ='[MiracleNikkiJp_balance.csv]MiracleNikkiJp_balance'!R[31]C[-25] -> 9 | AG15: ='[MiracleNikkiJp_balance.csv]MiracleNikkiJp_balance'!R[31]C[-25] -> 9 | AH15: ='[MiracleNikkiJp_balance.csv]MiracleNikkiJp_balance'!R[31]C[-25] -> 9 | AI15: ='[MiracleNikkiJp_balance.csv]MiracleNikkiJp_balance'!R[31]C[-25] -> 9 | AJ15: ='[MiracleNikkiJp_balance.csv]MiracleNikkiJp_balance'!R[31]C[-25] -> 9 | AK15: ='[MiracleNikkiJp_balance.csv]MiracleNikkiJp_balance'!R[30]C[-25] -> * | AL15: ='[MiracleNikkiJp_balance.csv]MiracleNikkiJp_balance'!R[30]C[-25] -> 5 | AM15: ='[MiracleNikkiJp_balance.csv]MiracleNikkiJp_balance'!R[30]C[-25] -> 1 | AN15: ='[MiracleNikkiJp_balance.csv]MiracleNikkiJp_balance'!R[30]C[-25] -> 0 | AO15: ='[MiracleNikkiJp_balance.csv]MiracleNikkiJp_balance'!R[30]C[-25] -> * | AP15: =T('[MiracleNikkiJp_balance.csv]MiracleNikkiJp_balance'!R[30]C[-25]) -> タグ重視+++ | AQ15: ='[MiracleNikkiJp_balance.csv]MiracleNikkiJp_balance'!R[30]C[-25] -> 5 | AR15: ='[MiracleNikkiJp_balance.csv]MiracleNikkiJp_balance'!R[30]C[-25] -> 0 | AS15: ='[MiracleNikkiJp_balance.csv]MiracleNikkiJp_balance'!R[30]C[-25] -> * | AT15: =T('[MiracleNikkiJp_balance.csv]MiracleNikkiJp_balance'!R[30]C[-25]) -> 色重視+++ | AU15: ='[MiracleNikkiJp_balance.csv]MiracleNikkiJp_balance'!R[30]C[-25] -> 5 | AV15: ='[MiracleNikkiJp_balance.csv]MiracleNikkiJp_balance'!R[30]C[-25] -> 0
A16: =IF(RC4<0,"",OFFSET(R51C,RC4,0,1,1)) -> #N/A | B16: =T(OFFSET(R51C,RC4,0,1,1)) -> #N/A | C16: =T(OFFSET(R51C,RC4,0,1,1)) -> #N/A | D16: =IF(AND(R[-1]C6=RC6,R[-1]C5=0),IFERROR((R[-1]C4+1)+(MATCH(RC6,OFFSET(R51C6,R[-1]C4+1,0,(通番最大+1)-1-R[-1]C4,1),0)-1),-2),IF(RC5>0,RC5,MATCH(RC6,OFFSET(R51C6,0,0,通番最大+1,1),0)-1)) -> #N/A | E16: =IF(R[-1]C6=RC6,0,IFERROR(MATCH(RC6,OFFSET(R51C5,0,0,通番最大+1,1),0)-1,0)) -> 0 | F16: トップス | G16: =T(OFFSET(R51C,RC4,0,1,1)) -> #N/A | H16: =IF(OR(AND(RC6="ドレス",R8C7<>"ドレス"),AND(OR(RC6="トップス",RC6="ボトムス"),R8C7="ドレス")),0,1)*OFFSET(R51C,RC4,0,1,1)*IFERROR(VLOOKUP(RC6,'[MiracleNikkiJp_balance.csv]MiracleNikkiJp_balance'!R5C1:R37C2,2,FALSE),VLOOKUP("アクセサリー",'[MiracleNikkiJp_balance.csv]MiracleNikkiJp_balance'!R5C1:R37C2,2,FALSE)) -> #N/A | I16: ◯ | K16: =T(OFFSET(R51C,RC4,0,1,1)) -> #N/A | L16: =T(OFFSET(R51C,RC4,0,1,1)) -> #N/A | M16: =T(OFFSET(R51C,RC4,0,1,1)) -> #N/A | N16: =T(OFFSET(R51C,RC4,0,1,1)) -> #N/A | O16: =T(OFFSET(R51C,RC4,0,1,1)) -> #N/A | P16: =T(OFFSET(R51C,RC4,0,1,1)) -> #N/A | Q16: =T(OFFSET(R51C,RC4,0,1,1)) -> #N/A | R16: =T(OFFSET(R51C,RC4,0,1,1)) -> #N/A | S16: =T(OFFSET(R51C,RC4,0,1,1)) -> #N/A | T16: =T(OFFSET(R51C,RC4,0,1,1)) -> #N/A | U16: =T(OFFSET(R51C,RC4,0,1,1)) -> #N/A | Y16: =T(OFFSET(R51C,RC4,0,1,1)) -> #N/A | Z16: =T('[MiracleNikkiJp_balance.csv]MiracleNikkiJp_balance'!R[31]C[-25]) -> SSS | AA16: ='[MiracleNikkiJp_balance.csv]MiracleNikkiJp_balance'!R[31]C[-25] -> 11 | AB16: ='[MiracleNikkiJp_balance.csv]MiracleNikkiJp_balance'!R[31]C[-25] -> 11 | AC16: ='[MiracleNikkiJp_balance.csv]MiracleNikkiJp_balance'!R[31]C[-25] -> 11 | AD16: ='[MiracleNikkiJp_balance.csv]MiracleNikkiJp_balance'!R[31]C[-25] -> 11 | AE16: ='[MiracleNikkiJp_balance.csv]MiracleNikkiJp_balance'!R[31]C[-25] -> 11 | AF16: ='[MiracleNikkiJp_balance.csv]MiracleNikkiJp_balance'!R[31]C[-25] -> 11 | AG16: ='[MiracleNikkiJp_balance.csv]MiracleNikkiJp_balance'!R[31]C[-25] -> 11 | AH16: ='[MiracleNikkiJp_balance.csv]MiracleNikkiJp_balance'!R[31]C[-25] -> 11 | AI16: ='[MiracleNikkiJp_balance.csv]MiracleNikkiJp_balance'!R[31]C[-25] -> 11 | AJ16: ='[MiracleNikkiJp_balance.csv]MiracleNikkiJp_balance'!R[31]C[-25] -> 11 | AK16: ='[MiracleNikkiJp_balance.csv]MiracleNikkiJp_balance'!R[30]C[-25] -> * | AL16: ='[MiracleNikkiJp_balance.csv]MiracleNikkiJp_balance'!R[30]C[-25] -> 6 | AM16: ='[MiracleNikkiJp_balance.csv]MiracleNikkiJp_balance'!R[30]C[-25] -> 1 | AN16: ='[MiracleNikkiJp_balance.csv]MiracleNikkiJp_balance'!R[30]C[-25] -> 0 | AO16: ='[MiracleNikkiJp_balance.csv]MiracleNikkiJp_balance'!R[30]C[-25] -> * | AP16: =T('[MiracleNikkiJp_balance.csv]MiracleNikkiJp_balance'!R[30]C[-25]) -> タグ重視+super | AQ16: ='[MiracleNikkiJp_balance.csv]MiracleNikkiJp_balance'!R[30]C[-25] -> 10 | AR16: ='[MiracleNikkiJp_balance.csv]MiracleNikkiJp_balance'!R[30]C[-25] -> 0 | AS16: ='[MiracleNikkiJp_balance.csv]MiracleNikkiJp_balance'!R[30]C[-25] -> * | AT16: =T('[MiracleNikkiJp_balance.csv]MiracleNikkiJp_balance'!R[30]C[-25]) -> 色重視+super | AU16: ='[MiracleNikkiJp_balance.csv]MiracleNikkiJp_balance'!R[30]C[-25] -> 10 | AV16: ='[MiracleNikkiJp_balance.csv]MiracleNikkiJp_balance'!R[30]C[-25] -> 0
A17: =IF(RC4<0,"",OFFSET(R51C,RC4,0,1,1)) -> #N/A | B17: =T(OFFSET(R51C,RC4,0,1,1)) -> #N/A | C17: =T(OFFSET(R51C,RC4,0,1,1)) -> #N/A | D17: =IF(AND(R[-1]C6=RC6,R[-1]C5=0),IFERROR((R[-1]C4+1)+(MATCH(RC6,OFFSET(R51C6,R[-1]C4+1,0,(通番最大+1)-1-R[-1]C4,1),0)-1),-2),IF(RC5>0,RC5,MATCH(RC6,OFFSET(R51C6,0,0,通番最大+1,1),0)-1)) -> #N/A | E17: =IF(R[-1]C6=RC6,0,IFERROR(MATCH(RC6,OFFSET(R51C5,0,0,通番最大+1,1),0)-1,0)) -> 0 | F17: ボトムス | G17: =T(OFFSET(R51C,RC4,0,1,1)) -> #N/A | H17: =IF(OR(AND(RC6="ドレス",R8C7<>"ドレス"),AND(OR(RC6="トップス",RC6="ボトムス"),R8C7="ドレス")),0,1)*OFFSET(R51C,RC4,0,1,1)*IFERROR(VLOOKUP(RC6,'[MiracleNikkiJp_balance.csv]MiracleNikkiJp_balance'!R5C1:R37C2,2,FALSE),VLOOKUP("アクセサリー",'[MiracleNikkiJp_balance.csv]MiracleNikkiJp_balance'!R5C1:R37C2,2,FALSE)) -> #N/A | I17: ◯ | K17: =T(OFFSET(R51C,RC4,0,1,1)) -> #N/A | L17: =T(OFFSET(R51C,RC4,0,1,1)) -> #N/A | M17: =T(OFFSET(R51C,RC4,0,1,1)) -> #N/A | N17: =T(OFFSET(R51C,RC4,0,1,1)) -> #N/A | O17: =T(OFFSET(R51C,RC4,0,1,1)) -> #N/A | P17: =T(OFFSET(R51C,RC4,0,1,1)) -> #N/A | Q17: =T(OFFSET(R51C,RC4,0,1,1)) -> #N/A | R17: =T(OFFSET(R51C,RC4,0,1,1)) -> #N/A | S17: =T(OFFSET(R51C,RC4,0,1,1)) -> #N/A | T17: =T(OFFSET(R51C,RC4,0,1,1)) -> #N/A | U17: =T(OFFSET(R51C,RC4,0,1,1)) -> #N/A | Y17: =T(OFFSET(R51C,RC4,0,1,1)) -> #N/A | Z17: =T('[MiracleNikkiJp_balance.csv]MiracleNikkiJp_balance'!R[31]C[-25]) -> SSSS | AA17: ='[MiracleNikkiJp_balance.csv]MiracleNikkiJp_balance'!R[31]C[-25] -> 13 | AB17: ='[MiracleNikkiJp_balance.csv]MiracleNikkiJp_balance'!R[31]C[-25] -> 13 | AC17: ='[MiracleNikkiJp_balance.csv]MiracleNikkiJp_balance'!R[31]C[-25] -> 13 | AD17: ='[MiracleNikkiJp_balance.csv]MiracleNikkiJp_balance'!R[31]C[-25] -> 13 | AE17: ='[MiracleNikkiJp_balance.csv]MiracleNikkiJp_balance'!R[31]C[-25] -> 13 | AF17: ='[MiracleNikkiJp_balance.csv]MiracleNikkiJp_balance'!R[31]C[-25] -> 13 | AG17: ='[MiracleNikkiJp_balance.csv]MiracleNikkiJp_balance'!R[31]C[-25] -> 13 | AH17: ='[MiracleNikkiJp_balance.csv]MiracleNikkiJp_balance'!R[31]C[-25] -> 13 | AI17: ='[MiracleNikkiJp_balance.csv]MiracleNikkiJp_balance'!R[31]C[-25] -> 13 | AJ17: ='[MiracleNikkiJp_balance.csv]MiracleNikkiJp_balance'!R[31]C[-25] -> 13 | AK17: ='[MiracleNikkiJp_balance.csv]MiracleNikkiJp_balance'!R[30]C[-25] -> * | AL17: ='[MiracleNikkiJp_balance.csv]MiracleNikkiJp_balance'!R[30]C[-25] -> 7 | AM17: ='[MiracleNikkiJp_balance.csv]MiracleNikkiJp_balance'!R[30]C[-25] -> 1 | AN17: ='[MiracleNikkiJp_balance.csv]MiracleNikkiJp_balance'!R[30]C[-25] -> 0 | AO17: ='[MiracleNikkiJp_balance.csv]MiracleNikkiJp_balance'!R[30]C[-25] -> * | AP17: =T('[MiracleNikkiJp_balance.csv]MiracleNikkiJp_balance'!R[30]C[-25]) ->  | AQ17: ='[MiracleNikkiJp_balance.csv]MiracleNikkiJp_balance'!R[30]C[-25] -> 0 | AR17: ='[MiracleNikkiJp_balance.csv]MiracleNikkiJp_balance'!R[30]C[-25] -> 0 | AS17: ='[MiracleNikkiJp_balance.csv]MiracleNikkiJp_balance'!R[30]C[-25] -> 0 | AT17: =T('[MiracleNikkiJp_balance.csv]MiracleNikkiJp_balance'!R[30]C[-25]) ->  | AU17: ='[MiracleNikkiJp_balance.csv]MiracleNikkiJp_balance'!R[30]C[-25] -> 0 | AV17: ='[MiracleNikkiJp_balance.csv]MiracleNikkiJp_balance'!R[30]C[-25] -> 0
A18: =IF(RC4<0,"",OFFSET(R51C,RC4,0,1,1)) -> #N/A | B18: =T(OFFSET(R51C,RC4,0,1,1)) -> #N/A | C18: =T(OFFSET(R51C,RC4,0,1,1)) -> #N/A | D18: =IF(AND(R[-1]C6=RC6,R[-1]C5=0),IFERROR((R[-1]C4+1)+(MATCH(RC6,OFFSET(R51C6,R[-1]C4+1,0,(通番最大+1)-1-R[-1]C4,1),0)-1),-2),IF(RC5>0,RC5,MATCH(RC6,OFFSET(R51C6,0,0,通番最大+1,1),0)-1)) -> #N/A | E18: =IF(R[-1]C6=RC6,0,IFERROR(MATCH(RC6,OFFSET(R51C5,0,0,通番最大+1,1),0)-1,0)) -> 0 | F18: 靴下 | G18: =T(OFFSET(R51C,RC4,0,1,1)) -> #N/A | H18: =IF(OR(AND(RC6="ドレス",R8C7<>"ドレス"),AND(OR(RC6="トップス",RC6="ボトムス"),R8C7="ドレス")),0,1)*OFFSET(R51C,RC4,0,1,1)*IFERROR(VLOOKUP(RC6,'[MiracleNikkiJp_balance.csv]MiracleNikkiJp_balance'!R5C1:R37C2,2,FALSE),VLOOKUP("アクセサリー",'[MiracleNikkiJp_balance.csv]MiracleNikkiJp_balance'!R5C1:R37C2,2,FALSE)) -> #N/A | I18: ◯ | K18: =T(OFFSET(R51C,RC4,0,1,1)) -> #N/A | L18: =T(OFFSET(R51C,RC4,0,1,1)) -> #N/A | M18: =T(OFFSET(R51C,RC4,0,1,1)) -> #N/A | N18: =T(OFFSET(R51C,RC4,0,1,1)) -> #N/A | O18: =T(OFFSET(R51C,RC4,0,1,1)) -> #N/A | P18: =T(OFFSET(R51C,RC4,0,1,1)) -> #N/A | Q18: =T(OFFSET(R51C,RC4,0,1,1)) -> #N/A | R18: =T(OFFSET(R51C,RC4,0,1,1)) -> #N/A | S18: =T(OFFSET(R51C,RC4,0,1,1)) -> #N/A | T18: =T(OFFSET(R51C,RC4,0,1,1)) -> #N/A | U18: =T(OFFSET(R51C,RC4,0,1,1)) -> #N/A | Y18: =T(OFFSET(R51C,RC4,0,1,1)) -> #N/A
A19: =IF(RC4<0,"",OFFSET(R51C,RC4,0,1,1)) -> #N/A | B19: =T(OFFSET(R51C,RC4,0,1,1)) -> #N/A | C19: =T(OFFSET(R51C,RC4,0,1,1)) -> #N/A | D19: =IF(AND(R[-1]C6=RC6,R[-1]C5=0),IFERROR((R[-1]C4+1)+(MATCH(RC6,OFFSET(R51C6,R[-1]C4+1,0,(通番最大+1)-1-R[-1]C4,1),0)-1),-2),IF(RC5>0,RC5,MATCH(RC6,OFFSET(R51C6,0,0,通番最大+1,1),0)-1)) -> #N/A | E19: =IF(R[-1]C6=RC6,0,IFERROR(MATCH(RC6,OFFSET(R51C5,0,0,通番最大+1,1),0)-1,0)) -> 0 | F19: 靴下・ガーター | G19: =T(OFFSET(R51C,RC4,0,1,1)) -> #N/A | H19: =IF(OR(AND(RC6="ドレス",R8C7<>"ドレス"),AND(OR(RC6="トップス",RC6="ボトムス"),R8C7="ドレス")),0,1)*OFFSET(R51C,RC4,0,1,1)*IFERROR(VLOOKUP(RC6,'[MiracleNikkiJp_balance.csv]MiracleNikkiJp_balance'!R5C1:R37C2,2,FALSE),VLOOKUP("アクセサリー",'[MiracleNikkiJp_balance.csv]MiracleNikkiJp_balance'!R5C1:R37C2,2,FALSE)) -> #N/A | I19: ◯ | K19: =T(OFFSET(R51C,RC4,0,1,1)) -> #N/A | L19: =T(OFFSET(R51C,RC4,0,1,1)) -> #N/A | M19: =T(OFFSET(R51C,RC4,0,1,1)) -> #N/A | N19: =T(OFFSET(R51C,RC4,0,1,1)) -> #N/A | O19: =T(OFFSET(R51C,RC4,0,1,1)) -> #N/A | P19: =T(OFFSET(R51C,RC4,0,1,1)) -> #N/A | Q19: =T(OFFSET(R51C,RC4,0,1,1)) -> #N/A | R19: =T(OFFSET(R51C,RC4,0,1,1)) -> #N/A | S19: =T(OFFSET(R51C,RC4,0,1,1)) -> #N/A | T19: =T(OFFSET(R51C,RC4,0,1,1)) -> #N/A | U19: =T(OFFSET(R51C,RC4,0,1,1)) -> #N/A | Y19: =T(OFFSET(R51C,RC4,0,1,1)) -> #N/A
A20: =IF(RC4<0,"",OFFSET(R51C,RC4,0,1,1)) -> #N/A | B20: =T(OFFSET(R51C,RC4,0,1,1)) -> #N/A | C20: =T(OFFSET(R51C,RC4,0,1,1)) -> #N/A | D20: =IF(AND(R[-1]C6=RC6,R[-1]C5=0),IFERROR((R[-1]C4+1)+(MATCH(RC6,OFFSET(R51C6,R[-1]C4+1,0,(通番最大+1)-1-R[-1]C4,1),0)-1),-2),IF(RC5>0,RC5,MATCH(RC6,OFFSET(R51C6,0,0,通番最大+1,1),0)-1)) -> #N/A | E20: =IF(R[-1]C6=RC6,0,IFERROR(MATCH(RC6,OFFSET(R51C5,0,0,通番最大+1,1),0)-1,0)) -> 0 | F20: シューズ | G20: =T(OFFSET(R51C,RC4,0,1,1)) -> #N/A | H20: =IF(OR(AND(RC6="ドレス",R8C7<>"ドレス"),AND(OR(RC6="トップス",RC6="ボトムス"),R8C7="ドレス")),0,1)*OFFSET(R51C,RC4,0,1,1)*IFERROR(VLOOKUP(RC6,'[MiracleNikkiJp_balance.csv]MiracleNikkiJp_balance'!R5C1:R37C2,2,FALSE),VLOOKUP("アクセサリー",'[MiracleNikkiJp_balance.csv]MiracleNikkiJp_balance'!R5C1:R37C2,2,FALSE)) -> #N/A | I20: ◯ | K20: =T(OFFSET(R51C,RC4,0,1,1)) -> #N/A | L20: =T(OFFSET(R51C,RC4,0,1,1)) -> #N/A | M20: =T(OFFSET(R51C,RC4,0,1,1)) -> #N/A | N20: =T(OFFSET(R51C,RC4,0,1,1)) -> #N/A | O20: =T(OFFSET(R51C,RC4,0,1,1)) -> #N/A | P20: =T(OFFSET(R51C,RC4,0,1,1)) -> #N/A | Q20: =T(OFFSET(R51C,RC4,0,1,1)) -> #N/A | R20: =T(OFFSET(R51C,RC4,0,1,1)) -> #N/A | S20: =T(OFFSET(R51C,RC4,0,1,1)) -> #N/A | T20: =T(OFFSET(R51C,RC4,0,1,1)) -> #N/A | U20: =T(OFFSET(R51C,RC4,0,1,1)) -> #N/A | Y20: =T(OFFSET(R51C,RC4,0,1,1)) -> #N/A
A21: =IF(RC4<0,"",OFFSET(R51C,RC4,0,1,1)) -> #N/A | B21: =T(OFFSET(R51C,RC4,0,1,1)) -> #N/A | C21: =T(OFFSET(R51C,RC4,0,1,1)) -> #N/A | D21: =IF(AND(R[-1]C6=RC6,R[-1]C5=0),IFERROR((R[-1]C4+1)+(MATCH(RC6,OFFSET(R51C6,R[-1]C4+1,0,(通番最大+1)-1-R[-1]C4,1),0)-1),-2),IF(RC5>0,RC5,MATCH(RC6,OFFSET(R51C6,0,0,通番最大+1,1),0)-1)) -> #N/A | E21: =IF(R[-1]C6=RC6,0,IFERROR(MATCH(RC6,OFFSET(R51C5,0,0,通番最大+1,1),0)-1,0)) -> 0 | F21: ヘッドアクセ | G21: =T(OFFSET(R51C,RC4,0,1,1)) -> #N/A | H21: =IF(OR(AND(RC6="ドレス",R8C7<>"ドレス"),AND(OR(RC6="トップス",RC6="ボトムス"),R8C7="ドレス")),0,1)*OFFSET(R51C,RC4,0,1,1)*IFERROR(VLOOKUP(RC6,'[MiracleNikkiJp_balance.csv]MiracleNikkiJp_balance'!R5C1:R37C2,2,FALSE),VLOOKUP("アクセサリー",'[MiracleNikkiJp_balance.csv]MiracleNikkiJp_balance'!R5C1:R37C2,2,FALSE)) -> #N/A | I21: ◯ | K21: =T(OFFSET(R51C,RC4,0,1,1)) -> #N/A | L21: =T(OFFSET(R51C,RC4,0,1,1)) -> #N/A | M21: =T(OFFSET(R51C,RC4,0,1,1)) -> #N/A | N21: =T(OFFSET(R51C,RC4,0,1,1)) -> #N/A | O21: =T(OFFSET(R51C,RC4,0,1,1)) -> #N/A | P21: =T(OFFSET(R51C,RC4,0,1,1)) -> #N/A | Q21: =T(OFFSET(R51C,RC4,0,1,1)) -> #N/A | R21: =T(OFFSET(R51C,RC4,0,1,1)) -> #N/A | S21: =T(OFFSET(R51C,RC4,0,1,1)) -> #N/A | T21: =T(OFFSET(R51C,RC4,0,1,1)) -> #N/A | U21: =T(OFFSET(R51C,RC4,0,1,1)) -> #N/A | Y21: =T(OFFSET(R51C,RC4,0,1,1)) -> #N/A
A22: =IF(RC4<0,"",OFFSET(R51C,RC4,0,1,1)) -> #N/A | B22: =T(OFFSET(R51C,RC4,0,1,1)) -> #N/A | C22: =T(OFFSET(R51C,RC4,0,1,1)) -> #N/A | D22: =IF(AND(R[-1]C6=RC6,R[-1]C5=0),IFERROR((R[-1]C4+1)+(MATCH(RC6,OFFSET(R51C6,R[-1]C4+1,0,(通番最大+1)-1-R[-1]C4,1),0)-1),-2),IF(RC5>0,RC5,MATCH(RC6,OFFSET(R51C6,0,0,通番最大+1,1),0)-1)) -> #N/A | E22: =IF(R[-1]C6=RC6,0,IFERROR(MATCH(RC6,OFFSET(R51C5,0,0,通番最大+1,1),0)-1,0)) -> 0 | F22: ヴェール | G22: =T(OFFSET(R51C,RC4,0,1,1)) -> #N/A | H22: =IF(OR(AND(RC6="ドレス",R8C7<>"ドレス"),AND(OR(RC6="トップス",RC6="ボトムス"),R8C7="ドレス")),0,1)*OFFSET(R51C,RC4,0,1,1)*IFERROR(VLOOKUP(RC6,'[MiracleNikkiJp_balance.csv]MiracleNikkiJp_balance'!R5C1:R37C2,2,FALSE),VLOOKUP("アクセサリー",'[MiracleNikkiJp_balance.csv]MiracleNikkiJp_balance'!R5C1:R37C2,2,FALSE)) -> #N/A | I22: ◯ | K22: =T(OFFSET(R51C,RC4,0,1,1)) -> #N/A | L22: =T(OFFSET(R51C,RC4,0,1,1)) -> #N/A | M22: =T(OFFSET(R51C,RC4,0,1,1)) -> #N/A | N22: =T(OFFSET(R51C,RC4,0,1,1)) -> #N/A | O22: =T(OFFSET(R51C,RC4,0,1,1)) -> #N/A | P22: =T(OFFSET(R51C,RC4,0,1,1)) -> #N/A | Q22: =T(OFFSET(R51C,RC4,0,1,1)) -> #N/A | R22: =T(OFFSET(R51C,RC4,0,1,1)) -> #N/A | S22: =T(OFFSET(R51C,RC4,0,1,1)) -> #N/A | T22: =T(OFFSET(R51C,RC4,0,1,1)) -> #N/A | U22: =T(OFFSET(R51C,RC4,0,1,1)) -> #N/A | Y22: =T(OFFSET(R51C,RC4,0,1,1)) -> #N/A
A23: =IF(RC4<0,"",OFFSET(R51C,RC4,0,1,1)) -> #N/A | B23: =T(OFFSET(R51C,RC4,0,1,1)) -> #N/A | C23: =T(OFFSET(R51C,RC4,0,1,1)) -> #N/A | D23: =IF(AND(R[-1]C6=RC6,R[-1]C5=0),IFERROR((R[-1]C4+1)+(MATCH(RC6,OFFSET(R51C6,R[-1]C4+1,0,(通番最大+1)-1-R[-1]C4,1),0)-1),-2),IF(RC5>0,RC5,MATCH(RC6,OFFSET(R51C6,0,0,通番最大+1,1),0)-1)) -> #N/A | E23: =IF(R[-1]C6=RC6,0,IFERROR(MATCH(RC6,OFFSET(R51C5,0,0,通番最大+1,1),0)-1,0)) -> 0 | F23: カチューシャ | G23: =T(OFFSET(R51C,RC4,0,1,1)) -> #N/A | H23: =IF(OR(AND(RC6="ドレス",R8C7<>"ドレス"),AND(OR(RC6="トップス",RC6="ボトムス"),R8C7="ドレス")),0,1)*OFFSET(R51C,RC4,0,1,1)*IFERROR(VLOOKUP(RC6,'[MiracleNikkiJp_balance.csv]MiracleNikkiJp_balance'!R5C1:R37C2,2,FALSE),VLOOKUP("アクセサリー",'[MiracleNikkiJp_balance.csv]MiracleNikkiJp_balance'!R5C1:R37C2,2,FALSE)) -> #N/A | I23: ◯ | K23: =T(OFFSET(R51C,RC4,0,1,1)) -> #N/A | L23: =T(OFFSET(R51C,RC4,0,1,1)) -> #N/A | M23: =T(OFFSET(R51C,RC4,0,1,1)) -> #N/A | N23: =T(OFFSET(R51C,RC4,0,1,1)) -> #N/A | O23: =T(OFFSET(R51C,RC4,0,1,1)) -> #N/A | P23: =T(OFFSET(R51C,RC4,0,1,1)) -> #N/A | Q23: =T(OFFSET(R51C,RC4,0,1,1)) -> #N/A | R23: =T(OFFSET(R51C,RC4,0,1,1)) -> #N/A | S23: =T(OFFSET(R51C,RC4,0,1,1)) -> #N/A | T23: =T(OFFSET(R51C,RC4,0,1,1)) -> #N/A | U23: =T(OFFSET(R51C,RC4,0,1,1)) -> #N/A | Y23: =T(OFFSET(R51C,RC4,0,1,1)) -> #N/A
A24: =IF(RC4<0,"",OFFSET(R51C,RC4,0,1,1)) -> #N/A | B24: =T(OFFSET(R51C,RC4,0,1,1)) -> #N/A | C24: =T(OFFSET(R51C,RC4,0,1,1)) -> #N/A | D24: =IF(AND(R[-1]C6=RC6,R[-1]C5=0),IFERROR((R[-1]C4+1)+(MATCH(RC6,OFFSET(R51C6,R[-1]C4+1,0,(通番最大+1)-1-R[-1]C4,1),0)-1),-2),IF(RC5>0,RC5,MATCH(RC6,OFFSET(R51C6,0,0,通番最大+1,1),0)-1)) -> #N/A | E24: =IF(R[-1]C6=RC6,0,IFERROR(MATCH(RC6,OFFSET(R51C5,0,0,通番最大+1,1),0)-1,0)) -> 0 | F24: つけ耳 | G24: =T(OFFSET(R51C,RC4,0,1,1)) -> #N/A | H24: =IF(OR(AND(RC6="ドレス",R8C7<>"ドレス"),AND(OR(RC6="トップス",RC6="ボトムス"),R8C7="ドレス")),0,1)*OFFSET(R51C,RC4,0,1,1)*IFERROR(VLOOKUP(RC6,'[MiracleNikkiJp_balance.csv]MiracleNikkiJp_balance'!R5C1:R37C2,2,FALSE),VLOOKUP("アクセサリー",'[MiracleNikkiJp_balance.csv]MiracleNikkiJp_balance'!R5C1:R37C2,2,FALSE)) -> #N/A | I24: ◯ | K24: =T(OFFSET(R51C,RC4,0,1,1)) -> #N/A | L24: =T(OFFSET(R51C,RC4,0,1,1)) -> #N/A | M24: =T(OFFSET(R51C,RC4,0,1,1)) -> #N/A | N24: =T(OFFSET(R51C,RC4,0,1,1)) -> #N/A | O24: =T(OFFSET(R51C,RC4,0,1,1)) -> #N/A | P24: =T(OFFSET(R51C,RC4,0,1,1)) -> #N/A | Q24: =T(OFFSET(R51C,RC4,0,1,1)) -> #N/A | R24: =T(OFFSET(R51C,RC4,0,1,1)) -> #N/A | S24: =T(OFFSET(R51C,RC4,0,1,1)) -> #N/A | T24: =T(OFFSET(R51C,RC4,0,1,1)) -> #N/A | U24: =T(OFFSET(R51C,RC4,0,1,1)) -> #N/A | Y24: =T(OFFSET(R51C,RC4,0,1,1)) -> #N/A
A25: =IF(RC4<0,"",OFFSET(R51C,RC4,0,1,1)) -> #N/A | B25: =T(OFFSET(R51C,RC4,0,1,1)) -> #N/A | C25: =T(OFFSET(R51C,RC4,0,1,1)) -> #N/A | D25: =IF(AND(R[-1]C6=RC6,R[-1]C5=0),IFERROR((R[-1]C4+1)+(MATCH(RC6,OFFSET(R51C6,R[-1]C4+1,0,(通番最大+1)-1-R[-1]C4,1),0)-1),-2),IF(RC5>0,RC5,MATCH(RC6,OFFSET(R51C6,0,0,通番最大+1,1),0)-1)) -> #N/A | E25: =IF(R[-1]C6=RC6,0,IFERROR(MATCH(RC6,OFFSET(R51C5,0,0,通番最大+1,1),0)-1,0)) -> 0 | F25: 耳飾り | G25: =T(OFFSET(R51C,RC4,0,1,1)) -> #N/A | H25: =IF(OR(AND(RC6="ドレス",R8C7<>"ドレス"),AND(OR(RC6="トップス",RC6="ボトムス"),R8C7="ドレス")),0,1)*OFFSET(R51C,RC4,0,1,1)*IFERROR(VLOOKUP(RC6,'[MiracleNikkiJp_balance.csv]MiracleNikkiJp_balance'!R5C1:R37C2,2,FALSE),VLOOKUP("アクセサリー",'[MiracleNikkiJp_balance.csv]MiracleNikkiJp_balance'!R5C1:R37C2,2,FALSE)) -> #N/A | I25: ◯ | K25: =T(OFFSET(R51C,RC4,0,1,1)) -> #N/A | L25: =T(OFFSET(R51C,RC4,0,1,1)) -> #N/A | M25: =T(OFFSET(R51C,RC4,0,1,1)) -> #N/A | N25: =T(OFFSET(R51C,RC4,0,1,1)) -> #N/A | O25: =T(OFFSET(R51C,RC4,0,1,1)) -> #N/A | P25: =T(OFFSET(R51C,RC4,0,1,1)) -> #N/A | Q25: =T(OFFSET(R51C,RC4,0,1,1)) -> #N/A | R25: =T(OFFSET(R51C,RC4,0,1,1)) -> #N/A | S25: =T(OFFSET(R51C,RC4,0,1,1)) -> #N/A | T25: =T(OFFSET(R51C,RC4,0,1,1)) -> #N/A | U25: =T(OFFSET(R51C,RC4,0,1,1)) -> #N/A | Y25: =T(OFFSET(R51C,RC4,0,1,1)) -> #N/A
A26: =IF(RC4<0,"",OFFSET(R51C,RC4,0,1,1)) -> #N/A | B26: =T(OFFSET(R51C,RC4,0,1,1)) -> #N/A | C26: =T(OFFSET(R51C,RC4,0,1,1)) -> #N/A | D26: =IF(AND(R[-1]C6=RC6,R[-1]C5=0),IFERROR((R[-1]C4+1)+(MATCH(RC6,OFFSET(R51C6,R[-1]C4+1,0,(通番最大+1)-1-R[-1]C4,1),0)-1),-2),IF(RC5>0,RC5,MATCH(RC6,OFFSET(R51C6,0,0,通番最大+1,1),0)-1)) -> #N/A | E26: =IF(R[-1]C6=RC6,0,IFERROR(MATCH(RC6,OFFSET(R51C5,0,0,通番最大+1,1),0)-1,0)) -> 0 | F26: マフラー | G26: =T(OFFSET(R51C,RC4,0,1,1)) -> #N/A | H26: =IF(OR(AND(RC6="ドレス",R8C7<>"ドレス"),AND(OR(RC6="トップス",RC6="ボトムス"),R8C7="ドレス")),0,1)*OFFSET(R51C,RC4,0,1,1)*IFERROR(VLOOKUP(RC6,'[MiracleNikkiJp_balance.csv]MiracleNikkiJp_balance'!R5C1:R37C2,2,FALSE),VLOOKUP("アクセサリー",'[MiracleNikkiJp_balance.csv]MiracleNikkiJp_balance'!R5C1:R37C2,2,FALSE)) -> #N/A | I26: ◯ | K26: =T(OFFSET(R51C,RC4,0,1,1)) -> #N/A | L26: =T(OFFSET(R51C,RC4,0,1,1)) -> #N/A | M26: =T(OFFSET(R51C,RC4,0,1,1)) -> #N/A | N26: =T(OFFSET(R51C,RC4,0,1,1)) -> #N/A | O26: =T(OFFSET(R51C,RC4,0,1,1)) -> #N/A | P26: =T(OFFSET(R51C,RC4,0,1,1)) -> #N/A | Q26: =T(OFFSET(R51C,RC4,0,1,1)) -> #N/A | R26: =T(OFFSET(R51C,RC4,0,1,1)) -> #N/A | S26: =T(OFFSET(R51C,RC4,0,1,1)) -> #N/A | T26: =T(OFFSET(R51C,RC4,0,1,1)) -> #N/A | U26: =T(OFFSET(R51C,RC4,0,1,1)) -> #N/A | Y26: =T(OFFSET(R51C,RC4,0,1,1)) -> #N/A
A27: =IF(RC4<0,"",OFFSET(R51C,RC4,0,1,1)) -> #N/A | B27: =T(OFFSET(R51C,RC4,0,1,1)) -> #N/A | C27: =T(OFFSET(R51C,RC4,0,1,1)) -> #N/A | D27: =IF(AND(R[-1]C6=RC6,R[-1]C5=0),IFERROR((R[-1]C4+1)+(MATCH(RC6,OFFSET(R51C6,R[-1]C4+1,0,(通番最大+1)-1-R[-1]C4,1),0)-1),-2),IF(RC5>0,RC5,MATCH(RC6,OFFSET(R51C6,0,0,通番最大+1,1),0)-1)) -> #N/A | E27: =IF(R[-1]C6=RC6,0,IFERROR(MATCH(RC6,OFFSET(R51C5,0,0,通番最大+1,1),0)-1,0)) -> 0 | F27: ネックレス | G27: =T(OFFSET(R51C,RC4,0,1,1)) -> #N/A | H27: =IF(OR(AND(RC6="ドレス",R8C7<>"ドレス"),AND(OR(RC6="トップス",RC6="ボトムス"),R8C7="ドレス")),0,1)*OFFSET(R51C,RC4,0,1,1)*IFERROR(VLOOKUP(RC6,'[MiracleNikkiJp_balance.csv]MiracleNikkiJp_balance'!R5C1:R37C2,2,FALSE),VLOOKUP("アクセサリー",'[MiracleNikkiJp_balance.csv]MiracleNikkiJp_balance'!R5C1:R37C2,2,FALSE)) -> #N/A | I27: ◯ | K27: =T(OFFSET(R51C,RC4,0,1,1)) -> #N/A | L27: =T(OFFSET(R51C,RC4,0,1,1)) -> #N/A | M27: =T(OFFSET(R51C,RC4,0,1,1)) -> #N/A | N27: =T(OFFSET(R51C,RC4,0,1,1)) -> #N/A | O27: =T(OFFSET(R51C,RC4,0,1,1)) -> #N/A | P27: =T(OFFSET(R51C,RC4,0,1,1)) -> #N/A | Q27: =T(OFFSET(R51C,RC4,0,1,1)) -> #N/A | R27: =T(OFFSET(R51C,RC4,0,1,1)) -> #N/A | S27: =T(OFFSET(R51C,RC4,0,1,1)) -> #N/A | T27: =T(OFFSET(R51C,RC4,0,1,1)) -> #N/A | U27: =T(OFFSET(R51C,RC4,0,1,1)) -> #N/A | Y27: =T(OFFSET(R51C,RC4,0,1,1)) -> #N/A
A28: =IF(RC4<0,"",OFFSET(R51C,RC4,0,1,1)) -> #N/A | B28: =T(OFFSET(R51C,RC4,0,1,1)) -> #N/A | C28: =T(OFFSET(R51C,RC4,0,1,1)) -> #N/A | D28: =IF(AND(R[-1]C6=RC6,R[-1]C5=0),IFERROR((R[-1]C4+1)+(MATCH(RC6,OFFSET(R51C6,R[-1]C4+1,0,(通番最大+1)-1-R[-1]C4,1),0)-1),-2),IF(RC5>0,RC5,MATCH(RC6,OFFSET(R51C6,0,0,通番最大+1,1),0)-1)) -> #N/A | E28: =IF(R[-1]C6=RC6,0,IFERROR(MATCH(RC6,OFFSET(R51C5,0,0,通番最大+1,1),0)-1,0)) -> 0 | F28: 右手飾り | G28: =T(OFFSET(R51C,RC4,0,1,1)) -> #N/A | H28: =IF(OR(AND(RC6="ドレス",R8C7<>"ドレス"),AND(OR(RC6="トップス",RC6="ボトムス"),R8C7="ドレス")),0,1)*OFFSET(R51C,RC4,0,1,1)*IFERROR(VLOOKUP(RC6,'[MiracleNikkiJp_balance.csv]MiracleNikkiJp_balance'!R5C1:R37C2,2,FALSE),VLOOKUP("アクセサリー",'[MiracleNikkiJp_balance.csv]MiracleNikkiJp_balance'!R5C1:R37C2,2,FALSE)) -> #N/A | I28: ◯ | K28: =T(OFFSET(R51C,RC4,0,1,1)) -> #N/A | L28: =T(OFFSET(R51C,RC4,0,1,1)) -> #N/A | M28: =T(OFFSET(R51C,RC4,0,1,1)) -> #N/A | N28: =T(OFFSET(R51C,RC4,0,1,1)) -> #N/A | O28: =T(OFFSET(R51C,RC4,0,1,1)) -> #N/A | P28: =T(OFFSET(R51C,RC4,0,1,1)) -> #N/A | Q28: =T(OFFSET(R51C,RC4,0,1,1)) -> #N/A | R28: =T(OFFSET(R51C,RC4,0,1,1)) -> #N/A | S28: =T(OFFSET(R51C,RC4,0,1,1)) -> #N/A | T28: =T(OFFSET(R51C,RC4,0,1,1)) -> #N/A | U28: =T(OFFSET(R51C,RC4,0,1,1)) -> #N/A | Y28: =T(OFFSET(R51C,RC4,0,1,1)) -> #N/A
A29: =IF(RC4<0,"",OFFSET(R51C,RC4,0,1,1)) -> #N/A | B29: =T(OFFSET(R51C,RC4,0,1,1)) -> #N/A | C29: =T(OFFSET(R51C,RC4,0,1,1)) -> #N/A | D29: =IF(AND(R[-1]C6=RC6,R[-1]C5=0),IFERROR((R[-1]C4+1)+(MATCH(RC6,OFFSET(R51C6,R[-1]C4+1,0,(通番最大+1)-1-R[-1]C4,1),0)-1),-2),IF(RC5>0,RC5,MATCH(RC6,OFFSET(R51C6,0,0,通番最大+1,1),0)-1)) -> #N/A | E29: =IF(R[-1]C6=RC6,0,IFERROR(MATCH(RC6,OFFSET(R51C5,0,0,通番最大+1,1),0)-1,0)) -> 0 | F29: 左手飾り | G29: =T(OFFSET(R51C,RC4,0,1,1)) -> #N/A | H29: =IF(OR(AND(RC6="ドレス",R8C7<>"ドレス"),AND(OR(RC6="トップス",RC6="ボトムス"),R8C7="ドレス")),0,1)*OFFSET(R51C,RC4,0,1,1)*IFERROR(VLOOKUP(RC6,'[MiracleNikkiJp_balance.csv]MiracleNikkiJp_balance'!R5C1:R37C2,2,FALSE),VLOOKUP("アクセサリー",'[MiracleNikkiJp_balance.csv]MiracleNikkiJp_balance'!R5C1:R37C2,2,FALSE)) -> #N/A | I29: ◯ | K29: =T(OFFSET(R51C,RC4,0,1,1)) -> #N/A | L29: =T(OFFSET(R51C,RC4,0,1,1)) -> #N/A | M29: =T(OFFSET(R51C,RC4,0,1,1)) -> #N/A | N29: =T(OFFSET(R51C,RC4,0,1,1)) -> #N/A | O29: =T(OFFSET(R51C,RC4,0,1,1)) -> #N/A | P29: =T(OFFSET(R51C,RC4,0,1,1)) -> #N/A | Q29: =T(OFFSET(R51C,RC4,0,1,1)) -> #N/A | R29: =T(OFFSET(R51C,RC4,0,1,1)) -> #N/A | S29: =T(OFFSET(R51C,RC4,0,1,1)) -> #N/A | T29: =T(OFFSET(R51C,RC4,0,1,1)) -> #N/A | U29: =T(OFFSET(R51C,RC4,0,1,1)) -> #N/A | Y29: =T(OFFSET(R51C,RC4,0,1,1)) -> #N/A
A30: =IF(RC4<0,"",OFFSET(R51C,RC4,0,1,1)) -> #N/A | B30: =T(OFFSET(R51C,RC4,0,1,1)) -> #N/A | C30: =T(OFFSET(R51C,RC4,0,1,1)) -> #N/A | D30: =IF(AND(R[-1]C6=RC6,R[-1]C5=0),IFERROR((R[-1]C4+1)+(MATCH(RC6,OFFSET(R51C6,R[-1]C4+1,0,(通番最大+1)-1-R[-1]C4,1),0)-1),-2),IF(RC5>0,RC5,MATCH(RC6,OFFSET(R51C6,0,0,通番最大+1,1),0)-1)) -> #N/A | E30: =IF(R[-1]C6=RC6,0,IFERROR(MATCH(RC6,OFFSET(R51C5,0,0,通番最大+1,1),0)-1,0)) -> 0 | F30: 手袋 | G30: =T(OFFSET(R51C,RC4,0,1,1)) -> #N/A | H30: =IF(OR(AND(RC6="ドレス",R8C7<>"ドレス"),AND(OR(RC6="トップス",RC6="ボトムス"),R8C7="ドレス")),0,1)*OFFSET(R51C,RC4,0,1,1)*IFERROR(VLOOKUP(RC6,'[MiracleNikkiJp_balance.csv]MiracleNikkiJp_balance'!R5C1:R37C2,2,FALSE),VLOOKUP("アクセサリー",'[MiracleNikkiJp_balance.csv]MiracleNikkiJp_balance'!R5C1:R37C2,2,FALSE)) -> #N/A | I30: ◯ | K30: =T(OFFSET(R51C,RC4,0,1,1)) -> #N/A | L30: =T(OFFSET(R51C,RC4,0,1,1)) -> #N/A | M30: =T(OFFSET(R51C,RC4,0,1,1)) -> #N/A | N30: =T(OFFSET(R51C,RC4,0,1,1)) -> #N/A | O30: =T(OFFSET(R51C,RC4,0,1,1)) -> #N/A | P30: =T(OFFSET(R51C,RC4,0,1,1)) -> #N/A | Q30: =T(OFFSET(R51C,RC4,0,1,1)) -> #N/A | R30: =T(OFFSET(R51C,RC4,0,1,1)) -> #N/A | S30: =T(OFFSET(R51C,RC4,0,1,1)) -> #N/A | T30: =T(OFFSET(R51C,RC4,0,1,1)) -> #N/A | U30: =T(OFFSET(R51C,RC4,0,1,1)) -> #N/A | Y30: =T(OFFSET(R51C,RC4,0,1,1)) -> #N/A
A31: =IF(RC4<0,"",OFFSET(R51C,RC4,0,1,1)) -> #N/A | B31: =T(OFFSET(R51C,RC4,0,1,1)) -> #N/A | C31: =T(OFFSET(R51C,RC4,0,1,1)) -> #N/A | D31: =IF(AND(R[-1]C6=RC6,R[-1]C5=0),IFERROR((R[-1]C4+1)+(MATCH(RC6,OFFSET(R51C6,R[-1]C4+1,0,(通番最大+1)-1-R[-1]C4,1),0)-1),-2),IF(RC5>0,RC5,MATCH(RC6,OFFSET(R51C6,0,0,通番最大+1,1),0)-1)) -> #N/A | E31: =IF(R[-1]C6=RC6,0,IFERROR(MATCH(RC6,OFFSET(R51C5,0,0,通番最大+1,1),0)-1,0)) -> 0 | F31: 右手持ち | G31: =T(OFFSET(R51C,RC4,0,1,1)) -> #N/A | H31: =IF(OR(AND(RC6="ドレス",R8C7<>"ドレス"),AND(OR(RC6="トップス",RC6="ボトムス"),R8C7="ドレス")),0,1)*OFFSET(R51C,RC4,0,1,1)*IFERROR(VLOOKUP(RC6,'[MiracleNikkiJp_balance.csv]MiracleNikkiJp_balance'!R5C1:R37C2,2,FALSE),VLOOKUP("アクセサリー",'[MiracleNikkiJp_balance.csv]MiracleNikkiJp_balance'!R5C1:R37C2,2,FALSE)) -> #N/A | I31: ◯ | K31: =T(OFFSET(R51C,RC4,0,1,1)) -> #N/A | L31: =T(OFFSET(R51C,RC4,0,1,1)) -> #N/A | M31: =T(OFFSET(R51C,RC4,0,1,1)) -> #N/A | N31: =T(OFFSET(R51C,RC4,0,1,1)) -> #N/A | O31: =T(OFFSET(R51C,RC4,0,1,1)) -> #N/A | P31: =T(OFFSET(R51C,RC4,0,1,1)) -> #N/A | Q31: =T(OFFSET(R51C,RC4,0,1,1)) -> #N/A | R31: =T(OFFSET(R51C,RC4,0,1,1)) -> #N/A | S31: =T(OFFSET(R51C,RC4,0,1,1)) -> #N/A | T31: =T(OFFSET(R51C,RC4,0,1,1)) -> #N/A | U31: =T(OFFSET(R51C,RC4,0,1,1)) -> #N/A | Y31: =T(OFFSET(R51C,RC4,0,1,1)) -> #N/A
A32: =IF(RC4<0,"",OFFSET(R51C,RC4,0,1,1)) -> #N/A | B32: =T(OFFSET(R51C,RC4,0,1,1)) -> #N/A | C32: =T(OFFSET(R51C,RC4,0,1,1)) -> #N/A | D32: =IF(AND(R[-1]C6=RC6,R[-1]C5=0),IFERROR((R[-1]C4+1)+(MATCH(RC6,OFFSET(R51C6,R[-1]C4+1,0,(通番最大+1)-1-R[-1]C4,1),0)-1),-2),IF(RC5>0,RC5,MATCH(RC6,OFFSET(R51C6,0,0,通番最大+1,1),0)-1)) -> #N/A | E32: =IF(R[-1]C6=RC6,0,IFERROR(MATCH(RC6,OFFSET(R51C5,0,0,通番最大+1,1),0)-1,0)) -> 0 | F32: 左手持ち | G32: =T(OFFSET(R51C,RC4,0,1,1)) -> #N/A | H32: =IF(OR(AND(RC6="ドレス",R8C7<>"ドレス"),AND(OR(RC6="トップス",RC6="ボトムス"),R8C7="ドレス")),0,1)*OFFSET(R51C,RC4,0,1,1)*IFERROR(VLOOKUP(RC6,'[MiracleNikkiJp_balance.csv]MiracleNikkiJp_balance'!R5C1:R37C2,2,FALSE),VLOOKUP("アクセサリー",'[MiracleNikkiJp_balance.csv]MiracleNikkiJp_balance'!R5C1:R37C2,2,FALSE)) -> #N/A | I32: ◯ | K32: =T(OFFSET(R51C,RC4,0,1,1)) -> #N/A | L32: =T(OFFSET(R51C,RC4,0,1,1)) -> #N/A | M32: =T(OFFSET(R51C,RC4,0,1,1)) -> #N/A | N32: =T(OFFSET(R51C,RC4,0,1,1)) -> #N/A | O32: =T(OFFSET(R51C,RC4,0,1,1)) -> #N/A | P32: =T(OFFSET(R51C,RC4,0,1,1)) -> #N/A | Q32: =T(OFFSET(R51C,RC4,0,1,1)) -> #N/A | R32: =T(OFFSET(R51C,RC4,0,1,1)) -> #N/A | S32: =T(OFFSET(R51C,RC4,0,1,1)) -> #N/A | T32: =T(OFFSET(R51C,RC4,0,1,1)) -> #N/A | U32: =T(OFFSET(R51C,RC4,0,1,1)) -> #N/A | Y32: =T(OFFSET(R51C,RC4,0,1,1)) -> #N/A
A33: =IF(RC4<0,"",OFFSET(R51C,RC4,0,1,1)) -> #N/A | B33: =T(OFFSET(R51C,RC4,0,1,1)) -> #N/A | C33: =T(OFFSET(R51C,RC4,0,1,1)) -> #N/A | D33: =IF(AND(R[-1]C6=RC6,R[-1]C5=0),IFERROR((R[-1]C4+1)+(MATCH(RC6,OFFSET(R51C6,R[-1]C4+1,0,(通番最大+1)-1-R[-1]C4,1),0)-1),-2),IF(RC5>0,RC5,MATCH(RC6,OFFSET(R51C6,0,0,通番最大+1,1),0)-1)) -> #N/A | E33: =IF(R[-1]C6=RC6,0,IFERROR(MATCH(RC6,OFFSET(R51C5,0,0,通番最大+1,1),0)-1,0)) -> 0 | F33: 両手持ち | G33: =T(OFFSET(R51C,RC4,0,1,1)) -> #N/A | H33: =IF(OR(AND(RC6="ドレス",R8C7<>"ドレス"),AND(OR(RC6="トップス",RC6="ボトムス"),R8C7="ドレス")),0,1)*OFFSET(R51C,RC4,0,1,1)*IFERROR(VLOOKUP(RC6,'[MiracleNikkiJp_balance.csv]MiracleNikkiJp_balance'!R5C1:R37C2,2,FALSE),VLOOKUP("アクセサリー",'[MiracleNikkiJp_balance.csv]MiracleNikkiJp_balance'!R5C1:R37C2,2,FALSE)) -> #N/A | I33: ◯ | K33: =T(OFFSET(R51C,RC4,0,1,1)) -> #N/A | L33: =T(OFFSET(R51C,RC4,0,1,1)) -> #N/A | M33: =T(OFFSET(R51C,RC4,0,1,1)) -> #N/A | N33: =T(OFFSET(R51C,RC4,0,1,1)) -> #N/A | O33: =T(OFFSET(R51C,RC4,0,1,1)) -> #N/A | P33: =T(OFFSET(R51C,RC4,0,1,1)) -> #N/A | Q33: =T(OFFSET(R51C,RC4,0,1,1)) -> #N/A | R33: =T(OFFSET(R51C,RC4,0,1,1)) -> #N/A | S33: =T(OFFSET(R51C,RC4,0,1,1)) -> #N/A | T33: =T(OFFSET(R51C,RC4,0,1,1)) -> #N/A | U33: =T(OFFSET(R51C,RC4,0,1,1)) -> #N/A | Y33: =T(OFFSET(R51C,RC4,0,1,1)) -> #N/A
A34: =IF(RC4<0,"",OFFSET(R51C,RC4,0,1,1)) -> #N/A | B34: =T(OFFSET(R51C,RC4,0,1,1)) -> #N/A | C34: =T(OFFSET(R51C,RC4,0,1,1)) -> #N/A | D34: =IF(AND(R[-1]C6=RC6,R[-1]C5=0),IFERROR((R[-1]C4+1)+(MATCH(RC6,OFFSET(R51C6,R[-1]C4+1,0,(通番最大+1)-1-R[-1]C4,1),0)-1),-2),IF(RC5>0,RC5,MATCH(RC6,OFFSET(R51C6,0,0,通番最大+1,1),0)-1)) -> #N/A | E34: =IF(R[-1]C6=RC6,0,IFERROR(MATCH(RC6,OFFSET(R51C5,0,0,通番最大+1,1),0)-1,0)) -> 0 | F34: 腰飾り | G34: =T(OFFSET(R51C,RC4,0,1,1)) -> #N/A | H34: =IF(OR(AND(RC6="ドレス",R8C7<>"ドレス"),AND(OR(RC6="トップス",RC6="ボトムス"),R8C7="ドレス")),0,1)*OFFSET(R51C,RC4,0,1,1)*IFERROR(VLOOKUP(RC6,'[MiracleNikkiJp_balance.csv]MiracleNikkiJp_balance'!R5C1:R37C2,2,FALSE),VLOOKUP("アクセサリー",'[MiracleNikkiJp_balance.csv]MiracleNikkiJp_balance'!R5C1:R37C2,2,FALSE)) -> #N/A | I34: ◯ | K34: =T(OFFSET(R51C,RC4,0,1,1)) -> #N/A | L34: =T(OFFSET(R51C,RC4,0,1,1)) -> #N/A | M34: =T(OFFSET(R51C,RC4,0,1,1)) -> #N/A | N34: =T(OFFSET(R51C,RC4,0,1,1)) -> #N/A | O34: =T(OFFSET(R51C,RC4,0,1,1)) -> #N/A | P34: =T(OFFSET(R51C,RC4,0,1,1)) -> #N/A | Q34: =T(OFFSET(R51C,RC4,0,1,1)) -> #N/A | R34: =T(OFFSET(R51C,RC4,0,1,1)) -> #N/A | S34: =T(OFFSET(R51C,RC4,0,1,1)) -> #N/A | T34: =T(OFFSET(R51C,RC4,0,1,1)) -> #N/A | U34: =T(OFFSET(R51C,RC4,0,1,1)) -> #N/A | Y34: =T(OFFSET(R51C,RC4,0,1,1)) -> #N/A
A35: =IF(RC4<0,"",OFFSET(R51C,RC4,0,1,1)) -> #N/A | B35: =T(OFFSET(R51C,RC4,0,1,1)) -> #N/A | C35: =T(OFFSET(R51C,RC4,0,1,1)) -> #N/A | D35: =IF(AND(R[-1]C6=RC6,R[-1]C5=0),IFERROR((R[-1]C4+1)+(MATCH(RC6,OFFSET(R51C6,R[-1]C4+1,0,(通番最大+1)-1-R[-1]C4,1),0)-1),-2),IF(RC5>0,RC5,MATCH(RC6,OFFSET(R51C6,0,0,通番最大+1,1),0)-1)) -> #N/A | E35: =IF(R[-1]C6=RC6,0,IFERROR(MATCH(RC6,OFFSET(R51C5,0,0,通番最大+1,1),0)-1,0)) -> 0 | F35: フェイス | G35: =T(OFFSET(R51C,RC4,0,1,1)) -> #N/A | H35: =IF(OR(AND(RC6="ドレス",R8C7<>"ドレス"),AND(OR(RC6="トップス",RC6="ボトムス"),R8C7="ドレス")),0,1)*OFFSET(R51C,RC4,0,1,1)*IFERROR(VLOOKUP(RC6,'[MiracleNikkiJp_balance.csv]MiracleNikkiJp_balance'!R5C1:R37C2,2,FALSE),VLOOKUP("アクセサリー",'[MiracleNikkiJp_balance.csv]MiracleNikkiJp_balance'!R5C1:R37C2,2,FALSE)) -> #N/A | I35: ◯ | K35: =T(OFFSET(R51C,RC4,0,1,1)) -> #N/A | L35: =T(OFFSET(R51C,RC4,0,1,1)) -> #N/A | M35: =T(OFFSET(R51C,RC4,0,1,1)) -> #N/A | N35: =T(OFFSET(R51C,RC4,0,1,1)) -> #N/A | O35: =T(OFFSET(R51C,RC4,0,1,1)) -> #N/A | P35: =T(OFFSET(R51C,RC4,0,1,1)) -> #N/A | Q35: =T(OFFSET(R51C,RC4,0,1,1)) -> #N/A | R35: =T(OFFSET(R51C,RC4,0,1,1)) -> #N/A | S35: =T(OFFSET(R51C,RC4,0,1,1)) -> #N/A | T35: =T(OFFSET(R51C,RC4,0,1,1)) -> #N/A | U35: =T(OFFSET(R51C,RC4,0,1,1)) -> #N/A | Y35: =T(OFFSET(R51C,RC4,0,1,1)) -> #N/A
A36: =IF(RC4<0,"",OFFSET(R51C,RC4,0,1,1)) -> #N/A | B36: =T(OFFSET(R51C,RC4,0,1,1)) -> #N/A | C36: =T(OFFSET(R51C,RC4,0,1,1)) -> #N/A | D36: =IF(AND(R[-1]C6=RC6,R[-1]C5=0),IFERROR((R[-1]C4+1)+(MATCH(RC6,OFFSET(R51C6,R[-1]C4+1,0,(通番最大+1)-1-R[-1]C4,1),0)-1),-2),IF(RC5>0,RC5,MATCH(RC6,OFFSET(R51C6,0,0,通番最大+1,1),0)-1)) -> #N/A | E36: =IF(R[-1]C6=RC6,0,IFERROR(MATCH(RC6,OFFSET(R51C5,0,0,通番最大+1,1),0)-1,0)) -> 0 | F36: ボディ | G36: =T(OFFSET(R51C,RC4,0,1,1)) -> #N/A | H36: =IF(OR(AND(RC6="ドレス",R8C7<>"ドレス"),AND(OR(RC6="トップス",RC6="ボトムス"),R8C7="ドレス")),0,1)*OFFSET(R51C,RC4,0,1,1)*IFERROR(VLOOKUP(RC6,'[MiracleNikkiJp_balance.csv]MiracleNikkiJp_balance'!R5C1:R37C2,2,FALSE),VLOOKUP("アクセサリー",'[MiracleNikkiJp_balance.csv]MiracleNikkiJp_balance'!R5C1:R37C2,2,FALSE)) -> #N/A | I36: ◯ | K36: =T(OFFSET(R51C,RC4,0,1,1)) -> #N/A | L36: =T(OFFSET(R51C,RC4,0,1,1)) -> #N/A | M36: =T(OFFSET(R51C,RC4,0,1,1)) -> #N/A | N36: =T(OFFSET(R51C,RC4,0,1,1)) -> #N/A | O36: =T(OFFSET(R51C,RC4,0,1,1)) -> #N/A | P36: =T(OFFSET(R51C,RC4,0,1,1)) -> #N/A | Q36: =T(OFFSET(R51C,RC4,0,1,1)) -> #N/A | R36: =T(OFFSET(R51C,RC4,0,1,1)) -> #N/A | S36: =T(OFFSET(R51C,RC4,0,1,1)) -> #N/A | T36: =T(OFFSET(R51C,RC4,0,1,1)) -> #N/A | U36: =T(OFFSET(R51C,RC4,0,1,1)) -> #N/A | Y36: =T(OFFSET(R51C,RC4,0,1,1)) -> #N/A
A37: =IF(RC4<0,"",OFFSET(R51C,RC4,0,1,1)) -> #N/A | B37: =T(OFFSET(R51C,RC4,0,1,1)) -> #N/A | C37: =T(OFFSET(R51C,RC4,0,1,1)) -> #N/A | D37: =IF(AND(R[-1]C6=RC6,R[-1]C5=0),IFERROR((R[-1]C4+1)+(MATCH(RC6,OFFSET(R51C6,R[-1]C4+1,0,(通番最大+1)-1-R[-1]C4,1),0)-1),-2),IF(RC5>0,RC5,MATCH(RC6,OFFSET(R51C6,0,0,通番最大+1,1),0)-1)) -> #N/A | E37: =IF(R[-1]C6=RC6,0,IFERROR(MATCH(RC6,OFFSET(R51C5,0,0,通番最大+1,1),0)-1,0)) -> 0 | F37: タトゥー | G37: =T(OFFSET(R51C,RC4,0,1,1)) -> #N/A | H37: =IF(OR(AND(RC6="ドレス",R8C7<>"ドレス"),AND(OR(RC6="トップス",RC6="ボトムス"),R8C7="ドレス")),0,1)*OFFSET(R51C,RC4,0,1,1)*IFERROR(VLOOKUP(RC6,'[MiracleNikkiJp_balance.csv]MiracleNikkiJp_balance'!R5C1:R37C2,2,FALSE),VLOOKUP("アクセサリー",'[MiracleNikkiJp_balance.csv]MiracleNikkiJp_balance'!R5C1:R37C2,2,FALSE)) -> #N/A | I37: ◯ | K37: =T(OFFSET(R51C,RC4,0,1,1)) -> #N/A | L37: =T(OFFSET(R51C,RC4,0,1,1)) -> #N/A | M37: =T(OFFSET(R51C,RC4,0,1,1)) -> #N/A | N37: =T(OFFSET(R51C,RC4,0,1,1)) -> #N/A | O37: =T(OFFSET(R51C,RC4,0,1,1)) -> #N/A | P37: =T(OFFSET(R51C,RC4,0,1,1)) -> #N/A | Q37: =T(OFFSET(R51C,RC4,0,1,1)) -> #N/A | R37: =T(OFFSET(R51C,RC4,0,1,1)) -> #N/A | S37: =T(OFFSET(R51C,RC4,0,1,1)) -> #N/A | T37: =T(OFFSET(R51C,RC4,0,1,1)) -> #N/A | U37: =T(OFFSET(R51C,RC4,0,1,1)) -> #N/A | Y37: =T(OFFSET(R51C,RC4,0,1,1)) -> #N/A
A38: =IF(RC4<0,"",OFFSET(R51C,RC4,0,1,1)) -> #N/A | B38: =T(OFFSET(R51C,RC4,0,1,1)) -> #N/A | C38: =T(OFFSET(R51C,RC4,0,1,1)) -> #N/A | D38: =IF(AND(R[-1]C6=RC6,R[-1]C5=0),IFERROR((R[-1]C4+1)+(MATCH(RC6,OFFSET(R51C6,R[-1]C4+1,0,(通番最大+1)-1-R[-1]C4,1),0)-1),-2),IF(RC5>0,RC5,MATCH(RC6,OFFSET(R51C6,0,0,通番最大+1,1),0)-1)) -> #N/A | E38: =IF(R[-1]C6=RC6,0,IFERROR(MATCH(RC6,OFFSET(R51C5,0,0,通番最大+1,1),0)-1,0)) -> 0 | F38: 羽根 | G38: =T(OFFSET(R51C,RC4,0,1,1)) -> #N/A | H38: =IF(OR(AND(RC6="ドレス",R8C7<>"ドレス"),AND(OR(RC6="トップス",RC6="ボトムス"),R8C7="ドレス")),0,1)*OFFSET(R51C,RC4,0,1,1)*IFERROR(VLOOKUP(RC6,'[MiracleNikkiJp_balance.csv]MiracleNikkiJp_balance'!R5C1:R37C2,2,FALSE),VLOOKUP("アクセサリー",'[MiracleNikkiJp_balance.csv]MiracleNikkiJp_balance'!R5C1:R37C2,2,FALSE)) -> #N/A | I38: ◯ | K38: =T(OFFSET(R51C,RC4,0,1,1)) -> #N/A | L38: =T(OFFSET(R51C,RC4,0,1,1)) -> #N/A | M38: =T(OFFSET(R51C,RC4,0,1,1)) -> #N/A | N38: =T(OFFSET(R51C,RC4,0,1,1)) -> #N/A | O38: =T(OFFSET(R51C,RC4,0,1,1)) -> #N/A | P38: =T(OFFSET(R51C,RC4,0,1,1)) -> #N/A | Q38: =T(OFFSET(R51C,RC4,0,1,1)) -> #N/A | R38: =T(OFFSET(R51C,RC4,0,1,1)) -> #N/A | S38: =T(OFFSET(R51C,RC4,0,1,1)) -> #N/A | T38: =T(OFFSET(R51C,RC4,0,1,1)) -> #N/A | U38: =T(OFFSET(R51C,RC4,0,1,1)) -> #N/A | Y38: =T(OFFSET(R51C,RC4,0,1,1)) -> #N/A
A39: =IF(RC4<0,"",OFFSET(R51C,RC4,0,1,1)) -> #N/A | B39: =T(OFFSET(R51C,RC4,0,1,1)) -> #N/A | C39: =T(OFFSET(R51C,RC4,0,1,1)) -> #N/A | D39: =IF(AND(R[-1]C6=RC6,R[-1]C5=0),IFERROR((R[-1]C4+1)+(MATCH(RC6,OFFSET(R51C6,R[-1]C4+1,0,(通番最大+1)-1-R[-1]C4,1),0)-1),-2),IF(RC5>0,RC5,MATCH(RC6,OFFSET(R51C6,0,0,通番最大+1,1),0)-1)) -> #N/A | E39: =IF(R[-1]C6=RC6,0,IFERROR(MATCH(RC6,OFFSET(R51C5,0,0,通番最大+1,1),0)-1,0)) -> 0 | F39: しっぽ | G39: =T(OFFSET(R51C,RC4,0,1,1)) -> #N/A | H39: =IF(OR(AND(RC6="ドレス",R8C7<>"ドレス"),AND(OR(RC6="トップス",RC6="ボトムス"),R8C7="ドレス")),0,1)*OFFSET(R51C,RC4,0,1,1)*IFERROR(VLOOKUP(RC6,'[MiracleNikkiJp_balance.csv]MiracleNikkiJp_balance'!R5C1:R37C2,2,FALSE),VLOOKUP("アクセサリー",'[MiracleNikkiJp_balance.csv]MiracleNikkiJp_balance'!R5C1:R37C2,2,FALSE)) -> #N/A | I39: ◯ | K39: =T(OFFSET(R51C,RC4,0,1,1)) -> #N/A | L39: =T(OFFSET(R51C,RC4,0,1,1)) -> #N/A | M39: =T(OFFSET(R51C,RC4,0,1,1)) -> #N/A | N39: =T(OFFSET(R51C,RC4,0,1,1)) -> #N/A | O39: =T(OFFSET(R51C,RC4,0,1,1)) -> #N/A | P39: =T(OFFSET(R51C,RC4,0,1,1)) -> #N/A | Q39: =T(OFFSET(R51C,RC4,0,1,1)) -> #N/A | R39: =T(OFFSET(R51C,RC4,0,1,1)) -> #N/A | S39: =T(OFFSET(R51C,RC4,0,1,1)) -> #N/A | T39: =T(OFFSET(R51C,RC4,0,1,1)) -> #N/A | U39: =T(OFFSET(R51C,RC4,0,1,1)) -> #N/A | Y39: =T(OFFSET(R51C,RC4,0,1,1)) -> #N/A
A40: =IF(RC4<0,"",OFFSET(R51C,RC4,0,1,1)) -> #N/A | B40: =T(OFFSET(R51C,RC4,0,1,1)) -> #N/A | C40: =T(OFFSET(R51C,RC4,0,1,1)) -> #N/A | D40: =IF(AND(R[-1]C6=RC6,R[-1]C5=0),IFERROR((R[-1]C4+1)+(MATCH(RC6,OFFSET(R51C6,R[-1]C4+1,0,(通番最大+1)-1-R[-1]C4,1),0)-1),-2),IF(RC5>0,RC5,MATCH(RC6,OFFSET(R51C6,0,0,通番最大+1,1),0)-1)) -> #N/A | E40: =IF(R[-1]C6=RC6,0,IFERROR(MATCH(RC6,OFFSET(R51C5,0,0,通番最大+1,1),0)-1,0)) -> 0 | F40: 前景 | G40: =T(OFFSET(R51C,RC4,0,1,1)) -> #N/A | H40: =IF(OR(AND(RC6="ドレス",R8C7<>"ドレス"),AND(OR(RC6="トップス",RC6="ボトムス"),R8C7="ドレス")),0,1)*OFFSET(R51C,RC4,0,1,1)*IFERROR(VLOOKUP(RC6,'[MiracleNikkiJp_balance.csv]MiracleNikkiJp_balance'!R5C1:R37C2,2,FALSE),VLOOKUP("アクセサリー",'[MiracleNikkiJp_balance.csv]MiracleNikkiJp_balance'!R5C1:R37C2,2,FALSE)) -> #N/A | I40: ◯ | K40: =T(OFFSET(R51C,RC4,0,1,1)) -> #N/A | L40: =T(OFFSET(R51C,RC4,0,1,1)) -> #N/A | M40: =T(OFFSET(R51C,RC4,0,1,1)) -> #N/A | N40: =T(OFFSET(R51C,RC4,0,1,1)) -> #N/A | O40: =T(OFFSET(R51C,RC4,0,1,1)) -> #N/A | P40: =T(OFFSET(R51C,RC4,0,1,1)) -> #N/A | Q40: =T(OFFSET(R51C,RC4,0,1,1)) -> #N/A | R40: =T(OFFSET(R51C,RC4,0,1,1)) -> #N/A | S40: =T(OFFSET(R51C,RC4,0,1,1)) -> #N/A | T40: =T(OFFSET(R51C,RC4,0,1,1)) -> #N/A | U40: =T(OFFSET(R51C,RC4,0,1,1)) -> #N/A | Y40: =T(OFFSET(R51C,RC4,0,1,1)) -> #N/A
A41: =IF(RC4<0,"",OFFSET(R51C,RC4,0,1,1)) -> #N/A | B41: =T(OFFSET(R51C,RC4,0,1,1)) -> #N/A | C41: =T(OFFSET(R51C,RC4,0,1,1)) -> #N/A | D41: =IF(AND(R[-1]C6=RC6,R[-1]C5=0),IFERROR((R[-1]C4+1)+(MATCH(RC6,OFFSET(R51C6,R[-1]C4+1,0,(通番最大+1)-1-R[-1]C4,1),0)-1),-2),IF(RC5>0,RC5,MATCH(RC6,OFFSET(R51C6,0,0,通番最大+1,1),0)-1)) -> #N/A | E41: =IF(R[-1]C6=RC6,0,IFERROR(MATCH(RC6,OFFSET(R51C5,0,0,通番最大+1,1),0)-1,0)) -> 0 | F41: 後景 | G41: =T(OFFSET(R51C,RC4,0,1,1)) -> #N/A | H41: =IF(OR(AND(RC6="ドレス",R8C7<>"ドレス"),AND(OR(RC6="トップス",RC6="ボトムス"),R8C7="ドレス")),0,1)*OFFSET(R51C,RC4,0,1,1)*IFERROR(VLOOKUP(RC6,'[MiracleNikkiJp_balance.csv]MiracleNikkiJp_balance'!R5C1:R37C2,2,FALSE),VLOOKUP("アクセサリー",'[MiracleNikkiJp_balance.csv]MiracleNikkiJp_balance'!R5C1:R37C2,2,FALSE)) -> #N/A | I41: ◯ | K41: =T(OFFSET(R51C,RC4,0,1,1)) -> #N/A | L41: =T(OFFSET(R51C,RC4,0,1,1)) -> #N/A | M41: =T(OFFSET(R51C,RC4,0,1,1)) -> #N/A | N41: =T(OFFSET(R51C,RC4,0,1,1)) -> #N/A | O41: =T(OFFSET(R51C,RC4,0,1,1)) -> #N/A | P41: =T(OFFSET(R51C,RC4,0,1,1)) -> #N/A | Q41: =T(OFFSET(R51C,RC4,0,1,1)) -> #N/A | R41: =T(OFFSET(R51C,RC4,0,1,1)) -> #N/A | S41: =T(OFFSET(R51C,RC4,0,1,1)) -> #N/A | T41: =T(OFFSET(R51C,RC4,0,1,1)) -> #N/A | U41: =T(OFFSET(R51C,RC4,0,1,1)) -> #N/A | Y41: =T(OFFSET(R51C,RC4,0,1,1)) -> #N/A
A42: =IF(RC4<0,"",OFFSET(R51C,RC4,0,1,1)) -> #N/A | B42: =T(OFFSET(R51C,RC4,0,1,1)) -> #N/A | C42: =T(OFFSET(R51C,RC4,0,1,1)) -> #N/A | D42: =IF(AND(R[-1]C6=RC6,R[-1]C5=0),IFERROR((R[-1]C4+1)+(MATCH(RC6,OFFSET(R51C6,R[-1]C4+1,0,(通番最大+1)-1-R[-1]C4,1),0)-1),-2),IF(RC5>0,RC5,MATCH(RC6,OFFSET(R51C6,0,0,通番最大+1,1),0)-1)) -> #N/A | E42: =IF(R[-1]C6=RC6,0,IFERROR(MATCH(RC6,OFFSET(R51C5,0,0,通番最大+1,1),0)-1,0)) -> 0 | F42: 吊り | G42: =T(OFFSET(R51C,RC4,0,1,1)) -> #N/A | H42: =IF(OR(AND(RC6="ドレス",R8C7<>"ドレス"),AND(OR(RC6="トップス",RC6="ボトムス"),R8C7="ドレス")),0,1)*OFFSET(R51C,RC4,0,1,1)*IFERROR(VLOOKUP(RC6,'[MiracleNikkiJp_balance.csv]MiracleNikkiJp_balance'!R5C1:R37C2,2,FALSE),VLOOKUP("アクセサリー",'[MiracleNikkiJp_balance.csv]MiracleNikkiJp_balance'!R5C1:R37C2,2,FALSE)) -> #N/A | I42: ◯ | K42: =T(OFFSET(R51C,RC4,0,1,1)) -> #N/A | L42: =T(OFFSET(R51C,RC4,0,1,1)) -> #N/A | M42: =T(OFFSET(R51C,RC4,0,1,1)) -> #N/A | N42: =T(OFFSET(R51C,RC4,0,1,1)) -> #N/A | O42: =T(OFFSET(R51C,RC4,0,1,1)) -> #N/A | P42: =T(OFFSET(R51C,RC4,0,1,1)) -> #N/A | Q42: =T(OFFSET(R51C,RC4,0,1,1)) -> #N/A | R42: =T(OFFSET(R51C,RC4,0,1,1)) -> #N/A | S42: =T(OFFSET(R51C,RC4,0,1,1)) -> #N/A | T42: =T(OFFSET(R51C,RC4,0,1,1)) -> #N/A | U42: =T(OFFSET(R51C,RC4,0,1,1)) -> #N/A | Y42: =T(OFFSET(R51C,RC4,0,1,1)) -> #N/A
A43: =IF(RC4<0,"",OFFSET(R51C,RC4,0,1,1)) -> #N/A | B43: =T(OFFSET(R51C,RC4,0,1,1)) -> #N/A | C43: =T(OFFSET(R51C,RC4,0,1,1)) -> #N/A | D43: =IF(AND(R[-1]C6=RC6,R[-1]C5=0),IFERROR((R[-1]C4+1)+(MATCH(RC6,OFFSET(R51C6,R[-1]C4+1,0,(通番最大+1)-1-R[-1]C4,1),0)-1),-2),IF(RC5>0,RC5,MATCH(RC6,OFFSET(R51C6,0,0,通番最大+1,1),0)-1)) -> #N/A | E43: =IF(R[-1]C6=RC6,0,IFERROR(MATCH(RC6,OFFSET(R51C5,0,0,通番最大+1,1),0)-1,0)) -> 0 | F43: 床 | G43: =T(OFFSET(R51C,RC4,0,1,1)) -> #N/A | H43: =IF(OR(AND(RC6="ドレス",R8C7<>"ドレス"),AND(OR(RC6="トップス",RC6="ボトムス"),R8C7="ドレス")),0,1)*OFFSET(R51C,RC4,0,1,1)*IFERROR(VLOOKUP(RC6,'[MiracleNikkiJp_balance.csv]MiracleNikkiJp_balance'!R5C1:R37C2,2,FALSE),VLOOKUP("アクセサリー",'[MiracleNikkiJp_balance.csv]MiracleNikkiJp_balance'!R5C1:R37C2,2,FALSE)) -> #N/A | I43: ◯ | K43: =T(OFFSET(R51C,RC4,0,1,1)) -> #N/A | L43: =T(OFFSET(R51C,RC4,0,1,1)) -> #N/A | M43: =T(OFFSET(R51C,RC4,0,1,1)) -> #N/A | N43: =T(OFFSET(R51C,RC4,0,1,1)) -> #N/A | O43: =T(OFFSET(R51C,RC4,0,1,1)) -> #N/A | P43: =T(OFFSET(R51C,RC4,0,1,1)) -> #N/A | Q43: =T(OFFSET(R51C,RC4,0,1,1)) -> #N/A | R43: =T(OFFSET(R51C,RC4,0,1,1)) -> #N/A | S43: =T(OFFSET(R51C,RC4,0,1,1)) -> #N/A | T43: =T(OFFSET(R51C,RC4,0,1,1)) -> #N/A | U43: =T(OFFSET(R51C,RC4,0,1,1)) -> #N/A | Y43: =T(OFFSET(R51C,RC4,0,1,1)) -> #N/A
A44: =IF(RC4<0,"",OFFSET(R51C,RC4,0,1,1)) -> #N/A | B44: =T(OFFSET(R51C,RC4,0,1,1)) -> #N/A | C44: =T(OFFSET(R51C,RC4,0,1,1)) -> #N/A | D44: =IF(AND(R[-1]C6=RC6,R[-1]C5=0),IFERROR((R[-1]C4+1)+(MATCH(RC6,OFFSET(R51C6,R[-1]C4+1,0,(通番最大+1)-1-R[-1]C4,1),0)-1),-2),IF(RC5>0,RC5,MATCH(RC6,OFFSET(R51C6,0,0,通番最大+1,1),0)-1)) -> #N/A | E44: =IF(R[-1]C6=RC6,0,IFERROR(MATCH(RC6,OFFSET(R51C5,0,0,通番最大+1,1),0)-1,0)) -> 0 | F44: 肌 | G44: =T(OFFSET(R51C,RC4,0,1,1)) -> #N/A | H44: =IF(OR(AND(RC6="ドレス",R8C7<>"ドレス"),AND(OR(RC6="トップス",RC6="ボトムス"),R8C7="ドレス")),0,1)*OFFSET(R51C,RC4,0,1,1)*IFERROR(VLOOKUP(RC6,'[MiracleNikkiJp_balance.csv]MiracleNikkiJp_balance'!R5C1:R37C2,2,FALSE),VLOOKUP("アクセサリー",'[MiracleNikkiJp_balance.csv]MiracleNikkiJp_balance'!R5C1:R37C2,2,FALSE)) -> #N/A | I44: ◯ | K44: =T(OFFSET(R51C,RC4,0,1,1)) -> #N/A | L44: =T(OFFSET(R51C,RC4,0,1,1)) -> #N/A | M44: =T(OFFSET(R51C,RC4,0,1,1)) -> #N/A | N44: =T(OFFSET(R51C,RC4,0,1,1)) -> #N/A | O44: =T(OFFSET(R51C,RC4,0,1,1)) -> #N/A | P44: =T(OFFSET(R51C,RC4,0,1,1)) -> #N/A | Q44: =T(OFFSET(R51C,RC4,0,1,1)) -> #N/A | R44: =T(OFFSET(R51C,RC4,0,1,1)) -> #N/A | S44: =T(OFFSET(R51C,RC4,0,1,1)) -> #N/A | T44: =T(OFFSET(R51C,RC4,0,1,1)) -> #N/A | U44: =T(OFFSET(R51C,RC4,0,1,1)) -> #N/A | Y44: =T(OFFSET(R51C,RC4,0,1,1)) -> #N/A
A45: =IF(RC4<0,"",OFFSET(R51C,RC4,0,1,1)) -> #N/A | B45: =T(OFFSET(R51C,RC4,0,1,1)) -> #N/A | C45: =T(OFFSET(R51C,RC4,0,1,1)) -> #N/A | D45: =IF(AND(R[-1]C6=RC6,R[-1]C5=0),IFERROR((R[-1]C4+1)+(MATCH(RC6,OFFSET(R51C6,R[-1]C4+1,0,(通番最大+1)-1-R[-1]C4,1),0)-1),-2),IF(RC5>0,RC5,MATCH(RC6,OFFSET(R51C6,0,0,通番最大+1,1),0)-1)) -> #N/A | E45: =IF(R[-1]C6=RC6,0,IFERROR(MATCH(RC6,OFFSET(R51C5,0,0,通番最大+1,1),0)-1,0)) -> 0 | F45: メイク | G45: =T(OFFSET(R51C,RC4,0,1,1)) -> #N/A | H45: =IF(OR(AND(RC6="ドレス",R8C7<>"ドレス"),AND(OR(RC6="トップス",RC6="ボトムス"),R8C7="ドレス")),0,1)*OFFSET(R51C,RC4,0,1,1)*IFERROR(VLOOKUP(RC6,'[MiracleNikkiJp_balance.csv]MiracleNikkiJp_balance'!R5C1:R37C2,2,FALSE),VLOOKUP("アクセサリー",'[MiracleNikkiJp_balance.csv]MiracleNikkiJp_balance'!R5C1:R37C2,2,FALSE)) -> #N/A | I45: ◯ | K45: =T(OFFSET(R51C,RC4,0,1,1)) -> #N/A | L45: =T(OFFSET(R51C,RC4,0,1,1)) -> #N/A | M45: =T(OFFSET(R51C,RC4,0,1,1)) -> #N/A | N45: =T(OFFSET(R51C,RC4,0,1,1)) -> #N/A | O45: =T(OFFSET(R51C,RC4,0,1,1)) -> #N/A | P45: =T(OFFSET(R51C,RC4,0,1,1)) -> #N/A | Q45: =T(OFFSET(R51C,RC4,0,1,1)) -> #N/A | R45: =T(OFFSET(R51C,RC4,0,1,1)) -> #N/A | S45: =T(OFFSET(R51C,RC4,0,1,1)) -> #N/A | T45: =T(OFFSET(R51C,RC4,0,1,1)) -> #N/A | U45: =T(OFFSET(R51C,RC4,0,1,1)) -> #N/A | Y45: =T(OFFSET(R51C,RC4,0,1,1)) -> #N/A
G46: 採用した評価の合計 | H46: =SUMIF(R[-33]C[1]:R[-1]C[1],"◯",R[-33]C:R[-1]C) -> #N/A
H48: ② 評価の大きい順に並べ替えます。(Excelのデータ→並べ替え機能を使います)
A50: 整理番号 | B50: 指定 | C50: 所有 | D50: 対象 | E50: 指定の種類 | F50: =OFFSET('[MiracleNikkiJp_items.csv]MiracleNikkiJp_items'!R10C[-3],0,0,1,1) -> 種類 | G50: =OFFSET('[MiracleNikkiJp_items.csv]MiracleNikkiJp_items'!R10C[-2],0,0,1,1) -> 名前 | H50: 評価 | I50: 整理番号 | J50: ❤ | K50: =LEFT(OFFSET('[MiracleNikkiJp_items.csv]MiracleNikkiJp_items'!R10C[-4],0,0,1,1),1) -> 華 | L50: =LEFT(OFFSET('[MiracleNikkiJp_items.csv]MiracleNikkiJp_items'!R10C[-4],0,0,1,1),1) -> シ | M50: =LEFT(OFFSET('[MiracleNikkiJp_items.csv]MiracleNikkiJp_items'!R10C[-4],0,0,1,1),1) -> エ | N50: =LEFT(OFFSET('[MiracleNikkiJp_items.csv]MiracleNikkiJp_items'!R10C[-4],0,0,1,1),1) -> ア | O50: =LEFT(OFFSET('[MiracleNikkiJp_items.csv]MiracleNikkiJp_items'!R10C[-4],0,0,1,1),1) -> 大 | P50: =LEFT(OFFSET('[MiracleNikkiJp_items.csv]MiracleNikkiJp_items'!R10C[-4],0,0,1,1),1) -> キ | Q50: =LEFT(OFFSET('[MiracleNikkiJp_items.csv]MiracleNikkiJp_items'!R10C[-4],0,0,1,1),1) -> セ | R50: =LEFT(OFFSET('[MiracleNikkiJp_items.csv]MiracleNikkiJp_items'!R10C[-4],0,0,1,1),1) -> ピ | S50: =LEFT(OFFSET('[MiracleNikkiJp_items.csv]MiracleNikkiJp_items'!R10C[-4],0,0,1,1),1) -> ウ | T50: =LEFT(OFFSET('[MiracleNikkiJp_items.csv]MiracleNikkiJp_items'!R10C[-4],0,0,1,1),1) -> ク | U50: タグ | V50: － | W50: － | X50: － | Y50: 色 | Z50: 通番 | AA50: =LEFT(OFFSET('[MiracleNikkiJp_items.csv]MiracleNikkiJp_items'!R10C[-20],0,0,1,1),1) -> 華 | AB50: =LEFT(OFFSET('[MiracleNikkiJp_items.csv]MiracleNikkiJp_items'!R10C[-20],0,0,1,1),1) -> シ | AC50: =LEFT(OFFSET('[MiracleNikkiJp_items.csv]MiracleNikkiJp_items'!R10C[-20],0,0,1,1),1) -> エ | AD50: =LEFT(OFFSET('[MiracleNikkiJp_items.csv]MiracleNikkiJp_items'!R10C[-20],0,0,1,1),1) -> ア | AE50: =LEFT(OFFSET('[MiracleNikkiJp_items.csv]MiracleNikkiJp_items'!R10C[-20],0,0,1,1),1) -> 大 | AF50: =LEFT(OFFSET('[MiracleNikkiJp_items.csv]MiracleNikkiJp_items'!R10C[-20],0,0,1,1),1) -> キ | AG50: =LEFT(OFFSET('[MiracleNikkiJp_items.csv]MiracleNikkiJp_items'!R10C[-20],0,0,1,1),1) -> セ | AH50: =LEFT(OFFSET('[MiracleNikkiJp_items.csv]MiracleNikkiJp_items'!R10C[-20],0,0,1,1),1) -> ピ | AI50: =LEFT(OFFSET('[MiracleNikkiJp_items.csv]MiracleNikkiJp_items'!R10C[-20],0,0,1,1),1) -> ウ | AJ50: =LEFT(OFFSET('[MiracleNikkiJp_items.csv]MiracleNikkiJp_items'!R10C[-20],0,0,1,1),1) -> ク | AK50: ♥× | AL50: ♥＋ | AM50: タグ1有 | AN50: タグ2有 | AO50: タグ1× | AP50: タグ1＋ | AQ50: タグ2× | AR50: タグ2＋ | AS50: 色1有 | AT50: 色2有 | AU50: 色1× | AV50: 色1＋ | AW50: 色2× | AX50: 色2＋ | AY50: 属性計 | AZ50: × | BA50: ＋
A51: 0 | D51: ◯ | E51: － | F51: － | G51: － | H51: 0 | I51: =RC1 -> 0 | J51: 0 | K51: ="" ->  | L51: ="" ->  | M51: ="" ->  | N51: ="" ->  | O51: ="" ->  | P51: ="" ->  | Q51: ="" ->  | R51: ="" ->  | S51: ="" ->  | T51: ="" ->  | U51: ="" ->  | Y51: ="" ->  | Z51: 0 | AA51: 0 | AB51: 0 | AC51: 0 | AD51: 0 | AE51: 0 | AF51: 0 | AG51: 0 | AH51: 0 | AI51: 0 | AJ51: 0 | AK51: =VLOOKUP(RC10,R9C38:R19C40,2,FALSE) -> 1 | AL51: 0 | AM51: =IF(OR(ISBLANK(R4C7),ISERROR(FIND(R4C7,RC21))),"　","●") ->  | AN51: =IF(OR(ISBLANK(R5C7),ISERROR(FIND(R5C7,RC21))),"　","●") ->  | AO51: 0 | AP51: 0 | AQ51: 0 | AR51: 0 | AS51: =IF(OR(ISBLANK(R6C7),ISERROR(FIND(R6C7,RC25))),"　","●") ->  | AT51: =IF(OR(ISBLANK(R7C7),ISERROR(FIND(R7C7,RC25))),"　","●") ->  | AU51: 0 | AV51: 0 | AW51: 0 | AX51: 0 | AY51: =SUM(RC27:RC36) -> 0 | AZ51: =RC37*RC41*RC43*RC47*RC49 -> 0 | BA51: =RC38+RC42+RC44+RC48+RC50 -> 0
A52: =OFFSET(R164C1,INT((RC26-1)/100),MOD(INT((RC26-1)/10),10),1,1)*10+MOD(RC26-1,10)+1 -> 1 | D52: =IF(AND(RC2<>"NG",OR(RC2<>"",RC3<>"",R9C4="×")),"◯","") ->  | E52: =IF(RC2="◯",RC6,"") ->  | F52: =T(OFFSET('[MiracleNikkiJp_items.csv]MiracleNikkiJp_items'!R10C[-3],RC1,0,1,1)) -> ヘアスタイル | G52: =T(OFFSET('[MiracleNikkiJp_items.csv]MiracleNikkiJp_items'!R10C[-2],RC1,0,1,1)) ->  | H52: =IF(RC4="",0,RC51*RC52+RC53) -> 0 | I52: =RC1 -> 1 | J52: =OFFSET('[MiracleNikkiJp_items.csv]MiracleNikkiJp_items'!R10C[-4],RC1,0,1,1) -> 0 | K52: =T(OFFSET('[MiracleNikkiJp_items.csv]MiracleNikkiJp_items'!R10C[-4],RC1,0,1,1)) ->  | L52: =T(OFFSET('[MiracleNikkiJp_items.csv]MiracleNikkiJp_items'!R10C[-4],RC1,0,1,1)) ->  | M52: =T(OFFSET('[MiracleNikkiJp_items.csv]MiracleNikkiJp_items'!R10C[-4],RC1,0,1,1)) ->  | N52: =T(OFFSET('[MiracleNikkiJp_items.csv]MiracleNikkiJp_items'!R10C[-4],RC1,0,1,1)) ->  | O52: =T(OFFSET('[MiracleNikkiJp_items.csv]MiracleNikkiJp_items'!R10C[-4],RC1,0,1,1)) ->  | P52: =T(OFFSET('[MiracleNikkiJp_items.csv]MiracleNikkiJp_items'!R10C[-4],RC1,0,1,1)) ->  | Q52: =T(OFFSET('[MiracleNikkiJp_items.csv]MiracleNikkiJp_items'!R10C[-4],RC1,0,1,1)) ->  | R52: =T(OFFSET('[MiracleNikkiJp_items.csv]MiracleNikkiJp_items'!R10C[-4],RC1,0,1,1)) ->  | S52: =T(OFFSET('[MiracleNikkiJp_items.csv]MiracleNikkiJp_items'!R10C[-4],RC1,0,1,1)) ->  | T52: =T(OFFSET('[MiracleNikkiJp_items.csv]MiracleNikkiJp_items'!R10C[-4],RC1,0,1,1)) ->  | U52: =T(OFFSET('[MiracleNikkiJp_items.csv]MiracleNikkiJp_items'!R10C[-4],RC1,0,1,1)) ->  | Y52: =T(OFFSET('[MiracleNikkiJp_items.csv]MiracleNikkiJp_items'!R10C[-7],RC1,0,1,1)) ->  | Z52: 1 | AA52: =IFERROR(VLOOKUP(RC[-16],R9C26:R17C36,2,FALSE),0)*R6C -> 0 | AB52: =IFERROR(VLOOKUP(RC[-16],R9C26:R17C36,3,FALSE),0)*R6C -> 0 | AC52: =IFERROR(VLOOKUP(RC[-16],R9C26:R17C36,4,FALSE),0)*R6C -> 0 | AD52: =IFERROR(VLOOKUP(RC[-16],R9C26:R17C36,5,FALSE),0)*R6C -> 0 | AE52: =IFERROR(VLOOKUP(RC[-16],R9C26:R17C36,6,FALSE),0)*R6C -> 0 | AF52: =IFERROR(VLOOKUP(RC[-16],R9C26:R17C36,7,FALSE),0)*R6C -> 0 | AG52: =IFERROR(VLOOKUP(RC[-16],R9C26:R17C36,8,FALSE),0)*R6C -> 0 | AH52: =IFERROR(VLOOKUP(RC[-16],R9C26:R17C36,9,FALSE),0)*R6C -> 0 | AI52: =IFERROR(VLOOKUP(RC[-16],R9C26:R17C36,10,FALSE),0)*R6C -> 0 | AJ52: =IFERROR(VLOOKUP(RC[-16],R9C26:R17C36,11,FALSE),0)*R6C -> 0 | AK52: =VLOOKUP(RC10,R9C38:R17C40,2,FALSE) -> 1 | AL52: =VLOOKUP(RC10,R9C38:R17C40,3,FALSE) -> 0 | AM52: =IF(OR(ISBLANK(R4C7),ISERROR(FIND(R4C7,RC21))),"　","●") ->  | AN52: =IF(OR(ISBLANK(R5C7),ISERROR(FIND(R5C7,RC21))),"　","●") ->  | AO52: =IF(RC39<>"●",VLOOKUP("評価しない",R9C42:R17C44,2,FALSE),VLOOKUP(R4C8,R9C42:R17C44,2,FALSE)) -> 1 | AP52: =IF(RC39<>"●",VLOOKUP("",R9C42:R17C44,3,FALSE),VLOOKUP(R4C8,R9C42:R17C44,3,FALSE)) -> 0 | AQ52: =IF(RC40<>"●",VLOOKUP("評価しない",R9C42:R17C44,2,FALSE),VLOOKUP(R5C8,R9C42:R17C44,2,FALSE)) -> 1 | AR52: =IF(RC40<>"●",VLOOKUP("",R9C42:R17C44,3,FALSE),VLOOKUP(R5C8,R9C42:R17C44,3,FALSE)) -> 0 | AS52: =IF(OR(ISBLANK(R6C7),ISERROR(FIND(R6C7,RC25))),"　","●") ->  | AT52: =IF(OR(ISBLANK(R7C7),ISERROR(FIND(R7C7,RC25))),"　","●") ->  | AU52: =IF(RC45<>"●",VLOOKUP("評価しない",R9C46:R17C48,2,FALSE),VLOOKUP(R6C8,R9C46:R17C48,2,FALSE)) -> 1 | AV52: =IF(RC45<>"●",VLOOKUP("",R9C46:R17C48,3,FALSE),VLOOKUP(R6C8,R9C46:R17C48,3,FALSE)) -> 0 | AW52: =IF(RC46<>"●",VLOOKUP("評価しない",R9C46:R17C48,2,FALSE),VLOOKUP(R7C8,R9C46:R17C48,2,FALSE)) -> 1 | AX52: =IF(RC46<>"●",VLOOKUP("",R9C46:R17C48,3,FALSE),VLOOKUP(R7C8,R9C46:R17C48,3,FALSE)) -> 0 | AY52: =SUM(RC27:RC36) -> 0 | AZ52: =RC37*RC41*RC43*RC47*RC49 -> 1 | BA52: =RC38+RC42+RC44+RC48+RC50 -> 0
A53: =OFFSET(R164C1,INT((RC26-1)/100),MOD(INT((RC26-1)/10),10),1,1)*10+MOD(RC26-1,10)+1 -> 2 | D53: =IF(AND(RC2<>"NG",OR(RC2<>"",RC3<>"",R9C4="×")),"◯","") ->  | E53: =IF(RC2="◯",RC6,"") ->  | F53: =T(OFFSET('[MiracleNikkiJp_items.csv]MiracleNikkiJp_items'!R10C[-3],RC1,0,1,1)) -> ヘアスタイル | G53: =T(OFFSET('[MiracleNikkiJp_items.csv]MiracleNikkiJp_items'!R10C[-2],RC1,0,1,1)) ->  | H53: =IF(RC4="",0,RC51*RC52+RC53) -> 0 | I53: =RC1 -> 2 | J53: =OFFSET('[MiracleNikkiJp_items.csv]MiracleNikkiJp_items'!R10C[-4],RC1,0,1,1) -> 0 | K53: =T(OFFSET('[MiracleNikkiJp_items.csv]MiracleNikkiJp_items'!R10C[-4],RC1,0,1,1)) ->  | L53: =T(OFFSET('[MiracleNikkiJp_items.csv]MiracleNikkiJp_items'!R10C[-4],RC1,0,1,1)) ->  | M53: =T(OFFSET('[MiracleNikkiJp_items.csv]MiracleNikkiJp_items'!R10C[-4],RC1,0,1,1)) ->  | N53: =T(OFFSET('[MiracleNikkiJp_items.csv]MiracleNikkiJp_items'!R10C[-4],RC1,0,1,1)) ->  | O53: =T(OFFSET('[MiracleNikkiJp_items.csv]MiracleNikkiJp_items'!R10C[-4],RC1,0,1,1)) ->  | P53: =T(OFFSET('[MiracleNikkiJp_items.csv]MiracleNikkiJp_items'!R10C[-4],RC1,0,1,1)) ->  | Q53: =T(OFFSET('[MiracleNikkiJp_items.csv]MiracleNikkiJp_items'!R10C[-4],RC1,0,1,1)) ->  | R53: =T(OFFSET('[MiracleNikkiJp_items.csv]MiracleNikkiJp_items'!R10C[-4],RC1,0,1,1)) ->  | S53: =T(OFFSET('[MiracleNikkiJp_items.csv]MiracleNikkiJp_items'!R10C[-4],RC1,0,1,1)) ->  | T53: =T(OFFSET('[MiracleNikkiJp_items.csv]MiracleNikkiJp_items'!R10C[-4],RC1,0,1,1)) ->  | U53: =T(OFFSET('[MiracleNikkiJp_items.csv]MiracleNikkiJp_items'!R10C[-4],RC1,0,1,1)) ->  | Y53: =T(OFFSET('[MiracleNikkiJp_items.csv]MiracleNikkiJp_items'!R10C[-7],RC1,0,1,1)) ->  | Z53: 2 | AA53: =IFERROR(VLOOKUP(RC[-16],R9C26:R17C36,2,FALSE),0)*R6C -> 0 | AB53: =IFERROR(VLOOKUP(RC[-16],R9C26:R17C36,3,FALSE),0)*R6C -> 0 | AC53: =IFERROR(VLOOKUP(RC[-16],R9C26:R17C36,4,FALSE),0)*R6C -> 0 | AD53: =IFERROR(VLOOKUP(RC[-16],R9C26:R17C36,5,FALSE),0)*R6C -> 0 | AE53: =IFERROR(VLOOKUP(RC[-16],R9C26:R17C36,6,FALSE),0)*R6C -> 0 | AF53: =IFERROR(VLOOKUP(RC[-16],R9C26:R17C36,7,FALSE),0)*R6C -> 0 | AG53: =IFERROR(VLOOKUP(RC[-16],R9C26:R17C36,8,FALSE),0)*R6C -> 0 | AH53: =IFERROR(VLOOKUP(RC[-16],R9C26:R17C36,9,FALSE),0)*R6C -> 0 | AI53: =IFERROR(VLOOKUP(RC[-16],R9C26:R17C36,10,FALSE),0)*R6C -> 0 | AJ53: =IFERROR(VLOOKUP(RC[-16],R9C26:R17C36,11,FALSE),0)*R6C -> 0 | AK53: =VLOOKUP(RC10,R9C38:R17C40,2,FALSE) -> 1 | AL53: =VLOOKUP(RC10,R9C38:R17C40,3,FALSE) -> 0 | AM53: =IF(OR(ISBLANK(R4C7),ISERROR(FIND(R4C7,RC21))),"　","●") ->  | AN53: =IF(OR(ISBLANK(R5C7),ISERROR(FIND(R5C7,RC21))),"　","●") ->  | AO53: =IF(RC39<>"●",VLOOKUP("評価しない",R9C42:R17C44,2,FALSE),VLOOKUP(R4C8,R9C42:R17C44,2,FALSE)) -> 1 | AP53: =IF(RC39<>"●",VLOOKUP("",R9C42:R17C44,3,FALSE),VLOOKUP(R4C8,R9C42:R17C44,3,FALSE)) -> 0 | AQ53: =IF(RC40<>"●",VLOOKUP("評価しない",R9C42:R17C44,2,FALSE),VLOOKUP(R5C8,R9C42:R17C44,2,FALSE)) -> 1 | AR53: =IF(RC40<>"●",VLOOKUP("",R9C42:R17C44,3,FALSE),VLOOKUP(R5C8,R9C42:R17C44,3,FALSE)) -> 0 | AS53: =IF(OR(ISBLANK(R6C7),ISERROR(FIND(R6C7,RC25))),"　","●") ->  | AT53: =IF(OR(ISBLANK(R7C7),ISERROR(FIND(R7C7,RC25))),"　","●") ->  | AU53: =IF(RC45<>"●",VLOOKUP("評価しない",R9C46:R17C48,2,FALSE),VLOOKUP(R6C8,R9C46:R17C48,2,FALSE)) -> 1 | AV53: =IF(RC45<>"●",VLOOKUP("",R9C46:R17C48,3,FALSE),VLOOKUP(R6C8,R9C46:R17C48,3,FALSE)) -> 0 | AW53: =IF(RC46<>"●",VLOOKUP("評価しない",R9C46:R17C48,2,FALSE),VLOOKUP(R7C8,R9C46:R17C48,2,FALSE)) -> 1 | AX53: =IF(RC46<>"●",VLOOKUP("",R9C46:R17C48,3,FALSE),VLOOKUP(R7C8,R9C46:R17C48,3,FALSE)) -> 0 | AY53: =SUM(RC27:RC36) -> 0 | AZ53: =RC37*RC41*RC43*RC47*RC49 -> 1 | BA53: =RC38+RC42+RC44+RC48+RC50 -> 0
A54: =OFFSET(R164C1,INT((RC26-1)/100),MOD(INT((RC26-1)/10),10),1,1)*10+MOD(RC26-1,10)+1 -> 3 | D54: =IF(AND(RC2<>"NG",OR(RC2<>"",RC3<>"",R9C4="×")),"◯","") ->  | E54: =IF(RC2="◯",RC6,"") ->  | F54: =T(OFFSET('[MiracleNikkiJp_items.csv]MiracleNikkiJp_items'!R10C[-3],RC1,0,1,1)) -> ヘアスタイル | G54: =T(OFFSET('[MiracleNikkiJp_items.csv]MiracleNikkiJp_items'!R10C[-2],RC1,0,1,1)) ->  | H54: =IF(RC4="",0,RC51*RC52+RC53) -> 0 | I54: =RC1 -> 3 | J54: =OFFSET('[MiracleNikkiJp_items.csv]MiracleNikkiJp_items'!R10C[-4],RC1,0,1,1) -> 0 | K54: =T(OFFSET('[MiracleNikkiJp_items.csv]MiracleNikkiJp_items'!R10C[-4],RC1,0,1,1)) ->  | L54: =T(OFFSET('[MiracleNikkiJp_items.csv]MiracleNikkiJp_items'!R10C[-4],RC1,0,1,1)) ->  | M54: =T(OFFSET('[MiracleNikkiJp_items.csv]MiracleNikkiJp_items'!R10C[-4],RC1,0,1,1)) ->  | N54: =T(OFFSET('[MiracleNikkiJp_items.csv]MiracleNikkiJp_items'!R10C[-4],RC1,0,1,1)) ->  | O54: =T(OFFSET('[MiracleNikkiJp_items.csv]MiracleNikkiJp_items'!R10C[-4],RC1,0,1,1)) ->  | P54: =T(OFFSET('[MiracleNikkiJp_items.csv]MiracleNikkiJp_items'!R10C[-4],RC1,0,1,1)) ->  | Q54: =T(OFFSET('[MiracleNikkiJp_items.csv]MiracleNikkiJp_items'!R10C[-4],RC1,0,1,1)) ->  | R54: =T(OFFSET('[MiracleNikkiJp_items.csv]MiracleNikkiJp_items'!R10C[-4],RC1,0,1,1)) ->  | S54: =T(OFFSET('[MiracleNikkiJp_items.csv]MiracleNikkiJp_items'!R10C[-4],RC1,0,1,1)) ->  | T54: =T(OFFSET('[MiracleNikkiJp_items.csv]MiracleNikkiJp_items'!R10C[-4],RC1,0,1,1)) ->  | U54: =T(OFFSET('[MiracleNikkiJp_items.csv]MiracleNikkiJp_items'!R10C[-4],RC1,0,1,1)) ->  | Y54: =T(OFFSET('[MiracleNikkiJp_items.csv]MiracleNikkiJp_items'!R10C[-7],RC1,0,1,1)) ->  | Z54: 3 | AA54: =IFERROR(VLOOKUP(RC[-16],R9C26:R17C36,2,FALSE),0)*R6C -> 0 | AB54: =IFERROR(VLOOKUP(RC[-16],R9C26:R17C36,3,FALSE),0)*R6C -> 0 | AC54: =IFERROR(VLOOKUP(RC[-16],R9C26:R17C36,4,FALSE),0)*R6C -> 0 | AD54: =IFERROR(VLOOKUP(RC[-16],R9C26:R17C36,5,FALSE),0)*R6C -> 0 | AE54: =IFERROR(VLOOKUP(RC[-16],R9C26:R17C36,6,FALSE),0)*R6C -> 0 | AF54: =IFERROR(VLOOKUP(RC[-16],R9C26:R17C36,7,FALSE),0)*R6C -> 0 | AG54: =IFERROR(VLOOKUP(RC[-16],R9C26:R17C36,8,FALSE),0)*R6C -> 0 | AH54: =IFERROR(VLOOKUP(RC[-16],R9C26:R17C36,9,FALSE),0)*R6C -> 0 | AI54: =IFERROR(VLOOKUP(RC[-16],R9C26:R17C36,10,FALSE),0)*R6C -> 0 | AJ54: =IFERROR(VLOOKUP(RC[-16],R9C26:R17C36,11,FALSE),0)*R6C -> 0 | AK54: =VLOOKUP(RC10,R9C38:R17C40,2,FALSE) -> 1 | AL54: =VLOOKUP(RC10,R9C38:R17C40,3,FALSE) -> 0 | AM54: =IF(OR(ISBLANK(R4C7),ISERROR(FIND(R4C7,RC21))),"　","●") ->  | AN54: =IF(OR(ISBLANK(R5C7),ISERROR(FIND(R5C7,RC21))),"　","●") ->  | AO54: =IF(RC39<>"●",VLOOKUP("評価しない",R9C42:R17C44,2,FALSE),VLOOKUP(R4C8,R9C42:R17C44,2,FALSE)) -> 1 | AP54: =IF(RC39<>"●",VLOOKUP("",R9C42:R17C44,3,FALSE),VLOOKUP(R4C8,R9C42:R17C44,3,FALSE)) -> 0 | AQ54: =IF(RC40<>"●",VLOOKUP("評価しない",R9C42:R17C44,2,FALSE),VLOOKUP(R5C8,R9C42:R17C44,2,FALSE)) -> 1 | AR54: =IF(RC40<>"●",VLOOKUP("",R9C42:R17C44,3,FALSE),VLOOKUP(R5C8,R9C42:R17C44,3,FALSE)) -> 0 | AS54: =IF(OR(ISBLANK(R6C7),ISERROR(FIND(R6C7,RC25))),"　","●") ->  | AT54: =IF(OR(ISBLANK(R7C7),ISERROR(FIND(R7C7,RC25))),"　","●") ->  | AU54: =IF(RC45<>"●",VLOOKUP("評価しない",R9C46:R17C48,2,FALSE),VLOOKUP(R6C8,R9C46:R17C48,2,FALSE)) -> 1 | AV54: =IF(RC45<>"●",VLOOKUP("",R9C46:R17C48,3,FALSE),VLOOKUP(R6C8,R9C46:R17C48,3,FALSE)) -> 0 | AW54: =IF(RC46<>"●",VLOOKUP("評価しない",R9C46:R17C48,2,FALSE),VLOOKUP(R7C8,R9C46:R17C48,2,FALSE)) -> 1 | AX54: =IF(RC46<>"●",VLOOKUP("",R9C46:R17C48,3,FALSE),VLOOKUP(R7C8,R9C46:R17C48,3,FALSE)) -> 0 | AY54: =SUM(RC27:RC36) -> 0 | AZ54: =RC37*RC41*RC43*RC47*RC49 -> 1 | BA54: =RC38+RC42+RC44+RC48+RC50 -> 0
A55: =OFFSET(R164C1,INT((RC26-1)/100),MOD(INT((RC26-1)/10),10),1,1)*10+MOD(RC26-1,10)+1 -> 4 | D55: =IF(AND(RC2<>"NG",OR(RC2<>"",RC3<>"",R9C4="×")),"◯","") ->  | E55: =IF(RC2="◯",RC6,"") ->  | F55: =T(OFFSET('[MiracleNikkiJp_items.csv]MiracleNikkiJp_items'!R10C[-3],RC1,0,1,1)) -> ヘアスタイル | G55: =T(OFFSET('[MiracleNikkiJp_items.csv]MiracleNikkiJp_items'!R10C[-2],RC1,0,1,1)) ->  | H55: =IF(RC4="",0,RC51*RC52+RC53) -> 0 | I55: =RC1 -> 4 | J55: =OFFSET('[MiracleNikkiJp_items.csv]MiracleNikkiJp_items'!R10C[-4],RC1,0,1,1) -> 0 | K55: =T(OFFSET('[MiracleNikkiJp_items.csv]MiracleNikkiJp_items'!R10C[-4],RC1,0,1,1)) ->  | L55: =T(OFFSET('[MiracleNikkiJp_items.csv]MiracleNikkiJp_items'!R10C[-4],RC1,0,1,1)) ->  | M55: =T(OFFSET('[MiracleNikkiJp_items.csv]MiracleNikkiJp_items'!R10C[-4],RC1,0,1,1)) ->  | N55: =T(OFFSET('[MiracleNikkiJp_items.csv]MiracleNikkiJp_items'!R10C[-4],RC1,0,1,1)) ->  | O55: =T(OFFSET('[MiracleNikkiJp_items.csv]MiracleNikkiJp_items'!R10C[-4],RC1,0,1,1)) ->  | P55: =T(OFFSET('[MiracleNikkiJp_items.csv]MiracleNikkiJp_items'!R10C[-4],RC1,0,1,1)) ->  | Q55: =T(OFFSET('[MiracleNikkiJp_items.csv]MiracleNikkiJp_items'!R10C[-4],RC1,0,1,1)) ->  | R55: =T(OFFSET('[MiracleNikkiJp_items.csv]MiracleNikkiJp_items'!R10C[-4],RC1,0,1,1)) ->  | S55: =T(OFFSET('[MiracleNikkiJp_items.csv]MiracleNikkiJp_items'!R10C[-4],RC1,0,1,1)) ->  | T55: =T(OFFSET('[MiracleNikkiJp_items.csv]MiracleNikkiJp_items'!R10C[-4],RC1,0,1,1)) ->  | U55: =T(OFFSET('[MiracleNikkiJp_items.csv]MiracleNikkiJp_items'!R10C[-4],RC1,0,1,1)) ->  | Y55: =T(OFFSET('[MiracleNikkiJp_items.csv]MiracleNikkiJp_items'!R10C[-7],RC1,0,1,1)) ->  | Z55: 4 | AA55: =IFERROR(VLOOKUP(RC[-16],R9C26:R17C36,2,FALSE),0)*R6C -> 0 | AB55: =IFERROR(VLOOKUP(RC[-16],R9C26:R17C36,3,FALSE),0)*R6C -> 0 | AC55: =IFERROR(VLOOKUP(RC[-16],R9C26:R17C36,4,FALSE),0)*R6C -> 0 | AD55: =IFERROR(VLOOKUP(RC[-16],R9C26:R17C36,5,FALSE),0)*R6C -> 0 | AE55: =IFERROR(VLOOKUP(RC[-16],R9C26:R17C36,6,FALSE),0)*R6C -> 0 | AF55: =IFERROR(VLOOKUP(RC[-16],R9C26:R17C36,7,FALSE),0)*R6C -> 0 | AG55: =IFERROR(VLOOKUP(RC[-16],R9C26:R17C36,8,FALSE),0)*R6C -> 0 | AH55: =IFERROR(VLOOKUP(RC[-16],R9C26:R17C36,9,FALSE),0)*R6C -> 0 | AI55: =IFERROR(VLOOKUP(RC[-16],R9C26:R17C36,10,FALSE),0)*R6C -> 0 | AJ55: =IFERROR(VLOOKUP(RC[-16],R9C26:R17C36,11,FALSE),0)*R6C -> 0 | AK55: =VLOOKUP(RC10,R9C38:R17C40,2,FALSE) -> 1 | AL55: =VLOOKUP(RC10,R9C38:R17C40,3,FALSE) -> 0 | AM55: =IF(OR(ISBLANK(R4C7),ISERROR(FIND(R4C7,RC21))),"　","●") ->  | AN55: =IF(OR(ISBLANK(R5C7),ISERROR(FIND(R5C7,RC21))),"　","●") ->  | AO55: =IF(RC39<>"●",VLOOKUP("評価しない",R9C42:R17C44,2,FALSE),VLOOKUP(R4C8,R9C42:R17C44,2,FALSE)) -> 1 | AP55: =IF(RC39<>"●",VLOOKUP("",R9C42:R17C44,3,FALSE),VLOOKUP(R4C8,R9C42:R17C44,3,FALSE)) -> 0 | AQ55: =IF(RC40<>"●",VLOOKUP("評価しない",R9C42:R17C44,2,FALSE),VLOOKUP(R5C8,R9C42:R17C44,2,FALSE)) -> 1 | AR55: =IF(RC40<>"●",VLOOKUP("",R9C42:R17C44,3,FALSE),VLOOKUP(R5C8,R9C42:R17C44,3,FALSE)) -> 0 | AS55: =IF(OR(ISBLANK(R6C7),ISERROR(FIND(R6C7,RC25))),"　","●") ->  | AT55: =IF(OR(ISBLANK(R7C7),ISERROR(FIND(R7C7,RC25))),"　","●") ->  | AU55: =IF(RC45<>"●",VLOOKUP("評価しない",R9C46:R17C48,2,FALSE),VLOOKUP(R6C8,R9C46:R17C48,2,FALSE)) -> 1 | AV55: =IF(RC45<>"●",VLOOKUP("",R9C46:R17C48,3,FALSE),VLOOKUP(R6C8,R9C46:R17C48,3,FALSE)) -> 0 | AW55: =IF(RC46<>"●",VLOOKUP("評価しない",R9C46:R17C48,2,FALSE),VLOOKUP(R7C8,R9C46:R17C48,2,FALSE)) -> 1 | AX55: =IF(RC46<>"●",VLOOKUP("",R9C46:R17C48,3,FALSE),VLOOKUP(R7C8,R9C46:R17C48,3,FALSE)) -> 0 | AY55: =SUM(RC27:RC36) -> 0 | AZ55: =RC37*RC41*RC43*RC47*RC49 -> 1 | BA55: =RC38+RC42+RC44+RC48+RC50 -> 0
A56: =OFFSET(R164C1,INT((RC26-1)/100),MOD(INT((RC26-1)/10),10),1,1)*10+MOD(RC26-1,10)+1 -> 5 | D56: =IF(AND(RC2<>"NG",OR(RC2<>"",RC3<>"",R9C4="×")),"◯","") ->  | E56: =IF(RC2="◯",RC6,"") ->  | F56: =T(OFFSET('[MiracleNikkiJp_items.csv]MiracleNikkiJp_items'!R10C[-3],RC1,0,1,1)) -> ヘアスタイル | G56: =T(OFFSET('[MiracleNikkiJp_items.csv]MiracleNikkiJp_items'!R10C[-2],RC1,0,1,1)) ->  | H56: =IF(RC4="",0,RC51*RC52+RC53) -> 0 | I56: =RC1 -> 5 | J56: =OFFSET('[MiracleNikkiJp_items.csv]MiracleNikkiJp_items'!R10C[-4],RC1,0,1,1) -> 0 | K56: =T(OFFSET('[MiracleNikkiJp_items.csv]MiracleNikkiJp_items'!R10C[-4],RC1,0,1,1)) ->  | L56: =T(OFFSET('[MiracleNikkiJp_items.csv]MiracleNikkiJp_items'!R10C[-4],RC1,0,1,1)) ->  | M56: =T(OFFSET('[MiracleNikkiJp_items.csv]MiracleNikkiJp_items'!R10C[-4],RC1,0,1,1)) ->  | N56: =T(OFFSET('[MiracleNikkiJp_items.csv]MiracleNikkiJp_items'!R10C[-4],RC1,0,1,1)) ->  | O56: =T(OFFSET('[MiracleNikkiJp_items.csv]MiracleNikkiJp_items'!R10C[-4],RC1,0,1,1)) ->  | P56: =T(OFFSET('[MiracleNikkiJp_items.csv]MiracleNikkiJp_items'!R10C[-4],RC1,0,1,1)) ->  | Q56: =T(OFFSET('[MiracleNikkiJp_items.csv]MiracleNikkiJp_items'!R10C[-4],RC1,0,1,1)) ->  | R56: =T(OFFSET('[MiracleNikkiJp_items.csv]MiracleNikkiJp_items'!R10C[-4],RC1,0,1,1)) ->  | S56: =T(OFFSET('[MiracleNikkiJp_items.csv]MiracleNikkiJp_items'!R10C[-4],RC1,0,1,1)) ->  | T56: =T(OFFSET('[MiracleNikkiJp_items.csv]MiracleNikkiJp_items'!R10C[-4],RC1,0,1,1)) ->  | U56: =T(OFFSET('[MiracleNikkiJp_items.csv]MiracleNikkiJp_items'!R10C[-4],RC1,0,1,1)) ->  | Y56: =T(OFFSET('[MiracleNikkiJp_items.csv]MiracleNikkiJp_items'!R10C[-7],RC1,0,1,1)) ->  | Z56: 5 | AA56: =IFERROR(VLOOKUP(RC[-16],R9C26:R17C36,2,FALSE),0)*R6C -> 0 | AB56: =IFERROR(VLOOKUP(RC[-16],R9C26:R17C36,3,FALSE),0)*R6C -> 0 | AC56: =IFERROR(VLOOKUP(RC[-16],R9C26:R17C36,4,FALSE),0)*R6C -> 0 | AD56: =IFERROR(VLOOKUP(RC[-16],R9C26:R17C36,5,FALSE),0)*R6C -> 0 | AE56: =IFERROR(VLOOKUP(RC[-16],R9C26:R17C36,6,FALSE),0)*R6C -> 0 | AF56: =IFERROR(VLOOKUP(RC[-16],R9C26:R17C36,7,FALSE),0)*R6C -> 0 | AG56: =IFERROR(VLOOKUP(RC[-16],R9C26:R17C36,8,FALSE),0)*R6C -> 0 | AH56: =IFERROR(VLOOKUP(RC[-16],R9C26:R17C36,9,FALSE),0)*R6C -> 0 | AI56: =IFERROR(VLOOKUP(RC[-16],R9C26:R17C36,10,FALSE),0)*R6C -> 0 | AJ56: =IFERROR(VLOOKUP(RC[-16],R9C26:R17C36,11,FALSE),0)*R6C -> 0 | AK56: =VLOOKUP(RC10,R9C38:R17C40,2,FALSE) -> 1 | AL56: =VLOOKUP(RC10,R9C38:R17C40,3,FALSE) -> 0 | AM56: =IF(OR(ISBLANK(R4C7),ISERROR(FIND(R4C7,RC21))),"　","●") ->  | AN56: =IF(OR(ISBLANK(R5C7),ISERROR(FIND(R5C7,RC21))),"　","●") ->  | AO56: =IF(RC39<>"●",VLOOKUP("評価しない",R9C42:R17C44,2,FALSE),VLOOKUP(R4C8,R9C42:R17C44,2,FALSE)) -> 1 | AP56: =IF(RC39<>"●",VLOOKUP("",R9C42:R17C44,3,FALSE),VLOOKUP(R4C8,R9C42:R17C44,3,FALSE)) -> 0 | AQ56: =IF(RC40<>"●",VLOOKUP("評価しない",R9C42:R17C44,2,FALSE),VLOOKUP(R5C8,R9C42:R17C44,2,FALSE)) -> 1 | AR56: =IF(RC40<>"●",VLOOKUP("",R9C42:R17C44,3,FALSE),VLOOKUP(R5C8,R9C42:R17C44,3,FALSE)) -> 0 | AS56: =IF(OR(ISBLANK(R6C7),ISERROR(FIND(R6C7,RC25))),"　","●") ->  | AT56: =IF(OR(ISBLANK(R7C7),ISERROR(FIND(R7C7,RC25))),"　","●") ->  | AU56: =IF(RC45<>"●",VLOOKUP("評価しない",R9C46:R17C48,2,FALSE),VLOOKUP(R6C8,R9C46:R17C48,2,FALSE)) -> 1 | AV56: =IF(RC45<>"●",VLOOKUP("",R9C46:R17C48,3,FALSE),VLOOKUP(R6C8,R9C46:R17C48,3,FALSE)) -> 0 | AW56: =IF(RC46<>"●",VLOOKUP("評価しない",R9C46:R17C48,2,FALSE),VLOOKUP(R7C8,R9C46:R17C48,2,FALSE)) -> 1 | AX56: =IF(RC46<>"●",VLOOKUP("",R9C46:R17C48,3,FALSE),VLOOKUP(R7C8,R9C46:R17C48,3,FALSE)) -> 0 | AY56: =SUM(RC27:RC36) -> 0 | AZ56: =RC37*RC41*RC43*RC47*RC49 -> 1 | BA56: =RC38+RC42+RC44+RC48+RC50 -> 0
A57: =OFFSET(R164C1,INT((RC26-1)/100),MOD(INT((RC26-1)/10),10),1,1)*10+MOD(RC26-1,10)+1 -> 6 | D57: =IF(AND(RC2<>"NG",OR(RC2<>"",RC3<>"",R9C4="×")),"◯","") ->  | E57: =IF(RC2="◯",RC6,"") ->  | F57: =T(OFFSET('[MiracleNikkiJp_items.csv]MiracleNikkiJp_items'!R10C[-3],RC1,0,1,1)) -> ヘアスタイル | G57: =T(OFFSET('[MiracleNikkiJp_items.csv]MiracleNikkiJp_items'!R10C[-2],RC1,0,1,1)) ->  | H57: =IF(RC4="",0,RC51*RC52+RC53) -> 0 | I57: =RC1 -> 6 | J57: =OFFSET('[MiracleNikkiJp_items.csv]MiracleNikkiJp_items'!R10C[-4],RC1,0,1,1) -> 0 | K57: =T(OFFSET('[MiracleNikkiJp_items.csv]MiracleNikkiJp_items'!R10C[-4],RC1,0,1,1)) ->  | L57: =T(OFFSET('[MiracleNikkiJp_items.csv]MiracleNikkiJp_items'!R10C[-4],RC1,0,1,1)) ->  | M57: =T(OFFSET('[MiracleNikkiJp_items.csv]MiracleNikkiJp_items'!R10C[-4],RC1,0,1,1)) ->  | N57: =T(OFFSET('[MiracleNikkiJp_items.csv]MiracleNikkiJp_items'!R10C[-4],RC1,0,1,1)) ->  | O57: =T(OFFSET('[MiracleNikkiJp_items.csv]MiracleNikkiJp_items'!R10C[-4],RC1,0,1,1)) ->  | P57: =T(OFFSET('[MiracleNikkiJp_items.csv]MiracleNikkiJp_items'!R10C[-4],RC1,0,1,1)) ->  | Q57: =T(OFFSET('[MiracleNikkiJp_items.csv]MiracleNikkiJp_items'!R10C[-4],RC1,0,1,1)) ->  | R57: =T(OFFSET('[MiracleNikkiJp_items.csv]MiracleNikkiJp_items'!R10C[-4],RC1,0,1,1)) ->  | S57: =T(OFFSET('[MiracleNikkiJp_items.csv]MiracleNikkiJp_items'!R10C[-4],RC1,0,1,1)) ->  | T57: =T(OFFSET('[MiracleNikkiJp_items.csv]MiracleNikkiJp_items'!R10C[-4],RC1,0,1,1)) ->  | U57: =T(OFFSET('[MiracleNikkiJp_items.csv]MiracleNikkiJp_items'!R10C[-4],RC1,0,1,1)) ->  | Y57: =T(OFFSET('[MiracleNikkiJp_items.csv]MiracleNikkiJp_items'!R10C[-7],RC1,0,1,1)) ->  | Z57: 6 | AA57: =IFERROR(VLOOKUP(RC[-16],R9C26:R17C36,2,FALSE),0)*R6C -> 0 | AB57: =IFERROR(VLOOKUP(RC[-16],R9C26:R17C36,3,FALSE),0)*R6C -> 0 | AC57: =IFERROR(VLOOKUP(RC[-16],R9C26:R17C36,4,FALSE),0)*R6C -> 0 | AD57: =IFERROR(VLOOKUP(RC[-16],R9C26:R17C36,5,FALSE),0)*R6C -> 0 | AE57: =IFERROR(VLOOKUP(RC[-16],R9C26:R17C36,6,FALSE),0)*R6C -> 0 | AF57: =IFERROR(VLOOKUP(RC[-16],R9C26:R17C36,7,FALSE),0)*R6C -> 0 | AG57: =IFERROR(VLOOKUP(RC[-16],R9C26:R17C36,8,FALSE),0)*R6C -> 0 | AH57: =IFERROR(VLOOKUP(RC[-16],R9C26:R17C36,9,FALSE),0)*R6C -> 0 | AI57: =IFERROR(VLOOKUP(RC[-16],R9C26:R17C36,10,FALSE),0)*R6C -> 0 | AJ57: =IFERROR(VLOOKUP(RC[-16],R9C26:R17C36,11,FALSE),0)*R6C -> 0 | AK57: =VLOOKUP(RC10,R9C38:R17C40,2,FALSE) -> 1 | AL57: =VLOOKUP(RC10,R9C38:R17C40,3,FALSE) -> 0 | AM57: =IF(OR(ISBLANK(R4C7),ISERROR(FIND(R4C7,RC21))),"　","●") ->  | AN57: =IF(OR(ISBLANK(R5C7),ISERROR(FIND(R5C7,RC21))),"　","●") ->  | AO57: =IF(RC39<>"●",VLOOKUP("評価しない",R9C42:R17C44,2,FALSE),VLOOKUP(R4C8,R9C42:R17C44,2,FALSE)) -> 1 | AP57: =IF(RC39<>"●",VLOOKUP("",R9C42:R17C44,3,FALSE),VLOOKUP(R4C8,R9C42:R17C44,3,FALSE)) -> 0 | AQ57: =IF(RC40<>"●",VLOOKUP("評価しない",R9C42:R17C44,2,FALSE),VLOOKUP(R5C8,R9C42:R17C44,2,FALSE)) -> 1 | AR57: =IF(RC40<>"●",VLOOKUP("",R9C42:R17C44,3,FALSE),VLOOKUP(R5C8,R9C42:R17C44,3,FALSE)) -> 0 | AS57: =IF(OR(ISBLANK(R6C7),ISERROR(FIND(R6C7,RC25))),"　","●") ->  | AT57: =IF(OR(ISBLANK(R7C7),ISERROR(FIND(R7C7,RC25))),"　","●") ->  | AU57: =IF(RC45<>"●",VLOOKUP("評価しない",R9C46:R17C48,2,FALSE),VLOOKUP(R6C8,R9C46:R17C48,2,FALSE)) -> 1 | AV57: =IF(RC45<>"●",VLOOKUP("",R9C46:R17C48,3,FALSE),VLOOKUP(R6C8,R9C46:R17C48,3,FALSE)) -> 0 | AW57: =IF(RC46<>"●",VLOOKUP("評価しない",R9C46:R17C48,2,FALSE),VLOOKUP(R7C8,R9C46:R17C48,2,FALSE)) -> 1 | AX57: =IF(RC46<>"●",VLOOKUP("",R9C46:R17C48,3,FALSE),VLOOKUP(R7C8,R9C46:R17C48,3,FALSE)) -> 0 | AY57: =SUM(RC27:RC36) -> 0 | AZ57: =RC37*RC41*RC43*RC47*RC49 -> 1 | BA57: =RC38+RC42+RC44+RC48+RC50 -> 0
A58: =OFFSET(R164C1,INT((RC26-1)/100),MOD(INT((RC26-1)/10),10),1,1)*10+MOD(RC26-1,10)+1 -> 7 | D58: =IF(AND(RC2<>"NG",OR(RC2<>"",RC3<>"",R9C4="×")),"◯","") ->  | E58: =IF(RC2="◯",RC6,"") ->  | F58: =T(OFFSET('[MiracleNikkiJp_items.csv]MiracleNikkiJp_items'!R10C[-3],RC1,0,1,1)) -> ヘアスタイル | G58: =T(OFFSET('[MiracleNikkiJp_items.csv]MiracleNikkiJp_items'!R10C[-2],RC1,0,1,1)) ->  | H58: =IF(RC4="",0,RC51*RC52+RC53) -> 0 | I58: =RC1 -> 7 | J58: =OFFSET('[MiracleNikkiJp_items.csv]MiracleNikkiJp_items'!R10C[-4],RC1,0,1,1) -> 0 | K58: =T(OFFSET('[MiracleNikkiJp_items.csv]MiracleNikkiJp_items'!R10C[-4],RC1,0,1,1)) ->  | L58: =T(OFFSET('[MiracleNikkiJp_items.csv]MiracleNikkiJp_items'!R10C[-4],RC1,0,1,1)) ->  | M58: =T(OFFSET('[MiracleNikkiJp_items.csv]MiracleNikkiJp_items'!R10C[-4],RC1,0,1,1)) ->  | N58: =T(OFFSET('[MiracleNikkiJp_items.csv]MiracleNikkiJp_items'!R10C[-4],RC1,0,1,1)) ->  | O58: =T(OFFSET('[MiracleNikkiJp_items.csv]MiracleNikkiJp_items'!R10C[-4],RC1,0,1,1)) ->  | P58: =T(OFFSET('[MiracleNikkiJp_items.csv]MiracleNikkiJp_items'!R10C[-4],RC1,0,1,1)) ->  | Q58: =T(OFFSET('[MiracleNikkiJp_items.csv]MiracleNikkiJp_items'!R10C[-4],RC1,0,1,1)) ->  | R58: =T(OFFSET('[MiracleNikkiJp_items.csv]MiracleNikkiJp_items'!R10C[-4],RC1,0,1,1)) ->  | S58: =T(OFFSET('[MiracleNikkiJp_items.csv]MiracleNikkiJp_items'!R10C[-4],RC1,0,1,1)) ->  | T58: =T(OFFSET('[MiracleNikkiJp_items.csv]MiracleNikkiJp_items'!R10C[-4],RC1,0,1,1)) ->  | U58: =T(OFFSET('[MiracleNikkiJp_items.csv]MiracleNikkiJp_items'!R10C[-4],RC1,0,1,1)) ->  | Y58: =T(OFFSET('[MiracleNikkiJp_items.csv]MiracleNikkiJp_items'!R10C[-7],RC1,0,1,1)) ->  | Z58: 7 | AA58: =IFERROR(VLOOKUP(RC[-16],R9C26:R17C36,2,FALSE),0)*R6C -> 0 | AB58: =IFERROR(VLOOKUP(RC[-16],R9C26:R17C36,3,FALSE),0)*R6C -> 0 | AC58: =IFERROR(VLOOKUP(RC[-16],R9C26:R17C36,4,FALSE),0)*R6C -> 0 | AD58: =IFERROR(VLOOKUP(RC[-16],R9C26:R17C36,5,FALSE),0)*R6C -> 0 | AE58: =IFERROR(VLOOKUP(RC[-16],R9C26:R17C36,6,FALSE),0)*R6C -> 0 | AF58: =IFERROR(VLOOKUP(RC[-16],R9C26:R17C36,7,FALSE),0)*R6C -> 0 | AG58: =IFERROR(VLOOKUP(RC[-16],R9C26:R17C36,8,FALSE),0)*R6C -> 0 | AH58: =IFERROR(VLOOKUP(RC[-16],R9C26:R17C36,9,FALSE),0)*R6C -> 0 | AI58: =IFERROR(VLOOKUP(RC[-16],R9C26:R17C36,10,FALSE),0)*R6C -> 0 | AJ58: =IFERROR(VLOOKUP(RC[-16],R9C26:R17C36,11,FALSE),0)*R6C -> 0 | AK58: =VLOOKUP(RC10,R9C38:R17C40,2,FALSE) -> 1 | AL58: =VLOOKUP(RC10,R9C38:R17C40,3,FALSE) -> 0 | AM58: =IF(OR(ISBLANK(R4C7),ISERROR(FIND(R4C7,RC21))),"　","●") ->  | AN58: =IF(OR(ISBLANK(R5C7),ISERROR(FIND(R5C7,RC21))),"　","●") ->  | AO58: =IF(RC39<>"●",VLOOKUP("評価しない",R9C42:R17C44,2,FALSE),VLOOKUP(R4C8,R9C42:R17C44,2,FALSE)) -> 1 | AP58: =IF(RC39<>"●",VLOOKUP("",R9C42:R17C44,3,FALSE),VLOOKUP(R4C8,R9C42:R17C44,3,FALSE)) -> 0 | AQ58: =IF(RC40<>"●",VLOOKUP("評価しない",R9C42:R17C44,2,FALSE),VLOOKUP(R5C8,R9C42:R17C44,2,FALSE)) -> 1 | AR58: =IF(RC40<>"●",VLOOKUP("",R9C42:R17C44,3,FALSE),VLOOKUP(R5C8,R9C42:R17C44,3,FALSE)) -> 0 | AS58: =IF(OR(ISBLANK(R6C7),ISERROR(FIND(R6C7,RC25))),"　","●") ->  | AT58: =IF(OR(ISBLANK(R7C7),ISERROR(FIND(R7C7,RC25))),"　","●") ->  | AU58: =IF(RC45<>"●",VLOOKUP("評価しない",R9C46:R17C48,2,FALSE),VLOOKUP(R6C8,R9C46:R17C48,2,FALSE)) -> 1 | AV58: =IF(RC45<>"●",VLOOKUP("",R9C46:R17C48,3,FALSE),VLOOKUP(R6C8,R9C46:R17C48,3,FALSE)) -> 0 | AW58: =IF(RC46<>"●",VLOOKUP("評価しない",R9C46:R17C48,2,FALSE),VLOOKUP(R7C8,R9C46:R17C48,2,FALSE)) -> 1 | AX58: =IF(RC46<>"●",VLOOKUP("",R9C46:R17C48,3,FALSE),VLOOKUP(R7C8,R9C46:R17C48,3,FALSE)) -> 0 | AY58: =SUM(RC27:RC36) -> 0 | AZ58: =RC37*RC41*RC43*RC47*RC49 -> 1 | BA58: =RC38+RC42+RC44+RC48+RC50 -> 0
A59: =OFFSET(R164C1,INT((RC26-1)/100),MOD(INT((RC26-1)/10),10),1,1)*10+MOD(RC26-1,10)+1 -> 8 | D59: =IF(AND(RC2<>"NG",OR(RC2<>"",RC3<>"",R9C4="×")),"◯","") ->  | E59: =IF(RC2="◯",RC6,"") ->  | F59: =T(OFFSET('[MiracleNikkiJp_items.csv]MiracleNikkiJp_items'!R10C[-3],RC1,0,1,1)) -> ヘアスタイル | G59: =T(OFFSET('[MiracleNikkiJp_items.csv]MiracleNikkiJp_items'!R10C[-2],RC1,0,1,1)) ->  | H59: =IF(RC4="",0,RC51*RC52+RC53) -> 0 | I59: =RC1 -> 8 | J59: =OFFSET('[MiracleNikkiJp_items.csv]MiracleNikkiJp_items'!R10C[-4],RC1,0,1,1) -> 0 | K59: =T(OFFSET('[MiracleNikkiJp_items.csv]MiracleNikkiJp_items'!R10C[-4],RC1,0,1,1)) ->  | L59: =T(OFFSET('[MiracleNikkiJp_items.csv]MiracleNikkiJp_items'!R10C[-4],RC1,0,1,1)) ->  | M59: =T(OFFSET('[MiracleNikkiJp_items.csv]MiracleNikkiJp_items'!R10C[-4],RC1,0,1,1)) ->  | N59: =T(OFFSET('[MiracleNikkiJp_items.csv]MiracleNikkiJp_items'!R10C[-4],RC1,0,1,1)) ->  | O59: =T(OFFSET('[MiracleNikkiJp_items.csv]MiracleNikkiJp_items'!R10C[-4],RC1,0,1,1)) ->  | P59: =T(OFFSET('[MiracleNikkiJp_items.csv]MiracleNikkiJp_items'!R10C[-4],RC1,0,1,1)) ->  | Q59: =T(OFFSET('[MiracleNikkiJp_items.csv]MiracleNikkiJp_items'!R10C[-4],RC1,0,1,1)) ->  | R59: =T(OFFSET('[MiracleNikkiJp_items.csv]MiracleNikkiJp_items'!R10C[-4],RC1,0,1,1)) ->  | S59: =T(OFFSET('[MiracleNikkiJp_items.csv]MiracleNikkiJp_items'!R10C[-4],RC1,0,1,1)) ->  | T59: =T(OFFSET('[MiracleNikkiJp_items.csv]MiracleNikkiJp_items'!R10C[-4],RC1,0,1,1)) ->  | U59: =T(OFFSET('[MiracleNikkiJp_items.csv]MiracleNikkiJp_items'!R10C[-4],RC1,0,1,1)) ->  | Y59: =T(OFFSET('[MiracleNikkiJp_items.csv]MiracleNikkiJp_items'!R10C[-7],RC1,0,1,1)) ->  | Z59: 8 | AA59: =IFERROR(VLOOKUP(RC[-16],R9C26:R17C36,2,FALSE),0)*R6C -> 0 | AB59: =IFERROR(VLOOKUP(RC[-16],R9C26:R17C36,3,FALSE),0)*R6C -> 0 | AC59: =IFERROR(VLOOKUP(RC[-16],R9C26:R17C36,4,FALSE),0)*R6C -> 0 | AD59: =IFERROR(VLOOKUP(RC[-16],R9C26:R17C36,5,FALSE),0)*R6C -> 0 | AE59: =IFERROR(VLOOKUP(RC[-16],R9C26:R17C36,6,FALSE),0)*R6C -> 0 | AF59: =IFERROR(VLOOKUP(RC[-16],R9C26:R17C36,7,FALSE),0)*R6C -> 0 | AG59: =IFERROR(VLOOKUP(RC[-16],R9C26:R17C36,8,FALSE),0)*R6C -> 0 | AH59: =IFERROR(VLOOKUP(RC[-16],R9C26:R17C36,9,FALSE),0)*R6C -> 0 | AI59: =IFERROR(VLOOKUP(RC[-16],R9C26:R17C36,10,FALSE),0)*R6C -> 0 | AJ59: =IFERROR(VLOOKUP(RC[-16],R9C26:R17C36,11,FALSE),0)*R6C -> 0 | AK59: =VLOOKUP(RC10,R9C38:R17C40,2,FALSE) -> 1 | AL59: =VLOOKUP(RC10,R9C38:R17C40,3,FALSE) -> 0 | AM59: =IF(OR(ISBLANK(R4C7),ISERROR(FIND(R4C7,RC21))),"　","●") ->  | AN59: =IF(OR(ISBLANK(R5C7),ISERROR(FIND(R5C7,RC21))),"　","●") ->  | AO59: =IF(RC39<>"●",VLOOKUP("評価しない",R9C42:R17C44,2,FALSE),VLOOKUP(R4C8,R9C42:R17C44,2,FALSE)) -> 1 | AP59: =IF(RC39<>"●",VLOOKUP("",R9C42:R17C44,3,FALSE),VLOOKUP(R4C8,R9C42:R17C44,3,FALSE)) -> 0 | AQ59: =IF(RC40<>"●",VLOOKUP("評価しない",R9C42:R17C44,2,FALSE),VLOOKUP(R5C8,R9C42:R17C44,2,FALSE)) -> 1 | AR59: =IF(RC40<>"●",VLOOKUP("",R9C42:R17C44,3,FALSE),VLOOKUP(R5C8,R9C42:R17C44,3,FALSE)) -> 0 | AS59: =IF(OR(ISBLANK(R6C7),ISERROR(FIND(R6C7,RC25))),"　","●") ->  | AT59: =IF(OR(ISBLANK(R7C7),ISERROR(FIND(R7C7,RC25))),"　","●") ->  | AU59: =IF(RC45<>"●",VLOOKUP("評価しない",R9C46:R17C48,2,FALSE),VLOOKUP(R6C8,R9C46:R17C48,2,FALSE)) -> 1 | AV59: =IF(RC45<>"●",VLOOKUP("",R9C46:R17C48,3,FALSE),VLOOKUP(R6C8,R9C46:R17C48,3,FALSE)) -> 0 | AW59: =IF(RC46<>"●",VLOOKUP("評価しない",R9C46:R17C48,2,FALSE),VLOOKUP(R7C8,R9C46:R17C48,2,FALSE)) -> 1 | AX59: =IF(RC46<>"●",VLOOKUP("",R9C46:R17C48,3,FALSE),VLOOKUP(R7C8,R9C46:R17C48,3,FALSE)) -> 0 | AY59: =SUM(RC27:RC36) -> 0 | AZ59: =RC37*RC41*RC43*RC47*RC49 -> 1 | BA59: =RC38+RC42+RC44+RC48+RC50 -> 0
A60: =OFFSET(R164C1,INT((RC26-1)/100),MOD(INT((RC26-1)/10),10),1,1)*10+MOD(RC26-1,10)+1 -> 9 | D60: =IF(AND(RC2<>"NG",OR(RC2<>"",RC3<>"",R9C4="×")),"◯","") ->  | E60: =IF(RC2="◯",RC6,"") ->  | F60: =T(OFFSET('[MiracleNikkiJp_items.csv]MiracleNikkiJp_items'!R10C[-3],RC1,0,1,1)) -> ヘアスタイル | G60: =T(OFFSET('[MiracleNikkiJp_items.csv]MiracleNikkiJp_items'!R10C[-2],RC1,0,1,1)) ->  | H60: =IF(RC4="",0,RC51*RC52+RC53) -> 0 | I60: =RC1 -> 9 | J60: =OFFSET('[MiracleNikkiJp_items.csv]MiracleNikkiJp_items'!R10C[-4],RC1,0,1,1) -> 0 | K60: =T(OFFSET('[MiracleNikkiJp_items.csv]MiracleNikkiJp_items'!R10C[-4],RC1,0,1,1)) ->  | L60: =T(OFFSET('[MiracleNikkiJp_items.csv]MiracleNikkiJp_items'!R10C[-4],RC1,0,1,1)) ->  | M60: =T(OFFSET('[MiracleNikkiJp_items.csv]MiracleNikkiJp_items'!R10C[-4],RC1,0,1,1)) ->  | N60: =T(OFFSET('[MiracleNikkiJp_items.csv]MiracleNikkiJp_items'!R10C[-4],RC1,0,1,1)) ->  | O60: =T(OFFSET('[MiracleNikkiJp_items.csv]MiracleNikkiJp_items'!R10C[-4],RC1,0,1,1)) ->  | P60: =T(OFFSET('[MiracleNikkiJp_items.csv]MiracleNikkiJp_items'!R10C[-4],RC1,0,1,1)) ->  | Q60: =T(OFFSET('[MiracleNikkiJp_items.csv]MiracleNikkiJp_items'!R10C[-4],RC1,0,1,1)) ->  | R60: =T(OFFSET('[MiracleNikkiJp_items.csv]MiracleNikkiJp_items'!R10C[-4],RC1,0,1,1)) ->  | S60: =T(OFFSET('[MiracleNikkiJp_items.csv]MiracleNikkiJp_items'!R10C[-4],RC1,0,1,1)) ->  | T60: =T(OFFSET('[MiracleNikkiJp_items.csv]MiracleNikkiJp_items'!R10C[-4],RC1,0,1,1)) ->  | U60: =T(OFFSET('[MiracleNikkiJp_items.csv]MiracleNikkiJp_items'!R10C[-4],RC1,0,1,1)) ->  | Y60: =T(OFFSET('[MiracleNikkiJp_items.csv]MiracleNikkiJp_items'!R10C[-7],RC1,0,1,1)) ->  | Z60: 9 | AA60: =IFERROR(VLOOKUP(RC[-16],R9C26:R17C36,2,FALSE),0)*R6C -> 0 | AB60: =IFERROR(VLOOKUP(RC[-16],R9C26:R17C36,3,FALSE),0)*R6C -> 0 | AC60: =IFERROR(VLOOKUP(RC[-16],R9C26:R17C36,4,FALSE),0)*R6C -> 0 | AD60: =IFERROR(VLOOKUP(RC[-16],R9C26:R17C36,5,FALSE),0)*R6C -> 0 | AE60: =IFERROR(VLOOKUP(RC[-16],R9C26:R17C36,6,FALSE),0)*R6C -> 0 | AF60: =IFERROR(VLOOKUP(RC[-16],R9C26:R17C36,7,FALSE),0)*R6C -> 0 | AG60: =IFERROR(VLOOKUP(RC[-16],R9C26:R17C36,8,FALSE),0)*R6C -> 0 | AH60: =IFERROR(VLOOKUP(RC[-16],R9C26:R17C36,9,FALSE),0)*R6C -> 0 | AI60: =IFERROR(VLOOKUP(RC[-16],R9C26:R17C36,10,FALSE),0)*R6C -> 0 | AJ60: =IFERROR(VLOOKUP(RC[-16],R9C26:R17C36,11,FALSE),0)*R6C -> 0 | AK60: =VLOOKUP(RC10,R9C38:R17C40,2,FALSE) -> 1 | AL60: =VLOOKUP(RC10,R9C38:R17C40,3,FALSE) -> 0 | AM60: =IF(OR(ISBLANK(R4C7),ISERROR(FIND(R4C7,RC21))),"　","●") ->  | AN60: =IF(OR(ISBLANK(R5C7),ISERROR(FIND(R5C7,RC21))),"　","●") ->  | AO60: =IF(RC39<>"●",VLOOKUP("評価しない",R9C42:R17C44,2,FALSE),VLOOKUP(R4C8,R9C42:R17C44,2,FALSE)) -> 1 | AP60: =IF(RC39<>"●",VLOOKUP("",R9C42:R17C44,3,FALSE),VLOOKUP(R4C8,R9C42:R17C44,3,FALSE)) -> 0 | AQ60: =IF(RC40<>"●",VLOOKUP("評価しない",R9C42:R17C44,2,FALSE),VLOOKUP(R5C8,R9C42:R17C44,2,FALSE)) -> 1 | AR60: =IF(RC40<>"●",VLOOKUP("",R9C42:R17C44,3,FALSE),VLOOKUP(R5C8,R9C42:R17C44,3,FALSE)) -> 0 | AS60: =IF(OR(ISBLANK(R6C7),ISERROR(FIND(R6C7,RC25))),"　","●") ->  | AT60: =IF(OR(ISBLANK(R7C7),ISERROR(FIND(R7C7,RC25))),"　","●") ->  | AU60: =IF(RC45<>"●",VLOOKUP("評価しない",R9C46:R17C48,2,FALSE),VLOOKUP(R6C8,R9C46:R17C48,2,FALSE)) -> 1 | AV60: =IF(RC45<>"●",VLOOKUP("",R9C46:R17C48,3,FALSE),VLOOKUP(R6C8,R9C46:R17C48,3,FALSE)) -> 0 | AW60: =IF(RC46<>"●",VLOOKUP("評価しない",R9C46:R17C48,2,FALSE),VLOOKUP(R7C8,R9C46:R17C48,2,FALSE)) -> 1 | AX60: =IF(RC46<>"●",VLOOKUP("",R9C46:R17C48,3,FALSE),VLOOKUP(R7C8,R9C46:R17C48,3,FALSE)) -> 0 | AY60: =SUM(RC27:RC36) -> 0 | AZ60: =RC37*RC41*RC43*RC47*RC49 -> 1 | BA60: =RC38+RC42+RC44+RC48+RC50 -> 0
A61: =OFFSET(R164C1,INT((RC26-1)/100),MOD(INT((RC26-1)/10),10),1,1)*10+MOD(RC26-1,10)+1 -> 10 | D61: =IF(AND(RC2<>"NG",OR(RC2<>"",RC3<>"",R9C4="×")),"◯","") ->  | E61: =IF(RC2="◯",RC6,"") ->  | F61: =T(OFFSET('[MiracleNikkiJp_items.csv]MiracleNikkiJp_items'!R10C[-3],RC1,0,1,1)) -> ヘアスタイル | G61: =T(OFFSET('[MiracleNikkiJp_items.csv]MiracleNikkiJp_items'!R10C[-2],RC1,0,1,1)) ->  | H61: =IF(RC4="",0,RC51*RC52+RC53) -> 0 | I61: =RC1 -> 10 | J61: =OFFSET('[MiracleNikkiJp_items.csv]MiracleNikkiJp_items'!R10C[-4],RC1,0,1,1) -> 0 | K61: =T(OFFSET('[MiracleNikkiJp_items.csv]MiracleNikkiJp_items'!R10C[-4],RC1,0,1,1)) ->  | L61: =T(OFFSET('[MiracleNikkiJp_items.csv]MiracleNikkiJp_items'!R10C[-4],RC1,0,1,1)) ->  | M61: =T(OFFSET('[MiracleNikkiJp_items.csv]MiracleNikkiJp_items'!R10C[-4],RC1,0,1,1)) ->  | N61: =T(OFFSET('[MiracleNikkiJp_items.csv]MiracleNikkiJp_items'!R10C[-4],RC1,0,1,1)) ->  | O61: =T(OFFSET('[MiracleNikkiJp_items.csv]MiracleNikkiJp_items'!R10C[-4],RC1,0,1,1)) ->  | P61: =T(OFFSET('[MiracleNikkiJp_items.csv]MiracleNikkiJp_items'!R10C[-4],RC1,0,1,1)) ->  | Q61: =T(OFFSET('[MiracleNikkiJp_items.csv]MiracleNikkiJp_items'!R10C[-4],RC1,0,1,1)) ->  | R61: =T(OFFSET('[MiracleNikkiJp_items.csv]MiracleNikkiJp_items'!R10C[-4],RC1,0,1,1)) ->  | S61: =T(OFFSET('[MiracleNikkiJp_items.csv]MiracleNikkiJp_items'!R10C[-4],RC1,0,1,1)) ->  | T61: =T(OFFSET('[MiracleNikkiJp_items.csv]MiracleNikkiJp_items'!R10C[-4],RC1,0,1,1)) ->  | U61: =T(OFFSET('[MiracleNikkiJp_items.csv]MiracleNikkiJp_items'!R10C[-4],RC1,0,1,1)) ->  | Y61: =T(OFFSET('[MiracleNikkiJp_items.csv]MiracleNikkiJp_items'!R10C[-7],RC1,0,1,1)) ->  | Z61: 10 | AA61: =IFERROR(VLOOKUP(RC[-16],R9C26:R17C36,2,FALSE),0)*R6C -> 0 | AB61: =IFERROR(VLOOKUP(RC[-16],R9C26:R17C36,3,FALSE),0)*R6C -> 0 | AC61: =IFERROR(VLOOKUP(RC[-16],R9C26:R17C36,4,FALSE),0)*R6C -> 0 | AD61: =IFERROR(VLOOKUP(RC[-16],R9C26:R17C36,5,FALSE),0)*R6C -> 0 | AE61: =IFERROR(VLOOKUP(RC[-16],R9C26:R17C36,6,FALSE),0)*R6C -> 0 | AF61: =IFERROR(VLOOKUP(RC[-16],R9C26:R17C36,7,FALSE),0)*R6C -> 0 | AG61: =IFERROR(VLOOKUP(RC[-16],R9C26:R17C36,8,FALSE),0)*R6C -> 0 | AH61: =IFERROR(VLOOKUP(RC[-16],R9C26:R17C36,9,FALSE),0)*R6C -> 0 | AI61: =IFERROR(VLOOKUP(RC[-16],R9C26:R17C36,10,FALSE),0)*R6C -> 0 | AJ61: =IFERROR(VLOOKUP(RC[-16],R9C26:R17C36,11,FALSE),0)*R6C -> 0 | AK61: =VLOOKUP(RC10,R9C38:R17C40,2,FALSE) -> 1 | AL61: =VLOOKUP(RC10,R9C38:R17C40,3,FALSE) -> 0 | AM61: =IF(OR(ISBLANK(R4C7),ISERROR(FIND(R4C7,RC21))),"　","●") ->  | AN61: =IF(OR(ISBLANK(R5C7),ISERROR(FIND(R5C7,RC21))),"　","●") ->  | AO61: =IF(RC39<>"●",VLOOKUP("評価しない",R9C42:R17C44,2,FALSE),VLOOKUP(R4C8,R9C42:R17C44,2,FALSE)) -> 1 | AP61: =IF(RC39<>"●",VLOOKUP("",R9C42:R17C44,3,FALSE),VLOOKUP(R4C8,R9C42:R17C44,3,FALSE)) -> 0 | AQ61: =IF(RC40<>"●",VLOOKUP("評価しない",R9C42:R17C44,2,FALSE),VLOOKUP(R5C8,R9C42:R17C44,2,FALSE)) -> 1 | AR61: =IF(RC40<>"●",VLOOKUP("",R9C42:R17C44,3,FALSE),VLOOKUP(R5C8,R9C42:R17C44,3,FALSE)) -> 0 | AS61: =IF(OR(ISBLANK(R6C7),ISERROR(FIND(R6C7,RC25))),"　","●") ->  | AT61: =IF(OR(ISBLANK(R7C7),ISERROR(FIND(R7C7,RC25))),"　","●") ->  | AU61: =IF(RC45<>"●",VLOOKUP("評価しない",R9C46:R17C48,2,FALSE),VLOOKUP(R6C8,R9C46:R17C48,2,FALSE)) -> 1 | AV61: =IF(RC45<>"●",VLOOKUP("",R9C46:R17C48,3,FALSE),VLOOKUP(R6C8,R9C46:R17C48,3,FALSE)) -> 0 | AW61: =IF(RC46<>"●",VLOOKUP("評価しない",R9C46:R17C48,2,FALSE),VLOOKUP(R7C8,R9C46:R17C48,2,FALSE)) -> 1 | AX61: =IF(RC46<>"●",VLOOKUP("",R9C46:R17C48,3,FALSE),VLOOKUP(R7C8,R9C46:R17C48,3,FALSE)) -> 0 | AY61: =SUM(RC27:RC36) -> 0 | AZ61: =RC37*RC41*RC43*RC47*RC49 -> 1 | BA61: =RC38+RC42+RC44+RC48+RC50 -> 0
A62: =OFFSET(R164C1,INT((RC26-1)/100),MOD(INT((RC26-1)/10),10),1,1)*10+MOD(RC26-1,10)+1 -> 11 | D62: =IF(AND(RC2<>"NG",OR(RC2<>"",RC3<>"",R9C4="×")),"◯","") ->  | E62: =IF(RC2="◯",RC6,"") ->  | F62: =T(OFFSET('[MiracleNikkiJp_items.csv]MiracleNikkiJp_items'!R10C[-3],RC1,0,1,1)) -> ヘアスタイル | G62: =T(OFFSET('[MiracleNikkiJp_items.csv]MiracleNikkiJp_items'!R10C[-2],RC1,0,1,1)) ->  | H62: =IF(RC4="",0,RC51*RC52+RC53) -> 0 | I62: =RC1 -> 11 | J62: =OFFSET('[MiracleNikkiJp_items.csv]MiracleNikkiJp_items'!R10C[-4],RC1,0,1,1) -> 0 | K62: =T(OFFSET('[MiracleNikkiJp_items.csv]MiracleNikkiJp_items'!R10C[-4],RC1,0,1,1)) ->  | L62: =T(OFFSET('[MiracleNikkiJp_items.csv]MiracleNikkiJp_items'!R10C[-4],RC1,0,1,1)) ->  | M62: =T(OFFSET('[MiracleNikkiJp_items.csv]MiracleNikkiJp_items'!R10C[-4],RC1,0,1,1)) ->  | N62: =T(OFFSET('[MiracleNikkiJp_items.csv]MiracleNikkiJp_items'!R10C[-4],RC1,0,1,1)) ->  | O62: =T(OFFSET('[MiracleNikkiJp_items.csv]MiracleNikkiJp_items'!R10C[-4],RC1,0,1,1)) ->  | P62: =T(OFFSET('[MiracleNikkiJp_items.csv]MiracleNikkiJp_items'!R10C[-4],RC1,0,1,1)) ->  | Q62: =T(OFFSET('[MiracleNikkiJp_items.csv]MiracleNikkiJp_items'!R10C[-4],RC1,0,1,1)) ->  | R62: =T(OFFSET('[MiracleNikkiJp_items.csv]MiracleNikkiJp_items'!R10C[-4],RC1,0,1,1)) ->  | S62: =T(OFFSET('[MiracleNikkiJp_items.csv]MiracleNikkiJp_items'!R10C[-4],RC1,0,1,1)) ->  | T62: =T(OFFSET('[MiracleNikkiJp_items.csv]MiracleNikkiJp_items'!R10C[-4],RC1,0,1,1)) ->  | U62: =T(OFFSET('[MiracleNikkiJp_items.csv]MiracleNikkiJp_items'!R10C[-4],RC1,0,1,1)) ->  | Y62: =T(OFFSET('[MiracleNikkiJp_items.csv]MiracleNikkiJp_items'!R10C[-7],RC1,0,1,1)) ->  | Z62: 11 | AA62: =IFERROR(VLOOKUP(RC[-16],R9C26:R17C36,2,FALSE),0)*R6C -> 0 | AB62: =IFERROR(VLOOKUP(RC[-16],R9C26:R17C36,3,FALSE),0)*R6C -> 0 | AC62: =IFERROR(VLOOKUP(RC[-16],R9C26:R17C36,4,FALSE),0)*R6C -> 0 | AD62: =IFERROR(VLOOKUP(RC[-16],R9C26:R17C36,5,FALSE),0)*R6C -> 0 | AE62: =IFERROR(VLOOKUP(RC[-16],R9C26:R17C36,6,FALSE),0)*R6C -> 0 | AF62: =IFERROR(VLOOKUP(RC[-16],R9C26:R17C36,7,FALSE),0)*R6C -> 0 | AG62: =IFERROR(VLOOKUP(RC[-16],R9C26:R17C36,8,FALSE),0)*R6C -> 0 | AH62: =IFERROR(VLOOKUP(RC[-16],R9C26:R17C36,9,FALSE),0)*R6C -> 0 | AI62: =IFERROR(VLOOKUP(RC[-16],R9C26:R17C36,10,FALSE),0)*R6C -> 0 | AJ62: =IFERROR(VLOOKUP(RC[-16],R9C26:R17C36,11,FALSE),0)*R6C -> 0 | AK62: =VLOOKUP(RC10,R9C38:R17C40,2,FALSE) -> 1 | AL62: =VLOOKUP(RC10,R9C38:R17C40,3,FALSE) -> 0 | AM62: =IF(OR(ISBLANK(R4C7),ISERROR(FIND(R4C7,RC21))),"　","●") ->  | AN62: =IF(OR(ISBLANK(R5C7),ISERROR(FIND(R5C7,RC21))),"　","●") ->  | AO62: =IF(RC39<>"●",VLOOKUP("評価しない",R9C42:R17C44,2,FALSE),VLOOKUP(R4C8,R9C42:R17C44,2,FALSE)) -> 1 | AP62: =IF(RC39<>"●",VLOOKUP("",R9C42:R17C44,3,FALSE),VLOOKUP(R4C8,R9C42:R17C44,3,FALSE)) -> 0 | AQ62: =IF(RC40<>"●",VLOOKUP("評価しない",R9C42:R17C44,2,FALSE),VLOOKUP(R5C8,R9C42:R17C44,2,FALSE)) -> 1 | AR62: =IF(RC40<>"●",VLOOKUP("",R9C42:R17C44,3,FALSE),VLOOKUP(R5C8,R9C42:R17C44,3,FALSE)) -> 0 | AS62: =IF(OR(ISBLANK(R6C7),ISERROR(FIND(R6C7,RC25))),"　","●") ->  | AT62: =IF(OR(ISBLANK(R7C7),ISERROR(FIND(R7C7,RC25))),"　","●") ->  | AU62: =IF(RC45<>"●",VLOOKUP("評価しない",R9C46:R17C48,2,FALSE),VLOOKUP(R6C8,R9C46:R17C48,2,FALSE)) -> 1 | AV62: =IF(RC45<>"●",VLOOKUP("",R9C46:R17C48,3,FALSE),VLOOKUP(R6C8,R9C46:R17C48,3,FALSE)) -> 0 | AW62: =IF(RC46<>"●",VLOOKUP("評価しない",R9C46:R17C48,2,FALSE),VLOOKUP(R7C8,R9C46:R17C48,2,FALSE)) -> 1 | AX62: =IF(RC46<>"●",VLOOKUP("",R9C46:R17C48,3,FALSE),VLOOKUP(R7C8,R9C46:R17C48,3,FALSE)) -> 0 | AY62: =SUM(RC27:RC36) -> 0 | AZ62: =RC37*RC41*RC43*RC47*RC49 -> 1 | BA62: =RC38+RC42+RC44+RC48+RC50 -> 0
A63: =OFFSET(R164C1,INT((RC26-1)/100),MOD(INT((RC26-1)/10),10),1,1)*10+MOD(RC26-1,10)+1 -> 12 | D63: =IF(AND(RC2<>"NG",OR(RC2<>"",RC3<>"",R9C4="×")),"◯","") ->  | E63: =IF(RC2="◯",RC6,"") ->  | F63: =T(OFFSET('[MiracleNikkiJp_items.csv]MiracleNikkiJp_items'!R10C[-3],RC1,0,1,1)) -> ヘアスタイル | G63: =T(OFFSET('[MiracleNikkiJp_items.csv]MiracleNikkiJp_items'!R10C[-2],RC1,0,1,1)) ->  | H63: =IF(RC4="",0,RC51*RC52+RC53) -> 0 | I63: =RC1 -> 12 | J63: =OFFSET('[MiracleNikkiJp_items.csv]MiracleNikkiJp_items'!R10C[-4],RC1,0,1,1) -> 0 | K63: =T(OFFSET('[MiracleNikkiJp_items.csv]MiracleNikkiJp_items'!R10C[-4],RC1,0,1,1)) ->  | L63: =T(OFFSET('[MiracleNikkiJp_items.csv]MiracleNikkiJp_items'!R10C[-4],RC1,0,1,1)) ->  | M63: =T(OFFSET('[MiracleNikkiJp_items.csv]MiracleNikkiJp_items'!R10C[-4],RC1,0,1,1)) ->  | N63: =T(OFFSET('[MiracleNikkiJp_items.csv]MiracleNikkiJp_items'!R10C[-4],RC1,0,1,1)) ->  | O63: =T(OFFSET('[MiracleNikkiJp_items.csv]MiracleNikkiJp_items'!R10C[-4],RC1,0,1,1)) ->  | P63: =T(OFFSET('[MiracleNikkiJp_items.csv]MiracleNikkiJp_items'!R10C[-4],RC1,0,1,1)) ->  | Q63: =T(OFFSET('[MiracleNikkiJp_items.csv]MiracleNikkiJp_items'!R10C[-4],RC1,0,1,1)) ->  | R63: =T(OFFSET('[MiracleNikkiJp_items.csv]MiracleNikkiJp_items'!R10C[-4],RC1,0,1,1)) ->  | S63: =T(OFFSET('[MiracleNikkiJp_items.csv]MiracleNikkiJp_items'!R10C[-4],RC1,0,1,1)) ->  | T63: =T(OFFSET('[MiracleNikkiJp_items.csv]MiracleNikkiJp_items'!R10C[-4],RC1,0,1,1)) ->  | U63: =T(OFFSET('[MiracleNikkiJp_items.csv]MiracleNikkiJp_items'!R10C[-4],RC1,0,1,1)) ->  | Y63: =T(OFFSET('[MiracleNikkiJp_items.csv]MiracleNikkiJp_items'!R10C[-7],RC1,0,1,1)) ->  | Z63: 12 | AA63: =IFERROR(VLOOKUP(RC[-16],R9C26:R17C36,2,FALSE),0)*R6C -> 0 | AB63: =IFERROR(VLOOKUP(RC[-16],R9C26:R17C36,3,FALSE),0)*R6C -> 0 | AC63: =IFERROR(VLOOKUP(RC[-16],R9C26:R17C36,4,FALSE),0)*R6C -> 0 | AD63: =IFERROR(VLOOKUP(RC[-16],R9C26:R17C36,5,FALSE),0)*R6C -> 0 | AE63: =IFERROR(VLOOKUP(RC[-16],R9C26:R17C36,6,FALSE),0)*R6C -> 0 | AF63: =IFERROR(VLOOKUP(RC[-16],R9C26:R17C36,7,FALSE),0)*R6C -> 0 | AG63: =IFERROR(VLOOKUP(RC[-16],R9C26:R17C36,8,FALSE),0)*R6C -> 0 | AH63: =IFERROR(VLOOKUP(RC[-16],R9C26:R17C36,9,FALSE),0)*R6C -> 0 | AI63: =IFERROR(VLOOKUP(RC[-16],R9C26:R17C36,10,FALSE),0)*R6C -> 0 | AJ63: =IFERROR(VLOOKUP(RC[-16],R9C26:R17C36,11,FALSE),0)*R6C -> 0 | AK63: =VLOOKUP(RC10,R9C38:R17C40,2,FALSE) -> 1 | AL63: =VLOOKUP(RC10,R9C38:R17C40,3,FALSE) -> 0 | AM63: =IF(OR(ISBLANK(R4C7),ISERROR(FIND(R4C7,RC21))),"　","●") ->  | AN63: =IF(OR(ISBLANK(R5C7),ISERROR(FIND(R5C7,RC21))),"　","●") ->  | AO63: =IF(RC39<>"●",VLOOKUP("評価しない",R9C42:R17C44,2,FALSE),VLOOKUP(R4C8,R9C42:R17C44,2,FALSE)) -> 1 | AP63: =IF(RC39<>"●",VLOOKUP("",R9C42:R17C44,3,FALSE),VLOOKUP(R4C8,R9C42:R17C44,3,FALSE)) -> 0 | AQ63: =IF(RC40<>"●",VLOOKUP("評価しない",R9C42:R17C44,2,FALSE),VLOOKUP(R5C8,R9C42:R17C44,2,FALSE)) -> 1 | AR63: =IF(RC40<>"●",VLOOKUP("",R9C42:R17C44,3,FALSE),VLOOKUP(R5C8,R9C42:R17C44,3,FALSE)) -> 0 | AS63: =IF(OR(ISBLANK(R6C7),ISERROR(FIND(R6C7,RC25))),"　","●") ->  | AT63: =IF(OR(ISBLANK(R7C7),ISERROR(FIND(R7C7,RC25))),"　","●") ->  | AU63: =IF(RC45<>"●",VLOOKUP("評価しない",R9C46:R17C48,2,FALSE),VLOOKUP(R6C8,R9C46:R17C48,2,FALSE)) -> 1 | AV63: =IF(RC45<>"●",VLOOKUP("",R9C46:R17C48,3,FALSE),VLOOKUP(R6C8,R9C46:R17C48,3,FALSE)) -> 0 | AW63: =IF(RC46<>"●",VLOOKUP("評価しない",R9C46:R17C48,2,FALSE),VLOOKUP(R7C8,R9C46:R17C48,2,FALSE)) -> 1 | AX63: =IF(RC46<>"●",VLOOKUP("",R9C46:R17C48,3,FALSE),VLOOKUP(R7C8,R9C46:R17C48,3,FALSE)) -> 0 | AY63: =SUM(RC27:RC36) -> 0 | AZ63: =RC37*RC41*RC43*RC47*RC49 -> 1 | BA63: =RC38+RC42+RC44+RC48+RC50 -> 0
A64: =OFFSET(R164C1,INT((RC26-1)/100),MOD(INT((RC26-1)/10),10),1,1)*10+MOD(RC26-1,10)+1 -> 13 | D64: =IF(AND(RC2<>"NG",OR(RC2<>"",RC3<>"",R9C4="×")),"◯","") ->  | E64: =IF(RC2="◯",RC6,"") ->  | F64: =T(OFFSET('[MiracleNikkiJp_items.csv]MiracleNikkiJp_items'!R10C[-3],RC1,0,1,1)) -> ヘアスタイル | G64: =T(OFFSET('[MiracleNikkiJp_items.csv]MiracleNikkiJp_items'!R10C[-2],RC1,0,1,1)) ->  | H64: =IF(RC4="",0,RC51*RC52+RC53) -> 0 | I64: =RC1 -> 13 | J64: =OFFSET('[MiracleNikkiJp_items.csv]MiracleNikkiJp_items'!R10C[-4],RC1,0,1,1) -> 0 | K64: =T(OFFSET('[MiracleNikkiJp_items.csv]MiracleNikkiJp_items'!R10C[-4],RC1,0,1,1)) ->  | L64: =T(OFFSET('[MiracleNikkiJp_items.csv]MiracleNikkiJp_items'!R10C[-4],RC1,0,1,1)) ->  | M64: =T(OFFSET('[MiracleNikkiJp_items.csv]MiracleNikkiJp_items'!R10C[-4],RC1,0,1,1)) ->  | N64: =T(OFFSET('[MiracleNikkiJp_items.csv]MiracleNikkiJp_items'!R10C[-4],RC1,0,1,1)) ->  | O64: =T(OFFSET('[MiracleNikkiJp_items.csv]MiracleNikkiJp_items'!R10C[-4],RC1,0,1,1)) ->  | P64: =T(OFFSET('[MiracleNikkiJp_items.csv]MiracleNikkiJp_items'!R10C[-4],RC1,0,1,1)) ->  | Q64: =T(OFFSET('[MiracleNikkiJp_items.csv]MiracleNikkiJp_items'!R10C[-4],RC1,0,1,1)) ->  | R64: =T(OFFSET('[MiracleNikkiJp_items.csv]MiracleNikkiJp_items'!R10C[-4],RC1,0,1,1)) ->  | S64: =T(OFFSET('[MiracleNikkiJp_items.csv]MiracleNikkiJp_items'!R10C[-4],RC1,0,1,1)) ->  | T64: =T(OFFSET('[MiracleNikkiJp_items.csv]MiracleNikkiJp_items'!R10C[-4],RC1,0,1,1)) ->  | U64: =T(OFFSET('[MiracleNikkiJp_items.csv]MiracleNikkiJp_items'!R10C[-4],RC1,0,1,1)) ->  | Y64: =T(OFFSET('[MiracleNikkiJp_items.csv]MiracleNikkiJp_items'!R10C[-7],RC1,0,1,1)) ->  | Z64: 13 | AA64: =IFERROR(VLOOKUP(RC[-16],R9C26:R17C36,2,FALSE),0)*R6C -> 0 | AB64: =IFERROR(VLOOKUP(RC[-16],R9C26:R17C36,3,FALSE),0)*R6C -> 0 | AC64: =IFERROR(VLOOKUP(RC[-16],R9C26:R17C36,4,FALSE),0)*R6C -> 0 | AD64: =IFERROR(VLOOKUP(RC[-16],R9C26:R17C36,5,FALSE),0)*R6C -> 0 | AE64: =IFERROR(VLOOKUP(RC[-16],R9C26:R17C36,6,FALSE),0)*R6C -> 0 | AF64: =IFERROR(VLOOKUP(RC[-16],R9C26:R17C36,7,FALSE),0)*R6C -> 0 | AG64: =IFERROR(VLOOKUP(RC[-16],R9C26:R17C36,8,FALSE),0)*R6C -> 0 | AH64: =IFERROR(VLOOKUP(RC[-16],R9C26:R17C36,9,FALSE),0)*R6C -> 0 | AI64: =IFERROR(VLOOKUP(RC[-16],R9C26:R17C36,10,FALSE),0)*R6C -> 0 | AJ64: =IFERROR(VLOOKUP(RC[-16],R9C26:R17C36,11,FALSE),0)*R6C -> 0 | AK64: =VLOOKUP(RC10,R9C38:R17C40,2,FALSE) -> 1 | AL64: =VLOOKUP(RC10,R9C38:R17C40,3,FALSE) -> 0 | AM64: =IF(OR(ISBLANK(R4C7),ISERROR(FIND(R4C7,RC21))),"　","●") ->  | AN64: =IF(OR(ISBLANK(R5C7),ISERROR(FIND(R5C7,RC21))),"　","●") ->  | AO64: =IF(RC39<>"●",VLOOKUP("評価しない",R9C42:R17C44,2,FALSE),VLOOKUP(R4C8,R9C42:R17C44,2,FALSE)) -> 1 | AP64: =IF(RC39<>"●",VLOOKUP("",R9C42:R17C44,3,FALSE),VLOOKUP(R4C8,R9C42:R17C44,3,FALSE)) -> 0 | AQ64: =IF(RC40<>"●",VLOOKUP("評価しない",R9C42:R17C44,2,FALSE),VLOOKUP(R5C8,R9C42:R17C44,2,FALSE)) -> 1 | AR64: =IF(RC40<>"●",VLOOKUP("",R9C42:R17C44,3,FALSE),VLOOKUP(R5C8,R9C42:R17C44,3,FALSE)) -> 0 | AS64: =IF(OR(ISBLANK(R6C7),ISERROR(FIND(R6C7,RC25))),"　","●") ->  | AT64: =IF(OR(ISBLANK(R7C7),ISERROR(FIND(R7C7,RC25))),"　","●") ->  | AU64: =IF(RC45<>"●",VLOOKUP("評価しない",R9C46:R17C48,2,FALSE),VLOOKUP(R6C8,R9C46:R17C48,2,FALSE)) -> 1 | AV64: =IF(RC45<>"●",VLOOKUP("",R9C46:R17C48,3,FALSE),VLOOKUP(R6C8,R9C46:R17C48,3,FALSE)) -> 0 | AW64: =IF(RC46<>"●",VLOOKUP("評価しない",R9C46:R17C48,2,FALSE),VLOOKUP(R7C8,R9C46:R17C48,2,FALSE)) -> 1 | AX64: =IF(RC46<>"●",VLOOKUP("",R9C46:R17C48,3,FALSE),VLOOKUP(R7C8,R9C46:R17C48,3,FALSE)) -> 0 | AY64: =SUM(RC27:RC36) -> 0 | AZ64: =RC37*RC41*RC43*RC47*RC49 -> 1 | BA64: =RC38+RC42+RC44+RC48+RC50 -> 0
A65: =OFFSET(R164C1,INT((RC26-1)/100),MOD(INT((RC26-1)/10),10),1,1)*10+MOD(RC26-1,10)+1 -> 14 | D65: =IF(AND(RC2<>"NG",OR(RC2<>"",RC3<>"",R9C4="×")),"◯","") ->  | E65: =IF(RC2="◯",RC6,"") ->  | F65: =T(OFFSET('[MiracleNikkiJp_items.csv]MiracleNikkiJp_items'!R10C[-3],RC1,0,1,1)) -> ヘアスタイル | G65: =T(OFFSET('[MiracleNikkiJp_items.csv]MiracleNikkiJp_items'!R10C[-2],RC1,0,1,1)) ->  | H65: =IF(RC4="",0,RC51*RC52+RC53) -> 0 | I65: =RC1 -> 14 | J65: =OFFSET('[MiracleNikkiJp_items.csv]MiracleNikkiJp_items'!R10C[-4],RC1,0,1,1) -> 0 | K65: =T(OFFSET('[MiracleNikkiJp_items.csv]MiracleNikkiJp_items'!R10C[-4],RC1,0,1,1)) ->  | L65: =T(OFFSET('[MiracleNikkiJp_items.csv]MiracleNikkiJp_items'!R10C[-4],RC1,0,1,1)) ->  | M65: =T(OFFSET('[MiracleNikkiJp_items.csv]MiracleNikkiJp_items'!R10C[-4],RC1,0,1,1)) ->  | N65: =T(OFFSET('[MiracleNikkiJp_items.csv]MiracleNikkiJp_items'!R10C[-4],RC1,0,1,1)) ->  | O65: =T(OFFSET('[MiracleNikkiJp_items.csv]MiracleNikkiJp_items'!R10C[-4],RC1,0,1,1)) ->  | P65: =T(OFFSET('[MiracleNikkiJp_items.csv]MiracleNikkiJp_items'!R10C[-4],RC1,0,1,1)) ->  | Q65: =T(OFFSET('[MiracleNikkiJp_items.csv]MiracleNikkiJp_items'!R10C[-4],RC1,0,1,1)) ->  | R65: =T(OFFSET('[MiracleNikkiJp_items.csv]MiracleNikkiJp_items'!R10C[-4],RC1,0,1,1)) ->  | S65: =T(OFFSET('[MiracleNikkiJp_items.csv]MiracleNikkiJp_items'!R10C[-4],RC1,0,1,1)) ->  | T65: =T(OFFSET('[MiracleNikkiJp_items.csv]MiracleNikkiJp_items'!R10C[-4],RC1,0,1,1)) ->  | U65: =T(OFFSET('[MiracleNikkiJp_items.csv]MiracleNikkiJp_items'!R10C[-4],RC1,0,1,1)) ->  | Y65: =T(OFFSET('[MiracleNikkiJp_items.csv]MiracleNikkiJp_items'!R10C[-7],RC1,0,1,1)) ->  | Z65: 14 | AA65: =IFERROR(VLOOKUP(RC[-16],R9C26:R17C36,2,FALSE),0)*R6C -> 0 | AB65: =IFERROR(VLOOKUP(RC[-16],R9C26:R17C36,3,FALSE),0)*R6C -> 0 | AC65: =IFERROR(VLOOKUP(RC[-16],R9C26:R17C36,4,FALSE),0)*R6C -> 0 | AD65: =IFERROR(VLOOKUP(RC[-16],R9C26:R17C36,5,FALSE),0)*R6C -> 0 | AE65: =IFERROR(VLOOKUP(RC[-16],R9C26:R17C36,6,FALSE),0)*R6C -> 0 | AF65: =IFERROR(VLOOKUP(RC[-16],R9C26:R17C36,7,FALSE),0)*R6C -> 0 | AG65: =IFERROR(VLOOKUP(RC[-16],R9C26:R17C36,8,FALSE),0)*R6C -> 0 | AH65: =IFERROR(VLOOKUP(RC[-16],R9C26:R17C36,9,FALSE),0)*R6C -> 0 | AI65: =IFERROR(VLOOKUP(RC[-16],R9C26:R17C36,10,FALSE),0)*R6C -> 0 | AJ65: =IFERROR(VLOOKUP(RC[-16],R9C26:R17C36,11,FALSE),0)*R6C -> 0 | AK65: =VLOOKUP(RC10,R9C38:R17C40,2,FALSE) -> 1 | AL65: =VLOOKUP(RC10,R9C38:R17C40,3,FALSE) -> 0 | AM65: =IF(OR(ISBLANK(R4C7),ISERROR(FIND(R4C7,RC21))),"　","●") ->  | AN65: =IF(OR(ISBLANK(R5C7),ISERROR(FIND(R5C7,RC21))),"　","●") ->  | AO65: =IF(RC39<>"●",VLOOKUP("評価しない",R9C42:R17C44,2,FALSE),VLOOKUP(R4C8,R9C42:R17C44,2,FALSE)) -> 1 | AP65: =IF(RC39<>"●",VLOOKUP("",R9C42:R17C44,3,FALSE),VLOOKUP(R4C8,R9C42:R17C44,3,FALSE)) -> 0 | AQ65: =IF(RC40<>"●",VLOOKUP("評価しない",R9C42:R17C44,2,FALSE),VLOOKUP(R5C8,R9C42:R17C44,2,FALSE)) -> 1 | AR65: =IF(RC40<>"●",VLOOKUP("",R9C42:R17C44,3,FALSE),VLOOKUP(R5C8,R9C42:R17C44,3,FALSE)) -> 0 | AS65: =IF(OR(ISBLANK(R6C7),ISERROR(FIND(R6C7,RC25))),"　","●") ->  | AT65: =IF(OR(ISBLANK(R7C7),ISERROR(FIND(R7C7,RC25))),"　","●") ->  | AU65: =IF(RC45<>"●",VLOOKUP("評価しない",R9C46:R17C48,2,FALSE),VLOOKUP(R6C8,R9C46:R17C48,2,FALSE)) -> 1 | AV65: =IF(RC45<>"●",VLOOKUP("",R9C46:R17C48,3,FALSE),VLOOKUP(R6C8,R9C46:R17C48,3,FALSE)) -> 0 | AW65: =IF(RC46<>"●",VLOOKUP("評価しない",R9C46:R17C48,2,FALSE),VLOOKUP(R7C8,R9C46:R17C48,2,FALSE)) -> 1 | AX65: =IF(RC46<>"●",VLOOKUP("",R9C46:R17C48,3,FALSE),VLOOKUP(R7C8,R9C46:R17C48,3,FALSE)) -> 0 | AY65: =SUM(RC27:RC36) -> 0 | AZ65: =RC37*RC41*RC43*RC47*RC49 -> 1 | BA65: =RC38+RC42+RC44+RC48+RC50 -> 0
A66: =OFFSET(R164C1,INT((RC26-1)/100),MOD(INT((RC26-1)/10),10),1,1)*10+MOD(RC26-1,10)+1 -> 15 | D66: =IF(AND(RC2<>"NG",OR(RC2<>"",RC3<>"",R9C4="×")),"◯","") ->  | E66: =IF(RC2="◯",RC6,"") ->  | F66: =T(OFFSET('[MiracleNikkiJp_items.csv]MiracleNikkiJp_items'!R10C[-3],RC1,0,1,1)) -> ヘアスタイル | G66: =T(OFFSET('[MiracleNikkiJp_items.csv]MiracleNikkiJp_items'!R10C[-2],RC1,0,1,1)) ->  | H66: =IF(RC4="",0,RC51*RC52+RC53) -> 0 | I66: =RC1 -> 15 | J66: =OFFSET('[MiracleNikkiJp_items.csv]MiracleNikkiJp_items'!R10C[-4],RC1,0,1,1) -> 0 | K66: =T(OFFSET('[MiracleNikkiJp_items.csv]MiracleNikkiJp_items'!R10C[-4],RC1,0,1,1)) ->  | L66: =T(OFFSET('[MiracleNikkiJp_items.csv]MiracleNikkiJp_items'!R10C[-4],RC1,0,1,1)) ->  | M66: =T(OFFSET('[MiracleNikkiJp_items.csv]MiracleNikkiJp_items'!R10C[-4],RC1,0,1,1)) ->  | N66: =T(OFFSET('[MiracleNikkiJp_items.csv]MiracleNikkiJp_items'!R10C[-4],RC1,0,1,1)) ->  | O66: =T(OFFSET('[MiracleNikkiJp_items.csv]MiracleNikkiJp_items'!R10C[-4],RC1,0,1,1)) ->  | P66: =T(OFFSET('[MiracleNikkiJp_items.csv]MiracleNikkiJp_items'!R10C[-4],RC1,0,1,1)) ->  | Q66: =T(OFFSET('[MiracleNikkiJp_items.csv]MiracleNikkiJp_items'!R10C[-4],RC1,0,1,1)) ->  | R66: =T(OFFSET('[MiracleNikkiJp_items.csv]MiracleNikkiJp_items'!R10C[-4],RC1,0,1,1)) ->  | S66: =T(OFFSET('[MiracleNikkiJp_items.csv]MiracleNikkiJp_items'!R10C[-4],RC1,0,1,1)) ->  | T66: =T(OFFSET('[MiracleNikkiJp_items.csv]MiracleNikkiJp_items'!R10C[-4],RC1,0,1,1)) ->  | U66: =T(OFFSET('[MiracleNikkiJp_items.csv]MiracleNikkiJp_items'!R10C[-4],RC1,0,1,1)) ->  | Y66: =T(OFFSET('[MiracleNikkiJp_items.csv]MiracleNikkiJp_items'!R10C[-7],RC1,0,1,1)) ->  | Z66: 15 | AA66: =IFERROR(VLOOKUP(RC[-16],R9C26:R17C36,2,FALSE),0)*R6C -> 0 | AB66: =IFERROR(VLOOKUP(RC[-16],R9C26:R17C36,3,FALSE),0)*R6C -> 0 | AC66: =IFERROR(VLOOKUP(RC[-16],R9C26:R17C36,4,FALSE),0)*R6C -> 0 | AD66: =IFERROR(VLOOKUP(RC[-16],R9C26:R17C36,5,FALSE),0)*R6C -> 0 | AE66: =IFERROR(VLOOKUP(RC[-16],R9C26:R17C36,6,FALSE),0)*R6C -> 0 | AF66: =IFERROR(VLOOKUP(RC[-16],R9C26:R17C36,7,FALSE),0)*R6C -> 0 | AG66: =IFERROR(VLOOKUP(RC[-16],R9C26:R17C36,8,FALSE),0)*R6C -> 0 | AH66: =IFERROR(VLOOKUP(RC[-16],R9C26:R17C36,9,FALSE),0)*R6C -> 0 | AI66: =IFERROR(VLOOKUP(RC[-16],R9C26:R17C36,10,FALSE),0)*R6C -> 0 | AJ66: =IFERROR(VLOOKUP(RC[-16],R9C26:R17C36,11,FALSE),0)*R6C -> 0 | AK66: =VLOOKUP(RC10,R9C38:R17C40,2,FALSE) -> 1 | AL66: =VLOOKUP(RC10,R9C38:R17C40,3,FALSE) -> 0 | AM66: =IF(OR(ISBLANK(R4C7),ISERROR(FIND(R4C7,RC21))),"　","●") ->  | AN66: =IF(OR(ISBLANK(R5C7),ISERROR(FIND(R5C7,RC21))),"　","●") ->  | AO66: =IF(RC39<>"●",VLOOKUP("評価しない",R9C42:R17C44,2,FALSE),VLOOKUP(R4C8,R9C42:R17C44,2,FALSE)) -> 1 | AP66: =IF(RC39<>"●",VLOOKUP("",R9C42:R17C44,3,FALSE),VLOOKUP(R4C8,R9C42:R17C44,3,FALSE)) -> 0 | AQ66: =IF(RC40<>"●",VLOOKUP("評価しない",R9C42:R17C44,2,FALSE),VLOOKUP(R5C8,R9C42:R17C44,2,FALSE)) -> 1 | AR66: =IF(RC40<>"●",VLOOKUP("",R9C42:R17C44,3,FALSE),VLOOKUP(R5C8,R9C42:R17C44,3,FALSE)) -> 0 | AS66: =IF(OR(ISBLANK(R6C7),ISERROR(FIND(R6C7,RC25))),"　","●") ->  | AT66: =IF(OR(ISBLANK(R7C7),ISERROR(FIND(R7C7,RC25))),"　","●") ->  | AU66: =IF(RC45<>"●",VLOOKUP("評価しない",R9C46:R17C48,2,FALSE),VLOOKUP(R6C8,R9C46:R17C48,2,FALSE)) -> 1 | AV66: =IF(RC45<>"●",VLOOKUP("",R9C46:R17C48,3,FALSE),VLOOKUP(R6C8,R9C46:R17C48,3,FALSE)) -> 0 | AW66: =IF(RC46<>"●",VLOOKUP("評価しない",R9C46:R17C48,2,FALSE),VLOOKUP(R7C8,R9C46:R17C48,2,FALSE)) -> 1 | AX66: =IF(RC46<>"●",VLOOKUP("",R9C46:R17C48,3,FALSE),VLOOKUP(R7C8,R9C46:R17C48,3,FALSE)) -> 0 | AY66: =SUM(RC27:RC36) -> 0 | AZ66: =RC37*RC41*RC43*RC47*RC49 -> 1 | BA66: =RC38+RC42+RC44+RC48+RC50 -> 0
A67: =OFFSET(R164C1,INT((RC26-1)/100),MOD(INT((RC26-1)/10),10),1,1)*10+MOD(RC26-1,10)+1 -> 16 | D67: =IF(AND(RC2<>"NG",OR(RC2<>"",RC3<>"",R9C4="×")),"◯","") ->  | E67: =IF(RC2="◯",RC6,"") ->  | F67: =T(OFFSET('[MiracleNikkiJp_items.csv]MiracleNikkiJp_items'!R10C[-3],RC1,0,1,1)) -> ヘアスタイル | G67: =T(OFFSET('[MiracleNikkiJp_items.csv]MiracleNikkiJp_items'!R10C[-2],RC1,0,1,1)) ->  | H67: =IF(RC4="",0,RC51*RC52+RC53) -> 0 | I67: =RC1 -> 16 | J67: =OFFSET('[MiracleNikkiJp_items.csv]MiracleNikkiJp_items'!R10C[-4],RC1,0,1,1) -> 0 | K67: =T(OFFSET('[MiracleNikkiJp_items.csv]MiracleNikkiJp_items'!R10C[-4],RC1,0,1,1)) ->  | L67: =T(OFFSET('[MiracleNikkiJp_items.csv]MiracleNikkiJp_items'!R10C[-4],RC1,0,1,1)) ->  | M67: =T(OFFSET('[MiracleNikkiJp_items.csv]MiracleNikkiJp_items'!R10C[-4],RC1,0,1,1)) ->  | N67: =T(OFFSET('[MiracleNikkiJp_items.csv]MiracleNikkiJp_items'!R10C[-4],RC1,0,1,1)) ->  | O67: =T(OFFSET('[MiracleNikkiJp_items.csv]MiracleNikkiJp_items'!R10C[-4],RC1,0,1,1)) ->  | P67: =T(OFFSET('[MiracleNikkiJp_items.csv]MiracleNikkiJp_items'!R10C[-4],RC1,0,1,1)) ->  | Q67: =T(OFFSET('[MiracleNikkiJp_items.csv]MiracleNikkiJp_items'!R10C[-4],RC1,0,1,1)) ->  | R67: =T(OFFSET('[MiracleNikkiJp_items.csv]MiracleNikkiJp_items'!R10C[-4],RC1,0,1,1)) ->  | S67: =T(OFFSET('[MiracleNikkiJp_items.csv]MiracleNikkiJp_items'!R10C[-4],RC1,0,1,1)) ->  | T67: =T(OFFSET('[MiracleNikkiJp_items.csv]MiracleNikkiJp_items'!R10C[-4],RC1,0,1,1)) ->  | U67: =T(OFFSET('[MiracleNikkiJp_items.csv]MiracleNikkiJp_items'!R10C[-4],RC1,0,1,1)) ->  | Y67: =T(OFFSET('[MiracleNikkiJp_items.csv]MiracleNikkiJp_items'!R10C[-7],RC1,0,1,1)) ->  | Z67: 16 | AA67: =IFERROR(VLOOKUP(RC[-16],R9C26:R17C36,2,FALSE),0)*R6C -> 0 | AB67: =IFERROR(VLOOKUP(RC[-16],R9C26:R17C36,3,FALSE),0)*R6C -> 0 | AC67: =IFERROR(VLOOKUP(RC[-16],R9C26:R17C36,4,FALSE),0)*R6C -> 0 | AD67: =IFERROR(VLOOKUP(RC[-16],R9C26:R17C36,5,FALSE),0)*R6C -> 0 | AE67: =IFERROR(VLOOKUP(RC[-16],R9C26:R17C36,6,FALSE),0)*R6C -> 0 | AF67: =IFERROR(VLOOKUP(RC[-16],R9C26:R17C36,7,FALSE),0)*R6C -> 0 | AG67: =IFERROR(VLOOKUP(RC[-16],R9C26:R17C36,8,FALSE),0)*R6C -> 0 | AH67: =IFERROR(VLOOKUP(RC[-16],R9C26:R17C36,9,FALSE),0)*R6C -> 0 | AI67: =IFERROR(VLOOKUP(RC[-16],R9C26:R17C36,10,FALSE),0)*R6C -> 0 | AJ67: =IFERROR(VLOOKUP(RC[-16],R9C26:R17C36,11,FALSE),0)*R6C -> 0 | AK67: =VLOOKUP(RC10,R9C38:R17C40,2,FALSE) -> 1 | AL67: =VLOOKUP(RC10,R9C38:R17C40,3,FALSE) -> 0 | AM67: =IF(OR(ISBLANK(R4C7),ISERROR(FIND(R4C7,RC21))),"　","●") ->  | AN67: =IF(OR(ISBLANK(R5C7),ISERROR(FIND(R5C7,RC21))),"　","●") ->  | AO67: =IF(RC39<>"●",VLOOKUP("評価しない",R9C42:R17C44,2,FALSE),VLOOKUP(R4C8,R9C42:R17C44,2,FALSE)) -> 1 | AP67: =IF(RC39<>"●",VLOOKUP("",R9C42:R17C44,3,FALSE),VLOOKUP(R4C8,R9C42:R17C44,3,FALSE)) -> 0 | AQ67: =IF(RC40<>"●",VLOOKUP("評価しない",R9C42:R17C44,2,FALSE),VLOOKUP(R5C8,R9C42:R17C44,2,FALSE)) -> 1 | AR67: =IF(RC40<>"●",VLOOKUP("",R9C42:R17C44,3,FALSE),VLOOKUP(R5C8,R9C42:R17C44,3,FALSE)) -> 0 | AS67: =IF(OR(ISBLANK(R6C7),ISERROR(FIND(R6C7,RC25))),"　","●") ->  | AT67: =IF(OR(ISBLANK(R7C7),ISERROR(FIND(R7C7,RC25))),"　","●") ->  | AU67: =IF(RC45<>"●",VLOOKUP("評価しない",R9C46:R17C48,2,FALSE),VLOOKUP(R6C8,R9C46:R17C48,2,FALSE)) -> 1 | AV67: =IF(RC45<>"●",VLOOKUP("",R9C46:R17C48,3,FALSE),VLOOKUP(R6C8,R9C46:R17C48,3,FALSE)) -> 0 | AW67: =IF(RC46<>"●",VLOOKUP("評価しない",R9C46:R17C48,2,FALSE),VLOOKUP(R7C8,R9C46:R17C48,2,FALSE)) -> 1 | AX67: =IF(RC46<>"●",VLOOKUP("",R9C46:R17C48,3,FALSE),VLOOKUP(R7C8,R9C46:R17C48,3,FALSE)) -> 0 | AY67: =SUM(RC27:RC36) -> 0 | AZ67: =RC37*RC41*RC43*RC47*RC49 -> 1 | BA67: =RC38+RC42+RC44+RC48+RC50 -> 0
A68: =OFFSET(R164C1,INT((RC26-1)/100),MOD(INT((RC26-1)/10),10),1,1)*10+MOD(RC26-1,10)+1 -> 17 | D68: =IF(AND(RC2<>"NG",OR(RC2<>"",RC3<>"",R9C4="×")),"◯","") ->  | E68: =IF(RC2="◯",RC6,"") ->  | F68: =T(OFFSET('[MiracleNikkiJp_items.csv]MiracleNikkiJp_items'!R10C[-3],RC1,0,1,1)) -> ヘアスタイル | G68: =T(OFFSET('[MiracleNikkiJp_items.csv]MiracleNikkiJp_items'!R10C[-2],RC1,0,1,1)) ->  | H68: =IF(RC4="",0,RC51*RC52+RC53) -> 0 | I68: =RC1 -> 17 | J68: =OFFSET('[MiracleNikkiJp_items.csv]MiracleNikkiJp_items'!R10C[-4],RC1,0,1,1) -> 0 | K68: =T(OFFSET('[MiracleNikkiJp_items.csv]MiracleNikkiJp_items'!R10C[-4],RC1,0,1,1)) ->  | L68: =T(OFFSET('[MiracleNikkiJp_items.csv]MiracleNikkiJp_items'!R10C[-4],RC1,0,1,1)) ->  | M68: =T(OFFSET('[MiracleNikkiJp_items.csv]MiracleNikkiJp_items'!R10C[-4],RC1,0,1,1)) ->  | N68: =T(OFFSET('[MiracleNikkiJp_items.csv]MiracleNikkiJp_items'!R10C[-4],RC1,0,1,1)) ->  | O68: =T(OFFSET('[MiracleNikkiJp_items.csv]MiracleNikkiJp_items'!R10C[-4],RC1,0,1,1)) ->  | P68: =T(OFFSET('[MiracleNikkiJp_items.csv]MiracleNikkiJp_items'!R10C[-4],RC1,0,1,1)) ->  | Q68: =T(OFFSET('[MiracleNikkiJp_items.csv]MiracleNikkiJp_items'!R10C[-4],RC1,0,1,1)) ->  | R68: =T(OFFSET('[MiracleNikkiJp_items.csv]MiracleNikkiJp_items'!R10C[-4],RC1,0,1,1)) ->  | S68: =T(OFFSET('[MiracleNikkiJp_items.csv]MiracleNikkiJp_items'!R10C[-4],RC1,0,1,1)) ->  | T68: =T(OFFSET('[MiracleNikkiJp_items.csv]MiracleNikkiJp_items'!R10C[-4],RC1,0,1,1)) ->  | U68: =T(OFFSET('[MiracleNikkiJp_items.csv]MiracleNikkiJp_items'!R10C[-4],RC1,0,1,1)) ->  | Y68: =T(OFFSET('[MiracleNikkiJp_items.csv]MiracleNikkiJp_items'!R10C[-7],RC1,0,1,1)) ->  | Z68: 17 | AA68: =IFERROR(VLOOKUP(RC[-16],R9C26:R17C36,2,FALSE),0)*R6C -> 0 | AB68: =IFERROR(VLOOKUP(RC[-16],R9C26:R17C36,3,FALSE),0)*R6C -> 0 | AC68: =IFERROR(VLOOKUP(RC[-16],R9C26:R17C36,4,FALSE),0)*R6C -> 0 | AD68: =IFERROR(VLOOKUP(RC[-16],R9C26:R17C36,5,FALSE),0)*R6C -> 0 | AE68: =IFERROR(VLOOKUP(RC[-16],R9C26:R17C36,6,FALSE),0)*R6C -> 0 | AF68: =IFERROR(VLOOKUP(RC[-16],R9C26:R17C36,7,FALSE),0)*R6C -> 0 | AG68: =IFERROR(VLOOKUP(RC[-16],R9C26:R17C36,8,FALSE),0)*R6C -> 0 | AH68: =IFERROR(VLOOKUP(RC[-16],R9C26:R17C36,9,FALSE),0)*R6C -> 0 | AI68: =IFERROR(VLOOKUP(RC[-16],R9C26:R17C36,10,FALSE),0)*R6C -> 0 | AJ68: =IFERROR(VLOOKUP(RC[-16],R9C26:R17C36,11,FALSE),0)*R6C -> 0 | AK68: =VLOOKUP(RC10,R9C38:R17C40,2,FALSE) -> 1 | AL68: =VLOOKUP(RC10,R9C38:R17C40,3,FALSE) -> 0 | AM68: =IF(OR(ISBLANK(R4C7),ISERROR(FIND(R4C7,RC21))),"　","●") ->  | AN68: =IF(OR(ISBLANK(R5C7),ISERROR(FIND(R5C7,RC21))),"　","●") ->  | AO68: =IF(RC39<>"●",VLOOKUP("評価しない",R9C42:R17C44,2,FALSE),VLOOKUP(R4C8,R9C42:R17C44,2,FALSE)) -> 1 | AP68: =IF(RC39<>"●",VLOOKUP("",R9C42:R17C44,3,FALSE),VLOOKUP(R4C8,R9C42:R17C44,3,FALSE)) -> 0 | AQ68: =IF(RC40<>"●",VLOOKUP("評価しない",R9C42:R17C44,2,FALSE),VLOOKUP(R5C8,R9C42:R17C44,2,FALSE)) -> 1 | AR68: =IF(RC40<>"●",VLOOKUP("",R9C42:R17C44,3,FALSE),VLOOKUP(R5C8,R9C42:R17C44,3,FALSE)) -> 0 | AS68: =IF(OR(ISBLANK(R6C7),ISERROR(FIND(R6C7,RC25))),"　","●") ->  | AT68: =IF(OR(ISBLANK(R7C7),ISERROR(FIND(R7C7,RC25))),"　","●") ->  | AU68: =IF(RC45<>"●",VLOOKUP("評価しない",R9C46:R17C48,2,FALSE),VLOOKUP(R6C8,R9C46:R17C48,2,FALSE)) -> 1 | AV68: =IF(RC45<>"●",VLOOKUP("",R9C46:R17C48,3,FALSE),VLOOKUP(R6C8,R9C46:R17C48,3,FALSE)) -> 0 | AW68: =IF(RC46<>"●",VLOOKUP("評価しない",R9C46:R17C48,2,FALSE),VLOOKUP(R7C8,R9C46:R17C48,2,FALSE)) -> 1 | AX68: =IF(RC46<>"●",VLOOKUP("",R9C46:R17C48,3,FALSE),VLOOKUP(R7C8,R9C46:R17C48,3,FALSE)) -> 0 | AY68: =SUM(RC27:RC36) -> 0 | AZ68: =RC37*RC41*RC43*RC47*RC49 -> 1 | BA68: =RC38+RC42+RC44+RC48+RC50 -> 0
A69: =OFFSET(R164C1,INT((RC26-1)/100),MOD(INT((RC26-1)/10),10),1,1)*10+MOD(RC26-1,10)+1 -> 18 | D69: =IF(AND(RC2<>"NG",OR(RC2<>"",RC3<>"",R9C4="×")),"◯","") ->  | E69: =IF(RC2="◯",RC6,"") ->  | F69: =T(OFFSET('[MiracleNikkiJp_items.csv]MiracleNikkiJp_items'!R10C[-3],RC1,0,1,1)) -> ヘアスタイル | G69: =T(OFFSET('[MiracleNikkiJp_items.csv]MiracleNikkiJp_items'!R10C[-2],RC1,0,1,1)) ->  | H69: =IF(RC4="",0,RC51*RC52+RC53) -> 0 | I69: =RC1 -> 18 | J69: =OFFSET('[MiracleNikkiJp_items.csv]MiracleNikkiJp_items'!R10C[-4],RC1,0,1,1) -> 0 | K69: =T(OFFSET('[MiracleNikkiJp_items.csv]MiracleNikkiJp_items'!R10C[-4],RC1,0,1,1)) ->  | L69: =T(OFFSET('[MiracleNikkiJp_items.csv]MiracleNikkiJp_items'!R10C[-4],RC1,0,1,1)) ->  | M69: =T(OFFSET('[MiracleNikkiJp_items.csv]MiracleNikkiJp_items'!R10C[-4],RC1,0,1,1)) ->  | N69: =T(OFFSET('[MiracleNikkiJp_items.csv]MiracleNikkiJp_items'!R10C[-4],RC1,0,1,1)) ->  | O69: =T(OFFSET('[MiracleNikkiJp_items.csv]MiracleNikkiJp_items'!R10C[-4],RC1,0,1,1)) ->  | P69: =T(OFFSET('[MiracleNikkiJp_items.csv]MiracleNikkiJp_items'!R10C[-4],RC1,0,1,1)) ->  | Q69: =T(OFFSET('[MiracleNikkiJp_items.csv]MiracleNikkiJp_items'!R10C[-4],RC1,0,1,1)) ->  | R69: =T(OFFSET('[MiracleNikkiJp_items.csv]MiracleNikkiJp_items'!R10C[-4],RC1,0,1,1)) ->  | S69: =T(OFFSET('[MiracleNikkiJp_items.csv]MiracleNikkiJp_items'!R10C[-4],RC1,0,1,1)) ->  | T69: =T(OFFSET('[MiracleNikkiJp_items.csv]MiracleNikkiJp_items'!R10C[-4],RC1,0,1,1)) ->  | U69: =T(OFFSET('[MiracleNikkiJp_items.csv]MiracleNikkiJp_items'!R10C[-4],RC1,0,1,1)) ->  | Y69: =T(OFFSET('[MiracleNikkiJp_items.csv]MiracleNikkiJp_items'!R10C[-7],RC1,0,1,1)) ->  | Z69: 18 | AA69: =IFERROR(VLOOKUP(RC[-16],R9C26:R17C36,2,FALSE),0)*R6C -> 0 | AB69: =IFERROR(VLOOKUP(RC[-16],R9C26:R17C36,3,FALSE),0)*R6C -> 0 | AC69: =IFERROR(VLOOKUP(RC[-16],R9C26:R17C36,4,FALSE),0)*R6C -> 0 | AD69: =IFERROR(VLOOKUP(RC[-16],R9C26:R17C36,5,FALSE),0)*R6C -> 0 | AE69: =IFERROR(VLOOKUP(RC[-16],R9C26:R17C36,6,FALSE),0)*R6C -> 0 | AF69: =IFERROR(VLOOKUP(RC[-16],R9C26:R17C36,7,FALSE),0)*R6C -> 0 | AG69: =IFERROR(VLOOKUP(RC[-16],R9C26:R17C36,8,FALSE),0)*R6C -> 0 | AH69: =IFERROR(VLOOKUP(RC[-16],R9C26:R17C36,9,FALSE),0)*R6C -> 0 | AI69: =IFERROR(VLOOKUP(RC[-16],R9C26:R17C36,10,FALSE),0)*R6C -> 0 | AJ69: =IFERROR(VLOOKUP(RC[-16],R9C26:R17C36,11,FALSE),0)*R6C -> 0 | AK69: =VLOOKUP(RC10,R9C38:R17C40,2,FALSE) -> 1 | AL69: =VLOOKUP(RC10,R9C38:R17C40,3,FALSE) -> 0 | AM69: =IF(OR(ISBLANK(R4C7),ISERROR(FIND(R4C7,RC21))),"　","●") ->  | AN69: =IF(OR(ISBLANK(R5C7),ISERROR(FIND(R5C7,RC21))),"　","●") ->  | AO69: =IF(RC39<>"●",VLOOKUP("評価しない",R9C42:R17C44,2,FALSE),VLOOKUP(R4C8,R9C42:R17C44,2,FALSE)) -> 1 | AP69: =IF(RC39<>"●",VLOOKUP("",R9C42:R17C44,3,FALSE),VLOOKUP(R4C8,R9C42:R17C44,3,FALSE)) -> 0 | AQ69: =IF(RC40<>"●",VLOOKUP("評価しない",R9C42:R17C44,2,FALSE),VLOOKUP(R5C8,R9C42:R17C44,2,FALSE)) -> 1 | AR69: =IF(RC40<>"●",VLOOKUP("",R9C42:R17C44,3,FALSE),VLOOKUP(R5C8,R9C42:R17C44,3,FALSE)) -> 0 | AS69: =IF(OR(ISBLANK(R6C7),ISERROR(FIND(R6C7,RC25))),"　","●") ->  | AT69: =IF(OR(ISBLANK(R7C7),ISERROR(FIND(R7C7,RC25))),"　","●") ->  | AU69: =IF(RC45<>"●",VLOOKUP("評価しない",R9C46:R17C48,2,FALSE),VLOOKUP(R6C8,R9C46:R17C48,2,FALSE)) -> 1 | AV69: =IF(RC45<>"●",VLOOKUP("",R9C46:R17C48,3,FALSE),VLOOKUP(R6C8,R9C46:R17C48,3,FALSE)) -> 0 | AW69: =IF(RC46<>"●",VLOOKUP("評価しない",R9C46:R17C48,2,FALSE),VLOOKUP(R7C8,R9C46:R17C48,2,FALSE)) -> 1 | AX69: =IF(RC46<>"●",VLOOKUP("",R9C46:R17C48,3,FALSE),VLOOKUP(R7C8,R9C46:R17C48,3,FALSE)) -> 0 | AY69: =SUM(RC27:RC36) -> 0 | AZ69: =RC37*RC41*RC43*RC47*RC49 -> 1 | BA69: =RC38+RC42+RC44+RC48+RC50 -> 0
A70: =OFFSET(R164C1,INT((RC26-1)/100),MOD(INT((RC26-1)/10),10),1,1)*10+MOD(RC26-1,10)+1 -> 19 | D70: =IF(AND(RC2<>"NG",OR(RC2<>"",RC3<>"",R9C4="×")),"◯","") ->  | E70: =IF(RC2="◯",RC6,"") ->  | F70: =T(OFFSET('[MiracleNikkiJp_items.csv]MiracleNikkiJp_items'!R10C[-3],RC1,0,1,1)) -> ヘアスタイル | G70: =T(OFFSET('[MiracleNikkiJp_items.csv]MiracleNikkiJp_items'!R10C[-2],RC1,0,1,1)) ->  | H70: =IF(RC4="",0,RC51*RC52+RC53) -> 0 | I70: =RC1 -> 19 | J70: =OFFSET('[MiracleNikkiJp_items.csv]MiracleNikkiJp_items'!R10C[-4],RC1,0,1,1) -> 0 | K70: =T(OFFSET('[MiracleNikkiJp_items.csv]MiracleNikkiJp_items'!R10C[-4],RC1,0,1,1)) ->  | L70: =T(OFFSET('[MiracleNikkiJp_items.csv]MiracleNikkiJp_items'!R10C[-4],RC1,0,1,1)) ->  | M70: =T(OFFSET('[MiracleNikkiJp_items.csv]MiracleNikkiJp_items'!R10C[-4],RC1,0,1,1)) ->  | N70: =T(OFFSET('[MiracleNikkiJp_items.csv]MiracleNikkiJp_items'!R10C[-4],RC1,0,1,1)) ->  | O70: =T(OFFSET('[MiracleNikkiJp_items.csv]MiracleNikkiJp_items'!R10C[-4],RC1,0,1,1)) ->  | P70: =T(OFFSET('[MiracleNikkiJp_items.csv]MiracleNikkiJp_items'!R10C[-4],RC1,0,1,1)) ->  | Q70: =T(OFFSET('[MiracleNikkiJp_items.csv]MiracleNikkiJp_items'!R10C[-4],RC1,0,1,1)) ->  | R70: =T(OFFSET('[MiracleNikkiJp_items.csv]MiracleNikkiJp_items'!R10C[-4],RC1,0,1,1)) ->  | S70: =T(OFFSET('[MiracleNikkiJp_items.csv]MiracleNikkiJp_items'!R10C[-4],RC1,0,1,1)) ->  | T70: =T(OFFSET('[MiracleNikkiJp_items.csv]MiracleNikkiJp_items'!R10C[-4],RC1,0,1,1)) ->  | U70: =T(OFFSET('[MiracleNikkiJp_items.csv]MiracleNikkiJp_items'!R10C[-4],RC1,0,1,1)) ->  | Y70: =T(OFFSET('[MiracleNikkiJp_items.csv]MiracleNikkiJp_items'!R10C[-7],RC1,0,1,1)) ->  | Z70: 19 | AA70: =IFERROR(VLOOKUP(RC[-16],R9C26:R17C36,2,FALSE),0)*R6C -> 0 | AB70: =IFERROR(VLOOKUP(RC[-16],R9C26:R17C36,3,FALSE),0)*R6C -> 0 | AC70: =IFERROR(VLOOKUP(RC[-16],R9C26:R17C36,4,FALSE),0)*R6C -> 0 | AD70: =IFERROR(VLOOKUP(RC[-16],R9C26:R17C36,5,FALSE),0)*R6C -> 0 | AE70: =IFERROR(VLOOKUP(RC[-16],R9C26:R17C36,6,FALSE),0)*R6C -> 0 | AF70: =IFERROR(VLOOKUP(RC[-16],R9C26:R17C36,7,FALSE),0)*R6C -> 0 | AG70: =IFERROR(VLOOKUP(RC[-16],R9C26:R17C36,8,FALSE),0)*R6C -> 0 | AH70: =IFERROR(VLOOKUP(RC[-16],R9C26:R17C36,9,FALSE),0)*R6C -> 0 | AI70: =IFERROR(VLOOKUP(RC[-16],R9C26:R17C36,10,FALSE),0)*R6C -> 0 | AJ70: =IFERROR(VLOOKUP(RC[-16],R9C26:R17C36,11,FALSE),0)*R6C -> 0 | AK70: =VLOOKUP(RC10,R9C38:R17C40,2,FALSE) -> 1 | AL70: =VLOOKUP(RC10,R9C38:R17C40,3,FALSE) -> 0 | AM70: =IF(OR(ISBLANK(R4C7),ISERROR(FIND(R4C7,RC21))),"　","●") ->  | AN70: =IF(OR(ISBLANK(R5C7),ISERROR(FIND(R5C7,RC21))),"　","●") ->  | AO70: =IF(RC39<>"●",VLOOKUP("評価しない",R9C42:R17C44,2,FALSE),VLOOKUP(R4C8,R9C42:R17C44,2,FALSE)) -> 1 | AP70: =IF(RC39<>"●",VLOOKUP("",R9C42:R17C44,3,FALSE),VLOOKUP(R4C8,R9C42:R17C44,3,FALSE)) -> 0 | AQ70: =IF(RC40<>"●",VLOOKUP("評価しない",R9C42:R17C44,2,FALSE),VLOOKUP(R5C8,R9C42:R17C44,2,FALSE)) -> 1 | AR70: =IF(RC40<>"●",VLOOKUP("",R9C42:R17C44,3,FALSE),VLOOKUP(R5C8,R9C42:R17C44,3,FALSE)) -> 0 | AS70: =IF(OR(ISBLANK(R6C7),ISERROR(FIND(R6C7,RC25))),"　","●") ->  | AT70: =IF(OR(ISBLANK(R7C7),ISERROR(FIND(R7C7,RC25))),"　","●") ->  | AU70: =IF(RC45<>"●",VLOOKUP("評価しない",R9C46:R17C48,2,FALSE),VLOOKUP(R6C8,R9C46:R17C48,2,FALSE)) -> 1 | AV70: =IF(RC45<>"●",VLOOKUP("",R9C46:R17C48,3,FALSE),VLOOKUP(R6C8,R9C46:R17C48,3,FALSE)) -> 0 | AW70: =IF(RC46<>"●",VLOOKUP("評価しない",R9C46:R17C48,2,FALSE),VLOOKUP(R7C8,R9C46:R17C48,2,FALSE)) -> 1 | AX70: =IF(RC46<>"●",VLOOKUP("",R9C46:R17C48,3,FALSE),VLOOKUP(R7C8,R9C46:R17C48,3,FALSE)) -> 0 | AY70: =SUM(RC27:RC36) -> 0 | AZ70: =RC37*RC41*RC43*RC47*RC49 -> 1 | BA70: =RC38+RC42+RC44+RC48+RC50 -> 0
A71: =OFFSET(R164C1,INT((RC26-1)/100),MOD(INT((RC26-1)/10),10),1,1)*10+MOD(RC26-1,10)+1 -> 20 | D71: =IF(AND(RC2<>"NG",OR(RC2<>"",RC3<>"",R9C4="×")),"◯","") ->  | E71: =IF(RC2="◯",RC6,"") ->  | F71: =T(OFFSET('[MiracleNikkiJp_items.csv]MiracleNikkiJp_items'!R10C[-3],RC1,0,1,1)) -> ヘアスタイル | G71: =T(OFFSET('[MiracleNikkiJp_items.csv]MiracleNikkiJp_items'!R10C[-2],RC1,0,1,1)) ->  | H71: =IF(RC4="",0,RC51*RC52+RC53) -> 0 | I71: =RC1 -> 20 | J71: =OFFSET('[MiracleNikkiJp_items.csv]MiracleNikkiJp_items'!R10C[-4],RC1,0,1,1) -> 0 | K71: =T(OFFSET('[MiracleNikkiJp_items.csv]MiracleNikkiJp_items'!R10C[-4],RC1,0,1,1)) ->  | L71: =T(OFFSET('[MiracleNikkiJp_items.csv]MiracleNikkiJp_items'!R10C[-4],RC1,0,1,1)) ->  | M71: =T(OFFSET('[MiracleNikkiJp_items.csv]MiracleNikkiJp_items'!R10C[-4],RC1,0,1,1)) ->  | N71: =T(OFFSET('[MiracleNikkiJp_items.csv]MiracleNikkiJp_items'!R10C[-4],RC1,0,1,1)) ->  | O71: =T(OFFSET('[MiracleNikkiJp_items.csv]MiracleNikkiJp_items'!R10C[-4],RC1,0,1,1)) ->  | P71: =T(OFFSET('[MiracleNikkiJp_items.csv]MiracleNikkiJp_items'!R10C[-4],RC1,0,1,1)) ->  | Q71: =T(OFFSET('[MiracleNikkiJp_items.csv]MiracleNikkiJp_items'!R10C[-4],RC1,0,1,1)) ->  | R71: =T(OFFSET('[MiracleNikkiJp_items.csv]MiracleNikkiJp_items'!R10C[-4],RC1,0,1,1)) ->  | S71: =T(OFFSET('[MiracleNikkiJp_items.csv]MiracleNikkiJp_items'!R10C[-4],RC1,0,1,1)) ->  | T71: =T(OFFSET('[MiracleNikkiJp_items.csv]MiracleNikkiJp_items'!R10C[-4],RC1,0,1,1)) ->  | U71: =T(OFFSET('[MiracleNikkiJp_items.csv]MiracleNikkiJp_items'!R10C[-4],RC1,0,1,1)) ->  | Y71: =T(OFFSET('[MiracleNikkiJp_items.csv]MiracleNikkiJp_items'!R10C[-7],RC1,0,1,1)) ->  | Z71: 20 | AA71: =IFERROR(VLOOKUP(RC[-16],R9C26:R17C36,2,FALSE),0)*R6C -> 0 | AB71: =IFERROR(VLOOKUP(RC[-16],R9C26:R17C36,3,FALSE),0)*R6C -> 0 | AC71: =IFERROR(VLOOKUP(RC[-16],R9C26:R17C36,4,FALSE),0)*R6C -> 0 | AD71: =IFERROR(VLOOKUP(RC[-16],R9C26:R17C36,5,FALSE),0)*R6C -> 0 | AE71: =IFERROR(VLOOKUP(RC[-16],R9C26:R17C36,6,FALSE),0)*R6C -> 0 | AF71: =IFERROR(VLOOKUP(RC[-16],R9C26:R17C36,7,FALSE),0)*R6C -> 0 | AG71: =IFERROR(VLOOKUP(RC[-16],R9C26:R17C36,8,FALSE),0)*R6C -> 0 | AH71: =IFERROR(VLOOKUP(RC[-16],R9C26:R17C36,9,FALSE),0)*R6C -> 0 | AI71: =IFERROR(VLOOKUP(RC[-16],R9C26:R17C36,10,FALSE),0)*R6C -> 0 | AJ71: =IFERROR(VLOOKUP(RC[-16],R9C26:R17C36,11,FALSE),0)*R6C -> 0 | AK71: =VLOOKUP(RC10,R9C38:R17C40,2,FALSE) -> 1 | AL71: =VLOOKUP(RC10,R9C38:R17C40,3,FALSE) -> 0 | AM71: =IF(OR(ISBLANK(R4C7),ISERROR(FIND(R4C7,RC21))),"　","●") ->  | AN71: =IF(OR(ISBLANK(R5C7),ISERROR(FIND(R5C7,RC21))),"　","●") ->  | AO71: =IF(RC39<>"●",VLOOKUP("評価しない",R9C42:R17C44,2,FALSE),VLOOKUP(R4C8,R9C42:R17C44,2,FALSE)) -> 1 | AP71: =IF(RC39<>"●",VLOOKUP("",R9C42:R17C44,3,FALSE),VLOOKUP(R4C8,R9C42:R17C44,3,FALSE)) -> 0 | AQ71: =IF(RC40<>"●",VLOOKUP("評価しない",R9C42:R17C44,2,FALSE),VLOOKUP(R5C8,R9C42:R17C44,2,FALSE)) -> 1 | AR71: =IF(RC40<>"●",VLOOKUP("",R9C42:R17C44,3,FALSE),VLOOKUP(R5C8,R9C42:R17C44,3,FALSE)) -> 0 | AS71: =IF(OR(ISBLANK(R6C7),ISERROR(FIND(R6C7,RC25))),"　","●") ->  | AT71: =IF(OR(ISBLANK(R7C7),ISERROR(FIND(R7C7,RC25))),"　","●") ->  | AU71: =IF(RC45<>"●",VLOOKUP("評価しない",R9C46:R17C48,2,FALSE),VLOOKUP(R6C8,R9C46:R17C48,2,FALSE)) -> 1 | AV71: =IF(RC45<>"●",VLOOKUP("",R9C46:R17C48,3,FALSE),VLOOKUP(R6C8,R9C46:R17C48,3,FALSE)) -> 0 | AW71: =IF(RC46<>"●",VLOOKUP("評価しない",R9C46:R17C48,2,FALSE),VLOOKUP(R7C8,R9C46:R17C48,2,FALSE)) -> 1 | AX71: =IF(RC46<>"●",VLOOKUP("",R9C46:R17C48,3,FALSE),VLOOKUP(R7C8,R9C46:R17C48,3,FALSE)) -> 0 | AY71: =SUM(RC27:RC36) -> 0 | AZ71: =RC37*RC41*RC43*RC47*RC49 -> 1 | BA71: =RC38+RC42+RC44+RC48+RC50 -> 0
A72: =OFFSET(R164C1,INT((RC26-1)/100),MOD(INT((RC26-1)/10),10),1,1)*10+MOD(RC26-1,10)+1 -> 21 | D72: =IF(AND(RC2<>"NG",OR(RC2<>"",RC3<>"",R9C4="×")),"◯","") ->  | E72: =IF(RC2="◯",RC6,"") ->  | F72: =T(OFFSET('[MiracleNikkiJp_items.csv]MiracleNikkiJp_items'!R10C[-3],RC1,0,1,1)) -> ヘアスタイル | G72: =T(OFFSET('[MiracleNikkiJp_items.csv]MiracleNikkiJp_items'!R10C[-2],RC1,0,1,1)) ->  | H72: =IF(RC4="",0,RC51*RC52+RC53) -> 0 | I72: =RC1 -> 21 | J72: =OFFSET('[MiracleNikkiJp_items.csv]MiracleNikkiJp_items'!R10C[-4],RC1,0,1,1) -> 0 | K72: =T(OFFSET('[MiracleNikkiJp_items.csv]MiracleNikkiJp_items'!R10C[-4],RC1,0,1,1)) ->  | L72: =T(OFFSET('[MiracleNikkiJp_items.csv]MiracleNikkiJp_items'!R10C[-4],RC1,0,1,1)) ->  | M72: =T(OFFSET('[MiracleNikkiJp_items.csv]MiracleNikkiJp_items'!R10C[-4],RC1,0,1,1)) ->  | N72: =T(OFFSET('[MiracleNikkiJp_items.csv]MiracleNikkiJp_items'!R10C[-4],RC1,0,1,1)) ->  | O72: =T(OFFSET('[MiracleNikkiJp_items.csv]MiracleNikkiJp_items'!R10C[-4],RC1,0,1,1)) ->  | P72: =T(OFFSET('[MiracleNikkiJp_items.csv]MiracleNikkiJp_items'!R10C[-4],RC1,0,1,1)) ->  | Q72: =T(OFFSET('[MiracleNikkiJp_items.csv]MiracleNikkiJp_items'!R10C[-4],RC1,0,1,1)) ->  | R72: =T(OFFSET('[MiracleNikkiJp_items.csv]MiracleNikkiJp_items'!R10C[-4],RC1,0,1,1)) ->  | S72: =T(OFFSET('[MiracleNikkiJp_items.csv]MiracleNikkiJp_items'!R10C[-4],RC1,0,1,1)) ->  | T72: =T(OFFSET('[MiracleNikkiJp_items.csv]MiracleNikkiJp_items'!R10C[-4],RC1,0,1,1)) ->  | U72: =T(OFFSET('[MiracleNikkiJp_items.csv]MiracleNikkiJp_items'!R10C[-4],RC1,0,1,1)) ->  | Y72: =T(OFFSET('[MiracleNikkiJp_items.csv]MiracleNikkiJp_items'!R10C[-7],RC1,0,1,1)) ->  | Z72: 21 | AA72: =IFERROR(VLOOKUP(RC[-16],R9C26:R17C36,2,FALSE),0)*R6C -> 0 | AB72: =IFERROR(VLOOKUP(RC[-16],R9C26:R17C36,3,FALSE),0)*R6C -> 0 | AC72: =IFERROR(VLOOKUP(RC[-16],R9C26:R17C36,4,FALSE),0)*R6C -> 0 | AD72: =IFERROR(VLOOKUP(RC[-16],R9C26:R17C36,5,FALSE),0)*R6C -> 0 | AE72: =IFERROR(VLOOKUP(RC[-16],R9C26:R17C36,6,FALSE),0)*R6C -> 0 | AF72: =IFERROR(VLOOKUP(RC[-16],R9C26:R17C36,7,FALSE),0)*R6C -> 0 | AG72: =IFERROR(VLOOKUP(RC[-16],R9C26:R17C36,8,FALSE),0)*R6C -> 0 | AH72: =IFERROR(VLOOKUP(RC[-16],R9C26:R17C36,9,FALSE),0)*R6C -> 0 | AI72: =IFERROR(VLOOKUP(RC[-16],R9C26:R17C36,10,FALSE),0)*R6C -> 0 | AJ72: =IFERROR(VLOOKUP(RC[-16],R9C26:R17C36,11,FALSE),0)*R6C -> 0 | AK72: =VLOOKUP(RC10,R9C38:R17C40,2,FALSE) -> 1 | AL72: =VLOOKUP(RC10,R9C38:R17C40,3,FALSE) -> 0 | AM72: =IF(OR(ISBLANK(R4C7),ISERROR(FIND(R4C7,RC21))),"　","●") ->  | AN72: =IF(OR(ISBLANK(R5C7),ISERROR(FIND(R5C7,RC21))),"　","●") ->  | AO72: =IF(RC39<>"●",VLOOKUP("評価しない",R9C42:R17C44,2,FALSE),VLOOKUP(R4C8,R9C42:R17C44,2,FALSE)) -> 1 | AP72: =IF(RC39<>"●",VLOOKUP("",R9C42:R17C44,3,FALSE),VLOOKUP(R4C8,R9C42:R17C44,3,FALSE)) -> 0 | AQ72: =IF(RC40<>"●",VLOOKUP("評価しない",R9C42:R17C44,2,FALSE),VLOOKUP(R5C8,R9C42:R17C44,2,FALSE)) -> 1 | AR72: =IF(RC40<>"●",VLOOKUP("",R9C42:R17C44,3,FALSE),VLOOKUP(R5C8,R9C42:R17C44,3,FALSE)) -> 0 | AS72: =IF(OR(ISBLANK(R6C7),ISERROR(FIND(R6C7,RC25))),"　","●") ->  | AT72: =IF(OR(ISBLANK(R7C7),ISERROR(FIND(R7C7,RC25))),"　","●") ->  | AU72: =IF(RC45<>"●",VLOOKUP("評価しない",R9C46:R17C48,2,FALSE),VLOOKUP(R6C8,R9C46:R17C48,2,FALSE)) -> 1 | AV72: =IF(RC45<>"●",VLOOKUP("",R9C46:R17C48,3,FALSE),VLOOKUP(R6C8,R9C46:R17C48,3,FALSE)) -> 0 | AW72: =IF(RC46<>"●",VLOOKUP("評価しない",R9C46:R17C48,2,FALSE),VLOOKUP(R7C8,R9C46:R17C48,2,FALSE)) -> 1 | AX72: =IF(RC46<>"●",VLOOKUP("",R9C46:R17C48,3,FALSE),VLOOKUP(R7C8,R9C46:R17C48,3,FALSE)) -> 0 | AY72: =SUM(RC27:RC36) -> 0 | AZ72: =RC37*RC41*RC43*RC47*RC49 -> 1 | BA72: =RC38+RC42+RC44+RC48+RC50 -> 0
A73: =OFFSET(R164C1,INT((RC26-1)/100),MOD(INT((RC26-1)/10),10),1,1)*10+MOD(RC26-1,10)+1 -> 22 | D73: =IF(AND(RC2<>"NG",OR(RC2<>"",RC3<>"",R9C4="×")),"◯","") ->  | E73: =IF(RC2="◯",RC6,"") ->  | F73: =T(OFFSET('[MiracleNikkiJp_items.csv]MiracleNikkiJp_items'!R10C[-3],RC1,0,1,1)) -> ヘアスタイル | G73: =T(OFFSET('[MiracleNikkiJp_items.csv]MiracleNikkiJp_items'!R10C[-2],RC1,0,1,1)) ->  | H73: =IF(RC4="",0,RC51*RC52+RC53) -> 0 | I73: =RC1 -> 22 | J73: =OFFSET('[MiracleNikkiJp_items.csv]MiracleNikkiJp_items'!R10C[-4],RC1,0,1,1) -> 0 | K73: =T(OFFSET('[MiracleNikkiJp_items.csv]MiracleNikkiJp_items'!R10C[-4],RC1,0,1,1)) ->  | L73: =T(OFFSET('[MiracleNikkiJp_items.csv]MiracleNikkiJp_items'!R10C[-4],RC1,0,1,1)) ->  | M73: =T(OFFSET('[MiracleNikkiJp_items.csv]MiracleNikkiJp_items'!R10C[-4],RC1,0,1,1)) ->  | N73: =T(OFFSET('[MiracleNikkiJp_items.csv]MiracleNikkiJp_items'!R10C[-4],RC1,0,1,1)) ->  | O73: =T(OFFSET('[MiracleNikkiJp_items.csv]MiracleNikkiJp_items'!R10C[-4],RC1,0,1,1)) ->  | P73: =T(OFFSET('[MiracleNikkiJp_items.csv]MiracleNikkiJp_items'!R10C[-4],RC1,0,1,1)) ->  | Q73: =T(OFFSET('[MiracleNikkiJp_items.csv]MiracleNikkiJp_items'!R10C[-4],RC1,0,1,1)) ->  | R73: =T(OFFSET('[MiracleNikkiJp_items.csv]MiracleNikkiJp_items'!R10C[-4],RC1,0,1,1)) ->  | S73: =T(OFFSET('[MiracleNikkiJp_items.csv]MiracleNikkiJp_items'!R10C[-4],RC1,0,1,1)) ->  | T73: =T(OFFSET('[MiracleNikkiJp_items.csv]MiracleNikkiJp_items'!R10C[-4],RC1,0,1,1)) ->  | U73: =T(OFFSET('[MiracleNikkiJp_items.csv]MiracleNikkiJp_items'!R10C[-4],RC1,0,1,1)) ->  | Y73: =T(OFFSET('[MiracleNikkiJp_items.csv]MiracleNikkiJp_items'!R10C[-7],RC1,0,1,1)) ->  | Z73: 22 | AA73: =IFERROR(VLOOKUP(RC[-16],R9C26:R17C36,2,FALSE),0)*R6C -> 0 | AB73: =IFERROR(VLOOKUP(RC[-16],R9C26:R17C36,3,FALSE),0)*R6C -> 0 | AC73: =IFERROR(VLOOKUP(RC[-16],R9C26:R17C36,4,FALSE),0)*R6C -> 0 | AD73: =IFERROR(VLOOKUP(RC[-16],R9C26:R17C36,5,FALSE),0)*R6C -> 0 | AE73: =IFERROR(VLOOKUP(RC[-16],R9C26:R17C36,6,FALSE),0)*R6C -> 0 | AF73: =IFERROR(VLOOKUP(RC[-16],R9C26:R17C36,7,FALSE),0)*R6C -> 0 | AG73: =IFERROR(VLOOKUP(RC[-16],R9C26:R17C36,8,FALSE),0)*R6C -> 0 | AH73: =IFERROR(VLOOKUP(RC[-16],R9C26:R17C36,9,FALSE),0)*R6C -> 0 | AI73: =IFERROR(VLOOKUP(RC[-16],R9C26:R17C36,10,FALSE),0)*R6C -> 0 | AJ73: =IFERROR(VLOOKUP(RC[-16],R9C26:R17C36,11,FALSE),0)*R6C -> 0 | AK73: =VLOOKUP(RC10,R9C38:R17C40,2,FALSE) -> 1 | AL73: =VLOOKUP(RC10,R9C38:R17C40,3,FALSE) -> 0 | AM73: =IF(OR(ISBLANK(R4C7),ISERROR(FIND(R4C7,RC21))),"　","●") ->  | AN73: =IF(OR(ISBLANK(R5C7),ISERROR(FIND(R5C7,RC21))),"　","●") ->  | AO73: =IF(RC39<>"●",VLOOKUP("評価しない",R9C42:R17C44,2,FALSE),VLOOKUP(R4C8,R9C42:R17C44,2,FALSE)) -> 1 | AP73: =IF(RC39<>"●",VLOOKUP("",R9C42:R17C44,3,FALSE),VLOOKUP(R4C8,R9C42:R17C44,3,FALSE)) -> 0 | AQ73: =IF(RC40<>"●",VLOOKUP("評価しない",R9C42:R17C44,2,FALSE),VLOOKUP(R5C8,R9C42:R17C44,2,FALSE)) -> 1 | AR73: =IF(RC40<>"●",VLOOKUP("",R9C42:R17C44,3,FALSE),VLOOKUP(R5C8,R9C42:R17C44,3,FALSE)) -> 0 | AS73: =IF(OR(ISBLANK(R6C7),ISERROR(FIND(R6C7,RC25))),"　","●") ->  | AT73: =IF(OR(ISBLANK(R7C7),ISERROR(FIND(R7C7,RC25))),"　","●") ->  | AU73: =IF(RC45<>"●",VLOOKUP("評価しない",R9C46:R17C48,2,FALSE),VLOOKUP(R6C8,R9C46:R17C48,2,FALSE)) -> 1 | AV73: =IF(RC45<>"●",VLOOKUP("",R9C46:R17C48,3,FALSE),VLOOKUP(R6C8,R9C46:R17C48,3,FALSE)) -> 0 | AW73: =IF(RC46<>"●",VLOOKUP("評価しない",R9C46:R17C48,2,FALSE),VLOOKUP(R7C8,R9C46:R17C48,2,FALSE)) -> 1 | AX73: =IF(RC46<>"●",VLOOKUP("",R9C46:R17C48,3,FALSE),VLOOKUP(R7C8,R9C46:R17C48,3,FALSE)) -> 0 | AY73: =SUM(RC27:RC36) -> 0 | AZ73: =RC37*RC41*RC43*RC47*RC49 -> 1 | BA73: =RC38+RC42+RC44+RC48+RC50 -> 0
A74: =OFFSET(R164C1,INT((RC26-1)/100),MOD(INT((RC26-1)/10),10),1,1)*10+MOD(RC26-1,10)+1 -> 23 | D74: =IF(AND(RC2<>"NG",OR(RC2<>"",RC3<>"",R9C4="×")),"◯","") ->  | E74: =IF(RC2="◯",RC6,"") ->  | F74: =T(OFFSET('[MiracleNikkiJp_items.csv]MiracleNikkiJp_items'!R10C[-3],RC1,0,1,1)) -> ヘアスタイル | G74: =T(OFFSET('[MiracleNikkiJp_items.csv]MiracleNikkiJp_items'!R10C[-2],RC1,0,1,1)) ->  | H74: =IF(RC4="",0,RC51*RC52+RC53) -> 0 | I74: =RC1 -> 23 | J74: =OFFSET('[MiracleNikkiJp_items.csv]MiracleNikkiJp_items'!R10C[-4],RC1,0,1,1) -> 0 | K74: =T(OFFSET('[MiracleNikkiJp_items.csv]MiracleNikkiJp_items'!R10C[-4],RC1,0,1,1)) ->  | L74: =T(OFFSET('[MiracleNikkiJp_items.csv]MiracleNikkiJp_items'!R10C[-4],RC1,0,1,1)) ->  | M74: =T(OFFSET('[MiracleNikkiJp_items.csv]MiracleNikkiJp_items'!R10C[-4],RC1,0,1,1)) ->  | N74: =T(OFFSET('[MiracleNikkiJp_items.csv]MiracleNikkiJp_items'!R10C[-4],RC1,0,1,1)) ->  | O74: =T(OFFSET('[MiracleNikkiJp_items.csv]MiracleNikkiJp_items'!R10C[-4],RC1,0,1,1)) ->  | P74: =T(OFFSET('[MiracleNikkiJp_items.csv]MiracleNikkiJp_items'!R10C[-4],RC1,0,1,1)) ->  | Q74: =T(OFFSET('[MiracleNikkiJp_items.csv]MiracleNikkiJp_items'!R10C[-4],RC1,0,1,1)) ->  | R74: =T(OFFSET('[MiracleNikkiJp_items.csv]MiracleNikkiJp_items'!R10C[-4],RC1,0,1,1)) ->  | S74: =T(OFFSET('[MiracleNikkiJp_items.csv]MiracleNikkiJp_items'!R10C[-4],RC1,0,1,1)) ->  | T74: =T(OFFSET('[MiracleNikkiJp_items.csv]MiracleNikkiJp_items'!R10C[-4],RC1,0,1,1)) ->  | U74: =T(OFFSET('[MiracleNikkiJp_items.csv]MiracleNikkiJp_items'!R10C[-4],RC1,0,1,1)) ->  | Y74: =T(OFFSET('[MiracleNikkiJp_items.csv]MiracleNikkiJp_items'!R10C[-7],RC1,0,1,1)) ->  | Z74: 23 | AA74: =IFERROR(VLOOKUP(RC[-16],R9C26:R17C36,2,FALSE),0)*R6C -> 0 | AB74: =IFERROR(VLOOKUP(RC[-16],R9C26:R17C36,3,FALSE),0)*R6C -> 0 | AC74: =IFERROR(VLOOKUP(RC[-16],R9C26:R17C36,4,FALSE),0)*R6C -> 0 | AD74: =IFERROR(VLOOKUP(RC[-16],R9C26:R17C36,5,FALSE),0)*R6C -> 0 | AE74: =IFERROR(VLOOKUP(RC[-16],R9C26:R17C36,6,FALSE),0)*R6C -> 0 | AF74: =IFERROR(VLOOKUP(RC[-16],R9C26:R17C36,7,FALSE),0)*R6C -> 0 | AG74: =IFERROR(VLOOKUP(RC[-16],R9C26:R17C36,8,FALSE),0)*R6C -> 0 | AH74: =IFERROR(VLOOKUP(RC[-16],R9C26:R17C36,9,FALSE),0)*R6C -> 0 | AI74: =IFERROR(VLOOKUP(RC[-16],R9C26:R17C36,10,FALSE),0)*R6C -> 0 | AJ74: =IFERROR(VLOOKUP(RC[-16],R9C26:R17C36,11,FALSE),0)*R6C -> 0 | AK74: =VLOOKUP(RC10,R9C38:R17C40,2,FALSE) -> 1 | AL74: =VLOOKUP(RC10,R9C38:R17C40,3,FALSE) -> 0 | AM74: =IF(OR(ISBLANK(R4C7),ISERROR(FIND(R4C7,RC21))),"　","●") ->  | AN74: =IF(OR(ISBLANK(R5C7),ISERROR(FIND(R5C7,RC21))),"　","●") ->  | AO74: =IF(RC39<>"●",VLOOKUP("評価しない",R9C42:R17C44,2,FALSE),VLOOKUP(R4C8,R9C42:R17C44,2,FALSE)) -> 1 | AP74: =IF(RC39<>"●",VLOOKUP("",R9C42:R17C44,3,FALSE),VLOOKUP(R4C8,R9C42:R17C44,3,FALSE)) -> 0 | AQ74: =IF(RC40<>"●",VLOOKUP("評価しない",R9C42:R17C44,2,FALSE),VLOOKUP(R5C8,R9C42:R17C44,2,FALSE)) -> 1 | AR74: =IF(RC40<>"●",VLOOKUP("",R9C42:R17C44,3,FALSE),VLOOKUP(R5C8,R9C42:R17C44,3,FALSE)) -> 0 | AS74: =IF(OR(ISBLANK(R6C7),ISERROR(FIND(R6C7,RC25))),"　","●") ->  | AT74: =IF(OR(ISBLANK(R7C7),ISERROR(FIND(R7C7,RC25))),"　","●") ->  | AU74: =IF(RC45<>"●",VLOOKUP("評価しない",R9C46:R17C48,2,FALSE),VLOOKUP(R6C8,R9C46:R17C48,2,FALSE)) -> 1 | AV74: =IF(RC45<>"●",VLOOKUP("",R9C46:R17C48,3,FALSE),VLOOKUP(R6C8,R9C46:R17C48,3,FALSE)) -> 0 | AW74: =IF(RC46<>"●",VLOOKUP("評価しない",R9C46:R17C48,2,FALSE),VLOOKUP(R7C8,R9C46:R17C48,2,FALSE)) -> 1 | AX74: =IF(RC46<>"●",VLOOKUP("",R9C46:R17C48,3,FALSE),VLOOKUP(R7C8,R9C46:R17C48,3,FALSE)) -> 0 | AY74: =SUM(RC27:RC36) -> 0 | AZ74: =RC37*RC41*RC43*RC47*RC49 -> 1 | BA74: =RC38+RC42+RC44+RC48+RC50 -> 0
A75: =OFFSET(R164C1,INT((RC26-1)/100),MOD(INT((RC26-1)/10),10),1,1)*10+MOD(RC26-1,10)+1 -> 24 | D75: =IF(AND(RC2<>"NG",OR(RC2<>"",RC3<>"",R9C4="×")),"◯","") ->  | E75: =IF(RC2="◯",RC6,"") ->  | F75: =T(OFFSET('[MiracleNikkiJp_items.csv]MiracleNikkiJp_items'!R10C[-3],RC1,0,1,1)) -> ヘアスタイル | G75: =T(OFFSET('[MiracleNikkiJp_items.csv]MiracleNikkiJp_items'!R10C[-2],RC1,0,1,1)) ->  | H75: =IF(RC4="",0,RC51*RC52+RC53) -> 0 | I75: =RC1 -> 24 | J75: =OFFSET('[MiracleNikkiJp_items.csv]MiracleNikkiJp_items'!R10C[-4],RC1,0,1,1) -> 0 | K75: =T(OFFSET('[MiracleNikkiJp_items.csv]MiracleNikkiJp_items'!R10C[-4],RC1,0,1,1)) ->  | L75: =T(OFFSET('[MiracleNikkiJp_items.csv]MiracleNikkiJp_items'!R10C[-4],RC1,0,1,1)) ->  | M75: =T(OFFSET('[MiracleNikkiJp_items.csv]MiracleNikkiJp_items'!R10C[-4],RC1,0,1,1)) ->  | N75: =T(OFFSET('[MiracleNikkiJp_items.csv]MiracleNikkiJp_items'!R10C[-4],RC1,0,1,1)) ->  | O75: =T(OFFSET('[MiracleNikkiJp_items.csv]MiracleNikkiJp_items'!R10C[-4],RC1,0,1,1)) ->  | P75: =T(OFFSET('[MiracleNikkiJp_items.csv]MiracleNikkiJp_items'!R10C[-4],RC1,0,1,1)) ->  | Q75: =T(OFFSET('[MiracleNikkiJp_items.csv]MiracleNikkiJp_items'!R10C[-4],RC1,0,1,1)) ->  | R75: =T(OFFSET('[MiracleNikkiJp_items.csv]MiracleNikkiJp_items'!R10C[-4],RC1,0,1,1)) ->  | S75: =T(OFFSET('[MiracleNikkiJp_items.csv]MiracleNikkiJp_items'!R10C[-4],RC1,0,1,1)) ->  | T75: =T(OFFSET('[MiracleNikkiJp_items.csv]MiracleNikkiJp_items'!R10C[-4],RC1,0,1,1)) ->  | U75: =T(OFFSET('[MiracleNikkiJp_items.csv]MiracleNikkiJp_items'!R10C[-4],RC1,0,1,1)) ->  | Y75: =T(OFFSET('[MiracleNikkiJp_items.csv]MiracleNikkiJp_items'!R10C[-7],RC1,0,1,1)) ->  | Z75: 24 | AA75: =IFERROR(VLOOKUP(RC[-16],R9C26:R17C36,2,FALSE),0)*R6C -> 0 | AB75: =IFERROR(VLOOKUP(RC[-16],R9C26:R17C36,3,FALSE),0)*R6C -> 0 | AC75: =IFERROR(VLOOKUP(RC[-16],R9C26:R17C36,4,FALSE),0)*R6C -> 0 | AD75: =IFERROR(VLOOKUP(RC[-16],R9C26:R17C36,5,FALSE),0)*R6C -> 0 | AE75: =IFERROR(VLOOKUP(RC[-16],R9C26:R17C36,6,FALSE),0)*R6C -> 0 | AF75: =IFERROR(VLOOKUP(RC[-16],R9C26:R17C36,7,FALSE),0)*R6C -> 0 | AG75: =IFERROR(VLOOKUP(RC[-16],R9C26:R17C36,8,FALSE),0)*R6C -> 0 | AH75: =IFERROR(VLOOKUP(RC[-16],R9C26:R17C36,9,FALSE),0)*R6C -> 0 | AI75: =IFERROR(VLOOKUP(RC[-16],R9C26:R17C36,10,FALSE),0)*R6C -> 0 | AJ75: =IFERROR(VLOOKUP(RC[-16],R9C26:R17C36,11,FALSE),0)*R6C -> 0 | AK75: =VLOOKUP(RC10,R9C38:R17C40,2,FALSE) -> 1 | AL75: =VLOOKUP(RC10,R9C38:R17C40,3,FALSE) -> 0 | AM75: =IF(OR(ISBLANK(R4C7),ISERROR(FIND(R4C7,RC21))),"　","●") ->  | AN75: =IF(OR(ISBLANK(R5C7),ISERROR(FIND(R5C7,RC21))),"　","●") ->  | AO75: =IF(RC39<>"●",VLOOKUP("評価しない",R9C42:R17C44,2,FALSE),VLOOKUP(R4C8,R9C42:R17C44,2,FALSE)) -> 1 | AP75: =IF(RC39<>"●",VLOOKUP("",R9C42:R17C44,3,FALSE),VLOOKUP(R4C8,R9C42:R17C44,3,FALSE)) -> 0 | AQ75: =IF(RC40<>"●",VLOOKUP("評価しない",R9C42:R17C44,2,FALSE),VLOOKUP(R5C8,R9C42:R17C44,2,FALSE)) -> 1 | AR75: =IF(RC40<>"●",VLOOKUP("",R9C42:R17C44,3,FALSE),VLOOKUP(R5C8,R9C42:R17C44,3,FALSE)) -> 0 | AS75: =IF(OR(ISBLANK(R6C7),ISERROR(FIND(R6C7,RC25))),"　","●") ->  | AT75: =IF(OR(ISBLANK(R7C7),ISERROR(FIND(R7C7,RC25))),"　","●") ->  | AU75: =IF(RC45<>"●",VLOOKUP("評価しない",R9C46:R17C48,2,FALSE),VLOOKUP(R6C8,R9C46:R17C48,2,FALSE)) -> 1 | AV75: =IF(RC45<>"●",VLOOKUP("",R9C46:R17C48,3,FALSE),VLOOKUP(R6C8,R9C46:R17C48,3,FALSE)) -> 0 | AW75: =IF(RC46<>"●",VLOOKUP("評価しない",R9C46:R17C48,2,FALSE),VLOOKUP(R7C8,R9C46:R17C48,2,FALSE)) -> 1 | AX75: =IF(RC46<>"●",VLOOKUP("",R9C46:R17C48,3,FALSE),VLOOKUP(R7C8,R9C46:R17C48,3,FALSE)) -> 0 | AY75: =SUM(RC27:RC36) -> 0 | AZ75: =RC37*RC41*RC43*RC47*RC49 -> 1 | BA75: =RC38+RC42+RC44+RC48+RC50 -> 0
A76: =OFFSET(R164C1,INT((RC26-1)/100),MOD(INT((RC26-1)/10),10),1,1)*10+MOD(RC26-1,10)+1 -> 25 | D76: =IF(AND(RC2<>"NG",OR(RC2<>"",RC3<>"",R9C4="×")),"◯","") ->  | E76: =IF(RC2="◯",RC6,"") ->  | F76: =T(OFFSET('[MiracleNikkiJp_items.csv]MiracleNikkiJp_items'!R10C[-3],RC1,0,1,1)) -> ヘアスタイル | G76: =T(OFFSET('[MiracleNikkiJp_items.csv]MiracleNikkiJp_items'!R10C[-2],RC1,0,1,1)) ->  | H76: =IF(RC4="",0,RC51*RC52+RC53) -> 0 | I76: =RC1 -> 25 | J76: =OFFSET('[MiracleNikkiJp_items.csv]MiracleNikkiJp_items'!R10C[-4],RC1,0,1,1) -> 0 | K76: =T(OFFSET('[MiracleNikkiJp_items.csv]MiracleNikkiJp_items'!R10C[-4],RC1,0,1,1)) ->  | L76: =T(OFFSET('[MiracleNikkiJp_items.csv]MiracleNikkiJp_items'!R10C[-4],RC1,0,1,1)) ->  | M76: =T(OFFSET('[MiracleNikkiJp_items.csv]MiracleNikkiJp_items'!R10C[-4],RC1,0,1,1)) ->  | N76: =T(OFFSET('[MiracleNikkiJp_items.csv]MiracleNikkiJp_items'!R10C[-4],RC1,0,1,1)) ->  | O76: =T(OFFSET('[MiracleNikkiJp_items.csv]MiracleNikkiJp_items'!R10C[-4],RC1,0,1,1)) ->  | P76: =T(OFFSET('[MiracleNikkiJp_items.csv]MiracleNikkiJp_items'!R10C[-4],RC1,0,1,1)) ->  | Q76: =T(OFFSET('[MiracleNikkiJp_items.csv]MiracleNikkiJp_items'!R10C[-4],RC1,0,1,1)) ->  | R76: =T(OFFSET('[MiracleNikkiJp_items.csv]MiracleNikkiJp_items'!R10C[-4],RC1,0,1,1)) ->  | S76: =T(OFFSET('[MiracleNikkiJp_items.csv]MiracleNikkiJp_items'!R10C[-4],RC1,0,1,1)) ->  | T76: =T(OFFSET('[MiracleNikkiJp_items.csv]MiracleNikkiJp_items'!R10C[-4],RC1,0,1,1)) ->  | U76: =T(OFFSET('[MiracleNikkiJp_items.csv]MiracleNikkiJp_items'!R10C[-4],RC1,0,1,1)) ->  | Y76: =T(OFFSET('[MiracleNikkiJp_items.csv]MiracleNikkiJp_items'!R10C[-7],RC1,0,1,1)) ->  | Z76: 25 | AA76: =IFERROR(VLOOKUP(RC[-16],R9C26:R17C36,2,FALSE),0)*R6C -> 0 | AB76: =IFERROR(VLOOKUP(RC[-16],R9C26:R17C36,3,FALSE),0)*R6C -> 0 | AC76: =IFERROR(VLOOKUP(RC[-16],R9C26:R17C36,4,FALSE),0)*R6C -> 0 | AD76: =IFERROR(VLOOKUP(RC[-16],R9C26:R17C36,5,FALSE),0)*R6C -> 0 | AE76: =IFERROR(VLOOKUP(RC[-16],R9C26:R17C36,6,FALSE),0)*R6C -> 0 | AF76: =IFERROR(VLOOKUP(RC[-16],R9C26:R17C36,7,FALSE),0)*R6C -> 0 | AG76: =IFERROR(VLOOKUP(RC[-16],R9C26:R17C36,8,FALSE),0)*R6C -> 0 | AH76: =IFERROR(VLOOKUP(RC[-16],R9C26:R17C36,9,FALSE),0)*R6C -> 0 | AI76: =IFERROR(VLOOKUP(RC[-16],R9C26:R17C36,10,FALSE),0)*R6C -> 0 | AJ76: =IFERROR(VLOOKUP(RC[-16],R9C26:R17C36,11,FALSE),0)*R6C -> 0 | AK76: =VLOOKUP(RC10,R9C38:R17C40,2,FALSE) -> 1 | AL76: =VLOOKUP(RC10,R9C38:R17C40,3,FALSE) -> 0 | AM76: =IF(OR(ISBLANK(R4C7),ISERROR(FIND(R4C7,RC21))),"　","●") ->  | AN76: =IF(OR(ISBLANK(R5C7),ISERROR(FIND(R5C7,RC21))),"　","●") ->  | AO76: =IF(RC39<>"●",VLOOKUP("評価しない",R9C42:R17C44,2,FALSE),VLOOKUP(R4C8,R9C42:R17C44,2,FALSE)) -> 1 | AP76: =IF(RC39<>"●",VLOOKUP("",R9C42:R17C44,3,FALSE),VLOOKUP(R4C8,R9C42:R17C44,3,FALSE)) -> 0 | AQ76: =IF(RC40<>"●",VLOOKUP("評価しない",R9C42:R17C44,2,FALSE),VLOOKUP(R5C8,R9C42:R17C44,2,FALSE)) -> 1 | AR76: =IF(RC40<>"●",VLOOKUP("",R9C42:R17C44,3,FALSE),VLOOKUP(R5C8,R9C42:R17C44,3,FALSE)) -> 0 | AS76: =IF(OR(ISBLANK(R6C7),ISERROR(FIND(R6C7,RC25))),"　","●") ->  | AT76: =IF(OR(ISBLANK(R7C7),ISERROR(FIND(R7C7,RC25))),"　","●") ->  | AU76: =IF(RC45<>"●",VLOOKUP("評価しない",R9C46:R17C48,2,FALSE),VLOOKUP(R6C8,R9C46:R17C48,2,FALSE)) -> 1 | AV76: =IF(RC45<>"●",VLOOKUP("",R9C46:R17C48,3,FALSE),VLOOKUP(R6C8,R9C46:R17C48,3,FALSE)) -> 0 | AW76: =IF(RC46<>"●",VLOOKUP("評価しない",R9C46:R17C48,2,FALSE),VLOOKUP(R7C8,R9C46:R17C48,2,FALSE)) -> 1 | AX76: =IF(RC46<>"●",VLOOKUP("",R9C46:R17C48,3,FALSE),VLOOKUP(R7C8,R9C46:R17C48,3,FALSE)) -> 0 | AY76: =SUM(RC27:RC36) -> 0 | AZ76: =RC37*RC41*RC43*RC47*RC49 -> 1 | BA76: =RC38+RC42+RC44+RC48+RC50 -> 0
A77: =OFFSET(R164C1,INT((RC26-1)/100),MOD(INT((RC26-1)/10),10),1,1)*10+MOD(RC26-1,10)+1 -> 26 | D77: =IF(AND(RC2<>"NG",OR(RC2<>"",RC3<>"",R9C4="×")),"◯","") ->  | E77: =IF(RC2="◯",RC6,"") ->  | F77: =T(OFFSET('[MiracleNikkiJp_items.csv]MiracleNikkiJp_items'!R10C[-3],RC1,0,1,1)) -> ヘアスタイル | G77: =T(OFFSET('[MiracleNikkiJp_items.csv]MiracleNikkiJp_items'!R10C[-2],RC1,0,1,1)) ->  | H77: =IF(RC4="",0,RC51*RC52+RC53) -> 0 | I77: =RC1 -> 26 | J77: =OFFSET('[MiracleNikkiJp_items.csv]MiracleNikkiJp_items'!R10C[-4],RC1,0,1,1) -> 0 | K77: =T(OFFSET('[MiracleNikkiJp_items.csv]MiracleNikkiJp_items'!R10C[-4],RC1,0,1,1)) ->  | L77: =T(OFFSET('[MiracleNikkiJp_items.csv]MiracleNikkiJp_items'!R10C[-4],RC1,0,1,1)) ->  | M77: =T(OFFSET('[MiracleNikkiJp_items.csv]MiracleNikkiJp_items'!R10C[-4],RC1,0,1,1)) ->  | N77: =T(OFFSET('[MiracleNikkiJp_items.csv]MiracleNikkiJp_items'!R10C[-4],RC1,0,1,1)) ->  | O77: =T(OFFSET('[MiracleNikkiJp_items.csv]MiracleNikkiJp_items'!R10C[-4],RC1,0,1,1)) ->  | P77: =T(OFFSET('[MiracleNikkiJp_items.csv]MiracleNikkiJp_items'!R10C[-4],RC1,0,1,1)) ->  | Q77: =T(OFFSET('[MiracleNikkiJp_items.csv]MiracleNikkiJp_items'!R10C[-4],RC1,0,1,1)) ->  | R77: =T(OFFSET('[MiracleNikkiJp_items.csv]MiracleNikkiJp_items'!R10C[-4],RC1,0,1,1)) ->  | S77: =T(OFFSET('[MiracleNikkiJp_items.csv]MiracleNikkiJp_items'!R10C[-4],RC1,0,1,1)) ->  | T77: =T(OFFSET('[MiracleNikkiJp_items.csv]MiracleNikkiJp_items'!R10C[-4],RC1,0,1,1)) ->  | U77: =T(OFFSET('[MiracleNikkiJp_items.csv]MiracleNikkiJp_items'!R10C[-4],RC1,0,1,1)) ->  | Y77: =T(OFFSET('[MiracleNikkiJp_items.csv]MiracleNikkiJp_items'!R10C[-7],RC1,0,1,1)) ->  | Z77: 26 | AA77: =IFERROR(VLOOKUP(RC[-16],R9C26:R17C36,2,FALSE),0)*R6C -> 0 | AB77: =IFERROR(VLOOKUP(RC[-16],R9C26:R17C36,3,FALSE),0)*R6C -> 0 | AC77: =IFERROR(VLOOKUP(RC[-16],R9C26:R17C36,4,FALSE),0)*R6C -> 0 | AD77: =IFERROR(VLOOKUP(RC[-16],R9C26:R17C36,5,FALSE),0)*R6C -> 0 | AE77: =IFERROR(VLOOKUP(RC[-16],R9C26:R17C36,6,FALSE),0)*R6C -> 0 | AF77: =IFERROR(VLOOKUP(RC[-16],R9C26:R17C36,7,FALSE),0)*R6C -> 0 | AG77: =IFERROR(VLOOKUP(RC[-16],R9C26:R17C36,8,FALSE),0)*R6C -> 0 | AH77: =IFERROR(VLOOKUP(RC[-16],R9C26:R17C36,9,FALSE),0)*R6C -> 0 | AI77: =IFERROR(VLOOKUP(RC[-16],R9C26:R17C36,10,FALSE),0)*R6C -> 0 | AJ77: =IFERROR(VLOOKUP(RC[-16],R9C26:R17C36,11,FALSE),0)*R6C -> 0 | AK77: =VLOOKUP(RC10,R9C38:R17C40,2,FALSE) -> 1 | AL77: =VLOOKUP(RC10,R9C38:R17C40,3,FALSE) -> 0 | AM77: =IF(OR(ISBLANK(R4C7),ISERROR(FIND(R4C7,RC21))),"　","●") ->  | AN77: =IF(OR(ISBLANK(R5C7),ISERROR(FIND(R5C7,RC21))),"　","●") ->  | AO77: =IF(RC39<>"●",VLOOKUP("評価しない",R9C42:R17C44,2,FALSE),VLOOKUP(R4C8,R9C42:R17C44,2,FALSE)) -> 1 | AP77: =IF(RC39<>"●",VLOOKUP("",R9C42:R17C44,3,FALSE),VLOOKUP(R4C8,R9C42:R17C44,3,FALSE)) -> 0 | AQ77: =IF(RC40<>"●",VLOOKUP("評価しない",R9C42:R17C44,2,FALSE),VLOOKUP(R5C8,R9C42:R17C44,2,FALSE)) -> 1 | AR77: =IF(RC40<>"●",VLOOKUP("",R9C42:R17C44,3,FALSE),VLOOKUP(R5C8,R9C42:R17C44,3,FALSE)) -> 0 | AS77: =IF(OR(ISBLANK(R6C7),ISERROR(FIND(R6C7,RC25))),"　","●") ->  | AT77: =IF(OR(ISBLANK(R7C7),ISERROR(FIND(R7C7,RC25))),"　","●") ->  | AU77: =IF(RC45<>"●",VLOOKUP("評価しない",R9C46:R17C48,2,FALSE),VLOOKUP(R6C8,R9C46:R17C48,2,FALSE)) -> 1 | AV77: =IF(RC45<>"●",VLOOKUP("",R9C46:R17C48,3,FALSE),VLOOKUP(R6C8,R9C46:R17C48,3,FALSE)) -> 0 | AW77: =IF(RC46<>"●",VLOOKUP("評価しない",R9C46:R17C48,2,FALSE),VLOOKUP(R7C8,R9C46:R17C48,2,FALSE)) -> 1 | AX77: =IF(RC46<>"●",VLOOKUP("",R9C46:R17C48,3,FALSE),VLOOKUP(R7C8,R9C46:R17C48,3,FALSE)) -> 0 | AY77: =SUM(RC27:RC36) -> 0 | AZ77: =RC37*RC41*RC43*RC47*RC49 -> 1 | BA77: =RC38+RC42+RC44+RC48+RC50 -> 0
A78: =OFFSET(R164C1,INT((RC26-1)/100),MOD(INT((RC26-1)/10),10),1,1)*10+MOD(RC26-1,10)+1 -> 27 | D78: =IF(AND(RC2<>"NG",OR(RC2<>"",RC3<>"",R9C4="×")),"◯","") ->  | E78: =IF(RC2="◯",RC6,"") ->  | F78: =T(OFFSET('[MiracleNikkiJp_items.csv]MiracleNikkiJp_items'!R10C[-3],RC1,0,1,1)) -> ヘアスタイル | G78: =T(OFFSET('[MiracleNikkiJp_items.csv]MiracleNikkiJp_items'!R10C[-2],RC1,0,1,1)) ->  | H78: =IF(RC4="",0,RC51*RC52+RC53) -> 0 | I78: =RC1 -> 27 | J78: =OFFSET('[MiracleNikkiJp_items.csv]MiracleNikkiJp_items'!R10C[-4],RC1,0,1,1) -> 0 | K78: =T(OFFSET('[MiracleNikkiJp_items.csv]MiracleNikkiJp_items'!R10C[-4],RC1,0,1,1)) ->  | L78: =T(OFFSET('[MiracleNikkiJp_items.csv]MiracleNikkiJp_items'!R10C[-4],RC1,0,1,1)) ->  | M78: =T(OFFSET('[MiracleNikkiJp_items.csv]MiracleNikkiJp_items'!R10C[-4],RC1,0,1,1)) ->  | N78: =T(OFFSET('[MiracleNikkiJp_items.csv]MiracleNikkiJp_items'!R10C[-4],RC1,0,1,1)) ->  | O78: =T(OFFSET('[MiracleNikkiJp_items.csv]MiracleNikkiJp_items'!R10C[-4],RC1,0,1,1)) ->  | P78: =T(OFFSET('[MiracleNikkiJp_items.csv]MiracleNikkiJp_items'!R10C[-4],RC1,0,1,1)) ->  | Q78: =T(OFFSET('[MiracleNikkiJp_items.csv]MiracleNikkiJp_items'!R10C[-4],RC1,0,1,1)) ->  | R78: =T(OFFSET('[MiracleNikkiJp_items.csv]MiracleNikkiJp_items'!R10C[-4],RC1,0,1,1)) ->  | S78: =T(OFFSET('[MiracleNikkiJp_items.csv]MiracleNikkiJp_items'!R10C[-4],RC1,0,1,1)) ->  | T78: =T(OFFSET('[MiracleNikkiJp_items.csv]MiracleNikkiJp_items'!R10C[-4],RC1,0,1,1)) ->  | U78: =T(OFFSET('[MiracleNikkiJp_items.csv]MiracleNikkiJp_items'!R10C[-4],RC1,0,1,1)) ->  | Y78: =T(OFFSET('[MiracleNikkiJp_items.csv]MiracleNikkiJp_items'!R10C[-7],RC1,0,1,1)) ->  | Z78: 27 | AA78: =IFERROR(VLOOKUP(RC[-16],R9C26:R17C36,2,FALSE),0)*R6C -> 0 | AB78: =IFERROR(VLOOKUP(RC[-16],R9C26:R17C36,3,FALSE),0)*R6C -> 0 | AC78: =IFERROR(VLOOKUP(RC[-16],R9C26:R17C36,4,FALSE),0)*R6C -> 0 | AD78: =IFERROR(VLOOKUP(RC[-16],R9C26:R17C36,5,FALSE),0)*R6C -> 0 | AE78: =IFERROR(VLOOKUP(RC[-16],R9C26:R17C36,6,FALSE),0)*R6C -> 0 | AF78: =IFERROR(VLOOKUP(RC[-16],R9C26:R17C36,7,FALSE),0)*R6C -> 0 | AG78: =IFERROR(VLOOKUP(RC[-16],R9C26:R17C36,8,FALSE),0)*R6C -> 0 | AH78: =IFERROR(VLOOKUP(RC[-16],R9C26:R17C36,9,FALSE),0)*R6C -> 0 | AI78: =IFERROR(VLOOKUP(RC[-16],R9C26:R17C36,10,FALSE),0)*R6C -> 0 | AJ78: =IFERROR(VLOOKUP(RC[-16],R9C26:R17C36,11,FALSE),0)*R6C -> 0 | AK78: =VLOOKUP(RC10,R9C38:R17C40,2,FALSE) -> 1 | AL78: =VLOOKUP(RC10,R9C38:R17C40,3,FALSE) -> 0 | AM78: =IF(OR(ISBLANK(R4C7),ISERROR(FIND(R4C7,RC21))),"　","●") ->  | AN78: =IF(OR(ISBLANK(R5C7),ISERROR(FIND(R5C7,RC21))),"　","●") ->  | AO78: =IF(RC39<>"●",VLOOKUP("評価しない",R9C42:R17C44,2,FALSE),VLOOKUP(R4C8,R9C42:R17C44,2,FALSE)) -> 1 | AP78: =IF(RC39<>"●",VLOOKUP("",R9C42:R17C44,3,FALSE),VLOOKUP(R4C8,R9C42:R17C44,3,FALSE)) -> 0 | AQ78: =IF(RC40<>"●",VLOOKUP("評価しない",R9C42:R17C44,2,FALSE),VLOOKUP(R5C8,R9C42:R17C44,2,FALSE)) -> 1 | AR78: =IF(RC40<>"●",VLOOKUP("",R9C42:R17C44,3,FALSE),VLOOKUP(R5C8,R9C42:R17C44,3,FALSE)) -> 0 | AS78: =IF(OR(ISBLANK(R6C7),ISERROR(FIND(R6C7,RC25))),"　","●") ->  | AT78: =IF(OR(ISBLANK(R7C7),ISERROR(FIND(R7C7,RC25))),"　","●") ->  | AU78: =IF(RC45<>"●",VLOOKUP("評価しない",R9C46:R17C48,2,FALSE),VLOOKUP(R6C8,R9C46:R17C48,2,FALSE)) -> 1 | AV78: =IF(RC45<>"●",VLOOKUP("",R9C46:R17C48,3,FALSE),VLOOKUP(R6C8,R9C46:R17C48,3,FALSE)) -> 0 | AW78: =IF(RC46<>"●",VLOOKUP("評価しない",R9C46:R17C48,2,FALSE),VLOOKUP(R7C8,R9C46:R17C48,2,FALSE)) -> 1 | AX78: =IF(RC46<>"●",VLOOKUP("",R9C46:R17C48,3,FALSE),VLOOKUP(R7C8,R9C46:R17C48,3,FALSE)) -> 0 | AY78: =SUM(RC27:RC36) -> 0 | AZ78: =RC37*RC41*RC43*RC47*RC49 -> 1 | BA78: =RC38+RC42+RC44+RC48+RC50 -> 0
A79: =OFFSET(R164C1,INT((RC26-1)/100),MOD(INT((RC26-1)/10),10),1,1)*10+MOD(RC26-1,10)+1 -> 28 | D79: =IF(AND(RC2<>"NG",OR(RC2<>"",RC3<>"",R9C4="×")),"◯","") ->  | E79: =IF(RC2="◯",RC6,"") ->  | F79: =T(OFFSET('[MiracleNikkiJp_items.csv]MiracleNikkiJp_items'!R10C[-3],RC1,0,1,1)) -> ヘアスタイル | G79: =T(OFFSET('[MiracleNikkiJp_items.csv]MiracleNikkiJp_items'!R10C[-2],RC1,0,1,1)) ->  | H79: =IF(RC4="",0,RC51*RC52+RC53) -> 0 | I79: =RC1 -> 28 | J79: =OFFSET('[MiracleNikkiJp_items.csv]MiracleNikkiJp_items'!R10C[-4],RC1,0,1,1) -> 0 | K79: =T(OFFSET('[MiracleNikkiJp_items.csv]MiracleNikkiJp_items'!R10C[-4],RC1,0,1,1)) ->  | L79: =T(OFFSET('[MiracleNikkiJp_items.csv]MiracleNikkiJp_items'!R10C[-4],RC1,0,1,1)) ->  | M79: =T(OFFSET('[MiracleNikkiJp_items.csv]MiracleNikkiJp_items'!R10C[-4],RC1,0,1,1)) ->  | N79: =T(OFFSET('[MiracleNikkiJp_items.csv]MiracleNikkiJp_items'!R10C[-4],RC1,0,1,1)) ->  | O79: =T(OFFSET('[MiracleNikkiJp_items.csv]MiracleNikkiJp_items'!R10C[-4],RC1,0,1,1)) ->  | P79: =T(OFFSET('[MiracleNikkiJp_items.csv]MiracleNikkiJp_items'!R10C[-4],RC1,0,1,1)) ->  | Q79: =T(OFFSET('[MiracleNikkiJp_items.csv]MiracleNikkiJp_items'!R10C[-4],RC1,0,1,1)) ->  | R79: =T(OFFSET('[MiracleNikkiJp_items.csv]MiracleNikkiJp_items'!R10C[-4],RC1,0,1,1)) ->  | S79: =T(OFFSET('[MiracleNikkiJp_items.csv]MiracleNikkiJp_items'!R10C[-4],RC1,0,1,1)) ->  | T79: =T(OFFSET('[MiracleNikkiJp_items.csv]MiracleNikkiJp_items'!R10C[-4],RC1,0,1,1)) ->  | U79: =T(OFFSET('[MiracleNikkiJp_items.csv]MiracleNikkiJp_items'!R10C[-4],RC1,0,1,1)) ->  | Y79: =T(OFFSET('[MiracleNikkiJp_items.csv]MiracleNikkiJp_items'!R10C[-7],RC1,0,1,1)) ->  | Z79: 28 | AA79: =IFERROR(VLOOKUP(RC[-16],R9C26:R17C36,2,FALSE),0)*R6C -> 0 | AB79: =IFERROR(VLOOKUP(RC[-16],R9C26:R17C36,3,FALSE),0)*R6C -> 0 | AC79: =IFERROR(VLOOKUP(RC[-16],R9C26:R17C36,4,FALSE),0)*R6C -> 0 | AD79: =IFERROR(VLOOKUP(RC[-16],R9C26:R17C36,5,FALSE),0)*R6C -> 0 | AE79: =IFERROR(VLOOKUP(RC[-16],R9C26:R17C36,6,FALSE),0)*R6C -> 0 | AF79: =IFERROR(VLOOKUP(RC[-16],R9C26:R17C36,7,FALSE),0)*R6C -> 0 | AG79: =IFERROR(VLOOKUP(RC[-16],R9C26:R17C36,8,FALSE),0)*R6C -> 0 | AH79: =IFERROR(VLOOKUP(RC[-16],R9C26:R17C36,9,FALSE),0)*R6C -> 0 | AI79: =IFERROR(VLOOKUP(RC[-16],R9C26:R17C36,10,FALSE),0)*R6C -> 0 | AJ79: =IFERROR(VLOOKUP(RC[-16],R9C26:R17C36,11,FALSE),0)*R6C -> 0 | AK79: =VLOOKUP(RC10,R9C38:R17C40,2,FALSE) -> 1 | AL79: =VLOOKUP(RC10,R9C38:R17C40,3,FALSE) -> 0 | AM79: =IF(OR(ISBLANK(R4C7),ISERROR(FIND(R4C7,RC21))),"　","●") ->  | AN79: =IF(OR(ISBLANK(R5C7),ISERROR(FIND(R5C7,RC21))),"　","●") ->  | AO79: =IF(RC39<>"●",VLOOKUP("評価しない",R9C42:R17C44,2,FALSE),VLOOKUP(R4C8,R9C42:R17C44,2,FALSE)) -> 1 | AP79: =IF(RC39<>"●",VLOOKUP("",R9C42:R17C44,3,FALSE),VLOOKUP(R4C8,R9C42:R17C44,3,FALSE)) -> 0 | AQ79: =IF(RC40<>"●",VLOOKUP("評価しない",R9C42:R17C44,2,FALSE),VLOOKUP(R5C8,R9C42:R17C44,2,FALSE)) -> 1 | AR79: =IF(RC40<>"●",VLOOKUP("",R9C42:R17C44,3,FALSE),VLOOKUP(R5C8,R9C42:R17C44,3,FALSE)) -> 0 | AS79: =IF(OR(ISBLANK(R6C7),ISERROR(FIND(R6C7,RC25))),"　","●") ->  | AT79: =IF(OR(ISBLANK(R7C7),ISERROR(FIND(R7C7,RC25))),"　","●") ->  | AU79: =IF(RC45<>"●",VLOOKUP("評価しない",R9C46:R17C48,2,FALSE),VLOOKUP(R6C8,R9C46:R17C48,2,FALSE)) -> 1 | AV79: =IF(RC45<>"●",VLOOKUP("",R9C46:R17C48,3,FALSE),VLOOKUP(R6C8,R9C46:R17C48,3,FALSE)) -> 0 | AW79: =IF(RC46<>"●",VLOOKUP("評価しない",R9C46:R17C48,2,FALSE),VLOOKUP(R7C8,R9C46:R17C48,2,FALSE)) -> 1 | AX79: =IF(RC46<>"●",VLOOKUP("",R9C46:R17C48,3,FALSE),VLOOKUP(R7C8,R9C46:R17C48,3,FALSE)) -> 0 | AY79: =SUM(RC27:RC36) -> 0 | AZ79: =RC37*RC41*RC43*RC47*RC49 -> 1 | BA79: =RC38+RC42+RC44+RC48+RC50 -> 0
A80: =OFFSET(R164C1,INT((RC26-1)/100),MOD(INT((RC26-1)/10),10),1,1)*10+MOD(RC26-1,10)+1 -> 29 | D80: =IF(AND(RC2<>"NG",OR(RC2<>"",RC3<>"",R9C4="×")),"◯","") ->  | E80: =IF(RC2="◯",RC6,"") ->  | F80: =T(OFFSET('[MiracleNikkiJp_items.csv]MiracleNikkiJp_items'!R10C[-3],RC1,0,1,1)) -> ヘアスタイル | G80: =T(OFFSET('[MiracleNikkiJp_items.csv]MiracleNikkiJp_items'!R10C[-2],RC1,0,1,1)) ->  | H80: =IF(RC4="",0,RC51*RC52+RC53) -> 0 | I80: =RC1 -> 29 | J80: =OFFSET('[MiracleNikkiJp_items.csv]MiracleNikkiJp_items'!R10C[-4],RC1,0,1,1) -> 0 | K80: =T(OFFSET('[MiracleNikkiJp_items.csv]MiracleNikkiJp_items'!R10C[-4],RC1,0,1,1)) ->  | L80: =T(OFFSET('[MiracleNikkiJp_items.csv]MiracleNikkiJp_items'!R10C[-4],RC1,0,1,1)) ->  | M80: =T(OFFSET('[MiracleNikkiJp_items.csv]MiracleNikkiJp_items'!R10C[-4],RC1,0,1,1)) ->  | N80: =T(OFFSET('[MiracleNikkiJp_items.csv]MiracleNikkiJp_items'!R10C[-4],RC1,0,1,1)) ->  | O80: =T(OFFSET('[MiracleNikkiJp_items.csv]MiracleNikkiJp_items'!R10C[-4],RC1,0,1,1)) ->  | P80: =T(OFFSET('[MiracleNikkiJp_items.csv]MiracleNikkiJp_items'!R10C[-4],RC1,0,1,1)) ->  | Q80: =T(OFFSET('[MiracleNikkiJp_items.csv]MiracleNikkiJp_items'!R10C[-4],RC1,0,1,1)) ->  | R80: =T(OFFSET('[MiracleNikkiJp_items.csv]MiracleNikkiJp_items'!R10C[-4],RC1,0,1,1)) ->  | S80: =T(OFFSET('[MiracleNikkiJp_items.csv]MiracleNikkiJp_items'!R10C[-4],RC1,0,1,1)) ->  | T80: =T(OFFSET('[MiracleNikkiJp_items.csv]MiracleNikkiJp_items'!R10C[-4],RC1,0,1,1)) ->  | U80: =T(OFFSET('[MiracleNikkiJp_items.csv]MiracleNikkiJp_items'!R10C[-4],RC1,0,1,1)) ->  | Y80: =T(OFFSET('[MiracleNikkiJp_items.csv]MiracleNikkiJp_items'!R10C[-7],RC1,0,1,1)) ->  | Z80: 29 | AA80: =IFERROR(VLOOKUP(RC[-16],R9C26:R17C36,2,FALSE),0)*R6C -> 0 | AB80: =IFERROR(VLOOKUP(RC[-16],R9C26:R17C36,3,FALSE),0)*R6C -> 0 | AC80: =IFERROR(VLOOKUP(RC[-16],R9C26:R17C36,4,FALSE),0)*R6C -> 0 | AD80: =IFERROR(VLOOKUP(RC[-16],R9C26:R17C36,5,FALSE),0)*R6C -> 0 | AE80: =IFERROR(VLOOKUP(RC[-16],R9C26:R17C36,6,FALSE),0)*R6C -> 0 | AF80: =IFERROR(VLOOKUP(RC[-16],R9C26:R17C36,7,FALSE),0)*R6C -> 0 | AG80: =IFERROR(VLOOKUP(RC[-16],R9C26:R17C36,8,FALSE),0)*R6C -> 0 | AH80: =IFERROR(VLOOKUP(RC[-16],R9C26:R17C36,9,FALSE),0)*R6C -> 0 | AI80: =IFERROR(VLOOKUP(RC[-16],R9C26:R17C36,10,FALSE),0)*R6C -> 0 | AJ80: =IFERROR(VLOOKUP(RC[-16],R9C26:R17C36,11,FALSE),0)*R6C -> 0 | AK80: =VLOOKUP(RC10,R9C38:R17C40,2,FALSE) -> 1 | AL80: =VLOOKUP(RC10,R9C38:R17C40,3,FALSE) -> 0 | AM80: =IF(OR(ISBLANK(R4C7),ISERROR(FIND(R4C7,RC21))),"　","●") ->  | AN80: =IF(OR(ISBLANK(R5C7),ISERROR(FIND(R5C7,RC21))),"　","●") ->  | AO80: =IF(RC39<>"●",VLOOKUP("評価しない",R9C42:R17C44,2,FALSE),VLOOKUP(R4C8,R9C42:R17C44,2,FALSE)) -> 1 | AP80: =IF(RC39<>"●",VLOOKUP("",R9C42:R17C44,3,FALSE),VLOOKUP(R4C8,R9C42:R17C44,3,FALSE)) -> 0 | AQ80: =IF(RC40<>"●",VLOOKUP("評価しない",R9C42:R17C44,2,FALSE),VLOOKUP(R5C8,R9C42:R17C44,2,FALSE)) -> 1 | AR80: =IF(RC40<>"●",VLOOKUP("",R9C42:R17C44,3,FALSE),VLOOKUP(R5C8,R9C42:R17C44,3,FALSE)) -> 0 | AS80: =IF(OR(ISBLANK(R6C7),ISERROR(FIND(R6C7,RC25))),"　","●") ->  | AT80: =IF(OR(ISBLANK(R7C7),ISERROR(FIND(R7C7,RC25))),"　","●") ->  | AU80: =IF(RC45<>"●",VLOOKUP("評価しない",R9C46:R17C48,2,FALSE),VLOOKUP(R6C8,R9C46:R17C48,2,FALSE)) -> 1 | AV80: =IF(RC45<>"●",VLOOKUP("",R9C46:R17C48,3,FALSE),VLOOKUP(R6C8,R9C46:R17C48,3,FALSE)) -> 0 | AW80: =IF(RC46<>"●",VLOOKUP("評価しない",R9C46:R17C48,2,FALSE),VLOOKUP(R7C8,R9C46:R17C48,2,FALSE)) -> 1 | AX80: =IF(RC46<>"●",VLOOKUP("",R9C46:R17C48,3,FALSE),VLOOKUP(R7C8,R9C46:R17C48,3,FALSE)) -> 0 | AY80: =SUM(RC27:RC36) -> 0 | AZ80: =RC37*RC41*RC43*RC47*RC49 -> 1 | BA80: =RC38+RC42+RC44+RC48+RC50 -> 0
A81: =OFFSET(R164C1,INT((RC26-1)/100),MOD(INT((RC26-1)/10),10),1,1)*10+MOD(RC26-1,10)+1 -> 30 | D81: =IF(AND(RC2<>"NG",OR(RC2<>"",RC3<>"",R9C4="×")),"◯","") ->  | E81: =IF(RC2="◯",RC6,"") ->  | F81: =T(OFFSET('[MiracleNikkiJp_items.csv]MiracleNikkiJp_items'!R10C[-3],RC1,0,1,1)) -> ヘアスタイル | G81: =T(OFFSET('[MiracleNikkiJp_items.csv]MiracleNikkiJp_items'!R10C[-2],RC1,0,1,1)) ->  | H81: =IF(RC4="",0,RC51*RC52+RC53) -> 0 | I81: =RC1 -> 30 | J81: =OFFSET('[MiracleNikkiJp_items.csv]MiracleNikkiJp_items'!R10C[-4],RC1,0,1,1) -> 0 | K81: =T(OFFSET('[MiracleNikkiJp_items.csv]MiracleNikkiJp_items'!R10C[-4],RC1,0,1,1)) ->  | L81: =T(OFFSET('[MiracleNikkiJp_items.csv]MiracleNikkiJp_items'!R10C[-4],RC1,0,1,1)) ->  | M81: =T(OFFSET('[MiracleNikkiJp_items.csv]MiracleNikkiJp_items'!R10C[-4],RC1,0,1,1)) ->  | N81: =T(OFFSET('[MiracleNikkiJp_items.csv]MiracleNikkiJp_items'!R10C[-4],RC1,0,1,1)) ->  | O81: =T(OFFSET('[MiracleNikkiJp_items.csv]MiracleNikkiJp_items'!R10C[-4],RC1,0,1,1)) ->  | P81: =T(OFFSET('[MiracleNikkiJp_items.csv]MiracleNikkiJp_items'!R10C[-4],RC1,0,1,1)) ->  | Q81: =T(OFFSET('[MiracleNikkiJp_items.csv]MiracleNikkiJp_items'!R10C[-4],RC1,0,1,1)) ->  | R81: =T(OFFSET('[MiracleNikkiJp_items.csv]MiracleNikkiJp_items'!R10C[-4],RC1,0,1,1)) ->  | S81: =T(OFFSET('[MiracleNikkiJp_items.csv]MiracleNikkiJp_items'!R10C[-4],RC1,0,1,1)) ->  | T81: =T(OFFSET('[MiracleNikkiJp_items.csv]MiracleNikkiJp_items'!R10C[-4],RC1,0,1,1)) ->  | U81: =T(OFFSET('[MiracleNikkiJp_items.csv]MiracleNikkiJp_items'!R10C[-4],RC1,0,1,1)) ->  | Y81: =T(OFFSET('[MiracleNikkiJp_items.csv]MiracleNikkiJp_items'!R10C[-7],RC1,0,1,1)) ->  | Z81: 30 | AA81: =IFERROR(VLOOKUP(RC[-16],R9C26:R17C36,2,FALSE),0)*R6C -> 0 | AB81: =IFERROR(VLOOKUP(RC[-16],R9C26:R17C36,3,FALSE),0)*R6C -> 0 | AC81: =IFERROR(VLOOKUP(RC[-16],R9C26:R17C36,4,FALSE),0)*R6C -> 0 | AD81: =IFERROR(VLOOKUP(RC[-16],R9C26:R17C36,5,FALSE),0)*R6C -> 0 | AE81: =IFERROR(VLOOKUP(RC[-16],R9C26:R17C36,6,FALSE),0)*R6C -> 0 | AF81: =IFERROR(VLOOKUP(RC[-16],R9C26:R17C36,7,FALSE),0)*R6C -> 0 | AG81: =IFERROR(VLOOKUP(RC[-16],R9C26:R17C36,8,FALSE),0)*R6C -> 0 | AH81: =IFERROR(VLOOKUP(RC[-16],R9C26:R17C36,9,FALSE),0)*R6C -> 0 | AI81: =IFERROR(VLOOKUP(RC[-16],R9C26:R17C36,10,FALSE),0)*R6C -> 0 | AJ81: =IFERROR(VLOOKUP(RC[-16],R9C26:R17C36,11,FALSE),0)*R6C -> 0 | AK81: =VLOOKUP(RC10,R9C38:R17C40,2,FALSE) -> 1 | AL81: =VLOOKUP(RC10,R9C38:R17C40,3,FALSE) -> 0 | AM81: =IF(OR(ISBLANK(R4C7),ISERROR(FIND(R4C7,RC21))),"　","●") ->  | AN81: =IF(OR(ISBLANK(R5C7),ISERROR(FIND(R5C7,RC21))),"　","●") ->  | AO81: =IF(RC39<>"●",VLOOKUP("評価しない",R9C42:R17C44,2,FALSE),VLOOKUP(R4C8,R9C42:R17C44,2,FALSE)) -> 1 | AP81: =IF(RC39<>"●",VLOOKUP("",R9C42:R17C44,3,FALSE),VLOOKUP(R4C8,R9C42:R17C44,3,FALSE)) -> 0 | AQ81: =IF(RC40<>"●",VLOOKUP("評価しない",R9C42:R17C44,2,FALSE),VLOOKUP(R5C8,R9C42:R17C44,2,FALSE)) -> 1 | AR81: =IF(RC40<>"●",VLOOKUP("",R9C42:R17C44,3,FALSE),VLOOKUP(R5C8,R9C42:R17C44,3,FALSE)) -> 0 | AS81: =IF(OR(ISBLANK(R6C7),ISERROR(FIND(R6C7,RC25))),"　","●") ->  | AT81: =IF(OR(ISBLANK(R7C7),ISERROR(FIND(R7C7,RC25))),"　","●") ->  | AU81: =IF(RC45<>"●",VLOOKUP("評価しない",R9C46:R17C48,2,FALSE),VLOOKUP(R6C8,R9C46:R17C48,2,FALSE)) -> 1 | AV81: =IF(RC45<>"●",VLOOKUP("",R9C46:R17C48,3,FALSE),VLOOKUP(R6C8,R9C46:R17C48,3,FALSE)) -> 0 | AW81: =IF(RC46<>"●",VLOOKUP("評価しない",R9C46:R17C48,2,FALSE),VLOOKUP(R7C8,R9C46:R17C48,2,FALSE)) -> 1 | AX81: =IF(RC46<>"●",VLOOKUP("",R9C46:R17C48,3,FALSE),VLOOKUP(R7C8,R9C46:R17C48,3,FALSE)) -> 0 | AY81: =SUM(RC27:RC36) -> 0 | AZ81: =RC37*RC41*RC43*RC47*RC49 -> 1 | BA81: =RC38+RC42+RC44+RC48+RC50 -> 0
A82: =OFFSET(R164C1,INT((RC26-1)/100),MOD(INT((RC26-1)/10),10),1,1)*10+MOD(RC26-1,10)+1 -> 31 | D82: =IF(AND(RC2<>"NG",OR(RC2<>"",RC3<>"",R9C4="×")),"◯","") ->  | E82: =IF(RC2="◯",RC6,"") ->  | F82: =T(OFFSET('[MiracleNikkiJp_items.csv]MiracleNikkiJp_items'!R10C[-3],RC1,0,1,1)) -> ヘアスタイル | G82: =T(OFFSET('[MiracleNikkiJp_items.csv]MiracleNikkiJp_items'!R10C[-2],RC1,0,1,1)) ->  | H82: =IF(RC4="",0,RC51*RC52+RC53) -> 0 | I82: =RC1 -> 31 | J82: =OFFSET('[MiracleNikkiJp_items.csv]MiracleNikkiJp_items'!R10C[-4],RC1,0,1,1) -> 0 | K82: =T(OFFSET('[MiracleNikkiJp_items.csv]MiracleNikkiJp_items'!R10C[-4],RC1,0,1,1)) ->  | L82: =T(OFFSET('[MiracleNikkiJp_items.csv]MiracleNikkiJp_items'!R10C[-4],RC1,0,1,1)) ->  | M82: =T(OFFSET('[MiracleNikkiJp_items.csv]MiracleNikkiJp_items'!R10C[-4],RC1,0,1,1)) ->  | N82: =T(OFFSET('[MiracleNikkiJp_items.csv]MiracleNikkiJp_items'!R10C[-4],RC1,0,1,1)) ->  | O82: =T(OFFSET('[MiracleNikkiJp_items.csv]MiracleNikkiJp_items'!R10C[-4],RC1,0,1,1)) ->  | P82: =T(OFFSET('[MiracleNikkiJp_items.csv]MiracleNikkiJp_items'!R10C[-4],RC1,0,1,1)) ->  | Q82: =T(OFFSET('[MiracleNikkiJp_items.csv]MiracleNikkiJp_items'!R10C[-4],RC1,0,1,1)) ->  | R82: =T(OFFSET('[MiracleNikkiJp_items.csv]MiracleNikkiJp_items'!R10C[-4],RC1,0,1,1)) ->  | S82: =T(OFFSET('[MiracleNikkiJp_items.csv]MiracleNikkiJp_items'!R10C[-4],RC1,0,1,1)) ->  | T82: =T(OFFSET('[MiracleNikkiJp_items.csv]MiracleNikkiJp_items'!R10C[-4],RC1,0,1,1)) ->  | U82: =T(OFFSET('[MiracleNikkiJp_items.csv]MiracleNikkiJp_items'!R10C[-4],RC1,0,1,1)) ->  | Y82: =T(OFFSET('[MiracleNikkiJp_items.csv]MiracleNikkiJp_items'!R10C[-7],RC1,0,1,1)) ->  | Z82: 31 | AA82: =IFERROR(VLOOKUP(RC[-16],R9C26:R17C36,2,FALSE),0)*R6C -> 0 | AB82: =IFERROR(VLOOKUP(RC[-16],R9C26:R17C36,3,FALSE),0)*R6C -> 0 | AC82: =IFERROR(VLOOKUP(RC[-16],R9C26:R17C36,4,FALSE),0)*R6C -> 0 | AD82: =IFERROR(VLOOKUP(RC[-16],R9C26:R17C36,5,FALSE),0)*R6C -> 0 | AE82: =IFERROR(VLOOKUP(RC[-16],R9C26:R17C36,6,FALSE),0)*R6C -> 0 | AF82: =IFERROR(VLOOKUP(RC[-16],R9C26:R17C36,7,FALSE),0)*R6C -> 0 | AG82: =IFERROR(VLOOKUP(RC[-16],R9C26:R17C36,8,FALSE),0)*R6C -> 0 | AH82: =IFERROR(VLOOKUP(RC[-16],R9C26:R17C36,9,FALSE),0)*R6C -> 0 | AI82: =IFERROR(VLOOKUP(RC[-16],R9C26:R17C36,10,FALSE),0)*R6C -> 0 | AJ82: =IFERROR(VLOOKUP(RC[-16],R9C26:R17C36,11,FALSE),0)*R6C -> 0 | AK82: =VLOOKUP(RC10,R9C38:R17C40,2,FALSE) -> 1 | AL82: =VLOOKUP(RC10,R9C38:R17C40,3,FALSE) -> 0 | AM82: =IF(OR(ISBLANK(R4C7),ISERROR(FIND(R4C7,RC21))),"　","●") ->  | AN82: =IF(OR(ISBLANK(R5C7),ISERROR(FIND(R5C7,RC21))),"　","●") ->  | AO82: =IF(RC39<>"●",VLOOKUP("評価しない",R9C42:R17C44,2,FALSE),VLOOKUP(R4C8,R9C42:R17C44,2,FALSE)) -> 1 | AP82: =IF(RC39<>"●",VLOOKUP("",R9C42:R17C44,3,FALSE),VLOOKUP(R4C8,R9C42:R17C44,3,FALSE)) -> 0 | AQ82: =IF(RC40<>"●",VLOOKUP("評価しない",R9C42:R17C44,2,FALSE),VLOOKUP(R5C8,R9C42:R17C44,2,FALSE)) -> 1 | AR82: =IF(RC40<>"●",VLOOKUP("",R9C42:R17C44,3,FALSE),VLOOKUP(R5C8,R9C42:R17C44,3,FALSE)) -> 0 | AS82: =IF(OR(ISBLANK(R6C7),ISERROR(FIND(R6C7,RC25))),"　","●") ->  | AT82: =IF(OR(ISBLANK(R7C7),ISERROR(FIND(R7C7,RC25))),"　","●") ->  | AU82: =IF(RC45<>"●",VLOOKUP("評価しない",R9C46:R17C48,2,FALSE),VLOOKUP(R6C8,R9C46:R17C48,2,FALSE)) -> 1 | AV82: =IF(RC45<>"●",VLOOKUP("",R9C46:R17C48,3,FALSE),VLOOKUP(R6C8,R9C46:R17C48,3,FALSE)) -> 0 | AW82: =IF(RC46<>"●",VLOOKUP("評価しない",R9C46:R17C48,2,FALSE),VLOOKUP(R7C8,R9C46:R17C48,2,FALSE)) -> 1 | AX82: =IF(RC46<>"●",VLOOKUP("",R9C46:R17C48,3,FALSE),VLOOKUP(R7C8,R9C46:R17C48,3,FALSE)) -> 0 | AY82: =SUM(RC27:RC36) -> 0 | AZ82: =RC37*RC41*RC43*RC47*RC49 -> 1 | BA82: =RC38+RC42+RC44+RC48+RC50 -> 0
A83: =OFFSET(R164C1,INT((RC26-1)/100),MOD(INT((RC26-1)/10),10),1,1)*10+MOD(RC26-1,10)+1 -> 32 | D83: =IF(AND(RC2<>"NG",OR(RC2<>"",RC3<>"",R9C4="×")),"◯","") ->  | E83: =IF(RC2="◯",RC6,"") ->  | F83: =T(OFFSET('[MiracleNikkiJp_items.csv]MiracleNikkiJp_items'!R10C[-3],RC1,0,1,1)) -> ヘアスタイル | G83: =T(OFFSET('[MiracleNikkiJp_items.csv]MiracleNikkiJp_items'!R10C[-2],RC1,0,1,1)) ->  | H83: =IF(RC4="",0,RC51*RC52+RC53) -> 0 | I83: =RC1 -> 32 | J83: =OFFSET('[MiracleNikkiJp_items.csv]MiracleNikkiJp_items'!R10C[-4],RC1,0,1,1) -> 0 | K83: =T(OFFSET('[MiracleNikkiJp_items.csv]MiracleNikkiJp_items'!R10C[-4],RC1,0,1,1)) ->  | L83: =T(OFFSET('[MiracleNikkiJp_items.csv]MiracleNikkiJp_items'!R10C[-4],RC1,0,1,1)) ->  | M83: =T(OFFSET('[MiracleNikkiJp_items.csv]MiracleNikkiJp_items'!R10C[-4],RC1,0,1,1)) ->  | N83: =T(OFFSET('[MiracleNikkiJp_items.csv]MiracleNikkiJp_items'!R10C[-4],RC1,0,1,1)) ->  | O83: =T(OFFSET('[MiracleNikkiJp_items.csv]MiracleNikkiJp_items'!R10C[-4],RC1,0,1,1)) ->  | P83: =T(OFFSET('[MiracleNikkiJp_items.csv]MiracleNikkiJp_items'!R10C[-4],RC1,0,1,1)) ->  | Q83: =T(OFFSET('[MiracleNikkiJp_items.csv]MiracleNikkiJp_items'!R10C[-4],RC1,0,1,1)) ->  | R83: =T(OFFSET('[MiracleNikkiJp_items.csv]MiracleNikkiJp_items'!R10C[-4],RC1,0,1,1)) ->  | S83: =T(OFFSET('[MiracleNikkiJp_items.csv]MiracleNikkiJp_items'!R10C[-4],RC1,0,1,1)) ->  | T83: =T(OFFSET('[MiracleNikkiJp_items.csv]MiracleNikkiJp_items'!R10C[-4],RC1,0,1,1)) ->  | U83: =T(OFFSET('[MiracleNikkiJp_items.csv]MiracleNikkiJp_items'!R10C[-4],RC1,0,1,1)) ->  | Y83: =T(OFFSET('[MiracleNikkiJp_items.csv]MiracleNikkiJp_items'!R10C[-7],RC1,0,1,1)) ->  | Z83: 32 | AA83: =IFERROR(VLOOKUP(RC[-16],R9C26:R17C36,2,FALSE),0)*R6C -> 0 | AB83: =IFERROR(VLOOKUP(RC[-16],R9C26:R17C36,3,FALSE),0)*R6C -> 0 | AC83: =IFERROR(VLOOKUP(RC[-16],R9C26:R17C36,4,FALSE),0)*R6C -> 0 | AD83: =IFERROR(VLOOKUP(RC[-16],R9C26:R17C36,5,FALSE),0)*R6C -> 0 | AE83: =IFERROR(VLOOKUP(RC[-16],R9C26:R17C36,6,FALSE),0)*R6C -> 0 | AF83: =IFERROR(VLOOKUP(RC[-16],R9C26:R17C36,7,FALSE),0)*R6C -> 0 | AG83: =IFERROR(VLOOKUP(RC[-16],R9C26:R17C36,8,FALSE),0)*R6C -> 0 | AH83: =IFERROR(VLOOKUP(RC[-16],R9C26:R17C36,9,FALSE),0)*R6C -> 0 | AI83: =IFERROR(VLOOKUP(RC[-16],R9C26:R17C36,10,FALSE),0)*R6C -> 0 | AJ83: =IFERROR(VLOOKUP(RC[-16],R9C26:R17C36,11,FALSE),0)*R6C -> 0 | AK83: =VLOOKUP(RC10,R9C38:R17C40,2,FALSE) -> 1 | AL83: =VLOOKUP(RC10,R9C38:R17C40,3,FALSE) -> 0 | AM83: =IF(OR(ISBLANK(R4C7),ISERROR(FIND(R4C7,RC21))),"　","●") ->  | AN83: =IF(OR(ISBLANK(R5C7),ISERROR(FIND(R5C7,RC21))),"　","●") ->  | AO83: =IF(RC39<>"●",VLOOKUP("評価しない",R9C42:R17C44,2,FALSE),VLOOKUP(R4C8,R9C42:R17C44,2,FALSE)) -> 1 | AP83: =IF(RC39<>"●",VLOOKUP("",R9C42:R17C44,3,FALSE),VLOOKUP(R4C8,R9C42:R17C44,3,FALSE)) -> 0 | AQ83: =IF(RC40<>"●",VLOOKUP("評価しない",R9C42:R17C44,2,FALSE),VLOOKUP(R5C8,R9C42:R17C44,2,FALSE)) -> 1 | AR83: =IF(RC40<>"●",VLOOKUP("",R9C42:R17C44,3,FALSE),VLOOKUP(R5C8,R9C42:R17C44,3,FALSE)) -> 0 | AS83: =IF(OR(ISBLANK(R6C7),ISERROR(FIND(R6C7,RC25))),"　","●") ->  | AT83: =IF(OR(ISBLANK(R7C7),ISERROR(FIND(R7C7,RC25))),"　","●") ->  | AU83: =IF(RC45<>"●",VLOOKUP("評価しない",R9C46:R17C48,2,FALSE),VLOOKUP(R6C8,R9C46:R17C48,2,FALSE)) -> 1 | AV83: =IF(RC45<>"●",VLOOKUP("",R9C46:R17C48,3,FALSE),VLOOKUP(R6C8,R9C46:R17C48,3,FALSE)) -> 0 | AW83: =IF(RC46<>"●",VLOOKUP("評価しない",R9C46:R17C48,2,FALSE),VLOOKUP(R7C8,R9C46:R17C48,2,FALSE)) -> 1 | AX83: =IF(RC46<>"●",VLOOKUP("",R9C46:R17C48,3,FALSE),VLOOKUP(R7C8,R9C46:R17C48,3,FALSE)) -> 0 | AY83: =SUM(RC27:RC36) -> 0 | AZ83: =RC37*RC41*RC43*RC47*RC49 -> 1 | BA83: =RC38+RC42+RC44+RC48+RC50 -> 0
A84: =OFFSET(R164C1,INT((RC26-1)/100),MOD(INT((RC26-1)/10),10),1,1)*10+MOD(RC26-1,10)+1 -> 33 | D84: =IF(AND(RC2<>"NG",OR(RC2<>"",RC3<>"",R9C4="×")),"◯","") ->  | E84: =IF(RC2="◯",RC6,"") ->  | F84: =T(OFFSET('[MiracleNikkiJp_items.csv]MiracleNikkiJp_items'!R10C[-3],RC1,0,1,1)) -> ヘアスタイル | G84: =T(OFFSET('[MiracleNikkiJp_items.csv]MiracleNikkiJp_items'!R10C[-2],RC1,0,1,1)) ->  | H84: =IF(RC4="",0,RC51*RC52+RC53) -> 0 | I84: =RC1 -> 33 | J84: =OFFSET('[MiracleNikkiJp_items.csv]MiracleNikkiJp_items'!R10C[-4],RC1,0,1,1) -> 0 | K84: =T(OFFSET('[MiracleNikkiJp_items.csv]MiracleNikkiJp_items'!R10C[-4],RC1,0,1,1)) ->  | L84: =T(OFFSET('[MiracleNikkiJp_items.csv]MiracleNikkiJp_items'!R10C[-4],RC1,0,1,1)) ->  | M84: =T(OFFSET('[MiracleNikkiJp_items.csv]MiracleNikkiJp_items'!R10C[-4],RC1,0,1,1)) ->  | N84: =T(OFFSET('[MiracleNikkiJp_items.csv]MiracleNikkiJp_items'!R10C[-4],RC1,0,1,1)) ->  | O84: =T(OFFSET('[MiracleNikkiJp_items.csv]MiracleNikkiJp_items'!R10C[-4],RC1,0,1,1)) ->  | P84: =T(OFFSET('[MiracleNikkiJp_items.csv]MiracleNikkiJp_items'!R10C[-4],RC1,0,1,1)) ->  | Q84: =T(OFFSET('[MiracleNikkiJp_items.csv]MiracleNikkiJp_items'!R10C[-4],RC1,0,1,1)) ->  | R84: =T(OFFSET('[MiracleNikkiJp_items.csv]MiracleNikkiJp_items'!R10C[-4],RC1,0,1,1)) ->  | S84: =T(OFFSET('[MiracleNikkiJp_items.csv]MiracleNikkiJp_items'!R10C[-4],RC1,0,1,1)) ->  | T84: =T(OFFSET('[MiracleNikkiJp_items.csv]MiracleNikkiJp_items'!R10C[-4],RC1,0,1,1)) ->  | U84: =T(OFFSET('[MiracleNikkiJp_items.csv]MiracleNikkiJp_items'!R10C[-4],RC1,0,1,1)) ->  | Y84: =T(OFFSET('[MiracleNikkiJp_items.csv]MiracleNikkiJp_items'!R10C[-7],RC1,0,1,1)) ->  | Z84: 33 | AA84: =IFERROR(VLOOKUP(RC[-16],R9C26:R17C36,2,FALSE),0)*R6C -> 0 | AB84: =IFERROR(VLOOKUP(RC[-16],R9C26:R17C36,3,FALSE),0)*R6C -> 0 | AC84: =IFERROR(VLOOKUP(RC[-16],R9C26:R17C36,4,FALSE),0)*R6C -> 0 | AD84: =IFERROR(VLOOKUP(RC[-16],R9C26:R17C36,5,FALSE),0)*R6C -> 0 | AE84: =IFERROR(VLOOKUP(RC[-16],R9C26:R17C36,6,FALSE),0)*R6C -> 0 | AF84: =IFERROR(VLOOKUP(RC[-16],R9C26:R17C36,7,FALSE),0)*R6C -> 0 | AG84: =IFERROR(VLOOKUP(RC[-16],R9C26:R17C36,8,FALSE),0)*R6C -> 0 | AH84: =IFERROR(VLOOKUP(RC[-16],R9C26:R17C36,9,FALSE),0)*R6C -> 0 | AI84: =IFERROR(VLOOKUP(RC[-16],R9C26:R17C36,10,FALSE),0)*R6C -> 0 | AJ84: =IFERROR(VLOOKUP(RC[-16],R9C26:R17C36,11,FALSE),0)*R6C -> 0 | AK84: =VLOOKUP(RC10,R9C38:R17C40,2,FALSE) -> 1 | AL84: =VLOOKUP(RC10,R9C38:R17C40,3,FALSE) -> 0 | AM84: =IF(OR(ISBLANK(R4C7),ISERROR(FIND(R4C7,RC21))),"　","●") ->  | AN84: =IF(OR(ISBLANK(R5C7),ISERROR(FIND(R5C7,RC21))),"　","●") ->  | AO84: =IF(RC39<>"●",VLOOKUP("評価しない",R9C42:R17C44,2,FALSE),VLOOKUP(R4C8,R9C42:R17C44,2,FALSE)) -> 1 | AP84: =IF(RC39<>"●",VLOOKUP("",R9C42:R17C44,3,FALSE),VLOOKUP(R4C8,R9C42:R17C44,3,FALSE)) -> 0 | AQ84: =IF(RC40<>"●",VLOOKUP("評価しない",R9C42:R17C44,2,FALSE),VLOOKUP(R5C8,R9C42:R17C44,2,FALSE)) -> 1 | AR84: =IF(RC40<>"●",VLOOKUP("",R9C42:R17C44,3,FALSE),VLOOKUP(R5C8,R9C42:R17C44,3,FALSE)) -> 0 | AS84: =IF(OR(ISBLANK(R6C7),ISERROR(FIND(R6C7,RC25))),"　","●") ->  | AT84: =IF(OR(ISBLANK(R7C7),ISERROR(FIND(R7C7,RC25))),"　","●") ->  | AU84: =IF(RC45<>"●",VLOOKUP("評価しない",R9C46:R17C48,2,FALSE),VLOOKUP(R6C8,R9C46:R17C48,2,FALSE)) -> 1 | AV84: =IF(RC45<>"●",VLOOKUP("",R9C46:R17C48,3,FALSE),VLOOKUP(R6C8,R9C46:R17C48,3,FALSE)) -> 0 | AW84: =IF(RC46<>"●",VLOOKUP("評価しない",R9C46:R17C48,2,FALSE),VLOOKUP(R7C8,R9C46:R17C48,2,FALSE)) -> 1 | AX84: =IF(RC46<>"●",VLOOKUP("",R9C46:R17C48,3,FALSE),VLOOKUP(R7C8,R9C46:R17C48,3,FALSE)) -> 0 | AY84: =SUM(RC27:RC36) -> 0 | AZ84: =RC37*RC41*RC43*RC47*RC49 -> 1 | BA84: =RC38+RC42+RC44+RC48+RC50 -> 0
A85: =OFFSET(R164C1,INT((RC26-1)/100),MOD(INT((RC26-1)/10),10),1,1)*10+MOD(RC26-1,10)+1 -> 34 | D85: =IF(AND(RC2<>"NG",OR(RC2<>"",RC3<>"",R9C4="×")),"◯","") ->  | E85: =IF(RC2="◯",RC6,"") ->  | F85: =T(OFFSET('[MiracleNikkiJp_items.csv]MiracleNikkiJp_items'!R10C[-3],RC1,0,1,1)) -> ヘアスタイル | G85: =T(OFFSET('[MiracleNikkiJp_items.csv]MiracleNikkiJp_items'!R10C[-2],RC1,0,1,1)) ->  | H85: =IF(RC4="",0,RC51*RC52+RC53) -> 0 | I85: =RC1 -> 34 | J85: =OFFSET('[MiracleNikkiJp_items.csv]MiracleNikkiJp_items'!R10C[-4],RC1,0,1,1) -> 0 | K85: =T(OFFSET('[MiracleNikkiJp_items.csv]MiracleNikkiJp_items'!R10C[-4],RC1,0,1,1)) ->  | L85: =T(OFFSET('[MiracleNikkiJp_items.csv]MiracleNikkiJp_items'!R10C[-4],RC1,0,1,1)) ->  | M85: =T(OFFSET('[MiracleNikkiJp_items.csv]MiracleNikkiJp_items'!R10C[-4],RC1,0,1,1)) ->  | N85: =T(OFFSET('[MiracleNikkiJp_items.csv]MiracleNikkiJp_items'!R10C[-4],RC1,0,1,1)) ->  | O85: =T(OFFSET('[MiracleNikkiJp_items.csv]MiracleNikkiJp_items'!R10C[-4],RC1,0,1,1)) ->  | P85: =T(OFFSET('[MiracleNikkiJp_items.csv]MiracleNikkiJp_items'!R10C[-4],RC1,0,1,1)) ->  | Q85: =T(OFFSET('[MiracleNikkiJp_items.csv]MiracleNikkiJp_items'!R10C[-4],RC1,0,1,1)) ->  | R85: =T(OFFSET('[MiracleNikkiJp_items.csv]MiracleNikkiJp_items'!R10C[-4],RC1,0,1,1)) ->  | S85: =T(OFFSET('[MiracleNikkiJp_items.csv]MiracleNikkiJp_items'!R10C[-4],RC1,0,1,1)) ->  | T85: =T(OFFSET('[MiracleNikkiJp_items.csv]MiracleNikkiJp_items'!R10C[-4],RC1,0,1,1)) ->  | U85: =T(OFFSET('[MiracleNikkiJp_items.csv]MiracleNikkiJp_items'!R10C[-4],RC1,0,1,1)) ->  | Y85: =T(OFFSET('[MiracleNikkiJp_items.csv]MiracleNikkiJp_items'!R10C[-7],RC1,0,1,1)) ->  | Z85: 34 | AA85: =IFERROR(VLOOKUP(RC[-16],R9C26:R17C36,2,FALSE),0)*R6C -> 0 | AB85: =IFERROR(VLOOKUP(RC[-16],R9C26:R17C36,3,FALSE),0)*R6C -> 0 | AC85: =IFERROR(VLOOKUP(RC[-16],R9C26:R17C36,4,FALSE),0)*R6C -> 0 | AD85: =IFERROR(VLOOKUP(RC[-16],R9C26:R17C36,5,FALSE),0)*R6C -> 0 | AE85: =IFERROR(VLOOKUP(RC[-16],R9C26:R17C36,6,FALSE),0)*R6C -> 0 | AF85: =IFERROR(VLOOKUP(RC[-16],R9C26:R17C36,7,FALSE),0)*R6C -> 0 | AG85: =IFERROR(VLOOKUP(RC[-16],R9C26:R17C36,8,FALSE),0)*R6C -> 0 | AH85: =IFERROR(VLOOKUP(RC[-16],R9C26:R17C36,9,FALSE),0)*R6C -> 0 | AI85: =IFERROR(VLOOKUP(RC[-16],R9C26:R17C36,10,FALSE),0)*R6C -> 0 | AJ85: =IFERROR(VLOOKUP(RC[-16],R9C26:R17C36,11,FALSE),0)*R6C -> 0 | AK85: =VLOOKUP(RC10,R9C38:R17C40,2,FALSE) -> 1 | AL85: =VLOOKUP(RC10,R9C38:R17C40,3,FALSE) -> 0 | AM85: =IF(OR(ISBLANK(R4C7),ISERROR(FIND(R4C7,RC21))),"　","●") ->  | AN85: =IF(OR(ISBLANK(R5C7),ISERROR(FIND(R5C7,RC21))),"　","●") ->  | AO85: =IF(RC39<>"●",VLOOKUP("評価しない",R9C42:R17C44,2,FALSE),VLOOKUP(R4C8,R9C42:R17C44,2,FALSE)) -> 1 | AP85: =IF(RC39<>"●",VLOOKUP("",R9C42:R17C44,3,FALSE),VLOOKUP(R4C8,R9C42:R17C44,3,FALSE)) -> 0 | AQ85: =IF(RC40<>"●",VLOOKUP("評価しない",R9C42:R17C44,2,FALSE),VLOOKUP(R5C8,R9C42:R17C44,2,FALSE)) -> 1 | AR85: =IF(RC40<>"●",VLOOKUP("",R9C42:R17C44,3,FALSE),VLOOKUP(R5C8,R9C42:R17C44,3,FALSE)) -> 0 | AS85: =IF(OR(ISBLANK(R6C7),ISERROR(FIND(R6C7,RC25))),"　","●") ->  | AT85: =IF(OR(ISBLANK(R7C7),ISERROR(FIND(R7C7,RC25))),"　","●") ->  | AU85: =IF(RC45<>"●",VLOOKUP("評価しない",R9C46:R17C48,2,FALSE),VLOOKUP(R6C8,R9C46:R17C48,2,FALSE)) -> 1 | AV85: =IF(RC45<>"●",VLOOKUP("",R9C46:R17C48,3,FALSE),VLOOKUP(R6C8,R9C46:R17C48,3,FALSE)) -> 0 | AW85: =IF(RC46<>"●",VLOOKUP("評価しない",R9C46:R17C48,2,FALSE),VLOOKUP(R7C8,R9C46:R17C48,2,FALSE)) -> 1 | AX85: =IF(RC46<>"●",VLOOKUP("",R9C46:R17C48,3,FALSE),VLOOKUP(R7C8,R9C46:R17C48,3,FALSE)) -> 0 | AY85: =SUM(RC27:RC36) -> 0 | AZ85: =RC37*RC41*RC43*RC47*RC49 -> 1 | BA85: =RC38+RC42+RC44+RC48+RC50 -> 0
A86: =OFFSET(R164C1,INT((RC26-1)/100),MOD(INT((RC26-1)/10),10),1,1)*10+MOD(RC26-1,10)+1 -> 35 | D86: =IF(AND(RC2<>"NG",OR(RC2<>"",RC3<>"",R9C4="×")),"◯","") ->  | E86: =IF(RC2="◯",RC6,"") ->  | F86: =T(OFFSET('[MiracleNikkiJp_items.csv]MiracleNikkiJp_items'!R10C[-3],RC1,0,1,1)) -> ヘアスタイル | G86: =T(OFFSET('[MiracleNikkiJp_items.csv]MiracleNikkiJp_items'!R10C[-2],RC1,0,1,1)) ->  | H86: =IF(RC4="",0,RC51*RC52+RC53) -> 0 | I86: =RC1 -> 35 | J86: =OFFSET('[MiracleNikkiJp_items.csv]MiracleNikkiJp_items'!R10C[-4],RC1,0,1,1) -> 0 | K86: =T(OFFSET('[MiracleNikkiJp_items.csv]MiracleNikkiJp_items'!R10C[-4],RC1,0,1,1)) ->  | L86: =T(OFFSET('[MiracleNikkiJp_items.csv]MiracleNikkiJp_items'!R10C[-4],RC1,0,1,1)) ->  | M86: =T(OFFSET('[MiracleNikkiJp_items.csv]MiracleNikkiJp_items'!R10C[-4],RC1,0,1,1)) ->  | N86: =T(OFFSET('[MiracleNikkiJp_items.csv]MiracleNikkiJp_items'!R10C[-4],RC1,0,1,1)) ->  | O86: =T(OFFSET('[MiracleNikkiJp_items.csv]MiracleNikkiJp_items'!R10C[-4],RC1,0,1,1)) ->  | P86: =T(OFFSET('[MiracleNikkiJp_items.csv]MiracleNikkiJp_items'!R10C[-4],RC1,0,1,1)) ->  | Q86: =T(OFFSET('[MiracleNikkiJp_items.csv]MiracleNikkiJp_items'!R10C[-4],RC1,0,1,1)) ->  | R86: =T(OFFSET('[MiracleNikkiJp_items.csv]MiracleNikkiJp_items'!R10C[-4],RC1,0,1,1)) ->  | S86: =T(OFFSET('[MiracleNikkiJp_items.csv]MiracleNikkiJp_items'!R10C[-4],RC1,0,1,1)) ->  | T86: =T(OFFSET('[MiracleNikkiJp_items.csv]MiracleNikkiJp_items'!R10C[-4],RC1,0,1,1)) ->  | U86: =T(OFFSET('[MiracleNikkiJp_items.csv]MiracleNikkiJp_items'!R10C[-4],RC1,0,1,1)) ->  | Y86: =T(OFFSET('[MiracleNikkiJp_items.csv]MiracleNikkiJp_items'!R10C[-7],RC1,0,1,1)) ->  | Z86: 35 | AA86: =IFERROR(VLOOKUP(RC[-16],R9C26:R17C36,2,FALSE),0)*R6C -> 0 | AB86: =IFERROR(VLOOKUP(RC[-16],R9C26:R17C36,3,FALSE),0)*R6C -> 0 | AC86: =IFERROR(VLOOKUP(RC[-16],R9C26:R17C36,4,FALSE),0)*R6C -> 0 | AD86: =IFERROR(VLOOKUP(RC[-16],R9C26:R17C36,5,FALSE),0)*R6C -> 0 | AE86: =IFERROR(VLOOKUP(RC[-16],R9C26:R17C36,6,FALSE),0)*R6C -> 0 | AF86: =IFERROR(VLOOKUP(RC[-16],R9C26:R17C36,7,FALSE),0)*R6C -> 0 | AG86: =IFERROR(VLOOKUP(RC[-16],R9C26:R17C36,8,FALSE),0)*R6C -> 0 | AH86: =IFERROR(VLOOKUP(RC[-16],R9C26:R17C36,9,FALSE),0)*R6C -> 0 | AI86: =IFERROR(VLOOKUP(RC[-16],R9C26:R17C36,10,FALSE),0)*R6C -> 0 | AJ86: =IFERROR(VLOOKUP(RC[-16],R9C26:R17C36,11,FALSE),0)*R6C -> 0 | AK86: =VLOOKUP(RC10,R9C38:R17C40,2,FALSE) -> 1 | AL86: =VLOOKUP(RC10,R9C38:R17C40,3,FALSE) -> 0 | AM86: =IF(OR(ISBLANK(R4C7),ISERROR(FIND(R4C7,RC21))),"　","●") ->  | AN86: =IF(OR(ISBLANK(R5C7),ISERROR(FIND(R5C7,RC21))),"　","●") ->  | AO86: =IF(RC39<>"●",VLOOKUP("評価しない",R9C42:R17C44,2,FALSE),VLOOKUP(R4C8,R9C42:R17C44,2,FALSE)) -> 1 | AP86: =IF(RC39<>"●",VLOOKUP("",R9C42:R17C44,3,FALSE),VLOOKUP(R4C8,R9C42:R17C44,3,FALSE)) -> 0 | AQ86: =IF(RC40<>"●",VLOOKUP("評価しない",R9C42:R17C44,2,FALSE),VLOOKUP(R5C8,R9C42:R17C44,2,FALSE)) -> 1 | AR86: =IF(RC40<>"●",VLOOKUP("",R9C42:R17C44,3,FALSE),VLOOKUP(R5C8,R9C42:R17C44,3,FALSE)) -> 0 | AS86: =IF(OR(ISBLANK(R6C7),ISERROR(FIND(R6C7,RC25))),"　","●") ->  | AT86: =IF(OR(ISBLANK(R7C7),ISERROR(FIND(R7C7,RC25))),"　","●") ->  | AU86: =IF(RC45<>"●",VLOOKUP("評価しない",R9C46:R17C48,2,FALSE),VLOOKUP(R6C8,R9C46:R17C48,2,FALSE)) -> 1 | AV86: =IF(RC45<>"●",VLOOKUP("",R9C46:R17C48,3,FALSE),VLOOKUP(R6C8,R9C46:R17C48,3,FALSE)) -> 0 | AW86: =IF(RC46<>"●",VLOOKUP("評価しない",R9C46:R17C48,2,FALSE),VLOOKUP(R7C8,R9C46:R17C48,2,FALSE)) -> 1 | AX86: =IF(RC46<>"●",VLOOKUP("",R9C46:R17C48,3,FALSE),VLOOKUP(R7C8,R9C46:R17C48,3,FALSE)) -> 0 | AY86: =SUM(RC27:RC36) -> 0 | AZ86: =RC37*RC41*RC43*RC47*RC49 -> 1 | BA86: =RC38+RC42+RC44+RC48+RC50 -> 0
A87: =OFFSET(R164C1,INT((RC26-1)/100),MOD(INT((RC26-1)/10),10),1,1)*10+MOD(RC26-1,10)+1 -> 36 | D87: =IF(AND(RC2<>"NG",OR(RC2<>"",RC3<>"",R9C4="×")),"◯","") ->  | E87: =IF(RC2="◯",RC6,"") ->  | F87: =T(OFFSET('[MiracleNikkiJp_items.csv]MiracleNikkiJp_items'!R10C[-3],RC1,0,1,1)) -> ヘアスタイル | G87: =T(OFFSET('[MiracleNikkiJp_items.csv]MiracleNikkiJp_items'!R10C[-2],RC1,0,1,1)) ->  | H87: =IF(RC4="",0,RC51*RC52+RC53) -> 0 | I87: =RC1 -> 36 | J87: =OFFSET('[MiracleNikkiJp_items.csv]MiracleNikkiJp_items'!R10C[-4],RC1,0,1,1) -> 0 | K87: =T(OFFSET('[MiracleNikkiJp_items.csv]MiracleNikkiJp_items'!R10C[-4],RC1,0,1,1)) ->  | L87: =T(OFFSET('[MiracleNikkiJp_items.csv]MiracleNikkiJp_items'!R10C[-4],RC1,0,1,1)) ->  | M87: =T(OFFSET('[MiracleNikkiJp_items.csv]MiracleNikkiJp_items'!R10C[-4],RC1,0,1,1)) ->  | N87: =T(OFFSET('[MiracleNikkiJp_items.csv]MiracleNikkiJp_items'!R10C[-4],RC1,0,1,1)) ->  | O87: =T(OFFSET('[MiracleNikkiJp_items.csv]MiracleNikkiJp_items'!R10C[-4],RC1,0,1,1)) ->  | P87: =T(OFFSET('[MiracleNikkiJp_items.csv]MiracleNikkiJp_items'!R10C[-4],RC1,0,1,1)) ->  | Q87: =T(OFFSET('[MiracleNikkiJp_items.csv]MiracleNikkiJp_items'!R10C[-4],RC1,0,1,1)) ->  | R87: =T(OFFSET('[MiracleNikkiJp_items.csv]MiracleNikkiJp_items'!R10C[-4],RC1,0,1,1)) ->  | S87: =T(OFFSET('[MiracleNikkiJp_items.csv]MiracleNikkiJp_items'!R10C[-4],RC1,0,1,1)) ->  | T87: =T(OFFSET('[MiracleNikkiJp_items.csv]MiracleNikkiJp_items'!R10C[-4],RC1,0,1,1)) ->  | U87: =T(OFFSET('[MiracleNikkiJp_items.csv]MiracleNikkiJp_items'!R10C[-4],RC1,0,1,1)) ->  | Y87: =T(OFFSET('[MiracleNikkiJp_items.csv]MiracleNikkiJp_items'!R10C[-7],RC1,0,1,1)) ->  | Z87: 36 | AA87: =IFERROR(VLOOKUP(RC[-16],R9C26:R17C36,2,FALSE),0)*R6C -> 0 | AB87: =IFERROR(VLOOKUP(RC[-16],R9C26:R17C36,3,FALSE),0)*R6C -> 0 | AC87: =IFERROR(VLOOKUP(RC[-16],R9C26:R17C36,4,FALSE),0)*R6C -> 0 | AD87: =IFERROR(VLOOKUP(RC[-16],R9C26:R17C36,5,FALSE),0)*R6C -> 0 | AE87: =IFERROR(VLOOKUP(RC[-16],R9C26:R17C36,6,FALSE),0)*R6C -> 0 | AF87: =IFERROR(VLOOKUP(RC[-16],R9C26:R17C36,7,FALSE),0)*R6C -> 0 | AG87: =IFERROR(VLOOKUP(RC[-16],R9C26:R17C36,8,FALSE),0)*R6C -> 0 | AH87: =IFERROR(VLOOKUP(RC[-16],R9C26:R17C36,9,FALSE),0)*R6C -> 0 | AI87: =IFERROR(VLOOKUP(RC[-16],R9C26:R17C36,10,FALSE),0)*R6C -> 0 | AJ87: =IFERROR(VLOOKUP(RC[-16],R9C26:R17C36,11,FALSE),0)*R6C -> 0 | AK87: =VLOOKUP(RC10,R9C38:R17C40,2,FALSE) -> 1 | AL87: =VLOOKUP(RC10,R9C38:R17C40,3,FALSE) -> 0 | AM87: =IF(OR(ISBLANK(R4C7),ISERROR(FIND(R4C7,RC21))),"　","●") ->  | AN87: =IF(OR(ISBLANK(R5C7),ISERROR(FIND(R5C7,RC21))),"　","●") ->  | AO87: =IF(RC39<>"●",VLOOKUP("評価しない",R9C42:R17C44,2,FALSE),VLOOKUP(R4C8,R9C42:R17C44,2,FALSE)) -> 1 | AP87: =IF(RC39<>"●",VLOOKUP("",R9C42:R17C44,3,FALSE),VLOOKUP(R4C8,R9C42:R17C44,3,FALSE)) -> 0 | AQ87: =IF(RC40<>"●",VLOOKUP("評価しない",R9C42:R17C44,2,FALSE),VLOOKUP(R5C8,R9C42:R17C44,2,FALSE)) -> 1 | AR87: =IF(RC40<>"●",VLOOKUP("",R9C42:R17C44,3,FALSE),VLOOKUP(R5C8,R9C42:R17C44,3,FALSE)) -> 0 | AS87: =IF(OR(ISBLANK(R6C7),ISERROR(FIND(R6C7,RC25))),"　","●") ->  | AT87: =IF(OR(ISBLANK(R7C7),ISERROR(FIND(R7C7,RC25))),"　","●") ->  | AU87: =IF(RC45<>"●",VLOOKUP("評価しない",R9C46:R17C48,2,FALSE),VLOOKUP(R6C8,R9C46:R17C48,2,FALSE)) -> 1 | AV87: =IF(RC45<>"●",VLOOKUP("",R9C46:R17C48,3,FALSE),VLOOKUP(R6C8,R9C46:R17C48,3,FALSE)) -> 0 | AW87: =IF(RC46<>"●",VLOOKUP("評価しない",R9C46:R17C48,2,FALSE),VLOOKUP(R7C8,R9C46:R17C48,2,FALSE)) -> 1 | AX87: =IF(RC46<>"●",VLOOKUP("",R9C46:R17C48,3,FALSE),VLOOKUP(R7C8,R9C46:R17C48,3,FALSE)) -> 0 | AY87: =SUM(RC27:RC36) -> 0 | AZ87: =RC37*RC41*RC43*RC47*RC49 -> 1 | BA87: =RC38+RC42+RC44+RC48+RC50 -> 0
A88: =OFFSET(R164C1,INT((RC26-1)/100),MOD(INT((RC26-1)/10),10),1,1)*10+MOD(RC26-1,10)+1 -> 37 | D88: =IF(AND(RC2<>"NG",OR(RC2<>"",RC3<>"",R9C4="×")),"◯","") ->  | E88: =IF(RC2="◯",RC6,"") ->  | F88: =T(OFFSET('[MiracleNikkiJp_items.csv]MiracleNikkiJp_items'!R10C[-3],RC1,0,1,1)) -> ヘアスタイル | G88: =T(OFFSET('[MiracleNikkiJp_items.csv]MiracleNikkiJp_items'!R10C[-2],RC1,0,1,1)) ->  | H88: =IF(RC4="",0,RC51*RC52+RC53) -> 0 | I88: =RC1 -> 37 | J88: =OFFSET('[MiracleNikkiJp_items.csv]MiracleNikkiJp_items'!R10C[-4],RC1,0,1,1) -> 0 | K88: =T(OFFSET('[MiracleNikkiJp_items.csv]MiracleNikkiJp_items'!R10C[-4],RC1,0,1,1)) ->  | L88: =T(OFFSET('[MiracleNikkiJp_items.csv]MiracleNikkiJp_items'!R10C[-4],RC1,0,1,1)) ->  | M88: =T(OFFSET('[MiracleNikkiJp_items.csv]MiracleNikkiJp_items'!R10C[-4],RC1,0,1,1)) ->  | N88: =T(OFFSET('[MiracleNikkiJp_items.csv]MiracleNikkiJp_items'!R10C[-4],RC1,0,1,1)) ->  | O88: =T(OFFSET('[MiracleNikkiJp_items.csv]MiracleNikkiJp_items'!R10C[-4],RC1,0,1,1)) ->  | P88: =T(OFFSET('[MiracleNikkiJp_items.csv]MiracleNikkiJp_items'!R10C[-4],RC1,0,1,1)) ->  | Q88: =T(OFFSET('[MiracleNikkiJp_items.csv]MiracleNikkiJp_items'!R10C[-4],RC1,0,1,1)) ->  | R88: =T(OFFSET('[MiracleNikkiJp_items.csv]MiracleNikkiJp_items'!R10C[-4],RC1,0,1,1)) ->  | S88: =T(OFFSET('[MiracleNikkiJp_items.csv]MiracleNikkiJp_items'!R10C[-4],RC1,0,1,1)) ->  | T88: =T(OFFSET('[MiracleNikkiJp_items.csv]MiracleNikkiJp_items'!R10C[-4],RC1,0,1,1)) ->  | U88: =T(OFFSET('[MiracleNikkiJp_items.csv]MiracleNikkiJp_items'!R10C[-4],RC1,0,1,1)) ->  | Y88: =T(OFFSET('[MiracleNikkiJp_items.csv]MiracleNikkiJp_items'!R10C[-7],RC1,0,1,1)) ->  | Z88: 37 | AA88: =IFERROR(VLOOKUP(RC[-16],R9C26:R17C36,2,FALSE),0)*R6C -> 0 | AB88: =IFERROR(VLOOKUP(RC[-16],R9C26:R17C36,3,FALSE),0)*R6C -> 0 | AC88: =IFERROR(VLOOKUP(RC[-16],R9C26:R17C36,4,FALSE),0)*R6C -> 0 | AD88: =IFERROR(VLOOKUP(RC[-16],R9C26:R17C36,5,FALSE),0)*R6C -> 0 | AE88: =IFERROR(VLOOKUP(RC[-16],R9C26:R17C36,6,FALSE),0)*R6C -> 0 | AF88: =IFERROR(VLOOKUP(RC[-16],R9C26:R17C36,7,FALSE),0)*R6C -> 0 | AG88: =IFERROR(VLOOKUP(RC[-16],R9C26:R17C36,8,FALSE),0)*R6C -> 0 | AH88: =IFERROR(VLOOKUP(RC[-16],R9C26:R17C36,9,FALSE),0)*R6C -> 0 | AI88: =IFERROR(VLOOKUP(RC[-16],R9C26:R17C36,10,FALSE),0)*R6C -> 0 | AJ88: =IFERROR(VLOOKUP(RC[-16],R9C26:R17C36,11,FALSE),0)*R6C -> 0 | AK88: =VLOOKUP(RC10,R9C38:R17C40,2,FALSE) -> 1 | AL88: =VLOOKUP(RC10,R9C38:R17C40,3,FALSE) -> 0 | AM88: =IF(OR(ISBLANK(R4C7),ISERROR(FIND(R4C7,RC21))),"　","●") ->  | AN88: =IF(OR(ISBLANK(R5C7),ISERROR(FIND(R5C7,RC21))),"　","●") ->  | AO88: =IF(RC39<>"●",VLOOKUP("評価しない",R9C42:R17C44,2,FALSE),VLOOKUP(R4C8,R9C42:R17C44,2,FALSE)) -> 1 | AP88: =IF(RC39<>"●",VLOOKUP("",R9C42:R17C44,3,FALSE),VLOOKUP(R4C8,R9C42:R17C44,3,FALSE)) -> 0 | AQ88: =IF(RC40<>"●",VLOOKUP("評価しない",R9C42:R17C44,2,FALSE),VLOOKUP(R5C8,R9C42:R17C44,2,FALSE)) -> 1 | AR88: =IF(RC40<>"●",VLOOKUP("",R9C42:R17C44,3,FALSE),VLOOKUP(R5C8,R9C42:R17C44,3,FALSE)) -> 0 | AS88: =IF(OR(ISBLANK(R6C7),ISERROR(FIND(R6C7,RC25))),"　","●") ->  | AT88: =IF(OR(ISBLANK(R7C7),ISERROR(FIND(R7C7,RC25))),"　","●") ->  | AU88: =IF(RC45<>"●",VLOOKUP("評価しない",R9C46:R17C48,2,FALSE),VLOOKUP(R6C8,R9C46:R17C48,2,FALSE)) -> 1 | AV88: =IF(RC45<>"●",VLOOKUP("",R9C46:R17C48,3,FALSE),VLOOKUP(R6C8,R9C46:R17C48,3,FALSE)) -> 0 | AW88: =IF(RC46<>"●",VLOOKUP("評価しない",R9C46:R17C48,2,FALSE),VLOOKUP(R7C8,R9C46:R17C48,2,FALSE)) -> 1 | AX88: =IF(RC46<>"●",VLOOKUP("",R9C46:R17C48,3,FALSE),VLOOKUP(R7C8,R9C46:R17C48,3,FALSE)) -> 0 | AY88: =SUM(RC27:RC36) -> 0 | AZ88: =RC37*RC41*RC43*RC47*RC49 -> 1 | BA88: =RC38+RC42+RC44+RC48+RC50 -> 0
A89: =OFFSET(R164C1,INT((RC26-1)/100),MOD(INT((RC26-1)/10),10),1,1)*10+MOD(RC26-1,10)+1 -> 38 | D89: =IF(AND(RC2<>"NG",OR(RC2<>"",RC3<>"",R9C4="×")),"◯","") ->  | E89: =IF(RC2="◯",RC6,"") ->  | F89: =T(OFFSET('[MiracleNikkiJp_items.csv]MiracleNikkiJp_items'!R10C[-3],RC1,0,1,1)) -> ヘアスタイル | G89: =T(OFFSET('[MiracleNikkiJp_items.csv]MiracleNikkiJp_items'!R10C[-2],RC1,0,1,1)) ->  | H89: =IF(RC4="",0,RC51*RC52+RC53) -> 0 | I89: =RC1 -> 38 | J89: =OFFSET('[MiracleNikkiJp_items.csv]MiracleNikkiJp_items'!R10C[-4],RC1,0,1,1) -> 0 | K89: =T(OFFSET('[MiracleNikkiJp_items.csv]MiracleNikkiJp_items'!R10C[-4],RC1,0,1,1)) ->  | L89: =T(OFFSET('[MiracleNikkiJp_items.csv]MiracleNikkiJp_items'!R10C[-4],RC1,0,1,1)) ->  | M89: =T(OFFSET('[MiracleNikkiJp_items.csv]MiracleNikkiJp_items'!R10C[-4],RC1,0,1,1)) ->  | N89: =T(OFFSET('[MiracleNikkiJp_items.csv]MiracleNikkiJp_items'!R10C[-4],RC1,0,1,1)) ->  | O89: =T(OFFSET('[MiracleNikkiJp_items.csv]MiracleNikkiJp_items'!R10C[-4],RC1,0,1,1)) ->  | P89: =T(OFFSET('[MiracleNikkiJp_items.csv]MiracleNikkiJp_items'!R10C[-4],RC1,0,1,1)) ->  | Q89: =T(OFFSET('[MiracleNikkiJp_items.csv]MiracleNikkiJp_items'!R10C[-4],RC1,0,1,1)) ->  | R89: =T(OFFSET('[MiracleNikkiJp_items.csv]MiracleNikkiJp_items'!R10C[-4],RC1,0,1,1)) ->  | S89: =T(OFFSET('[MiracleNikkiJp_items.csv]MiracleNikkiJp_items'!R10C[-4],RC1,0,1,1)) ->  | T89: =T(OFFSET('[MiracleNikkiJp_items.csv]MiracleNikkiJp_items'!R10C[-4],RC1,0,1,1)) ->  | U89: =T(OFFSET('[MiracleNikkiJp_items.csv]MiracleNikkiJp_items'!R10C[-4],RC1,0,1,1)) ->  | Y89: =T(OFFSET('[MiracleNikkiJp_items.csv]MiracleNikkiJp_items'!R10C[-7],RC1,0,1,1)) ->  | Z89: 38 | AA89: =IFERROR(VLOOKUP(RC[-16],R9C26:R17C36,2,FALSE),0)*R6C -> 0 | AB89: =IFERROR(VLOOKUP(RC[-16],R9C26:R17C36,3,FALSE),0)*R6C -> 0 | AC89: =IFERROR(VLOOKUP(RC[-16],R9C26:R17C36,4,FALSE),0)*R6C -> 0 | AD89: =IFERROR(VLOOKUP(RC[-16],R9C26:R17C36,5,FALSE),0)*R6C -> 0 | AE89: =IFERROR(VLOOKUP(RC[-16],R9C26:R17C36,6,FALSE),0)*R6C -> 0 | AF89: =IFERROR(VLOOKUP(RC[-16],R9C26:R17C36,7,FALSE),0)*R6C -> 0 | AG89: =IFERROR(VLOOKUP(RC[-16],R9C26:R17C36,8,FALSE),0)*R6C -> 0 | AH89: =IFERROR(VLOOKUP(RC[-16],R9C26:R17C36,9,FALSE),0)*R6C -> 0 | AI89: =IFERROR(VLOOKUP(RC[-16],R9C26:R17C36,10,FALSE),0)*R6C -> 0 | AJ89: =IFERROR(VLOOKUP(RC[-16],R9C26:R17C36,11,FALSE),0)*R6C -> 0 | AK89: =VLOOKUP(RC10,R9C38:R17C40,2,FALSE) -> 1 | AL89: =VLOOKUP(RC10,R9C38:R17C40,3,FALSE) -> 0 | AM89: =IF(OR(ISBLANK(R4C7),ISERROR(FIND(R4C7,RC21))),"　","●") ->  | AN89: =IF(OR(ISBLANK(R5C7),ISERROR(FIND(R5C7,RC21))),"　","●") ->  | AO89: =IF(RC39<>"●",VLOOKUP("評価しない",R9C42:R17C44,2,FALSE),VLOOKUP(R4C8,R9C42:R17C44,2,FALSE)) -> 1 | AP89: =IF(RC39<>"●",VLOOKUP("",R9C42:R17C44,3,FALSE),VLOOKUP(R4C8,R9C42:R17C44,3,FALSE)) -> 0 | AQ89: =IF(RC40<>"●",VLOOKUP("評価しない",R9C42:R17C44,2,FALSE),VLOOKUP(R5C8,R9C42:R17C44,2,FALSE)) -> 1 | AR89: =IF(RC40<>"●",VLOOKUP("",R9C42:R17C44,3,FALSE),VLOOKUP(R5C8,R9C42:R17C44,3,FALSE)) -> 0 | AS89: =IF(OR(ISBLANK(R6C7),ISERROR(FIND(R6C7,RC25))),"　","●") ->  | AT89: =IF(OR(ISBLANK(R7C7),ISERROR(FIND(R7C7,RC25))),"　","●") ->  | AU89: =IF(RC45<>"●",VLOOKUP("評価しない",R9C46:R17C48,2,FALSE),VLOOKUP(R6C8,R9C46:R17C48,2,FALSE)) -> 1 | AV89: =IF(RC45<>"●",VLOOKUP("",R9C46:R17C48,3,FALSE),VLOOKUP(R6C8,R9C46:R17C48,3,FALSE)) -> 0 | AW89: =IF(RC46<>"●",VLOOKUP("評価しない",R9C46:R17C48,2,FALSE),VLOOKUP(R7C8,R9C46:R17C48,2,FALSE)) -> 1 | AX89: =IF(RC46<>"●",VLOOKUP("",R9C46:R17C48,3,FALSE),VLOOKUP(R7C8,R9C46:R17C48,3,FALSE)) -> 0 | AY89: =SUM(RC27:RC36) -> 0 | AZ89: =RC37*RC41*RC43*RC47*RC49 -> 1 | BA89: =RC38+RC42+RC44+RC48+RC50 -> 0
A90: =OFFSET(R164C1,INT((RC26-1)/100),MOD(INT((RC26-1)/10),10),1,1)*10+MOD(RC26-1,10)+1 -> 39 | D90: =IF(AND(RC2<>"NG",OR(RC2<>"",RC3<>"",R9C4="×")),"◯","") ->  | E90: =IF(RC2="◯",RC6,"") ->  | F90: =T(OFFSET('[MiracleNikkiJp_items.csv]MiracleNikkiJp_items'!R10C[-3],RC1,0,1,1)) -> ヘアスタイル | G90: =T(OFFSET('[MiracleNikkiJp_items.csv]MiracleNikkiJp_items'!R10C[-2],RC1,0,1,1)) ->  | H90: =IF(RC4="",0,RC51*RC52+RC53) -> 0 | I90: =RC1 -> 39 | J90: =OFFSET('[MiracleNikkiJp_items.csv]MiracleNikkiJp_items'!R10C[-4],RC1,0,1,1) -> 0 | K90: =T(OFFSET('[MiracleNikkiJp_items.csv]MiracleNikkiJp_items'!R10C[-4],RC1,0,1,1)) ->  | L90: =T(OFFSET('[MiracleNikkiJp_items.csv]MiracleNikkiJp_items'!R10C[-4],RC1,0,1,1)) ->  | M90: =T(OFFSET('[MiracleNikkiJp_items.csv]MiracleNikkiJp_items'!R10C[-4],RC1,0,1,1)) ->  | N90: =T(OFFSET('[MiracleNikkiJp_items.csv]MiracleNikkiJp_items'!R10C[-4],RC1,0,1,1)) ->  | O90: =T(OFFSET('[MiracleNikkiJp_items.csv]MiracleNikkiJp_items'!R10C[-4],RC1,0,1,1)) ->  | P90: =T(OFFSET('[MiracleNikkiJp_items.csv]MiracleNikkiJp_items'!R10C[-4],RC1,0,1,1)) ->  | Q90: =T(OFFSET('[MiracleNikkiJp_items.csv]MiracleNikkiJp_items'!R10C[-4],RC1,0,1,1)) ->  | R90: =T(OFFSET('[MiracleNikkiJp_items.csv]MiracleNikkiJp_items'!R10C[-4],RC1,0,1,1)) ->  | S90: =T(OFFSET('[MiracleNikkiJp_items.csv]MiracleNikkiJp_items'!R10C[-4],RC1,0,1,1)) ->  | T90: =T(OFFSET('[MiracleNikkiJp_items.csv]MiracleNikkiJp_items'!R10C[-4],RC1,0,1,1)) ->  | U90: =T(OFFSET('[MiracleNikkiJp_items.csv]MiracleNikkiJp_items'!R10C[-4],RC1,0,1,1)) ->  | Y90: =T(OFFSET('[MiracleNikkiJp_items.csv]MiracleNikkiJp_items'!R10C[-7],RC1,0,1,1)) ->  | Z90: 39 | AA90: =IFERROR(VLOOKUP(RC[-16],R9C26:R17C36,2,FALSE),0)*R6C -> 0 | AB90: =IFERROR(VLOOKUP(RC[-16],R9C26:R17C36,3,FALSE),0)*R6C -> 0 | AC90: =IFERROR(VLOOKUP(RC[-16],R9C26:R17C36,4,FALSE),0)*R6C -> 0 | AD90: =IFERROR(VLOOKUP(RC[-16],R9C26:R17C36,5,FALSE),0)*R6C -> 0 | AE90: =IFERROR(VLOOKUP(RC[-16],R9C26:R17C36,6,FALSE),0)*R6C -> 0 | AF90: =IFERROR(VLOOKUP(RC[-16],R9C26:R17C36,7,FALSE),0)*R6C -> 0 | AG90: =IFERROR(VLOOKUP(RC[-16],R9C26:R17C36,8,FALSE),0)*R6C -> 0 | AH90: =IFERROR(VLOOKUP(RC[-16],R9C26:R17C36,9,FALSE),0)*R6C -> 0 | AI90: =IFERROR(VLOOKUP(RC[-16],R9C26:R17C36,10,FALSE),0)*R6C -> 0 | AJ90: =IFERROR(VLOOKUP(RC[-16],R9C26:R17C36,11,FALSE),0)*R6C -> 0 | AK90: =VLOOKUP(RC10,R9C38:R17C40,2,FALSE) -> 1 | AL90: =VLOOKUP(RC10,R9C38:R17C40,3,FALSE) -> 0 | AM90: =IF(OR(ISBLANK(R4C7),ISERROR(FIND(R4C7,RC21))),"　","●") ->  | AN90: =IF(OR(ISBLANK(R5C7),ISERROR(FIND(R5C7,RC21))),"　","●") ->  | AO90: =IF(RC39<>"●",VLOOKUP("評価しない",R9C42:R17C44,2,FALSE),VLOOKUP(R4C8,R9C42:R17C44,2,FALSE)) -> 1 | AP90: =IF(RC39<>"●",VLOOKUP("",R9C42:R17C44,3,FALSE),VLOOKUP(R4C8,R9C42:R17C44,3,FALSE)) -> 0 | AQ90: =IF(RC40<>"●",VLOOKUP("評価しない",R9C42:R17C44,2,FALSE),VLOOKUP(R5C8,R9C42:R17C44,2,FALSE)) -> 1 | AR90: =IF(RC40<>"●",VLOOKUP("",R9C42:R17C44,3,FALSE),VLOOKUP(R5C8,R9C42:R17C44,3,FALSE)) -> 0 | AS90: =IF(OR(ISBLANK(R6C7),ISERROR(FIND(R6C7,RC25))),"　","●") ->  | AT90: =IF(OR(ISBLANK(R7C7),ISERROR(FIND(R7C7,RC25))),"　","●") ->  | AU90: =IF(RC45<>"●",VLOOKUP("評価しない",R9C46:R17C48,2,FALSE),VLOOKUP(R6C8,R9C46:R17C48,2,FALSE)) -> 1 | AV90: =IF(RC45<>"●",VLOOKUP("",R9C46:R17C48,3,FALSE),VLOOKUP(R6C8,R9C46:R17C48,3,FALSE)) -> 0 | AW90: =IF(RC46<>"●",VLOOKUP("評価しない",R9C46:R17C48,2,FALSE),VLOOKUP(R7C8,R9C46:R17C48,2,FALSE)) -> 1 | AX90: =IF(RC46<>"●",VLOOKUP("",R9C46:R17C48,3,FALSE),VLOOKUP(R7C8,R9C46:R17C48,3,FALSE)) -> 0 | AY90: =SUM(RC27:RC36) -> 0 | AZ90: =RC37*RC41*RC43*RC47*RC49 -> 1 | BA90: =RC38+RC42+RC44+RC48+RC50 -> 0
A91: =OFFSET(R164C1,INT((RC26-1)/100),MOD(INT((RC26-1)/10),10),1,1)*10+MOD(RC26-1,10)+1 -> 40 | D91: =IF(AND(RC2<>"NG",OR(RC2<>"",RC3<>"",R9C4="×")),"◯","") ->  | E91: =IF(RC2="◯",RC6,"") ->  | F91: =T(OFFSET('[MiracleNikkiJp_items.csv]MiracleNikkiJp_items'!R10C[-3],RC1,0,1,1)) -> ヘアスタイル | G91: =T(OFFSET('[MiracleNikkiJp_items.csv]MiracleNikkiJp_items'!R10C[-2],RC1,0,1,1)) ->  | H91: =IF(RC4="",0,RC51*RC52+RC53) -> 0 | I91: =RC1 -> 40 | J91: =OFFSET('[MiracleNikkiJp_items.csv]MiracleNikkiJp_items'!R10C[-4],RC1,0,1,1) -> 0 | K91: =T(OFFSET('[MiracleNikkiJp_items.csv]MiracleNikkiJp_items'!R10C[-4],RC1,0,1,1)) ->  | L91: =T(OFFSET('[MiracleNikkiJp_items.csv]MiracleNikkiJp_items'!R10C[-4],RC1,0,1,1)) ->  | M91: =T(OFFSET('[MiracleNikkiJp_items.csv]MiracleNikkiJp_items'!R10C[-4],RC1,0,1,1)) ->  | N91: =T(OFFSET('[MiracleNikkiJp_items.csv]MiracleNikkiJp_items'!R10C[-4],RC1,0,1,1)) ->  | O91: =T(OFFSET('[MiracleNikkiJp_items.csv]MiracleNikkiJp_items'!R10C[-4],RC1,0,1,1)) ->  | P91: =T(OFFSET('[MiracleNikkiJp_items.csv]MiracleNikkiJp_items'!R10C[-4],RC1,0,1,1)) ->  | Q91: =T(OFFSET('[MiracleNikkiJp_items.csv]MiracleNikkiJp_items'!R10C[-4],RC1,0,1,1)) ->  | R91: =T(OFFSET('[MiracleNikkiJp_items.csv]MiracleNikkiJp_items'!R10C[-4],RC1,0,1,1)) ->  | S91: =T(OFFSET('[MiracleNikkiJp_items.csv]MiracleNikkiJp_items'!R10C[-4],RC1,0,1,1)) ->  | T91: =T(OFFSET('[MiracleNikkiJp_items.csv]MiracleNikkiJp_items'!R10C[-4],RC1,0,1,1)) ->  | U91: =T(OFFSET('[MiracleNikkiJp_items.csv]MiracleNikkiJp_items'!R10C[-4],RC1,0,1,1)) ->  | Y91: =T(OFFSET('[MiracleNikkiJp_items.csv]MiracleNikkiJp_items'!R10C[-7],RC1,0,1,1)) ->  | Z91: 40 | AA91: =IFERROR(VLOOKUP(RC[-16],R9C26:R17C36,2,FALSE),0)*R6C -> 0 | AB91: =IFERROR(VLOOKUP(RC[-16],R9C26:R17C36,3,FALSE),0)*R6C -> 0 | AC91: =IFERROR(VLOOKUP(RC[-16],R9C26:R17C36,4,FALSE),0)*R6C -> 0 | AD91: =IFERROR(VLOOKUP(RC[-16],R9C26:R17C36,5,FALSE),0)*R6C -> 0 | AE91: =IFERROR(VLOOKUP(RC[-16],R9C26:R17C36,6,FALSE),0)*R6C -> 0 | AF91: =IFERROR(VLOOKUP(RC[-16],R9C26:R17C36,7,FALSE),0)*R6C -> 0 | AG91: =IFERROR(VLOOKUP(RC[-16],R9C26:R17C36,8,FALSE),0)*R6C -> 0 | AH91: =IFERROR(VLOOKUP(RC[-16],R9C26:R17C36,9,FALSE),0)*R6C -> 0 | AI91: =IFERROR(VLOOKUP(RC[-16],R9C26:R17C36,10,FALSE),0)*R6C -> 0 | AJ91: =IFERROR(VLOOKUP(RC[-16],R9C26:R17C36,11,FALSE),0)*R6C -> 0 | AK91: =VLOOKUP(RC10,R9C38:R17C40,2,FALSE) -> 1 | AL91: =VLOOKUP(RC10,R9C38:R17C40,3,FALSE) -> 0 | AM91: =IF(OR(ISBLANK(R4C7),ISERROR(FIND(R4C7,RC21))),"　","●") ->  | AN91: =IF(OR(ISBLANK(R5C7),ISERROR(FIND(R5C7,RC21))),"　","●") ->  | AO91: =IF(RC39<>"●",VLOOKUP("評価しない",R9C42:R17C44,2,FALSE),VLOOKUP(R4C8,R9C42:R17C44,2,FALSE)) -> 1 | AP91: =IF(RC39<>"●",VLOOKUP("",R9C42:R17C44,3,FALSE),VLOOKUP(R4C8,R9C42:R17C44,3,FALSE)) -> 0 | AQ91: =IF(RC40<>"●",VLOOKUP("評価しない",R9C42:R17C44,2,FALSE),VLOOKUP(R5C8,R9C42:R17C44,2,FALSE)) -> 1 | AR91: =IF(RC40<>"●",VLOOKUP("",R9C42:R17C44,3,FALSE),VLOOKUP(R5C8,R9C42:R17C44,3,FALSE)) -> 0 | AS91: =IF(OR(ISBLANK(R6C7),ISERROR(FIND(R6C7,RC25))),"　","●") ->  | AT91: =IF(OR(ISBLANK(R7C7),ISERROR(FIND(R7C7,RC25))),"　","●") ->  | AU91: =IF(RC45<>"●",VLOOKUP("評価しない",R9C46:R17C48,2,FALSE),VLOOKUP(R6C8,R9C46:R17C48,2,FALSE)) -> 1 | AV91: =IF(RC45<>"●",VLOOKUP("",R9C46:R17C48,3,FALSE),VLOOKUP(R6C8,R9C46:R17C48,3,FALSE)) -> 0 | AW91: =IF(RC46<>"●",VLOOKUP("評価しない",R9C46:R17C48,2,FALSE),VLOOKUP(R7C8,R9C46:R17C48,2,FALSE)) -> 1 | AX91: =IF(RC46<>"●",VLOOKUP("",R9C46:R17C48,3,FALSE),VLOOKUP(R7C8,R9C46:R17C48,3,FALSE)) -> 0 | AY91: =SUM(RC27:RC36) -> 0 | AZ91: =RC37*RC41*RC43*RC47*RC49 -> 1 | BA91: =RC38+RC42+RC44+RC48+RC50 -> 0
A92: =OFFSET(R164C1,INT((RC26-1)/100),MOD(INT((RC26-1)/10),10),1,1)*10+MOD(RC26-1,10)+1 -> 41 | D92: =IF(AND(RC2<>"NG",OR(RC2<>"",RC3<>"",R9C4="×")),"◯","") ->  | E92: =IF(RC2="◯",RC6,"") ->  | F92: =T(OFFSET('[MiracleNikkiJp_items.csv]MiracleNikkiJp_items'!R10C[-3],RC1,0,1,1)) -> ヘアスタイル | G92: =T(OFFSET('[MiracleNikkiJp_items.csv]MiracleNikkiJp_items'!R10C[-2],RC1,0,1,1)) ->  | H92: =IF(RC4="",0,RC51*RC52+RC53) -> 0 | I92: =RC1 -> 41 | J92: =OFFSET('[MiracleNikkiJp_items.csv]MiracleNikkiJp_items'!R10C[-4],RC1,0,1,1) -> 0 | K92: =T(OFFSET('[MiracleNikkiJp_items.csv]MiracleNikkiJp_items'!R10C[-4],RC1,0,1,1)) ->  | L92: =T(OFFSET('[MiracleNikkiJp_items.csv]MiracleNikkiJp_items'!R10C[-4],RC1,0,1,1)) ->  | M92: =T(OFFSET('[MiracleNikkiJp_items.csv]MiracleNikkiJp_items'!R10C[-4],RC1,0,1,1)) ->  | N92: =T(OFFSET('[MiracleNikkiJp_items.csv]MiracleNikkiJp_items'!R10C[-4],RC1,0,1,1)) ->  | O92: =T(OFFSET('[MiracleNikkiJp_items.csv]MiracleNikkiJp_items'!R10C[-4],RC1,0,1,1)) ->  | P92: =T(OFFSET('[MiracleNikkiJp_items.csv]MiracleNikkiJp_items'!R10C[-4],RC1,0,1,1)) ->  | Q92: =T(OFFSET('[MiracleNikkiJp_items.csv]MiracleNikkiJp_items'!R10C[-4],RC1,0,1,1)) ->  | R92: =T(OFFSET('[MiracleNikkiJp_items.csv]MiracleNikkiJp_items'!R10C[-4],RC1,0,1,1)) ->  | S92: =T(OFFSET('[MiracleNikkiJp_items.csv]MiracleNikkiJp_items'!R10C[-4],RC1,0,1,1)) ->  | T92: =T(OFFSET('[MiracleNikkiJp_items.csv]MiracleNikkiJp_items'!R10C[-4],RC1,0,1,1)) ->  | U92: =T(OFFSET('[MiracleNikkiJp_items.csv]MiracleNikkiJp_items'!R10C[-4],RC1,0,1,1)) ->  | Y92: =T(OFFSET('[MiracleNikkiJp_items.csv]MiracleNikkiJp_items'!R10C[-7],RC1,0,1,1)) ->  | Z92: 41 | AA92: =IFERROR(VLOOKUP(RC[-16],R9C26:R17C36,2,FALSE),0)*R6C -> 0 | AB92: =IFERROR(VLOOKUP(RC[-16],R9C26:R17C36,3,FALSE),0)*R6C -> 0 | AC92: =IFERROR(VLOOKUP(RC[-16],R9C26:R17C36,4,FALSE),0)*R6C -> 0 | AD92: =IFERROR(VLOOKUP(RC[-16],R9C26:R17C36,5,FALSE),0)*R6C -> 0 | AE92: =IFERROR(VLOOKUP(RC[-16],R9C26:R17C36,6,FALSE),0)*R6C -> 0 | AF92: =IFERROR(VLOOKUP(RC[-16],R9C26:R17C36,7,FALSE),0)*R6C -> 0 | AG92: =IFERROR(VLOOKUP(RC[-16],R9C26:R17C36,8,FALSE),0)*R6C -> 0 | AH92: =IFERROR(VLOOKUP(RC[-16],R9C26:R17C36,9,FALSE),0)*R6C -> 0 | AI92: =IFERROR(VLOOKUP(RC[-16],R9C26:R17C36,10,FALSE),0)*R6C -> 0 | AJ92: =IFERROR(VLOOKUP(RC[-16],R9C26:R17C36,11,FALSE),0)*R6C -> 0 | AK92: =VLOOKUP(RC10,R9C38:R17C40,2,FALSE) -> 1 | AL92: =VLOOKUP(RC10,R9C38:R17C40,3,FALSE) -> 0 | AM92: =IF(OR(ISBLANK(R4C7),ISERROR(FIND(R4C7,RC21))),"　","●") ->  | AN92: =IF(OR(ISBLANK(R5C7),ISERROR(FIND(R5C7,RC21))),"　","●") ->  | AO92: =IF(RC39<>"●",VLOOKUP("評価しない",R9C42:R17C44,2,FALSE),VLOOKUP(R4C8,R9C42:R17C44,2,FALSE)) -> 1 | AP92: =IF(RC39<>"●",VLOOKUP("",R9C42:R17C44,3,FALSE),VLOOKUP(R4C8,R9C42:R17C44,3,FALSE)) -> 0 | AQ92: =IF(RC40<>"●",VLOOKUP("評価しない",R9C42:R17C44,2,FALSE),VLOOKUP(R5C8,R9C42:R17C44,2,FALSE)) -> 1 | AR92: =IF(RC40<>"●",VLOOKUP("",R9C42:R17C44,3,FALSE),VLOOKUP(R5C8,R9C42:R17C44,3,FALSE)) -> 0 | AS92: =IF(OR(ISBLANK(R6C7),ISERROR(FIND(R6C7,RC25))),"　","●") ->  | AT92: =IF(OR(ISBLANK(R7C7),ISERROR(FIND(R7C7,RC25))),"　","●") ->  | AU92: =IF(RC45<>"●",VLOOKUP("評価しない",R9C46:R17C48,2,FALSE),VLOOKUP(R6C8,R9C46:R17C48,2,FALSE)) -> 1 | AV92: =IF(RC45<>"●",VLOOKUP("",R9C46:R17C48,3,FALSE),VLOOKUP(R6C8,R9C46:R17C48,3,FALSE)) -> 0 | AW92: =IF(RC46<>"●",VLOOKUP("評価しない",R9C46:R17C48,2,FALSE),VLOOKUP(R7C8,R9C46:R17C48,2,FALSE)) -> 1 | AX92: =IF(RC46<>"●",VLOOKUP("",R9C46:R17C48,3,FALSE),VLOOKUP(R7C8,R9C46:R17C48,3,FALSE)) -> 0 | AY92: =SUM(RC27:RC36) -> 0 | AZ92: =RC37*RC41*RC43*RC47*RC49 -> 1 | BA92: =RC38+RC42+RC44+RC48+RC50 -> 0
A93: =OFFSET(R164C1,INT((RC26-1)/100),MOD(INT((RC26-1)/10),10),1,1)*10+MOD(RC26-1,10)+1 -> 42 | D93: =IF(AND(RC2<>"NG",OR(RC2<>"",RC3<>"",R9C4="×")),"◯","") ->  | E93: =IF(RC2="◯",RC6,"") ->  | F93: =T(OFFSET('[MiracleNikkiJp_items.csv]MiracleNikkiJp_items'!R10C[-3],RC1,0,1,1)) -> ヘアスタイル | G93: =T(OFFSET('[MiracleNikkiJp_items.csv]MiracleNikkiJp_items'!R10C[-2],RC1,0,1,1)) ->  | H93: =IF(RC4="",0,RC51*RC52+RC53) -> 0 | I93: =RC1 -> 42 | J93: =OFFSET('[MiracleNikkiJp_items.csv]MiracleNikkiJp_items'!R10C[-4],RC1,0,1,1) -> 0 | K93: =T(OFFSET('[MiracleNikkiJp_items.csv]MiracleNikkiJp_items'!R10C[-4],RC1,0,1,1)) ->  | L93: =T(OFFSET('[MiracleNikkiJp_items.csv]MiracleNikkiJp_items'!R10C[-4],RC1,0,1,1)) ->  | M93: =T(OFFSET('[MiracleNikkiJp_items.csv]MiracleNikkiJp_items'!R10C[-4],RC1,0,1,1)) ->  | N93: =T(OFFSET('[MiracleNikkiJp_items.csv]MiracleNikkiJp_items'!R10C[-4],RC1,0,1,1)) ->  | O93: =T(OFFSET('[MiracleNikkiJp_items.csv]MiracleNikkiJp_items'!R10C[-4],RC1,0,1,1)) ->  | P93: =T(OFFSET('[MiracleNikkiJp_items.csv]MiracleNikkiJp_items'!R10C[-4],RC1,0,1,1)) ->  | Q93: =T(OFFSET('[MiracleNikkiJp_items.csv]MiracleNikkiJp_items'!R10C[-4],RC1,0,1,1)) ->  | R93: =T(OFFSET('[MiracleNikkiJp_items.csv]MiracleNikkiJp_items'!R10C[-4],RC1,0,1,1)) ->  | S93: =T(OFFSET('[MiracleNikkiJp_items.csv]MiracleNikkiJp_items'!R10C[-4],RC1,0,1,1)) ->  | T93: =T(OFFSET('[MiracleNikkiJp_items.csv]MiracleNikkiJp_items'!R10C[-4],RC1,0,1,1)) ->  | U93: =T(OFFSET('[MiracleNikkiJp_items.csv]MiracleNikkiJp_items'!R10C[-4],RC1,0,1,1)) ->  | Y93: =T(OFFSET('[MiracleNikkiJp_items.csv]MiracleNikkiJp_items'!R10C[-7],RC1,0,1,1)) ->  | Z93: 42 | AA93: =IFERROR(VLOOKUP(RC[-16],R9C26:R17C36,2,FALSE),0)*R6C -> 0 | AB93: =IFERROR(VLOOKUP(RC[-16],R9C26:R17C36,3,FALSE),0)*R6C -> 0 | AC93: =IFERROR(VLOOKUP(RC[-16],R9C26:R17C36,4,FALSE),0)*R6C -> 0 | AD93: =IFERROR(VLOOKUP(RC[-16],R9C26:R17C36,5,FALSE),0)*R6C -> 0 | AE93: =IFERROR(VLOOKUP(RC[-16],R9C26:R17C36,6,FALSE),0)*R6C -> 0 | AF93: =IFERROR(VLOOKUP(RC[-16],R9C26:R17C36,7,FALSE),0)*R6C -> 0 | AG93: =IFERROR(VLOOKUP(RC[-16],R9C26:R17C36,8,FALSE),0)*R6C -> 0 | AH93: =IFERROR(VLOOKUP(RC[-16],R9C26:R17C36,9,FALSE),0)*R6C -> 0 | AI93: =IFERROR(VLOOKUP(RC[-16],R9C26:R17C36,10,FALSE),0)*R6C -> 0 | AJ93: =IFERROR(VLOOKUP(RC[-16],R9C26:R17C36,11,FALSE),0)*R6C -> 0 | AK93: =VLOOKUP(RC10,R9C38:R17C40,2,FALSE) -> 1 | AL93: =VLOOKUP(RC10,R9C38:R17C40,3,FALSE) -> 0 | AM93: =IF(OR(ISBLANK(R4C7),ISERROR(FIND(R4C7,RC21))),"　","●") ->  | AN93: =IF(OR(ISBLANK(R5C7),ISERROR(FIND(R5C7,RC21))),"　","●") ->  | AO93: =IF(RC39<>"●",VLOOKUP("評価しない",R9C42:R17C44,2,FALSE),VLOOKUP(R4C8,R9C42:R17C44,2,FALSE)) -> 1 | AP93: =IF(RC39<>"●",VLOOKUP("",R9C42:R17C44,3,FALSE),VLOOKUP(R4C8,R9C42:R17C44,3,FALSE)) -> 0 | AQ93: =IF(RC40<>"●",VLOOKUP("評価しない",R9C42:R17C44,2,FALSE),VLOOKUP(R5C8,R9C42:R17C44,2,FALSE)) -> 1 | AR93: =IF(RC40<>"●",VLOOKUP("",R9C42:R17C44,3,FALSE),VLOOKUP(R5C8,R9C42:R17C44,3,FALSE)) -> 0 | AS93: =IF(OR(ISBLANK(R6C7),ISERROR(FIND(R6C7,RC25))),"　","●") ->  | AT93: =IF(OR(ISBLANK(R7C7),ISERROR(FIND(R7C7,RC25))),"　","●") ->  | AU93: =IF(RC45<>"●",VLOOKUP("評価しない",R9C46:R17C48,2,FALSE),VLOOKUP(R6C8,R9C46:R17C48,2,FALSE)) -> 1 | AV93: =IF(RC45<>"●",VLOOKUP("",R9C46:R17C48,3,FALSE),VLOOKUP(R6C8,R9C46:R17C48,3,FALSE)) -> 0 | AW93: =IF(RC46<>"●",VLOOKUP("評価しない",R9C46:R17C48,2,FALSE),VLOOKUP(R7C8,R9C46:R17C48,2,FALSE)) -> 1 | AX93: =IF(RC46<>"●",VLOOKUP("",R9C46:R17C48,3,FALSE),VLOOKUP(R7C8,R9C46:R17C48,3,FALSE)) -> 0 | AY93: =SUM(RC27:RC36) -> 0 | AZ93: =RC37*RC41*RC43*RC47*RC49 -> 1 | BA93: =RC38+RC42+RC44+RC48+RC50 -> 0
A94: =OFFSET(R164C1,INT((RC26-1)/100),MOD(INT((RC26-1)/10),10),1,1)*10+MOD(RC26-1,10)+1 -> 43 | D94: =IF(AND(RC2<>"NG",OR(RC2<>"",RC3<>"",R9C4="×")),"◯","") ->  | E94: =IF(RC2="◯",RC6,"") ->  | F94: =T(OFFSET('[MiracleNikkiJp_items.csv]MiracleNikkiJp_items'!R10C[-3],RC1,0,1,1)) -> ヘアスタイル | G94: =T(OFFSET('[MiracleNikkiJp_items.csv]MiracleNikkiJp_items'!R10C[-2],RC1,0,1,1)) ->  | H94: =IF(RC4="",0,RC51*RC52+RC53) -> 0 | I94: =RC1 -> 43 | J94: =OFFSET('[MiracleNikkiJp_items.csv]MiracleNikkiJp_items'!R10C[-4],RC1,0,1,1) -> 0 | K94: =T(OFFSET('[MiracleNikkiJp_items.csv]MiracleNikkiJp_items'!R10C[-4],RC1,0,1,1)) ->  | L94: =T(OFFSET('[MiracleNikkiJp_items.csv]MiracleNikkiJp_items'!R10C[-4],RC1,0,1,1)) ->  | M94: =T(OFFSET('[MiracleNikkiJp_items.csv]MiracleNikkiJp_items'!R10C[-4],RC1,0,1,1)) ->  | N94: =T(OFFSET('[MiracleNikkiJp_items.csv]MiracleNikkiJp_items'!R10C[-4],RC1,0,1,1)) ->  | O94: =T(OFFSET('[MiracleNikkiJp_items.csv]MiracleNikkiJp_items'!R10C[-4],RC1,0,1,1)) ->  | P94: =T(OFFSET('[MiracleNikkiJp_items.csv]MiracleNikkiJp_items'!R10C[-4],RC1,0,1,1)) ->  | Q94: =T(OFFSET('[MiracleNikkiJp_items.csv]MiracleNikkiJp_items'!R10C[-4],RC1,0,1,1)) ->  | R94: =T(OFFSET('[MiracleNikkiJp_items.csv]MiracleNikkiJp_items'!R10C[-4],RC1,0,1,1)) ->  | S94: =T(OFFSET('[MiracleNikkiJp_items.csv]MiracleNikkiJp_items'!R10C[-4],RC1,0,1,1)) ->  | T94: =T(OFFSET('[MiracleNikkiJp_items.csv]MiracleNikkiJp_items'!R10C[-4],RC1,0,1,1)) ->  | U94: =T(OFFSET('[MiracleNikkiJp_items.csv]MiracleNikkiJp_items'!R10C[-4],RC1,0,1,1)) ->  | Y94: =T(OFFSET('[MiracleNikkiJp_items.csv]MiracleNikkiJp_items'!R10C[-7],RC1,0,1,1)) ->  | Z94: 43 | AA94: =IFERROR(VLOOKUP(RC[-16],R9C26:R17C36,2,FALSE),0)*R6C -> 0 | AB94: =IFERROR(VLOOKUP(RC[-16],R9C26:R17C36,3,FALSE),0)*R6C -> 0 | AC94: =IFERROR(VLOOKUP(RC[-16],R9C26:R17C36,4,FALSE),0)*R6C -> 0 | AD94: =IFERROR(VLOOKUP(RC[-16],R9C26:R17C36,5,FALSE),0)*R6C -> 0 | AE94: =IFERROR(VLOOKUP(RC[-16],R9C26:R17C36,6,FALSE),0)*R6C -> 0 | AF94: =IFERROR(VLOOKUP(RC[-16],R9C26:R17C36,7,FALSE),0)*R6C -> 0 | AG94: =IFERROR(VLOOKUP(RC[-16],R9C26:R17C36,8,FALSE),0)*R6C -> 0 | AH94: =IFERROR(VLOOKUP(RC[-16],R9C26:R17C36,9,FALSE),0)*R6C -> 0 | AI94: =IFERROR(VLOOKUP(RC[-16],R9C26:R17C36,10,FALSE),0)*R6C -> 0 | AJ94: =IFERROR(VLOOKUP(RC[-16],R9C26:R17C36,11,FALSE),0)*R6C -> 0 | AK94: =VLOOKUP(RC10,R9C38:R17C40,2,FALSE) -> 1 | AL94: =VLOOKUP(RC10,R9C38:R17C40,3,FALSE) -> 0 | AM94: =IF(OR(ISBLANK(R4C7),ISERROR(FIND(R4C7,RC21))),"　","●") ->  | AN94: =IF(OR(ISBLANK(R5C7),ISERROR(FIND(R5C7,RC21))),"　","●") ->  | AO94: =IF(RC39<>"●",VLOOKUP("評価しない",R9C42:R17C44,2,FALSE),VLOOKUP(R4C8,R9C42:R17C44,2,FALSE)) -> 1 | AP94: =IF(RC39<>"●",VLOOKUP("",R9C42:R17C44,3,FALSE),VLOOKUP(R4C8,R9C42:R17C44,3,FALSE)) -> 0 | AQ94: =IF(RC40<>"●",VLOOKUP("評価しない",R9C42:R17C44,2,FALSE),VLOOKUP(R5C8,R9C42:R17C44,2,FALSE)) -> 1 | AR94: =IF(RC40<>"●",VLOOKUP("",R9C42:R17C44,3,FALSE),VLOOKUP(R5C8,R9C42:R17C44,3,FALSE)) -> 0 | AS94: =IF(OR(ISBLANK(R6C7),ISERROR(FIND(R6C7,RC25))),"　","●") ->  | AT94: =IF(OR(ISBLANK(R7C7),ISERROR(FIND(R7C7,RC25))),"　","●") ->  | AU94: =IF(RC45<>"●",VLOOKUP("評価しない",R9C46:R17C48,2,FALSE),VLOOKUP(R6C8,R9C46:R17C48,2,FALSE)) -> 1 | AV94: =IF(RC45<>"●",VLOOKUP("",R9C46:R17C48,3,FALSE),VLOOKUP(R6C8,R9C46:R17C48,3,FALSE)) -> 0 | AW94: =IF(RC46<>"●",VLOOKUP("評価しない",R9C46:R17C48,2,FALSE),VLOOKUP(R7C8,R9C46:R17C48,2,FALSE)) -> 1 | AX94: =IF(RC46<>"●",VLOOKUP("",R9C46:R17C48,3,FALSE),VLOOKUP(R7C8,R9C46:R17C48,3,FALSE)) -> 0 | AY94: =SUM(RC27:RC36) -> 0 | AZ94: =RC37*RC41*RC43*RC47*RC49 -> 1 | BA94: =RC38+RC42+RC44+RC48+RC50 -> 0
A95: =OFFSET(R164C1,INT((RC26-1)/100),MOD(INT((RC26-1)/10),10),1,1)*10+MOD(RC26-1,10)+1 -> 44 | D95: =IF(AND(RC2<>"NG",OR(RC2<>"",RC3<>"",R9C4="×")),"◯","") ->  | E95: =IF(RC2="◯",RC6,"") ->  | F95: =T(OFFSET('[MiracleNikkiJp_items.csv]MiracleNikkiJp_items'!R10C[-3],RC1,0,1,1)) -> ヘアスタイル | G95: =T(OFFSET('[MiracleNikkiJp_items.csv]MiracleNikkiJp_items'!R10C[-2],RC1,0,1,1)) ->  | H95: =IF(RC4="",0,RC51*RC52+RC53) -> 0 | I95: =RC1 -> 44 | J95: =OFFSET('[MiracleNikkiJp_items.csv]MiracleNikkiJp_items'!R10C[-4],RC1,0,1,1) -> 0 | K95: =T(OFFSET('[MiracleNikkiJp_items.csv]MiracleNikkiJp_items'!R10C[-4],RC1,0,1,1)) ->  | L95: =T(OFFSET('[MiracleNikkiJp_items.csv]MiracleNikkiJp_items'!R10C[-4],RC1,0,1,1)) ->  | M95: =T(OFFSET('[MiracleNikkiJp_items.csv]MiracleNikkiJp_items'!R10C[-4],RC1,0,1,1)) ->  | N95: =T(OFFSET('[MiracleNikkiJp_items.csv]MiracleNikkiJp_items'!R10C[-4],RC1,0,1,1)) ->  | O95: =T(OFFSET('[MiracleNikkiJp_items.csv]MiracleNikkiJp_items'!R10C[-4],RC1,0,1,1)) ->  | P95: =T(OFFSET('[MiracleNikkiJp_items.csv]MiracleNikkiJp_items'!R10C[-4],RC1,0,1,1)) ->  | Q95: =T(OFFSET('[MiracleNikkiJp_items.csv]MiracleNikkiJp_items'!R10C[-4],RC1,0,1,1)) ->  | R95: =T(OFFSET('[MiracleNikkiJp_items.csv]MiracleNikkiJp_items'!R10C[-4],RC1,0,1,1)) ->  | S95: =T(OFFSET('[MiracleNikkiJp_items.csv]MiracleNikkiJp_items'!R10C[-4],RC1,0,1,1)) ->  | T95: =T(OFFSET('[MiracleNikkiJp_items.csv]MiracleNikkiJp_items'!R10C[-4],RC1,0,1,1)) ->  | U95: =T(OFFSET('[MiracleNikkiJp_items.csv]MiracleNikkiJp_items'!R10C[-4],RC1,0,1,1)) ->  | Y95: =T(OFFSET('[MiracleNikkiJp_items.csv]MiracleNikkiJp_items'!R10C[-7],RC1,0,1,1)) ->  | Z95: 44 | AA95: =IFERROR(VLOOKUP(RC[-16],R9C26:R17C36,2,FALSE),0)*R6C -> 0 | AB95: =IFERROR(VLOOKUP(RC[-16],R9C26:R17C36,3,FALSE),0)*R6C -> 0 | AC95: =IFERROR(VLOOKUP(RC[-16],R9C26:R17C36,4,FALSE),0)*R6C -> 0 | AD95: =IFERROR(VLOOKUP(RC[-16],R9C26:R17C36,5,FALSE),0)*R6C -> 0 | AE95: =IFERROR(VLOOKUP(RC[-16],R9C26:R17C36,6,FALSE),0)*R6C -> 0 | AF95: =IFERROR(VLOOKUP(RC[-16],R9C26:R17C36,7,FALSE),0)*R6C -> 0 | AG95: =IFERROR(VLOOKUP(RC[-16],R9C26:R17C36,8,FALSE),0)*R6C -> 0 | AH95: =IFERROR(VLOOKUP(RC[-16],R9C26:R17C36,9,FALSE),0)*R6C -> 0 | AI95: =IFERROR(VLOOKUP(RC[-16],R9C26:R17C36,10,FALSE),0)*R6C -> 0 | AJ95: =IFERROR(VLOOKUP(RC[-16],R9C26:R17C36,11,FALSE),0)*R6C -> 0 | AK95: =VLOOKUP(RC10,R9C38:R17C40,2,FALSE) -> 1 | AL95: =VLOOKUP(RC10,R9C38:R17C40,3,FALSE) -> 0 | AM95: =IF(OR(ISBLANK(R4C7),ISERROR(FIND(R4C7,RC21))),"　","●") ->  | AN95: =IF(OR(ISBLANK(R5C7),ISERROR(FIND(R5C7,RC21))),"　","●") ->  | AO95: =IF(RC39<>"●",VLOOKUP("評価しない",R9C42:R17C44,2,FALSE),VLOOKUP(R4C8,R9C42:R17C44,2,FALSE)) -> 1 | AP95: =IF(RC39<>"●",VLOOKUP("",R9C42:R17C44,3,FALSE),VLOOKUP(R4C8,R9C42:R17C44,3,FALSE)) -> 0 | AQ95: =IF(RC40<>"●",VLOOKUP("評価しない",R9C42:R17C44,2,FALSE),VLOOKUP(R5C8,R9C42:R17C44,2,FALSE)) -> 1 | AR95: =IF(RC40<>"●",VLOOKUP("",R9C42:R17C44,3,FALSE),VLOOKUP(R5C8,R9C42:R17C44,3,FALSE)) -> 0 | AS95: =IF(OR(ISBLANK(R6C7),ISERROR(FIND(R6C7,RC25))),"　","●") ->  | AT95: =IF(OR(ISBLANK(R7C7),ISERROR(FIND(R7C7,RC25))),"　","●") ->  | AU95: =IF(RC45<>"●",VLOOKUP("評価しない",R9C46:R17C48,2,FALSE),VLOOKUP(R6C8,R9C46:R17C48,2,FALSE)) -> 1 | AV95: =IF(RC45<>"●",VLOOKUP("",R9C46:R17C48,3,FALSE),VLOOKUP(R6C8,R9C46:R17C48,3,FALSE)) -> 0 | AW95: =IF(RC46<>"●",VLOOKUP("評価しない",R9C46:R17C48,2,FALSE),VLOOKUP(R7C8,R9C46:R17C48,2,FALSE)) -> 1 | AX95: =IF(RC46<>"●",VLOOKUP("",R9C46:R17C48,3,FALSE),VLOOKUP(R7C8,R9C46:R17C48,3,FALSE)) -> 0 | AY95: =SUM(RC27:RC36) -> 0 | AZ95: =RC37*RC41*RC43*RC47*RC49 -> 1 | BA95: =RC38+RC42+RC44+RC48+RC50 -> 0
A96: =OFFSET(R164C1,INT((RC26-1)/100),MOD(INT((RC26-1)/10),10),1,1)*10+MOD(RC26-1,10)+1 -> 45 | D96: =IF(AND(RC2<>"NG",OR(RC2<>"",RC3<>"",R9C4="×")),"◯","") ->  | E96: =IF(RC2="◯",RC6,"") ->  | F96: =T(OFFSET('[MiracleNikkiJp_items.csv]MiracleNikkiJp_items'!R10C[-3],RC1,0,1,1)) -> ヘアスタイル | G96: =T(OFFSET('[MiracleNikkiJp_items.csv]MiracleNikkiJp_items'!R10C[-2],RC1,0,1,1)) ->  | H96: =IF(RC4="",0,RC51*RC52+RC53) -> 0 | I96: =RC1 -> 45 | J96: =OFFSET('[MiracleNikkiJp_items.csv]MiracleNikkiJp_items'!R10C[-4],RC1,0,1,1) -> 0 | K96: =T(OFFSET('[MiracleNikkiJp_items.csv]MiracleNikkiJp_items'!R10C[-4],RC1,0,1,1)) ->  | L96: =T(OFFSET('[MiracleNikkiJp_items.csv]MiracleNikkiJp_items'!R10C[-4],RC1,0,1,1)) ->  | M96: =T(OFFSET('[MiracleNikkiJp_items.csv]MiracleNikkiJp_items'!R10C[-4],RC1,0,1,1)) ->  | N96: =T(OFFSET('[MiracleNikkiJp_items.csv]MiracleNikkiJp_items'!R10C[-4],RC1,0,1,1)) ->  | O96: =T(OFFSET('[MiracleNikkiJp_items.csv]MiracleNikkiJp_items'!R10C[-4],RC1,0,1,1)) ->  | P96: =T(OFFSET('[MiracleNikkiJp_items.csv]MiracleNikkiJp_items'!R10C[-4],RC1,0,1,1)) ->  | Q96: =T(OFFSET('[MiracleNikkiJp_items.csv]MiracleNikkiJp_items'!R10C[-4],RC1,0,1,1)) ->  | R96: =T(OFFSET('[MiracleNikkiJp_items.csv]MiracleNikkiJp_items'!R10C[-4],RC1,0,1,1)) ->  | S96: =T(OFFSET('[MiracleNikkiJp_items.csv]MiracleNikkiJp_items'!R10C[-4],RC1,0,1,1)) ->  | T96: =T(OFFSET('[MiracleNikkiJp_items.csv]MiracleNikkiJp_items'!R10C[-4],RC1,0,1,1)) ->  | U96: =T(OFFSET('[MiracleNikkiJp_items.csv]MiracleNikkiJp_items'!R10C[-4],RC1,0,1,1)) ->  | Y96: =T(OFFSET('[MiracleNikkiJp_items.csv]MiracleNikkiJp_items'!R10C[-7],RC1,0,1,1)) ->  | Z96: 45 | AA96: =IFERROR(VLOOKUP(RC[-16],R9C26:R17C36,2,FALSE),0)*R6C -> 0 | AB96: =IFERROR(VLOOKUP(RC[-16],R9C26:R17C36,3,FALSE),0)*R6C -> 0 | AC96: =IFERROR(VLOOKUP(RC[-16],R9C26:R17C36,4,FALSE),0)*R6C -> 0 | AD96: =IFERROR(VLOOKUP(RC[-16],R9C26:R17C36,5,FALSE),0)*R6C -> 0 | AE96: =IFERROR(VLOOKUP(RC[-16],R9C26:R17C36,6,FALSE),0)*R6C -> 0 | AF96: =IFERROR(VLOOKUP(RC[-16],R9C26:R17C36,7,FALSE),0)*R6C -> 0 | AG96: =IFERROR(VLOOKUP(RC[-16],R9C26:R17C36,8,FALSE),0)*R6C -> 0 | AH96: =IFERROR(VLOOKUP(RC[-16],R9C26:R17C36,9,FALSE),0)*R6C -> 0 | AI96: =IFERROR(VLOOKUP(RC[-16],R9C26:R17C36,10,FALSE),0)*R6C -> 0 | AJ96: =IFERROR(VLOOKUP(RC[-16],R9C26:R17C36,11,FALSE),0)*R6C -> 0 | AK96: =VLOOKUP(RC10,R9C38:R17C40,2,FALSE) -> 1 | AL96: =VLOOKUP(RC10,R9C38:R17C40,3,FALSE) -> 0 | AM96: =IF(OR(ISBLANK(R4C7),ISERROR(FIND(R4C7,RC21))),"　","●") ->  | AN96: =IF(OR(ISBLANK(R5C7),ISERROR(FIND(R5C7,RC21))),"　","●") ->  | AO96: =IF(RC39<>"●",VLOOKUP("評価しない",R9C42:R17C44,2,FALSE),VLOOKUP(R4C8,R9C42:R17C44,2,FALSE)) -> 1 | AP96: =IF(RC39<>"●",VLOOKUP("",R9C42:R17C44,3,FALSE),VLOOKUP(R4C8,R9C42:R17C44,3,FALSE)) -> 0 | AQ96: =IF(RC40<>"●",VLOOKUP("評価しない",R9C42:R17C44,2,FALSE),VLOOKUP(R5C8,R9C42:R17C44,2,FALSE)) -> 1 | AR96: =IF(RC40<>"●",VLOOKUP("",R9C42:R17C44,3,FALSE),VLOOKUP(R5C8,R9C42:R17C44,3,FALSE)) -> 0 | AS96: =IF(OR(ISBLANK(R6C7),ISERROR(FIND(R6C7,RC25))),"　","●") ->  | AT96: =IF(OR(ISBLANK(R7C7),ISERROR(FIND(R7C7,RC25))),"　","●") ->  | AU96: =IF(RC45<>"●",VLOOKUP("評価しない",R9C46:R17C48,2,FALSE),VLOOKUP(R6C8,R9C46:R17C48,2,FALSE)) -> 1 | AV96: =IF(RC45<>"●",VLOOKUP("",R9C46:R17C48,3,FALSE),VLOOKUP(R6C8,R9C46:R17C48,3,FALSE)) -> 0 | AW96: =IF(RC46<>"●",VLOOKUP("評価しない",R9C46:R17C48,2,FALSE),VLOOKUP(R7C8,R9C46:R17C48,2,FALSE)) -> 1 | AX96: =IF(RC46<>"●",VLOOKUP("",R9C46:R17C48,3,FALSE),VLOOKUP(R7C8,R9C46:R17C48,3,FALSE)) -> 0 | AY96: =SUM(RC27:RC36) -> 0 | AZ96: =RC37*RC41*RC43*RC47*RC49 -> 1 | BA96: =RC38+RC42+RC44+RC48+RC50 -> 0
A97: =OFFSET(R164C1,INT((RC26-1)/100),MOD(INT((RC26-1)/10),10),1,1)*10+MOD(RC26-1,10)+1 -> 46 | D97: =IF(AND(RC2<>"NG",OR(RC2<>"",RC3<>"",R9C4="×")),"◯","") ->  | E97: =IF(RC2="◯",RC6,"") ->  | F97: =T(OFFSET('[MiracleNikkiJp_items.csv]MiracleNikkiJp_items'!R10C[-3],RC1,0,1,1)) -> ヘアスタイル | G97: =T(OFFSET('[MiracleNikkiJp_items.csv]MiracleNikkiJp_items'!R10C[-2],RC1,0,1,1)) ->  | H97: =IF(RC4="",0,RC51*RC52+RC53) -> 0 | I97: =RC1 -> 46 | J97: =OFFSET('[MiracleNikkiJp_items.csv]MiracleNikkiJp_items'!R10C[-4],RC1,0,1,1) -> 0 | K97: =T(OFFSET('[MiracleNikkiJp_items.csv]MiracleNikkiJp_items'!R10C[-4],RC1,0,1,1)) ->  | L97: =T(OFFSET('[MiracleNikkiJp_items.csv]MiracleNikkiJp_items'!R10C[-4],RC1,0,1,1)) ->  | M97: =T(OFFSET('[MiracleNikkiJp_items.csv]MiracleNikkiJp_items'!R10C[-4],RC1,0,1,1)) ->  | N97: =T(OFFSET('[MiracleNikkiJp_items.csv]MiracleNikkiJp_items'!R10C[-4],RC1,0,1,1)) ->  | O97: =T(OFFSET('[MiracleNikkiJp_items.csv]MiracleNikkiJp_items'!R10C[-4],RC1,0,1,1)) ->  | P97: =T(OFFSET('[MiracleNikkiJp_items.csv]MiracleNikkiJp_items'!R10C[-4],RC1,0,1,1)) ->  | Q97: =T(OFFSET('[MiracleNikkiJp_items.csv]MiracleNikkiJp_items'!R10C[-4],RC1,0,1,1)) ->  | R97: =T(OFFSET('[MiracleNikkiJp_items.csv]MiracleNikkiJp_items'!R10C[-4],RC1,0,1,1)) ->  | S97: =T(OFFSET('[MiracleNikkiJp_items.csv]MiracleNikkiJp_items'!R10C[-4],RC1,0,1,1)) ->  | T97: =T(OFFSET('[MiracleNikkiJp_items.csv]MiracleNikkiJp_items'!R10C[-4],RC1,0,1,1)) ->  | U97: =T(OFFSET('[MiracleNikkiJp_items.csv]MiracleNikkiJp_items'!R10C[-4],RC1,0,1,1)) ->  | Y97: =T(OFFSET('[MiracleNikkiJp_items.csv]MiracleNikkiJp_items'!R10C[-7],RC1,0,1,1)) ->  | Z97: 46 | AA97: =IFERROR(VLOOKUP(RC[-16],R9C26:R17C36,2,FALSE),0)*R6C -> 0 | AB97: =IFERROR(VLOOKUP(RC[-16],R9C26:R17C36,3,FALSE),0)*R6C -> 0 | AC97: =IFERROR(VLOOKUP(RC[-16],R9C26:R17C36,4,FALSE),0)*R6C -> 0 | AD97: =IFERROR(VLOOKUP(RC[-16],R9C26:R17C36,5,FALSE),0)*R6C -> 0 | AE97: =IFERROR(VLOOKUP(RC[-16],R9C26:R17C36,6,FALSE),0)*R6C -> 0 | AF97: =IFERROR(VLOOKUP(RC[-16],R9C26:R17C36,7,FALSE),0)*R6C -> 0 | AG97: =IFERROR(VLOOKUP(RC[-16],R9C26:R17C36,8,FALSE),0)*R6C -> 0 | AH97: =IFERROR(VLOOKUP(RC[-16],R9C26:R17C36,9,FALSE),0)*R6C -> 0 | AI97: =IFERROR(VLOOKUP(RC[-16],R9C26:R17C36,10,FALSE),0)*R6C -> 0 | AJ97: =IFERROR(VLOOKUP(RC[-16],R9C26:R17C36,11,FALSE),0)*R6C -> 0 | AK97: =VLOOKUP(RC10,R9C38:R17C40,2,FALSE) -> 1 | AL97: =VLOOKUP(RC10,R9C38:R17C40,3,FALSE) -> 0 | AM97: =IF(OR(ISBLANK(R4C7),ISERROR(FIND(R4C7,RC21))),"　","●") ->  | AN97: =IF(OR(ISBLANK(R5C7),ISERROR(FIND(R5C7,RC21))),"　","●") ->  | AO97: =IF(RC39<>"●",VLOOKUP("評価しない",R9C42:R17C44,2,FALSE),VLOOKUP(R4C8,R9C42:R17C44,2,FALSE)) -> 1 | AP97: =IF(RC39<>"●",VLOOKUP("",R9C42:R17C44,3,FALSE),VLOOKUP(R4C8,R9C42:R17C44,3,FALSE)) -> 0 | AQ97: =IF(RC40<>"●",VLOOKUP("評価しない",R9C42:R17C44,2,FALSE),VLOOKUP(R5C8,R9C42:R17C44,2,FALSE)) -> 1 | AR97: =IF(RC40<>"●",VLOOKUP("",R9C42:R17C44,3,FALSE),VLOOKUP(R5C8,R9C42:R17C44,3,FALSE)) -> 0 | AS97: =IF(OR(ISBLANK(R6C7),ISERROR(FIND(R6C7,RC25))),"　","●") ->  | AT97: =IF(OR(ISBLANK(R7C7),ISERROR(FIND(R7C7,RC25))),"　","●") ->  | AU97: =IF(RC45<>"●",VLOOKUP("評価しない",R9C46:R17C48,2,FALSE),VLOOKUP(R6C8,R9C46:R17C48,2,FALSE)) -> 1 | AV97: =IF(RC45<>"●",VLOOKUP("",R9C46:R17C48,3,FALSE),VLOOKUP(R6C8,R9C46:R17C48,3,FALSE)) -> 0 | AW97: =IF(RC46<>"●",VLOOKUP("評価しない",R9C46:R17C48,2,FALSE),VLOOKUP(R7C8,R9C46:R17C48,2,FALSE)) -> 1 | AX97: =IF(RC46<>"●",VLOOKUP("",R9C46:R17C48,3,FALSE),VLOOKUP(R7C8,R9C46:R17C48,3,FALSE)) -> 0 | AY97: =SUM(RC27:RC36) -> 0 | AZ97: =RC37*RC41*RC43*RC47*RC49 -> 1 | BA97: =RC38+RC42+RC44+RC48+RC50 -> 0
A98: =OFFSET(R164C1,INT((RC26-1)/100),MOD(INT((RC26-1)/10),10),1,1)*10+MOD(RC26-1,10)+1 -> 47 | D98: =IF(AND(RC2<>"NG",OR(RC2<>"",RC3<>"",R9C4="×")),"◯","") ->  | E98: =IF(RC2="◯",RC6,"") ->  | F98: =T(OFFSET('[MiracleNikkiJp_items.csv]MiracleNikkiJp_items'!R10C[-3],RC1,0,1,1)) -> ヘアスタイル | G98: =T(OFFSET('[MiracleNikkiJp_items.csv]MiracleNikkiJp_items'!R10C[-2],RC1,0,1,1)) ->  | H98: =IF(RC4="",0,RC51*RC52+RC53) -> 0 | I98: =RC1 -> 47 | J98: =OFFSET('[MiracleNikkiJp_items.csv]MiracleNikkiJp_items'!R10C[-4],RC1,0,1,1) -> 0 | K98: =T(OFFSET('[MiracleNikkiJp_items.csv]MiracleNikkiJp_items'!R10C[-4],RC1,0,1,1)) ->  | L98: =T(OFFSET('[MiracleNikkiJp_items.csv]MiracleNikkiJp_items'!R10C[-4],RC1,0,1,1)) ->  | M98: =T(OFFSET('[MiracleNikkiJp_items.csv]MiracleNikkiJp_items'!R10C[-4],RC1,0,1,1)) ->  | N98: =T(OFFSET('[MiracleNikkiJp_items.csv]MiracleNikkiJp_items'!R10C[-4],RC1,0,1,1)) ->  | O98: =T(OFFSET('[MiracleNikkiJp_items.csv]MiracleNikkiJp_items'!R10C[-4],RC1,0,1,1)) ->  | P98: =T(OFFSET('[MiracleNikkiJp_items.csv]MiracleNikkiJp_items'!R10C[-4],RC1,0,1,1)) ->  | Q98: =T(OFFSET('[MiracleNikkiJp_items.csv]MiracleNikkiJp_items'!R10C[-4],RC1,0,1,1)) ->  | R98: =T(OFFSET('[MiracleNikkiJp_items.csv]MiracleNikkiJp_items'!R10C[-4],RC1,0,1,1)) ->  | S98: =T(OFFSET('[MiracleNikkiJp_items.csv]MiracleNikkiJp_items'!R10C[-4],RC1,0,1,1)) ->  | T98: =T(OFFSET('[MiracleNikkiJp_items.csv]MiracleNikkiJp_items'!R10C[-4],RC1,0,1,1)) ->  | U98: =T(OFFSET('[MiracleNikkiJp_items.csv]MiracleNikkiJp_items'!R10C[-4],RC1,0,1,1)) ->  | Y98: =T(OFFSET('[MiracleNikkiJp_items.csv]MiracleNikkiJp_items'!R10C[-7],RC1,0,1,1)) ->  | Z98: 47 | AA98: =IFERROR(VLOOKUP(RC[-16],R9C26:R17C36,2,FALSE),0)*R6C -> 0 | AB98: =IFERROR(VLOOKUP(RC[-16],R9C26:R17C36,3,FALSE),0)*R6C -> 0 | AC98: =IFERROR(VLOOKUP(RC[-16],R9C26:R17C36,4,FALSE),0)*R6C -> 0 | AD98: =IFERROR(VLOOKUP(RC[-16],R9C26:R17C36,5,FALSE),0)*R6C -> 0 | AE98: =IFERROR(VLOOKUP(RC[-16],R9C26:R17C36,6,FALSE),0)*R6C -> 0 | AF98: =IFERROR(VLOOKUP(RC[-16],R9C26:R17C36,7,FALSE),0)*R6C -> 0 | AG98: =IFERROR(VLOOKUP(RC[-16],R9C26:R17C36,8,FALSE),0)*R6C -> 0 | AH98: =IFERROR(VLOOKUP(RC[-16],R9C26:R17C36,9,FALSE),0)*R6C -> 0 | AI98: =IFERROR(VLOOKUP(RC[-16],R9C26:R17C36,10,FALSE),0)*R6C -> 0 | AJ98: =IFERROR(VLOOKUP(RC[-16],R9C26:R17C36,11,FALSE),0)*R6C -> 0 | AK98: =VLOOKUP(RC10,R9C38:R17C40,2,FALSE) -> 1 | AL98: =VLOOKUP(RC10,R9C38:R17C40,3,FALSE) -> 0 | AM98: =IF(OR(ISBLANK(R4C7),ISERROR(FIND(R4C7,RC21))),"　","●") ->  | AN98: =IF(OR(ISBLANK(R5C7),ISERROR(FIND(R5C7,RC21))),"　","●") ->  | AO98: =IF(RC39<>"●",VLOOKUP("評価しない",R9C42:R17C44,2,FALSE),VLOOKUP(R4C8,R9C42:R17C44,2,FALSE)) -> 1 | AP98: =IF(RC39<>"●",VLOOKUP("",R9C42:R17C44,3,FALSE),VLOOKUP(R4C8,R9C42:R17C44,3,FALSE)) -> 0 | AQ98: =IF(RC40<>"●",VLOOKUP("評価しない",R9C42:R17C44,2,FALSE),VLOOKUP(R5C8,R9C42:R17C44,2,FALSE)) -> 1 | AR98: =IF(RC40<>"●",VLOOKUP("",R9C42:R17C44,3,FALSE),VLOOKUP(R5C8,R9C42:R17C44,3,FALSE)) -> 0 | AS98: =IF(OR(ISBLANK(R6C7),ISERROR(FIND(R6C7,RC25))),"　","●") ->  | AT98: =IF(OR(ISBLANK(R7C7),ISERROR(FIND(R7C7,RC25))),"　","●") ->  | AU98: =IF(RC45<>"●",VLOOKUP("評価しない",R9C46:R17C48,2,FALSE),VLOOKUP(R6C8,R9C46:R17C48,2,FALSE)) -> 1 | AV98: =IF(RC45<>"●",VLOOKUP("",R9C46:R17C48,3,FALSE),VLOOKUP(R6C8,R9C46:R17C48,3,FALSE)) -> 0 | AW98: =IF(RC46<>"●",VLOOKUP("評価しない",R9C46:R17C48,2,FALSE),VLOOKUP(R7C8,R9C46:R17C48,2,FALSE)) -> 1 | AX98: =IF(RC46<>"●",VLOOKUP("",R9C46:R17C48,3,FALSE),VLOOKUP(R7C8,R9C46:R17C48,3,FALSE)) -> 0 | AY98: =SUM(RC27:RC36) -> 0 | AZ98: =RC37*RC41*RC43*RC47*RC49 -> 1 | BA98: =RC38+RC42+RC44+RC48+RC50 -> 0
A99: =OFFSET(R164C1,INT((RC26-1)/100),MOD(INT((RC26-1)/10),10),1,1)*10+MOD(RC26-1,10)+1 -> 48 | D99: =IF(AND(RC2<>"NG",OR(RC2<>"",RC3<>"",R9C4="×")),"◯","") ->  | E99: =IF(RC2="◯",RC6,"") ->  | F99: =T(OFFSET('[MiracleNikkiJp_items.csv]MiracleNikkiJp_items'!R10C[-3],RC1,0,1,1)) -> ヘアスタイル | G99: =T(OFFSET('[MiracleNikkiJp_items.csv]MiracleNikkiJp_items'!R10C[-2],RC1,0,1,1)) ->  | H99: =IF(RC4="",0,RC51*RC52+RC53) -> 0 | I99: =RC1 -> 48 | J99: =OFFSET('[MiracleNikkiJp_items.csv]MiracleNikkiJp_items'!R10C[-4],RC1,0,1,1) -> 0 | K99: =T(OFFSET('[MiracleNikkiJp_items.csv]MiracleNikkiJp_items'!R10C[-4],RC1,0,1,1)) ->  | L99: =T(OFFSET('[MiracleNikkiJp_items.csv]MiracleNikkiJp_items'!R10C[-4],RC1,0,1,1)) ->  | M99: =T(OFFSET('[MiracleNikkiJp_items.csv]MiracleNikkiJp_items'!R10C[-4],RC1,0,1,1)) ->  | N99: =T(OFFSET('[MiracleNikkiJp_items.csv]MiracleNikkiJp_items'!R10C[-4],RC1,0,1,1)) ->  | O99: =T(OFFSET('[MiracleNikkiJp_items.csv]MiracleNikkiJp_items'!R10C[-4],RC1,0,1,1)) ->  | P99: =T(OFFSET('[MiracleNikkiJp_items.csv]MiracleNikkiJp_items'!R10C[-4],RC1,0,1,1)) ->  | Q99: =T(OFFSET('[MiracleNikkiJp_items.csv]MiracleNikkiJp_items'!R10C[-4],RC1,0,1,1)) ->  | R99: =T(OFFSET('[MiracleNikkiJp_items.csv]MiracleNikkiJp_items'!R10C[-4],RC1,0,1,1)) ->  | S99: =T(OFFSET('[MiracleNikkiJp_items.csv]MiracleNikkiJp_items'!R10C[-4],RC1,0,1,1)) ->  | T99: =T(OFFSET('[MiracleNikkiJp_items.csv]MiracleNikkiJp_items'!R10C[-4],RC1,0,1,1)) ->  | U99: =T(OFFSET('[MiracleNikkiJp_items.csv]MiracleNikkiJp_items'!R10C[-4],RC1,0,1,1)) ->  | Y99: =T(OFFSET('[MiracleNikkiJp_items.csv]MiracleNikkiJp_items'!R10C[-7],RC1,0,1,1)) ->  | Z99: 48 | AA99: =IFERROR(VLOOKUP(RC[-16],R9C26:R17C36,2,FALSE),0)*R6C -> 0 | AB99: =IFERROR(VLOOKUP(RC[-16],R9C26:R17C36,3,FALSE),0)*R6C -> 0 | AC99: =IFERROR(VLOOKUP(RC[-16],R9C26:R17C36,4,FALSE),0)*R6C -> 0 | AD99: =IFERROR(VLOOKUP(RC[-16],R9C26:R17C36,5,FALSE),0)*R6C -> 0 | AE99: =IFERROR(VLOOKUP(RC[-16],R9C26:R17C36,6,FALSE),0)*R6C -> 0 | AF99: =IFERROR(VLOOKUP(RC[-16],R9C26:R17C36,7,FALSE),0)*R6C -> 0 | AG99: =IFERROR(VLOOKUP(RC[-16],R9C26:R17C36,8,FALSE),0)*R6C -> 0 | AH99: =IFERROR(VLOOKUP(RC[-16],R9C26:R17C36,9,FALSE),0)*R6C -> 0 | AI99: =IFERROR(VLOOKUP(RC[-16],R9C26:R17C36,10,FALSE),0)*R6C -> 0 | AJ99: =IFERROR(VLOOKUP(RC[-16],R9C26:R17C36,11,FALSE),0)*R6C -> 0 | AK99: =VLOOKUP(RC10,R9C38:R17C40,2,FALSE) -> 1 | AL99: =VLOOKUP(RC10,R9C38:R17C40,3,FALSE) -> 0 | AM99: =IF(OR(ISBLANK(R4C7),ISERROR(FIND(R4C7,RC21))),"　","●") ->  | AN99: =IF(OR(ISBLANK(R5C7),ISERROR(FIND(R5C7,RC21))),"　","●") ->  | AO99: =IF(RC39<>"●",VLOOKUP("評価しない",R9C42:R17C44,2,FALSE),VLOOKUP(R4C8,R9C42:R17C44,2,FALSE)) -> 1 | AP99: =IF(RC39<>"●",VLOOKUP("",R9C42:R17C44,3,FALSE),VLOOKUP(R4C8,R9C42:R17C44,3,FALSE)) -> 0 | AQ99: =IF(RC40<>"●",VLOOKUP("評価しない",R9C42:R17C44,2,FALSE),VLOOKUP(R5C8,R9C42:R17C44,2,FALSE)) -> 1 | AR99: =IF(RC40<>"●",VLOOKUP("",R9C42:R17C44,3,FALSE),VLOOKUP(R5C8,R9C42:R17C44,3,FALSE)) -> 0 | AS99: =IF(OR(ISBLANK(R6C7),ISERROR(FIND(R6C7,RC25))),"　","●") ->  | AT99: =IF(OR(ISBLANK(R7C7),ISERROR(FIND(R7C7,RC25))),"　","●") ->  | AU99: =IF(RC45<>"●",VLOOKUP("評価しない",R9C46:R17C48,2,FALSE),VLOOKUP(R6C8,R9C46:R17C48,2,FALSE)) -> 1 | AV99: =IF(RC45<>"●",VLOOKUP("",R9C46:R17C48,3,FALSE),VLOOKUP(R6C8,R9C46:R17C48,3,FALSE)) -> 0 | AW99: =IF(RC46<>"●",VLOOKUP("評価しない",R9C46:R17C48,2,FALSE),VLOOKUP(R7C8,R9C46:R17C48,2,FALSE)) -> 1 | AX99: =IF(RC46<>"●",VLOOKUP("",R9C46:R17C48,3,FALSE),VLOOKUP(R7C8,R9C46:R17C48,3,FALSE)) -> 0 | AY99: =SUM(RC27:RC36) -> 0 | AZ99: =RC37*RC41*RC43*RC47*RC49 -> 1 | BA99: =RC38+RC42+RC44+RC48+RC50 -> 0
A100: =OFFSET(R164C1,INT((RC26-1)/100),MOD(INT((RC26-1)/10),10),1,1)*10+MOD(RC26-1,10)+1 -> 49 | D100: =IF(AND(RC2<>"NG",OR(RC2<>"",RC3<>"",R9C4="×")),"◯","") ->  | E100: =IF(RC2="◯",RC6,"") ->  | F100: =T(OFFSET('[MiracleNikkiJp_items.csv]MiracleNikkiJp_items'!R10C[-3],RC1,0,1,1)) -> ヘアスタイル | G100: =T(OFFSET('[MiracleNikkiJp_items.csv]MiracleNikkiJp_items'!R10C[-2],RC1,0,1,1)) ->  | H100: =IF(RC4="",0,RC51*RC52+RC53) -> 0 | I100: =RC1 -> 49 | J100: =OFFSET('[MiracleNikkiJp_items.csv]MiracleNikkiJp_items'!R10C[-4],RC1,0,1,1) -> 0 | K100: =T(OFFSET('[MiracleNikkiJp_items.csv]MiracleNikkiJp_items'!R10C[-4],RC1,0,1,1)) ->  | L100: =T(OFFSET('[MiracleNikkiJp_items.csv]MiracleNikkiJp_items'!R10C[-4],RC1,0,1,1)) ->  | M100: =T(OFFSET('[MiracleNikkiJp_items.csv]MiracleNikkiJp_items'!R10C[-4],RC1,0,1,1)) ->  | N100: =T(OFFSET('[MiracleNikkiJp_items.csv]MiracleNikkiJp_items'!R10C[-4],RC1,0,1,1)) ->  | O100: =T(OFFSET('[MiracleNikkiJp_items.csv]MiracleNikkiJp_items'!R10C[-4],RC1,0,1,1)) ->  | P100: =T(OFFSET('[MiracleNikkiJp_items.csv]MiracleNikkiJp_items'!R10C[-4],RC1,0,1,1)) ->  | Q100: =T(OFFSET('[MiracleNikkiJp_items.csv]MiracleNikkiJp_items'!R10C[-4],RC1,0,1,1)) ->  | R100: =T(OFFSET('[MiracleNikkiJp_items.csv]MiracleNikkiJp_items'!R10C[-4],RC1,0,1,1)) ->  | S100: =T(OFFSET('[MiracleNikkiJp_items.csv]MiracleNikkiJp_items'!R10C[-4],RC1,0,1,1)) ->  | T100: =T(OFFSET('[MiracleNikkiJp_items.csv]MiracleNikkiJp_items'!R10C[-4],RC1,0,1,1)) ->  | U100: =T(OFFSET('[MiracleNikkiJp_items.csv]MiracleNikkiJp_items'!R10C[-4],RC1,0,1,1)) ->  | Y100: =T(OFFSET('[MiracleNikkiJp_items.csv]MiracleNikkiJp_items'!R10C[-7],RC1,0,1,1)) ->  | Z100: 49 | AA100: =IFERROR(VLOOKUP(RC[-16],R9C26:R17C36,2,FALSE),0)*R6C -> 0 | AB100: =IFERROR(VLOOKUP(RC[-16],R9C26:R17C36,3,FALSE),0)*R6C -> 0 | AC100: =IFERROR(VLOOKUP(RC[-16],R9C26:R17C36,4,FALSE),0)*R6C -> 0 | AD100: =IFERROR(VLOOKUP(RC[-16],R9C26:R17C36,5,FALSE),0)*R6C -> 0 | AE100: =IFERROR(VLOOKUP(RC[-16],R9C26:R17C36,6,FALSE),0)*R6C -> 0 | AF100: =IFERROR(VLOOKUP(RC[-16],R9C26:R17C36,7,FALSE),0)*R6C -> 0 | AG100: =IFERROR(VLOOKUP(RC[-16],R9C26:R17C36,8,FALSE),0)*R6C -> 0 | AH100: =IFERROR(VLOOKUP(RC[-16],R9C26:R17C36,9,FALSE),0)*R6C -> 0 | AI100: =IFERROR(VLOOKUP(RC[-16],R9C26:R17C36,10,FALSE),0)*R6C -> 0 | AJ100: =IFERROR(VLOOKUP(RC[-16],R9C26:R17C36,11,FALSE),0)*R6C -> 0 | AK100: =VLOOKUP(RC10,R9C38:R17C40,2,FALSE) -> 1 | AL100: =VLOOKUP(RC10,R9C38:R17C40,3,FALSE) -> 0 | AM100: =IF(OR(ISBLANK(R4C7),ISERROR(FIND(R4C7,RC21))),"　","●") ->  | AN100: =IF(OR(ISBLANK(R5C7),ISERROR(FIND(R5C7,RC21))),"　","●") ->  | AO100: =IF(RC39<>"●",VLOOKUP("評価しない",R9C42:R17C44,2,FALSE),VLOOKUP(R4C8,R9C42:R17C44,2,FALSE)) -> 1 | AP100: =IF(RC39<>"●",VLOOKUP("",R9C42:R17C44,3,FALSE),VLOOKUP(R4C8,R9C42:R17C44,3,FALSE)) -> 0 | AQ100: =IF(RC40<>"●",VLOOKUP("評価しない",R9C42:R17C44,2,FALSE),VLOOKUP(R5C8,R9C42:R17C44,2,FALSE)) -> 1 | AR100: =IF(RC40<>"●",VLOOKUP("",R9C42:R17C44,3,FALSE),VLOOKUP(R5C8,R9C42:R17C44,3,FALSE)) -> 0 | AS100: =IF(OR(ISBLANK(R6C7),ISERROR(FIND(R6C7,RC25))),"　","●") ->  | AT100: =IF(OR(ISBLANK(R7C7),ISERROR(FIND(R7C7,RC25))),"　","●") ->  | AU100: =IF(RC45<>"●",VLOOKUP("評価しない",R9C46:R17C48,2,FALSE),VLOOKUP(R6C8,R9C46:R17C48,2,FALSE)) -> 1 | AV100: =IF(RC45<>"●",VLOOKUP("",R9C46:R17C48,3,FALSE),VLOOKUP(R6C8,R9C46:R17C48,3,FALSE)) -> 0 | AW100: =IF(RC46<>"●",VLOOKUP("評価しない",R9C46:R17C48,2,FALSE),VLOOKUP(R7C8,R9C46:R17C48,2,FALSE)) -> 1 | AX100: =IF(RC46<>"●",VLOOKUP("",R9C46:R17C48,3,FALSE),VLOOKUP(R7C8,R9C46:R17C48,3,FALSE)) -> 0 | AY100: =SUM(RC27:RC36) -> 0 | AZ100: =RC37*RC41*RC43*RC47*RC49 -> 1 | BA100: =RC38+RC42+RC44+RC48+RC50 -> 0
A101: =OFFSET(R164C1,INT((RC26-1)/100),MOD(INT((RC26-1)/10),10),1,1)*10+MOD(RC26-1,10)+1 -> 50 | D101: =IF(AND(RC2<>"NG",OR(RC2<>"",RC3<>"",R9C4="×")),"◯","") ->  | E101: =IF(RC2="◯",RC6,"") ->  | F101: =T(OFFSET('[MiracleNikkiJp_items.csv]MiracleNikkiJp_items'!R10C[-3],RC1,0,1,1)) -> ヘアスタイル | G101: =T(OFFSET('[MiracleNikkiJp_items.csv]MiracleNikkiJp_items'!R10C[-2],RC1,0,1,1)) ->  | H101: =IF(RC4="",0,RC51*RC52+RC53) -> 0 | I101: =RC1 -> 50 | J101: =OFFSET('[MiracleNikkiJp_items.csv]MiracleNikkiJp_items'!R10C[-4],RC1,0,1,1) -> 0 | K101: =T(OFFSET('[MiracleNikkiJp_items.csv]MiracleNikkiJp_items'!R10C[-4],RC1,0,1,1)) ->  | L101: =T(OFFSET('[MiracleNikkiJp_items.csv]MiracleNikkiJp_items'!R10C[-4],RC1,0,1,1)) ->  | M101: =T(OFFSET('[MiracleNikkiJp_items.csv]MiracleNikkiJp_items'!R10C[-4],RC1,0,1,1)) ->  | N101: =T(OFFSET('[MiracleNikkiJp_items.csv]MiracleNikkiJp_items'!R10C[-4],RC1,0,1,1)) ->  | O101: =T(OFFSET('[MiracleNikkiJp_items.csv]MiracleNikkiJp_items'!R10C[-4],RC1,0,1,1)) ->  | P101: =T(OFFSET('[MiracleNikkiJp_items.csv]MiracleNikkiJp_items'!R10C[-4],RC1,0,1,1)) ->  | Q101: =T(OFFSET('[MiracleNikkiJp_items.csv]MiracleNikkiJp_items'!R10C[-4],RC1,0,1,1)) ->  | R101: =T(OFFSET('[MiracleNikkiJp_items.csv]MiracleNikkiJp_items'!R10C[-4],RC1,0,1,1)) ->  | S101: =T(OFFSET('[MiracleNikkiJp_items.csv]MiracleNikkiJp_items'!R10C[-4],RC1,0,1,1)) ->  | T101: =T(OFFSET('[MiracleNikkiJp_items.csv]MiracleNikkiJp_items'!R10C[-4],RC1,0,1,1)) ->  | U101: =T(OFFSET('[MiracleNikkiJp_items.csv]MiracleNikkiJp_items'!R10C[-4],RC1,0,1,1)) ->  | Y101: =T(OFFSET('[MiracleNikkiJp_items.csv]MiracleNikkiJp_items'!R10C[-7],RC1,0,1,1)) ->  | Z101: 50 | AA101: =IFERROR(VLOOKUP(RC[-16],R9C26:R17C36,2,FALSE),0)*R6C -> 0 | AB101: =IFERROR(VLOOKUP(RC[-16],R9C26:R17C36,3,FALSE),0)*R6C -> 0 | AC101: =IFERROR(VLOOKUP(RC[-16],R9C26:R17C36,4,FALSE),0)*R6C -> 0 | AD101: =IFERROR(VLOOKUP(RC[-16],R9C26:R17C36,5,FALSE),0)*R6C -> 0 | AE101: =IFERROR(VLOOKUP(RC[-16],R9C26:R17C36,6,FALSE),0)*R6C -> 0 | AF101: =IFERROR(VLOOKUP(RC[-16],R9C26:R17C36,7,FALSE),0)*R6C -> 0 | AG101: =IFERROR(VLOOKUP(RC[-16],R9C26:R17C36,8,FALSE),0)*R6C -> 0 | AH101: =IFERROR(VLOOKUP(RC[-16],R9C26:R17C36,9,FALSE),0)*R6C -> 0 | AI101: =IFERROR(VLOOKUP(RC[-16],R9C26:R17C36,10,FALSE),0)*R6C -> 0 | AJ101: =IFERROR(VLOOKUP(RC[-16],R9C26:R17C36,11,FALSE),0)*R6C -> 0 | AK101: =VLOOKUP(RC10,R9C38:R17C40,2,FALSE) -> 1 | AL101: =VLOOKUP(RC10,R9C38:R17C40,3,FALSE) -> 0 | AM101: =IF(OR(ISBLANK(R4C7),ISERROR(FIND(R4C7,RC21))),"　","●") ->  | AN101: =IF(OR(ISBLANK(R5C7),ISERROR(FIND(R5C7,RC21))),"　","●") ->  | AO101: =IF(RC39<>"●",VLOOKUP("評価しない",R9C42:R17C44,2,FALSE),VLOOKUP(R4C8,R9C42:R17C44,2,FALSE)) -> 1 | AP101: =IF(RC39<>"●",VLOOKUP("",R9C42:R17C44,3,FALSE),VLOOKUP(R4C8,R9C42:R17C44,3,FALSE)) -> 0 | AQ101: =IF(RC40<>"●",VLOOKUP("評価しない",R9C42:R17C44,2,FALSE),VLOOKUP(R5C8,R9C42:R17C44,2,FALSE)) -> 1 | AR101: =IF(RC40<>"●",VLOOKUP("",R9C42:R17C44,3,FALSE),VLOOKUP(R5C8,R9C42:R17C44,3,FALSE)) -> 0 | AS101: =IF(OR(ISBLANK(R6C7),ISERROR(FIND(R6C7,RC25))),"　","●") ->  | AT101: =IF(OR(ISBLANK(R7C7),ISERROR(FIND(R7C7,RC25))),"　","●") ->  | AU101: =IF(RC45<>"●",VLOOKUP("評価しない",R9C46:R17C48,2,FALSE),VLOOKUP(R6C8,R9C46:R17C48,2,FALSE)) -> 1 | AV101: =IF(RC45<>"●",VLOOKUP("",R9C46:R17C48,3,FALSE),VLOOKUP(R6C8,R9C46:R17C48,3,FALSE)) -> 0 | AW101: =IF(RC46<>"●",VLOOKUP("評価しない",R9C46:R17C48,2,FALSE),VLOOKUP(R7C8,R9C46:R17C48,2,FALSE)) -> 1 | AX101: =IF(RC46<>"●",VLOOKUP("",R9C46:R17C48,3,FALSE),VLOOKUP(R7C8,R9C46:R17C48,3,FALSE)) -> 0 | AY101: =SUM(RC27:RC36) -> 0 | AZ101: =RC37*RC41*RC43*RC47*RC49 -> 1 | BA101: =RC38+RC42+RC44+RC48+RC50 -> 0
A102: =OFFSET(R164C1,INT((RC26-1)/100),MOD(INT((RC26-1)/10),10),1,1)*10+MOD(RC26-1,10)+1 -> 51 | D102: =IF(AND(RC2<>"NG",OR(RC2<>"",RC3<>"",R9C4="×")),"◯","") ->  | E102: =IF(RC2="◯",RC6,"") ->  | F102: =T(OFFSET('[MiracleNikkiJp_items.csv]MiracleNikkiJp_items'!R10C[-3],RC1,0,1,1)) -> ヘアスタイル | G102: =T(OFFSET('[MiracleNikkiJp_items.csv]MiracleNikkiJp_items'!R10C[-2],RC1,0,1,1)) ->  | H102: =IF(RC4="",0,RC51*RC52+RC53) -> 0 | I102: =RC1 -> 51 | J102: =OFFSET('[MiracleNikkiJp_items.csv]MiracleNikkiJp_items'!R10C[-4],RC1,0,1,1) -> 0 | K102: =T(OFFSET('[MiracleNikkiJp_items.csv]MiracleNikkiJp_items'!R10C[-4],RC1,0,1,1)) ->  | L102: =T(OFFSET('[MiracleNikkiJp_items.csv]MiracleNikkiJp_items'!R10C[-4],RC1,0,1,1)) ->  | M102: =T(OFFSET('[MiracleNikkiJp_items.csv]MiracleNikkiJp_items'!R10C[-4],RC1,0,1,1)) ->  | N102: =T(OFFSET('[MiracleNikkiJp_items.csv]MiracleNikkiJp_items'!R10C[-4],RC1,0,1,1)) ->  | O102: =T(OFFSET('[MiracleNikkiJp_items.csv]MiracleNikkiJp_items'!R10C[-4],RC1,0,1,1)) ->  | P102: =T(OFFSET('[MiracleNikkiJp_items.csv]MiracleNikkiJp_items'!R10C[-4],RC1,0,1,1)) ->  | Q102: =T(OFFSET('[MiracleNikkiJp_items.csv]MiracleNikkiJp_items'!R10C[-4],RC1,0,1,1)) ->  | R102: =T(OFFSET('[MiracleNikkiJp_items.csv]MiracleNikkiJp_items'!R10C[-4],RC1,0,1,1)) ->  | S102: =T(OFFSET('[MiracleNikkiJp_items.csv]MiracleNikkiJp_items'!R10C[-4],RC1,0,1,1)) ->  | T102: =T(OFFSET('[MiracleNikkiJp_items.csv]MiracleNikkiJp_items'!R10C[-4],RC1,0,1,1)) ->  | U102: =T(OFFSET('[MiracleNikkiJp_items.csv]MiracleNikkiJp_items'!R10C[-4],RC1,0,1,1)) ->  | Y102: =T(OFFSET('[MiracleNikkiJp_items.csv]MiracleNikkiJp_items'!R10C[-7],RC1,0,1,1)) ->  | Z102: 51 | AA102: =IFERROR(VLOOKUP(RC[-16],R9C26:R17C36,2,FALSE),0)*R6C -> 0 | AB102: =IFERROR(VLOOKUP(RC[-16],R9C26:R17C36,3,FALSE),0)*R6C -> 0 | AC102: =IFERROR(VLOOKUP(RC[-16],R9C26:R17C36,4,FALSE),0)*R6C -> 0 | AD102: =IFERROR(VLOOKUP(RC[-16],R9C26:R17C36,5,FALSE),0)*R6C -> 0 | AE102: =IFERROR(VLOOKUP(RC[-16],R9C26:R17C36,6,FALSE),0)*R6C -> 0 | AF102: =IFERROR(VLOOKUP(RC[-16],R9C26:R17C36,7,FALSE),0)*R6C -> 0 | AG102: =IFERROR(VLOOKUP(RC[-16],R9C26:R17C36,8,FALSE),0)*R6C -> 0 | AH102: =IFERROR(VLOOKUP(RC[-16],R9C26:R17C36,9,FALSE),0)*R6C -> 0 | AI102: =IFERROR(VLOOKUP(RC[-16],R9C26:R17C36,10,FALSE),0)*R6C -> 0 | AJ102: =IFERROR(VLOOKUP(RC[-16],R9C26:R17C36,11,FALSE),0)*R6C -> 0 | AK102: =VLOOKUP(RC10,R9C38:R17C40,2,FALSE) -> 1 | AL102: =VLOOKUP(RC10,R9C38:R17C40,3,FALSE) -> 0 | AM102: =IF(OR(ISBLANK(R4C7),ISERROR(FIND(R4C7,RC21))),"　","●") ->  | AN102: =IF(OR(ISBLANK(R5C7),ISERROR(FIND(R5C7,RC21))),"　","●") ->  | AO102: =IF(RC39<>"●",VLOOKUP("評価しない",R9C42:R17C44,2,FALSE),VLOOKUP(R4C8,R9C42:R17C44,2,FALSE)) -> 1 | AP102: =IF(RC39<>"●",VLOOKUP("",R9C42:R17C44,3,FALSE),VLOOKUP(R4C8,R9C42:R17C44,3,FALSE)) -> 0 | AQ102: =IF(RC40<>"●",VLOOKUP("評価しない",R9C42:R17C44,2,FALSE),VLOOKUP(R5C8,R9C42:R17C44,2,FALSE)) -> 1 | AR102: =IF(RC40<>"●",VLOOKUP("",R9C42:R17C44,3,FALSE),VLOOKUP(R5C8,R9C42:R17C44,3,FALSE)) -> 0 | AS102: =IF(OR(ISBLANK(R6C7),ISERROR(FIND(R6C7,RC25))),"　","●") ->  | AT102: =IF(OR(ISBLANK(R7C7),ISERROR(FIND(R7C7,RC25))),"　","●") ->  | AU102: =IF(RC45<>"●",VLOOKUP("評価しない",R9C46:R17C48,2,FALSE),VLOOKUP(R6C8,R9C46:R17C48,2,FALSE)) -> 1 | AV102: =IF(RC45<>"●",VLOOKUP("",R9C46:R17C48,3,FALSE),VLOOKUP(R6C8,R9C46:R17C48,3,FALSE)) -> 0 | AW102: =IF(RC46<>"●",VLOOKUP("評価しない",R9C46:R17C48,2,FALSE),VLOOKUP(R7C8,R9C46:R17C48,2,FALSE)) -> 1 | AX102: =IF(RC46<>"●",VLOOKUP("",R9C46:R17C48,3,FALSE),VLOOKUP(R7C8,R9C46:R17C48,3,FALSE)) -> 0 | AY102: =SUM(RC27:RC36) -> 0 | AZ102: =RC37*RC41*RC43*RC47*RC49 -> 1 | BA102: =RC38+RC42+RC44+RC48+RC50 -> 0
A103: =OFFSET(R164C1,INT((RC26-1)/100),MOD(INT((RC26-1)/10),10),1,1)*10+MOD(RC26-1,10)+1 -> 52 | D103: =IF(AND(RC2<>"NG",OR(RC2<>"",RC3<>"",R9C4="×")),"◯","") ->  | E103: =IF(RC2="◯",RC6,"") ->  | F103: =T(OFFSET('[MiracleNikkiJp_items.csv]MiracleNikkiJp_items'!R10C[-3],RC1,0,1,1)) -> ヘアスタイル | G103: =T(OFFSET('[MiracleNikkiJp_items.csv]MiracleNikkiJp_items'!R10C[-2],RC1,0,1,1)) ->  | H103: =IF(RC4="",0,RC51*RC52+RC53) -> 0 | I103: =RC1 -> 52 | J103: =OFFSET('[MiracleNikkiJp_items.csv]MiracleNikkiJp_items'!R10C[-4],RC1,0,1,1) -> 0 | K103: =T(OFFSET('[MiracleNikkiJp_items.csv]MiracleNikkiJp_items'!R10C[-4],RC1,0,1,1)) ->  | L103: =T(OFFSET('[MiracleNikkiJp_items.csv]MiracleNikkiJp_items'!R10C[-4],RC1,0,1,1)) ->  | M103: =T(OFFSET('[MiracleNikkiJp_items.csv]MiracleNikkiJp_items'!R10C[-4],RC1,0,1,1)) ->  | N103: =T(OFFSET('[MiracleNikkiJp_items.csv]MiracleNikkiJp_items'!R10C[-4],RC1,0,1,1)) ->  | O103: =T(OFFSET('[MiracleNikkiJp_items.csv]MiracleNikkiJp_items'!R10C[-4],RC1,0,1,1)) ->  | P103: =T(OFFSET('[MiracleNikkiJp_items.csv]MiracleNikkiJp_items'!R10C[-4],RC1,0,1,1)) ->  | Q103: =T(OFFSET('[MiracleNikkiJp_items.csv]MiracleNikkiJp_items'!R10C[-4],RC1,0,1,1)) ->  | R103: =T(OFFSET('[MiracleNikkiJp_items.csv]MiracleNikkiJp_items'!R10C[-4],RC1,0,1,1)) ->  | S103: =T(OFFSET('[MiracleNikkiJp_items.csv]MiracleNikkiJp_items'!R10C[-4],RC1,0,1,1)) ->  | T103: =T(OFFSET('[MiracleNikkiJp_items.csv]MiracleNikkiJp_items'!R10C[-4],RC1,0,1,1)) ->  | U103: =T(OFFSET('[MiracleNikkiJp_items.csv]MiracleNikkiJp_items'!R10C[-4],RC1,0,1,1)) ->  | Y103: =T(OFFSET('[MiracleNikkiJp_items.csv]MiracleNikkiJp_items'!R10C[-7],RC1,0,1,1)) ->  | Z103: 52 | AA103: =IFERROR(VLOOKUP(RC[-16],R9C26:R17C36,2,FALSE),0)*R6C -> 0 | AB103: =IFERROR(VLOOKUP(RC[-16],R9C26:R17C36,3,FALSE),0)*R6C -> 0 | AC103: =IFERROR(VLOOKUP(RC[-16],R9C26:R17C36,4,FALSE),0)*R6C -> 0 | AD103: =IFERROR(VLOOKUP(RC[-16],R9C26:R17C36,5,FALSE),0)*R6C -> 0 | AE103: =IFERROR(VLOOKUP(RC[-16],R9C26:R17C36,6,FALSE),0)*R6C -> 0 | AF103: =IFERROR(VLOOKUP(RC[-16],R9C26:R17C36,7,FALSE),0)*R6C -> 0 | AG103: =IFERROR(VLOOKUP(RC[-16],R9C26:R17C36,8,FALSE),0)*R6C -> 0 | AH103: =IFERROR(VLOOKUP(RC[-16],R9C26:R17C36,9,FALSE),0)*R6C -> 0 | AI103: =IFERROR(VLOOKUP(RC[-16],R9C26:R17C36,10,FALSE),0)*R6C -> 0 | AJ103: =IFERROR(VLOOKUP(RC[-16],R9C26:R17C36,11,FALSE),0)*R6C -> 0 | AK103: =VLOOKUP(RC10,R9C38:R17C40,2,FALSE) -> 1 | AL103: =VLOOKUP(RC10,R9C38:R17C40,3,FALSE) -> 0 | AM103: =IF(OR(ISBLANK(R4C7),ISERROR(FIND(R4C7,RC21))),"　","●") ->  | AN103: =IF(OR(ISBLANK(R5C7),ISERROR(FIND(R5C7,RC21))),"　","●") ->  | AO103: =IF(RC39<>"●",VLOOKUP("評価しない",R9C42:R17C44,2,FALSE),VLOOKUP(R4C8,R9C42:R17C44,2,FALSE)) -> 1 | AP103: =IF(RC39<>"●",VLOOKUP("",R9C42:R17C44,3,FALSE),VLOOKUP(R4C8,R9C42:R17C44,3,FALSE)) -> 0 | AQ103: =IF(RC40<>"●",VLOOKUP("評価しない",R9C42:R17C44,2,FALSE),VLOOKUP(R5C8,R9C42:R17C44,2,FALSE)) -> 1 | AR103: =IF(RC40<>"●",VLOOKUP("",R9C42:R17C44,3,FALSE),VLOOKUP(R5C8,R9C42:R17C44,3,FALSE)) -> 0 | AS103: =IF(OR(ISBLANK(R6C7),ISERROR(FIND(R6C7,RC25))),"　","●") ->  | AT103: =IF(OR(ISBLANK(R7C7),ISERROR(FIND(R7C7,RC25))),"　","●") ->  | AU103: =IF(RC45<>"●",VLOOKUP("評価しない",R9C46:R17C48,2,FALSE),VLOOKUP(R6C8,R9C46:R17C48,2,FALSE)) -> 1 | AV103: =IF(RC45<>"●",VLOOKUP("",R9C46:R17C48,3,FALSE),VLOOKUP(R6C8,R9C46:R17C48,3,FALSE)) -> 0 | AW103: =IF(RC46<>"●",VLOOKUP("評価しない",R9C46:R17C48,2,FALSE),VLOOKUP(R7C8,R9C46:R17C48,2,FALSE)) -> 1 | AX103: =IF(RC46<>"●",VLOOKUP("",R9C46:R17C48,3,FALSE),VLOOKUP(R7C8,R9C46:R17C48,3,FALSE)) -> 0 | AY103: =SUM(RC27:RC36) -> 0 | AZ103: =RC37*RC41*RC43*RC47*RC49 -> 1 | BA103: =RC38+RC42+RC44+RC48+RC50 -> 0
A104: =OFFSET(R164C1,INT((RC26-1)/100),MOD(INT((RC26-1)/10),10),1,1)*10+MOD(RC26-1,10)+1 -> 53 | D104: =IF(AND(RC2<>"NG",OR(RC2<>"",RC3<>"",R9C4="×")),"◯","") ->  | E104: =IF(RC2="◯",RC6,"") ->  | F104: =T(OFFSET('[MiracleNikkiJp_items.csv]MiracleNikkiJp_items'!R10C[-3],RC1,0,1,1)) -> ヘアスタイル | G104: =T(OFFSET('[MiracleNikkiJp_items.csv]MiracleNikkiJp_items'!R10C[-2],RC1,0,1,1)) ->  | H104: =IF(RC4="",0,RC51*RC52+RC53) -> 0 | I104: =RC1 -> 53 | J104: =OFFSET('[MiracleNikkiJp_items.csv]MiracleNikkiJp_items'!R10C[-4],RC1,0,1,1) -> 0 | K104: =T(OFFSET('[MiracleNikkiJp_items.csv]MiracleNikkiJp_items'!R10C[-4],RC1,0,1,1)) ->  | L104: =T(OFFSET('[MiracleNikkiJp_items.csv]MiracleNikkiJp_items'!R10C[-4],RC1,0,1,1)) ->  | M104: =T(OFFSET('[MiracleNikkiJp_items.csv]MiracleNikkiJp_items'!R10C[-4],RC1,0,1,1)) ->  | N104: =T(OFFSET('[MiracleNikkiJp_items.csv]MiracleNikkiJp_items'!R10C[-4],RC1,0,1,1)) ->  | O104: =T(OFFSET('[MiracleNikkiJp_items.csv]MiracleNikkiJp_items'!R10C[-4],RC1,0,1,1)) ->  | P104: =T(OFFSET('[MiracleNikkiJp_items.csv]MiracleNikkiJp_items'!R10C[-4],RC1,0,1,1)) ->  | Q104: =T(OFFSET('[MiracleNikkiJp_items.csv]MiracleNikkiJp_items'!R10C[-4],RC1,0,1,1)) ->  | R104: =T(OFFSET('[MiracleNikkiJp_items.csv]MiracleNikkiJp_items'!R10C[-4],RC1,0,1,1)) ->  | S104: =T(OFFSET('[MiracleNikkiJp_items.csv]MiracleNikkiJp_items'!R10C[-4],RC1,0,1,1)) ->  | T104: =T(OFFSET('[MiracleNikkiJp_items.csv]MiracleNikkiJp_items'!R10C[-4],RC1,0,1,1)) ->  | U104: =T(OFFSET('[MiracleNikkiJp_items.csv]MiracleNikkiJp_items'!R10C[-4],RC1,0,1,1)) ->  | Y104: =T(OFFSET('[MiracleNikkiJp_items.csv]MiracleNikkiJp_items'!R10C[-7],RC1,0,1,1)) ->  | Z104: 53 | AA104: =IFERROR(VLOOKUP(RC[-16],R9C26:R17C36,2,FALSE),0)*R6C -> 0 | AB104: =IFERROR(VLOOKUP(RC[-16],R9C26:R17C36,3,FALSE),0)*R6C -> 0 | AC104: =IFERROR(VLOOKUP(RC[-16],R9C26:R17C36,4,FALSE),0)*R6C -> 0 | AD104: =IFERROR(VLOOKUP(RC[-16],R9C26:R17C36,5,FALSE),0)*R6C -> 0 | AE104: =IFERROR(VLOOKUP(RC[-16],R9C26:R17C36,6,FALSE),0)*R6C -> 0 | AF104: =IFERROR(VLOOKUP(RC[-16],R9C26:R17C36,7,FALSE),0)*R6C -> 0 | AG104: =IFERROR(VLOOKUP(RC[-16],R9C26:R17C36,8,FALSE),0)*R6C -> 0 | AH104: =IFERROR(VLOOKUP(RC[-16],R9C26:R17C36,9,FALSE),0)*R6C -> 0 | AI104: =IFERROR(VLOOKUP(RC[-16],R9C26:R17C36,10,FALSE),0)*R6C -> 0 | AJ104: =IFERROR(VLOOKUP(RC[-16],R9C26:R17C36,11,FALSE),0)*R6C -> 0 | AK104: =VLOOKUP(RC10,R9C38:R17C40,2,FALSE) -> 1 | AL104: =VLOOKUP(RC10,R9C38:R17C40,3,FALSE) -> 0 | AM104: =IF(OR(ISBLANK(R4C7),ISERROR(FIND(R4C7,RC21))),"　","●") ->  | AN104: =IF(OR(ISBLANK(R5C7),ISERROR(FIND(R5C7,RC21))),"　","●") ->  | AO104: =IF(RC39<>"●",VLOOKUP("評価しない",R9C42:R17C44,2,FALSE),VLOOKUP(R4C8,R9C42:R17C44,2,FALSE)) -> 1 | AP104: =IF(RC39<>"●",VLOOKUP("",R9C42:R17C44,3,FALSE),VLOOKUP(R4C8,R9C42:R17C44,3,FALSE)) -> 0 | AQ104: =IF(RC40<>"●",VLOOKUP("評価しない",R9C42:R17C44,2,FALSE),VLOOKUP(R5C8,R9C42:R17C44,2,FALSE)) -> 1 | AR104: =IF(RC40<>"●",VLOOKUP("",R9C42:R17C44,3,FALSE),VLOOKUP(R5C8,R9C42:R17C44,3,FALSE)) -> 0 | AS104: =IF(OR(ISBLANK(R6C7),ISERROR(FIND(R6C7,RC25))),"　","●") ->  | AT104: =IF(OR(ISBLANK(R7C7),ISERROR(FIND(R7C7,RC25))),"　","●") ->  | AU104: =IF(RC45<>"●",VLOOKUP("評価しない",R9C46:R17C48,2,FALSE),VLOOKUP(R6C8,R9C46:R17C48,2,FALSE)) -> 1 | AV104: =IF(RC45<>"●",VLOOKUP("",R9C46:R17C48,3,FALSE),VLOOKUP(R6C8,R9C46:R17C48,3,FALSE)) -> 0 | AW104: =IF(RC46<>"●",VLOOKUP("評価しない",R9C46:R17C48,2,FALSE),VLOOKUP(R7C8,R9C46:R17C48,2,FALSE)) -> 1 | AX104: =IF(RC46<>"●",VLOOKUP("",R9C46:R17C48,3,FALSE),VLOOKUP(R7C8,R9C46:R17C48,3,FALSE)) -> 0 | AY104: =SUM(RC27:RC36) -> 0 | AZ104: =RC37*RC41*RC43*RC47*RC49 -> 1 | BA104: =RC38+RC42+RC44+RC48+RC50 -> 0
A105: =OFFSET(R164C1,INT((RC26-1)/100),MOD(INT((RC26-1)/10),10),1,1)*10+MOD(RC26-1,10)+1 -> 54 | D105: =IF(AND(RC2<>"NG",OR(RC2<>"",RC3<>"",R9C4="×")),"◯","") ->  | E105: =IF(RC2="◯",RC6,"") ->  | F105: =T(OFFSET('[MiracleNikkiJp_items.csv]MiracleNikkiJp_items'!R10C[-3],RC1,0,1,1)) -> ヘアスタイル | G105: =T(OFFSET('[MiracleNikkiJp_items.csv]MiracleNikkiJp_items'!R10C[-2],RC1,0,1,1)) ->  | H105: =IF(RC4="",0,RC51*RC52+RC53) -> 0 | I105: =RC1 -> 54 | J105: =OFFSET('[MiracleNikkiJp_items.csv]MiracleNikkiJp_items'!R10C[-4],RC1,0,1,1) -> 0 | K105: =T(OFFSET('[MiracleNikkiJp_items.csv]MiracleNikkiJp_items'!R10C[-4],RC1,0,1,1)) ->  | L105: =T(OFFSET('[MiracleNikkiJp_items.csv]MiracleNikkiJp_items'!R10C[-4],RC1,0,1,1)) ->  | M105: =T(OFFSET('[MiracleNikkiJp_items.csv]MiracleNikkiJp_items'!R10C[-4],RC1,0,1,1)) ->  | N105: =T(OFFSET('[MiracleNikkiJp_items.csv]MiracleNikkiJp_items'!R10C[-4],RC1,0,1,1)) ->  | O105: =T(OFFSET('[MiracleNikkiJp_items.csv]MiracleNikkiJp_items'!R10C[-4],RC1,0,1,1)) ->  | P105: =T(OFFSET('[MiracleNikkiJp_items.csv]MiracleNikkiJp_items'!R10C[-4],RC1,0,1,1)) ->  | Q105: =T(OFFSET('[MiracleNikkiJp_items.csv]MiracleNikkiJp_items'!R10C[-4],RC1,0,1,1)) ->  | R105: =T(OFFSET('[MiracleNikkiJp_items.csv]MiracleNikkiJp_items'!R10C[-4],RC1,0,1,1)) ->  | S105: =T(OFFSET('[MiracleNikkiJp_items.csv]MiracleNikkiJp_items'!R10C[-4],RC1,0,1,1)) ->  | T105: =T(OFFSET('[MiracleNikkiJp_items.csv]MiracleNikkiJp_items'!R10C[-4],RC1,0,1,1)) ->  | U105: =T(OFFSET('[MiracleNikkiJp_items.csv]MiracleNikkiJp_items'!R10C[-4],RC1,0,1,1)) ->  | Y105: =T(OFFSET('[MiracleNikkiJp_items.csv]MiracleNikkiJp_items'!R10C[-7],RC1,0,1,1)) ->  | Z105: 54 | AA105: =IFERROR(VLOOKUP(RC[-16],R9C26:R17C36,2,FALSE),0)*R6C -> 0 | AB105: =IFERROR(VLOOKUP(RC[-16],R9C26:R17C36,3,FALSE),0)*R6C -> 0 | AC105: =IFERROR(VLOOKUP(RC[-16],R9C26:R17C36,4,FALSE),0)*R6C -> 0 | AD105: =IFERROR(VLOOKUP(RC[-16],R9C26:R17C36,5,FALSE),0)*R6C -> 0 | AE105: =IFERROR(VLOOKUP(RC[-16],R9C26:R17C36,6,FALSE),0)*R6C -> 0 | AF105: =IFERROR(VLOOKUP(RC[-16],R9C26:R17C36,7,FALSE),0)*R6C -> 0 | AG105: =IFERROR(VLOOKUP(RC[-16],R9C26:R17C36,8,FALSE),0)*R6C -> 0 | AH105: =IFERROR(VLOOKUP(RC[-16],R9C26:R17C36,9,FALSE),0)*R6C -> 0 | AI105: =IFERROR(VLOOKUP(RC[-16],R9C26:R17C36,10,FALSE),0)*R6C -> 0 | AJ105: =IFERROR(VLOOKUP(RC[-16],R9C26:R17C36,11,FALSE),0)*R6C -> 0 | AK105: =VLOOKUP(RC10,R9C38:R17C40,2,FALSE) -> 1 | AL105: =VLOOKUP(RC10,R9C38:R17C40,3,FALSE) -> 0 | AM105: =IF(OR(ISBLANK(R4C7),ISERROR(FIND(R4C7,RC21))),"　","●") ->  | AN105: =IF(OR(ISBLANK(R5C7),ISERROR(FIND(R5C7,RC21))),"　","●") ->  | AO105: =IF(RC39<>"●",VLOOKUP("評価しない",R9C42:R17C44,2,FALSE),VLOOKUP(R4C8,R9C42:R17C44,2,FALSE)) -> 1 | AP105: =IF(RC39<>"●",VLOOKUP("",R9C42:R17C44,3,FALSE),VLOOKUP(R4C8,R9C42:R17C44,3,FALSE)) -> 0 | AQ105: =IF(RC40<>"●",VLOOKUP("評価しない",R9C42:R17C44,2,FALSE),VLOOKUP(R5C8,R9C42:R17C44,2,FALSE)) -> 1 | AR105: =IF(RC40<>"●",VLOOKUP("",R9C42:R17C44,3,FALSE),VLOOKUP(R5C8,R9C42:R17C44,3,FALSE)) -> 0 | AS105: =IF(OR(ISBLANK(R6C7),ISERROR(FIND(R6C7,RC25))),"　","●") ->  | AT105: =IF(OR(ISBLANK(R7C7),ISERROR(FIND(R7C7,RC25))),"　","●") ->  | AU105: =IF(RC45<>"●",VLOOKUP("評価しない",R9C46:R17C48,2,FALSE),VLOOKUP(R6C8,R9C46:R17C48,2,FALSE)) -> 1 | AV105: =IF(RC45<>"●",VLOOKUP("",R9C46:R17C48,3,FALSE),VLOOKUP(R6C8,R9C46:R17C48,3,FALSE)) -> 0 | AW105: =IF(RC46<>"●",VLOOKUP("評価しない",R9C46:R17C48,2,FALSE),VLOOKUP(R7C8,R9C46:R17C48,2,FALSE)) -> 1 | AX105: =IF(RC46<>"●",VLOOKUP("",R9C46:R17C48,3,FALSE),VLOOKUP(R7C8,R9C46:R17C48,3,FALSE)) -> 0 | AY105: =SUM(RC27:RC36) -> 0 | AZ105: =RC37*RC41*RC43*RC47*RC49 -> 1 | BA105: =RC38+RC42+RC44+RC48+RC50 -> 0
A106: =OFFSET(R164C1,INT((RC26-1)/100),MOD(INT((RC26-1)/10),10),1,1)*10+MOD(RC26-1,10)+1 -> 55 | D106: =IF(AND(RC2<>"NG",OR(RC2<>"",RC3<>"",R9C4="×")),"◯","") ->  | E106: =IF(RC2="◯",RC6,"") ->  | F106: =T(OFFSET('[MiracleNikkiJp_items.csv]MiracleNikkiJp_items'!R10C[-3],RC1,0,1,1)) -> ヘアスタイル | G106: =T(OFFSET('[MiracleNikkiJp_items.csv]MiracleNikkiJp_items'!R10C[-2],RC1,0,1,1)) ->  | H106: =IF(RC4="",0,RC51*RC52+RC53) -> 0 | I106: =RC1 -> 55 | J106: =OFFSET('[MiracleNikkiJp_items.csv]MiracleNikkiJp_items'!R10C[-4],RC1,0,1,1) -> 0 | K106: =T(OFFSET('[MiracleNikkiJp_items.csv]MiracleNikkiJp_items'!R10C[-4],RC1,0,1,1)) ->  | L106: =T(OFFSET('[MiracleNikkiJp_items.csv]MiracleNikkiJp_items'!R10C[-4],RC1,0,1,1)) ->  | M106: =T(OFFSET('[MiracleNikkiJp_items.csv]MiracleNikkiJp_items'!R10C[-4],RC1,0,1,1)) ->  | N106: =T(OFFSET('[MiracleNikkiJp_items.csv]MiracleNikkiJp_items'!R10C[-4],RC1,0,1,1)) ->  | O106: =T(OFFSET('[MiracleNikkiJp_items.csv]MiracleNikkiJp_items'!R10C[-4],RC1,0,1,1)) ->  | P106: =T(OFFSET('[MiracleNikkiJp_items.csv]MiracleNikkiJp_items'!R10C[-4],RC1,0,1,1)) ->  | Q106: =T(OFFSET('[MiracleNikkiJp_items.csv]MiracleNikkiJp_items'!R10C[-4],RC1,0,1,1)) ->  | R106: =T(OFFSET('[MiracleNikkiJp_items.csv]MiracleNikkiJp_items'!R10C[-4],RC1,0,1,1)) ->  | S106: =T(OFFSET('[MiracleNikkiJp_items.csv]MiracleNikkiJp_items'!R10C[-4],RC1,0,1,1)) ->  | T106: =T(OFFSET('[MiracleNikkiJp_items.csv]MiracleNikkiJp_items'!R10C[-4],RC1,0,1,1)) ->  | U106: =T(OFFSET('[MiracleNikkiJp_items.csv]MiracleNikkiJp_items'!R10C[-4],RC1,0,1,1)) ->  | Y106: =T(OFFSET('[MiracleNikkiJp_items.csv]MiracleNikkiJp_items'!R10C[-7],RC1,0,1,1)) ->  | Z106: 55 | AA106: =IFERROR(VLOOKUP(RC[-16],R9C26:R17C36,2,FALSE),0)*R6C -> 0 | AB106: =IFERROR(VLOOKUP(RC[-16],R9C26:R17C36,3,FALSE),0)*R6C -> 0 | AC106: =IFERROR(VLOOKUP(RC[-16],R9C26:R17C36,4,FALSE),0)*R6C -> 0 | AD106: =IFERROR(VLOOKUP(RC[-16],R9C26:R17C36,5,FALSE),0)*R6C -> 0 | AE106: =IFERROR(VLOOKUP(RC[-16],R9C26:R17C36,6,FALSE),0)*R6C -> 0 | AF106: =IFERROR(VLOOKUP(RC[-16],R9C26:R17C36,7,FALSE),0)*R6C -> 0 | AG106: =IFERROR(VLOOKUP(RC[-16],R9C26:R17C36,8,FALSE),0)*R6C -> 0 | AH106: =IFERROR(VLOOKUP(RC[-16],R9C26:R17C36,9,FALSE),0)*R6C -> 0 | AI106: =IFERROR(VLOOKUP(RC[-16],R9C26:R17C36,10,FALSE),0)*R6C -> 0 | AJ106: =IFERROR(VLOOKUP(RC[-16],R9C26:R17C36,11,FALSE),0)*R6C -> 0 | AK106: =VLOOKUP(RC10,R9C38:R17C40,2,FALSE) -> 1 | AL106: =VLOOKUP(RC10,R9C38:R17C40,3,FALSE) -> 0 | AM106: =IF(OR(ISBLANK(R4C7),ISERROR(FIND(R4C7,RC21))),"　","●") ->  | AN106: =IF(OR(ISBLANK(R5C7),ISERROR(FIND(R5C7,RC21))),"　","●") ->  | AO106: =IF(RC39<>"●",VLOOKUP("評価しない",R9C42:R17C44,2,FALSE),VLOOKUP(R4C8,R9C42:R17C44,2,FALSE)) -> 1 | AP106: =IF(RC39<>"●",VLOOKUP("",R9C42:R17C44,3,FALSE),VLOOKUP(R4C8,R9C42:R17C44,3,FALSE)) -> 0 | AQ106: =IF(RC40<>"●",VLOOKUP("評価しない",R9C42:R17C44,2,FALSE),VLOOKUP(R5C8,R9C42:R17C44,2,FALSE)) -> 1 | AR106: =IF(RC40<>"●",VLOOKUP("",R9C42:R17C44,3,FALSE),VLOOKUP(R5C8,R9C42:R17C44,3,FALSE)) -> 0 | AS106: =IF(OR(ISBLANK(R6C7),ISERROR(FIND(R6C7,RC25))),"　","●") ->  | AT106: =IF(OR(ISBLANK(R7C7),ISERROR(FIND(R7C7,RC25))),"　","●") ->  | AU106: =IF(RC45<>"●",VLOOKUP("評価しない",R9C46:R17C48,2,FALSE),VLOOKUP(R6C8,R9C46:R17C48,2,FALSE)) -> 1 | AV106: =IF(RC45<>"●",VLOOKUP("",R9C46:R17C48,3,FALSE),VLOOKUP(R6C8,R9C46:R17C48,3,FALSE)) -> 0 | AW106: =IF(RC46<>"●",VLOOKUP("評価しない",R9C46:R17C48,2,FALSE),VLOOKUP(R7C8,R9C46:R17C48,2,FALSE)) -> 1 | AX106: =IF(RC46<>"●",VLOOKUP("",R9C46:R17C48,3,FALSE),VLOOKUP(R7C8,R9C46:R17C48,3,FALSE)) -> 0 | AY106: =SUM(RC27:RC36) -> 0 | AZ106: =RC37*RC41*RC43*RC47*RC49 -> 1 | BA106: =RC38+RC42+RC44+RC48+RC50 -> 0
A107: =OFFSET(R164C1,INT((RC26-1)/100),MOD(INT((RC26-1)/10),10),1,1)*10+MOD(RC26-1,10)+1 -> 56 | D107: =IF(AND(RC2<>"NG",OR(RC2<>"",RC3<>"",R9C4="×")),"◯","") ->  | E107: =IF(RC2="◯",RC6,"") ->  | F107: =T(OFFSET('[MiracleNikkiJp_items.csv]MiracleNikkiJp_items'!R10C[-3],RC1,0,1,1)) -> ヘアスタイル | G107: =T(OFFSET('[MiracleNikkiJp_items.csv]MiracleNikkiJp_items'!R10C[-2],RC1,0,1,1)) ->  | H107: =IF(RC4="",0,RC51*RC52+RC53) -> 0 | I107: =RC1 -> 56 | J107: =OFFSET('[MiracleNikkiJp_items.csv]MiracleNikkiJp_items'!R10C[-4],RC1,0,1,1) -> 0 | K107: =T(OFFSET('[MiracleNikkiJp_items.csv]MiracleNikkiJp_items'!R10C[-4],RC1,0,1,1)) ->  | L107: =T(OFFSET('[MiracleNikkiJp_items.csv]MiracleNikkiJp_items'!R10C[-4],RC1,0,1,1)) ->  | M107: =T(OFFSET('[MiracleNikkiJp_items.csv]MiracleNikkiJp_items'!R10C[-4],RC1,0,1,1)) ->  | N107: =T(OFFSET('[MiracleNikkiJp_items.csv]MiracleNikkiJp_items'!R10C[-4],RC1,0,1,1)) ->  | O107: =T(OFFSET('[MiracleNikkiJp_items.csv]MiracleNikkiJp_items'!R10C[-4],RC1,0,1,1)) ->  | P107: =T(OFFSET('[MiracleNikkiJp_items.csv]MiracleNikkiJp_items'!R10C[-4],RC1,0,1,1)) ->  | Q107: =T(OFFSET('[MiracleNikkiJp_items.csv]MiracleNikkiJp_items'!R10C[-4],RC1,0,1,1)) ->  | R107: =T(OFFSET('[MiracleNikkiJp_items.csv]MiracleNikkiJp_items'!R10C[-4],RC1,0,1,1)) ->  | S107: =T(OFFSET('[MiracleNikkiJp_items.csv]MiracleNikkiJp_items'!R10C[-4],RC1,0,1,1)) ->  | T107: =T(OFFSET('[MiracleNikkiJp_items.csv]MiracleNikkiJp_items'!R10C[-4],RC1,0,1,1)) ->  | U107: =T(OFFSET('[MiracleNikkiJp_items.csv]MiracleNikkiJp_items'!R10C[-4],RC1,0,1,1)) ->  | Y107: =T(OFFSET('[MiracleNikkiJp_items.csv]MiracleNikkiJp_items'!R10C[-7],RC1,0,1,1)) ->  | Z107: 56 | AA107: =IFERROR(VLOOKUP(RC[-16],R9C26:R17C36,2,FALSE),0)*R6C -> 0 | AB107: =IFERROR(VLOOKUP(RC[-16],R9C26:R17C36,3,FALSE),0)*R6C -> 0 | AC107: =IFERROR(VLOOKUP(RC[-16],R9C26:R17C36,4,FALSE),0)*R6C -> 0 | AD107: =IFERROR(VLOOKUP(RC[-16],R9C26:R17C36,5,FALSE),0)*R6C -> 0 | AE107: =IFERROR(VLOOKUP(RC[-16],R9C26:R17C36,6,FALSE),0)*R6C -> 0 | AF107: =IFERROR(VLOOKUP(RC[-16],R9C26:R17C36,7,FALSE),0)*R6C -> 0 | AG107: =IFERROR(VLOOKUP(RC[-16],R9C26:R17C36,8,FALSE),0)*R6C -> 0 | AH107: =IFERROR(VLOOKUP(RC[-16],R9C26:R17C36,9,FALSE),0)*R6C -> 0 | AI107: =IFERROR(VLOOKUP(RC[-16],R9C26:R17C36,10,FALSE),0)*R6C -> 0 | AJ107: =IFERROR(VLOOKUP(RC[-16],R9C26:R17C36,11,FALSE),0)*R6C -> 0 | AK107: =VLOOKUP(RC10,R9C38:R17C40,2,FALSE) -> 1 | AL107: =VLOOKUP(RC10,R9C38:R17C40,3,FALSE) -> 0 | AM107: =IF(OR(ISBLANK(R4C7),ISERROR(FIND(R4C7,RC21))),"　","●") ->  | AN107: =IF(OR(ISBLANK(R5C7),ISERROR(FIND(R5C7,RC21))),"　","●") ->  | AO107: =IF(RC39<>"●",VLOOKUP("評価しない",R9C42:R17C44,2,FALSE),VLOOKUP(R4C8,R9C42:R17C44,2,FALSE)) -> 1 | AP107: =IF(RC39<>"●",VLOOKUP("",R9C42:R17C44,3,FALSE),VLOOKUP(R4C8,R9C42:R17C44,3,FALSE)) -> 0 | AQ107: =IF(RC40<>"●",VLOOKUP("評価しない",R9C42:R17C44,2,FALSE),VLOOKUP(R5C8,R9C42:R17C44,2,FALSE)) -> 1 | AR107: =IF(RC40<>"●",VLOOKUP("",R9C42:R17C44,3,FALSE),VLOOKUP(R5C8,R9C42:R17C44,3,FALSE)) -> 0 | AS107: =IF(OR(ISBLANK(R6C7),ISERROR(FIND(R6C7,RC25))),"　","●") ->  | AT107: =IF(OR(ISBLANK(R7C7),ISERROR(FIND(R7C7,RC25))),"　","●") ->  | AU107: =IF(RC45<>"●",VLOOKUP("評価しない",R9C46:R17C48,2,FALSE),VLOOKUP(R6C8,R9C46:R17C48,2,FALSE)) -> 1 | AV107: =IF(RC45<>"●",VLOOKUP("",R9C46:R17C48,3,FALSE),VLOOKUP(R6C8,R9C46:R17C48,3,FALSE)) -> 0 | AW107: =IF(RC46<>"●",VLOOKUP("評価しない",R9C46:R17C48,2,FALSE),VLOOKUP(R7C8,R9C46:R17C48,2,FALSE)) -> 1 | AX107: =IF(RC46<>"●",VLOOKUP("",R9C46:R17C48,3,FALSE),VLOOKUP(R7C8,R9C46:R17C48,3,FALSE)) -> 0 | AY107: =SUM(RC27:RC36) -> 0 | AZ107: =RC37*RC41*RC43*RC47*RC49 -> 1 | BA107: =RC38+RC42+RC44+RC48+RC50 -> 0
A108: =OFFSET(R164C1,INT((RC26-1)/100),MOD(INT((RC26-1)/10),10),1,1)*10+MOD(RC26-1,10)+1 -> 57 | D108: =IF(AND(RC2<>"NG",OR(RC2<>"",RC3<>"",R9C4="×")),"◯","") ->  | E108: =IF(RC2="◯",RC6,"") ->  | F108: =T(OFFSET('[MiracleNikkiJp_items.csv]MiracleNikkiJp_items'!R10C[-3],RC1,0,1,1)) -> ヘアスタイル | G108: =T(OFFSET('[MiracleNikkiJp_items.csv]MiracleNikkiJp_items'!R10C[-2],RC1,0,1,1)) ->  | H108: =IF(RC4="",0,RC51*RC52+RC53) -> 0 | I108: =RC1 -> 57 | J108: =OFFSET('[MiracleNikkiJp_items.csv]MiracleNikkiJp_items'!R10C[-4],RC1,0,1,1) -> 0 | K108: =T(OFFSET('[MiracleNikkiJp_items.csv]MiracleNikkiJp_items'!R10C[-4],RC1,0,1,1)) ->  | L108: =T(OFFSET('[MiracleNikkiJp_items.csv]MiracleNikkiJp_items'!R10C[-4],RC1,0,1,1)) ->  | M108: =T(OFFSET('[MiracleNikkiJp_items.csv]MiracleNikkiJp_items'!R10C[-4],RC1,0,1,1)) ->  | N108: =T(OFFSET('[MiracleNikkiJp_items.csv]MiracleNikkiJp_items'!R10C[-4],RC1,0,1,1)) ->  | O108: =T(OFFSET('[MiracleNikkiJp_items.csv]MiracleNikkiJp_items'!R10C[-4],RC1,0,1,1)) ->  | P108: =T(OFFSET('[MiracleNikkiJp_items.csv]MiracleNikkiJp_items'!R10C[-4],RC1,0,1,1)) ->  | Q108: =T(OFFSET('[MiracleNikkiJp_items.csv]MiracleNikkiJp_items'!R10C[-4],RC1,0,1,1)) ->  | R108: =T(OFFSET('[MiracleNikkiJp_items.csv]MiracleNikkiJp_items'!R10C[-4],RC1,0,1,1)) ->  | S108: =T(OFFSET('[MiracleNikkiJp_items.csv]MiracleNikkiJp_items'!R10C[-4],RC1,0,1,1)) ->  | T108: =T(OFFSET('[MiracleNikkiJp_items.csv]MiracleNikkiJp_items'!R10C[-4],RC1,0,1,1)) ->  | U108: =T(OFFSET('[MiracleNikkiJp_items.csv]MiracleNikkiJp_items'!R10C[-4],RC1,0,1,1)) ->  | Y108: =T(OFFSET('[MiracleNikkiJp_items.csv]MiracleNikkiJp_items'!R10C[-7],RC1,0,1,1)) ->  | Z108: 57 | AA108: =IFERROR(VLOOKUP(RC[-16],R9C26:R17C36,2,FALSE),0)*R6C -> 0 | AB108: =IFERROR(VLOOKUP(RC[-16],R9C26:R17C36,3,FALSE),0)*R6C -> 0 | AC108: =IFERROR(VLOOKUP(RC[-16],R9C26:R17C36,4,FALSE),0)*R6C -> 0 | AD108: =IFERROR(VLOOKUP(RC[-16],R9C26:R17C36,5,FALSE),0)*R6C -> 0 | AE108: =IFERROR(VLOOKUP(RC[-16],R9C26:R17C36,6,FALSE),0)*R6C -> 0 | AF108: =IFERROR(VLOOKUP(RC[-16],R9C26:R17C36,7,FALSE),0)*R6C -> 0 | AG108: =IFERROR(VLOOKUP(RC[-16],R9C26:R17C36,8,FALSE),0)*R6C -> 0 | AH108: =IFERROR(VLOOKUP(RC[-16],R9C26:R17C36,9,FALSE),0)*R6C -> 0 | AI108: =IFERROR(VLOOKUP(RC[-16],R9C26:R17C36,10,FALSE),0)*R6C -> 0 | AJ108: =IFERROR(VLOOKUP(RC[-16],R9C26:R17C36,11,FALSE),0)*R6C -> 0 | AK108: =VLOOKUP(RC10,R9C38:R17C40,2,FALSE) -> 1 | AL108: =VLOOKUP(RC10,R9C38:R17C40,3,FALSE) -> 0 | AM108: =IF(OR(ISBLANK(R4C7),ISERROR(FIND(R4C7,RC21))),"　","●") ->  | AN108: =IF(OR(ISBLANK(R5C7),ISERROR(FIND(R5C7,RC21))),"　","●") ->  | AO108: =IF(RC39<>"●",VLOOKUP("評価しない",R9C42:R17C44,2,FALSE),VLOOKUP(R4C8,R9C42:R17C44,2,FALSE)) -> 1 | AP108: =IF(RC39<>"●",VLOOKUP("",R9C42:R17C44,3,FALSE),VLOOKUP(R4C8,R9C42:R17C44,3,FALSE)) -> 0 | AQ108: =IF(RC40<>"●",VLOOKUP("評価しない",R9C42:R17C44,2,FALSE),VLOOKUP(R5C8,R9C42:R17C44,2,FALSE)) -> 1 | AR108: =IF(RC40<>"●",VLOOKUP("",R9C42:R17C44,3,FALSE),VLOOKUP(R5C8,R9C42:R17C44,3,FALSE)) -> 0 | AS108: =IF(OR(ISBLANK(R6C7),ISERROR(FIND(R6C7,RC25))),"　","●") ->  | AT108: =IF(OR(ISBLANK(R7C7),ISERROR(FIND(R7C7,RC25))),"　","●") ->  | AU108: =IF(RC45<>"●",VLOOKUP("評価しない",R9C46:R17C48,2,FALSE),VLOOKUP(R6C8,R9C46:R17C48,2,FALSE)) -> 1 | AV108: =IF(RC45<>"●",VLOOKUP("",R9C46:R17C48,3,FALSE),VLOOKUP(R6C8,R9C46:R17C48,3,FALSE)) -> 0 | AW108: =IF(RC46<>"●",VLOOKUP("評価しない",R9C46:R17C48,2,FALSE),VLOOKUP(R7C8,R9C46:R17C48,2,FALSE)) -> 1 | AX108: =IF(RC46<>"●",VLOOKUP("",R9C46:R17C48,3,FALSE),VLOOKUP(R7C8,R9C46:R17C48,3,FALSE)) -> 0 | AY108: =SUM(RC27:RC36) -> 0 | AZ108: =RC37*RC41*RC43*RC47*RC49 -> 1 | BA108: =RC38+RC42+RC44+RC48+RC50 -> 0
A109: =OFFSET(R164C1,INT((RC26-1)/100),MOD(INT((RC26-1)/10),10),1,1)*10+MOD(RC26-1,10)+1 -> 58 | D109: =IF(AND(RC2<>"NG",OR(RC2<>"",RC3<>"",R9C4="×")),"◯","") ->  | E109: =IF(RC2="◯",RC6,"") ->  | F109: =T(OFFSET('[MiracleNikkiJp_items.csv]MiracleNikkiJp_items'!R10C[-3],RC1,0,1,1)) -> ヘアスタイル | G109: =T(OFFSET('[MiracleNikkiJp_items.csv]MiracleNikkiJp_items'!R10C[-2],RC1,0,1,1)) ->  | H109: =IF(RC4="",0,RC51*RC52+RC53) -> 0 | I109: =RC1 -> 58 | J109: =OFFSET('[MiracleNikkiJp_items.csv]MiracleNikkiJp_items'!R10C[-4],RC1,0,1,1) -> 0 | K109: =T(OFFSET('[MiracleNikkiJp_items.csv]MiracleNikkiJp_items'!R10C[-4],RC1,0,1,1)) ->  | L109: =T(OFFSET('[MiracleNikkiJp_items.csv]MiracleNikkiJp_items'!R10C[-4],RC1,0,1,1)) ->  | M109: =T(OFFSET('[MiracleNikkiJp_items.csv]MiracleNikkiJp_items'!R10C[-4],RC1,0,1,1)) ->  | N109: =T(OFFSET('[MiracleNikkiJp_items.csv]MiracleNikkiJp_items'!R10C[-4],RC1,0,1,1)) ->  | O109: =T(OFFSET('[MiracleNikkiJp_items.csv]MiracleNikkiJp_items'!R10C[-4],RC1,0,1,1)) ->  | P109: =T(OFFSET('[MiracleNikkiJp_items.csv]MiracleNikkiJp_items'!R10C[-4],RC1,0,1,1)) ->  | Q109: =T(OFFSET('[MiracleNikkiJp_items.csv]MiracleNikkiJp_items'!R10C[-4],RC1,0,1,1)) ->  | R109: =T(OFFSET('[MiracleNikkiJp_items.csv]MiracleNikkiJp_items'!R10C[-4],RC1,0,1,1)) ->  | S109: =T(OFFSET('[MiracleNikkiJp_items.csv]MiracleNikkiJp_items'!R10C[-4],RC1,0,1,1)) ->  | T109: =T(OFFSET('[MiracleNikkiJp_items.csv]MiracleNikkiJp_items'!R10C[-4],RC1,0,1,1)) ->  | U109: =T(OFFSET('[MiracleNikkiJp_items.csv]MiracleNikkiJp_items'!R10C[-4],RC1,0,1,1)) ->  | Y109: =T(OFFSET('[MiracleNikkiJp_items.csv]MiracleNikkiJp_items'!R10C[-7],RC1,0,1,1)) ->  | Z109: 58 | AA109: =IFERROR(VLOOKUP(RC[-16],R9C26:R17C36,2,FALSE),0)*R6C -> 0 | AB109: =IFERROR(VLOOKUP(RC[-16],R9C26:R17C36,3,FALSE),0)*R6C -> 0 | AC109: =IFERROR(VLOOKUP(RC[-16],R9C26:R17C36,4,FALSE),0)*R6C -> 0 | AD109: =IFERROR(VLOOKUP(RC[-16],R9C26:R17C36,5,FALSE),0)*R6C -> 0 | AE109: =IFERROR(VLOOKUP(RC[-16],R9C26:R17C36,6,FALSE),0)*R6C -> 0 | AF109: =IFERROR(VLOOKUP(RC[-16],R9C26:R17C36,7,FALSE),0)*R6C -> 0 | AG109: =IFERROR(VLOOKUP(RC[-16],R9C26:R17C36,8,FALSE),0)*R6C -> 0 | AH109: =IFERROR(VLOOKUP(RC[-16],R9C26:R17C36,9,FALSE),0)*R6C -> 0 | AI109: =IFERROR(VLOOKUP(RC[-16],R9C26:R17C36,10,FALSE),0)*R6C -> 0 | AJ109: =IFERROR(VLOOKUP(RC[-16],R9C26:R17C36,11,FALSE),0)*R6C -> 0 | AK109: =VLOOKUP(RC10,R9C38:R17C40,2,FALSE) -> 1 | AL109: =VLOOKUP(RC10,R9C38:R17C40,3,FALSE) -> 0 | AM109: =IF(OR(ISBLANK(R4C7),ISERROR(FIND(R4C7,RC21))),"　","●") ->  | AN109: =IF(OR(ISBLANK(R5C7),ISERROR(FIND(R5C7,RC21))),"　","●") ->  | AO109: =IF(RC39<>"●",VLOOKUP("評価しない",R9C42:R17C44,2,FALSE),VLOOKUP(R4C8,R9C42:R17C44,2,FALSE)) -> 1 | AP109: =IF(RC39<>"●",VLOOKUP("",R9C42:R17C44,3,FALSE),VLOOKUP(R4C8,R9C42:R17C44,3,FALSE)) -> 0 | AQ109: =IF(RC40<>"●",VLOOKUP("評価しない",R9C42:R17C44,2,FALSE),VLOOKUP(R5C8,R9C42:R17C44,2,FALSE)) -> 1 | AR109: =IF(RC40<>"●",VLOOKUP("",R9C42:R17C44,3,FALSE),VLOOKUP(R5C8,R9C42:R17C44,3,FALSE)) -> 0 | AS109: =IF(OR(ISBLANK(R6C7),ISERROR(FIND(R6C7,RC25))),"　","●") ->  | AT109: =IF(OR(ISBLANK(R7C7),ISERROR(FIND(R7C7,RC25))),"　","●") ->  | AU109: =IF(RC45<>"●",VLOOKUP("評価しない",R9C46:R17C48,2,FALSE),VLOOKUP(R6C8,R9C46:R17C48,2,FALSE)) -> 1 | AV109: =IF(RC45<>"●",VLOOKUP("",R9C46:R17C48,3,FALSE),VLOOKUP(R6C8,R9C46:R17C48,3,FALSE)) -> 0 | AW109: =IF(RC46<>"●",VLOOKUP("評価しない",R9C46:R17C48,2,FALSE),VLOOKUP(R7C8,R9C46:R17C48,2,FALSE)) -> 1 | AX109: =IF(RC46<>"●",VLOOKUP("",R9C46:R17C48,3,FALSE),VLOOKUP(R7C8,R9C46:R17C48,3,FALSE)) -> 0 | AY109: =SUM(RC27:RC36) -> 0 | AZ109: =RC37*RC41*RC43*RC47*RC49 -> 1 | BA109: =RC38+RC42+RC44+RC48+RC50 -> 0
A110: =OFFSET(R164C1,INT((RC26-1)/100),MOD(INT((RC26-1)/10),10),1,1)*10+MOD(RC26-1,10)+1 -> 59 | D110: =IF(AND(RC2<>"NG",OR(RC2<>"",RC3<>"",R9C4="×")),"◯","") ->  | E110: =IF(RC2="◯",RC6,"") ->  | F110: =T(OFFSET('[MiracleNikkiJp_items.csv]MiracleNikkiJp_items'!R10C[-3],RC1,0,1,1)) -> ヘアスタイル | G110: =T(OFFSET('[MiracleNikkiJp_items.csv]MiracleNikkiJp_items'!R10C[-2],RC1,0,1,1)) ->  | H110: =IF(RC4="",0,RC51*RC52+RC53) -> 0 | I110: =RC1 -> 59 | J110: =OFFSET('[MiracleNikkiJp_items.csv]MiracleNikkiJp_items'!R10C[-4],RC1,0,1,1) -> 0 | K110: =T(OFFSET('[MiracleNikkiJp_items.csv]MiracleNikkiJp_items'!R10C[-4],RC1,0,1,1)) ->  | L110: =T(OFFSET('[MiracleNikkiJp_items.csv]MiracleNikkiJp_items'!R10C[-4],RC1,0,1,1)) ->  | M110: =T(OFFSET('[MiracleNikkiJp_items.csv]MiracleNikkiJp_items'!R10C[-4],RC1,0,1,1)) ->  | N110: =T(OFFSET('[MiracleNikkiJp_items.csv]MiracleNikkiJp_items'!R10C[-4],RC1,0,1,1)) ->  | O110: =T(OFFSET('[MiracleNikkiJp_items.csv]MiracleNikkiJp_items'!R10C[-4],RC1,0,1,1)) ->  | P110: =T(OFFSET('[MiracleNikkiJp_items.csv]MiracleNikkiJp_items'!R10C[-4],RC1,0,1,1)) ->  | Q110: =T(OFFSET('[MiracleNikkiJp_items.csv]MiracleNikkiJp_items'!R10C[-4],RC1,0,1,1)) ->  | R110: =T(OFFSET('[MiracleNikkiJp_items.csv]MiracleNikkiJp_items'!R10C[-4],RC1,0,1,1)) ->  | S110: =T(OFFSET('[MiracleNikkiJp_items.csv]MiracleNikkiJp_items'!R10C[-4],RC1,0,1,1)) ->  | T110: =T(OFFSET('[MiracleNikkiJp_items.csv]MiracleNikkiJp_items'!R10C[-4],RC1,0,1,1)) ->  | U110: =T(OFFSET('[MiracleNikkiJp_items.csv]MiracleNikkiJp_items'!R10C[-4],RC1,0,1,1)) ->  | Y110: =T(OFFSET('[MiracleNikkiJp_items.csv]MiracleNikkiJp_items'!R10C[-7],RC1,0,1,1)) ->  | Z110: 59 | AA110: =IFERROR(VLOOKUP(RC[-16],R9C26:R17C36,2,FALSE),0)*R6C -> 0 | AB110: =IFERROR(VLOOKUP(RC[-16],R9C26:R17C36,3,FALSE),0)*R6C -> 0 | AC110: =IFERROR(VLOOKUP(RC[-16],R9C26:R17C36,4,FALSE),0)*R6C -> 0 | AD110: =IFERROR(VLOOKUP(RC[-16],R9C26:R17C36,5,FALSE),0)*R6C -> 0 | AE110: =IFERROR(VLOOKUP(RC[-16],R9C26:R17C36,6,FALSE),0)*R6C -> 0 | AF110: =IFERROR(VLOOKUP(RC[-16],R9C26:R17C36,7,FALSE),0)*R6C -> 0 | AG110: =IFERROR(VLOOKUP(RC[-16],R9C26:R17C36,8,FALSE),0)*R6C -> 0 | AH110: =IFERROR(VLOOKUP(RC[-16],R9C26:R17C36,9,FALSE),0)*R6C -> 0 | AI110: =IFERROR(VLOOKUP(RC[-16],R9C26:R17C36,10,FALSE),0)*R6C -> 0 | AJ110: =IFERROR(VLOOKUP(RC[-16],R9C26:R17C36,11,FALSE),0)*R6C -> 0 | AK110: =VLOOKUP(RC10,R9C38:R17C40,2,FALSE) -> 1 | AL110: =VLOOKUP(RC10,R9C38:R17C40,3,FALSE) -> 0 | AM110: =IF(OR(ISBLANK(R4C7),ISERROR(FIND(R4C7,RC21))),"　","●") ->  | AN110: =IF(OR(ISBLANK(R5C7),ISERROR(FIND(R5C7,RC21))),"　","●") ->  | AO110: =IF(RC39<>"●",VLOOKUP("評価しない",R9C42:R17C44,2,FALSE),VLOOKUP(R4C8,R9C42:R17C44,2,FALSE)) -> 1 | AP110: =IF(RC39<>"●",VLOOKUP("",R9C42:R17C44,3,FALSE),VLOOKUP(R4C8,R9C42:R17C44,3,FALSE)) -> 0 | AQ110: =IF(RC40<>"●",VLOOKUP("評価しない",R9C42:R17C44,2,FALSE),VLOOKUP(R5C8,R9C42:R17C44,2,FALSE)) -> 1 | AR110: =IF(RC40<>"●",VLOOKUP("",R9C42:R17C44,3,FALSE),VLOOKUP(R5C8,R9C42:R17C44,3,FALSE)) -> 0 | AS110: =IF(OR(ISBLANK(R6C7),ISERROR(FIND(R6C7,RC25))),"　","●") ->  | AT110: =IF(OR(ISBLANK(R7C7),ISERROR(FIND(R7C7,RC25))),"　","●") ->  | AU110: =IF(RC45<>"●",VLOOKUP("評価しない",R9C46:R17C48,2,FALSE),VLOOKUP(R6C8,R9C46:R17C48,2,FALSE)) -> 1 | AV110: =IF(RC45<>"●",VLOOKUP("",R9C46:R17C48,3,FALSE),VLOOKUP(R6C8,R9C46:R17C48,3,FALSE)) -> 0 | AW110: =IF(RC46<>"●",VLOOKUP("評価しない",R9C46:R17C48,2,FALSE),VLOOKUP(R7C8,R9C46:R17C48,2,FALSE)) -> 1 | AX110: =IF(RC46<>"●",VLOOKUP("",R9C46:R17C48,3,FALSE),VLOOKUP(R7C8,R9C46:R17C48,3,FALSE)) -> 0 | AY110: =SUM(RC27:RC36) -> 0 | AZ110: =RC37*RC41*RC43*RC47*RC49 -> 1 | BA110: =RC38+RC42+RC44+RC48+RC50 -> 0
A111: =OFFSET(R164C1,INT((RC26-1)/100),MOD(INT((RC26-1)/10),10),1,1)*10+MOD(RC26-1,10)+1 -> 60 | D111: =IF(AND(RC2<>"NG",OR(RC2<>"",RC3<>"",R9C4="×")),"◯","") ->  | E111: =IF(RC2="◯",RC6,"") ->  | F111: =T(OFFSET('[MiracleNikkiJp_items.csv]MiracleNikkiJp_items'!R10C[-3],RC1,0,1,1)) -> ヘアスタイル | G111: =T(OFFSET('[MiracleNikkiJp_items.csv]MiracleNikkiJp_items'!R10C[-2],RC1,0,1,1)) ->  | H111: =IF(RC4="",0,RC51*RC52+RC53) -> 0 | I111: =RC1 -> 60 | J111: =OFFSET('[MiracleNikkiJp_items.csv]MiracleNikkiJp_items'!R10C[-4],RC1,0,1,1) -> 0 | K111: =T(OFFSET('[MiracleNikkiJp_items.csv]MiracleNikkiJp_items'!R10C[-4],RC1,0,1,1)) ->  | L111: =T(OFFSET('[MiracleNikkiJp_items.csv]MiracleNikkiJp_items'!R10C[-4],RC1,0,1,1)) ->  | M111: =T(OFFSET('[MiracleNikkiJp_items.csv]MiracleNikkiJp_items'!R10C[-4],RC1,0,1,1)) ->  | N111: =T(OFFSET('[MiracleNikkiJp_items.csv]MiracleNikkiJp_items'!R10C[-4],RC1,0,1,1)) ->  | O111: =T(OFFSET('[MiracleNikkiJp_items.csv]MiracleNikkiJp_items'!R10C[-4],RC1,0,1,1)) ->  | P111: =T(OFFSET('[MiracleNikkiJp_items.csv]MiracleNikkiJp_items'!R10C[-4],RC1,0,1,1)) ->  | Q111: =T(OFFSET('[MiracleNikkiJp_items.csv]MiracleNikkiJp_items'!R10C[-4],RC1,0,1,1)) ->  | R111: =T(OFFSET('[MiracleNikkiJp_items.csv]MiracleNikkiJp_items'!R10C[-4],RC1,0,1,1)) ->  | S111: =T(OFFSET('[MiracleNikkiJp_items.csv]MiracleNikkiJp_items'!R10C[-4],RC1,0,1,1)) ->  | T111: =T(OFFSET('[MiracleNikkiJp_items.csv]MiracleNikkiJp_items'!R10C[-4],RC1,0,1,1)) ->  | U111: =T(OFFSET('[MiracleNikkiJp_items.csv]MiracleNikkiJp_items'!R10C[-4],RC1,0,1,1)) ->  | Y111: =T(OFFSET('[MiracleNikkiJp_items.csv]MiracleNikkiJp_items'!R10C[-7],RC1,0,1,1)) ->  | Z111: 60 | AA111: =IFERROR(VLOOKUP(RC[-16],R9C26:R17C36,2,FALSE),0)*R6C -> 0 | AB111: =IFERROR(VLOOKUP(RC[-16],R9C26:R17C36,3,FALSE),0)*R6C -> 0 | AC111: =IFERROR(VLOOKUP(RC[-16],R9C26:R17C36,4,FALSE),0)*R6C -> 0 | AD111: =IFERROR(VLOOKUP(RC[-16],R9C26:R17C36,5,FALSE),0)*R6C -> 0 | AE111: =IFERROR(VLOOKUP(RC[-16],R9C26:R17C36,6,FALSE),0)*R6C -> 0 | AF111: =IFERROR(VLOOKUP(RC[-16],R9C26:R17C36,7,FALSE),0)*R6C -> 0 | AG111: =IFERROR(VLOOKUP(RC[-16],R9C26:R17C36,8,FALSE),0)*R6C -> 0 | AH111: =IFERROR(VLOOKUP(RC[-16],R9C26:R17C36,9,FALSE),0)*R6C -> 0 | AI111: =IFERROR(VLOOKUP(RC[-16],R9C26:R17C36,10,FALSE),0)*R6C -> 0 | AJ111: =IFERROR(VLOOKUP(RC[-16],R9C26:R17C36,11,FALSE),0)*R6C -> 0 | AK111: =VLOOKUP(RC10,R9C38:R17C40,2,FALSE) -> 1 | AL111: =VLOOKUP(RC10,R9C38:R17C40,3,FALSE) -> 0 | AM111: =IF(OR(ISBLANK(R4C7),ISERROR(FIND(R4C7,RC21))),"　","●") ->  | AN111: =IF(OR(ISBLANK(R5C7),ISERROR(FIND(R5C7,RC21))),"　","●") ->  | AO111: =IF(RC39<>"●",VLOOKUP("評価しない",R9C42:R17C44,2,FALSE),VLOOKUP(R4C8,R9C42:R17C44,2,FALSE)) -> 1 | AP111: =IF(RC39<>"●",VLOOKUP("",R9C42:R17C44,3,FALSE),VLOOKUP(R4C8,R9C42:R17C44,3,FALSE)) -> 0 | AQ111: =IF(RC40<>"●",VLOOKUP("評価しない",R9C42:R17C44,2,FALSE),VLOOKUP(R5C8,R9C42:R17C44,2,FALSE)) -> 1 | AR111: =IF(RC40<>"●",VLOOKUP("",R9C42:R17C44,3,FALSE),VLOOKUP(R5C8,R9C42:R17C44,3,FALSE)) -> 0 | AS111: =IF(OR(ISBLANK(R6C7),ISERROR(FIND(R6C7,RC25))),"　","●") ->  | AT111: =IF(OR(ISBLANK(R7C7),ISERROR(FIND(R7C7,RC25))),"　","●") ->  | AU111: =IF(RC45<>"●",VLOOKUP("評価しない",R9C46:R17C48,2,FALSE),VLOOKUP(R6C8,R9C46:R17C48,2,FALSE)) -> 1 | AV111: =IF(RC45<>"●",VLOOKUP("",R9C46:R17C48,3,FALSE),VLOOKUP(R6C8,R9C46:R17C48,3,FALSE)) -> 0 | AW111: =IF(RC46<>"●",VLOOKUP("評価しない",R9C46:R17C48,2,FALSE),VLOOKUP(R7C8,R9C46:R17C48,2,FALSE)) -> 1 | AX111: =IF(RC46<>"●",VLOOKUP("",R9C46:R17C48,3,FALSE),VLOOKUP(R7C8,R9C46:R17C48,3,FALSE)) -> 0 | AY111: =SUM(RC27:RC36) -> 0 | AZ111: =RC37*RC41*RC43*RC47*RC49 -> 1 | BA111: =RC38+RC42+RC44+RC48+RC50 -> 0
A112: =OFFSET(R164C1,INT((RC26-1)/100),MOD(INT((RC26-1)/10),10),1,1)*10+MOD(RC26-1,10)+1 -> 61 | D112: =IF(AND(RC2<>"NG",OR(RC2<>"",RC3<>"",R9C4="×")),"◯","") ->  | E112: =IF(RC2="◯",RC6,"") ->  | F112: =T(OFFSET('[MiracleNikkiJp_items.csv]MiracleNikkiJp_items'!R10C[-3],RC1,0,1,1)) -> ヘアスタイル | G112: =T(OFFSET('[MiracleNikkiJp_items.csv]MiracleNikkiJp_items'!R10C[-2],RC1,0,1,1)) ->  | H112: =IF(RC4="",0,RC51*RC52+RC53) -> 0 | I112: =RC1 -> 61 | J112: =OFFSET('[MiracleNikkiJp_items.csv]MiracleNikkiJp_items'!R10C[-4],RC1,0,1,1) -> 0 | K112: =T(OFFSET('[MiracleNikkiJp_items.csv]MiracleNikkiJp_items'!R10C[-4],RC1,0,1,1)) ->  | L112: =T(OFFSET('[MiracleNikkiJp_items.csv]MiracleNikkiJp_items'!R10C[-4],RC1,0,1,1)) ->  | M112: =T(OFFSET('[MiracleNikkiJp_items.csv]MiracleNikkiJp_items'!R10C[-4],RC1,0,1,1)) ->  | N112: =T(OFFSET('[MiracleNikkiJp_items.csv]MiracleNikkiJp_items'!R10C[-4],RC1,0,1,1)) ->  | O112: =T(OFFSET('[MiracleNikkiJp_items.csv]MiracleNikkiJp_items'!R10C[-4],RC1,0,1,1)) ->  | P112: =T(OFFSET('[MiracleNikkiJp_items.csv]MiracleNikkiJp_items'!R10C[-4],RC1,0,1,1)) ->  | Q112: =T(OFFSET('[MiracleNikkiJp_items.csv]MiracleNikkiJp_items'!R10C[-4],RC1,0,1,1)) ->  | R112: =T(OFFSET('[MiracleNikkiJp_items.csv]MiracleNikkiJp_items'!R10C[-4],RC1,0,1,1)) ->  | S112: =T(OFFSET('[MiracleNikkiJp_items.csv]MiracleNikkiJp_items'!R10C[-4],RC1,0,1,1)) ->  | T112: =T(OFFSET('[MiracleNikkiJp_items.csv]MiracleNikkiJp_items'!R10C[-4],RC1,0,1,1)) ->  | U112: =T(OFFSET('[MiracleNikkiJp_items.csv]MiracleNikkiJp_items'!R10C[-4],RC1,0,1,1)) ->  | Y112: =T(OFFSET('[MiracleNikkiJp_items.csv]MiracleNikkiJp_items'!R10C[-7],RC1,0,1,1)) ->  | Z112: 61 | AA112: =IFERROR(VLOOKUP(RC[-16],R9C26:R17C36,2,FALSE),0)*R6C -> 0 | AB112: =IFERROR(VLOOKUP(RC[-16],R9C26:R17C36,3,FALSE),0)*R6C -> 0 | AC112: =IFERROR(VLOOKUP(RC[-16],R9C26:R17C36,4,FALSE),0)*R6C -> 0 | AD112: =IFERROR(VLOOKUP(RC[-16],R9C26:R17C36,5,FALSE),0)*R6C -> 0 | AE112: =IFERROR(VLOOKUP(RC[-16],R9C26:R17C36,6,FALSE),0)*R6C -> 0 | AF112: =IFERROR(VLOOKUP(RC[-16],R9C26:R17C36,7,FALSE),0)*R6C -> 0 | AG112: =IFERROR(VLOOKUP(RC[-16],R9C26:R17C36,8,FALSE),0)*R6C -> 0 | AH112: =IFERROR(VLOOKUP(RC[-16],R9C26:R17C36,9,FALSE),0)*R6C -> 0 | AI112: =IFERROR(VLOOKUP(RC[-16],R9C26:R17C36,10,FALSE),0)*R6C -> 0 | AJ112: =IFERROR(VLOOKUP(RC[-16],R9C26:R17C36,11,FALSE),0)*R6C -> 0 | AK112: =VLOOKUP(RC10,R9C38:R17C40,2,FALSE) -> 1 | AL112: =VLOOKUP(RC10,R9C38:R17C40,3,FALSE) -> 0 | AM112: =IF(OR(ISBLANK(R4C7),ISERROR(FIND(R4C7,RC21))),"　","●") ->  | AN112: =IF(OR(ISBLANK(R5C7),ISERROR(FIND(R5C7,RC21))),"　","●") ->  | AO112: =IF(RC39<>"●",VLOOKUP("評価しない",R9C42:R17C44,2,FALSE),VLOOKUP(R4C8,R9C42:R17C44,2,FALSE)) -> 1 | AP112: =IF(RC39<>"●",VLOOKUP("",R9C42:R17C44,3,FALSE),VLOOKUP(R4C8,R9C42:R17C44,3,FALSE)) -> 0 | AQ112: =IF(RC40<>"●",VLOOKUP("評価しない",R9C42:R17C44,2,FALSE),VLOOKUP(R5C8,R9C42:R17C44,2,FALSE)) -> 1 | AR112: =IF(RC40<>"●",VLOOKUP("",R9C42:R17C44,3,FALSE),VLOOKUP(R5C8,R9C42:R17C44,3,FALSE)) -> 0 | AS112: =IF(OR(ISBLANK(R6C7),ISERROR(FIND(R6C7,RC25))),"　","●") ->  | AT112: =IF(OR(ISBLANK(R7C7),ISERROR(FIND(R7C7,RC25))),"　","●") ->  | AU112: =IF(RC45<>"●",VLOOKUP("評価しない",R9C46:R17C48,2,FALSE),VLOOKUP(R6C8,R9C46:R17C48,2,FALSE)) -> 1 | AV112: =IF(RC45<>"●",VLOOKUP("",R9C46:R17C48,3,FALSE),VLOOKUP(R6C8,R9C46:R17C48,3,FALSE)) -> 0 | AW112: =IF(RC46<>"●",VLOOKUP("評価しない",R9C46:R17C48,2,FALSE),VLOOKUP(R7C8,R9C46:R17C48,2,FALSE)) -> 1 | AX112: =IF(RC46<>"●",VLOOKUP("",R9C46:R17C48,3,FALSE),VLOOKUP(R7C8,R9C46:R17C48,3,FALSE)) -> 0 | AY112: =SUM(RC27:RC36) -> 0 | AZ112: =RC37*RC41*RC43*RC47*RC49 -> 1 | BA112: =RC38+RC42+RC44+RC48+RC50 -> 0
A113: =OFFSET(R164C1,INT((RC26-1)/100),MOD(INT((RC26-1)/10),10),1,1)*10+MOD(RC26-1,10)+1 -> 62 | D113: =IF(AND(RC2<>"NG",OR(RC2<>"",RC3<>"",R9C4="×")),"◯","") ->  | E113: =IF(RC2="◯",RC6,"") ->  | F113: =T(OFFSET('[MiracleNikkiJp_items.csv]MiracleNikkiJp_items'!R10C[-3],RC1,0,1,1)) -> ヘアスタイル | G113: =T(OFFSET('[MiracleNikkiJp_items.csv]MiracleNikkiJp_items'!R10C[-2],RC1,0,1,1)) ->  | H113: =IF(RC4="",0,RC51*RC52+RC53) -> 0 | I113: =RC1 -> 62 | J113: =OFFSET('[MiracleNikkiJp_items.csv]MiracleNikkiJp_items'!R10C[-4],RC1,0,1,1) -> 0 | K113: =T(OFFSET('[MiracleNikkiJp_items.csv]MiracleNikkiJp_items'!R10C[-4],RC1,0,1,1)) ->  | L113: =T(OFFSET('[MiracleNikkiJp_items.csv]MiracleNikkiJp_items'!R10C[-4],RC1,0,1,1)) ->  | M113: =T(OFFSET('[MiracleNikkiJp_items.csv]MiracleNikkiJp_items'!R10C[-4],RC1,0,1,1)) ->  | N113: =T(OFFSET('[MiracleNikkiJp_items.csv]MiracleNikkiJp_items'!R10C[-4],RC1,0,1,1)) ->  | O113: =T(OFFSET('[MiracleNikkiJp_items.csv]MiracleNikkiJp_items'!R10C[-4],RC1,0,1,1)) ->  | P113: =T(OFFSET('[MiracleNikkiJp_items.csv]MiracleNikkiJp_items'!R10C[-4],RC1,0,1,1)) ->  | Q113: =T(OFFSET('[MiracleNikkiJp_items.csv]MiracleNikkiJp_items'!R10C[-4],RC1,0,1,1)) ->  | R113: =T(OFFSET('[MiracleNikkiJp_items.csv]MiracleNikkiJp_items'!R10C[-4],RC1,0,1,1)) ->  | S113: =T(OFFSET('[MiracleNikkiJp_items.csv]MiracleNikkiJp_items'!R10C[-4],RC1,0,1,1)) ->  | T113: =T(OFFSET('[MiracleNikkiJp_items.csv]MiracleNikkiJp_items'!R10C[-4],RC1,0,1,1)) ->  | U113: =T(OFFSET('[MiracleNikkiJp_items.csv]MiracleNikkiJp_items'!R10C[-4],RC1,0,1,1)) ->  | Y113: =T(OFFSET('[MiracleNikkiJp_items.csv]MiracleNikkiJp_items'!R10C[-7],RC1,0,1,1)) ->  | Z113: 62 | AA113: =IFERROR(VLOOKUP(RC[-16],R9C26:R17C36,2,FALSE),0)*R6C -> 0 | AB113: =IFERROR(VLOOKUP(RC[-16],R9C26:R17C36,3,FALSE),0)*R6C -> 0 | AC113: =IFERROR(VLOOKUP(RC[-16],R9C26:R17C36,4,FALSE),0)*R6C -> 0 | AD113: =IFERROR(VLOOKUP(RC[-16],R9C26:R17C36,5,FALSE),0)*R6C -> 0 | AE113: =IFERROR(VLOOKUP(RC[-16],R9C26:R17C36,6,FALSE),0)*R6C -> 0 | AF113: =IFERROR(VLOOKUP(RC[-16],R9C26:R17C36,7,FALSE),0)*R6C -> 0 | AG113: =IFERROR(VLOOKUP(RC[-16],R9C26:R17C36,8,FALSE),0)*R6C -> 0 | AH113: =IFERROR(VLOOKUP(RC[-16],R9C26:R17C36,9,FALSE),0)*R6C -> 0 | AI113: =IFERROR(VLOOKUP(RC[-16],R9C26:R17C36,10,FALSE),0)*R6C -> 0 | AJ113: =IFERROR(VLOOKUP(RC[-16],R9C26:R17C36,11,FALSE),0)*R6C -> 0 | AK113: =VLOOKUP(RC10,R9C38:R17C40,2,FALSE) -> 1 | AL113: =VLOOKUP(RC10,R9C38:R17C40,3,FALSE) -> 0 | AM113: =IF(OR(ISBLANK(R4C7),ISERROR(FIND(R4C7,RC21))),"　","●") ->  | AN113: =IF(OR(ISBLANK(R5C7),ISERROR(FIND(R5C7,RC21))),"　","●") ->  | AO113: =IF(RC39<>"●",VLOOKUP("評価しない",R9C42:R17C44,2,FALSE),VLOOKUP(R4C8,R9C42:R17C44,2,FALSE)) -> 1 | AP113: =IF(RC39<>"●",VLOOKUP("",R9C42:R17C44,3,FALSE),VLOOKUP(R4C8,R9C42:R17C44,3,FALSE)) -> 0 | AQ113: =IF(RC40<>"●",VLOOKUP("評価しない",R9C42:R17C44,2,FALSE),VLOOKUP(R5C8,R9C42:R17C44,2,FALSE)) -> 1 | AR113: =IF(RC40<>"●",VLOOKUP("",R9C42:R17C44,3,FALSE),VLOOKUP(R5C8,R9C42:R17C44,3,FALSE)) -> 0 | AS113: =IF(OR(ISBLANK(R6C7),ISERROR(FIND(R6C7,RC25))),"　","●") ->  | AT113: =IF(OR(ISBLANK(R7C7),ISERROR(FIND(R7C7,RC25))),"　","●") ->  | AU113: =IF(RC45<>"●",VLOOKUP("評価しない",R9C46:R17C48,2,FALSE),VLOOKUP(R6C8,R9C46:R17C48,2,FALSE)) -> 1 | AV113: =IF(RC45<>"●",VLOOKUP("",R9C46:R17C48,3,FALSE),VLOOKUP(R6C8,R9C46:R17C48,3,FALSE)) -> 0 | AW113: =IF(RC46<>"●",VLOOKUP("評価しない",R9C46:R17C48,2,FALSE),VLOOKUP(R7C8,R9C46:R17C48,2,FALSE)) -> 1 | AX113: =IF(RC46<>"●",VLOOKUP("",R9C46:R17C48,3,FALSE),VLOOKUP(R7C8,R9C46:R17C48,3,FALSE)) -> 0 | AY113: =SUM(RC27:RC36) -> 0 | AZ113: =RC37*RC41*RC43*RC47*RC49 -> 1 | BA113: =RC38+RC42+RC44+RC48+RC50 -> 0
A114: =OFFSET(R164C1,INT((RC26-1)/100),MOD(INT((RC26-1)/10),10),1,1)*10+MOD(RC26-1,10)+1 -> 63 | D114: =IF(AND(RC2<>"NG",OR(RC2<>"",RC3<>"",R9C4="×")),"◯","") ->  | E114: =IF(RC2="◯",RC6,"") ->  | F114: =T(OFFSET('[MiracleNikkiJp_items.csv]MiracleNikkiJp_items'!R10C[-3],RC1,0,1,1)) -> ヘアスタイル | G114: =T(OFFSET('[MiracleNikkiJp_items.csv]MiracleNikkiJp_items'!R10C[-2],RC1,0,1,1)) ->  | H114: =IF(RC4="",0,RC51*RC52+RC53) -> 0 | I114: =RC1 -> 63 | J114: =OFFSET('[MiracleNikkiJp_items.csv]MiracleNikkiJp_items'!R10C[-4],RC1,0,1,1) -> 0 | K114: =T(OFFSET('[MiracleNikkiJp_items.csv]MiracleNikkiJp_items'!R10C[-4],RC1,0,1,1)) ->  | L114: =T(OFFSET('[MiracleNikkiJp_items.csv]MiracleNikkiJp_items'!R10C[-4],RC1,0,1,1)) ->  | M114: =T(OFFSET('[MiracleNikkiJp_items.csv]MiracleNikkiJp_items'!R10C[-4],RC1,0,1,1)) ->  | N114: =T(OFFSET('[MiracleNikkiJp_items.csv]MiracleNikkiJp_items'!R10C[-4],RC1,0,1,1)) ->  | O114: =T(OFFSET('[MiracleNikkiJp_items.csv]MiracleNikkiJp_items'!R10C[-4],RC1,0,1,1)) ->  | P114: =T(OFFSET('[MiracleNikkiJp_items.csv]MiracleNikkiJp_items'!R10C[-4],RC1,0,1,1)) ->  | Q114: =T(OFFSET('[MiracleNikkiJp_items.csv]MiracleNikkiJp_items'!R10C[-4],RC1,0,1,1)) ->  | R114: =T(OFFSET('[MiracleNikkiJp_items.csv]MiracleNikkiJp_items'!R10C[-4],RC1,0,1,1)) ->  | S114: =T(OFFSET('[MiracleNikkiJp_items.csv]MiracleNikkiJp_items'!R10C[-4],RC1,0,1,1)) ->  | T114: =T(OFFSET('[MiracleNikkiJp_items.csv]MiracleNikkiJp_items'!R10C[-4],RC1,0,1,1)) ->  | U114: =T(OFFSET('[MiracleNikkiJp_items.csv]MiracleNikkiJp_items'!R10C[-4],RC1,0,1,1)) ->  | Y114: =T(OFFSET('[MiracleNikkiJp_items.csv]MiracleNikkiJp_items'!R10C[-7],RC1,0,1,1)) ->  | Z114: 63 | AA114: =IFERROR(VLOOKUP(RC[-16],R9C26:R17C36,2,FALSE),0)*R6C -> 0 | AB114: =IFERROR(VLOOKUP(RC[-16],R9C26:R17C36,3,FALSE),0)*R6C -> 0 | AC114: =IFERROR(VLOOKUP(RC[-16],R9C26:R17C36,4,FALSE),0)*R6C -> 0 | AD114: =IFERROR(VLOOKUP(RC[-16],R9C26:R17C36,5,FALSE),0)*R6C -> 0 | AE114: =IFERROR(VLOOKUP(RC[-16],R9C26:R17C36,6,FALSE),0)*R6C -> 0 | AF114: =IFERROR(VLOOKUP(RC[-16],R9C26:R17C36,7,FALSE),0)*R6C -> 0 | AG114: =IFERROR(VLOOKUP(RC[-16],R9C26:R17C36,8,FALSE),0)*R6C -> 0 | AH114: =IFERROR(VLOOKUP(RC[-16],R9C26:R17C36,9,FALSE),0)*R6C -> 0 | AI114: =IFERROR(VLOOKUP(RC[-16],R9C26:R17C36,10,FALSE),0)*R6C -> 0 | AJ114: =IFERROR(VLOOKUP(RC[-16],R9C26:R17C36,11,FALSE),0)*R6C -> 0 | AK114: =VLOOKUP(RC10,R9C38:R17C40,2,FALSE) -> 1 | AL114: =VLOOKUP(RC10,R9C38:R17C40,3,FALSE) -> 0 | AM114: =IF(OR(ISBLANK(R4C7),ISERROR(FIND(R4C7,RC21))),"　","●") ->  | AN114: =IF(OR(ISBLANK(R5C7),ISERROR(FIND(R5C7,RC21))),"　","●") ->  | AO114: =IF(RC39<>"●",VLOOKUP("評価しない",R9C42:R17C44,2,FALSE),VLOOKUP(R4C8,R9C42:R17C44,2,FALSE)) -> 1 | AP114: =IF(RC39<>"●",VLOOKUP("",R9C42:R17C44,3,FALSE),VLOOKUP(R4C8,R9C42:R17C44,3,FALSE)) -> 0 | AQ114: =IF(RC40<>"●",VLOOKUP("評価しない",R9C42:R17C44,2,FALSE),VLOOKUP(R5C8,R9C42:R17C44,2,FALSE)) -> 1 | AR114: =IF(RC40<>"●",VLOOKUP("",R9C42:R17C44,3,FALSE),VLOOKUP(R5C8,R9C42:R17C44,3,FALSE)) -> 0 | AS114: =IF(OR(ISBLANK(R6C7),ISERROR(FIND(R6C7,RC25))),"　","●") ->  | AT114: =IF(OR(ISBLANK(R7C7),ISERROR(FIND(R7C7,RC25))),"　","●") ->  | AU114: =IF(RC45<>"●",VLOOKUP("評価しない",R9C46:R17C48,2,FALSE),VLOOKUP(R6C8,R9C46:R17C48,2,FALSE)) -> 1 | AV114: =IF(RC45<>"●",VLOOKUP("",R9C46:R17C48,3,FALSE),VLOOKUP(R6C8,R9C46:R17C48,3,FALSE)) -> 0 | AW114: =IF(RC46<>"●",VLOOKUP("評価しない",R9C46:R17C48,2,FALSE),VLOOKUP(R7C8,R9C46:R17C48,2,FALSE)) -> 1 | AX114: =IF(RC46<>"●",VLOOKUP("",R9C46:R17C48,3,FALSE),VLOOKUP(R7C8,R9C46:R17C48,3,FALSE)) -> 0 | AY114: =SUM(RC27:RC36) -> 0 | AZ114: =RC37*RC41*RC43*RC47*RC49 -> 1 | BA114: =RC38+RC42+RC44+RC48+RC50 -> 0
A115: =OFFSET(R164C1,INT((RC26-1)/100),MOD(INT((RC26-1)/10),10),1,1)*10+MOD(RC26-1,10)+1 -> 64 | D115: =IF(AND(RC2<>"NG",OR(RC2<>"",RC3<>"",R9C4="×")),"◯","") ->  | E115: =IF(RC2="◯",RC6,"") ->  | F115: =T(OFFSET('[MiracleNikkiJp_items.csv]MiracleNikkiJp_items'!R10C[-3],RC1,0,1,1)) -> ヘアスタイル | G115: =T(OFFSET('[MiracleNikkiJp_items.csv]MiracleNikkiJp_items'!R10C[-2],RC1,0,1,1)) ->  | H115: =IF(RC4="",0,RC51*RC52+RC53) -> 0 | I115: =RC1 -> 64 | J115: =OFFSET('[MiracleNikkiJp_items.csv]MiracleNikkiJp_items'!R10C[-4],RC1,0,1,1) -> 0 | K115: =T(OFFSET('[MiracleNikkiJp_items.csv]MiracleNikkiJp_items'!R10C[-4],RC1,0,1,1)) ->  | L115: =T(OFFSET('[MiracleNikkiJp_items.csv]MiracleNikkiJp_items'!R10C[-4],RC1,0,1,1)) ->  | M115: =T(OFFSET('[MiracleNikkiJp_items.csv]MiracleNikkiJp_items'!R10C[-4],RC1,0,1,1)) ->  | N115: =T(OFFSET('[MiracleNikkiJp_items.csv]MiracleNikkiJp_items'!R10C[-4],RC1,0,1,1)) ->  | O115: =T(OFFSET('[MiracleNikkiJp_items.csv]MiracleNikkiJp_items'!R10C[-4],RC1,0,1,1)) ->  | P115: =T(OFFSET('[MiracleNikkiJp_items.csv]MiracleNikkiJp_items'!R10C[-4],RC1,0,1,1)) ->  | Q115: =T(OFFSET('[MiracleNikkiJp_items.csv]MiracleNikkiJp_items'!R10C[-4],RC1,0,1,1)) ->  | R115: =T(OFFSET('[MiracleNikkiJp_items.csv]MiracleNikkiJp_items'!R10C[-4],RC1,0,1,1)) ->  | S115: =T(OFFSET('[MiracleNikkiJp_items.csv]MiracleNikkiJp_items'!R10C[-4],RC1,0,1,1)) ->  | T115: =T(OFFSET('[MiracleNikkiJp_items.csv]MiracleNikkiJp_items'!R10C[-4],RC1,0,1,1)) ->  | U115: =T(OFFSET('[MiracleNikkiJp_items.csv]MiracleNikkiJp_items'!R10C[-4],RC1,0,1,1)) ->  | Y115: =T(OFFSET('[MiracleNikkiJp_items.csv]MiracleNikkiJp_items'!R10C[-7],RC1,0,1,1)) ->  | Z115: 64 | AA115: =IFERROR(VLOOKUP(RC[-16],R9C26:R17C36,2,FALSE),0)*R6C -> 0 | AB115: =IFERROR(VLOOKUP(RC[-16],R9C26:R17C36,3,FALSE),0)*R6C -> 0 | AC115: =IFERROR(VLOOKUP(RC[-16],R9C26:R17C36,4,FALSE),0)*R6C -> 0 | AD115: =IFERROR(VLOOKUP(RC[-16],R9C26:R17C36,5,FALSE),0)*R6C -> 0 | AE115: =IFERROR(VLOOKUP(RC[-16],R9C26:R17C36,6,FALSE),0)*R6C -> 0 | AF115: =IFERROR(VLOOKUP(RC[-16],R9C26:R17C36,7,FALSE),0)*R6C -> 0 | AG115: =IFERROR(VLOOKUP(RC[-16],R9C26:R17C36,8,FALSE),0)*R6C -> 0 | AH115: =IFERROR(VLOOKUP(RC[-16],R9C26:R17C36,9,FALSE),0)*R6C -> 0 | AI115: =IFERROR(VLOOKUP(RC[-16],R9C26:R17C36,10,FALSE),0)*R6C -> 0 | AJ115: =IFERROR(VLOOKUP(RC[-16],R9C26:R17C36,11,FALSE),0)*R6C -> 0 | AK115: =VLOOKUP(RC10,R9C38:R17C40,2,FALSE) -> 1 | AL115: =VLOOKUP(RC10,R9C38:R17C40,3,FALSE) -> 0 | AM115: =IF(OR(ISBLANK(R4C7),ISERROR(FIND(R4C7,RC21))),"　","●") ->  | AN115: =IF(OR(ISBLANK(R5C7),ISERROR(FIND(R5C7,RC21))),"　","●") ->  | AO115: =IF(RC39<>"●",VLOOKUP("評価しない",R9C42:R17C44,2,FALSE),VLOOKUP(R4C8,R9C42:R17C44,2,FALSE)) -> 1 | AP115: =IF(RC39<>"●",VLOOKUP("",R9C42:R17C44,3,FALSE),VLOOKUP(R4C8,R9C42:R17C44,3,FALSE)) -> 0 | AQ115: =IF(RC40<>"●",VLOOKUP("評価しない",R9C42:R17C44,2,FALSE),VLOOKUP(R5C8,R9C42:R17C44,2,FALSE)) -> 1 | AR115: =IF(RC40<>"●",VLOOKUP("",R9C42:R17C44,3,FALSE),VLOOKUP(R5C8,R9C42:R17C44,3,FALSE)) -> 0 | AS115: =IF(OR(ISBLANK(R6C7),ISERROR(FIND(R6C7,RC25))),"　","●") ->  | AT115: =IF(OR(ISBLANK(R7C7),ISERROR(FIND(R7C7,RC25))),"　","●") ->  | AU115: =IF(RC45<>"●",VLOOKUP("評価しない",R9C46:R17C48,2,FALSE),VLOOKUP(R6C8,R9C46:R17C48,2,FALSE)) -> 1 | AV115: =IF(RC45<>"●",VLOOKUP("",R9C46:R17C48,3,FALSE),VLOOKUP(R6C8,R9C46:R17C48,3,FALSE)) -> 0 | AW115: =IF(RC46<>"●",VLOOKUP("評価しない",R9C46:R17C48,2,FALSE),VLOOKUP(R7C8,R9C46:R17C48,2,FALSE)) -> 1 | AX115: =IF(RC46<>"●",VLOOKUP("",R9C46:R17C48,3,FALSE),VLOOKUP(R7C8,R9C46:R17C48,3,FALSE)) -> 0 | AY115: =SUM(RC27:RC36) -> 0 | AZ115: =RC37*RC41*RC43*RC47*RC49 -> 1 | BA115: =RC38+RC42+RC44+RC48+RC50 -> 0
A116: =OFFSET(R164C1,INT((RC26-1)/100),MOD(INT((RC26-1)/10),10),1,1)*10+MOD(RC26-1,10)+1 -> 65 | D116: =IF(AND(RC2<>"NG",OR(RC2<>"",RC3<>"",R9C4="×")),"◯","") ->  | E116: =IF(RC2="◯",RC6,"") ->  | F116: =T(OFFSET('[MiracleNikkiJp_items.csv]MiracleNikkiJp_items'!R10C[-3],RC1,0,1,1)) -> ヘアスタイル | G116: =T(OFFSET('[MiracleNikkiJp_items.csv]MiracleNikkiJp_items'!R10C[-2],RC1,0,1,1)) ->  | H116: =IF(RC4="",0,RC51*RC52+RC53) -> 0 | I116: =RC1 -> 65 | J116: =OFFSET('[MiracleNikkiJp_items.csv]MiracleNikkiJp_items'!R10C[-4],RC1,0,1,1) -> 0 | K116: =T(OFFSET('[MiracleNikkiJp_items.csv]MiracleNikkiJp_items'!R10C[-4],RC1,0,1,1)) ->  | L116: =T(OFFSET('[MiracleNikkiJp_items.csv]MiracleNikkiJp_items'!R10C[-4],RC1,0,1,1)) ->  | M116: =T(OFFSET('[MiracleNikkiJp_items.csv]MiracleNikkiJp_items'!R10C[-4],RC1,0,1,1)) ->  | N116: =T(OFFSET('[MiracleNikkiJp_items.csv]MiracleNikkiJp_items'!R10C[-4],RC1,0,1,1)) ->  | O116: =T(OFFSET('[MiracleNikkiJp_items.csv]MiracleNikkiJp_items'!R10C[-4],RC1,0,1,1)) ->  | P116: =T(OFFSET('[MiracleNikkiJp_items.csv]MiracleNikkiJp_items'!R10C[-4],RC1,0,1,1)) ->  | Q116: =T(OFFSET('[MiracleNikkiJp_items.csv]MiracleNikkiJp_items'!R10C[-4],RC1,0,1,1)) ->  | R116: =T(OFFSET('[MiracleNikkiJp_items.csv]MiracleNikkiJp_items'!R10C[-4],RC1,0,1,1)) ->  | S116: =T(OFFSET('[MiracleNikkiJp_items.csv]MiracleNikkiJp_items'!R10C[-4],RC1,0,1,1)) ->  | T116: =T(OFFSET('[MiracleNikkiJp_items.csv]MiracleNikkiJp_items'!R10C[-4],RC1,0,1,1)) ->  | U116: =T(OFFSET('[MiracleNikkiJp_items.csv]MiracleNikkiJp_items'!R10C[-4],RC1,0,1,1)) ->  | Y116: =T(OFFSET('[MiracleNikkiJp_items.csv]MiracleNikkiJp_items'!R10C[-7],RC1,0,1,1)) ->  | Z116: 65 | AA116: =IFERROR(VLOOKUP(RC[-16],R9C26:R17C36,2,FALSE),0)*R6C -> 0 | AB116: =IFERROR(VLOOKUP(RC[-16],R9C26:R17C36,3,FALSE),0)*R6C -> 0 | AC116: =IFERROR(VLOOKUP(RC[-16],R9C26:R17C36,4,FALSE),0)*R6C -> 0 | AD116: =IFERROR(VLOOKUP(RC[-16],R9C26:R17C36,5,FALSE),0)*R6C -> 0 | AE116: =IFERROR(VLOOKUP(RC[-16],R9C26:R17C36,6,FALSE),0)*R6C -> 0 | AF116: =IFERROR(VLOOKUP(RC[-16],R9C26:R17C36,7,FALSE),0)*R6C -> 0 | AG116: =IFERROR(VLOOKUP(RC[-16],R9C26:R17C36,8,FALSE),0)*R6C -> 0 | AH116: =IFERROR(VLOOKUP(RC[-16],R9C26:R17C36,9,FALSE),0)*R6C -> 0 | AI116: =IFERROR(VLOOKUP(RC[-16],R9C26:R17C36,10,FALSE),0)*R6C -> 0 | AJ116: =IFERROR(VLOOKUP(RC[-16],R9C26:R17C36,11,FALSE),0)*R6C -> 0 | AK116: =VLOOKUP(RC10,R9C38:R17C40,2,FALSE) -> 1 | AL116: =VLOOKUP(RC10,R9C38:R17C40,3,FALSE) -> 0 | AM116: =IF(OR(ISBLANK(R4C7),ISERROR(FIND(R4C7,RC21))),"　","●") ->  | AN116: =IF(OR(ISBLANK(R5C7),ISERROR(FIND(R5C7,RC21))),"　","●") ->  | AO116: =IF(RC39<>"●",VLOOKUP("評価しない",R9C42:R17C44,2,FALSE),VLOOKUP(R4C8,R9C42:R17C44,2,FALSE)) -> 1 | AP116: =IF(RC39<>"●",VLOOKUP("",R9C42:R17C44,3,FALSE),VLOOKUP(R4C8,R9C42:R17C44,3,FALSE)) -> 0 | AQ116: =IF(RC40<>"●",VLOOKUP("評価しない",R9C42:R17C44,2,FALSE),VLOOKUP(R5C8,R9C42:R17C44,2,FALSE)) -> 1 | AR116: =IF(RC40<>"●",VLOOKUP("",R9C42:R17C44,3,FALSE),VLOOKUP(R5C8,R9C42:R17C44,3,FALSE)) -> 0 | AS116: =IF(OR(ISBLANK(R6C7),ISERROR(FIND(R6C7,RC25))),"　","●") ->  | AT116: =IF(OR(ISBLANK(R7C7),ISERROR(FIND(R7C7,RC25))),"　","●") ->  | AU116: =IF(RC45<>"●",VLOOKUP("評価しない",R9C46:R17C48,2,FALSE),VLOOKUP(R6C8,R9C46:R17C48,2,FALSE)) -> 1 | AV116: =IF(RC45<>"●",VLOOKUP("",R9C46:R17C48,3,FALSE),VLOOKUP(R6C8,R9C46:R17C48,3,FALSE)) -> 0 | AW116: =IF(RC46<>"●",VLOOKUP("評価しない",R9C46:R17C48,2,FALSE),VLOOKUP(R7C8,R9C46:R17C48,2,FALSE)) -> 1 | AX116: =IF(RC46<>"●",VLOOKUP("",R9C46:R17C48,3,FALSE),VLOOKUP(R7C8,R9C46:R17C48,3,FALSE)) -> 0 | AY116: =SUM(RC27:RC36) -> 0 | AZ116: =RC37*RC41*RC43*RC47*RC49 -> 1 | BA116: =RC38+RC42+RC44+RC48+RC50 -> 0
A117: =OFFSET(R164C1,INT((RC26-1)/100),MOD(INT((RC26-1)/10),10),1,1)*10+MOD(RC26-1,10)+1 -> 66 | D117: =IF(AND(RC2<>"NG",OR(RC2<>"",RC3<>"",R9C4="×")),"◯","") ->  | E117: =IF(RC2="◯",RC6,"") ->  | F117: =T(OFFSET('[MiracleNikkiJp_items.csv]MiracleNikkiJp_items'!R10C[-3],RC1,0,1,1)) -> ヘアスタイル | G117: =T(OFFSET('[MiracleNikkiJp_items.csv]MiracleNikkiJp_items'!R10C[-2],RC1,0,1,1)) ->  | H117: =IF(RC4="",0,RC51*RC52+RC53) -> 0 | I117: =RC1 -> 66 | J117: =OFFSET('[MiracleNikkiJp_items.csv]MiracleNikkiJp_items'!R10C[-4],RC1,0,1,1) -> 0 | K117: =T(OFFSET('[MiracleNikkiJp_items.csv]MiracleNikkiJp_items'!R10C[-4],RC1,0,1,1)) ->  | L117: =T(OFFSET('[MiracleNikkiJp_items.csv]MiracleNikkiJp_items'!R10C[-4],RC1,0,1,1)) ->  | M117: =T(OFFSET('[MiracleNikkiJp_items.csv]MiracleNikkiJp_items'!R10C[-4],RC1,0,1,1)) ->  | N117: =T(OFFSET('[MiracleNikkiJp_items.csv]MiracleNikkiJp_items'!R10C[-4],RC1,0,1,1)) ->  | O117: =T(OFFSET('[MiracleNikkiJp_items.csv]MiracleNikkiJp_items'!R10C[-4],RC1,0,1,1)) ->  | P117: =T(OFFSET('[MiracleNikkiJp_items.csv]MiracleNikkiJp_items'!R10C[-4],RC1,0,1,1)) ->  | Q117: =T(OFFSET('[MiracleNikkiJp_items.csv]MiracleNikkiJp_items'!R10C[-4],RC1,0,1,1)) ->  | R117: =T(OFFSET('[MiracleNikkiJp_items.csv]MiracleNikkiJp_items'!R10C[-4],RC1,0,1,1)) ->  | S117: =T(OFFSET('[MiracleNikkiJp_items.csv]MiracleNikkiJp_items'!R10C[-4],RC1,0,1,1)) ->  | T117: =T(OFFSET('[MiracleNikkiJp_items.csv]MiracleNikkiJp_items'!R10C[-4],RC1,0,1,1)) ->  | U117: =T(OFFSET('[MiracleNikkiJp_items.csv]MiracleNikkiJp_items'!R10C[-4],RC1,0,1,1)) ->  | Y117: =T(OFFSET('[MiracleNikkiJp_items.csv]MiracleNikkiJp_items'!R10C[-7],RC1,0,1,1)) ->  | Z117: 66 | AA117: =IFERROR(VLOOKUP(RC[-16],R9C26:R17C36,2,FALSE),0)*R6C -> 0 | AB117: =IFERROR(VLOOKUP(RC[-16],R9C26:R17C36,3,FALSE),0)*R6C -> 0 | AC117: =IFERROR(VLOOKUP(RC[-16],R9C26:R17C36,4,FALSE),0)*R6C -> 0 | AD117: =IFERROR(VLOOKUP(RC[-16],R9C26:R17C36,5,FALSE),0)*R6C -> 0 | AE117: =IFERROR(VLOOKUP(RC[-16],R9C26:R17C36,6,FALSE),0)*R6C -> 0 | AF117: =IFERROR(VLOOKUP(RC[-16],R9C26:R17C36,7,FALSE),0)*R6C -> 0 | AG117: =IFERROR(VLOOKUP(RC[-16],R9C26:R17C36,8,FALSE),0)*R6C -> 0 | AH117: =IFERROR(VLOOKUP(RC[-16],R9C26:R17C36,9,FALSE),0)*R6C -> 0 | AI117: =IFERROR(VLOOKUP(RC[-16],R9C26:R17C36,10,FALSE),0)*R6C -> 0 | AJ117: =IFERROR(VLOOKUP(RC[-16],R9C26:R17C36,11,FALSE),0)*R6C -> 0 | AK117: =VLOOKUP(RC10,R9C38:R17C40,2,FALSE) -> 1 | AL117: =VLOOKUP(RC10,R9C38:R17C40,3,FALSE) -> 0 | AM117: =IF(OR(ISBLANK(R4C7),ISERROR(FIND(R4C7,RC21))),"　","●") ->  | AN117: =IF(OR(ISBLANK(R5C7),ISERROR(FIND(R5C7,RC21))),"　","●") ->  | AO117: =IF(RC39<>"●",VLOOKUP("評価しない",R9C42:R17C44,2,FALSE),VLOOKUP(R4C8,R9C42:R17C44,2,FALSE)) -> 1 | AP117: =IF(RC39<>"●",VLOOKUP("",R9C42:R17C44,3,FALSE),VLOOKUP(R4C8,R9C42:R17C44,3,FALSE)) -> 0 | AQ117: =IF(RC40<>"●",VLOOKUP("評価しない",R9C42:R17C44,2,FALSE),VLOOKUP(R5C8,R9C42:R17C44,2,FALSE)) -> 1 | AR117: =IF(RC40<>"●",VLOOKUP("",R9C42:R17C44,3,FALSE),VLOOKUP(R5C8,R9C42:R17C44,3,FALSE)) -> 0 | AS117: =IF(OR(ISBLANK(R6C7),ISERROR(FIND(R6C7,RC25))),"　","●") ->  | AT117: =IF(OR(ISBLANK(R7C7),ISERROR(FIND(R7C7,RC25))),"　","●") ->  | AU117: =IF(RC45<>"●",VLOOKUP("評価しない",R9C46:R17C48,2,FALSE),VLOOKUP(R6C8,R9C46:R17C48,2,FALSE)) -> 1 | AV117: =IF(RC45<>"●",VLOOKUP("",R9C46:R17C48,3,FALSE),VLOOKUP(R6C8,R9C46:R17C48,3,FALSE)) -> 0 | AW117: =IF(RC46<>"●",VLOOKUP("評価しない",R9C46:R17C48,2,FALSE),VLOOKUP(R7C8,R9C46:R17C48,2,FALSE)) -> 1 | AX117: =IF(RC46<>"●",VLOOKUP("",R9C46:R17C48,3,FALSE),VLOOKUP(R7C8,R9C46:R17C48,3,FALSE)) -> 0 | AY117: =SUM(RC27:RC36) -> 0 | AZ117: =RC37*RC41*RC43*RC47*RC49 -> 1 | BA117: =RC38+RC42+RC44+RC48+RC50 -> 0
A118: =OFFSET(R164C1,INT((RC26-1)/100),MOD(INT((RC26-1)/10),10),1,1)*10+MOD(RC26-1,10)+1 -> 67 | D118: =IF(AND(RC2<>"NG",OR(RC2<>"",RC3<>"",R9C4="×")),"◯","") ->  | E118: =IF(RC2="◯",RC6,"") ->  | F118: =T(OFFSET('[MiracleNikkiJp_items.csv]MiracleNikkiJp_items'!R10C[-3],RC1,0,1,1)) -> ヘアスタイル | G118: =T(OFFSET('[MiracleNikkiJp_items.csv]MiracleNikkiJp_items'!R10C[-2],RC1,0,1,1)) ->  | H118: =IF(RC4="",0,RC51*RC52+RC53) -> 0 | I118: =RC1 -> 67 | J118: =OFFSET('[MiracleNikkiJp_items.csv]MiracleNikkiJp_items'!R10C[-4],RC1,0,1,1) -> 0 | K118: =T(OFFSET('[MiracleNikkiJp_items.csv]MiracleNikkiJp_items'!R10C[-4],RC1,0,1,1)) ->  | L118: =T(OFFSET('[MiracleNikkiJp_items.csv]MiracleNikkiJp_items'!R10C[-4],RC1,0,1,1)) ->  | M118: =T(OFFSET('[MiracleNikkiJp_items.csv]MiracleNikkiJp_items'!R10C[-4],RC1,0,1,1)) ->  | N118: =T(OFFSET('[MiracleNikkiJp_items.csv]MiracleNikkiJp_items'!R10C[-4],RC1,0,1,1)) ->  | O118: =T(OFFSET('[MiracleNikkiJp_items.csv]MiracleNikkiJp_items'!R10C[-4],RC1,0,1,1)) ->  | P118: =T(OFFSET('[MiracleNikkiJp_items.csv]MiracleNikkiJp_items'!R10C[-4],RC1,0,1,1)) ->  | Q118: =T(OFFSET('[MiracleNikkiJp_items.csv]MiracleNikkiJp_items'!R10C[-4],RC1,0,1,1)) ->  | R118: =T(OFFSET('[MiracleNikkiJp_items.csv]MiracleNikkiJp_items'!R10C[-4],RC1,0,1,1)) ->  | S118: =T(OFFSET('[MiracleNikkiJp_items.csv]MiracleNikkiJp_items'!R10C[-4],RC1,0,1,1)) ->  | T118: =T(OFFSET('[MiracleNikkiJp_items.csv]MiracleNikkiJp_items'!R10C[-4],RC1,0,1,1)) ->  | U118: =T(OFFSET('[MiracleNikkiJp_items.csv]MiracleNikkiJp_items'!R10C[-4],RC1,0,1,1)) ->  | Y118: =T(OFFSET('[MiracleNikkiJp_items.csv]MiracleNikkiJp_items'!R10C[-7],RC1,0,1,1)) ->  | Z118: 67 | AA118: =IFERROR(VLOOKUP(RC[-16],R9C26:R17C36,2,FALSE),0)*R6C -> 0 | AB118: =IFERROR(VLOOKUP(RC[-16],R9C26:R17C36,3,FALSE),0)*R6C -> 0 | AC118: =IFERROR(VLOOKUP(RC[-16],R9C26:R17C36,4,FALSE),0)*R6C -> 0 | AD118: =IFERROR(VLOOKUP(RC[-16],R9C26:R17C36,5,FALSE),0)*R6C -> 0 | AE118: =IFERROR(VLOOKUP(RC[-16],R9C26:R17C36,6,FALSE),0)*R6C -> 0 | AF118: =IFERROR(VLOOKUP(RC[-16],R9C26:R17C36,7,FALSE),0)*R6C -> 0 | AG118: =IFERROR(VLOOKUP(RC[-16],R9C26:R17C36,8,FALSE),0)*R6C -> 0 | AH118: =IFERROR(VLOOKUP(RC[-16],R9C26:R17C36,9,FALSE),0)*R6C -> 0 | AI118: =IFERROR(VLOOKUP(RC[-16],R9C26:R17C36,10,FALSE),0)*R6C -> 0 | AJ118: =IFERROR(VLOOKUP(RC[-16],R9C26:R17C36,11,FALSE),0)*R6C -> 0 | AK118: =VLOOKUP(RC10,R9C38:R17C40,2,FALSE) -> 1 | AL118: =VLOOKUP(RC10,R9C38:R17C40,3,FALSE) -> 0 | AM118: =IF(OR(ISBLANK(R4C7),ISERROR(FIND(R4C7,RC21))),"　","●") ->  | AN118: =IF(OR(ISBLANK(R5C7),ISERROR(FIND(R5C7,RC21))),"　","●") ->  | AO118: =IF(RC39<>"●",VLOOKUP("評価しない",R9C42:R17C44,2,FALSE),VLOOKUP(R4C8,R9C42:R17C44,2,FALSE)) -> 1 | AP118: =IF(RC39<>"●",VLOOKUP("",R9C42:R17C44,3,FALSE),VLOOKUP(R4C8,R9C42:R17C44,3,FALSE)) -> 0 | AQ118: =IF(RC40<>"●",VLOOKUP("評価しない",R9C42:R17C44,2,FALSE),VLOOKUP(R5C8,R9C42:R17C44,2,FALSE)) -> 1 | AR118: =IF(RC40<>"●",VLOOKUP("",R9C42:R17C44,3,FALSE),VLOOKUP(R5C8,R9C42:R17C44,3,FALSE)) -> 0 | AS118: =IF(OR(ISBLANK(R6C7),ISERROR(FIND(R6C7,RC25))),"　","●") ->  | AT118: =IF(OR(ISBLANK(R7C7),ISERROR(FIND(R7C7,RC25))),"　","●") ->  | AU118: =IF(RC45<>"●",VLOOKUP("評価しない",R9C46:R17C48,2,FALSE),VLOOKUP(R6C8,R9C46:R17C48,2,FALSE)) -> 1 | AV118: =IF(RC45<>"●",VLOOKUP("",R9C46:R17C48,3,FALSE),VLOOKUP(R6C8,R9C46:R17C48,3,FALSE)) -> 0 | AW118: =IF(RC46<>"●",VLOOKUP("評価しない",R9C46:R17C48,2,FALSE),VLOOKUP(R7C8,R9C46:R17C48,2,FALSE)) -> 1 | AX118: =IF(RC46<>"●",VLOOKUP("",R9C46:R17C48,3,FALSE),VLOOKUP(R7C8,R9C46:R17C48,3,FALSE)) -> 0 | AY118: =SUM(RC27:RC36) -> 0 | AZ118: =RC37*RC41*RC43*RC47*RC49 -> 1 | BA118: =RC38+RC42+RC44+RC48+RC50 -> 0
A119: =OFFSET(R164C1,INT((RC26-1)/100),MOD(INT((RC26-1)/10),10),1,1)*10+MOD(RC26-1,10)+1 -> 68 | D119: =IF(AND(RC2<>"NG",OR(RC2<>"",RC3<>"",R9C4="×")),"◯","") ->  | E119: =IF(RC2="◯",RC6,"") ->  | F119: =T(OFFSET('[MiracleNikkiJp_items.csv]MiracleNikkiJp_items'!R10C[-3],RC1,0,1,1)) -> ヘアスタイル | G119: =T(OFFSET('[MiracleNikkiJp_items.csv]MiracleNikkiJp_items'!R10C[-2],RC1,0,1,1)) ->  | H119: =IF(RC4="",0,RC51*RC52+RC53) -> 0 | I119: =RC1 -> 68 | J119: =OFFSET('[MiracleNikkiJp_items.csv]MiracleNikkiJp_items'!R10C[-4],RC1,0,1,1) -> 0 | K119: =T(OFFSET('[MiracleNikkiJp_items.csv]MiracleNikkiJp_items'!R10C[-4],RC1,0,1,1)) ->  | L119: =T(OFFSET('[MiracleNikkiJp_items.csv]MiracleNikkiJp_items'!R10C[-4],RC1,0,1,1)) ->  | M119: =T(OFFSET('[MiracleNikkiJp_items.csv]MiracleNikkiJp_items'!R10C[-4],RC1,0,1,1)) ->  | N119: =T(OFFSET('[MiracleNikkiJp_items.csv]MiracleNikkiJp_items'!R10C[-4],RC1,0,1,1)) ->  | O119: =T(OFFSET('[MiracleNikkiJp_items.csv]MiracleNikkiJp_items'!R10C[-4],RC1,0,1,1)) ->  | P119: =T(OFFSET('[MiracleNikkiJp_items.csv]MiracleNikkiJp_items'!R10C[-4],RC1,0,1,1)) ->  | Q119: =T(OFFSET('[MiracleNikkiJp_items.csv]MiracleNikkiJp_items'!R10C[-4],RC1,0,1,1)) ->  | R119: =T(OFFSET('[MiracleNikkiJp_items.csv]MiracleNikkiJp_items'!R10C[-4],RC1,0,1,1)) ->  | S119: =T(OFFSET('[MiracleNikkiJp_items.csv]MiracleNikkiJp_items'!R10C[-4],RC1,0,1,1)) ->  | T119: =T(OFFSET('[MiracleNikkiJp_items.csv]MiracleNikkiJp_items'!R10C[-4],RC1,0,1,1)) ->  | U119: =T(OFFSET('[MiracleNikkiJp_items.csv]MiracleNikkiJp_items'!R10C[-4],RC1,0,1,1)) ->  | Y119: =T(OFFSET('[MiracleNikkiJp_items.csv]MiracleNikkiJp_items'!R10C[-7],RC1,0,1,1)) ->  | Z119: 68 | AA119: =IFERROR(VLOOKUP(RC[-16],R9C26:R17C36,2,FALSE),0)*R6C -> 0 | AB119: =IFERROR(VLOOKUP(RC[-16],R9C26:R17C36,3,FALSE),0)*R6C -> 0 | AC119: =IFERROR(VLOOKUP(RC[-16],R9C26:R17C36,4,FALSE),0)*R6C -> 0 | AD119: =IFERROR(VLOOKUP(RC[-16],R9C26:R17C36,5,FALSE),0)*R6C -> 0 | AE119: =IFERROR(VLOOKUP(RC[-16],R9C26:R17C36,6,FALSE),0)*R6C -> 0 | AF119: =IFERROR(VLOOKUP(RC[-16],R9C26:R17C36,7,FALSE),0)*R6C -> 0 | AG119: =IFERROR(VLOOKUP(RC[-16],R9C26:R17C36,8,FALSE),0)*R6C -> 0 | AH119: =IFERROR(VLOOKUP(RC[-16],R9C26:R17C36,9,FALSE),0)*R6C -> 0 | AI119: =IFERROR(VLOOKUP(RC[-16],R9C26:R17C36,10,FALSE),0)*R6C -> 0 | AJ119: =IFERROR(VLOOKUP(RC[-16],R9C26:R17C36,11,FALSE),0)*R6C -> 0 | AK119: =VLOOKUP(RC10,R9C38:R17C40,2,FALSE) -> 1 | AL119: =VLOOKUP(RC10,R9C38:R17C40,3,FALSE) -> 0 | AM119: =IF(OR(ISBLANK(R4C7),ISERROR(FIND(R4C7,RC21))),"　","●") ->  | AN119: =IF(OR(ISBLANK(R5C7),ISERROR(FIND(R5C7,RC21))),"　","●") ->  | AO119: =IF(RC39<>"●",VLOOKUP("評価しない",R9C42:R17C44,2,FALSE),VLOOKUP(R4C8,R9C42:R17C44,2,FALSE)) -> 1 | AP119: =IF(RC39<>"●",VLOOKUP("",R9C42:R17C44,3,FALSE),VLOOKUP(R4C8,R9C42:R17C44,3,FALSE)) -> 0 | AQ119: =IF(RC40<>"●",VLOOKUP("評価しない",R9C42:R17C44,2,FALSE),VLOOKUP(R5C8,R9C42:R17C44,2,FALSE)) -> 1 | AR119: =IF(RC40<>"●",VLOOKUP("",R9C42:R17C44,3,FALSE),VLOOKUP(R5C8,R9C42:R17C44,3,FALSE)) -> 0 | AS119: =IF(OR(ISBLANK(R6C7),ISERROR(FIND(R6C7,RC25))),"　","●") ->  | AT119: =IF(OR(ISBLANK(R7C7),ISERROR(FIND(R7C7,RC25))),"　","●") ->  | AU119: =IF(RC45<>"●",VLOOKUP("評価しない",R9C46:R17C48,2,FALSE),VLOOKUP(R6C8,R9C46:R17C48,2,FALSE)) -> 1 | AV119: =IF(RC45<>"●",VLOOKUP("",R9C46:R17C48,3,FALSE),VLOOKUP(R6C8,R9C46:R17C48,3,FALSE)) -> 0 | AW119: =IF(RC46<>"●",VLOOKUP("評価しない",R9C46:R17C48,2,FALSE),VLOOKUP(R7C8,R9C46:R17C48,2,FALSE)) -> 1 | AX119: =IF(RC46<>"●",VLOOKUP("",R9C46:R17C48,3,FALSE),VLOOKUP(R7C8,R9C46:R17C48,3,FALSE)) -> 0 | AY119: =SUM(RC27:RC36) -> 0 | AZ119: =RC37*RC41*RC43*RC47*RC49 -> 1 | BA119: =RC38+RC42+RC44+RC48+RC50 -> 0
A120: =OFFSET(R164C1,INT((RC26-1)/100),MOD(INT((RC26-1)/10),10),1,1)*10+MOD(RC26-1,10)+1 -> 69 | D120: =IF(AND(RC2<>"NG",OR(RC2<>"",RC3<>"",R9C4="×")),"◯","") ->  | E120: =IF(RC2="◯",RC6,"") ->  | F120: =T(OFFSET('[MiracleNikkiJp_items.csv]MiracleNikkiJp_items'!R10C[-3],RC1,0,1,1)) -> ヘアスタイル | G120: =T(OFFSET('[MiracleNikkiJp_items.csv]MiracleNikkiJp_items'!R10C[-2],RC1,0,1,1)) ->  | H120: =IF(RC4="",0,RC51*RC52+RC53) -> 0 | I120: =RC1 -> 69 | J120: =OFFSET('[MiracleNikkiJp_items.csv]MiracleNikkiJp_items'!R10C[-4],RC1,0,1,1) -> 0 | K120: =T(OFFSET('[MiracleNikkiJp_items.csv]MiracleNikkiJp_items'!R10C[-4],RC1,0,1,1)) ->  | L120: =T(OFFSET('[MiracleNikkiJp_items.csv]MiracleNikkiJp_items'!R10C[-4],RC1,0,1,1)) ->  | M120: =T(OFFSET('[MiracleNikkiJp_items.csv]MiracleNikkiJp_items'!R10C[-4],RC1,0,1,1)) ->  | N120: =T(OFFSET('[MiracleNikkiJp_items.csv]MiracleNikkiJp_items'!R10C[-4],RC1,0,1,1)) ->  | O120: =T(OFFSET('[MiracleNikkiJp_items.csv]MiracleNikkiJp_items'!R10C[-4],RC1,0,1,1)) ->  | P120: =T(OFFSET('[MiracleNikkiJp_items.csv]MiracleNikkiJp_items'!R10C[-4],RC1,0,1,1)) ->  | Q120: =T(OFFSET('[MiracleNikkiJp_items.csv]MiracleNikkiJp_items'!R10C[-4],RC1,0,1,1)) ->  | R120: =T(OFFSET('[MiracleNikkiJp_items.csv]MiracleNikkiJp_items'!R10C[-4],RC1,0,1,1)) ->  | S120: =T(OFFSET('[MiracleNikkiJp_items.csv]MiracleNikkiJp_items'!R10C[-4],RC1,0,1,1)) ->  | T120: =T(OFFSET('[MiracleNikkiJp_items.csv]MiracleNikkiJp_items'!R10C[-4],RC1,0,1,1)) ->  | U120: =T(OFFSET('[MiracleNikkiJp_items.csv]MiracleNikkiJp_items'!R10C[-4],RC1,0,1,1)) ->  | Y120: =T(OFFSET('[MiracleNikkiJp_items.csv]MiracleNikkiJp_items'!R10C[-7],RC1,0,1,1)) ->  | Z120: 69 | AA120: =IFERROR(VLOOKUP(RC[-16],R9C26:R17C36,2,FALSE),0)*R6C -> 0 | AB120: =IFERROR(VLOOKUP(RC[-16],R9C26:R17C36,3,FALSE),0)*R6C -> 0 | AC120: =IFERROR(VLOOKUP(RC[-16],R9C26:R17C36,4,FALSE),0)*R6C -> 0 | AD120: =IFERROR(VLOOKUP(RC[-16],R9C26:R17C36,5,FALSE),0)*R6C -> 0 | AE120: =IFERROR(VLOOKUP(RC[-16],R9C26:R17C36,6,FALSE),0)*R6C -> 0 | AF120: =IFERROR(VLOOKUP(RC[-16],R9C26:R17C36,7,FALSE),0)*R6C -> 0 | AG120: =IFERROR(VLOOKUP(RC[-16],R9C26:R17C36,8,FALSE),0)*R6C -> 0 | AH120: =IFERROR(VLOOKUP(RC[-16],R9C26:R17C36,9,FALSE),0)*R6C -> 0 | AI120: =IFERROR(VLOOKUP(RC[-16],R9C26:R17C36,10,FALSE),0)*R6C -> 0 | AJ120: =IFERROR(VLOOKUP(RC[-16],R9C26:R17C36,11,FALSE),0)*R6C -> 0 | AK120: =VLOOKUP(RC10,R9C38:R17C40,2,FALSE) -> 1 | AL120: =VLOOKUP(RC10,R9C38:R17C40,3,FALSE) -> 0 | AM120: =IF(OR(ISBLANK(R4C7),ISERROR(FIND(R4C7,RC21))),"　","●") ->  | AN120: =IF(OR(ISBLANK(R5C7),ISERROR(FIND(R5C7,RC21))),"　","●") ->  | AO120: =IF(RC39<>"●",VLOOKUP("評価しない",R9C42:R17C44,2,FALSE),VLOOKUP(R4C8,R9C42:R17C44,2,FALSE)) -> 1 | AP120: =IF(RC39<>"●",VLOOKUP("",R9C42:R17C44,3,FALSE),VLOOKUP(R4C8,R9C42:R17C44,3,FALSE)) -> 0 | AQ120: =IF(RC40<>"●",VLOOKUP("評価しない",R9C42:R17C44,2,FALSE),VLOOKUP(R5C8,R9C42:R17C44,2,FALSE)) -> 1 | AR120: =IF(RC40<>"●",VLOOKUP("",R9C42:R17C44,3,FALSE),VLOOKUP(R5C8,R9C42:R17C44,3,FALSE)) -> 0 | AS120: =IF(OR(ISBLANK(R6C7),ISERROR(FIND(R6C7,RC25))),"　","●") ->  | AT120: =IF(OR(ISBLANK(R7C7),ISERROR(FIND(R7C7,RC25))),"　","●") ->  | AU120: =IF(RC45<>"●",VLOOKUP("評価しない",R9C46:R17C48,2,FALSE),VLOOKUP(R6C8,R9C46:R17C48,2,FALSE)) -> 1 | AV120: =IF(RC45<>"●",VLOOKUP("",R9C46:R17C48,3,FALSE),VLOOKUP(R6C8,R9C46:R17C48,3,FALSE)) -> 0 | AW120: =IF(RC46<>"●",VLOOKUP("評価しない",R9C46:R17C48,2,FALSE),VLOOKUP(R7C8,R9C46:R17C48,2,FALSE)) -> 1 | AX120: =IF(RC46<>"●",VLOOKUP("",R9C46:R17C48,3,FALSE),VLOOKUP(R7C8,R9C46:R17C48,3,FALSE)) -> 0 | AY120: =SUM(RC27:RC36) -> 0 | AZ120: =RC37*RC41*RC43*RC47*RC49 -> 1 | BA120: =RC38+RC42+RC44+RC48+RC50 -> 0
A121: =OFFSET(R164C1,INT((RC26-1)/100),MOD(INT((RC26-1)/10),10),1,1)*10+MOD(RC26-1,10)+1 -> 70 | D121: =IF(AND(RC2<>"NG",OR(RC2<>"",RC3<>"",R9C4="×")),"◯","") ->  | E121: =IF(RC2="◯",RC6,"") ->  | F121: =T(OFFSET('[MiracleNikkiJp_items.csv]MiracleNikkiJp_items'!R10C[-3],RC1,0,1,1)) -> ヘアスタイル | G121: =T(OFFSET('[MiracleNikkiJp_items.csv]MiracleNikkiJp_items'!R10C[-2],RC1,0,1,1)) ->  | H121: =IF(RC4="",0,RC51*RC52+RC53) -> 0 | I121: =RC1 -> 70 | J121: =OFFSET('[MiracleNikkiJp_items.csv]MiracleNikkiJp_items'!R10C[-4],RC1,0,1,1) -> 0 | K121: =T(OFFSET('[MiracleNikkiJp_items.csv]MiracleNikkiJp_items'!R10C[-4],RC1,0,1,1)) ->  | L121: =T(OFFSET('[MiracleNikkiJp_items.csv]MiracleNikkiJp_items'!R10C[-4],RC1,0,1,1)) ->  | M121: =T(OFFSET('[MiracleNikkiJp_items.csv]MiracleNikkiJp_items'!R10C[-4],RC1,0,1,1)) ->  | N121: =T(OFFSET('[MiracleNikkiJp_items.csv]MiracleNikkiJp_items'!R10C[-4],RC1,0,1,1)) ->  | O121: =T(OFFSET('[MiracleNikkiJp_items.csv]MiracleNikkiJp_items'!R10C[-4],RC1,0,1,1)) ->  | P121: =T(OFFSET('[MiracleNikkiJp_items.csv]MiracleNikkiJp_items'!R10C[-4],RC1,0,1,1)) ->  | Q121: =T(OFFSET('[MiracleNikkiJp_items.csv]MiracleNikkiJp_items'!R10C[-4],RC1,0,1,1)) ->  | R121: =T(OFFSET('[MiracleNikkiJp_items.csv]MiracleNikkiJp_items'!R10C[-4],RC1,0,1,1)) ->  | S121: =T(OFFSET('[MiracleNikkiJp_items.csv]MiracleNikkiJp_items'!R10C[-4],RC1,0,1,1)) ->  | T121: =T(OFFSET('[MiracleNikkiJp_items.csv]MiracleNikkiJp_items'!R10C[-4],RC1,0,1,1)) ->  | U121: =T(OFFSET('[MiracleNikkiJp_items.csv]MiracleNikkiJp_items'!R10C[-4],RC1,0,1,1)) ->  | Y121: =T(OFFSET('[MiracleNikkiJp_items.csv]MiracleNikkiJp_items'!R10C[-7],RC1,0,1,1)) ->  | Z121: 70 | AA121: =IFERROR(VLOOKUP(RC[-16],R9C26:R17C36,2,FALSE),0)*R6C -> 0 | AB121: =IFERROR(VLOOKUP(RC[-16],R9C26:R17C36,3,FALSE),0)*R6C -> 0 | AC121: =IFERROR(VLOOKUP(RC[-16],R9C26:R17C36,4,FALSE),0)*R6C -> 0 | AD121: =IFERROR(VLOOKUP(RC[-16],R9C26:R17C36,5,FALSE),0)*R6C -> 0 | AE121: =IFERROR(VLOOKUP(RC[-16],R9C26:R17C36,6,FALSE),0)*R6C -> 0 | AF121: =IFERROR(VLOOKUP(RC[-16],R9C26:R17C36,7,FALSE),0)*R6C -> 0 | AG121: =IFERROR(VLOOKUP(RC[-16],R9C26:R17C36,8,FALSE),0)*R6C -> 0 | AH121: =IFERROR(VLOOKUP(RC[-16],R9C26:R17C36,9,FALSE),0)*R6C -> 0 | AI121: =IFERROR(VLOOKUP(RC[-16],R9C26:R17C36,10,FALSE),0)*R6C -> 0 | AJ121: =IFERROR(VLOOKUP(RC[-16],R9C26:R17C36,11,FALSE),0)*R6C -> 0 | AK121: =VLOOKUP(RC10,R9C38:R17C40,2,FALSE) -> 1 | AL121: =VLOOKUP(RC10,R9C38:R17C40,3,FALSE) -> 0 | AM121: =IF(OR(ISBLANK(R4C7),ISERROR(FIND(R4C7,RC21))),"　","●") ->  | AN121: =IF(OR(ISBLANK(R5C7),ISERROR(FIND(R5C7,RC21))),"　","●") ->  | AO121: =IF(RC39<>"●",VLOOKUP("評価しない",R9C42:R17C44,2,FALSE),VLOOKUP(R4C8,R9C42:R17C44,2,FALSE)) -> 1 | AP121: =IF(RC39<>"●",VLOOKUP("",R9C42:R17C44,3,FALSE),VLOOKUP(R4C8,R9C42:R17C44,3,FALSE)) -> 0 | AQ121: =IF(RC40<>"●",VLOOKUP("評価しない",R9C42:R17C44,2,FALSE),VLOOKUP(R5C8,R9C42:R17C44,2,FALSE)) -> 1 | AR121: =IF(RC40<>"●",VLOOKUP("",R9C42:R17C44,3,FALSE),VLOOKUP(R5C8,R9C42:R17C44,3,FALSE)) -> 0 | AS121: =IF(OR(ISBLANK(R6C7),ISERROR(FIND(R6C7,RC25))),"　","●") ->  | AT121: =IF(OR(ISBLANK(R7C7),ISERROR(FIND(R7C7,RC25))),"　","●") ->  | AU121: =IF(RC45<>"●",VLOOKUP("評価しない",R9C46:R17C48,2,FALSE),VLOOKUP(R6C8,R9C46:R17C48,2,FALSE)) -> 1 | AV121: =IF(RC45<>"●",VLOOKUP("",R9C46:R17C48,3,FALSE),VLOOKUP(R6C8,R9C46:R17C48,3,FALSE)) -> 0 | AW121: =IF(RC46<>"●",VLOOKUP("評価しない",R9C46:R17C48,2,FALSE),VLOOKUP(R7C8,R9C46:R17C48,2,FALSE)) -> 1 | AX121: =IF(RC46<>"●",VLOOKUP("",R9C46:R17C48,3,FALSE),VLOOKUP(R7C8,R9C46:R17C48,3,FALSE)) -> 0 | AY121: =SUM(RC27:RC36) -> 0 | AZ121: =RC37*RC41*RC43*RC47*RC49 -> 1 | BA121: =RC38+RC42+RC44+RC48+RC50 -> 0
A122: =OFFSET(R164C1,INT((RC26-1)/100),MOD(INT((RC26-1)/10),10),1,1)*10+MOD(RC26-1,10)+1 -> 71 | D122: =IF(AND(RC2<>"NG",OR(RC2<>"",RC3<>"",R9C4="×")),"◯","") ->  | E122: =IF(RC2="◯",RC6,"") ->  | F122: =T(OFFSET('[MiracleNikkiJp_items.csv]MiracleNikkiJp_items'!R10C[-3],RC1,0,1,1)) -> ヘアスタイル | G122: =T(OFFSET('[MiracleNikkiJp_items.csv]MiracleNikkiJp_items'!R10C[-2],RC1,0,1,1)) ->  | H122: =IF(RC4="",0,RC51*RC52+RC53) -> 0 | I122: =RC1 -> 71 | J122: =OFFSET('[MiracleNikkiJp_items.csv]MiracleNikkiJp_items'!R10C[-4],RC1,0,1,1) -> 0 | K122: =T(OFFSET('[MiracleNikkiJp_items.csv]MiracleNikkiJp_items'!R10C[-4],RC1,0,1,1)) ->  | L122: =T(OFFSET('[MiracleNikkiJp_items.csv]MiracleNikkiJp_items'!R10C[-4],RC1,0,1,1)) ->  | M122: =T(OFFSET('[MiracleNikkiJp_items.csv]MiracleNikkiJp_items'!R10C[-4],RC1,0,1,1)) ->  | N122: =T(OFFSET('[MiracleNikkiJp_items.csv]MiracleNikkiJp_items'!R10C[-4],RC1,0,1,1)) ->  | O122: =T(OFFSET('[MiracleNikkiJp_items.csv]MiracleNikkiJp_items'!R10C[-4],RC1,0,1,1)) ->  | P122: =T(OFFSET('[MiracleNikkiJp_items.csv]MiracleNikkiJp_items'!R10C[-4],RC1,0,1,1)) ->  | Q122: =T(OFFSET('[MiracleNikkiJp_items.csv]MiracleNikkiJp_items'!R10C[-4],RC1,0,1,1)) ->  | R122: =T(OFFSET('[MiracleNikkiJp_items.csv]MiracleNikkiJp_items'!R10C[-4],RC1,0,1,1)) ->  | S122: =T(OFFSET('[MiracleNikkiJp_items.csv]MiracleNikkiJp_items'!R10C[-4],RC1,0,1,1)) ->  | T122: =T(OFFSET('[MiracleNikkiJp_items.csv]MiracleNikkiJp_items'!R10C[-4],RC1,0,1,1)) ->  | U122: =T(OFFSET('[MiracleNikkiJp_items.csv]MiracleNikkiJp_items'!R10C[-4],RC1,0,1,1)) ->  | Y122: =T(OFFSET('[MiracleNikkiJp_items.csv]MiracleNikkiJp_items'!R10C[-7],RC1,0,1,1)) ->  | Z122: 71 | AA122: =IFERROR(VLOOKUP(RC[-16],R9C26:R17C36,2,FALSE),0)*R6C -> 0 | AB122: =IFERROR(VLOOKUP(RC[-16],R9C26:R17C36,3,FALSE),0)*R6C -> 0 | AC122: =IFERROR(VLOOKUP(RC[-16],R9C26:R17C36,4,FALSE),0)*R6C -> 0 | AD122: =IFERROR(VLOOKUP(RC[-16],R9C26:R17C36,5,FALSE),0)*R6C -> 0 | AE122: =IFERROR(VLOOKUP(RC[-16],R9C26:R17C36,6,FALSE),0)*R6C -> 0 | AF122: =IFERROR(VLOOKUP(RC[-16],R9C26:R17C36,7,FALSE),0)*R6C -> 0 | AG122: =IFERROR(VLOOKUP(RC[-16],R9C26:R17C36,8,FALSE),0)*R6C -> 0 | AH122: =IFERROR(VLOOKUP(RC[-16],R9C26:R17C36,9,FALSE),0)*R6C -> 0 | AI122: =IFERROR(VLOOKUP(RC[-16],R9C26:R17C36,10,FALSE),0)*R6C -> 0 | AJ122: =IFERROR(VLOOKUP(RC[-16],R9C26:R17C36,11,FALSE),0)*R6C -> 0 | AK122: =VLOOKUP(RC10,R9C38:R17C40,2,FALSE) -> 1 | AL122: =VLOOKUP(RC10,R9C38:R17C40,3,FALSE) -> 0 | AM122: =IF(OR(ISBLANK(R4C7),ISERROR(FIND(R4C7,RC21))),"　","●") ->  | AN122: =IF(OR(ISBLANK(R5C7),ISERROR(FIND(R5C7,RC21))),"　","●") ->  | AO122: =IF(RC39<>"●",VLOOKUP("評価しない",R9C42:R17C44,2,FALSE),VLOOKUP(R4C8,R9C42:R17C44,2,FALSE)) -> 1 | AP122: =IF(RC39<>"●",VLOOKUP("",R9C42:R17C44,3,FALSE),VLOOKUP(R4C8,R9C42:R17C44,3,FALSE)) -> 0 | AQ122: =IF(RC40<>"●",VLOOKUP("評価しない",R9C42:R17C44,2,FALSE),VLOOKUP(R5C8,R9C42:R17C44,2,FALSE)) -> 1 | AR122: =IF(RC40<>"●",VLOOKUP("",R9C42:R17C44,3,FALSE),VLOOKUP(R5C8,R9C42:R17C44,3,FALSE)) -> 0 | AS122: =IF(OR(ISBLANK(R6C7),ISERROR(FIND(R6C7,RC25))),"　","●") ->  | AT122: =IF(OR(ISBLANK(R7C7),ISERROR(FIND(R7C7,RC25))),"　","●") ->  | AU122: =IF(RC45<>"●",VLOOKUP("評価しない",R9C46:R17C48,2,FALSE),VLOOKUP(R6C8,R9C46:R17C48,2,FALSE)) -> 1 | AV122: =IF(RC45<>"●",VLOOKUP("",R9C46:R17C48,3,FALSE),VLOOKUP(R6C8,R9C46:R17C48,3,FALSE)) -> 0 | AW122: =IF(RC46<>"●",VLOOKUP("評価しない",R9C46:R17C48,2,FALSE),VLOOKUP(R7C8,R9C46:R17C48,2,FALSE)) -> 1 | AX122: =IF(RC46<>"●",VLOOKUP("",R9C46:R17C48,3,FALSE),VLOOKUP(R7C8,R9C46:R17C48,3,FALSE)) -> 0 | AY122: =SUM(RC27:RC36) -> 0 | AZ122: =RC37*RC41*RC43*RC47*RC49 -> 1 | BA122: =RC38+RC42+RC44+RC48+RC50 -> 0
A123: =OFFSET(R164C1,INT((RC26-1)/100),MOD(INT((RC26-1)/10),10),1,1)*10+MOD(RC26-1,10)+1 -> 72 | D123: =IF(AND(RC2<>"NG",OR(RC2<>"",RC3<>"",R9C4="×")),"◯","") ->  | E123: =IF(RC2="◯",RC6,"") ->  | F123: =T(OFFSET('[MiracleNikkiJp_items.csv]MiracleNikkiJp_items'!R10C[-3],RC1,0,1,1)) -> ヘアスタイル | G123: =T(OFFSET('[MiracleNikkiJp_items.csv]MiracleNikkiJp_items'!R10C[-2],RC1,0,1,1)) ->  | H123: =IF(RC4="",0,RC51*RC52+RC53) -> 0 | I123: =RC1 -> 72 | J123: =OFFSET('[MiracleNikkiJp_items.csv]MiracleNikkiJp_items'!R10C[-4],RC1,0,1,1) -> 0 | K123: =T(OFFSET('[MiracleNikkiJp_items.csv]MiracleNikkiJp_items'!R10C[-4],RC1,0,1,1)) ->  | L123: =T(OFFSET('[MiracleNikkiJp_items.csv]MiracleNikkiJp_items'!R10C[-4],RC1,0,1,1)) ->  | M123: =T(OFFSET('[MiracleNikkiJp_items.csv]MiracleNikkiJp_items'!R10C[-4],RC1,0,1,1)) ->  | N123: =T(OFFSET('[MiracleNikkiJp_items.csv]MiracleNikkiJp_items'!R10C[-4],RC1,0,1,1)) ->  | O123: =T(OFFSET('[MiracleNikkiJp_items.csv]MiracleNikkiJp_items'!R10C[-4],RC1,0,1,1)) ->  | P123: =T(OFFSET('[MiracleNikkiJp_items.csv]MiracleNikkiJp_items'!R10C[-4],RC1,0,1,1)) ->  | Q123: =T(OFFSET('[MiracleNikkiJp_items.csv]MiracleNikkiJp_items'!R10C[-4],RC1,0,1,1)) ->  | R123: =T(OFFSET('[MiracleNikkiJp_items.csv]MiracleNikkiJp_items'!R10C[-4],RC1,0,1,1)) ->  | S123: =T(OFFSET('[MiracleNikkiJp_items.csv]MiracleNikkiJp_items'!R10C[-4],RC1,0,1,1)) ->  | T123: =T(OFFSET('[MiracleNikkiJp_items.csv]MiracleNikkiJp_items'!R10C[-4],RC1,0,1,1)) ->  | U123: =T(OFFSET('[MiracleNikkiJp_items.csv]MiracleNikkiJp_items'!R10C[-4],RC1,0,1,1)) ->  | Y123: =T(OFFSET('[MiracleNikkiJp_items.csv]MiracleNikkiJp_items'!R10C[-7],RC1,0,1,1)) ->  | Z123: 72 | AA123: =IFERROR(VLOOKUP(RC[-16],R9C26:R17C36,2,FALSE),0)*R6C -> 0 | AB123: =IFERROR(VLOOKUP(RC[-16],R9C26:R17C36,3,FALSE),0)*R6C -> 0 | AC123: =IFERROR(VLOOKUP(RC[-16],R9C26:R17C36,4,FALSE),0)*R6C -> 0 | AD123: =IFERROR(VLOOKUP(RC[-16],R9C26:R17C36,5,FALSE),0)*R6C -> 0 | AE123: =IFERROR(VLOOKUP(RC[-16],R9C26:R17C36,6,FALSE),0)*R6C -> 0 | AF123: =IFERROR(VLOOKUP(RC[-16],R9C26:R17C36,7,FALSE),0)*R6C -> 0 | AG123: =IFERROR(VLOOKUP(RC[-16],R9C26:R17C36,8,FALSE),0)*R6C -> 0 | AH123: =IFERROR(VLOOKUP(RC[-16],R9C26:R17C36,9,FALSE),0)*R6C -> 0 | AI123: =IFERROR(VLOOKUP(RC[-16],R9C26:R17C36,10,FALSE),0)*R6C -> 0 | AJ123: =IFERROR(VLOOKUP(RC[-16],R9C26:R17C36,11,FALSE),0)*R6C -> 0 | AK123: =VLOOKUP(RC10,R9C38:R17C40,2,FALSE) -> 1 | AL123: =VLOOKUP(RC10,R9C38:R17C40,3,FALSE) -> 0 | AM123: =IF(OR(ISBLANK(R4C7),ISERROR(FIND(R4C7,RC21))),"　","●") ->  | AN123: =IF(OR(ISBLANK(R5C7),ISERROR(FIND(R5C7,RC21))),"　","●") ->  | AO123: =IF(RC39<>"●",VLOOKUP("評価しない",R9C42:R17C44,2,FALSE),VLOOKUP(R4C8,R9C42:R17C44,2,FALSE)) -> 1 | AP123: =IF(RC39<>"●",VLOOKUP("",R9C42:R17C44,3,FALSE),VLOOKUP(R4C8,R9C42:R17C44,3,FALSE)) -> 0 | AQ123: =IF(RC40<>"●",VLOOKUP("評価しない",R9C42:R17C44,2,FALSE),VLOOKUP(R5C8,R9C42:R17C44,2,FALSE)) -> 1 | AR123: =IF(RC40<>"●",VLOOKUP("",R9C42:R17C44,3,FALSE),VLOOKUP(R5C8,R9C42:R17C44,3,FALSE)) -> 0 | AS123: =IF(OR(ISBLANK(R6C7),ISERROR(FIND(R6C7,RC25))),"　","●") ->  | AT123: =IF(OR(ISBLANK(R7C7),ISERROR(FIND(R7C7,RC25))),"　","●") ->  | AU123: =IF(RC45<>"●",VLOOKUP("評価しない",R9C46:R17C48,2,FALSE),VLOOKUP(R6C8,R9C46:R17C48,2,FALSE)) -> 1 | AV123: =IF(RC45<>"●",VLOOKUP("",R9C46:R17C48,3,FALSE),VLOOKUP(R6C8,R9C46:R17C48,3,FALSE)) -> 0 | AW123: =IF(RC46<>"●",VLOOKUP("評価しない",R9C46:R17C48,2,FALSE),VLOOKUP(R7C8,R9C46:R17C48,2,FALSE)) -> 1 | AX123: =IF(RC46<>"●",VLOOKUP("",R9C46:R17C48,3,FALSE),VLOOKUP(R7C8,R9C46:R17C48,3,FALSE)) -> 0 | AY123: =SUM(RC27:RC36) -> 0 | AZ123: =RC37*RC41*RC43*RC47*RC49 -> 1 | BA123: =RC38+RC42+RC44+RC48+RC50 -> 0
A124: =OFFSET(R164C1,INT((RC26-1)/100),MOD(INT((RC26-1)/10),10),1,1)*10+MOD(RC26-1,10)+1 -> 73 | D124: =IF(AND(RC2<>"NG",OR(RC2<>"",RC3<>"",R9C4="×")),"◯","") ->  | E124: =IF(RC2="◯",RC6,"") ->  | F124: =T(OFFSET('[MiracleNikkiJp_items.csv]MiracleNikkiJp_items'!R10C[-3],RC1,0,1,1)) -> ヘアスタイル | G124: =T(OFFSET('[MiracleNikkiJp_items.csv]MiracleNikkiJp_items'!R10C[-2],RC1,0,1,1)) ->  | H124: =IF(RC4="",0,RC51*RC52+RC53) -> 0 | I124: =RC1 -> 73 | J124: =OFFSET('[MiracleNikkiJp_items.csv]MiracleNikkiJp_items'!R10C[-4],RC1,0,1,1) -> 0 | K124: =T(OFFSET('[MiracleNikkiJp_items.csv]MiracleNikkiJp_items'!R10C[-4],RC1,0,1,1)) ->  | L124: =T(OFFSET('[MiracleNikkiJp_items.csv]MiracleNikkiJp_items'!R10C[-4],RC1,0,1,1)) ->  | M124: =T(OFFSET('[MiracleNikkiJp_items.csv]MiracleNikkiJp_items'!R10C[-4],RC1,0,1,1)) ->  | N124: =T(OFFSET('[MiracleNikkiJp_items.csv]MiracleNikkiJp_items'!R10C[-4],RC1,0,1,1)) ->  | O124: =T(OFFSET('[MiracleNikkiJp_items.csv]MiracleNikkiJp_items'!R10C[-4],RC1,0,1,1)) ->  | P124: =T(OFFSET('[MiracleNikkiJp_items.csv]MiracleNikkiJp_items'!R10C[-4],RC1,0,1,1)) ->  | Q124: =T(OFFSET('[MiracleNikkiJp_items.csv]MiracleNikkiJp_items'!R10C[-4],RC1,0,1,1)) ->  | R124: =T(OFFSET('[MiracleNikkiJp_items.csv]MiracleNikkiJp_items'!R10C[-4],RC1,0,1,1)) ->  | S124: =T(OFFSET('[MiracleNikkiJp_items.csv]MiracleNikkiJp_items'!R10C[-4],RC1,0,1,1)) ->  | T124: =T(OFFSET('[MiracleNikkiJp_items.csv]MiracleNikkiJp_items'!R10C[-4],RC1,0,1,1)) ->  | U124: =T(OFFSET('[MiracleNikkiJp_items.csv]MiracleNikkiJp_items'!R10C[-4],RC1,0,1,1)) ->  | Y124: =T(OFFSET('[MiracleNikkiJp_items.csv]MiracleNikkiJp_items'!R10C[-7],RC1,0,1,1)) ->  | Z124: 73 | AA124: =IFERROR(VLOOKUP(RC[-16],R9C26:R17C36,2,FALSE),0)*R6C -> 0 | AB124: =IFERROR(VLOOKUP(RC[-16],R9C26:R17C36,3,FALSE),0)*R6C -> 0 | AC124: =IFERROR(VLOOKUP(RC[-16],R9C26:R17C36,4,FALSE),0)*R6C -> 0 | AD124: =IFERROR(VLOOKUP(RC[-16],R9C26:R17C36,5,FALSE),0)*R6C -> 0 | AE124: =IFERROR(VLOOKUP(RC[-16],R9C26:R17C36,6,FALSE),0)*R6C -> 0 | AF124: =IFERROR(VLOOKUP(RC[-16],R9C26:R17C36,7,FALSE),0)*R6C -> 0 | AG124: =IFERROR(VLOOKUP(RC[-16],R9C26:R17C36,8,FALSE),0)*R6C -> 0 | AH124: =IFERROR(VLOOKUP(RC[-16],R9C26:R17C36,9,FALSE),0)*R6C -> 0 | AI124: =IFERROR(VLOOKUP(RC[-16],R9C26:R17C36,10,FALSE),0)*R6C -> 0 | AJ124: =IFERROR(VLOOKUP(RC[-16],R9C26:R17C36,11,FALSE),0)*R6C -> 0 | AK124: =VLOOKUP(RC10,R9C38:R17C40,2,FALSE) -> 1 | AL124: =VLOOKUP(RC10,R9C38:R17C40,3,FALSE) -> 0 | AM124: =IF(OR(ISBLANK(R4C7),ISERROR(FIND(R4C7,RC21))),"　","●") ->  | AN124: =IF(OR(ISBLANK(R5C7),ISERROR(FIND(R5C7,RC21))),"　","●") ->  | AO124: =IF(RC39<>"●",VLOOKUP("評価しない",R9C42:R17C44,2,FALSE),VLOOKUP(R4C8,R9C42:R17C44,2,FALSE)) -> 1 | AP124: =IF(RC39<>"●",VLOOKUP("",R9C42:R17C44,3,FALSE),VLOOKUP(R4C8,R9C42:R17C44,3,FALSE)) -> 0 | AQ124: =IF(RC40<>"●",VLOOKUP("評価しない",R9C42:R17C44,2,FALSE),VLOOKUP(R5C8,R9C42:R17C44,2,FALSE)) -> 1 | AR124: =IF(RC40<>"●",VLOOKUP("",R9C42:R17C44,3,FALSE),VLOOKUP(R5C8,R9C42:R17C44,3,FALSE)) -> 0 | AS124: =IF(OR(ISBLANK(R6C7),ISERROR(FIND(R6C7,RC25))),"　","●") ->  | AT124: =IF(OR(ISBLANK(R7C7),ISERROR(FIND(R7C7,RC25))),"　","●") ->  | AU124: =IF(RC45<>"●",VLOOKUP("評価しない",R9C46:R17C48,2,FALSE),VLOOKUP(R6C8,R9C46:R17C48,2,FALSE)) -> 1 | AV124: =IF(RC45<>"●",VLOOKUP("",R9C46:R17C48,3,FALSE),VLOOKUP(R6C8,R9C46:R17C48,3,FALSE)) -> 0 | AW124: =IF(RC46<>"●",VLOOKUP("評価しない",R9C46:R17C48,2,FALSE),VLOOKUP(R7C8,R9C46:R17C48,2,FALSE)) -> 1 | AX124: =IF(RC46<>"●",VLOOKUP("",R9C46:R17C48,3,FALSE),VLOOKUP(R7C8,R9C46:R17C48,3,FALSE)) -> 0 | AY124: =SUM(RC27:RC36) -> 0 | AZ124: =RC37*RC41*RC43*RC47*RC49 -> 1 | BA124: =RC38+RC42+RC44+RC48+RC50 -> 0
A125: =OFFSET(R164C1,INT((RC26-1)/100),MOD(INT((RC26-1)/10),10),1,1)*10+MOD(RC26-1,10)+1 -> 74 | D125: =IF(AND(RC2<>"NG",OR(RC2<>"",RC3<>"",R9C4="×")),"◯","") ->  | E125: =IF(RC2="◯",RC6,"") ->  | F125: =T(OFFSET('[MiracleNikkiJp_items.csv]MiracleNikkiJp_items'!R10C[-3],RC1,0,1,1)) -> ヘアスタイル | G125: =T(OFFSET('[MiracleNikkiJp_items.csv]MiracleNikkiJp_items'!R10C[-2],RC1,0,1,1)) ->  | H125: =IF(RC4="",0,RC51*RC52+RC53) -> 0 | I125: =RC1 -> 74 | J125: =OFFSET('[MiracleNikkiJp_items.csv]MiracleNikkiJp_items'!R10C[-4],RC1,0,1,1) -> 0 | K125: =T(OFFSET('[MiracleNikkiJp_items.csv]MiracleNikkiJp_items'!R10C[-4],RC1,0,1,1)) ->  | L125: =T(OFFSET('[MiracleNikkiJp_items.csv]MiracleNikkiJp_items'!R10C[-4],RC1,0,1,1)) ->  | M125: =T(OFFSET('[MiracleNikkiJp_items.csv]MiracleNikkiJp_items'!R10C[-4],RC1,0,1,1)) ->  | N125: =T(OFFSET('[MiracleNikkiJp_items.csv]MiracleNikkiJp_items'!R10C[-4],RC1,0,1,1)) ->  | O125: =T(OFFSET('[MiracleNikkiJp_items.csv]MiracleNikkiJp_items'!R10C[-4],RC1,0,1,1)) ->  | P125: =T(OFFSET('[MiracleNikkiJp_items.csv]MiracleNikkiJp_items'!R10C[-4],RC1,0,1,1)) ->  | Q125: =T(OFFSET('[MiracleNikkiJp_items.csv]MiracleNikkiJp_items'!R10C[-4],RC1,0,1,1)) ->  | R125: =T(OFFSET('[MiracleNikkiJp_items.csv]MiracleNikkiJp_items'!R10C[-4],RC1,0,1,1)) ->  | S125: =T(OFFSET('[MiracleNikkiJp_items.csv]MiracleNikkiJp_items'!R10C[-4],RC1,0,1,1)) ->  | T125: =T(OFFSET('[MiracleNikkiJp_items.csv]MiracleNikkiJp_items'!R10C[-4],RC1,0,1,1)) ->  | U125: =T(OFFSET('[MiracleNikkiJp_items.csv]MiracleNikkiJp_items'!R10C[-4],RC1,0,1,1)) ->  | Y125: =T(OFFSET('[MiracleNikkiJp_items.csv]MiracleNikkiJp_items'!R10C[-7],RC1,0,1,1)) ->  | Z125: 74 | AA125: =IFERROR(VLOOKUP(RC[-16],R9C26:R17C36,2,FALSE),0)*R6C -> 0 | AB125: =IFERROR(VLOOKUP(RC[-16],R9C26:R17C36,3,FALSE),0)*R6C -> 0 | AC125: =IFERROR(VLOOKUP(RC[-16],R9C26:R17C36,4,FALSE),0)*R6C -> 0 | AD125: =IFERROR(VLOOKUP(RC[-16],R9C26:R17C36,5,FALSE),0)*R6C -> 0 | AE125: =IFERROR(VLOOKUP(RC[-16],R9C26:R17C36,6,FALSE),0)*R6C -> 0 | AF125: =IFERROR(VLOOKUP(RC[-16],R9C26:R17C36,7,FALSE),0)*R6C -> 0 | AG125: =IFERROR(VLOOKUP(RC[-16],R9C26:R17C36,8,FALSE),0)*R6C -> 0 | AH125: =IFERROR(VLOOKUP(RC[-16],R9C26:R17C36,9,FALSE),0)*R6C -> 0 | AI125: =IFERROR(VLOOKUP(RC[-16],R9C26:R17C36,10,FALSE),0)*R6C -> 0 | AJ125: =IFERROR(VLOOKUP(RC[-16],R9C26:R17C36,11,FALSE),0)*R6C -> 0 | AK125: =VLOOKUP(RC10,R9C38:R17C40,2,FALSE) -> 1 | AL125: =VLOOKUP(RC10,R9C38:R17C40,3,FALSE) -> 0 | AM125: =IF(OR(ISBLANK(R4C7),ISERROR(FIND(R4C7,RC21))),"　","●") ->  | AN125: =IF(OR(ISBLANK(R5C7),ISERROR(FIND(R5C7,RC21))),"　","●") ->  | AO125: =IF(RC39<>"●",VLOOKUP("評価しない",R9C42:R17C44,2,FALSE),VLOOKUP(R4C8,R9C42:R17C44,2,FALSE)) -> 1 | AP125: =IF(RC39<>"●",VLOOKUP("",R9C42:R17C44,3,FALSE),VLOOKUP(R4C8,R9C42:R17C44,3,FALSE)) -> 0 | AQ125: =IF(RC40<>"●",VLOOKUP("評価しない",R9C42:R17C44,2,FALSE),VLOOKUP(R5C8,R9C42:R17C44,2,FALSE)) -> 1 | AR125: =IF(RC40<>"●",VLOOKUP("",R9C42:R17C44,3,FALSE),VLOOKUP(R5C8,R9C42:R17C44,3,FALSE)) -> 0 | AS125: =IF(OR(ISBLANK(R6C7),ISERROR(FIND(R6C7,RC25))),"　","●") ->  | AT125: =IF(OR(ISBLANK(R7C7),ISERROR(FIND(R7C7,RC25))),"　","●") ->  | AU125: =IF(RC45<>"●",VLOOKUP("評価しない",R9C46:R17C48,2,FALSE),VLOOKUP(R6C8,R9C46:R17C48,2,FALSE)) -> 1 | AV125: =IF(RC45<>"●",VLOOKUP("",R9C46:R17C48,3,FALSE),VLOOKUP(R6C8,R9C46:R17C48,3,FALSE)) -> 0 | AW125: =IF(RC46<>"●",VLOOKUP("評価しない",R9C46:R17C48,2,FALSE),VLOOKUP(R7C8,R9C46:R17C48,2,FALSE)) -> 1 | AX125: =IF(RC46<>"●",VLOOKUP("",R9C46:R17C48,3,FALSE),VLOOKUP(R7C8,R9C46:R17C48,3,FALSE)) -> 0 | AY125: =SUM(RC27:RC36) -> 0 | AZ125: =RC37*RC41*RC43*RC47*RC49 -> 1 | BA125: =RC38+RC42+RC44+RC48+RC50 -> 0
A126: =OFFSET(R164C1,INT((RC26-1)/100),MOD(INT((RC26-1)/10),10),1,1)*10+MOD(RC26-1,10)+1 -> 75 | D126: =IF(AND(RC2<>"NG",OR(RC2<>"",RC3<>"",R9C4="×")),"◯","") ->  | E126: =IF(RC2="◯",RC6,"") ->  | F126: =T(OFFSET('[MiracleNikkiJp_items.csv]MiracleNikkiJp_items'!R10C[-3],RC1,0,1,1)) -> ヘアスタイル | G126: =T(OFFSET('[MiracleNikkiJp_items.csv]MiracleNikkiJp_items'!R10C[-2],RC1,0,1,1)) ->  | H126: =IF(RC4="",0,RC51*RC52+RC53) -> 0 | I126: =RC1 -> 75 | J126: =OFFSET('[MiracleNikkiJp_items.csv]MiracleNikkiJp_items'!R10C[-4],RC1,0,1,1) -> 0 | K126: =T(OFFSET('[MiracleNikkiJp_items.csv]MiracleNikkiJp_items'!R10C[-4],RC1,0,1,1)) ->  | L126: =T(OFFSET('[MiracleNikkiJp_items.csv]MiracleNikkiJp_items'!R10C[-4],RC1,0,1,1)) ->  | M126: =T(OFFSET('[MiracleNikkiJp_items.csv]MiracleNikkiJp_items'!R10C[-4],RC1,0,1,1)) ->  | N126: =T(OFFSET('[MiracleNikkiJp_items.csv]MiracleNikkiJp_items'!R10C[-4],RC1,0,1,1)) ->  | O126: =T(OFFSET('[MiracleNikkiJp_items.csv]MiracleNikkiJp_items'!R10C[-4],RC1,0,1,1)) ->  | P126: =T(OFFSET('[MiracleNikkiJp_items.csv]MiracleNikkiJp_items'!R10C[-4],RC1,0,1,1)) ->  | Q126: =T(OFFSET('[MiracleNikkiJp_items.csv]MiracleNikkiJp_items'!R10C[-4],RC1,0,1,1)) ->  | R126: =T(OFFSET('[MiracleNikkiJp_items.csv]MiracleNikkiJp_items'!R10C[-4],RC1,0,1,1)) ->  | S126: =T(OFFSET('[MiracleNikkiJp_items.csv]MiracleNikkiJp_items'!R10C[-4],RC1,0,1,1)) ->  | T126: =T(OFFSET('[MiracleNikkiJp_items.csv]MiracleNikkiJp_items'!R10C[-4],RC1,0,1,1)) ->  | U126: =T(OFFSET('[MiracleNikkiJp_items.csv]MiracleNikkiJp_items'!R10C[-4],RC1,0,1,1)) ->  | Y126: =T(OFFSET('[MiracleNikkiJp_items.csv]MiracleNikkiJp_items'!R10C[-7],RC1,0,1,1)) ->  | Z126: 75 | AA126: =IFERROR(VLOOKUP(RC[-16],R9C26:R17C36,2,FALSE),0)*R6C -> 0 | AB126: =IFERROR(VLOOKUP(RC[-16],R9C26:R17C36,3,FALSE),0)*R6C -> 0 | AC126: =IFERROR(VLOOKUP(RC[-16],R9C26:R17C36,4,FALSE),0)*R6C -> 0 | AD126: =IFERROR(VLOOKUP(RC[-16],R9C26:R17C36,5,FALSE),0)*R6C -> 0 | AE126: =IFERROR(VLOOKUP(RC[-16],R9C26:R17C36,6,FALSE),0)*R6C -> 0 | AF126: =IFERROR(VLOOKUP(RC[-16],R9C26:R17C36,7,FALSE),0)*R6C -> 0 | AG126: =IFERROR(VLOOKUP(RC[-16],R9C26:R17C36,8,FALSE),0)*R6C -> 0 | AH126: =IFERROR(VLOOKUP(RC[-16],R9C26:R17C36,9,FALSE),0)*R6C -> 0 | AI126: =IFERROR(VLOOKUP(RC[-16],R9C26:R17C36,10,FALSE),0)*R6C -> 0 | AJ126: =IFERROR(VLOOKUP(RC[-16],R9C26:R17C36,11,FALSE),0)*R6C -> 0 | AK126: =VLOOKUP(RC10,R9C38:R17C40,2,FALSE) -> 1 | AL126: =VLOOKUP(RC10,R9C38:R17C40,3,FALSE) -> 0 | AM126: =IF(OR(ISBLANK(R4C7),ISERROR(FIND(R4C7,RC21))),"　","●") ->  | AN126: =IF(OR(ISBLANK(R5C7),ISERROR(FIND(R5C7,RC21))),"　","●") ->  | AO126: =IF(RC39<>"●",VLOOKUP("評価しない",R9C42:R17C44,2,FALSE),VLOOKUP(R4C8,R9C42:R17C44,2,FALSE)) -> 1 | AP126: =IF(RC39<>"●",VLOOKUP("",R9C42:R17C44,3,FALSE),VLOOKUP(R4C8,R9C42:R17C44,3,FALSE)) -> 0 | AQ126: =IF(RC40<>"●",VLOOKUP("評価しない",R9C42:R17C44,2,FALSE),VLOOKUP(R5C8,R9C42:R17C44,2,FALSE)) -> 1 | AR126: =IF(RC40<>"●",VLOOKUP("",R9C42:R17C44,3,FALSE),VLOOKUP(R5C8,R9C42:R17C44,3,FALSE)) -> 0 | AS126: =IF(OR(ISBLANK(R6C7),ISERROR(FIND(R6C7,RC25))),"　","●") ->  | AT126: =IF(OR(ISBLANK(R7C7),ISERROR(FIND(R7C7,RC25))),"　","●") ->  | AU126: =IF(RC45<>"●",VLOOKUP("評価しない",R9C46:R17C48,2,FALSE),VLOOKUP(R6C8,R9C46:R17C48,2,FALSE)) -> 1 | AV126: =IF(RC45<>"●",VLOOKUP("",R9C46:R17C48,3,FALSE),VLOOKUP(R6C8,R9C46:R17C48,3,FALSE)) -> 0 | AW126: =IF(RC46<>"●",VLOOKUP("評価しない",R9C46:R17C48,2,FALSE),VLOOKUP(R7C8,R9C46:R17C48,2,FALSE)) -> 1 | AX126: =IF(RC46<>"●",VLOOKUP("",R9C46:R17C48,3,FALSE),VLOOKUP(R7C8,R9C46:R17C48,3,FALSE)) -> 0 | AY126: =SUM(RC27:RC36) -> 0 | AZ126: =RC37*RC41*RC43*RC47*RC49 -> 1 | BA126: =RC38+RC42+RC44+RC48+RC50 -> 0
A127: =OFFSET(R164C1,INT((RC26-1)/100),MOD(INT((RC26-1)/10),10),1,1)*10+MOD(RC26-1,10)+1 -> 76 | D127: =IF(AND(RC2<>"NG",OR(RC2<>"",RC3<>"",R9C4="×")),"◯","") ->  | E127: =IF(RC2="◯",RC6,"") ->  | F127: =T(OFFSET('[MiracleNikkiJp_items.csv]MiracleNikkiJp_items'!R10C[-3],RC1,0,1,1)) -> ヘアスタイル | G127: =T(OFFSET('[MiracleNikkiJp_items.csv]MiracleNikkiJp_items'!R10C[-2],RC1,0,1,1)) ->  | H127: =IF(RC4="",0,RC51*RC52+RC53) -> 0 | I127: =RC1 -> 76 | J127: =OFFSET('[MiracleNikkiJp_items.csv]MiracleNikkiJp_items'!R10C[-4],RC1,0,1,1) -> 0 | K127: =T(OFFSET('[MiracleNikkiJp_items.csv]MiracleNikkiJp_items'!R10C[-4],RC1,0,1,1)) ->  | L127: =T(OFFSET('[MiracleNikkiJp_items.csv]MiracleNikkiJp_items'!R10C[-4],RC1,0,1,1)) ->  | M127: =T(OFFSET('[MiracleNikkiJp_items.csv]MiracleNikkiJp_items'!R10C[-4],RC1,0,1,1)) ->  | N127: =T(OFFSET('[MiracleNikkiJp_items.csv]MiracleNikkiJp_items'!R10C[-4],RC1,0,1,1)) ->  | O127: =T(OFFSET('[MiracleNikkiJp_items.csv]MiracleNikkiJp_items'!R10C[-4],RC1,0,1,1)) ->  | P127: =T(OFFSET('[MiracleNikkiJp_items.csv]MiracleNikkiJp_items'!R10C[-4],RC1,0,1,1)) ->  | Q127: =T(OFFSET('[MiracleNikkiJp_items.csv]MiracleNikkiJp_items'!R10C[-4],RC1,0,1,1)) ->  | R127: =T(OFFSET('[MiracleNikkiJp_items.csv]MiracleNikkiJp_items'!R10C[-4],RC1,0,1,1)) ->  | S127: =T(OFFSET('[MiracleNikkiJp_items.csv]MiracleNikkiJp_items'!R10C[-4],RC1,0,1,1)) ->  | T127: =T(OFFSET('[MiracleNikkiJp_items.csv]MiracleNikkiJp_items'!R10C[-4],RC1,0,1,1)) ->  | U127: =T(OFFSET('[MiracleNikkiJp_items.csv]MiracleNikkiJp_items'!R10C[-4],RC1,0,1,1)) ->  | Y127: =T(OFFSET('[MiracleNikkiJp_items.csv]MiracleNikkiJp_items'!R10C[-7],RC1,0,1,1)) ->  | Z127: 76 | AA127: =IFERROR(VLOOKUP(RC[-16],R9C26:R17C36,2,FALSE),0)*R6C -> 0 | AB127: =IFERROR(VLOOKUP(RC[-16],R9C26:R17C36,3,FALSE),0)*R6C -> 0 | AC127: =IFERROR(VLOOKUP(RC[-16],R9C26:R17C36,4,FALSE),0)*R6C -> 0 | AD127: =IFERROR(VLOOKUP(RC[-16],R9C26:R17C36,5,FALSE),0)*R6C -> 0 | AE127: =IFERROR(VLOOKUP(RC[-16],R9C26:R17C36,6,FALSE),0)*R6C -> 0 | AF127: =IFERROR(VLOOKUP(RC[-16],R9C26:R17C36,7,FALSE),0)*R6C -> 0 | AG127: =IFERROR(VLOOKUP(RC[-16],R9C26:R17C36,8,FALSE),0)*R6C -> 0 | AH127: =IFERROR(VLOOKUP(RC[-16],R9C26:R17C36,9,FALSE),0)*R6C -> 0 | AI127: =IFERROR(VLOOKUP(RC[-16],R9C26:R17C36,10,FALSE),0)*R6C -> 0 | AJ127: =IFERROR(VLOOKUP(RC[-16],R9C26:R17C36,11,FALSE),0)*R6C -> 0 | AK127: =VLOOKUP(RC10,R9C38:R17C40,2,FALSE) -> 1 | AL127: =VLOOKUP(RC10,R9C38:R17C40,3,FALSE) -> 0 | AM127: =IF(OR(ISBLANK(R4C7),ISERROR(FIND(R4C7,RC21))),"　","●") ->  | AN127: =IF(OR(ISBLANK(R5C7),ISERROR(FIND(R5C7,RC21))),"　","●") ->  | AO127: =IF(RC39<>"●",VLOOKUP("評価しない",R9C42:R17C44,2,FALSE),VLOOKUP(R4C8,R9C42:R17C44,2,FALSE)) -> 1 | AP127: =IF(RC39<>"●",VLOOKUP("",R9C42:R17C44,3,FALSE),VLOOKUP(R4C8,R9C42:R17C44,3,FALSE)) -> 0 | AQ127: =IF(RC40<>"●",VLOOKUP("評価しない",R9C42:R17C44,2,FALSE),VLOOKUP(R5C8,R9C42:R17C44,2,FALSE)) -> 1 | AR127: =IF(RC40<>"●",VLOOKUP("",R9C42:R17C44,3,FALSE),VLOOKUP(R5C8,R9C42:R17C44,3,FALSE)) -> 0 | AS127: =IF(OR(ISBLANK(R6C7),ISERROR(FIND(R6C7,RC25))),"　","●") ->  | AT127: =IF(OR(ISBLANK(R7C7),ISERROR(FIND(R7C7,RC25))),"　","●") ->  | AU127: =IF(RC45<>"●",VLOOKUP("評価しない",R9C46:R17C48,2,FALSE),VLOOKUP(R6C8,R9C46:R17C48,2,FALSE)) -> 1 | AV127: =IF(RC45<>"●",VLOOKUP("",R9C46:R17C48,3,FALSE),VLOOKUP(R6C8,R9C46:R17C48,3,FALSE)) -> 0 | AW127: =IF(RC46<>"●",VLOOKUP("評価しない",R9C46:R17C48,2,FALSE),VLOOKUP(R7C8,R9C46:R17C48,2,FALSE)) -> 1 | AX127: =IF(RC46<>"●",VLOOKUP("",R9C46:R17C48,3,FALSE),VLOOKUP(R7C8,R9C46:R17C48,3,FALSE)) -> 0 | AY127: =SUM(RC27:RC36) -> 0 | AZ127: =RC37*RC41*RC43*RC47*RC49 -> 1 | BA127: =RC38+RC42+RC44+RC48+RC50 -> 0
A128: =OFFSET(R164C1,INT((RC26-1)/100),MOD(INT((RC26-1)/10),10),1,1)*10+MOD(RC26-1,10)+1 -> 77 | D128: =IF(AND(RC2<>"NG",OR(RC2<>"",RC3<>"",R9C4="×")),"◯","") ->  | E128: =IF(RC2="◯",RC6,"") ->  | F128: =T(OFFSET('[MiracleNikkiJp_items.csv]MiracleNikkiJp_items'!R10C[-3],RC1,0,1,1)) -> ヘアスタイル | G128: =T(OFFSET('[MiracleNikkiJp_items.csv]MiracleNikkiJp_items'!R10C[-2],RC1,0,1,1)) ->  | H128: =IF(RC4="",0,RC51*RC52+RC53) -> 0 | I128: =RC1 -> 77 | J128: =OFFSET('[MiracleNikkiJp_items.csv]MiracleNikkiJp_items'!R10C[-4],RC1,0,1,1) -> 0 | K128: =T(OFFSET('[MiracleNikkiJp_items.csv]MiracleNikkiJp_items'!R10C[-4],RC1,0,1,1)) ->  | L128: =T(OFFSET('[MiracleNikkiJp_items.csv]MiracleNikkiJp_items'!R10C[-4],RC1,0,1,1)) ->  | M128: =T(OFFSET('[MiracleNikkiJp_items.csv]MiracleNikkiJp_items'!R10C[-4],RC1,0,1,1)) ->  | N128: =T(OFFSET('[MiracleNikkiJp_items.csv]MiracleNikkiJp_items'!R10C[-4],RC1,0,1,1)) ->  | O128: =T(OFFSET('[MiracleNikkiJp_items.csv]MiracleNikkiJp_items'!R10C[-4],RC1,0,1,1)) ->  | P128: =T(OFFSET('[MiracleNikkiJp_items.csv]MiracleNikkiJp_items'!R10C[-4],RC1,0,1,1)) ->  | Q128: =T(OFFSET('[MiracleNikkiJp_items.csv]MiracleNikkiJp_items'!R10C[-4],RC1,0,1,1)) ->  | R128: =T(OFFSET('[MiracleNikkiJp_items.csv]MiracleNikkiJp_items'!R10C[-4],RC1,0,1,1)) ->  | S128: =T(OFFSET('[MiracleNikkiJp_items.csv]MiracleNikkiJp_items'!R10C[-4],RC1,0,1,1)) ->  | T128: =T(OFFSET('[MiracleNikkiJp_items.csv]MiracleNikkiJp_items'!R10C[-4],RC1,0,1,1)) ->  | U128: =T(OFFSET('[MiracleNikkiJp_items.csv]MiracleNikkiJp_items'!R10C[-4],RC1,0,1,1)) ->  | Y128: =T(OFFSET('[MiracleNikkiJp_items.csv]MiracleNikkiJp_items'!R10C[-7],RC1,0,1,1)) ->  | Z128: 77 | AA128: =IFERROR(VLOOKUP(RC[-16],R9C26:R17C36,2,FALSE),0)*R6C -> 0 | AB128: =IFERROR(VLOOKUP(RC[-16],R9C26:R17C36,3,FALSE),0)*R6C -> 0 | AC128: =IFERROR(VLOOKUP(RC[-16],R9C26:R17C36,4,FALSE),0)*R6C -> 0 | AD128: =IFERROR(VLOOKUP(RC[-16],R9C26:R17C36,5,FALSE),0)*R6C -> 0 | AE128: =IFERROR(VLOOKUP(RC[-16],R9C26:R17C36,6,FALSE),0)*R6C -> 0 | AF128: =IFERROR(VLOOKUP(RC[-16],R9C26:R17C36,7,FALSE),0)*R6C -> 0 | AG128: =IFERROR(VLOOKUP(RC[-16],R9C26:R17C36,8,FALSE),0)*R6C -> 0 | AH128: =IFERROR(VLOOKUP(RC[-16],R9C26:R17C36,9,FALSE),0)*R6C -> 0 | AI128: =IFERROR(VLOOKUP(RC[-16],R9C26:R17C36,10,FALSE),0)*R6C -> 0 | AJ128: =IFERROR(VLOOKUP(RC[-16],R9C26:R17C36,11,FALSE),0)*R6C -> 0 | AK128: =VLOOKUP(RC10,R9C38:R17C40,2,FALSE) -> 1 | AL128: =VLOOKUP(RC10,R9C38:R17C40,3,FALSE) -> 0 | AM128: =IF(OR(ISBLANK(R4C7),ISERROR(FIND(R4C7,RC21))),"　","●") ->  | AN128: =IF(OR(ISBLANK(R5C7),ISERROR(FIND(R5C7,RC21))),"　","●") ->  | AO128: =IF(RC39<>"●",VLOOKUP("評価しない",R9C42:R17C44,2,FALSE),VLOOKUP(R4C8,R9C42:R17C44,2,FALSE)) -> 1 | AP128: =IF(RC39<>"●",VLOOKUP("",R9C42:R17C44,3,FALSE),VLOOKUP(R4C8,R9C42:R17C44,3,FALSE)) -> 0 | AQ128: =IF(RC40<>"●",VLOOKUP("評価しない",R9C42:R17C44,2,FALSE),VLOOKUP(R5C8,R9C42:R17C44,2,FALSE)) -> 1 | AR128: =IF(RC40<>"●",VLOOKUP("",R9C42:R17C44,3,FALSE),VLOOKUP(R5C8,R9C42:R17C44,3,FALSE)) -> 0 | AS128: =IF(OR(ISBLANK(R6C7),ISERROR(FIND(R6C7,RC25))),"　","●") ->  | AT128: =IF(OR(ISBLANK(R7C7),ISERROR(FIND(R7C7,RC25))),"　","●") ->  | AU128: =IF(RC45<>"●",VLOOKUP("評価しない",R9C46:R17C48,2,FALSE),VLOOKUP(R6C8,R9C46:R17C48,2,FALSE)) -> 1 | AV128: =IF(RC45<>"●",VLOOKUP("",R9C46:R17C48,3,FALSE),VLOOKUP(R6C8,R9C46:R17C48,3,FALSE)) -> 0 | AW128: =IF(RC46<>"●",VLOOKUP("評価しない",R9C46:R17C48,2,FALSE),VLOOKUP(R7C8,R9C46:R17C48,2,FALSE)) -> 1 | AX128: =IF(RC46<>"●",VLOOKUP("",R9C46:R17C48,3,FALSE),VLOOKUP(R7C8,R9C46:R17C48,3,FALSE)) -> 0 | AY128: =SUM(RC27:RC36) -> 0 | AZ128: =RC37*RC41*RC43*RC47*RC49 -> 1 | BA128: =RC38+RC42+RC44+RC48+RC50 -> 0
A129: =OFFSET(R164C1,INT((RC26-1)/100),MOD(INT((RC26-1)/10),10),1,1)*10+MOD(RC26-1,10)+1 -> 78 | D129: =IF(AND(RC2<>"NG",OR(RC2<>"",RC3<>"",R9C4="×")),"◯","") ->  | E129: =IF(RC2="◯",RC6,"") ->  | F129: =T(OFFSET('[MiracleNikkiJp_items.csv]MiracleNikkiJp_items'!R10C[-3],RC1,0,1,1)) -> ヘアスタイル | G129: =T(OFFSET('[MiracleNikkiJp_items.csv]MiracleNikkiJp_items'!R10C[-2],RC1,0,1,1)) ->  | H129: =IF(RC4="",0,RC51*RC52+RC53) -> 0 | I129: =RC1 -> 78 | J129: =OFFSET('[MiracleNikkiJp_items.csv]MiracleNikkiJp_items'!R10C[-4],RC1,0,1,1) -> 0 | K129: =T(OFFSET('[MiracleNikkiJp_items.csv]MiracleNikkiJp_items'!R10C[-4],RC1,0,1,1)) ->  | L129: =T(OFFSET('[MiracleNikkiJp_items.csv]MiracleNikkiJp_items'!R10C[-4],RC1,0,1,1)) ->  | M129: =T(OFFSET('[MiracleNikkiJp_items.csv]MiracleNikkiJp_items'!R10C[-4],RC1,0,1,1)) ->  | N129: =T(OFFSET('[MiracleNikkiJp_items.csv]MiracleNikkiJp_items'!R10C[-4],RC1,0,1,1)) ->  | O129: =T(OFFSET('[MiracleNikkiJp_items.csv]MiracleNikkiJp_items'!R10C[-4],RC1,0,1,1)) ->  | P129: =T(OFFSET('[MiracleNikkiJp_items.csv]MiracleNikkiJp_items'!R10C[-4],RC1,0,1,1)) ->  | Q129: =T(OFFSET('[MiracleNikkiJp_items.csv]MiracleNikkiJp_items'!R10C[-4],RC1,0,1,1)) ->  | R129: =T(OFFSET('[MiracleNikkiJp_items.csv]MiracleNikkiJp_items'!R10C[-4],RC1,0,1,1)) ->  | S129: =T(OFFSET('[MiracleNikkiJp_items.csv]MiracleNikkiJp_items'!R10C[-4],RC1,0,1,1)) ->  | T129: =T(OFFSET('[MiracleNikkiJp_items.csv]MiracleNikkiJp_items'!R10C[-4],RC1,0,1,1)) ->  | U129: =T(OFFSET('[MiracleNikkiJp_items.csv]MiracleNikkiJp_items'!R10C[-4],RC1,0,1,1)) ->  | Y129: =T(OFFSET('[MiracleNikkiJp_items.csv]MiracleNikkiJp_items'!R10C[-7],RC1,0,1,1)) ->  | Z129: 78 | AA129: =IFERROR(VLOOKUP(RC[-16],R9C26:R17C36,2,FALSE),0)*R6C -> 0 | AB129: =IFERROR(VLOOKUP(RC[-16],R9C26:R17C36,3,FALSE),0)*R6C -> 0 | AC129: =IFERROR(VLOOKUP(RC[-16],R9C26:R17C36,4,FALSE),0)*R6C -> 0 | AD129: =IFERROR(VLOOKUP(RC[-16],R9C26:R17C36,5,FALSE),0)*R6C -> 0 | AE129: =IFERROR(VLOOKUP(RC[-16],R9C26:R17C36,6,FALSE),0)*R6C -> 0 | AF129: =IFERROR(VLOOKUP(RC[-16],R9C26:R17C36,7,FALSE),0)*R6C -> 0 | AG129: =IFERROR(VLOOKUP(RC[-16],R9C26:R17C36,8,FALSE),0)*R6C -> 0 | AH129: =IFERROR(VLOOKUP(RC[-16],R9C26:R17C36,9,FALSE),0)*R6C -> 0 | AI129: =IFERROR(VLOOKUP(RC[-16],R9C26:R17C36,10,FALSE),0)*R6C -> 0 | AJ129: =IFERROR(VLOOKUP(RC[-16],R9C26:R17C36,11,FALSE),0)*R6C -> 0 | AK129: =VLOOKUP(RC10,R9C38:R17C40,2,FALSE) -> 1 | AL129: =VLOOKUP(RC10,R9C38:R17C40,3,FALSE) -> 0 | AM129: =IF(OR(ISBLANK(R4C7),ISERROR(FIND(R4C7,RC21))),"　","●") ->  | AN129: =IF(OR(ISBLANK(R5C7),ISERROR(FIND(R5C7,RC21))),"　","●") ->  | AO129: =IF(RC39<>"●",VLOOKUP("評価しない",R9C42:R17C44,2,FALSE),VLOOKUP(R4C8,R9C42:R17C44,2,FALSE)) -> 1 | AP129: =IF(RC39<>"●",VLOOKUP("",R9C42:R17C44,3,FALSE),VLOOKUP(R4C8,R9C42:R17C44,3,FALSE)) -> 0 | AQ129: =IF(RC40<>"●",VLOOKUP("評価しない",R9C42:R17C44,2,FALSE),VLOOKUP(R5C8,R9C42:R17C44,2,FALSE)) -> 1 | AR129: =IF(RC40<>"●",VLOOKUP("",R9C42:R17C44,3,FALSE),VLOOKUP(R5C8,R9C42:R17C44,3,FALSE)) -> 0 | AS129: =IF(OR(ISBLANK(R6C7),ISERROR(FIND(R6C7,RC25))),"　","●") ->  | AT129: =IF(OR(ISBLANK(R7C7),ISERROR(FIND(R7C7,RC25))),"　","●") ->  | AU129: =IF(RC45<>"●",VLOOKUP("評価しない",R9C46:R17C48,2,FALSE),VLOOKUP(R6C8,R9C46:R17C48,2,FALSE)) -> 1 | AV129: =IF(RC45<>"●",VLOOKUP("",R9C46:R17C48,3,FALSE),VLOOKUP(R6C8,R9C46:R17C48,3,FALSE)) -> 0 | AW129: =IF(RC46<>"●",VLOOKUP("評価しない",R9C46:R17C48,2,FALSE),VLOOKUP(R7C8,R9C46:R17C48,2,FALSE)) -> 1 | AX129: =IF(RC46<>"●",VLOOKUP("",R9C46:R17C48,3,FALSE),VLOOKUP(R7C8,R9C46:R17C48,3,FALSE)) -> 0 | AY129: =SUM(RC27:RC36) -> 0 | AZ129: =RC37*RC41*RC43*RC47*RC49 -> 1 | BA129: =RC38+RC42+RC44+RC48+RC50 -> 0
A130: =OFFSET(R164C1,INT((RC26-1)/100),MOD(INT((RC26-1)/10),10),1,1)*10+MOD(RC26-1,10)+1 -> 79 | D130: =IF(AND(RC2<>"NG",OR(RC2<>"",RC3<>"",R9C4="×")),"◯","") ->  | E130: =IF(RC2="◯",RC6,"") ->  | F130: =T(OFFSET('[MiracleNikkiJp_items.csv]MiracleNikkiJp_items'!R10C[-3],RC1,0,1,1)) -> ヘアスタイル | G130: =T(OFFSET('[MiracleNikkiJp_items.csv]MiracleNikkiJp_items'!R10C[-2],RC1,0,1,1)) ->  | H130: =IF(RC4="",0,RC51*RC52+RC53) -> 0 | I130: =RC1 -> 79 | J130: =OFFSET('[MiracleNikkiJp_items.csv]MiracleNikkiJp_items'!R10C[-4],RC1,0,1,1) -> 0 | K130: =T(OFFSET('[MiracleNikkiJp_items.csv]MiracleNikkiJp_items'!R10C[-4],RC1,0,1,1)) ->  | L130: =T(OFFSET('[MiracleNikkiJp_items.csv]MiracleNikkiJp_items'!R10C[-4],RC1,0,1,1)) ->  | M130: =T(OFFSET('[MiracleNikkiJp_items.csv]MiracleNikkiJp_items'!R10C[-4],RC1,0,1,1)) ->  | N130: =T(OFFSET('[MiracleNikkiJp_items.csv]MiracleNikkiJp_items'!R10C[-4],RC1,0,1,1)) ->  | O130: =T(OFFSET('[MiracleNikkiJp_items.csv]MiracleNikkiJp_items'!R10C[-4],RC1,0,1,1)) ->  | P130: =T(OFFSET('[MiracleNikkiJp_items.csv]MiracleNikkiJp_items'!R10C[-4],RC1,0,1,1)) ->  | Q130: =T(OFFSET('[MiracleNikkiJp_items.csv]MiracleNikkiJp_items'!R10C[-4],RC1,0,1,1)) ->  | R130: =T(OFFSET('[MiracleNikkiJp_items.csv]MiracleNikkiJp_items'!R10C[-4],RC1,0,1,1)) ->  | S130: =T(OFFSET('[MiracleNikkiJp_items.csv]MiracleNikkiJp_items'!R10C[-4],RC1,0,1,1)) ->  | T130: =T(OFFSET('[MiracleNikkiJp_items.csv]MiracleNikkiJp_items'!R10C[-4],RC1,0,1,1)) ->  | U130: =T(OFFSET('[MiracleNikkiJp_items.csv]MiracleNikkiJp_items'!R10C[-4],RC1,0,1,1)) ->  | Y130: =T(OFFSET('[MiracleNikkiJp_items.csv]MiracleNikkiJp_items'!R10C[-7],RC1,0,1,1)) ->  | Z130: 79 | AA130: =IFERROR(VLOOKUP(RC[-16],R9C26:R17C36,2,FALSE),0)*R6C -> 0 | AB130: =IFERROR(VLOOKUP(RC[-16],R9C26:R17C36,3,FALSE),0)*R6C -> 0 | AC130: =IFERROR(VLOOKUP(RC[-16],R9C26:R17C36,4,FALSE),0)*R6C -> 0 | AD130: =IFERROR(VLOOKUP(RC[-16],R9C26:R17C36,5,FALSE),0)*R6C -> 0 | AE130: =IFERROR(VLOOKUP(RC[-16],R9C26:R17C36,6,FALSE),0)*R6C -> 0 | AF130: =IFERROR(VLOOKUP(RC[-16],R9C26:R17C36,7,FALSE),0)*R6C -> 0 | AG130: =IFERROR(VLOOKUP(RC[-16],R9C26:R17C36,8,FALSE),0)*R6C -> 0 | AH130: =IFERROR(VLOOKUP(RC[-16],R9C26:R17C36,9,FALSE),0)*R6C -> 0 | AI130: =IFERROR(VLOOKUP(RC[-16],R9C26:R17C36,10,FALSE),0)*R6C -> 0 | AJ130: =IFERROR(VLOOKUP(RC[-16],R9C26:R17C36,11,FALSE),0)*R6C -> 0 | AK130: =VLOOKUP(RC10,R9C38:R17C40,2,FALSE) -> 1 | AL130: =VLOOKUP(RC10,R9C38:R17C40,3,FALSE) -> 0 | AM130: =IF(OR(ISBLANK(R4C7),ISERROR(FIND(R4C7,RC21))),"　","●") ->  | AN130: =IF(OR(ISBLANK(R5C7),ISERROR(FIND(R5C7,RC21))),"　","●") ->  | AO130: =IF(RC39<>"●",VLOOKUP("評価しない",R9C42:R17C44,2,FALSE),VLOOKUP(R4C8,R9C42:R17C44,2,FALSE)) -> 1 | AP130: =IF(RC39<>"●",VLOOKUP("",R9C42:R17C44,3,FALSE),VLOOKUP(R4C8,R9C42:R17C44,3,FALSE)) -> 0 | AQ130: =IF(RC40<>"●",VLOOKUP("評価しない",R9C42:R17C44,2,FALSE),VLOOKUP(R5C8,R9C42:R17C44,2,FALSE)) -> 1 | AR130: =IF(RC40<>"●",VLOOKUP("",R9C42:R17C44,3,FALSE),VLOOKUP(R5C8,R9C42:R17C44,3,FALSE)) -> 0 | AS130: =IF(OR(ISBLANK(R6C7),ISERROR(FIND(R6C7,RC25))),"　","●") ->  | AT130: =IF(OR(ISBLANK(R7C7),ISERROR(FIND(R7C7,RC25))),"　","●") ->  | AU130: =IF(RC45<>"●",VLOOKUP("評価しない",R9C46:R17C48,2,FALSE),VLOOKUP(R6C8,R9C46:R17C48,2,FALSE)) -> 1 | AV130: =IF(RC45<>"●",VLOOKUP("",R9C46:R17C48,3,FALSE),VLOOKUP(R6C8,R9C46:R17C48,3,FALSE)) -> 0 | AW130: =IF(RC46<>"●",VLOOKUP("評価しない",R9C46:R17C48,2,FALSE),VLOOKUP(R7C8,R9C46:R17C48,2,FALSE)) -> 1 | AX130: =IF(RC46<>"●",VLOOKUP("",R9C46:R17C48,3,FALSE),VLOOKUP(R7C8,R9C46:R17C48,3,FALSE)) -> 0 | AY130: =SUM(RC27:RC36) -> 0 | AZ130: =RC37*RC41*RC43*RC47*RC49 -> 1 | BA130: =RC38+RC42+RC44+RC48+RC50 -> 0
A131: =OFFSET(R164C1,INT((RC26-1)/100),MOD(INT((RC26-1)/10),10),1,1)*10+MOD(RC26-1,10)+1 -> 80 | D131: =IF(AND(RC2<>"NG",OR(RC2<>"",RC3<>"",R9C4="×")),"◯","") ->  | E131: =IF(RC2="◯",RC6,"") ->  | F131: =T(OFFSET('[MiracleNikkiJp_items.csv]MiracleNikkiJp_items'!R10C[-3],RC1,0,1,1)) -> ヘアスタイル | G131: =T(OFFSET('[MiracleNikkiJp_items.csv]MiracleNikkiJp_items'!R10C[-2],RC1,0,1,1)) ->  | H131: =IF(RC4="",0,RC51*RC52+RC53) -> 0 | I131: =RC1 -> 80 | J131: =OFFSET('[MiracleNikkiJp_items.csv]MiracleNikkiJp_items'!R10C[-4],RC1,0,1,1) -> 0 | K131: =T(OFFSET('[MiracleNikkiJp_items.csv]MiracleNikkiJp_items'!R10C[-4],RC1,0,1,1)) ->  | L131: =T(OFFSET('[MiracleNikkiJp_items.csv]MiracleNikkiJp_items'!R10C[-4],RC1,0,1,1)) ->  | M131: =T(OFFSET('[MiracleNikkiJp_items.csv]MiracleNikkiJp_items'!R10C[-4],RC1,0,1,1)) ->  | N131: =T(OFFSET('[MiracleNikkiJp_items.csv]MiracleNikkiJp_items'!R10C[-4],RC1,0,1,1)) ->  | O131: =T(OFFSET('[MiracleNikkiJp_items.csv]MiracleNikkiJp_items'!R10C[-4],RC1,0,1,1)) ->  | P131: =T(OFFSET('[MiracleNikkiJp_items.csv]MiracleNikkiJp_items'!R10C[-4],RC1,0,1,1)) ->  | Q131: =T(OFFSET('[MiracleNikkiJp_items.csv]MiracleNikkiJp_items'!R10C[-4],RC1,0,1,1)) ->  | R131: =T(OFFSET('[MiracleNikkiJp_items.csv]MiracleNikkiJp_items'!R10C[-4],RC1,0,1,1)) ->  | S131: =T(OFFSET('[MiracleNikkiJp_items.csv]MiracleNikkiJp_items'!R10C[-4],RC1,0,1,1)) ->  | T131: =T(OFFSET('[MiracleNikkiJp_items.csv]MiracleNikkiJp_items'!R10C[-4],RC1,0,1,1)) ->  | U131: =T(OFFSET('[MiracleNikkiJp_items.csv]MiracleNikkiJp_items'!R10C[-4],RC1,0,1,1)) ->  | Y131: =T(OFFSET('[MiracleNikkiJp_items.csv]MiracleNikkiJp_items'!R10C[-7],RC1,0,1,1)) ->  | Z131: 80 | AA131: =IFERROR(VLOOKUP(RC[-16],R9C26:R17C36,2,FALSE),0)*R6C -> 0 | AB131: =IFERROR(VLOOKUP(RC[-16],R9C26:R17C36,3,FALSE),0)*R6C -> 0 | AC131: =IFERROR(VLOOKUP(RC[-16],R9C26:R17C36,4,FALSE),0)*R6C -> 0 | AD131: =IFERROR(VLOOKUP(RC[-16],R9C26:R17C36,5,FALSE),0)*R6C -> 0 | AE131: =IFERROR(VLOOKUP(RC[-16],R9C26:R17C36,6,FALSE),0)*R6C -> 0 | AF131: =IFERROR(VLOOKUP(RC[-16],R9C26:R17C36,7,FALSE),0)*R6C -> 0 | AG131: =IFERROR(VLOOKUP(RC[-16],R9C26:R17C36,8,FALSE),0)*R6C -> 0 | AH131: =IFERROR(VLOOKUP(RC[-16],R9C26:R17C36,9,FALSE),0)*R6C -> 0 | AI131: =IFERROR(VLOOKUP(RC[-16],R9C26:R17C36,10,FALSE),0)*R6C -> 0 | AJ131: =IFERROR(VLOOKUP(RC[-16],R9C26:R17C36,11,FALSE),0)*R6C -> 0 | AK131: =VLOOKUP(RC10,R9C38:R17C40,2,FALSE) -> 1 | AL131: =VLOOKUP(RC10,R9C38:R17C40,3,FALSE) -> 0 | AM131: =IF(OR(ISBLANK(R4C7),ISERROR(FIND(R4C7,RC21))),"　","●") ->  | AN131: =IF(OR(ISBLANK(R5C7),ISERROR(FIND(R5C7,RC21))),"　","●") ->  | AO131: =IF(RC39<>"●",VLOOKUP("評価しない",R9C42:R17C44,2,FALSE),VLOOKUP(R4C8,R9C42:R17C44,2,FALSE)) -> 1 | AP131: =IF(RC39<>"●",VLOOKUP("",R9C42:R17C44,3,FALSE),VLOOKUP(R4C8,R9C42:R17C44,3,FALSE)) -> 0 | AQ131: =IF(RC40<>"●",VLOOKUP("評価しない",R9C42:R17C44,2,FALSE),VLOOKUP(R5C8,R9C42:R17C44,2,FALSE)) -> 1 | AR131: =IF(RC40<>"●",VLOOKUP("",R9C42:R17C44,3,FALSE),VLOOKUP(R5C8,R9C42:R17C44,3,FALSE)) -> 0 | AS131: =IF(OR(ISBLANK(R6C7),ISERROR(FIND(R6C7,RC25))),"　","●") ->  | AT131: =IF(OR(ISBLANK(R7C7),ISERROR(FIND(R7C7,RC25))),"　","●") ->  | AU131: =IF(RC45<>"●",VLOOKUP("評価しない",R9C46:R17C48,2,FALSE),VLOOKUP(R6C8,R9C46:R17C48,2,FALSE)) -> 1 | AV131: =IF(RC45<>"●",VLOOKUP("",R9C46:R17C48,3,FALSE),VLOOKUP(R6C8,R9C46:R17C48,3,FALSE)) -> 0 | AW131: =IF(RC46<>"●",VLOOKUP("評価しない",R9C46:R17C48,2,FALSE),VLOOKUP(R7C8,R9C46:R17C48,2,FALSE)) -> 1 | AX131: =IF(RC46<>"●",VLOOKUP("",R9C46:R17C48,3,FALSE),VLOOKUP(R7C8,R9C46:R17C48,3,FALSE)) -> 0 | AY131: =SUM(RC27:RC36) -> 0 | AZ131: =RC37*RC41*RC43*RC47*RC49 -> 1 | BA131: =RC38+RC42+RC44+RC48+RC50 -> 0
A132: =OFFSET(R164C1,INT((RC26-1)/100),MOD(INT((RC26-1)/10),10),1,1)*10+MOD(RC26-1,10)+1 -> 81 | D132: =IF(AND(RC2<>"NG",OR(RC2<>"",RC3<>"",R9C4="×")),"◯","") ->  | E132: =IF(RC2="◯",RC6,"") ->  | F132: =T(OFFSET('[MiracleNikkiJp_items.csv]MiracleNikkiJp_items'!R10C[-3],RC1,0,1,1)) -> ヘアスタイル | G132: =T(OFFSET('[MiracleNikkiJp_items.csv]MiracleNikkiJp_items'!R10C[-2],RC1,0,1,1)) ->  | H132: =IF(RC4="",0,RC51*RC52+RC53) -> 0 | I132: =RC1 -> 81 | J132: =OFFSET('[MiracleNikkiJp_items.csv]MiracleNikkiJp_items'!R10C[-4],RC1,0,1,1) -> 0 | K132: =T(OFFSET('[MiracleNikkiJp_items.csv]MiracleNikkiJp_items'!R10C[-4],RC1,0,1,1)) ->  | L132: =T(OFFSET('[MiracleNikkiJp_items.csv]MiracleNikkiJp_items'!R10C[-4],RC1,0,1,1)) ->  | M132: =T(OFFSET('[MiracleNikkiJp_items.csv]MiracleNikkiJp_items'!R10C[-4],RC1,0,1,1)) ->  | N132: =T(OFFSET('[MiracleNikkiJp_items.csv]MiracleNikkiJp_items'!R10C[-4],RC1,0,1,1)) ->  | O132: =T(OFFSET('[MiracleNikkiJp_items.csv]MiracleNikkiJp_items'!R10C[-4],RC1,0,1,1)) ->  | P132: =T(OFFSET('[MiracleNikkiJp_items.csv]MiracleNikkiJp_items'!R10C[-4],RC1,0,1,1)) ->  | Q132: =T(OFFSET('[MiracleNikkiJp_items.csv]MiracleNikkiJp_items'!R10C[-4],RC1,0,1,1)) ->  | R132: =T(OFFSET('[MiracleNikkiJp_items.csv]MiracleNikkiJp_items'!R10C[-4],RC1,0,1,1)) ->  | S132: =T(OFFSET('[MiracleNikkiJp_items.csv]MiracleNikkiJp_items'!R10C[-4],RC1,0,1,1)) ->  | T132: =T(OFFSET('[MiracleNikkiJp_items.csv]MiracleNikkiJp_items'!R10C[-4],RC1,0,1,1)) ->  | U132: =T(OFFSET('[MiracleNikkiJp_items.csv]MiracleNikkiJp_items'!R10C[-4],RC1,0,1,1)) ->  | Y132: =T(OFFSET('[MiracleNikkiJp_items.csv]MiracleNikkiJp_items'!R10C[-7],RC1,0,1,1)) ->  | Z132: 81 | AA132: =IFERROR(VLOOKUP(RC[-16],R9C26:R17C36,2,FALSE),0)*R6C -> 0 | AB132: =IFERROR(VLOOKUP(RC[-16],R9C26:R17C36,3,FALSE),0)*R6C -> 0 | AC132: =IFERROR(VLOOKUP(RC[-16],R9C26:R17C36,4,FALSE),0)*R6C -> 0 | AD132: =IFERROR(VLOOKUP(RC[-16],R9C26:R17C36,5,FALSE),0)*R6C -> 0 | AE132: =IFERROR(VLOOKUP(RC[-16],R9C26:R17C36,6,FALSE),0)*R6C -> 0 | AF132: =IFERROR(VLOOKUP(RC[-16],R9C26:R17C36,7,FALSE),0)*R6C -> 0 | AG132: =IFERROR(VLOOKUP(RC[-16],R9C26:R17C36,8,FALSE),0)*R6C -> 0 | AH132: =IFERROR(VLOOKUP(RC[-16],R9C26:R17C36,9,FALSE),0)*R6C -> 0 | AI132: =IFERROR(VLOOKUP(RC[-16],R9C26:R17C36,10,FALSE),0)*R6C -> 0 | AJ132: =IFERROR(VLOOKUP(RC[-16],R9C26:R17C36,11,FALSE),0)*R6C -> 0 | AK132: =VLOOKUP(RC10,R9C38:R17C40,2,FALSE) -> 1 | AL132: =VLOOKUP(RC10,R9C38:R17C40,3,FALSE) -> 0 | AM132: =IF(OR(ISBLANK(R4C7),ISERROR(FIND(R4C7,RC21))),"　","●") ->  | AN132: =IF(OR(ISBLANK(R5C7),ISERROR(FIND(R5C7,RC21))),"　","●") ->  | AO132: =IF(RC39<>"●",VLOOKUP("評価しない",R9C42:R17C44,2,FALSE),VLOOKUP(R4C8,R9C42:R17C44,2,FALSE)) -> 1 | AP132: =IF(RC39<>"●",VLOOKUP("",R9C42:R17C44,3,FALSE),VLOOKUP(R4C8,R9C42:R17C44,3,FALSE)) -> 0 | AQ132: =IF(RC40<>"●",VLOOKUP("評価しない",R9C42:R17C44,2,FALSE),VLOOKUP(R5C8,R9C42:R17C44,2,FALSE)) -> 1 | AR132: =IF(RC40<>"●",VLOOKUP("",R9C42:R17C44,3,FALSE),VLOOKUP(R5C8,R9C42:R17C44,3,FALSE)) -> 0 | AS132: =IF(OR(ISBLANK(R6C7),ISERROR(FIND(R6C7,RC25))),"　","●") ->  | AT132: =IF(OR(ISBLANK(R7C7),ISERROR(FIND(R7C7,RC25))),"　","●") ->  | AU132: =IF(RC45<>"●",VLOOKUP("評価しない",R9C46:R17C48,2,FALSE),VLOOKUP(R6C8,R9C46:R17C48,2,FALSE)) -> 1 | AV132: =IF(RC45<>"●",VLOOKUP("",R9C46:R17C48,3,FALSE),VLOOKUP(R6C8,R9C46:R17C48,3,FALSE)) -> 0 | AW132: =IF(RC46<>"●",VLOOKUP("評価しない",R9C46:R17C48,2,FALSE),VLOOKUP(R7C8,R9C46:R17C48,2,FALSE)) -> 1 | AX132: =IF(RC46<>"●",VLOOKUP("",R9C46:R17C48,3,FALSE),VLOOKUP(R7C8,R9C46:R17C48,3,FALSE)) -> 0 | AY132: =SUM(RC27:RC36) -> 0 | AZ132: =RC37*RC41*RC43*RC47*RC49 -> 1 | BA132: =RC38+RC42+RC44+RC48+RC50 -> 0
A133: =OFFSET(R164C1,INT((RC26-1)/100),MOD(INT((RC26-1)/10),10),1,1)*10+MOD(RC26-1,10)+1 -> 82 | D133: =IF(AND(RC2<>"NG",OR(RC2<>"",RC3<>"",R9C4="×")),"◯","") ->  | E133: =IF(RC2="◯",RC6,"") ->  | F133: =T(OFFSET('[MiracleNikkiJp_items.csv]MiracleNikkiJp_items'!R10C[-3],RC1,0,1,1)) -> ヘアスタイル | G133: =T(OFFSET('[MiracleNikkiJp_items.csv]MiracleNikkiJp_items'!R10C[-2],RC1,0,1,1)) ->  | H133: =IF(RC4="",0,RC51*RC52+RC53) -> 0 | I133: =RC1 -> 82 | J133: =OFFSET('[MiracleNikkiJp_items.csv]MiracleNikkiJp_items'!R10C[-4],RC1,0,1,1) -> 0 | K133: =T(OFFSET('[MiracleNikkiJp_items.csv]MiracleNikkiJp_items'!R10C[-4],RC1,0,1,1)) ->  | L133: =T(OFFSET('[MiracleNikkiJp_items.csv]MiracleNikkiJp_items'!R10C[-4],RC1,0,1,1)) ->  | M133: =T(OFFSET('[MiracleNikkiJp_items.csv]MiracleNikkiJp_items'!R10C[-4],RC1,0,1,1)) ->  | N133: =T(OFFSET('[MiracleNikkiJp_items.csv]MiracleNikkiJp_items'!R10C[-4],RC1,0,1,1)) ->  | O133: =T(OFFSET('[MiracleNikkiJp_items.csv]MiracleNikkiJp_items'!R10C[-4],RC1,0,1,1)) ->  | P133: =T(OFFSET('[MiracleNikkiJp_items.csv]MiracleNikkiJp_items'!R10C[-4],RC1,0,1,1)) ->  | Q133: =T(OFFSET('[MiracleNikkiJp_items.csv]MiracleNikkiJp_items'!R10C[-4],RC1,0,1,1)) ->  | R133: =T(OFFSET('[MiracleNikkiJp_items.csv]MiracleNikkiJp_items'!R10C[-4],RC1,0,1,1)) ->  | S133: =T(OFFSET('[MiracleNikkiJp_items.csv]MiracleNikkiJp_items'!R10C[-4],RC1,0,1,1)) ->  | T133: =T(OFFSET('[MiracleNikkiJp_items.csv]MiracleNikkiJp_items'!R10C[-4],RC1,0,1,1)) ->  | U133: =T(OFFSET('[MiracleNikkiJp_items.csv]MiracleNikkiJp_items'!R10C[-4],RC1,0,1,1)) ->  | Y133: =T(OFFSET('[MiracleNikkiJp_items.csv]MiracleNikkiJp_items'!R10C[-7],RC1,0,1,1)) ->  | Z133: 82 | AA133: =IFERROR(VLOOKUP(RC[-16],R9C26:R17C36,2,FALSE),0)*R6C -> 0 | AB133: =IFERROR(VLOOKUP(RC[-16],R9C26:R17C36,3,FALSE),0)*R6C -> 0 | AC133: =IFERROR(VLOOKUP(RC[-16],R9C26:R17C36,4,FALSE),0)*R6C -> 0 | AD133: =IFERROR(VLOOKUP(RC[-16],R9C26:R17C36,5,FALSE),0)*R6C -> 0 | AE133: =IFERROR(VLOOKUP(RC[-16],R9C26:R17C36,6,FALSE),0)*R6C -> 0 | AF133: =IFERROR(VLOOKUP(RC[-16],R9C26:R17C36,7,FALSE),0)*R6C -> 0 | AG133: =IFERROR(VLOOKUP(RC[-16],R9C26:R17C36,8,FALSE),0)*R6C -> 0 | AH133: =IFERROR(VLOOKUP(RC[-16],R9C26:R17C36,9,FALSE),0)*R6C -> 0 | AI133: =IFERROR(VLOOKUP(RC[-16],R9C26:R17C36,10,FALSE),0)*R6C -> 0 | AJ133: =IFERROR(VLOOKUP(RC[-16],R9C26:R17C36,11,FALSE),0)*R6C -> 0 | AK133: =VLOOKUP(RC10,R9C38:R17C40,2,FALSE) -> 1 | AL133: =VLOOKUP(RC10,R9C38:R17C40,3,FALSE) -> 0 | AM133: =IF(OR(ISBLANK(R4C7),ISERROR(FIND(R4C7,RC21))),"　","●") ->  | AN133: =IF(OR(ISBLANK(R5C7),ISERROR(FIND(R5C7,RC21))),"　","●") ->  | AO133: =IF(RC39<>"●",VLOOKUP("評価しない",R9C42:R17C44,2,FALSE),VLOOKUP(R4C8,R9C42:R17C44,2,FALSE)) -> 1 | AP133: =IF(RC39<>"●",VLOOKUP("",R9C42:R17C44,3,FALSE),VLOOKUP(R4C8,R9C42:R17C44,3,FALSE)) -> 0 | AQ133: =IF(RC40<>"●",VLOOKUP("評価しない",R9C42:R17C44,2,FALSE),VLOOKUP(R5C8,R9C42:R17C44,2,FALSE)) -> 1 | AR133: =IF(RC40<>"●",VLOOKUP("",R9C42:R17C44,3,FALSE),VLOOKUP(R5C8,R9C42:R17C44,3,FALSE)) -> 0 | AS133: =IF(OR(ISBLANK(R6C7),ISERROR(FIND(R6C7,RC25))),"　","●") ->  | AT133: =IF(OR(ISBLANK(R7C7),ISERROR(FIND(R7C7,RC25))),"　","●") ->  | AU133: =IF(RC45<>"●",VLOOKUP("評価しない",R9C46:R17C48,2,FALSE),VLOOKUP(R6C8,R9C46:R17C48,2,FALSE)) -> 1 | AV133: =IF(RC45<>"●",VLOOKUP("",R9C46:R17C48,3,FALSE),VLOOKUP(R6C8,R9C46:R17C48,3,FALSE)) -> 0 | AW133: =IF(RC46<>"●",VLOOKUP("評価しない",R9C46:R17C48,2,FALSE),VLOOKUP(R7C8,R9C46:R17C48,2,FALSE)) -> 1 | AX133: =IF(RC46<>"●",VLOOKUP("",R9C46:R17C48,3,FALSE),VLOOKUP(R7C8,R9C46:R17C48,3,FALSE)) -> 0 | AY133: =SUM(RC27:RC36) -> 0 | AZ133: =RC37*RC41*RC43*RC47*RC49 -> 1 | BA133: =RC38+RC42+RC44+RC48+RC50 -> 0
A134: =OFFSET(R164C1,INT((RC26-1)/100),MOD(INT((RC26-1)/10),10),1,1)*10+MOD(RC26-1,10)+1 -> 83 | D134: =IF(AND(RC2<>"NG",OR(RC2<>"",RC3<>"",R9C4="×")),"◯","") ->  | E134: =IF(RC2="◯",RC6,"") ->  | F134: =T(OFFSET('[MiracleNikkiJp_items.csv]MiracleNikkiJp_items'!R10C[-3],RC1,0,1,1)) -> ヘアスタイル | G134: =T(OFFSET('[MiracleNikkiJp_items.csv]MiracleNikkiJp_items'!R10C[-2],RC1,0,1,1)) ->  | H134: =IF(RC4="",0,RC51*RC52+RC53) -> 0 | I134: =RC1 -> 83 | J134: =OFFSET('[MiracleNikkiJp_items.csv]MiracleNikkiJp_items'!R10C[-4],RC1,0,1,1) -> 0 | K134: =T(OFFSET('[MiracleNikkiJp_items.csv]MiracleNikkiJp_items'!R10C[-4],RC1,0,1,1)) ->  | L134: =T(OFFSET('[MiracleNikkiJp_items.csv]MiracleNikkiJp_items'!R10C[-4],RC1,0,1,1)) ->  | M134: =T(OFFSET('[MiracleNikkiJp_items.csv]MiracleNikkiJp_items'!R10C[-4],RC1,0,1,1)) ->  | N134: =T(OFFSET('[MiracleNikkiJp_items.csv]MiracleNikkiJp_items'!R10C[-4],RC1,0,1,1)) ->  | O134: =T(OFFSET('[MiracleNikkiJp_items.csv]MiracleNikkiJp_items'!R10C[-4],RC1,0,1,1)) ->  | P134: =T(OFFSET('[MiracleNikkiJp_items.csv]MiracleNikkiJp_items'!R10C[-4],RC1,0,1,1)) ->  | Q134: =T(OFFSET('[MiracleNikkiJp_items.csv]MiracleNikkiJp_items'!R10C[-4],RC1,0,1,1)) ->  | R134: =T(OFFSET('[MiracleNikkiJp_items.csv]MiracleNikkiJp_items'!R10C[-4],RC1,0,1,1)) ->  | S134: =T(OFFSET('[MiracleNikkiJp_items.csv]MiracleNikkiJp_items'!R10C[-4],RC1,0,1,1)) ->  | T134: =T(OFFSET('[MiracleNikkiJp_items.csv]MiracleNikkiJp_items'!R10C[-4],RC1,0,1,1)) ->  | U134: =T(OFFSET('[MiracleNikkiJp_items.csv]MiracleNikkiJp_items'!R10C[-4],RC1,0,1,1)) ->  | Y134: =T(OFFSET('[MiracleNikkiJp_items.csv]MiracleNikkiJp_items'!R10C[-7],RC1,0,1,1)) ->  | Z134: 83 | AA134: =IFERROR(VLOOKUP(RC[-16],R9C26:R17C36,2,FALSE),0)*R6C -> 0 | AB134: =IFERROR(VLOOKUP(RC[-16],R9C26:R17C36,3,FALSE),0)*R6C -> 0 | AC134: =IFERROR(VLOOKUP(RC[-16],R9C26:R17C36,4,FALSE),0)*R6C -> 0 | AD134: =IFERROR(VLOOKUP(RC[-16],R9C26:R17C36,5,FALSE),0)*R6C -> 0 | AE134: =IFERROR(VLOOKUP(RC[-16],R9C26:R17C36,6,FALSE),0)*R6C -> 0 | AF134: =IFERROR(VLOOKUP(RC[-16],R9C26:R17C36,7,FALSE),0)*R6C -> 0 | AG134: =IFERROR(VLOOKUP(RC[-16],R9C26:R17C36,8,FALSE),0)*R6C -> 0 | AH134: =IFERROR(VLOOKUP(RC[-16],R9C26:R17C36,9,FALSE),0)*R6C -> 0 | AI134: =IFERROR(VLOOKUP(RC[-16],R9C26:R17C36,10,FALSE),0)*R6C -> 0 | AJ134: =IFERROR(VLOOKUP(RC[-16],R9C26:R17C36,11,FALSE),0)*R6C -> 0 | AK134: =VLOOKUP(RC10,R9C38:R17C40,2,FALSE) -> 1 | AL134: =VLOOKUP(RC10,R9C38:R17C40,3,FALSE) -> 0 | AM134: =IF(OR(ISBLANK(R4C7),ISERROR(FIND(R4C7,RC21))),"　","●") ->  | AN134: =IF(OR(ISBLANK(R5C7),ISERROR(FIND(R5C7,RC21))),"　","●") ->  | AO134: =IF(RC39<>"●",VLOOKUP("評価しない",R9C42:R17C44,2,FALSE),VLOOKUP(R4C8,R9C42:R17C44,2,FALSE)) -> 1 | AP134: =IF(RC39<>"●",VLOOKUP("",R9C42:R17C44,3,FALSE),VLOOKUP(R4C8,R9C42:R17C44,3,FALSE)) -> 0 | AQ134: =IF(RC40<>"●",VLOOKUP("評価しない",R9C42:R17C44,2,FALSE),VLOOKUP(R5C8,R9C42:R17C44,2,FALSE)) -> 1 | AR134: =IF(RC40<>"●",VLOOKUP("",R9C42:R17C44,3,FALSE),VLOOKUP(R5C8,R9C42:R17C44,3,FALSE)) -> 0 | AS134: =IF(OR(ISBLANK(R6C7),ISERROR(FIND(R6C7,RC25))),"　","●") ->  | AT134: =IF(OR(ISBLANK(R7C7),ISERROR(FIND(R7C7,RC25))),"　","●") ->  | AU134: =IF(RC45<>"●",VLOOKUP("評価しない",R9C46:R17C48,2,FALSE),VLOOKUP(R6C8,R9C46:R17C48,2,FALSE)) -> 1 | AV134: =IF(RC45<>"●",VLOOKUP("",R9C46:R17C48,3,FALSE),VLOOKUP(R6C8,R9C46:R17C48,3,FALSE)) -> 0 | AW134: =IF(RC46<>"●",VLOOKUP("評価しない",R9C46:R17C48,2,FALSE),VLOOKUP(R7C8,R9C46:R17C48,2,FALSE)) -> 1 | AX134: =IF(RC46<>"●",VLOOKUP("",R9C46:R17C48,3,FALSE),VLOOKUP(R7C8,R9C46:R17C48,3,FALSE)) -> 0 | AY134: =SUM(RC27:RC36) -> 0 | AZ134: =RC37*RC41*RC43*RC47*RC49 -> 1 | BA134: =RC38+RC42+RC44+RC48+RC50 -> 0
A135: =OFFSET(R164C1,INT((RC26-1)/100),MOD(INT((RC26-1)/10),10),1,1)*10+MOD(RC26-1,10)+1 -> 84 | D135: =IF(AND(RC2<>"NG",OR(RC2<>"",RC3<>"",R9C4="×")),"◯","") ->  | E135: =IF(RC2="◯",RC6,"") ->  | F135: =T(OFFSET('[MiracleNikkiJp_items.csv]MiracleNikkiJp_items'!R10C[-3],RC1,0,1,1)) -> ヘアスタイル | G135: =T(OFFSET('[MiracleNikkiJp_items.csv]MiracleNikkiJp_items'!R10C[-2],RC1,0,1,1)) ->  | H135: =IF(RC4="",0,RC51*RC52+RC53) -> 0 | I135: =RC1 -> 84 | J135: =OFFSET('[MiracleNikkiJp_items.csv]MiracleNikkiJp_items'!R10C[-4],RC1,0,1,1) -> 0 | K135: =T(OFFSET('[MiracleNikkiJp_items.csv]MiracleNikkiJp_items'!R10C[-4],RC1,0,1,1)) ->  | L135: =T(OFFSET('[MiracleNikkiJp_items.csv]MiracleNikkiJp_items'!R10C[-4],RC1,0,1,1)) ->  | M135: =T(OFFSET('[MiracleNikkiJp_items.csv]MiracleNikkiJp_items'!R10C[-4],RC1,0,1,1)) ->  | N135: =T(OFFSET('[MiracleNikkiJp_items.csv]MiracleNikkiJp_items'!R10C[-4],RC1,0,1,1)) ->  | O135: =T(OFFSET('[MiracleNikkiJp_items.csv]MiracleNikkiJp_items'!R10C[-4],RC1,0,1,1)) ->  | P135: =T(OFFSET('[MiracleNikkiJp_items.csv]MiracleNikkiJp_items'!R10C[-4],RC1,0,1,1)) ->  | Q135: =T(OFFSET('[MiracleNikkiJp_items.csv]MiracleNikkiJp_items'!R10C[-4],RC1,0,1,1)) ->  | R135: =T(OFFSET('[MiracleNikkiJp_items.csv]MiracleNikkiJp_items'!R10C[-4],RC1,0,1,1)) ->  | S135: =T(OFFSET('[MiracleNikkiJp_items.csv]MiracleNikkiJp_items'!R10C[-4],RC1,0,1,1)) ->  | T135: =T(OFFSET('[MiracleNikkiJp_items.csv]MiracleNikkiJp_items'!R10C[-4],RC1,0,1,1)) ->  | U135: =T(OFFSET('[MiracleNikkiJp_items.csv]MiracleNikkiJp_items'!R10C[-4],RC1,0,1,1)) ->  | Y135: =T(OFFSET('[MiracleNikkiJp_items.csv]MiracleNikkiJp_items'!R10C[-7],RC1,0,1,1)) ->  | Z135: 84 | AA135: =IFERROR(VLOOKUP(RC[-16],R9C26:R17C36,2,FALSE),0)*R6C -> 0 | AB135: =IFERROR(VLOOKUP(RC[-16],R9C26:R17C36,3,FALSE),0)*R6C -> 0 | AC135: =IFERROR(VLOOKUP(RC[-16],R9C26:R17C36,4,FALSE),0)*R6C -> 0 | AD135: =IFERROR(VLOOKUP(RC[-16],R9C26:R17C36,5,FALSE),0)*R6C -> 0 | AE135: =IFERROR(VLOOKUP(RC[-16],R9C26:R17C36,6,FALSE),0)*R6C -> 0 | AF135: =IFERROR(VLOOKUP(RC[-16],R9C26:R17C36,7,FALSE),0)*R6C -> 0 | AG135: =IFERROR(VLOOKUP(RC[-16],R9C26:R17C36,8,FALSE),0)*R6C -> 0 | AH135: =IFERROR(VLOOKUP(RC[-16],R9C26:R17C36,9,FALSE),0)*R6C -> 0 | AI135: =IFERROR(VLOOKUP(RC[-16],R9C26:R17C36,10,FALSE),0)*R6C -> 0 | AJ135: =IFERROR(VLOOKUP(RC[-16],R9C26:R17C36,11,FALSE),0)*R6C -> 0 | AK135: =VLOOKUP(RC10,R9C38:R17C40,2,FALSE) -> 1 | AL135: =VLOOKUP(RC10,R9C38:R17C40,3,FALSE) -> 0 | AM135: =IF(OR(ISBLANK(R4C7),ISERROR(FIND(R4C7,RC21))),"　","●") ->  | AN135: =IF(OR(ISBLANK(R5C7),ISERROR(FIND(R5C7,RC21))),"　","●") ->  | AO135: =IF(RC39<>"●",VLOOKUP("評価しない",R9C42:R17C44,2,FALSE),VLOOKUP(R4C8,R9C42:R17C44,2,FALSE)) -> 1 | AP135: =IF(RC39<>"●",VLOOKUP("",R9C42:R17C44,3,FALSE),VLOOKUP(R4C8,R9C42:R17C44,3,FALSE)) -> 0 | AQ135: =IF(RC40<>"●",VLOOKUP("評価しない",R9C42:R17C44,2,FALSE),VLOOKUP(R5C8,R9C42:R17C44,2,FALSE)) -> 1 | AR135: =IF(RC40<>"●",VLOOKUP("",R9C42:R17C44,3,FALSE),VLOOKUP(R5C8,R9C42:R17C44,3,FALSE)) -> 0 | AS135: =IF(OR(ISBLANK(R6C7),ISERROR(FIND(R6C7,RC25))),"　","●") ->  | AT135: =IF(OR(ISBLANK(R7C7),ISERROR(FIND(R7C7,RC25))),"　","●") ->  | AU135: =IF(RC45<>"●",VLOOKUP("評価しない",R9C46:R17C48,2,FALSE),VLOOKUP(R6C8,R9C46:R17C48,2,FALSE)) -> 1 | AV135: =IF(RC45<>"●",VLOOKUP("",R9C46:R17C48,3,FALSE),VLOOKUP(R6C8,R9C46:R17C48,3,FALSE)) -> 0 | AW135: =IF(RC46<>"●",VLOOKUP("評価しない",R9C46:R17C48,2,FALSE),VLOOKUP(R7C8,R9C46:R17C48,2,FALSE)) -> 1 | AX135: =IF(RC46<>"●",VLOOKUP("",R9C46:R17C48,3,FALSE),VLOOKUP(R7C8,R9C46:R17C48,3,FALSE)) -> 0 | AY135: =SUM(RC27:RC36) -> 0 | AZ135: =RC37*RC41*RC43*RC47*RC49 -> 1 | BA135: =RC38+RC42+RC44+RC48+RC50 -> 0
A136: =OFFSET(R164C1,INT((RC26-1)/100),MOD(INT((RC26-1)/10),10),1,1)*10+MOD(RC26-1,10)+1 -> 85 | D136: =IF(AND(RC2<>"NG",OR(RC2<>"",RC3<>"",R9C4="×")),"◯","") ->  | E136: =IF(RC2="◯",RC6,"") ->  | F136: =T(OFFSET('[MiracleNikkiJp_items.csv]MiracleNikkiJp_items'!R10C[-3],RC1,0,1,1)) -> ヘアスタイル | G136: =T(OFFSET('[MiracleNikkiJp_items.csv]MiracleNikkiJp_items'!R10C[-2],RC1,0,1,1)) ->  | H136: =IF(RC4="",0,RC51*RC52+RC53) -> 0 | I136: =RC1 -> 85 | J136: =OFFSET('[MiracleNikkiJp_items.csv]MiracleNikkiJp_items'!R10C[-4],RC1,0,1,1) -> 0 | K136: =T(OFFSET('[MiracleNikkiJp_items.csv]MiracleNikkiJp_items'!R10C[-4],RC1,0,1,1)) ->  | L136: =T(OFFSET('[MiracleNikkiJp_items.csv]MiracleNikkiJp_items'!R10C[-4],RC1,0,1,1)) ->  | M136: =T(OFFSET('[MiracleNikkiJp_items.csv]MiracleNikkiJp_items'!R10C[-4],RC1,0,1,1)) ->  | N136: =T(OFFSET('[MiracleNikkiJp_items.csv]MiracleNikkiJp_items'!R10C[-4],RC1,0,1,1)) ->  | O136: =T(OFFSET('[MiracleNikkiJp_items.csv]MiracleNikkiJp_items'!R10C[-4],RC1,0,1,1)) ->  | P136: =T(OFFSET('[MiracleNikkiJp_items.csv]MiracleNikkiJp_items'!R10C[-4],RC1,0,1,1)) ->  | Q136: =T(OFFSET('[MiracleNikkiJp_items.csv]MiracleNikkiJp_items'!R10C[-4],RC1,0,1,1)) ->  | R136: =T(OFFSET('[MiracleNikkiJp_items.csv]MiracleNikkiJp_items'!R10C[-4],RC1,0,1,1)) ->  | S136: =T(OFFSET('[MiracleNikkiJp_items.csv]MiracleNikkiJp_items'!R10C[-4],RC1,0,1,1)) ->  | T136: =T(OFFSET('[MiracleNikkiJp_items.csv]MiracleNikkiJp_items'!R10C[-4],RC1,0,1,1)) ->  | U136: =T(OFFSET('[MiracleNikkiJp_items.csv]MiracleNikkiJp_items'!R10C[-4],RC1,0,1,1)) ->  | Y136: =T(OFFSET('[MiracleNikkiJp_items.csv]MiracleNikkiJp_items'!R10C[-7],RC1,0,1,1)) ->  | Z136: 85 | AA136: =IFERROR(VLOOKUP(RC[-16],R9C26:R17C36,2,FALSE),0)*R6C -> 0 | AB136: =IFERROR(VLOOKUP(RC[-16],R9C26:R17C36,3,FALSE),0)*R6C -> 0 | AC136: =IFERROR(VLOOKUP(RC[-16],R9C26:R17C36,4,FALSE),0)*R6C -> 0 | AD136: =IFERROR(VLOOKUP(RC[-16],R9C26:R17C36,5,FALSE),0)*R6C -> 0 | AE136: =IFERROR(VLOOKUP(RC[-16],R9C26:R17C36,6,FALSE),0)*R6C -> 0 | AF136: =IFERROR(VLOOKUP(RC[-16],R9C26:R17C36,7,FALSE),0)*R6C -> 0 | AG136: =IFERROR(VLOOKUP(RC[-16],R9C26:R17C36,8,FALSE),0)*R6C -> 0 | AH136: =IFERROR(VLOOKUP(RC[-16],R9C26:R17C36,9,FALSE),0)*R6C -> 0 | AI136: =IFERROR(VLOOKUP(RC[-16],R9C26:R17C36,10,FALSE),0)*R6C -> 0 | AJ136: =IFERROR(VLOOKUP(RC[-16],R9C26:R17C36,11,FALSE),0)*R6C -> 0 | AK136: =VLOOKUP(RC10,R9C38:R17C40,2,FALSE) -> 1 | AL136: =VLOOKUP(RC10,R9C38:R17C40,3,FALSE) -> 0 | AM136: =IF(OR(ISBLANK(R4C7),ISERROR(FIND(R4C7,RC21))),"　","●") ->  | AN136: =IF(OR(ISBLANK(R5C7),ISERROR(FIND(R5C7,RC21))),"　","●") ->  | AO136: =IF(RC39<>"●",VLOOKUP("評価しない",R9C42:R17C44,2,FALSE),VLOOKUP(R4C8,R9C42:R17C44,2,FALSE)) -> 1 | AP136: =IF(RC39<>"●",VLOOKUP("",R9C42:R17C44,3,FALSE),VLOOKUP(R4C8,R9C42:R17C44,3,FALSE)) -> 0 | AQ136: =IF(RC40<>"●",VLOOKUP("評価しない",R9C42:R17C44,2,FALSE),VLOOKUP(R5C8,R9C42:R17C44,2,FALSE)) -> 1 | AR136: =IF(RC40<>"●",VLOOKUP("",R9C42:R17C44,3,FALSE),VLOOKUP(R5C8,R9C42:R17C44,3,FALSE)) -> 0 | AS136: =IF(OR(ISBLANK(R6C7),ISERROR(FIND(R6C7,RC25))),"　","●") ->  | AT136: =IF(OR(ISBLANK(R7C7),ISERROR(FIND(R7C7,RC25))),"　","●") ->  | AU136: =IF(RC45<>"●",VLOOKUP("評価しない",R9C46:R17C48,2,FALSE),VLOOKUP(R6C8,R9C46:R17C48,2,FALSE)) -> 1 | AV136: =IF(RC45<>"●",VLOOKUP("",R9C46:R17C48,3,FALSE),VLOOKUP(R6C8,R9C46:R17C48,3,FALSE)) -> 0 | AW136: =IF(RC46<>"●",VLOOKUP("評価しない",R9C46:R17C48,2,FALSE),VLOOKUP(R7C8,R9C46:R17C48,2,FALSE)) -> 1 | AX136: =IF(RC46<>"●",VLOOKUP("",R9C46:R17C48,3,FALSE),VLOOKUP(R7C8,R9C46:R17C48,3,FALSE)) -> 0 | AY136: =SUM(RC27:RC36) -> 0 | AZ136: =RC37*RC41*RC43*RC47*RC49 -> 1 | BA136: =RC38+RC42+RC44+RC48+RC50 -> 0
A137: =OFFSET(R164C1,INT((RC26-1)/100),MOD(INT((RC26-1)/10),10),1,1)*10+MOD(RC26-1,10)+1 -> 86 | D137: =IF(AND(RC2<>"NG",OR(RC2<>"",RC3<>"",R9C4="×")),"◯","") ->  | E137: =IF(RC2="◯",RC6,"") ->  | F137: =T(OFFSET('[MiracleNikkiJp_items.csv]MiracleNikkiJp_items'!R10C[-3],RC1,0,1,1)) -> ヘアスタイル | G137: =T(OFFSET('[MiracleNikkiJp_items.csv]MiracleNikkiJp_items'!R10C[-2],RC1,0,1,1)) ->  | H137: =IF(RC4="",0,RC51*RC52+RC53) -> 0 | I137: =RC1 -> 86 | J137: =OFFSET('[MiracleNikkiJp_items.csv]MiracleNikkiJp_items'!R10C[-4],RC1,0,1,1) -> 0 | K137: =T(OFFSET('[MiracleNikkiJp_items.csv]MiracleNikkiJp_items'!R10C[-4],RC1,0,1,1)) ->  | L137: =T(OFFSET('[MiracleNikkiJp_items.csv]MiracleNikkiJp_items'!R10C[-4],RC1,0,1,1)) ->  | M137: =T(OFFSET('[MiracleNikkiJp_items.csv]MiracleNikkiJp_items'!R10C[-4],RC1,0,1,1)) ->  | N137: =T(OFFSET('[MiracleNikkiJp_items.csv]MiracleNikkiJp_items'!R10C[-4],RC1,0,1,1)) ->  | O137: =T(OFFSET('[MiracleNikkiJp_items.csv]MiracleNikkiJp_items'!R10C[-4],RC1,0,1,1)) ->  | P137: =T(OFFSET('[MiracleNikkiJp_items.csv]MiracleNikkiJp_items'!R10C[-4],RC1,0,1,1)) ->  | Q137: =T(OFFSET('[MiracleNikkiJp_items.csv]MiracleNikkiJp_items'!R10C[-4],RC1,0,1,1)) ->  | R137: =T(OFFSET('[MiracleNikkiJp_items.csv]MiracleNikkiJp_items'!R10C[-4],RC1,0,1,1)) ->  | S137: =T(OFFSET('[MiracleNikkiJp_items.csv]MiracleNikkiJp_items'!R10C[-4],RC1,0,1,1)) ->  | T137: =T(OFFSET('[MiracleNikkiJp_items.csv]MiracleNikkiJp_items'!R10C[-4],RC1,0,1,1)) ->  | U137: =T(OFFSET('[MiracleNikkiJp_items.csv]MiracleNikkiJp_items'!R10C[-4],RC1,0,1,1)) ->  | Y137: =T(OFFSET('[MiracleNikkiJp_items.csv]MiracleNikkiJp_items'!R10C[-7],RC1,0,1,1)) ->  | Z137: 86 | AA137: =IFERROR(VLOOKUP(RC[-16],R9C26:R17C36,2,FALSE),0)*R6C -> 0 | AB137: =IFERROR(VLOOKUP(RC[-16],R9C26:R17C36,3,FALSE),0)*R6C -> 0 | AC137: =IFERROR(VLOOKUP(RC[-16],R9C26:R17C36,4,FALSE),0)*R6C -> 0 | AD137: =IFERROR(VLOOKUP(RC[-16],R9C26:R17C36,5,FALSE),0)*R6C -> 0 | AE137: =IFERROR(VLOOKUP(RC[-16],R9C26:R17C36,6,FALSE),0)*R6C -> 0 | AF137: =IFERROR(VLOOKUP(RC[-16],R9C26:R17C36,7,FALSE),0)*R6C -> 0 | AG137: =IFERROR(VLOOKUP(RC[-16],R9C26:R17C36,8,FALSE),0)*R6C -> 0 | AH137: =IFERROR(VLOOKUP(RC[-16],R9C26:R17C36,9,FALSE),0)*R6C -> 0 | AI137: =IFERROR(VLOOKUP(RC[-16],R9C26:R17C36,10,FALSE),0)*R6C -> 0 | AJ137: =IFERROR(VLOOKUP(RC[-16],R9C26:R17C36,11,FALSE),0)*R6C -> 0 | AK137: =VLOOKUP(RC10,R9C38:R17C40,2,FALSE) -> 1 | AL137: =VLOOKUP(RC10,R9C38:R17C40,3,FALSE) -> 0 | AM137: =IF(OR(ISBLANK(R4C7),ISERROR(FIND(R4C7,RC21))),"　","●") ->  | AN137: =IF(OR(ISBLANK(R5C7),ISERROR(FIND(R5C7,RC21))),"　","●") ->  | AO137: =IF(RC39<>"●",VLOOKUP("評価しない",R9C42:R17C44,2,FALSE),VLOOKUP(R4C8,R9C42:R17C44,2,FALSE)) -> 1 | AP137: =IF(RC39<>"●",VLOOKUP("",R9C42:R17C44,3,FALSE),VLOOKUP(R4C8,R9C42:R17C44,3,FALSE)) -> 0 | AQ137: =IF(RC40<>"●",VLOOKUP("評価しない",R9C42:R17C44,2,FALSE),VLOOKUP(R5C8,R9C42:R17C44,2,FALSE)) -> 1 | AR137: =IF(RC40<>"●",VLOOKUP("",R9C42:R17C44,3,FALSE),VLOOKUP(R5C8,R9C42:R17C44,3,FALSE)) -> 0 | AS137: =IF(OR(ISBLANK(R6C7),ISERROR(FIND(R6C7,RC25))),"　","●") ->  | AT137: =IF(OR(ISBLANK(R7C7),ISERROR(FIND(R7C7,RC25))),"　","●") ->  | AU137: =IF(RC45<>"●",VLOOKUP("評価しない",R9C46:R17C48,2,FALSE),VLOOKUP(R6C8,R9C46:R17C48,2,FALSE)) -> 1 | AV137: =IF(RC45<>"●",VLOOKUP("",R9C46:R17C48,3,FALSE),VLOOKUP(R6C8,R9C46:R17C48,3,FALSE)) -> 0 | AW137: =IF(RC46<>"●",VLOOKUP("評価しない",R9C46:R17C48,2,FALSE),VLOOKUP(R7C8,R9C46:R17C48,2,FALSE)) -> 1 | AX137: =IF(RC46<>"●",VLOOKUP("",R9C46:R17C48,3,FALSE),VLOOKUP(R7C8,R9C46:R17C48,3,FALSE)) -> 0 | AY137: =SUM(RC27:RC36) -> 0 | AZ137: =RC37*RC41*RC43*RC47*RC49 -> 1 | BA137: =RC38+RC42+RC44+RC48+RC50 -> 0
A138: =OFFSET(R164C1,INT((RC26-1)/100),MOD(INT((RC26-1)/10),10),1,1)*10+MOD(RC26-1,10)+1 -> 87 | D138: =IF(AND(RC2<>"NG",OR(RC2<>"",RC3<>"",R9C4="×")),"◯","") ->  | E138: =IF(RC2="◯",RC6,"") ->  | F138: =T(OFFSET('[MiracleNikkiJp_items.csv]MiracleNikkiJp_items'!R10C[-3],RC1,0,1,1)) -> ヘアスタイル | G138: =T(OFFSET('[MiracleNikkiJp_items.csv]MiracleNikkiJp_items'!R10C[-2],RC1,0,1,1)) ->  | H138: =IF(RC4="",0,RC51*RC52+RC53) -> 0 | I138: =RC1 -> 87 | J138: =OFFSET('[MiracleNikkiJp_items.csv]MiracleNikkiJp_items'!R10C[-4],RC1,0,1,1) -> 0 | K138: =T(OFFSET('[MiracleNikkiJp_items.csv]MiracleNikkiJp_items'!R10C[-4],RC1,0,1,1)) ->  | L138: =T(OFFSET('[MiracleNikkiJp_items.csv]MiracleNikkiJp_items'!R10C[-4],RC1,0,1,1)) ->  | M138: =T(OFFSET('[MiracleNikkiJp_items.csv]MiracleNikkiJp_items'!R10C[-4],RC1,0,1,1)) ->  | N138: =T(OFFSET('[MiracleNikkiJp_items.csv]MiracleNikkiJp_items'!R10C[-4],RC1,0,1,1)) ->  | O138: =T(OFFSET('[MiracleNikkiJp_items.csv]MiracleNikkiJp_items'!R10C[-4],RC1,0,1,1)) ->  | P138: =T(OFFSET('[MiracleNikkiJp_items.csv]MiracleNikkiJp_items'!R10C[-4],RC1,0,1,1)) ->  | Q138: =T(OFFSET('[MiracleNikkiJp_items.csv]MiracleNikkiJp_items'!R10C[-4],RC1,0,1,1)) ->  | R138: =T(OFFSET('[MiracleNikkiJp_items.csv]MiracleNikkiJp_items'!R10C[-4],RC1,0,1,1)) ->  | S138: =T(OFFSET('[MiracleNikkiJp_items.csv]MiracleNikkiJp_items'!R10C[-4],RC1,0,1,1)) ->  | T138: =T(OFFSET('[MiracleNikkiJp_items.csv]MiracleNikkiJp_items'!R10C[-4],RC1,0,1,1)) ->  | U138: =T(OFFSET('[MiracleNikkiJp_items.csv]MiracleNikkiJp_items'!R10C[-4],RC1,0,1,1)) ->  | Y138: =T(OFFSET('[MiracleNikkiJp_items.csv]MiracleNikkiJp_items'!R10C[-7],RC1,0,1,1)) ->  | Z138: 87 | AA138: =IFERROR(VLOOKUP(RC[-16],R9C26:R17C36,2,FALSE),0)*R6C -> 0 | AB138: =IFERROR(VLOOKUP(RC[-16],R9C26:R17C36,3,FALSE),0)*R6C -> 0 | AC138: =IFERROR(VLOOKUP(RC[-16],R9C26:R17C36,4,FALSE),0)*R6C -> 0 | AD138: =IFERROR(VLOOKUP(RC[-16],R9C26:R17C36,5,FALSE),0)*R6C -> 0 | AE138: =IFERROR(VLOOKUP(RC[-16],R9C26:R17C36,6,FALSE),0)*R6C -> 0 | AF138: =IFERROR(VLOOKUP(RC[-16],R9C26:R17C36,7,FALSE),0)*R6C -> 0 | AG138: =IFERROR(VLOOKUP(RC[-16],R9C26:R17C36,8,FALSE),0)*R6C -> 0 | AH138: =IFERROR(VLOOKUP(RC[-16],R9C26:R17C36,9,FALSE),0)*R6C -> 0 | AI138: =IFERROR(VLOOKUP(RC[-16],R9C26:R17C36,10,FALSE),0)*R6C -> 0 | AJ138: =IFERROR(VLOOKUP(RC[-16],R9C26:R17C36,11,FALSE),0)*R6C -> 0 | AK138: =VLOOKUP(RC10,R9C38:R17C40,2,FALSE) -> 1 | AL138: =VLOOKUP(RC10,R9C38:R17C40,3,FALSE) -> 0 | AM138: =IF(OR(ISBLANK(R4C7),ISERROR(FIND(R4C7,RC21))),"　","●") ->  | AN138: =IF(OR(ISBLANK(R5C7),ISERROR(FIND(R5C7,RC21))),"　","●") ->  | AO138: =IF(RC39<>"●",VLOOKUP("評価しない",R9C42:R17C44,2,FALSE),VLOOKUP(R4C8,R9C42:R17C44,2,FALSE)) -> 1 | AP138: =IF(RC39<>"●",VLOOKUP("",R9C42:R17C44,3,FALSE),VLOOKUP(R4C8,R9C42:R17C44,3,FALSE)) -> 0 | AQ138: =IF(RC40<>"●",VLOOKUP("評価しない",R9C42:R17C44,2,FALSE),VLOOKUP(R5C8,R9C42:R17C44,2,FALSE)) -> 1 | AR138: =IF(RC40<>"●",VLOOKUP("",R9C42:R17C44,3,FALSE),VLOOKUP(R5C8,R9C42:R17C44,3,FALSE)) -> 0 | AS138: =IF(OR(ISBLANK(R6C7),ISERROR(FIND(R6C7,RC25))),"　","●") ->  | AT138: =IF(OR(ISBLANK(R7C7),ISERROR(FIND(R7C7,RC25))),"　","●") ->  | AU138: =IF(RC45<>"●",VLOOKUP("評価しない",R9C46:R17C48,2,FALSE),VLOOKUP(R6C8,R9C46:R17C48,2,FALSE)) -> 1 | AV138: =IF(RC45<>"●",VLOOKUP("",R9C46:R17C48,3,FALSE),VLOOKUP(R6C8,R9C46:R17C48,3,FALSE)) -> 0 | AW138: =IF(RC46<>"●",VLOOKUP("評価しない",R9C46:R17C48,2,FALSE),VLOOKUP(R7C8,R9C46:R17C48,2,FALSE)) -> 1 | AX138: =IF(RC46<>"●",VLOOKUP("",R9C46:R17C48,3,FALSE),VLOOKUP(R7C8,R9C46:R17C48,3,FALSE)) -> 0 | AY138: =SUM(RC27:RC36) -> 0 | AZ138: =RC37*RC41*RC43*RC47*RC49 -> 1 | BA138: =RC38+RC42+RC44+RC48+RC50 -> 0
A139: =OFFSET(R164C1,INT((RC26-1)/100),MOD(INT((RC26-1)/10),10),1,1)*10+MOD(RC26-1,10)+1 -> 88 | D139: =IF(AND(RC2<>"NG",OR(RC2<>"",RC3<>"",R9C4="×")),"◯","") ->  | E139: =IF(RC2="◯",RC6,"") ->  | F139: =T(OFFSET('[MiracleNikkiJp_items.csv]MiracleNikkiJp_items'!R10C[-3],RC1,0,1,1)) -> ヘアスタイル | G139: =T(OFFSET('[MiracleNikkiJp_items.csv]MiracleNikkiJp_items'!R10C[-2],RC1,0,1,1)) ->  | H139: =IF(RC4="",0,RC51*RC52+RC53) -> 0 | I139: =RC1 -> 88 | J139: =OFFSET('[MiracleNikkiJp_items.csv]MiracleNikkiJp_items'!R10C[-4],RC1,0,1,1) -> 0 | K139: =T(OFFSET('[MiracleNikkiJp_items.csv]MiracleNikkiJp_items'!R10C[-4],RC1,0,1,1)) ->  | L139: =T(OFFSET('[MiracleNikkiJp_items.csv]MiracleNikkiJp_items'!R10C[-4],RC1,0,1,1)) ->  | M139: =T(OFFSET('[MiracleNikkiJp_items.csv]MiracleNikkiJp_items'!R10C[-4],RC1,0,1,1)) ->  | N139: =T(OFFSET('[MiracleNikkiJp_items.csv]MiracleNikkiJp_items'!R10C[-4],RC1,0,1,1)) ->  | O139: =T(OFFSET('[MiracleNikkiJp_items.csv]MiracleNikkiJp_items'!R10C[-4],RC1,0,1,1)) ->  | P139: =T(OFFSET('[MiracleNikkiJp_items.csv]MiracleNikkiJp_items'!R10C[-4],RC1,0,1,1)) ->  | Q139: =T(OFFSET('[MiracleNikkiJp_items.csv]MiracleNikkiJp_items'!R10C[-4],RC1,0,1,1)) ->  | R139: =T(OFFSET('[MiracleNikkiJp_items.csv]MiracleNikkiJp_items'!R10C[-4],RC1,0,1,1)) ->  | S139: =T(OFFSET('[MiracleNikkiJp_items.csv]MiracleNikkiJp_items'!R10C[-4],RC1,0,1,1)) ->  | T139: =T(OFFSET('[MiracleNikkiJp_items.csv]MiracleNikkiJp_items'!R10C[-4],RC1,0,1,1)) ->  | U139: =T(OFFSET('[MiracleNikkiJp_items.csv]MiracleNikkiJp_items'!R10C[-4],RC1,0,1,1)) ->  | Y139: =T(OFFSET('[MiracleNikkiJp_items.csv]MiracleNikkiJp_items'!R10C[-7],RC1,0,1,1)) ->  | Z139: 88 | AA139: =IFERROR(VLOOKUP(RC[-16],R9C26:R17C36,2,FALSE),0)*R6C -> 0 | AB139: =IFERROR(VLOOKUP(RC[-16],R9C26:R17C36,3,FALSE),0)*R6C -> 0 | AC139: =IFERROR(VLOOKUP(RC[-16],R9C26:R17C36,4,FALSE),0)*R6C -> 0 | AD139: =IFERROR(VLOOKUP(RC[-16],R9C26:R17C36,5,FALSE),0)*R6C -> 0 | AE139: =IFERROR(VLOOKUP(RC[-16],R9C26:R17C36,6,FALSE),0)*R6C -> 0 | AF139: =IFERROR(VLOOKUP(RC[-16],R9C26:R17C36,7,FALSE),0)*R6C -> 0 | AG139: =IFERROR(VLOOKUP(RC[-16],R9C26:R17C36,8,FALSE),0)*R6C -> 0 | AH139: =IFERROR(VLOOKUP(RC[-16],R9C26:R17C36,9,FALSE),0)*R6C -> 0 | AI139: =IFERROR(VLOOKUP(RC[-16],R9C26:R17C36,10,FALSE),0)*R6C -> 0 | AJ139: =IFERROR(VLOOKUP(RC[-16],R9C26:R17C36,11,FALSE),0)*R6C -> 0 | AK139: =VLOOKUP(RC10,R9C38:R17C40,2,FALSE) -> 1 | AL139: =VLOOKUP(RC10,R9C38:R17C40,3,FALSE) -> 0 | AM139: =IF(OR(ISBLANK(R4C7),ISERROR(FIND(R4C7,RC21))),"　","●") ->  | AN139: =IF(OR(ISBLANK(R5C7),ISERROR(FIND(R5C7,RC21))),"　","●") ->  | AO139: =IF(RC39<>"●",VLOOKUP("評価しない",R9C42:R17C44,2,FALSE),VLOOKUP(R4C8,R9C42:R17C44,2,FALSE)) -> 1 | AP139: =IF(RC39<>"●",VLOOKUP("",R9C42:R17C44,3,FALSE),VLOOKUP(R4C8,R9C42:R17C44,3,FALSE)) -> 0 | AQ139: =IF(RC40<>"●",VLOOKUP("評価しない",R9C42:R17C44,2,FALSE),VLOOKUP(R5C8,R9C42:R17C44,2,FALSE)) -> 1 | AR139: =IF(RC40<>"●",VLOOKUP("",R9C42:R17C44,3,FALSE),VLOOKUP(R5C8,R9C42:R17C44,3,FALSE)) -> 0 | AS139: =IF(OR(ISBLANK(R6C7),ISERROR(FIND(R6C7,RC25))),"　","●") ->  | AT139: =IF(OR(ISBLANK(R7C7),ISERROR(FIND(R7C7,RC25))),"　","●") ->  | AU139: =IF(RC45<>"●",VLOOKUP("評価しない",R9C46:R17C48,2,FALSE),VLOOKUP(R6C8,R9C46:R17C48,2,FALSE)) -> 1 | AV139: =IF(RC45<>"●",VLOOKUP("",R9C46:R17C48,3,FALSE),VLOOKUP(R6C8,R9C46:R17C48,3,FALSE)) -> 0 | AW139: =IF(RC46<>"●",VLOOKUP("評価しない",R9C46:R17C48,2,FALSE),VLOOKUP(R7C8,R9C46:R17C48,2,FALSE)) -> 1 | AX139: =IF(RC46<>"●",VLOOKUP("",R9C46:R17C48,3,FALSE),VLOOKUP(R7C8,R9C46:R17C48,3,FALSE)) -> 0 | AY139: =SUM(RC27:RC36) -> 0 | AZ139: =RC37*RC41*RC43*RC47*RC49 -> 1 | BA139: =RC38+RC42+RC44+RC48+RC50 -> 0
A140: =OFFSET(R164C1,INT((RC26-1)/100),MOD(INT((RC26-1)/10),10),1,1)*10+MOD(RC26-1,10)+1 -> 89 | D140: =IF(AND(RC2<>"NG",OR(RC2<>"",RC3<>"",R9C4="×")),"◯","") ->  | E140: =IF(RC2="◯",RC6,"") ->  | F140: =T(OFFSET('[MiracleNikkiJp_items.csv]MiracleNikkiJp_items'!R10C[-3],RC1,0,1,1)) -> ヘアスタイル | G140: =T(OFFSET('[MiracleNikkiJp_items.csv]MiracleNikkiJp_items'!R10C[-2],RC1,0,1,1)) ->  | H140: =IF(RC4="",0,RC51*RC52+RC53) -> 0 | I140: =RC1 -> 89 | J140: =OFFSET('[MiracleNikkiJp_items.csv]MiracleNikkiJp_items'!R10C[-4],RC1,0,1,1) -> 0 | K140: =T(OFFSET('[MiracleNikkiJp_items.csv]MiracleNikkiJp_items'!R10C[-4],RC1,0,1,1)) ->  | L140: =T(OFFSET('[MiracleNikkiJp_items.csv]MiracleNikkiJp_items'!R10C[-4],RC1,0,1,1)) ->  | M140: =T(OFFSET('[MiracleNikkiJp_items.csv]MiracleNikkiJp_items'!R10C[-4],RC1,0,1,1)) ->  | N140: =T(OFFSET('[MiracleNikkiJp_items.csv]MiracleNikkiJp_items'!R10C[-4],RC1,0,1,1)) ->  | O140: =T(OFFSET('[MiracleNikkiJp_items.csv]MiracleNikkiJp_items'!R10C[-4],RC1,0,1,1)) ->  | P140: =T(OFFSET('[MiracleNikkiJp_items.csv]MiracleNikkiJp_items'!R10C[-4],RC1,0,1,1)) ->  | Q140: =T(OFFSET('[MiracleNikkiJp_items.csv]MiracleNikkiJp_items'!R10C[-4],RC1,0,1,1)) ->  | R140: =T(OFFSET('[MiracleNikkiJp_items.csv]MiracleNikkiJp_items'!R10C[-4],RC1,0,1,1)) ->  | S140: =T(OFFSET('[MiracleNikkiJp_items.csv]MiracleNikkiJp_items'!R10C[-4],RC1,0,1,1)) ->  | T140: =T(OFFSET('[MiracleNikkiJp_items.csv]MiracleNikkiJp_items'!R10C[-4],RC1,0,1,1)) ->  | U140: =T(OFFSET('[MiracleNikkiJp_items.csv]MiracleNikkiJp_items'!R10C[-4],RC1,0,1,1)) ->  | Y140: =T(OFFSET('[MiracleNikkiJp_items.csv]MiracleNikkiJp_items'!R10C[-7],RC1,0,1,1)) ->  | Z140: 89 | AA140: =IFERROR(VLOOKUP(RC[-16],R9C26:R17C36,2,FALSE),0)*R6C -> 0 | AB140: =IFERROR(VLOOKUP(RC[-16],R9C26:R17C36,3,FALSE),0)*R6C -> 0 | AC140: =IFERROR(VLOOKUP(RC[-16],R9C26:R17C36,4,FALSE),0)*R6C -> 0 | AD140: =IFERROR(VLOOKUP(RC[-16],R9C26:R17C36,5,FALSE),0)*R6C -> 0 | AE140: =IFERROR(VLOOKUP(RC[-16],R9C26:R17C36,6,FALSE),0)*R6C -> 0 | AF140: =IFERROR(VLOOKUP(RC[-16],R9C26:R17C36,7,FALSE),0)*R6C -> 0 | AG140: =IFERROR(VLOOKUP(RC[-16],R9C26:R17C36,8,FALSE),0)*R6C -> 0 | AH140: =IFERROR(VLOOKUP(RC[-16],R9C26:R17C36,9,FALSE),0)*R6C -> 0 | AI140: =IFERROR(VLOOKUP(RC[-16],R9C26:R17C36,10,FALSE),0)*R6C -> 0 | AJ140: =IFERROR(VLOOKUP(RC[-16],R9C26:R17C36,11,FALSE),0)*R6C -> 0 | AK140: =VLOOKUP(RC10,R9C38:R17C40,2,FALSE) -> 1 | AL140: =VLOOKUP(RC10,R9C38:R17C40,3,FALSE) -> 0 | AM140: =IF(OR(ISBLANK(R4C7),ISERROR(FIND(R4C7,RC21))),"　","●") ->  | AN140: =IF(OR(ISBLANK(R5C7),ISERROR(FIND(R5C7,RC21))),"　","●") ->  | AO140: =IF(RC39<>"●",VLOOKUP("評価しない",R9C42:R17C44,2,FALSE),VLOOKUP(R4C8,R9C42:R17C44,2,FALSE)) -> 1 | AP140: =IF(RC39<>"●",VLOOKUP("",R9C42:R17C44,3,FALSE),VLOOKUP(R4C8,R9C42:R17C44,3,FALSE)) -> 0 | AQ140: =IF(RC40<>"●",VLOOKUP("評価しない",R9C42:R17C44,2,FALSE),VLOOKUP(R5C8,R9C42:R17C44,2,FALSE)) -> 1 | AR140: =IF(RC40<>"●",VLOOKUP("",R9C42:R17C44,3,FALSE),VLOOKUP(R5C8,R9C42:R17C44,3,FALSE)) -> 0 | AS140: =IF(OR(ISBLANK(R6C7),ISERROR(FIND(R6C7,RC25))),"　","●") ->  | AT140: =IF(OR(ISBLANK(R7C7),ISERROR(FIND(R7C7,RC25))),"　","●") ->  | AU140: =IF(RC45<>"●",VLOOKUP("評価しない",R9C46:R17C48,2,FALSE),VLOOKUP(R6C8,R9C46:R17C48,2,FALSE)) -> 1 | AV140: =IF(RC45<>"●",VLOOKUP("",R9C46:R17C48,3,FALSE),VLOOKUP(R6C8,R9C46:R17C48,3,FALSE)) -> 0 | AW140: =IF(RC46<>"●",VLOOKUP("評価しない",R9C46:R17C48,2,FALSE),VLOOKUP(R7C8,R9C46:R17C48,2,FALSE)) -> 1 | AX140: =IF(RC46<>"●",VLOOKUP("",R9C46:R17C48,3,FALSE),VLOOKUP(R7C8,R9C46:R17C48,3,FALSE)) -> 0 | AY140: =SUM(RC27:RC36) -> 0 | AZ140: =RC37*RC41*RC43*RC47*RC49 -> 1 | BA140: =RC38+RC42+RC44+RC48+RC50 -> 0
A141: =OFFSET(R164C1,INT((RC26-1)/100),MOD(INT((RC26-1)/10),10),1,1)*10+MOD(RC26-1,10)+1 -> 90 | D141: =IF(AND(RC2<>"NG",OR(RC2<>"",RC3<>"",R9C4="×")),"◯","") ->  | E141: =IF(RC2="◯",RC6,"") ->  | F141: =T(OFFSET('[MiracleNikkiJp_items.csv]MiracleNikkiJp_items'!R10C[-3],RC1,0,1,1)) -> ヘアスタイル | G141: =T(OFFSET('[MiracleNikkiJp_items.csv]MiracleNikkiJp_items'!R10C[-2],RC1,0,1,1)) ->  | H141: =IF(RC4="",0,RC51*RC52+RC53) -> 0 | I141: =RC1 -> 90 | J141: =OFFSET('[MiracleNikkiJp_items.csv]MiracleNikkiJp_items'!R10C[-4],RC1,0,1,1) -> 0 | K141: =T(OFFSET('[MiracleNikkiJp_items.csv]MiracleNikkiJp_items'!R10C[-4],RC1,0,1,1)) ->  | L141: =T(OFFSET('[MiracleNikkiJp_items.csv]MiracleNikkiJp_items'!R10C[-4],RC1,0,1,1)) ->  | M141: =T(OFFSET('[MiracleNikkiJp_items.csv]MiracleNikkiJp_items'!R10C[-4],RC1,0,1,1)) ->  | N141: =T(OFFSET('[MiracleNikkiJp_items.csv]MiracleNikkiJp_items'!R10C[-4],RC1,0,1,1)) ->  | O141: =T(OFFSET('[MiracleNikkiJp_items.csv]MiracleNikkiJp_items'!R10C[-4],RC1,0,1,1)) ->  | P141: =T(OFFSET('[MiracleNikkiJp_items.csv]MiracleNikkiJp_items'!R10C[-4],RC1,0,1,1)) ->  | Q141: =T(OFFSET('[MiracleNikkiJp_items.csv]MiracleNikkiJp_items'!R10C[-4],RC1,0,1,1)) ->  | R141: =T(OFFSET('[MiracleNikkiJp_items.csv]MiracleNikkiJp_items'!R10C[-4],RC1,0,1,1)) ->  | S141: =T(OFFSET('[MiracleNikkiJp_items.csv]MiracleNikkiJp_items'!R10C[-4],RC1,0,1,1)) ->  | T141: =T(OFFSET('[MiracleNikkiJp_items.csv]MiracleNikkiJp_items'!R10C[-4],RC1,0,1,1)) ->  | U141: =T(OFFSET('[MiracleNikkiJp_items.csv]MiracleNikkiJp_items'!R10C[-4],RC1,0,1,1)) ->  | Y141: =T(OFFSET('[MiracleNikkiJp_items.csv]MiracleNikkiJp_items'!R10C[-7],RC1,0,1,1)) ->  | Z141: 90 | AA141: =IFERROR(VLOOKUP(RC[-16],R9C26:R17C36,2,FALSE),0)*R6C -> 0 | AB141: =IFERROR(VLOOKUP(RC[-16],R9C26:R17C36,3,FALSE),0)*R6C -> 0 | AC141: =IFERROR(VLOOKUP(RC[-16],R9C26:R17C36,4,FALSE),0)*R6C -> 0 | AD141: =IFERROR(VLOOKUP(RC[-16],R9C26:R17C36,5,FALSE),0)*R6C -> 0 | AE141: =IFERROR(VLOOKUP(RC[-16],R9C26:R17C36,6,FALSE),0)*R6C -> 0 | AF141: =IFERROR(VLOOKUP(RC[-16],R9C26:R17C36,7,FALSE),0)*R6C -> 0 | AG141: =IFERROR(VLOOKUP(RC[-16],R9C26:R17C36,8,FALSE),0)*R6C -> 0 | AH141: =IFERROR(VLOOKUP(RC[-16],R9C26:R17C36,9,FALSE),0)*R6C -> 0 | AI141: =IFERROR(VLOOKUP(RC[-16],R9C26:R17C36,10,FALSE),0)*R6C -> 0 | AJ141: =IFERROR(VLOOKUP(RC[-16],R9C26:R17C36,11,FALSE),0)*R6C -> 0 | AK141: =VLOOKUP(RC10,R9C38:R17C40,2,FALSE) -> 1 | AL141: =VLOOKUP(RC10,R9C38:R17C40,3,FALSE) -> 0 | AM141: =IF(OR(ISBLANK(R4C7),ISERROR(FIND(R4C7,RC21))),"　","●") ->  | AN141: =IF(OR(ISBLANK(R5C7),ISERROR(FIND(R5C7,RC21))),"　","●") ->  | AO141: =IF(RC39<>"●",VLOOKUP("評価しない",R9C42:R17C44,2,FALSE),VLOOKUP(R4C8,R9C42:R17C44,2,FALSE)) -> 1 | AP141: =IF(RC39<>"●",VLOOKUP("",R9C42:R17C44,3,FALSE),VLOOKUP(R4C8,R9C42:R17C44,3,FALSE)) -> 0 | AQ141: =IF(RC40<>"●",VLOOKUP("評価しない",R9C42:R17C44,2,FALSE),VLOOKUP(R5C8,R9C42:R17C44,2,FALSE)) -> 1 | AR141: =IF(RC40<>"●",VLOOKUP("",R9C42:R17C44,3,FALSE),VLOOKUP(R5C8,R9C42:R17C44,3,FALSE)) -> 0 | AS141: =IF(OR(ISBLANK(R6C7),ISERROR(FIND(R6C7,RC25))),"　","●") ->  | AT141: =IF(OR(ISBLANK(R7C7),ISERROR(FIND(R7C7,RC25))),"　","●") ->  | AU141: =IF(RC45<>"●",VLOOKUP("評価しない",R9C46:R17C48,2,FALSE),VLOOKUP(R6C8,R9C46:R17C48,2,FALSE)) -> 1 | AV141: =IF(RC45<>"●",VLOOKUP("",R9C46:R17C48,3,FALSE),VLOOKUP(R6C8,R9C46:R17C48,3,FALSE)) -> 0 | AW141: =IF(RC46<>"●",VLOOKUP("評価しない",R9C46:R17C48,2,FALSE),VLOOKUP(R7C8,R9C46:R17C48,2,FALSE)) -> 1 | AX141: =IF(RC46<>"●",VLOOKUP("",R9C46:R17C48,3,FALSE),VLOOKUP(R7C8,R9C46:R17C48,3,FALSE)) -> 0 | AY141: =SUM(RC27:RC36) -> 0 | AZ141: =RC37*RC41*RC43*RC47*RC49 -> 1 | BA141: =RC38+RC42+RC44+RC48+RC50 -> 0
A142: =OFFSET(R164C1,INT((RC26-1)/100),MOD(INT((RC26-1)/10),10),1,1)*10+MOD(RC26-1,10)+1 -> 91 | D142: =IF(AND(RC2<>"NG",OR(RC2<>"",RC3<>"",R9C4="×")),"◯","") ->  | E142: =IF(RC2="◯",RC6,"") ->  | F142: =T(OFFSET('[MiracleNikkiJp_items.csv]MiracleNikkiJp_items'!R10C[-3],RC1,0,1,1)) -> ヘアスタイル | G142: =T(OFFSET('[MiracleNikkiJp_items.csv]MiracleNikkiJp_items'!R10C[-2],RC1,0,1,1)) ->  | H142: =IF(RC4="",0,RC51*RC52+RC53) -> 0 | I142: =RC1 -> 91 | J142: =OFFSET('[MiracleNikkiJp_items.csv]MiracleNikkiJp_items'!R10C[-4],RC1,0,1,1) -> 0 | K142: =T(OFFSET('[MiracleNikkiJp_items.csv]MiracleNikkiJp_items'!R10C[-4],RC1,0,1,1)) ->  | L142: =T(OFFSET('[MiracleNikkiJp_items.csv]MiracleNikkiJp_items'!R10C[-4],RC1,0,1,1)) ->  | M142: =T(OFFSET('[MiracleNikkiJp_items.csv]MiracleNikkiJp_items'!R10C[-4],RC1,0,1,1)) ->  | N142: =T(OFFSET('[MiracleNikkiJp_items.csv]MiracleNikkiJp_items'!R10C[-4],RC1,0,1,1)) ->  | O142: =T(OFFSET('[MiracleNikkiJp_items.csv]MiracleNikkiJp_items'!R10C[-4],RC1,0,1,1)) ->  | P142: =T(OFFSET('[MiracleNikkiJp_items.csv]MiracleNikkiJp_items'!R10C[-4],RC1,0,1,1)) ->  | Q142: =T(OFFSET('[MiracleNikkiJp_items.csv]MiracleNikkiJp_items'!R10C[-4],RC1,0,1,1)) ->  | R142: =T(OFFSET('[MiracleNikkiJp_items.csv]MiracleNikkiJp_items'!R10C[-4],RC1,0,1,1)) ->  | S142: =T(OFFSET('[MiracleNikkiJp_items.csv]MiracleNikkiJp_items'!R10C[-4],RC1,0,1,1)) ->  | T142: =T(OFFSET('[MiracleNikkiJp_items.csv]MiracleNikkiJp_items'!R10C[-4],RC1,0,1,1)) ->  | U142: =T(OFFSET('[MiracleNikkiJp_items.csv]MiracleNikkiJp_items'!R10C[-4],RC1,0,1,1)) ->  | Y142: =T(OFFSET('[MiracleNikkiJp_items.csv]MiracleNikkiJp_items'!R10C[-7],RC1,0,1,1)) ->  | Z142: 91 | AA142: =IFERROR(VLOOKUP(RC[-16],R9C26:R17C36,2,FALSE),0)*R6C -> 0 | AB142: =IFERROR(VLOOKUP(RC[-16],R9C26:R17C36,3,FALSE),0)*R6C -> 0 | AC142: =IFERROR(VLOOKUP(RC[-16],R9C26:R17C36,4,FALSE),0)*R6C -> 0 | AD142: =IFERROR(VLOOKUP(RC[-16],R9C26:R17C36,5,FALSE),0)*R6C -> 0 | AE142: =IFERROR(VLOOKUP(RC[-16],R9C26:R17C36,6,FALSE),0)*R6C -> 0 | AF142: =IFERROR(VLOOKUP(RC[-16],R9C26:R17C36,7,FALSE),0)*R6C -> 0 | AG142: =IFERROR(VLOOKUP(RC[-16],R9C26:R17C36,8,FALSE),0)*R6C -> 0 | AH142: =IFERROR(VLOOKUP(RC[-16],R9C26:R17C36,9,FALSE),0)*R6C -> 0 | AI142: =IFERROR(VLOOKUP(RC[-16],R9C26:R17C36,10,FALSE),0)*R6C -> 0 | AJ142: =IFERROR(VLOOKUP(RC[-16],R9C26:R17C36,11,FALSE),0)*R6C -> 0 | AK142: =VLOOKUP(RC10,R9C38:R17C40,2,FALSE) -> 1 | AL142: =VLOOKUP(RC10,R9C38:R17C40,3,FALSE) -> 0 | AM142: =IF(OR(ISBLANK(R4C7),ISERROR(FIND(R4C7,RC21))),"　","●") ->  | AN142: =IF(OR(ISBLANK(R5C7),ISERROR(FIND(R5C7,RC21))),"　","●") ->  | AO142: =IF(RC39<>"●",VLOOKUP("評価しない",R9C42:R17C44,2,FALSE),VLOOKUP(R4C8,R9C42:R17C44,2,FALSE)) -> 1 | AP142: =IF(RC39<>"●",VLOOKUP("",R9C42:R17C44,3,FALSE),VLOOKUP(R4C8,R9C42:R17C44,3,FALSE)) -> 0 | AQ142: =IF(RC40<>"●",VLOOKUP("評価しない",R9C42:R17C44,2,FALSE),VLOOKUP(R5C8,R9C42:R17C44,2,FALSE)) -> 1 | AR142: =IF(RC40<>"●",VLOOKUP("",R9C42:R17C44,3,FALSE),VLOOKUP(R5C8,R9C42:R17C44,3,FALSE)) -> 0 | AS142: =IF(OR(ISBLANK(R6C7),ISERROR(FIND(R6C7,RC25))),"　","●") ->  | AT142: =IF(OR(ISBLANK(R7C7),ISERROR(FIND(R7C7,RC25))),"　","●") ->  | AU142: =IF(RC45<>"●",VLOOKUP("評価しない",R9C46:R17C48,2,FALSE),VLOOKUP(R6C8,R9C46:R17C48,2,FALSE)) -> 1 | AV142: =IF(RC45<>"●",VLOOKUP("",R9C46:R17C48,3,FALSE),VLOOKUP(R6C8,R9C46:R17C48,3,FALSE)) -> 0 | AW142: =IF(RC46<>"●",VLOOKUP("評価しない",R9C46:R17C48,2,FALSE),VLOOKUP(R7C8,R9C46:R17C48,2,FALSE)) -> 1 | AX142: =IF(RC46<>"●",VLOOKUP("",R9C46:R17C48,3,FALSE),VLOOKUP(R7C8,R9C46:R17C48,3,FALSE)) -> 0 | AY142: =SUM(RC27:RC36) -> 0 | AZ142: =RC37*RC41*RC43*RC47*RC49 -> 1 | BA142: =RC38+RC42+RC44+RC48+RC50 -> 0
A143: =OFFSET(R164C1,INT((RC26-1)/100),MOD(INT((RC26-1)/10),10),1,1)*10+MOD(RC26-1,10)+1 -> 92 | D143: =IF(AND(RC2<>"NG",OR(RC2<>"",RC3<>"",R9C4="×")),"◯","") ->  | E143: =IF(RC2="◯",RC6,"") ->  | F143: =T(OFFSET('[MiracleNikkiJp_items.csv]MiracleNikkiJp_items'!R10C[-3],RC1,0,1,1)) -> ヘアスタイル | G143: =T(OFFSET('[MiracleNikkiJp_items.csv]MiracleNikkiJp_items'!R10C[-2],RC1,0,1,1)) ->  | H143: =IF(RC4="",0,RC51*RC52+RC53) -> 0 | I143: =RC1 -> 92 | J143: =OFFSET('[MiracleNikkiJp_items.csv]MiracleNikkiJp_items'!R10C[-4],RC1,0,1,1) -> 0 | K143: =T(OFFSET('[MiracleNikkiJp_items.csv]MiracleNikkiJp_items'!R10C[-4],RC1,0,1,1)) ->  | L143: =T(OFFSET('[MiracleNikkiJp_items.csv]MiracleNikkiJp_items'!R10C[-4],RC1,0,1,1)) ->  | M143: =T(OFFSET('[MiracleNikkiJp_items.csv]MiracleNikkiJp_items'!R10C[-4],RC1,0,1,1)) ->  | N143: =T(OFFSET('[MiracleNikkiJp_items.csv]MiracleNikkiJp_items'!R10C[-4],RC1,0,1,1)) ->  | O143: =T(OFFSET('[MiracleNikkiJp_items.csv]MiracleNikkiJp_items'!R10C[-4],RC1,0,1,1)) ->  | P143: =T(OFFSET('[MiracleNikkiJp_items.csv]MiracleNikkiJp_items'!R10C[-4],RC1,0,1,1)) ->  | Q143: =T(OFFSET('[MiracleNikkiJp_items.csv]MiracleNikkiJp_items'!R10C[-4],RC1,0,1,1)) ->  | R143: =T(OFFSET('[MiracleNikkiJp_items.csv]MiracleNikkiJp_items'!R10C[-4],RC1,0,1,1)) ->  | S143: =T(OFFSET('[MiracleNikkiJp_items.csv]MiracleNikkiJp_items'!R10C[-4],RC1,0,1,1)) ->  | T143: =T(OFFSET('[MiracleNikkiJp_items.csv]MiracleNikkiJp_items'!R10C[-4],RC1,0,1,1)) ->  | U143: =T(OFFSET('[MiracleNikkiJp_items.csv]MiracleNikkiJp_items'!R10C[-4],RC1,0,1,1)) ->  | Y143: =T(OFFSET('[MiracleNikkiJp_items.csv]MiracleNikkiJp_items'!R10C[-7],RC1,0,1,1)) ->  | Z143: 92 | AA143: =IFERROR(VLOOKUP(RC[-16],R9C26:R17C36,2,FALSE),0)*R6C -> 0 | AB143: =IFERROR(VLOOKUP(RC[-16],R9C26:R17C36,3,FALSE),0)*R6C -> 0 | AC143: =IFERROR(VLOOKUP(RC[-16],R9C26:R17C36,4,FALSE),0)*R6C -> 0 | AD143: =IFERROR(VLOOKUP(RC[-16],R9C26:R17C36,5,FALSE),0)*R6C -> 0 | AE143: =IFERROR(VLOOKUP(RC[-16],R9C26:R17C36,6,FALSE),0)*R6C -> 0 | AF143: =IFERROR(VLOOKUP(RC[-16],R9C26:R17C36,7,FALSE),0)*R6C -> 0 | AG143: =IFERROR(VLOOKUP(RC[-16],R9C26:R17C36,8,FALSE),0)*R6C -> 0 | AH143: =IFERROR(VLOOKUP(RC[-16],R9C26:R17C36,9,FALSE),0)*R6C -> 0 | AI143: =IFERROR(VLOOKUP(RC[-16],R9C26:R17C36,10,FALSE),0)*R6C -> 0 | AJ143: =IFERROR(VLOOKUP(RC[-16],R9C26:R17C36,11,FALSE),0)*R6C -> 0 | AK143: =VLOOKUP(RC10,R9C38:R17C40,2,FALSE) -> 1 | AL143: =VLOOKUP(RC10,R9C38:R17C40,3,FALSE) -> 0 | AM143: =IF(OR(ISBLANK(R4C7),ISERROR(FIND(R4C7,RC21))),"　","●") ->  | AN143: =IF(OR(ISBLANK(R5C7),ISERROR(FIND(R5C7,RC21))),"　","●") ->  | AO143: =IF(RC39<>"●",VLOOKUP("評価しない",R9C42:R17C44,2,FALSE),VLOOKUP(R4C8,R9C42:R17C44,2,FALSE)) -> 1 | AP143: =IF(RC39<>"●",VLOOKUP("",R9C42:R17C44,3,FALSE),VLOOKUP(R4C8,R9C42:R17C44,3,FALSE)) -> 0 | AQ143: =IF(RC40<>"●",VLOOKUP("評価しない",R9C42:R17C44,2,FALSE),VLOOKUP(R5C8,R9C42:R17C44,2,FALSE)) -> 1 | AR143: =IF(RC40<>"●",VLOOKUP("",R9C42:R17C44,3,FALSE),VLOOKUP(R5C8,R9C42:R17C44,3,FALSE)) -> 0 | AS143: =IF(OR(ISBLANK(R6C7),ISERROR(FIND(R6C7,RC25))),"　","●") ->  | AT143: =IF(OR(ISBLANK(R7C7),ISERROR(FIND(R7C7,RC25))),"　","●") ->  | AU143: =IF(RC45<>"●",VLOOKUP("評価しない",R9C46:R17C48,2,FALSE),VLOOKUP(R6C8,R9C46:R17C48,2,FALSE)) -> 1 | AV143: =IF(RC45<>"●",VLOOKUP("",R9C46:R17C48,3,FALSE),VLOOKUP(R6C8,R9C46:R17C48,3,FALSE)) -> 0 | AW143: =IF(RC46<>"●",VLOOKUP("評価しない",R9C46:R17C48,2,FALSE),VLOOKUP(R7C8,R9C46:R17C48,2,FALSE)) -> 1 | AX143: =IF(RC46<>"●",VLOOKUP("",R9C46:R17C48,3,FALSE),VLOOKUP(R7C8,R9C46:R17C48,3,FALSE)) -> 0 | AY143: =SUM(RC27:RC36) -> 0 | AZ143: =RC37*RC41*RC43*RC47*RC49 -> 1 | BA143: =RC38+RC42+RC44+RC48+RC50 -> 0
A144: =OFFSET(R164C1,INT((RC26-1)/100),MOD(INT((RC26-1)/10),10),1,1)*10+MOD(RC26-1,10)+1 -> 93 | D144: =IF(AND(RC2<>"NG",OR(RC2<>"",RC3<>"",R9C4="×")),"◯","") ->  | E144: =IF(RC2="◯",RC6,"") ->  | F144: =T(OFFSET('[MiracleNikkiJp_items.csv]MiracleNikkiJp_items'!R10C[-3],RC1,0,1,1)) -> ヘアスタイル | G144: =T(OFFSET('[MiracleNikkiJp_items.csv]MiracleNikkiJp_items'!R10C[-2],RC1,0,1,1)) ->  | H144: =IF(RC4="",0,RC51*RC52+RC53) -> 0 | I144: =RC1 -> 93 | J144: =OFFSET('[MiracleNikkiJp_items.csv]MiracleNikkiJp_items'!R10C[-4],RC1,0,1,1) -> 0 | K144: =T(OFFSET('[MiracleNikkiJp_items.csv]MiracleNikkiJp_items'!R10C[-4],RC1,0,1,1)) ->  | L144: =T(OFFSET('[MiracleNikkiJp_items.csv]MiracleNikkiJp_items'!R10C[-4],RC1,0,1,1)) ->  | M144: =T(OFFSET('[MiracleNikkiJp_items.csv]MiracleNikkiJp_items'!R10C[-4],RC1,0,1,1)) ->  | N144: =T(OFFSET('[MiracleNikkiJp_items.csv]MiracleNikkiJp_items'!R10C[-4],RC1,0,1,1)) ->  | O144: =T(OFFSET('[MiracleNikkiJp_items.csv]MiracleNikkiJp_items'!R10C[-4],RC1,0,1,1)) ->  | P144: =T(OFFSET('[MiracleNikkiJp_items.csv]MiracleNikkiJp_items'!R10C[-4],RC1,0,1,1)) ->  | Q144: =T(OFFSET('[MiracleNikkiJp_items.csv]MiracleNikkiJp_items'!R10C[-4],RC1,0,1,1)) ->  | R144: =T(OFFSET('[MiracleNikkiJp_items.csv]MiracleNikkiJp_items'!R10C[-4],RC1,0,1,1)) ->  | S144: =T(OFFSET('[MiracleNikkiJp_items.csv]MiracleNikkiJp_items'!R10C[-4],RC1,0,1,1)) ->  | T144: =T(OFFSET('[MiracleNikkiJp_items.csv]MiracleNikkiJp_items'!R10C[-4],RC1,0,1,1)) ->  | U144: =T(OFFSET('[MiracleNikkiJp_items.csv]MiracleNikkiJp_items'!R10C[-4],RC1,0,1,1)) ->  | Y144: =T(OFFSET('[MiracleNikkiJp_items.csv]MiracleNikkiJp_items'!R10C[-7],RC1,0,1,1)) ->  | Z144: 93 | AA144: =IFERROR(VLOOKUP(RC[-16],R9C26:R17C36,2,FALSE),0)*R6C -> 0 | AB144: =IFERROR(VLOOKUP(RC[-16],R9C26:R17C36,3,FALSE),0)*R6C -> 0 | AC144: =IFERROR(VLOOKUP(RC[-16],R9C26:R17C36,4,FALSE),0)*R6C -> 0 | AD144: =IFERROR(VLOOKUP(RC[-16],R9C26:R17C36,5,FALSE),0)*R6C -> 0 | AE144: =IFERROR(VLOOKUP(RC[-16],R9C26:R17C36,6,FALSE),0)*R6C -> 0 | AF144: =IFERROR(VLOOKUP(RC[-16],R9C26:R17C36,7,FALSE),0)*R6C -> 0 | AG144: =IFERROR(VLOOKUP(RC[-16],R9C26:R17C36,8,FALSE),0)*R6C -> 0 | AH144: =IFERROR(VLOOKUP(RC[-16],R9C26:R17C36,9,FALSE),0)*R6C -> 0 | AI144: =IFERROR(VLOOKUP(RC[-16],R9C26:R17C36,10,FALSE),0)*R6C -> 0 | AJ144: =IFERROR(VLOOKUP(RC[-16],R9C26:R17C36,11,FALSE),0)*R6C -> 0 | AK144: =VLOOKUP(RC10,R9C38:R17C40,2,FALSE) -> 1 | AL144: =VLOOKUP(RC10,R9C38:R17C40,3,FALSE) -> 0 | AM144: =IF(OR(ISBLANK(R4C7),ISERROR(FIND(R4C7,RC21))),"　","●") ->  | AN144: =IF(OR(ISBLANK(R5C7),ISERROR(FIND(R5C7,RC21))),"　","●") ->  | AO144: =IF(RC39<>"●",VLOOKUP("評価しない",R9C42:R17C44,2,FALSE),VLOOKUP(R4C8,R9C42:R17C44,2,FALSE)) -> 1 | AP144: =IF(RC39<>"●",VLOOKUP("",R9C42:R17C44,3,FALSE),VLOOKUP(R4C8,R9C42:R17C44,3,FALSE)) -> 0 | AQ144: =IF(RC40<>"●",VLOOKUP("評価しない",R9C42:R17C44,2,FALSE),VLOOKUP(R5C8,R9C42:R17C44,2,FALSE)) -> 1 | AR144: =IF(RC40<>"●",VLOOKUP("",R9C42:R17C44,3,FALSE),VLOOKUP(R5C8,R9C42:R17C44,3,FALSE)) -> 0 | AS144: =IF(OR(ISBLANK(R6C7),ISERROR(FIND(R6C7,RC25))),"　","●") ->  | AT144: =IF(OR(ISBLANK(R7C7),ISERROR(FIND(R7C7,RC25))),"　","●") ->  | AU144: =IF(RC45<>"●",VLOOKUP("評価しない",R9C46:R17C48,2,FALSE),VLOOKUP(R6C8,R9C46:R17C48,2,FALSE)) -> 1 | AV144: =IF(RC45<>"●",VLOOKUP("",R9C46:R17C48,3,FALSE),VLOOKUP(R6C8,R9C46:R17C48,3,FALSE)) -> 0 | AW144: =IF(RC46<>"●",VLOOKUP("評価しない",R9C46:R17C48,2,FALSE),VLOOKUP(R7C8,R9C46:R17C48,2,FALSE)) -> 1 | AX144: =IF(RC46<>"●",VLOOKUP("",R9C46:R17C48,3,FALSE),VLOOKUP(R7C8,R9C46:R17C48,3,FALSE)) -> 0 | AY144: =SUM(RC27:RC36) -> 0 | AZ144: =RC37*RC41*RC43*RC47*RC49 -> 1 | BA144: =RC38+RC42+RC44+RC48+RC50 -> 0
A145: =OFFSET(R164C1,INT((RC26-1)/100),MOD(INT((RC26-1)/10),10),1,1)*10+MOD(RC26-1,10)+1 -> 94 | D145: =IF(AND(RC2<>"NG",OR(RC2<>"",RC3<>"",R9C4="×")),"◯","") ->  | E145: =IF(RC2="◯",RC6,"") ->  | F145: =T(OFFSET('[MiracleNikkiJp_items.csv]MiracleNikkiJp_items'!R10C[-3],RC1,0,1,1)) -> ヘアスタイル | G145: =T(OFFSET('[MiracleNikkiJp_items.csv]MiracleNikkiJp_items'!R10C[-2],RC1,0,1,1)) ->  | H145: =IF(RC4="",0,RC51*RC52+RC53) -> 0 | I145: =RC1 -> 94 | J145: =OFFSET('[MiracleNikkiJp_items.csv]MiracleNikkiJp_items'!R10C[-4],RC1,0,1,1) -> 0 | K145: =T(OFFSET('[MiracleNikkiJp_items.csv]MiracleNikkiJp_items'!R10C[-4],RC1,0,1,1)) ->  | L145: =T(OFFSET('[MiracleNikkiJp_items.csv]MiracleNikkiJp_items'!R10C[-4],RC1,0,1,1)) ->  | M145: =T(OFFSET('[MiracleNikkiJp_items.csv]MiracleNikkiJp_items'!R10C[-4],RC1,0,1,1)) ->  | N145: =T(OFFSET('[MiracleNikkiJp_items.csv]MiracleNikkiJp_items'!R10C[-4],RC1,0,1,1)) ->  | O145: =T(OFFSET('[MiracleNikkiJp_items.csv]MiracleNikkiJp_items'!R10C[-4],RC1,0,1,1)) ->  | P145: =T(OFFSET('[MiracleNikkiJp_items.csv]MiracleNikkiJp_items'!R10C[-4],RC1,0,1,1)) ->  | Q145: =T(OFFSET('[MiracleNikkiJp_items.csv]MiracleNikkiJp_items'!R10C[-4],RC1,0,1,1)) ->  | R145: =T(OFFSET('[MiracleNikkiJp_items.csv]MiracleNikkiJp_items'!R10C[-4],RC1,0,1,1)) ->  | S145: =T(OFFSET('[MiracleNikkiJp_items.csv]MiracleNikkiJp_items'!R10C[-4],RC1,0,1,1)) ->  | T145: =T(OFFSET('[MiracleNikkiJp_items.csv]MiracleNikkiJp_items'!R10C[-4],RC1,0,1,1)) ->  | U145: =T(OFFSET('[MiracleNikkiJp_items.csv]MiracleNikkiJp_items'!R10C[-4],RC1,0,1,1)) ->  | Y145: =T(OFFSET('[MiracleNikkiJp_items.csv]MiracleNikkiJp_items'!R10C[-7],RC1,0,1,1)) ->  | Z145: 94 | AA145: =IFERROR(VLOOKUP(RC[-16],R9C26:R17C36,2,FALSE),0)*R6C -> 0 | AB145: =IFERROR(VLOOKUP(RC[-16],R9C26:R17C36,3,FALSE),0)*R6C -> 0 | AC145: =IFERROR(VLOOKUP(RC[-16],R9C26:R17C36,4,FALSE),0)*R6C -> 0 | AD145: =IFERROR(VLOOKUP(RC[-16],R9C26:R17C36,5,FALSE),0)*R6C -> 0 | AE145: =IFERROR(VLOOKUP(RC[-16],R9C26:R17C36,6,FALSE),0)*R6C -> 0 | AF145: =IFERROR(VLOOKUP(RC[-16],R9C26:R17C36,7,FALSE),0)*R6C -> 0 | AG145: =IFERROR(VLOOKUP(RC[-16],R9C26:R17C36,8,FALSE),0)*R6C -> 0 | AH145: =IFERROR(VLOOKUP(RC[-16],R9C26:R17C36,9,FALSE),0)*R6C -> 0 | AI145: =IFERROR(VLOOKUP(RC[-16],R9C26:R17C36,10,FALSE),0)*R6C -> 0 | AJ145: =IFERROR(VLOOKUP(RC[-16],R9C26:R17C36,11,FALSE),0)*R6C -> 0 | AK145: =VLOOKUP(RC10,R9C38:R17C40,2,FALSE) -> 1 | AL145: =VLOOKUP(RC10,R9C38:R17C40,3,FALSE) -> 0 | AM145: =IF(OR(ISBLANK(R4C7),ISERROR(FIND(R4C7,RC21))),"　","●") ->  | AN145: =IF(OR(ISBLANK(R5C7),ISERROR(FIND(R5C7,RC21))),"　","●") ->  | AO145: =IF(RC39<>"●",VLOOKUP("評価しない",R9C42:R17C44,2,FALSE),VLOOKUP(R4C8,R9C42:R17C44,2,FALSE)) -> 1 | AP145: =IF(RC39<>"●",VLOOKUP("",R9C42:R17C44,3,FALSE),VLOOKUP(R4C8,R9C42:R17C44,3,FALSE)) -> 0 | AQ145: =IF(RC40<>"●",VLOOKUP("評価しない",R9C42:R17C44,2,FALSE),VLOOKUP(R5C8,R9C42:R17C44,2,FALSE)) -> 1 | AR145: =IF(RC40<>"●",VLOOKUP("",R9C42:R17C44,3,FALSE),VLOOKUP(R5C8,R9C42:R17C44,3,FALSE)) -> 0 | AS145: =IF(OR(ISBLANK(R6C7),ISERROR(FIND(R6C7,RC25))),"　","●") ->  | AT145: =IF(OR(ISBLANK(R7C7),ISERROR(FIND(R7C7,RC25))),"　","●") ->  | AU145: =IF(RC45<>"●",VLOOKUP("評価しない",R9C46:R17C48,2,FALSE),VLOOKUP(R6C8,R9C46:R17C48,2,FALSE)) -> 1 | AV145: =IF(RC45<>"●",VLOOKUP("",R9C46:R17C48,3,FALSE),VLOOKUP(R6C8,R9C46:R17C48,3,FALSE)) -> 0 | AW145: =IF(RC46<>"●",VLOOKUP("評価しない",R9C46:R17C48,2,FALSE),VLOOKUP(R7C8,R9C46:R17C48,2,FALSE)) -> 1 | AX145: =IF(RC46<>"●",VLOOKUP("",R9C46:R17C48,3,FALSE),VLOOKUP(R7C8,R9C46:R17C48,3,FALSE)) -> 0 | AY145: =SUM(RC27:RC36) -> 0 | AZ145: =RC37*RC41*RC43*RC47*RC49 -> 1 | BA145: =RC38+RC42+RC44+RC48+RC50 -> 0
A146: =OFFSET(R164C1,INT((RC26-1)/100),MOD(INT((RC26-1)/10),10),1,1)*10+MOD(RC26-1,10)+1 -> 95 | D146: =IF(AND(RC2<>"NG",OR(RC2<>"",RC3<>"",R9C4="×")),"◯","") ->  | E146: =IF(RC2="◯",RC6,"") ->  | F146: =T(OFFSET('[MiracleNikkiJp_items.csv]MiracleNikkiJp_items'!R10C[-3],RC1,0,1,1)) -> ヘアスタイル | G146: =T(OFFSET('[MiracleNikkiJp_items.csv]MiracleNikkiJp_items'!R10C[-2],RC1,0,1,1)) ->  | H146: =IF(RC4="",0,RC51*RC52+RC53) -> 0 | I146: =RC1 -> 95 | J146: =OFFSET('[MiracleNikkiJp_items.csv]MiracleNikkiJp_items'!R10C[-4],RC1,0,1,1) -> 0 | K146: =T(OFFSET('[MiracleNikkiJp_items.csv]MiracleNikkiJp_items'!R10C[-4],RC1,0,1,1)) ->  | L146: =T(OFFSET('[MiracleNikkiJp_items.csv]MiracleNikkiJp_items'!R10C[-4],RC1,0,1,1)) ->  | M146: =T(OFFSET('[MiracleNikkiJp_items.csv]MiracleNikkiJp_items'!R10C[-4],RC1,0,1,1)) ->  | N146: =T(OFFSET('[MiracleNikkiJp_items.csv]MiracleNikkiJp_items'!R10C[-4],RC1,0,1,1)) ->  | O146: =T(OFFSET('[MiracleNikkiJp_items.csv]MiracleNikkiJp_items'!R10C[-4],RC1,0,1,1)) ->  | P146: =T(OFFSET('[MiracleNikkiJp_items.csv]MiracleNikkiJp_items'!R10C[-4],RC1,0,1,1)) ->  | Q146: =T(OFFSET('[MiracleNikkiJp_items.csv]MiracleNikkiJp_items'!R10C[-4],RC1,0,1,1)) ->  | R146: =T(OFFSET('[MiracleNikkiJp_items.csv]MiracleNikkiJp_items'!R10C[-4],RC1,0,1,1)) ->  | S146: =T(OFFSET('[MiracleNikkiJp_items.csv]MiracleNikkiJp_items'!R10C[-4],RC1,0,1,1)) ->  | T146: =T(OFFSET('[MiracleNikkiJp_items.csv]MiracleNikkiJp_items'!R10C[-4],RC1,0,1,1)) ->  | U146: =T(OFFSET('[MiracleNikkiJp_items.csv]MiracleNikkiJp_items'!R10C[-4],RC1,0,1,1)) ->  | Y146: =T(OFFSET('[MiracleNikkiJp_items.csv]MiracleNikkiJp_items'!R10C[-7],RC1,0,1,1)) ->  | Z146: 95 | AA146: =IFERROR(VLOOKUP(RC[-16],R9C26:R17C36,2,FALSE),0)*R6C -> 0 | AB146: =IFERROR(VLOOKUP(RC[-16],R9C26:R17C36,3,FALSE),0)*R6C -> 0 | AC146: =IFERROR(VLOOKUP(RC[-16],R9C26:R17C36,4,FALSE),0)*R6C -> 0 | AD146: =IFERROR(VLOOKUP(RC[-16],R9C26:R17C36,5,FALSE),0)*R6C -> 0 | AE146: =IFERROR(VLOOKUP(RC[-16],R9C26:R17C36,6,FALSE),0)*R6C -> 0 | AF146: =IFERROR(VLOOKUP(RC[-16],R9C26:R17C36,7,FALSE),0)*R6C -> 0 | AG146: =IFERROR(VLOOKUP(RC[-16],R9C26:R17C36,8,FALSE),0)*R6C -> 0 | AH146: =IFERROR(VLOOKUP(RC[-16],R9C26:R17C36,9,FALSE),0)*R6C -> 0 | AI146: =IFERROR(VLOOKUP(RC[-16],R9C26:R17C36,10,FALSE),0)*R6C -> 0 | AJ146: =IFERROR(VLOOKUP(RC[-16],R9C26:R17C36,11,FALSE),0)*R6C -> 0 | AK146: =VLOOKUP(RC10,R9C38:R17C40,2,FALSE) -> 1 | AL146: =VLOOKUP(RC10,R9C38:R17C40,3,FALSE) -> 0 | AM146: =IF(OR(ISBLANK(R4C7),ISERROR(FIND(R4C7,RC21))),"　","●") ->  | AN146: =IF(OR(ISBLANK(R5C7),ISERROR(FIND(R5C7,RC21))),"　","●") ->  | AO146: =IF(RC39<>"●",VLOOKUP("評価しない",R9C42:R17C44,2,FALSE),VLOOKUP(R4C8,R9C42:R17C44,2,FALSE)) -> 1 | AP146: =IF(RC39<>"●",VLOOKUP("",R9C42:R17C44,3,FALSE),VLOOKUP(R4C8,R9C42:R17C44,3,FALSE)) -> 0 | AQ146: =IF(RC40<>"●",VLOOKUP("評価しない",R9C42:R17C44,2,FALSE),VLOOKUP(R5C8,R9C42:R17C44,2,FALSE)) -> 1 | AR146: =IF(RC40<>"●",VLOOKUP("",R9C42:R17C44,3,FALSE),VLOOKUP(R5C8,R9C42:R17C44,3,FALSE)) -> 0 | AS146: =IF(OR(ISBLANK(R6C7),ISERROR(FIND(R6C7,RC25))),"　","●") ->  | AT146: =IF(OR(ISBLANK(R7C7),ISERROR(FIND(R7C7,RC25))),"　","●") ->  | AU146: =IF(RC45<>"●",VLOOKUP("評価しない",R9C46:R17C48,2,FALSE),VLOOKUP(R6C8,R9C46:R17C48,2,FALSE)) -> 1 | AV146: =IF(RC45<>"●",VLOOKUP("",R9C46:R17C48,3,FALSE),VLOOKUP(R6C8,R9C46:R17C48,3,FALSE)) -> 0 | AW146: =IF(RC46<>"●",VLOOKUP("評価しない",R9C46:R17C48,2,FALSE),VLOOKUP(R7C8,R9C46:R17C48,2,FALSE)) -> 1 | AX146: =IF(RC46<>"●",VLOOKUP("",R9C46:R17C48,3,FALSE),VLOOKUP(R7C8,R9C46:R17C48,3,FALSE)) -> 0 | AY146: =SUM(RC27:RC36) -> 0 | AZ146: =RC37*RC41*RC43*RC47*RC49 -> 1 | BA146: =RC38+RC42+RC44+RC48+RC50 -> 0
A147: =OFFSET(R164C1,INT((RC26-1)/100),MOD(INT((RC26-1)/10),10),1,1)*10+MOD(RC26-1,10)+1 -> 96 | D147: =IF(AND(RC2<>"NG",OR(RC2<>"",RC3<>"",R9C4="×")),"◯","") ->  | E147: =IF(RC2="◯",RC6,"") ->  | F147: =T(OFFSET('[MiracleNikkiJp_items.csv]MiracleNikkiJp_items'!R10C[-3],RC1,0,1,1)) -> ヘアスタイル | G147: =T(OFFSET('[MiracleNikkiJp_items.csv]MiracleNikkiJp_items'!R10C[-2],RC1,0,1,1)) ->  | H147: =IF(RC4="",0,RC51*RC52+RC53) -> 0 | I147: =RC1 -> 96 | J147: =OFFSET('[MiracleNikkiJp_items.csv]MiracleNikkiJp_items'!R10C[-4],RC1,0,1,1) -> 0 | K147: =T(OFFSET('[MiracleNikkiJp_items.csv]MiracleNikkiJp_items'!R10C[-4],RC1,0,1,1)) ->  | L147: =T(OFFSET('[MiracleNikkiJp_items.csv]MiracleNikkiJp_items'!R10C[-4],RC1,0,1,1)) ->  | M147: =T(OFFSET('[MiracleNikkiJp_items.csv]MiracleNikkiJp_items'!R10C[-4],RC1,0,1,1)) ->  | N147: =T(OFFSET('[MiracleNikkiJp_items.csv]MiracleNikkiJp_items'!R10C[-4],RC1,0,1,1)) ->  | O147: =T(OFFSET('[MiracleNikkiJp_items.csv]MiracleNikkiJp_items'!R10C[-4],RC1,0,1,1)) ->  | P147: =T(OFFSET('[MiracleNikkiJp_items.csv]MiracleNikkiJp_items'!R10C[-4],RC1,0,1,1)) ->  | Q147: =T(OFFSET('[MiracleNikkiJp_items.csv]MiracleNikkiJp_items'!R10C[-4],RC1,0,1,1)) ->  | R147: =T(OFFSET('[MiracleNikkiJp_items.csv]MiracleNikkiJp_items'!R10C[-4],RC1,0,1,1)) ->  | S147: =T(OFFSET('[MiracleNikkiJp_items.csv]MiracleNikkiJp_items'!R10C[-4],RC1,0,1,1)) ->  | T147: =T(OFFSET('[MiracleNikkiJp_items.csv]MiracleNikkiJp_items'!R10C[-4],RC1,0,1,1)) ->  | U147: =T(OFFSET('[MiracleNikkiJp_items.csv]MiracleNikkiJp_items'!R10C[-4],RC1,0,1,1)) ->  | Y147: =T(OFFSET('[MiracleNikkiJp_items.csv]MiracleNikkiJp_items'!R10C[-7],RC1,0,1,1)) ->  | Z147: 96 | AA147: =IFERROR(VLOOKUP(RC[-16],R9C26:R17C36,2,FALSE),0)*R6C -> 0 | AB147: =IFERROR(VLOOKUP(RC[-16],R9C26:R17C36,3,FALSE),0)*R6C -> 0 | AC147: =IFERROR(VLOOKUP(RC[-16],R9C26:R17C36,4,FALSE),0)*R6C -> 0 | AD147: =IFERROR(VLOOKUP(RC[-16],R9C26:R17C36,5,FALSE),0)*R6C -> 0 | AE147: =IFERROR(VLOOKUP(RC[-16],R9C26:R17C36,6,FALSE),0)*R6C -> 0 | AF147: =IFERROR(VLOOKUP(RC[-16],R9C26:R17C36,7,FALSE),0)*R6C -> 0 | AG147: =IFERROR(VLOOKUP(RC[-16],R9C26:R17C36,8,FALSE),0)*R6C -> 0 | AH147: =IFERROR(VLOOKUP(RC[-16],R9C26:R17C36,9,FALSE),0)*R6C -> 0 | AI147: =IFERROR(VLOOKUP(RC[-16],R9C26:R17C36,10,FALSE),0)*R6C -> 0 | AJ147: =IFERROR(VLOOKUP(RC[-16],R9C26:R17C36,11,FALSE),0)*R6C -> 0 | AK147: =VLOOKUP(RC10,R9C38:R17C40,2,FALSE) -> 1 | AL147: =VLOOKUP(RC10,R9C38:R17C40,3,FALSE) -> 0 | AM147: =IF(OR(ISBLANK(R4C7),ISERROR(FIND(R4C7,RC21))),"　","●") ->  | AN147: =IF(OR(ISBLANK(R5C7),ISERROR(FIND(R5C7,RC21))),"　","●") ->  | AO147: =IF(RC39<>"●",VLOOKUP("評価しない",R9C42:R17C44,2,FALSE),VLOOKUP(R4C8,R9C42:R17C44,2,FALSE)) -> 1 | AP147: =IF(RC39<>"●",VLOOKUP("",R9C42:R17C44,3,FALSE),VLOOKUP(R4C8,R9C42:R17C44,3,FALSE)) -> 0 | AQ147: =IF(RC40<>"●",VLOOKUP("評価しない",R9C42:R17C44,2,FALSE),VLOOKUP(R5C8,R9C42:R17C44,2,FALSE)) -> 1 | AR147: =IF(RC40<>"●",VLOOKUP("",R9C42:R17C44,3,FALSE),VLOOKUP(R5C8,R9C42:R17C44,3,FALSE)) -> 0 | AS147: =IF(OR(ISBLANK(R6C7),ISERROR(FIND(R6C7,RC25))),"　","●") ->  | AT147: =IF(OR(ISBLANK(R7C7),ISERROR(FIND(R7C7,RC25))),"　","●") ->  | AU147: =IF(RC45<>"●",VLOOKUP("評価しない",R9C46:R17C48,2,FALSE),VLOOKUP(R6C8,R9C46:R17C48,2,FALSE)) -> 1 | AV147: =IF(RC45<>"●",VLOOKUP("",R9C46:R17C48,3,FALSE),VLOOKUP(R6C8,R9C46:R17C48,3,FALSE)) -> 0 | AW147: =IF(RC46<>"●",VLOOKUP("評価しない",R9C46:R17C48,2,FALSE),VLOOKUP(R7C8,R9C46:R17C48,2,FALSE)) -> 1 | AX147: =IF(RC46<>"●",VLOOKUP("",R9C46:R17C48,3,FALSE),VLOOKUP(R7C8,R9C46:R17C48,3,FALSE)) -> 0 | AY147: =SUM(RC27:RC36) -> 0 | AZ147: =RC37*RC41*RC43*RC47*RC49 -> 1 | BA147: =RC38+RC42+RC44+RC48+RC50 -> 0
A148: =OFFSET(R164C1,INT((RC26-1)/100),MOD(INT((RC26-1)/10),10),1,1)*10+MOD(RC26-1,10)+1 -> 97 | D148: =IF(AND(RC2<>"NG",OR(RC2<>"",RC3<>"",R9C4="×")),"◯","") ->  | E148: =IF(RC2="◯",RC6,"") ->  | F148: =T(OFFSET('[MiracleNikkiJp_items.csv]MiracleNikkiJp_items'!R10C[-3],RC1,0,1,1)) -> ヘアスタイル | G148: =T(OFFSET('[MiracleNikkiJp_items.csv]MiracleNikkiJp_items'!R10C[-2],RC1,0,1,1)) ->  | H148: =IF(RC4="",0,RC51*RC52+RC53) -> 0 | I148: =RC1 -> 97 | J148: =OFFSET('[MiracleNikkiJp_items.csv]MiracleNikkiJp_items'!R10C[-4],RC1,0,1,1) -> 0 | K148: =T(OFFSET('[MiracleNikkiJp_items.csv]MiracleNikkiJp_items'!R10C[-4],RC1,0,1,1)) ->  | L148: =T(OFFSET('[MiracleNikkiJp_items.csv]MiracleNikkiJp_items'!R10C[-4],RC1,0,1,1)) ->  | M148: =T(OFFSET('[MiracleNikkiJp_items.csv]MiracleNikkiJp_items'!R10C[-4],RC1,0,1,1)) ->  | N148: =T(OFFSET('[MiracleNikkiJp_items.csv]MiracleNikkiJp_items'!R10C[-4],RC1,0,1,1)) ->  | O148: =T(OFFSET('[MiracleNikkiJp_items.csv]MiracleNikkiJp_items'!R10C[-4],RC1,0,1,1)) ->  | P148: =T(OFFSET('[MiracleNikkiJp_items.csv]MiracleNikkiJp_items'!R10C[-4],RC1,0,1,1)) ->  | Q148: =T(OFFSET('[MiracleNikkiJp_items.csv]MiracleNikkiJp_items'!R10C[-4],RC1,0,1,1)) ->  | R148: =T(OFFSET('[MiracleNikkiJp_items.csv]MiracleNikkiJp_items'!R10C[-4],RC1,0,1,1)) ->  | S148: =T(OFFSET('[MiracleNikkiJp_items.csv]MiracleNikkiJp_items'!R10C[-4],RC1,0,1,1)) ->  | T148: =T(OFFSET('[MiracleNikkiJp_items.csv]MiracleNikkiJp_items'!R10C[-4],RC1,0,1,1)) ->  | U148: =T(OFFSET('[MiracleNikkiJp_items.csv]MiracleNikkiJp_items'!R10C[-4],RC1,0,1,1)) ->  | Y148: =T(OFFSET('[MiracleNikkiJp_items.csv]MiracleNikkiJp_items'!R10C[-7],RC1,0,1,1)) ->  | Z148: 97 | AA148: =IFERROR(VLOOKUP(RC[-16],R9C26:R17C36,2,FALSE),0)*R6C -> 0 | AB148: =IFERROR(VLOOKUP(RC[-16],R9C26:R17C36,3,FALSE),0)*R6C -> 0 | AC148: =IFERROR(VLOOKUP(RC[-16],R9C26:R17C36,4,FALSE),0)*R6C -> 0 | AD148: =IFERROR(VLOOKUP(RC[-16],R9C26:R17C36,5,FALSE),0)*R6C -> 0 | AE148: =IFERROR(VLOOKUP(RC[-16],R9C26:R17C36,6,FALSE),0)*R6C -> 0 | AF148: =IFERROR(VLOOKUP(RC[-16],R9C26:R17C36,7,FALSE),0)*R6C -> 0 | AG148: =IFERROR(VLOOKUP(RC[-16],R9C26:R17C36,8,FALSE),0)*R6C -> 0 | AH148: =IFERROR(VLOOKUP(RC[-16],R9C26:R17C36,9,FALSE),0)*R6C -> 0 | AI148: =IFERROR(VLOOKUP(RC[-16],R9C26:R17C36,10,FALSE),0)*R6C -> 0 | AJ148: =IFERROR(VLOOKUP(RC[-16],R9C26:R17C36,11,FALSE),0)*R6C -> 0 | AK148: =VLOOKUP(RC10,R9C38:R17C40,2,FALSE) -> 1 | AL148: =VLOOKUP(RC10,R9C38:R17C40,3,FALSE) -> 0 | AM148: =IF(OR(ISBLANK(R4C7),ISERROR(FIND(R4C7,RC21))),"　","●") ->  | AN148: =IF(OR(ISBLANK(R5C7),ISERROR(FIND(R5C7,RC21))),"　","●") ->  | AO148: =IF(RC39<>"●",VLOOKUP("評価しない",R9C42:R17C44,2,FALSE),VLOOKUP(R4C8,R9C42:R17C44,2,FALSE)) -> 1 | AP148: =IF(RC39<>"●",VLOOKUP("",R9C42:R17C44,3,FALSE),VLOOKUP(R4C8,R9C42:R17C44,3,FALSE)) -> 0 | AQ148: =IF(RC40<>"●",VLOOKUP("評価しない",R9C42:R17C44,2,FALSE),VLOOKUP(R5C8,R9C42:R17C44,2,FALSE)) -> 1 | AR148: =IF(RC40<>"●",VLOOKUP("",R9C42:R17C44,3,FALSE),VLOOKUP(R5C8,R9C42:R17C44,3,FALSE)) -> 0 | AS148: =IF(OR(ISBLANK(R6C7),ISERROR(FIND(R6C7,RC25))),"　","●") ->  | AT148: =IF(OR(ISBLANK(R7C7),ISERROR(FIND(R7C7,RC25))),"　","●") ->  | AU148: =IF(RC45<>"●",VLOOKUP("評価しない",R9C46:R17C48,2,FALSE),VLOOKUP(R6C8,R9C46:R17C48,2,FALSE)) -> 1 | AV148: =IF(RC45<>"●",VLOOKUP("",R9C46:R17C48,3,FALSE),VLOOKUP(R6C8,R9C46:R17C48,3,FALSE)) -> 0 | AW148: =IF(RC46<>"●",VLOOKUP("評価しない",R9C46:R17C48,2,FALSE),VLOOKUP(R7C8,R9C46:R17C48,2,FALSE)) -> 1 | AX148: =IF(RC46<>"●",VLOOKUP("",R9C46:R17C48,3,FALSE),VLOOKUP(R7C8,R9C46:R17C48,3,FALSE)) -> 0 | AY148: =SUM(RC27:RC36) -> 0 | AZ148: =RC37*RC41*RC43*RC47*RC49 -> 1 | BA148: =RC38+RC42+RC44+RC48+RC50 -> 0
A149: =OFFSET(R164C1,INT((RC26-1)/100),MOD(INT((RC26-1)/10),10),1,1)*10+MOD(RC26-1,10)+1 -> 98 | D149: =IF(AND(RC2<>"NG",OR(RC2<>"",RC3<>"",R9C4="×")),"◯","") ->  | E149: =IF(RC2="◯",RC6,"") ->  | F149: =T(OFFSET('[MiracleNikkiJp_items.csv]MiracleNikkiJp_items'!R10C[-3],RC1,0,1,1)) -> ヘアスタイル | G149: =T(OFFSET('[MiracleNikkiJp_items.csv]MiracleNikkiJp_items'!R10C[-2],RC1,0,1,1)) ->  | H149: =IF(RC4="",0,RC51*RC52+RC53) -> 0 | I149: =RC1 -> 98 | J149: =OFFSET('[MiracleNikkiJp_items.csv]MiracleNikkiJp_items'!R10C[-4],RC1,0,1,1) -> 0 | K149: =T(OFFSET('[MiracleNikkiJp_items.csv]MiracleNikkiJp_items'!R10C[-4],RC1,0,1,1)) ->  | L149: =T(OFFSET('[MiracleNikkiJp_items.csv]MiracleNikkiJp_items'!R10C[-4],RC1,0,1,1)) ->  | M149: =T(OFFSET('[MiracleNikkiJp_items.csv]MiracleNikkiJp_items'!R10C[-4],RC1,0,1,1)) ->  | N149: =T(OFFSET('[MiracleNikkiJp_items.csv]MiracleNikkiJp_items'!R10C[-4],RC1,0,1,1)) ->  | O149: =T(OFFSET('[MiracleNikkiJp_items.csv]MiracleNikkiJp_items'!R10C[-4],RC1,0,1,1)) ->  | P149: =T(OFFSET('[MiracleNikkiJp_items.csv]MiracleNikkiJp_items'!R10C[-4],RC1,0,1,1)) ->  | Q149: =T(OFFSET('[MiracleNikkiJp_items.csv]MiracleNikkiJp_items'!R10C[-4],RC1,0,1,1)) ->  | R149: =T(OFFSET('[MiracleNikkiJp_items.csv]MiracleNikkiJp_items'!R10C[-4],RC1,0,1,1)) ->  | S149: =T(OFFSET('[MiracleNikkiJp_items.csv]MiracleNikkiJp_items'!R10C[-4],RC1,0,1,1)) ->  | T149: =T(OFFSET('[MiracleNikkiJp_items.csv]MiracleNikkiJp_items'!R10C[-4],RC1,0,1,1)) ->  | U149: =T(OFFSET('[MiracleNikkiJp_items.csv]MiracleNikkiJp_items'!R10C[-4],RC1,0,1,1)) ->  | Y149: =T(OFFSET('[MiracleNikkiJp_items.csv]MiracleNikkiJp_items'!R10C[-7],RC1,0,1,1)) ->  | Z149: 98 | AA149: =IFERROR(VLOOKUP(RC[-16],R9C26:R17C36,2,FALSE),0)*R6C -> 0 | AB149: =IFERROR(VLOOKUP(RC[-16],R9C26:R17C36,3,FALSE),0)*R6C -> 0 | AC149: =IFERROR(VLOOKUP(RC[-16],R9C26:R17C36,4,FALSE),0)*R6C -> 0 | AD149: =IFERROR(VLOOKUP(RC[-16],R9C26:R17C36,5,FALSE),0)*R6C -> 0 | AE149: =IFERROR(VLOOKUP(RC[-16],R9C26:R17C36,6,FALSE),0)*R6C -> 0 | AF149: =IFERROR(VLOOKUP(RC[-16],R9C26:R17C36,7,FALSE),0)*R6C -> 0 | AG149: =IFERROR(VLOOKUP(RC[-16],R9C26:R17C36,8,FALSE),0)*R6C -> 0 | AH149: =IFERROR(VLOOKUP(RC[-16],R9C26:R17C36,9,FALSE),0)*R6C -> 0 | AI149: =IFERROR(VLOOKUP(RC[-16],R9C26:R17C36,10,FALSE),0)*R6C -> 0 | AJ149: =IFERROR(VLOOKUP(RC[-16],R9C26:R17C36,11,FALSE),0)*R6C -> 0 | AK149: =VLOOKUP(RC10,R9C38:R17C40,2,FALSE) -> 1 | AL149: =VLOOKUP(RC10,R9C38:R17C40,3,FALSE) -> 0 | AM149: =IF(OR(ISBLANK(R4C7),ISERROR(FIND(R4C7,RC21))),"　","●") ->  | AN149: =IF(OR(ISBLANK(R5C7),ISERROR(FIND(R5C7,RC21))),"　","●") ->  | AO149: =IF(RC39<>"●",VLOOKUP("評価しない",R9C42:R17C44,2,FALSE),VLOOKUP(R4C8,R9C42:R17C44,2,FALSE)) -> 1 | AP149: =IF(RC39<>"●",VLOOKUP("",R9C42:R17C44,3,FALSE),VLOOKUP(R4C8,R9C42:R17C44,3,FALSE)) -> 0 | AQ149: =IF(RC40<>"●",VLOOKUP("評価しない",R9C42:R17C44,2,FALSE),VLOOKUP(R5C8,R9C42:R17C44,2,FALSE)) -> 1 | AR149: =IF(RC40<>"●",VLOOKUP("",R9C42:R17C44,3,FALSE),VLOOKUP(R5C8,R9C42:R17C44,3,FALSE)) -> 0 | AS149: =IF(OR(ISBLANK(R6C7),ISERROR(FIND(R6C7,RC25))),"　","●") ->  | AT149: =IF(OR(ISBLANK(R7C7),ISERROR(FIND(R7C7,RC25))),"　","●") ->  | AU149: =IF(RC45<>"●",VLOOKUP("評価しない",R9C46:R17C48,2,FALSE),VLOOKUP(R6C8,R9C46:R17C48,2,FALSE)) -> 1 | AV149: =IF(RC45<>"●",VLOOKUP("",R9C46:R17C48,3,FALSE),VLOOKUP(R6C8,R9C46:R17C48,3,FALSE)) -> 0 | AW149: =IF(RC46<>"●",VLOOKUP("評価しない",R9C46:R17C48,2,FALSE),VLOOKUP(R7C8,R9C46:R17C48,2,FALSE)) -> 1 | AX149: =IF(RC46<>"●",VLOOKUP("",R9C46:R17C48,3,FALSE),VLOOKUP(R7C8,R9C46:R17C48,3,FALSE)) -> 0 | AY149: =SUM(RC27:RC36) -> 0 | AZ149: =RC37*RC41*RC43*RC47*RC49 -> 1 | BA149: =RC38+RC42+RC44+RC48+RC50 -> 0
A150: =OFFSET(R164C1,INT((RC26-1)/100),MOD(INT((RC26-1)/10),10),1,1)*10+MOD(RC26-1,10)+1 -> 99 | D150: =IF(AND(RC2<>"NG",OR(RC2<>"",RC3<>"",R9C4="×")),"◯","") ->  | E150: =IF(RC2="◯",RC6,"") ->  | F150: =T(OFFSET('[MiracleNikkiJp_items.csv]MiracleNikkiJp_items'!R10C[-3],RC1,0,1,1)) -> ヘアスタイル | G150: =T(OFFSET('[MiracleNikkiJp_items.csv]MiracleNikkiJp_items'!R10C[-2],RC1,0,1,1)) ->  | H150: =IF(RC4="",0,RC51*RC52+RC53) -> 0 | I150: =RC1 -> 99 | J150: =OFFSET('[MiracleNikkiJp_items.csv]MiracleNikkiJp_items'!R10C[-4],RC1,0,1,1) -> 0 | K150: =T(OFFSET('[MiracleNikkiJp_items.csv]MiracleNikkiJp_items'!R10C[-4],RC1,0,1,1)) ->  | L150: =T(OFFSET('[MiracleNikkiJp_items.csv]MiracleNikkiJp_items'!R10C[-4],RC1,0,1,1)) ->  | M150: =T(OFFSET('[MiracleNikkiJp_items.csv]MiracleNikkiJp_items'!R10C[-4],RC1,0,1,1)) ->  | N150: =T(OFFSET('[MiracleNikkiJp_items.csv]MiracleNikkiJp_items'!R10C[-4],RC1,0,1,1)) ->  | O150: =T(OFFSET('[MiracleNikkiJp_items.csv]MiracleNikkiJp_items'!R10C[-4],RC1,0,1,1)) ->  | P150: =T(OFFSET('[MiracleNikkiJp_items.csv]MiracleNikkiJp_items'!R10C[-4],RC1,0,1,1)) ->  | Q150: =T(OFFSET('[MiracleNikkiJp_items.csv]MiracleNikkiJp_items'!R10C[-4],RC1,0,1,1)) ->  | R150: =T(OFFSET('[MiracleNikkiJp_items.csv]MiracleNikkiJp_items'!R10C[-4],RC1,0,1,1)) ->  | S150: =T(OFFSET('[MiracleNikkiJp_items.csv]MiracleNikkiJp_items'!R10C[-4],RC1,0,1,1)) ->  | T150: =T(OFFSET('[MiracleNikkiJp_items.csv]MiracleNikkiJp_items'!R10C[-4],RC1,0,1,1)) ->  | U150: =T(OFFSET('[MiracleNikkiJp_items.csv]MiracleNikkiJp_items'!R10C[-4],RC1,0,1,1)) ->  | Y150: =T(OFFSET('[MiracleNikkiJp_items.csv]MiracleNikkiJp_items'!R10C[-7],RC1,0,1,1)) ->  | Z150: 99 | AA150: =IFERROR(VLOOKUP(RC[-16],R9C26:R17C36,2,FALSE),0)*R6C -> 0 | AB150: =IFERROR(VLOOKUP(RC[-16],R9C26:R17C36,3,FALSE),0)*R6C -> 0 | AC150: =IFERROR(VLOOKUP(RC[-16],R9C26:R17C36,4,FALSE),0)*R6C -> 0 | AD150: =IFERROR(VLOOKUP(RC[-16],R9C26:R17C36,5,FALSE),0)*R6C -> 0 | AE150: =IFERROR(VLOOKUP(RC[-16],R9C26:R17C36,6,FALSE),0)*R6C -> 0 | AF150: =IFERROR(VLOOKUP(RC[-16],R9C26:R17C36,7,FALSE),0)*R6C -> 0 | AG150: =IFERROR(VLOOKUP(RC[-16],R9C26:R17C36,8,FALSE),0)*R6C -> 0 | AH150: =IFERROR(VLOOKUP(RC[-16],R9C26:R17C36,9,FALSE),0)*R6C -> 0 | AI150: =IFERROR(VLOOKUP(RC[-16],R9C26:R17C36,10,FALSE),0)*R6C -> 0 | AJ150: =IFERROR(VLOOKUP(RC[-16],R9C26:R17C36,11,FALSE),0)*R6C -> 0 | AK150: =VLOOKUP(RC10,R9C38:R17C40,2,FALSE) -> 1 | AL150: =VLOOKUP(RC10,R9C38:R17C40,3,FALSE) -> 0 | AM150: =IF(OR(ISBLANK(R4C7),ISERROR(FIND(R4C7,RC21))),"　","●") ->  | AN150: =IF(OR(ISBLANK(R5C7),ISERROR(FIND(R5C7,RC21))),"　","●") ->  | AO150: =IF(RC39<>"●",VLOOKUP("評価しない",R9C42:R17C44,2,FALSE),VLOOKUP(R4C8,R9C42:R17C44,2,FALSE)) -> 1 | AP150: =IF(RC39<>"●",VLOOKUP("",R9C42:R17C44,3,FALSE),VLOOKUP(R4C8,R9C42:R17C44,3,FALSE)) -> 0 | AQ150: =IF(RC40<>"●",VLOOKUP("評価しない",R9C42:R17C44,2,FALSE),VLOOKUP(R5C8,R9C42:R17C44,2,FALSE)) -> 1 | AR150: =IF(RC40<>"●",VLOOKUP("",R9C42:R17C44,3,FALSE),VLOOKUP(R5C8,R9C42:R17C44,3,FALSE)) -> 0 | AS150: =IF(OR(ISBLANK(R6C7),ISERROR(FIND(R6C7,RC25))),"　","●") ->  | AT150: =IF(OR(ISBLANK(R7C7),ISERROR(FIND(R7C7,RC25))),"　","●") ->  | AU150: =IF(RC45<>"●",VLOOKUP("評価しない",R9C46:R17C48,2,FALSE),VLOOKUP(R6C8,R9C46:R17C48,2,FALSE)) -> 1 | AV150: =IF(RC45<>"●",VLOOKUP("",R9C46:R17C48,3,FALSE),VLOOKUP(R6C8,R9C46:R17C48,3,FALSE)) -> 0 | AW150: =IF(RC46<>"●",VLOOKUP("評価しない",R9C46:R17C48,2,FALSE),VLOOKUP(R7C8,R9C46:R17C48,2,FALSE)) -> 1 | AX150: =IF(RC46<>"●",VLOOKUP("",R9C46:R17C48,3,FALSE),VLOOKUP(R7C8,R9C46:R17C48,3,FALSE)) -> 0 | AY150: =SUM(RC27:RC36) -> 0 | AZ150: =RC37*RC41*RC43*RC47*RC49 -> 1 | BA150: =RC38+RC42+RC44+RC48+RC50 -> 0
A151: =OFFSET(R164C1,INT((RC26-1)/100),MOD(INT((RC26-1)/10),10),1,1)*10+MOD(RC26-1,10)+1 -> 100 | D151: =IF(AND(RC2<>"NG",OR(RC2<>"",RC3<>"",R9C4="×")),"◯","") ->  | E151: =IF(RC2="◯",RC6,"") ->  | F151: =T(OFFSET('[MiracleNikkiJp_items.csv]MiracleNikkiJp_items'!R10C[-3],RC1,0,1,1)) -> ヘアスタイル | G151: =T(OFFSET('[MiracleNikkiJp_items.csv]MiracleNikkiJp_items'!R10C[-2],RC1,0,1,1)) ->  | H151: =IF(RC4="",0,RC51*RC52+RC53) -> 0 | I151: =RC1 -> 100 | J151: =OFFSET('[MiracleNikkiJp_items.csv]MiracleNikkiJp_items'!R10C[-4],RC1,0,1,1) -> 0 | K151: =T(OFFSET('[MiracleNikkiJp_items.csv]MiracleNikkiJp_items'!R10C[-4],RC1,0,1,1)) ->  | L151: =T(OFFSET('[MiracleNikkiJp_items.csv]MiracleNikkiJp_items'!R10C[-4],RC1,0,1,1)) ->  | M151: =T(OFFSET('[MiracleNikkiJp_items.csv]MiracleNikkiJp_items'!R10C[-4],RC1,0,1,1)) ->  | N151: =T(OFFSET('[MiracleNikkiJp_items.csv]MiracleNikkiJp_items'!R10C[-4],RC1,0,1,1)) ->  | O151: =T(OFFSET('[MiracleNikkiJp_items.csv]MiracleNikkiJp_items'!R10C[-4],RC1,0,1,1)) ->  | P151: =T(OFFSET('[MiracleNikkiJp_items.csv]MiracleNikkiJp_items'!R10C[-4],RC1,0,1,1)) ->  | Q151: =T(OFFSET('[MiracleNikkiJp_items.csv]MiracleNikkiJp_items'!R10C[-4],RC1,0,1,1)) ->  | R151: =T(OFFSET('[MiracleNikkiJp_items.csv]MiracleNikkiJp_items'!R10C[-4],RC1,0,1,1)) ->  | S151: =T(OFFSET('[MiracleNikkiJp_items.csv]MiracleNikkiJp_items'!R10C[-4],RC1,0,1,1)) ->  | T151: =T(OFFSET('[MiracleNikkiJp_items.csv]MiracleNikkiJp_items'!R10C[-4],RC1,0,1,1)) ->  | U151: =T(OFFSET('[MiracleNikkiJp_items.csv]MiracleNikkiJp_items'!R10C[-4],RC1,0,1,1)) ->  | Y151: =T(OFFSET('[MiracleNikkiJp_items.csv]MiracleNikkiJp_items'!R10C[-7],RC1,0,1,1)) ->  | Z151: 100 | AA151: =IFERROR(VLOOKUP(RC[-16],R9C26:R17C36,2,FALSE),0)*R6C -> 0 | AB151: =IFERROR(VLOOKUP(RC[-16],R9C26:R17C36,3,FALSE),0)*R6C -> 0 | AC151: =IFERROR(VLOOKUP(RC[-16],R9C26:R17C36,4,FALSE),0)*R6C -> 0 | AD151: =IFERROR(VLOOKUP(RC[-16],R9C26:R17C36,5,FALSE),0)*R6C -> 0 | AE151: =IFERROR(VLOOKUP(RC[-16],R9C26:R17C36,6,FALSE),0)*R6C -> 0 | AF151: =IFERROR(VLOOKUP(RC[-16],R9C26:R17C36,7,FALSE),0)*R6C -> 0 | AG151: =IFERROR(VLOOKUP(RC[-16],R9C26:R17C36,8,FALSE),0)*R6C -> 0 | AH151: =IFERROR(VLOOKUP(RC[-16],R9C26:R17C36,9,FALSE),0)*R6C -> 0 | AI151: =IFERROR(VLOOKUP(RC[-16],R9C26:R17C36,10,FALSE),0)*R6C -> 0 | AJ151: =IFERROR(VLOOKUP(RC[-16],R9C26:R17C36,11,FALSE),0)*R6C -> 0 | AK151: =VLOOKUP(RC10,R9C38:R17C40,2,FALSE) -> 1 | AL151: =VLOOKUP(RC10,R9C38:R17C40,3,FALSE) -> 0 | AM151: =IF(OR(ISBLANK(R4C7),ISERROR(FIND(R4C7,RC21))),"　","●") ->  | AN151: =IF(OR(ISBLANK(R5C7),ISERROR(FIND(R5C7,RC21))),"　","●") ->  | AO151: =IF(RC39<>"●",VLOOKUP("評価しない",R9C42:R17C44,2,FALSE),VLOOKUP(R4C8,R9C42:R17C44,2,FALSE)) -> 1 | AP151: =IF(RC39<>"●",VLOOKUP("",R9C42:R17C44,3,FALSE),VLOOKUP(R4C8,R9C42:R17C44,3,FALSE)) -> 0 | AQ151: =IF(RC40<>"●",VLOOKUP("評価しない",R9C42:R17C44,2,FALSE),VLOOKUP(R5C8,R9C42:R17C44,2,FALSE)) -> 1 | AR151: =IF(RC40<>"●",VLOOKUP("",R9C42:R17C44,3,FALSE),VLOOKUP(R5C8,R9C42:R17C44,3,FALSE)) -> 0 | AS151: =IF(OR(ISBLANK(R6C7),ISERROR(FIND(R6C7,RC25))),"　","●") ->  | AT151: =IF(OR(ISBLANK(R7C7),ISERROR(FIND(R7C7,RC25))),"　","●") ->  | AU151: =IF(RC45<>"●",VLOOKUP("評価しない",R9C46:R17C48,2,FALSE),VLOOKUP(R6C8,R9C46:R17C48,2,FALSE)) -> 1 | AV151: =IF(RC45<>"●",VLOOKUP("",R9C46:R17C48,3,FALSE),VLOOKUP(R6C8,R9C46:R17C48,3,FALSE)) -> 0 | AW151: =IF(RC46<>"●",VLOOKUP("評価しない",R9C46:R17C48,2,FALSE),VLOOKUP(R7C8,R9C46:R17C48,2,FALSE)) -> 1 | AX151: =IF(RC46<>"●",VLOOKUP("",R9C46:R17C48,3,FALSE),VLOOKUP(R7C8,R9C46:R17C48,3,FALSE)) -> 0 | AY151: =SUM(RC27:RC36) -> 0 | AZ151: =RC37*RC41*RC43*RC47*RC49 -> 1 | BA151: =RC38+RC42+RC44+RC48+RC50 -> 0
A152: =OFFSET(R164C1,INT((RC26-1)/100),MOD(INT((RC26-1)/10),10),1,1)*10+MOD(RC26-1,10)+1 -> 101 | D152: =IF(AND(RC2<>"NG",OR(RC2<>"",RC3<>"",R9C4="×")),"◯","") ->  | E152: =IF(RC2="◯",RC6,"") ->  | F152: =T(OFFSET('[MiracleNikkiJp_items.csv]MiracleNikkiJp_items'!R10C[-3],RC1,0,1,1)) -> ヘアスタイル | G152: =T(OFFSET('[MiracleNikkiJp_items.csv]MiracleNikkiJp_items'!R10C[-2],RC1,0,1,1)) ->  | H152: =IF(RC4="",0,RC51*RC52+RC53) -> 0 | I152: =RC1 -> 101 | J152: =OFFSET('[MiracleNikkiJp_items.csv]MiracleNikkiJp_items'!R10C[-4],RC1,0,1,1) -> 0 | K152: =T(OFFSET('[MiracleNikkiJp_items.csv]MiracleNikkiJp_items'!R10C[-4],RC1,0,1,1)) ->  | L152: =T(OFFSET('[MiracleNikkiJp_items.csv]MiracleNikkiJp_items'!R10C[-4],RC1,0,1,1)) ->  | M152: =T(OFFSET('[MiracleNikkiJp_items.csv]MiracleNikkiJp_items'!R10C[-4],RC1,0,1,1)) ->  | N152: =T(OFFSET('[MiracleNikkiJp_items.csv]MiracleNikkiJp_items'!R10C[-4],RC1,0,1,1)) ->  | O152: =T(OFFSET('[MiracleNikkiJp_items.csv]MiracleNikkiJp_items'!R10C[-4],RC1,0,1,1)) ->  | P152: =T(OFFSET('[MiracleNikkiJp_items.csv]MiracleNikkiJp_items'!R10C[-4],RC1,0,1,1)) ->  | Q152: =T(OFFSET('[MiracleNikkiJp_items.csv]MiracleNikkiJp_items'!R10C[-4],RC1,0,1,1)) ->  | R152: =T(OFFSET('[MiracleNikkiJp_items.csv]MiracleNikkiJp_items'!R10C[-4],RC1,0,1,1)) ->  | S152: =T(OFFSET('[MiracleNikkiJp_items.csv]MiracleNikkiJp_items'!R10C[-4],RC1,0,1,1)) ->  | T152: =T(OFFSET('[MiracleNikkiJp_items.csv]MiracleNikkiJp_items'!R10C[-4],RC1,0,1,1)) ->  | U152: =T(OFFSET('[MiracleNikkiJp_items.csv]MiracleNikkiJp_items'!R10C[-4],RC1,0,1,1)) ->  | Y152: =T(OFFSET('[MiracleNikkiJp_items.csv]MiracleNikkiJp_items'!R10C[-7],RC1,0,1,1)) ->  | Z152: 101 | AA152: =IFERROR(VLOOKUP(RC[-16],R9C26:R17C36,2,FALSE),0)*R6C -> 0 | AB152: =IFERROR(VLOOKUP(RC[-16],R9C26:R17C36,3,FALSE),0)*R6C -> 0 | AC152: =IFERROR(VLOOKUP(RC[-16],R9C26:R17C36,4,FALSE),0)*R6C -> 0 | AD152: =IFERROR(VLOOKUP(RC[-16],R9C26:R17C36,5,FALSE),0)*R6C -> 0 | AE152: =IFERROR(VLOOKUP(RC[-16],R9C26:R17C36,6,FALSE),0)*R6C -> 0 | AF152: =IFERROR(VLOOKUP(RC[-16],R9C26:R17C36,7,FALSE),0)*R6C -> 0 | AG152: =IFERROR(VLOOKUP(RC[-16],R9C26:R17C36,8,FALSE),0)*R6C -> 0 | AH152: =IFERROR(VLOOKUP(RC[-16],R9C26:R17C36,9,FALSE),0)*R6C -> 0 | AI152: =IFERROR(VLOOKUP(RC[-16],R9C26:R17C36,10,FALSE),0)*R6C -> 0 | AJ152: =IFERROR(VLOOKUP(RC[-16],R9C26:R17C36,11,FALSE),0)*R6C -> 0 | AK152: =VLOOKUP(RC10,R9C38:R17C40,2,FALSE) -> 1 | AL152: =VLOOKUP(RC10,R9C38:R17C40,3,FALSE) -> 0 | AM152: =IF(OR(ISBLANK(R4C7),ISERROR(FIND(R4C7,RC21))),"　","●") ->  | AN152: =IF(OR(ISBLANK(R5C7),ISERROR(FIND(R5C7,RC21))),"　","●") ->  | AO152: =IF(RC39<>"●",VLOOKUP("評価しない",R9C42:R17C44,2,FALSE),VLOOKUP(R4C8,R9C42:R17C44,2,FALSE)) -> 1 | AP152: =IF(RC39<>"●",VLOOKUP("",R9C42:R17C44,3,FALSE),VLOOKUP(R4C8,R9C42:R17C44,3,FALSE)) -> 0 | AQ152: =IF(RC40<>"●",VLOOKUP("評価しない",R9C42:R17C44,2,FALSE),VLOOKUP(R5C8,R9C42:R17C44,2,FALSE)) -> 1 | AR152: =IF(RC40<>"●",VLOOKUP("",R9C42:R17C44,3,FALSE),VLOOKUP(R5C8,R9C42:R17C44,3,FALSE)) -> 0 | AS152: =IF(OR(ISBLANK(R6C7),ISERROR(FIND(R6C7,RC25))),"　","●") ->  | AT152: =IF(OR(ISBLANK(R7C7),ISERROR(FIND(R7C7,RC25))),"　","●") ->  | AU152: =IF(RC45<>"●",VLOOKUP("評価しない",R9C46:R17C48,2,FALSE),VLOOKUP(R6C8,R9C46:R17C48,2,FALSE)) -> 1 | AV152: =IF(RC45<>"●",VLOOKUP("",R9C46:R17C48,3,FALSE),VLOOKUP(R6C8,R9C46:R17C48,3,FALSE)) -> 0 | AW152: =IF(RC46<>"●",VLOOKUP("評価しない",R9C46:R17C48,2,FALSE),VLOOKUP(R7C8,R9C46:R17C48,2,FALSE)) -> 1 | AX152: =IF(RC46<>"●",VLOOKUP("",R9C46:R17C48,3,FALSE),VLOOKUP(R7C8,R9C46:R17C48,3,FALSE)) -> 0 | AY152: =SUM(RC27:RC36) -> 0 | AZ152: =RC37*RC41*RC43*RC47*RC49 -> 1 | BA152: =RC38+RC42+RC44+RC48+RC50 -> 0
A154: 一つ上の行は、理由があって空けています。通番最大値が並べ替えの対象にならないようにするためです。 | Y154: 右に非表示の通番最大値があります | Z154: =MAX(R[-104]C:R[-1]C) -> 101
A157: このフォーマットでは、スキップ部分が多いアイテムの番号を効率よく拾って使用するために、通しの整理番号を付与したうえで、どの部分を使用するか指定します。
A158: 整理番号と、番号(アプリ中の番号)と、種類の関係は固定で、変更しないこととします。この固定により整理番号とアイテムの所持情報をリンクすることができ、このファイルの何行目なのかも特定できるようになります。
A159: アイテムの種類毎に番号1から10000まで記述可能な書式になっています。全部埋まると90000アイテムです。
A160: 以下の900行は、使用する整理番号ブロックの一覧です。10列×900行＝9000個指定可能ですが、4500アイテムまでを表示する表では先頭から45行を使用します。0と書くと、整理番号1から10の10行を指定したこととします。使用しない部分は8999のような未使用ブロックを記述しておきます。
A162: 使用する整理番号ブロックの参照
A163: 1 | B163: 2 | C163: 3 | D163: 4 | E163: 5 | F163: 6 | G163: 7 | H163: 8 | I163: 9 | J163: 10
A164: 0 | B164: 1 | C164: 2 | D164: 3 | E164: 4 | F164: 5 | G164: 6 | H164: 7 | I164: 8 | J164: 9
A165: 10 | B165: 11 | C165: 12 | D165: 13 | E165: 14 | F165: 15 | G165: 16 | H165: 17 | I165: 18 | J165: 19

Sheet: スクショ
B1: =クエスト!R[11]C[9] -> 華 | C1: =クエスト!R[11]C[9] -> シ | D1: =クエスト!R[11]C[9] -> エ | E1: =クエスト!R[11]C[9] -> ア | F1: =クエスト!R[11]C[9] -> 大 | G1: =クエスト!R[11]C[9] -> キ | H1: =クエスト!R[11]C[9] -> セ | I1: =クエスト!R[11]C[9] -> ピ | J1: =クエスト!R[11]C[9] -> ウ | K1: =クエスト!R[11]C[9] -> ク | L1: =クエスト!R[11]C[9] -> タグ | M1: ここに画像を貼り付けます
A2: =IF(クエスト!R[11]C8>0,LEFT(クエスト!R[11]C[6],10),"-") -> - | B2: =IF(クエスト!R[11]C8>0,クエスト!R[11]C[9],"-") -> - | C2: =IF(クエスト!R[11]C8>0,クエスト!R[11]C[9],"-") -> - | D2: =IF(クエスト!R[11]C8>0,クエスト!R[11]C[9],"-") -> - | E2: =IF(クエスト!R[11]C8>0,クエスト!R[11]C[9],"-") -> - | F2: =IF(クエスト!R[11]C8>0,クエスト!R[11]C[9],"-") -> - | G2: =IF(クエスト!R[11]C8>0,クエスト!R[11]C[9],"-") -> - | H2: =IF(クエスト!R[11]C8>0,クエスト!R[11]C[9],"-") -> - | I2: =IF(クエスト!R[11]C8>0,クエスト!R[11]C[9],"-") -> - | J2: =IF(クエスト!R[11]C8>0,クエスト!R[11]C[9],"-") -> - | K2: =IF(クエスト!R[11]C8>0,クエスト!R[11]C[9],"-") -> - | L2: =IF(クエスト!R[11]C8>0,LEFT(クエスト!R[11]C[9],2),"-") -> -
A3: =IF(クエスト!R[11]C8>0,LEFT(クエスト!R[11]C[6],10),"-") -> #N/A | B3: =IF(クエスト!R[11]C8>0,クエスト!R[11]C[9],"-") -> #N/A | C3: =IF(クエスト!R[11]C8>0,クエスト!R[11]C[9],"-") -> #N/A | D3: =IF(クエスト!R[11]C8>0,クエスト!R[11]C[9],"-") -> #N/A | E3: =IF(クエスト!R[11]C8>0,クエスト!R[11]C[9],"-") -> #N/A | F3: =IF(クエスト!R[11]C8>0,クエスト!R[11]C[9],"-") -> #N/A | G3: =IF(クエスト!R[11]C8>0,クエスト!R[11]C[9],"-") -> #N/A | H3: =IF(クエスト!R[11]C8>0,クエスト!R[11]C[9],"-") -> #N/A | I3: =IF(クエスト!R[11]C8>0,クエスト!R[11]C[9],"-") -> #N/A | J3: =IF(クエスト!R[11]C8>0,クエスト!R[11]C[9],"-") -> #N/A | K3: =IF(クエスト!R[11]C8>0,クエスト!R[11]C[9],"-") -> #N/A | L3: =IF(クエスト!R[11]C8>0,LEFT(クエスト!R[11]C[9],2),"-") -> #N/A
A4: =IF(クエスト!R[11]C8>0,LEFT(クエスト!R[11]C[6],10),"-") -> #N/A | B4: =IF(クエスト!R[11]C8>0,クエスト!R[11]C[9],"-") -> #N/A | C4: =IF(クエスト!R[11]C8>0,クエスト!R[11]C[9],"-") -> #N/A | D4: =IF(クエスト!R[11]C8>0,クエスト!R[11]C[9],"-") -> #N/A | E4: =IF(クエスト!R[11]C8>0,クエスト!R[11]C[9],"-") -> #N/A | F4: =IF(クエスト!R[11]C8>0,クエスト!R[11]C[9],"-") -> #N/A | G4: =IF(クエスト!R[11]C8>0,クエスト!R[11]C[9],"-") -> #N/A | H4: =IF(クエスト!R[11]C8>0,クエスト!R[11]C[9],"-") -> #N/A | I4: =IF(クエスト!R[11]C8>0,クエスト!R[11]C[9],"-") -> #N/A | J4: =IF(クエスト!R[11]C8>0,クエスト!R[11]C[9],"-") -> #N/A | K4: =IF(クエスト!R[11]C8>0,クエスト!R[11]C[9],"-") -> #N/A | L4: =IF(クエスト!R[11]C8>0,LEFT(クエスト!R[11]C[9],2),"-") -> #N/A
A5: =IF(クエスト!R[11]C8>0,LEFT(クエスト!R[11]C[6],10),"-") -> #N/A | B5: =IF(クエスト!R[11]C8>0,クエスト!R[11]C[9],"-") -> #N/A | C5: =IF(クエスト!R[11]C8>0,クエスト!R[11]C[9],"-") -> #N/A | D5: =IF(クエスト!R[11]C8>0,クエスト!R[11]C[9],"-") -> #N/A | E5: =IF(クエスト!R[11]C8>0,クエスト!R[11]C[9],"-") -> #N/A | F5: =IF(クエスト!R[11]C8>0,クエスト!R[11]C[9],"-") -> #N/A | G5: =IF(クエスト!R[11]C8>0,クエスト!R[11]C[9],"-") -> #N/A | H5: =IF(クエスト!R[11]C8>0,クエスト!R[11]C[9],"-") -> #N/A | I5: =IF(クエスト!R[11]C8>0,クエスト!R[11]C[9],"-") -> #N/A | J5: =IF(クエスト!R[11]C8>0,クエスト!R[11]C[9],"-") -> #N/A | K5: =IF(クエスト!R[11]C8>0,クエスト!R[11]C[9],"-") -> #N/A | L5: =IF(クエスト!R[11]C8>0,LEFT(クエスト!R[11]C[9],2),"-") -> #N/A
A6: =IF(クエスト!R[11]C8>0,LEFT(クエスト!R[11]C[6],10),"-") -> #N/A | B6: =IF(クエスト!R[11]C8>0,クエスト!R[11]C[9],"-") -> #N/A | C6: =IF(クエスト!R[11]C8>0,クエスト!R[11]C[9],"-") -> #N/A | D6: =IF(クエスト!R[11]C8>0,クエスト!R[11]C[9],"-") -> #N/A | E6: =IF(クエスト!R[11]C8>0,クエスト!R[11]C[9],"-") -> #N/A | F6: =IF(クエスト!R[11]C8>0,クエスト!R[11]C[9],"-") -> #N/A | G6: =IF(クエスト!R[11]C8>0,クエスト!R[11]C[9],"-") -> #N/A | H6: =IF(クエスト!R[11]C8>0,クエスト!R[11]C[9],"-") -> #N/A | I6: =IF(クエスト!R[11]C8>0,クエスト!R[11]C[9],"-") -> #N/A | J6: =IF(クエスト!R[11]C8>0,クエスト!R[11]C[9],"-") -> #N/A | K6: =IF(クエスト!R[11]C8>0,クエスト!R[11]C[9],"-") -> #N/A | L6: =IF(クエスト!R[11]C8>0,LEFT(クエスト!R[11]C[9],2),"-") -> #N/A
A7: =IF(クエスト!R[11]C8>0,LEFT(クエスト!R[11]C[6],10),"-") -> #N/A | B7: =IF(クエスト!R[11]C8>0,クエスト!R[11]C[9],"-") -> #N/A | C7: =IF(クエスト!R[11]C8>0,クエスト!R[11]C[9],"-") -> #N/A | D7: =IF(クエスト!R[11]C8>0,クエスト!R[11]C[9],"-") -> #N/A | E7: =IF(クエスト!R[11]C8>0,クエスト!R[11]C[9],"-") -> #N/A | F7: =IF(クエスト!R[11]C8>0,クエスト!R[11]C[9],"-") -> #N/A | G7: =IF(クエスト!R[11]C8>0,クエスト!R[11]C[9],"-") -> #N/A | H7: =IF(クエスト!R[11]C8>0,クエスト!R[11]C[9],"-") -> #N/A | I7: =IF(クエスト!R[11]C8>0,クエスト!R[11]C[9],"-") -> #N/A | J7: =IF(クエスト!R[11]C8>0,クエスト!R[11]C[9],"-") -> #N/A | K7: =IF(クエスト!R[11]C8>0,クエスト!R[11]C[9],"-") -> #N/A | L7: =IF(クエスト!R[11]C8>0,LEFT(クエスト!R[11]C[9],2),"-") -> #N/A
A8: =IF(クエスト!R[11]C8>0,LEFT(クエスト!R[11]C[6],10),"-") -> #N/A | B8: =IF(クエスト!R[11]C8>0,クエスト!R[11]C[9],"-") -> #N/A | C8: =IF(クエスト!R[11]C8>0,クエスト!R[11]C[9],"-") -> #N/A | D8: =IF(クエスト!R[11]C8>0,クエスト!R[11]C[9],"-") -> #N/A | E8: =IF(クエスト!R[11]C8>0,クエスト!R[11]C[9],"-") -> #N/A | F8: =IF(クエスト!R[11]C8>0,クエスト!R[11]C[9],"-") -> #N/A | G8: =IF(クエスト!R[11]C8>0,クエスト!R[11]C[9],"-") -> #N/A | H8: =IF(クエスト!R[11]C8>0,クエスト!R[11]C[9],"-") -> #N/A | I8: =IF(クエスト!R[11]C8>0,クエスト!R[11]C[9],"-") -> #N/A | J8: =IF(クエスト!R[11]C8>0,クエスト!R[11]C[9],"-") -> #N/A | K8: =IF(クエスト!R[11]C8>0,クエスト!R[11]C[9],"-") -> #N/A | L8: =IF(クエスト!R[11]C8>0,LEFT(クエスト!R[11]C[9],2),"-") -> #N/A
A9: =IF(クエスト!R[11]C8>0,LEFT(クエスト!R[11]C[6],10),"-") -> #N/A | B9: =IF(クエスト!R[11]C8>0,クエスト!R[11]C[9],"-") -> #N/A | C9: =IF(クエスト!R[11]C8>0,クエスト!R[11]C[9],"-") -> #N/A | D9: =IF(クエスト!R[11]C8>0,クエスト!R[11]C[9],"-") -> #N/A | E9: =IF(クエスト!R[11]C8>0,クエスト!R[11]C[9],"-") -> #N/A | F9: =IF(クエスト!R[11]C8>0,クエスト!R[11]C[9],"-") -> #N/A | G9: =IF(クエスト!R[11]C8>0,クエスト!R[11]C[9],"-") -> #N/A | H9: =IF(クエスト!R[11]C8>0,クエスト!R[11]C[9],"-") -> #N/A | I9: =IF(クエスト!R[11]C8>0,クエスト!R[11]C[9],"-") -> #N/A | J9: =IF(クエスト!R[11]C8>0,クエスト!R[11]C[9],"-") -> #N/A | K9: =IF(クエスト!R[11]C8>0,クエスト!R[11]C[9],"-") -> #N/A | L9: =IF(クエスト!R[11]C8>0,LEFT(クエスト!R[11]C[9],2),"-") -> #N/A
A10: =IF(クエスト!R[11]C8>0,LEFT(クエスト!R[11]C[6],10),"-") -> #N/A | B10: =IF(クエスト!R[11]C8>0,クエスト!R[11]C[9],"-") -> #N/A | C10: =IF(クエスト!R[11]C8>0,クエスト!R[11]C[9],"-") -> #N/A | D10: =IF(クエスト!R[11]C8>0,クエスト!R[11]C[9],"-") -> #N/A | E10: =IF(クエスト!R[11]C8>0,クエスト!R[11]C[9],"-") -> #N/A | F10: =IF(クエスト!R[11]C8>0,クエスト!R[11]C[9],"-") -> #N/A | G10: =IF(クエスト!R[11]C8>0,クエスト!R[11]C[9],"-") -> #N/A | H10: =IF(クエスト!R[11]C8>0,クエスト!R[11]C[9],"-") -> #N/A | I10: =IF(クエスト!R[11]C8>0,クエスト!R[11]C[9],"-") -> #N/A | J10: =IF(クエスト!R[11]C8>0,クエスト!R[11]C[9],"-") -> #N/A | K10: =IF(クエスト!R[11]C8>0,クエスト!R[11]C[9],"-") -> #N/A | L10: =IF(クエスト!R[11]C8>0,LEFT(クエスト!R[11]C[9],2),"-") -> #N/A
A11: =IF(クエスト!R[11]C8>0,LEFT(クエスト!R[11]C[6],10),"-") -> #N/A | B11: =IF(クエスト!R[11]C8>0,クエスト!R[11]C[9],"-") -> #N/A | C11: =IF(クエスト!R[11]C8>0,クエスト!R[11]C[9],"-") -> #N/A | D11: =IF(クエスト!R[11]C8>0,クエスト!R[11]C[9],"-") -> #N/A | E11: =IF(クエスト!R[11]C8>0,クエスト!R[11]C[9],"-") -> #N/A | F11: =IF(クエスト!R[11]C8>0,クエスト!R[11]C[9],"-") -> #N/A | G11: =IF(クエスト!R[11]C8>0,クエスト!R[11]C[9],"-") -> #N/A | H11: =IF(クエスト!R[11]C8>0,クエスト!R[11]C[9],"-") -> #N/A | I11: =IF(クエスト!R[11]C8>0,クエスト!R[11]C[9],"-") -> #N/A | J11: =IF(クエスト!R[11]C8>0,クエスト!R[11]C[9],"-") -> #N/A | K11: =IF(クエスト!R[11]C8>0,クエスト!R[11]C[9],"-") -> #N/A | L11: =IF(クエスト!R[11]C8>0,LEFT(クエスト!R[11]C[9],2),"-") -> #N/A
A12: =IF(クエスト!R[11]C8>0,LEFT(クエスト!R[11]C[6],10),"-") -> #N/A | B12: =IF(クエスト!R[11]C8>0,クエスト!R[11]C[9],"-") -> #N/A | C12: =IF(クエスト!R[11]C8>0,クエスト!R[11]C[9],"-") -> #N/A | D12: =IF(クエスト!R[11]C8>0,クエスト!R[11]C[9],"-") -> #N/A | E12: =IF(クエスト!R[11]C8>0,クエスト!R[11]C[9],"-") -> #N/A | F12: =IF(クエスト!R[11]C8>0,クエスト!R[11]C[9],"-") -> #N/A | G12: =IF(クエスト!R[11]C8>0,クエスト!R[11]C[9],"-") -> #N/A | H12: =IF(クエスト!R[11]C8>0,クエスト!R[11]C[9],"-") -> #N/A | I12: =IF(クエスト!R[11]C8>0,クエスト!R[11]C[9],"-") -> #N/A | J12: =IF(クエスト!R[11]C8>0,クエスト!R[11]C[9],"-") -> #N/A | K12: =IF(クエスト!R[11]C8>0,クエスト!R[11]C[9],"-") -> #N/A | L12: =IF(クエスト!R[11]C8>0,LEFT(クエスト!R[11]C[9],2),"-") -> #N/A
A13: =IF(クエスト!R[11]C8>0,LEFT(クエスト!R[11]C[6],10),"-") -> #N/A | B13: =IF(クエスト!R[11]C8>0,クエスト!R[11]C[9],"-") -> #N/A | C13: =IF(クエスト!R[11]C8>0,クエスト!R[11]C[9],"-") -> #N/A | D13: =IF(クエスト!R[11]C8>0,クエスト!R[11]C[9],"-") -> #N/A | E13: =IF(クエスト!R[11]C8>0,クエスト!R[11]C[9],"-") -> #N/A | F13: =IF(クエスト!R[11]C8>0,クエスト!R[11]C[9],"-") -> #N/A | G13: =IF(クエスト!R[11]C8>0,クエスト!R[11]C[9],"-") -> #N/A | H13: =IF(クエスト!R[11]C8>0,クエスト!R[11]C[9],"-") -> #N/A | I13: =IF(クエスト!R[11]C8>0,クエスト!R[11]C[9],"-") -> #N/A | J13: =IF(クエスト!R[11]C8>0,クエスト!R[11]C[9],"-") -> #N/A | K13: =IF(クエスト!R[11]C8>0,クエスト!R[11]C[9],"-") -> #N/A | L13: =IF(クエスト!R[11]C8>0,LEFT(クエスト!R[11]C[9],2),"-") -> #N/A
A14: =IF(クエスト!R[11]C8>0,LEFT(クエスト!R[11]C[6],10),"-") -> #N/A | B14: =IF(クエスト!R[11]C8>0,クエスト!R[11]C[9],"-") -> #N/A | C14: =IF(クエスト!R[11]C8>0,クエスト!R[11]C[9],"-") -> #N/A | D14: =IF(クエスト!R[11]C8>0,クエスト!R[11]C[9],"-") -> #N/A | E14: =IF(クエスト!R[11]C8>0,クエスト!R[11]C[9],"-") -> #N/A | F14: =IF(クエスト!R[11]C8>0,クエスト!R[11]C[9],"-") -> #N/A | G14: =IF(クエスト!R[11]C8>0,クエスト!R[11]C[9],"-") -> #N/A | H14: =IF(クエスト!R[11]C8>0,クエスト!R[11]C[9],"-") -> #N/A | I14: =IF(クエスト!R[11]C8>0,クエスト!R[11]C[9],"-") -> #N/A | J14: =IF(クエスト!R[11]C8>0,クエスト!R[11]C[9],"-") -> #N/A | K14: =IF(クエスト!R[11]C8>0,クエスト!R[11]C[9],"-") -> #N/A | L14: =IF(クエスト!R[11]C8>0,LEFT(クエスト!R[11]C[9],2),"-") -> #N/A
A15: =IF(クエスト!R[11]C8>0,LEFT(クエスト!R[11]C[6],10),"-") -> #N/A | B15: =IF(クエスト!R[11]C8>0,クエスト!R[11]C[9],"-") -> #N/A | C15: =IF(クエスト!R[11]C8>0,クエスト!R[11]C[9],"-") -> #N/A | D15: =IF(クエスト!R[11]C8>0,クエスト!R[11]C[9],"-") -> #N/A | E15: =IF(クエスト!R[11]C8>0,クエスト!R[11]C[9],"-") -> #N/A | F15: =IF(クエスト!R[11]C8>0,クエスト!R[11]C[9],"-") -> #N/A | G15: =IF(クエスト!R[11]C8>0,クエスト!R[11]C[9],"-") -> #N/A | H15: =IF(クエスト!R[11]C8>0,クエスト!R[11]C[9],"-") -> #N/A | I15: =IF(クエスト!R[11]C8>0,クエスト!R[11]C[9],"-") -> #N/A | J15: =IF(クエスト!R[11]C8>0,クエスト!R[11]C[9],"-") -> #N/A | K15: =IF(クエスト!R[11]C8>0,クエスト!R[11]C[9],"-") -> #N/A | L15: =IF(クエスト!R[11]C8>0,LEFT(クエスト!R[11]C[9],2),"-") -> #N/A
A16: =IF(クエスト!R[11]C8>0,LEFT(クエスト!R[11]C[6],10),"-") -> #N/A | B16: =IF(クエスト!R[11]C8>0,クエスト!R[11]C[9],"-") -> #N/A | C16: =IF(クエスト!R[11]C8>0,クエスト!R[11]C[9],"-") -> #N/A | D16: =IF(クエスト!R[11]C8>0,クエスト!R[11]C[9],"-") -> #N/A | E16: =IF(クエスト!R[11]C8>0,クエスト!R[11]C[9],"-") -> #N/A | F16: =IF(クエスト!R[11]C8>0,クエスト!R[11]C[9],"-") -> #N/A | G16: =IF(クエスト!R[11]C8>0,クエスト!R[11]C[9],"-") -> #N/A | H16: =IF(クエスト!R[11]C8>0,クエスト!R[11]C[9],"-") -> #N/A | I16: =IF(クエスト!R[11]C8>0,クエスト!R[11]C[9],"-") -> #N/A | J16: =IF(クエスト!R[11]C8>0,クエスト!R[11]C[9],"-") -> #N/A | K16: =IF(クエスト!R[11]C8>0,クエスト!R[11]C[9],"-") -> #N/A | L16: =IF(クエスト!R[11]C8>0,LEFT(クエスト!R[11]C[9],2),"-") -> #N/A
A17: =IF(クエスト!R[11]C8>0,LEFT(クエスト!R[11]C[6],10),"-") -> #N/A | B17: =IF(クエスト!R[11]C8>0,クエスト!R[11]C[9],"-") -> #N/A | C17: =IF(クエスト!R[11]C8>0,クエスト!R[11]C[9],"-") -> #N/A | D17: =IF(クエスト!R[11]C8>0,クエスト!R[11]C[9],"-") -> #N/A | E17: =IF(クエスト!R[11]C8>0,クエスト!R[11]C[9],"-") -> #N/A | F17: =IF(クエスト!R[11]C8>0,クエスト!R[11]C[9],"-") -> #N/A | G17: =IF(クエスト!R[11]C8>0,クエスト!R[11]C[9],"-") -> #N/A | H17: =IF(クエスト!R[11]C8>0,クエスト!R[11]C[9],"-") -> #N/A | I17: =IF(クエスト!R[11]C8>0,クエスト!R[11]C[9],"-") -> #N/A | J17: =IF(クエスト!R[11]C8>0,クエスト!R[11]C[9],"-") -> #N/A | K17: =IF(クエスト!R[11]C8>0,クエスト!R[11]C[9],"-") -> #N/A | L17: =IF(クエスト!R[11]C8>0,LEFT(クエスト!R[11]C[9],2),"-") -> #N/A
A18: =IF(クエスト!R[11]C8>0,LEFT(クエスト!R[11]C[6],10),"-") -> #N/A | B18: =IF(クエスト!R[11]C8>0,クエスト!R[11]C[9],"-") -> #N/A | C18: =IF(クエスト!R[11]C8>0,クエスト!R[11]C[9],"-") -> #N/A | D18: =IF(クエスト!R[11]C8>0,クエスト!R[11]C[9],"-") -> #N/A | E18: =IF(クエスト!R[11]C8>0,クエスト!R[11]C[9],"-") -> #N/A | F18: =IF(クエスト!R[11]C8>0,クエスト!R[11]C[9],"-") -> #N/A | G18: =IF(クエスト!R[11]C8>0,クエスト!R[11]C[9],"-") -> #N/A | H18: =IF(クエスト!R[11]C8>0,クエスト!R[11]C[9],"-") -> #N/A | I18: =IF(クエスト!R[11]C8>0,クエスト!R[11]C[9],"-") -> #N/A | J18: =IF(クエスト!R[11]C8>0,クエスト!R[11]C[9],"-") -> #N/A | K18: =IF(クエスト!R[11]C8>0,クエスト!R[11]C[9],"-") -> #N/A | L18: =IF(クエスト!R[11]C8>0,LEFT(クエスト!R[11]C[9],2),"-") -> #N/A
A19: =IF(クエスト!R[11]C8>0,LEFT(クエスト!R[11]C[6],10),"-") -> #N/A | B19: =IF(クエスト!R[11]C8>0,クエスト!R[11]C[9],"-") -> #N/A | C19: =IF(クエスト!R[11]C8>0,クエスト!R[11]C[9],"-") -> #N/A | D19: =IF(クエスト!R[11]C8>0,クエスト!R[11]C[9],"-") -> #N/A | E19: =IF(クエスト!R[11]C8>0,クエスト!R[11]C[9],"-") -> #N/A | F19: =IF(クエスト!R[11]C8>0,クエスト!R[11]C[9],"-") -> #N/A | G19: =IF(クエスト!R[11]C8>0,クエスト!R[11]C[9],"-") -> #N/A | H19: =IF(クエスト!R[11]C8>0,クエスト!R[11]C[9],"-") -> #N/A | I19: =IF(クエスト!R[11]C8>0,クエスト!R[11]C[9],"-") -> #N/A | J19: =IF(クエスト!R[11]C8>0,クエスト!R[11]C[9],"-") -> #N/A | K19: =IF(クエスト!R[11]C8>0,クエスト!R[11]C[9],"-") -> #N/A | L19: =IF(クエスト!R[11]C8>0,LEFT(クエスト!R[11]C[9],2),"-") -> #N/A
A20: =IF(クエスト!R[11]C8>0,LEFT(クエスト!R[11]C[6],10),"-") -> #N/A | B20: =IF(クエスト!R[11]C8>0,クエスト!R[11]C[9],"-") -> #N/A | C20: =IF(クエスト!R[11]C8>0,クエスト!R[11]C[9],"-") -> #N/A | D20: =IF(クエスト!R[11]C8>0,クエスト!R[11]C[9],"-") -> #N/A | E20: =IF(クエスト!R[11]C8>0,クエスト!R[11]C[9],"-") -> #N/A | F20: =IF(クエスト!R[11]C8>0,クエスト!R[11]C[9],"-") -> #N/A | G20: =IF(クエスト!R[11]C8>0,クエスト!R[11]C[9],"-") -> #N/A | H20: =IF(クエスト!R[11]C8>0,クエスト!R[11]C[9],"-") -> #N/A | I20: =IF(クエスト!R[11]C8>0,クエスト!R[11]C[9],"-") -> #N/A | J20: =IF(クエスト!R[11]C8>0,クエスト!R[11]C[9],"-") -> #N/A | K20: =IF(クエスト!R[11]C8>0,クエスト!R[11]C[9],"-") -> #N/A | L20: =IF(クエスト!R[11]C8>0,LEFT(クエスト!R[11]C[9],2),"-") -> #N/A
A21: =IF(クエスト!R[11]C8>0,LEFT(クエスト!R[11]C[6],10),"-") -> #N/A | B21: =IF(クエスト!R[11]C8>0,クエスト!R[11]C[9],"-") -> #N/A | C21: =IF(クエスト!R[11]C8>0,クエスト!R[11]C[9],"-") -> #N/A | D21: =IF(クエスト!R[11]C8>0,クエスト!R[11]C[9],"-") -> #N/A | E21: =IF(クエスト!R[11]C8>0,クエスト!R[11]C[9],"-") -> #N/A | F21: =IF(クエスト!R[11]C8>0,クエスト!R[11]C[9],"-") -> #N/A | G21: =IF(クエスト!R[11]C8>0,クエスト!R[11]C[9],"-") -> #N/A | H21: =IF(クエスト!R[11]C8>0,クエスト!R[11]C[9],"-") -> #N/A | I21: =IF(クエスト!R[11]C8>0,クエスト!R[11]C[9],"-") -> #N/A | J21: =IF(クエスト!R[11]C8>0,クエスト!R[11]C[9],"-") -> #N/A | K21: =IF(クエスト!R[11]C8>0,クエスト!R[11]C[9],"-") -> #N/A | L21: =IF(クエスト!R[11]C8>0,LEFT(クエスト!R[11]C[9],2),"-") -> #N/A
A22: =IF(クエスト!R[11]C8>0,LEFT(クエスト!R[11]C[6],10),"-") -> #N/A | B22: =IF(クエスト!R[11]C8>0,クエスト!R[11]C[9],"-") -> #N/A | C22: =IF(クエスト!R[11]C8>0,クエスト!R[11]C[9],"-") -> #N/A | D22: =IF(クエスト!R[11]C8>0,クエスト!R[11]C[9],"-") -> #N/A | E22: =IF(クエスト!R[11]C8>0,クエスト!R[11]C[9],"-") -> #N/A | F22: =IF(クエスト!R[11]C8>0,クエスト!R[11]C[9],"-") -> #N/A | G22: =IF(クエスト!R[11]C8>0,クエスト!R[11]C[9],"-") -> #N/A | H22: =IF(クエスト!R[11]C8>0,クエスト!R[11]C[9],"-") -> #N/A | I22: =IF(クエスト!R[11]C8>0,クエスト!R[11]C[9],"-") -> #N/A | J22: =IF(クエスト!R[11]C8>0,クエスト!R[11]C[9],"-") -> #N/A | K22: =IF(クエスト!R[11]C8>0,クエスト!R[11]C[9],"-") -> #N/A | L22: =IF(クエスト!R[11]C8>0,LEFT(クエスト!R[11]C[9],2),"-") -> #N/A
A23: =IF(クエスト!R[11]C8>0,LEFT(クエスト!R[11]C[6],10),"-") -> #N/A | B23: =IF(クエスト!R[11]C8>0,クエスト!R[11]C[9],"-") -> #N/A | C23: =IF(クエスト!R[11]C8>0,クエスト!R[11]C[9],"-") -> #N/A | D23: =IF(クエスト!R[11]C8>0,クエスト!R[11]C[9],"-") -> #N/A | E23: =IF(クエスト!R[11]C8>0,クエスト!R[11]C[9],"-") -> #N/A | F23: =IF(クエスト!R[11]C8>0,クエスト!R[11]C[9],"-") -> #N/A | G23: =IF(クエスト!R[11]C8>0,クエスト!R[11]C[9],"-") -> #N/A | H23: =IF(クエスト!R[11]C8>0,クエスト!R[11]C[9],"-") -> #N/A | I23: =IF(クエスト!R[11]C8>0,クエスト!R[11]C[9],"-") -> #N/A | J23: =IF(クエスト!R[11]C8>0,クエスト!R[11]C[9],"-") -> #N/A | K23: =IF(クエスト!R[11]C8>0,クエスト!R[11]C[9],"-") -> #N/A | L23: =IF(クエスト!R[11]C8>0,LEFT(クエスト!R[11]C[9],2),"-") -> #N/A
A24: =IF(クエスト!R[11]C8>0,LEFT(クエスト!R[11]C[6],10),"-") -> #N/A | B24: =IF(クエスト!R[11]C8>0,クエスト!R[11]C[9],"-") -> #N/A | C24: =IF(クエスト!R[11]C8>0,クエスト!R[11]C[9],"-") -> #N/A | D24: =IF(クエスト!R[11]C8>0,クエスト!R[11]C[9],"-") -> #N/A | E24: =IF(クエスト!R[11]C8>0,クエスト!R[11]C[9],"-") -> #N/A | F24: =IF(クエスト!R[11]C8>0,クエスト!R[11]C[9],"-") -> #N/A | G24: =IF(クエスト!R[11]C8>0,クエスト!R[11]C[9],"-") -> #N/A | H24: =IF(クエスト!R[11]C8>0,クエスト!R[11]C[9],"-") -> #N/A | I24: =IF(クエスト!R[11]C8>0,クエスト!R[11]C[9],"-") -> #N/A | J24: =IF(クエスト!R[11]C8>0,クエスト!R[11]C[9],"-") -> #N/A | K24: =IF(クエスト!R[11]C8>0,クエスト!R[11]C[9],"-") -> #N/A | L24: =IF(クエスト!R[11]C8>0,LEFT(クエスト!R[11]C[9],2),"-") -> #N/A
A25: =IF(クエスト!R[11]C8>0,LEFT(クエスト!R[11]C[6],10),"-") -> #N/A | B25: =IF(クエスト!R[11]C8>0,クエスト!R[11]C[9],"-") -> #N/A | C25: =IF(クエスト!R[11]C8>0,クエスト!R[11]C[9],"-") -> #N/A | D25: =IF(クエスト!R[11]C8>0,クエスト!R[11]C[9],"-") -> #N/A | E25: =IF(クエスト!R[11]C8>0,クエスト!R[11]C[9],"-") -> #N/A | F25: =IF(クエスト!R[11]C8>0,クエスト!R[11]C[9],"-") -> #N/A | G25: =IF(クエスト!R[11]C8>0,クエスト!R[11]C[9],"-") -> #N/A | H25: =IF(クエスト!R[11]C8>0,クエスト!R[11]C[9],"-") -> #N/A | I25: =IF(クエスト!R[11]C8>0,クエスト!R[11]C[9],"-") -> #N/A | J25: =IF(クエスト!R[11]C8>0,クエスト!R[11]C[9],"-") -> #N/A | K25: =IF(クエスト!R[11]C8>0,クエスト!R[11]C[9],"-") -> #N/A | L25: =IF(クエスト!R[11]C8>0,LEFT(クエスト!R[11]C[9],2),"-") -> #N/A
A26: =IF(クエスト!R[11]C8>0,LEFT(クエスト!R[11]C[6],10),"-") -> #N/A | B26: =IF(クエスト!R[11]C8>0,クエスト!R[11]C[9],"-") -> #N/A | C26: =IF(クエスト!R[11]C8>0,クエスト!R[11]C[9],"-") -> #N/A | D26: =IF(クエスト!R[11]C8>0,クエスト!R[11]C[9],"-") -> #N/A | E26: =IF(クエスト!R[11]C8>0,クエスト!R[11]C[9],"-") -> #N/A | F26: =IF(クエスト!R[11]C8>0,クエスト!R[11]C[9],"-") -> #N/A | G26: =IF(クエスト!R[11]C8>0,クエスト!R[11]C[9],"-") -> #N/A | H26: =IF(クエスト!R[11]C8>0,クエスト!R[11]C[9],"-") -> #N/A | I26: =IF(クエスト!R[11]C8>0,クエスト!R[11]C[9],"-") -> #N/A | J26: =IF(クエスト!R[11]C8>0,クエスト!R[11]C[9],"-") -> #N/A | K26: =IF(クエスト!R[11]C8>0,クエスト!R[11]C[9],"-") -> #N/A | L26: =IF(クエスト!R[11]C8>0,LEFT(クエスト!R[11]C[9],2),"-") -> #N/A
A27: =IF(クエスト!R[11]C8>0,LEFT(クエスト!R[11]C[6],10),"-") -> #N/A | B27: =IF(クエスト!R[11]C8>0,クエスト!R[11]C[9],"-") -> #N/A | C27: =IF(クエスト!R[11]C8>0,クエスト!R[11]C[9],"-") -> #N/A | D27: =IF(クエスト!R[11]C8>0,クエスト!R[11]C[9],"-") -> #N/A | E27: =IF(クエスト!R[11]C8>0,クエスト!R[11]C[9],"-") -> #N/A | F27: =IF(クエスト!R[11]C8>0,クエスト!R[11]C[9],"-") -> #N/A | G27: =IF(クエスト!R[11]C8>0,クエスト!R[11]C[9],"-") -> #N/A | H27: =IF(クエスト!R[11]C8>0,クエスト!R[11]C[9],"-") -> #N/A | I27: =IF(クエスト!R[11]C8>0,クエスト!R[11]C[9],"-") -> #N/A | J27: =IF(クエスト!R[11]C8>0,クエスト!R[11]C[9],"-") -> #N/A | K27: =IF(クエスト!R[11]C8>0,クエスト!R[11]C[9],"-") -> #N/A | L27: =IF(クエスト!R[11]C8>0,LEFT(クエスト!R[11]C[9],2),"-") -> #N/A
A28: =IF(クエスト!R[11]C8>0,LEFT(クエスト!R[11]C[6],10),"-") -> #N/A | B28: =IF(クエスト!R[11]C8>0,クエスト!R[11]C[9],"-") -> #N/A | C28: =IF(クエスト!R[11]C8>0,クエスト!R[11]C[9],"-") -> #N/A | D28: =IF(クエスト!R[11]C8>0,クエスト!R[11]C[9],"-") -> #N/A | E28: =IF(クエスト!R[11]C8>0,クエスト!R[11]C[9],"-") -> #N/A | F28: =IF(クエスト!R[11]C8>0,クエスト!R[11]C[9],"-") -> #N/A | G28: =IF(クエスト!R[11]C8>0,クエスト!R[11]C[9],"-") -> #N/A | H28: =IF(クエスト!R[11]C8>0,クエスト!R[11]C[9],"-") -> #N/A | I28: =IF(クエスト!R[11]C8>0,クエスト!R[11]C[9],"-") -> #N/A | J28: =IF(クエスト!R[11]C8>0,クエスト!R[11]C[9],"-") -> #N/A | K28: =IF(クエスト!R[11]C8>0,クエスト!R[11]C[9],"-") -> #N/A | L28: =IF(クエスト!R[11]C8>0,LEFT(クエスト!R[11]C[9],2),"-") -> #N/A
A29: =IF(クエスト!R[11]C8>0,LEFT(クエスト!R[11]C[6],10),"-") -> #N/A | B29: =IF(クエスト!R[11]C8>0,クエスト!R[11]C[9],"-") -> #N/A | C29: =IF(クエスト!R[11]C8>0,クエスト!R[11]C[9],"-") -> #N/A | D29: =IF(クエスト!R[11]C8>0,クエスト!R[11]C[9],"-") -> #N/A | E29: =IF(クエスト!R[11]C8>0,クエスト!R[11]C[9],"-") -> #N/A | F29: =IF(クエスト!R[11]C8>0,クエスト!R[11]C[9],"-") -> #N/A | G29: =IF(クエスト!R[11]C8>0,クエスト!R[11]C[9],"-") -> #N/A | H29: =IF(クエスト!R[11]C8>0,クエスト!R[11]C[9],"-") -> #N/A | I29: =IF(クエスト!R[11]C8>0,クエスト!R[11]C[9],"-") -> #N/A | J29: =IF(クエスト!R[11]C8>0,クエスト!R[11]C[9],"-") -> #N/A | K29: =IF(クエスト!R[11]C8>0,クエスト!R[11]C[9],"-") -> #N/A | L29: =IF(クエスト!R[11]C8>0,LEFT(クエスト!R[11]C[9],2),"-") -> #N/A
A30: =IF(クエスト!R[11]C8>0,LEFT(クエスト!R[11]C[6],10),"-") -> #N/A | B30: =IF(クエスト!R[11]C8>0,クエスト!R[11]C[9],"-") -> #N/A | C30: =IF(クエスト!R[11]C8>0,クエスト!R[11]C[9],"-") -> #N/A | D30: =IF(クエスト!R[11]C8>0,クエスト!R[11]C[9],"-") -> #N/A | E30: =IF(クエスト!R[11]C8>0,クエスト!R[11]C[9],"-") -> #N/A | F30: =IF(クエスト!R[11]C8>0,クエスト!R[11]C[9],"-") -> #N/A | G30: =IF(クエスト!R[11]C8>0,クエスト!R[11]C[9],"-") -> #N/A | H30: =IF(クエスト!R[11]C8>0,クエスト!R[11]C[9],"-") -> #N/A | I30: =IF(クエスト!R[11]C8>0,クエスト!R[11]C[9],"-") -> #N/A | J30: =IF(クエスト!R[11]C8>0,クエスト!R[11]C[9],"-") -> #N/A | K30: =IF(クエスト!R[11]C8>0,クエスト!R[11]C[9],"-") -> #N/A | L30: =IF(クエスト!R[11]C8>0,LEFT(クエスト!R[11]C[9],2),"-") -> #N/A
A31: =IF(クエスト!R[14]C8>0,LEFT(クエスト!R[14]C[6],10),"-") -> #N/A | B31: =IF(クエスト!R[14]C8>0,クエスト!R[14]C[9],"-") -> #N/A | C31: =IF(クエスト!R[14]C8>0,クエスト!R[14]C[9],"-") -> #N/A | D31: =IF(クエスト!R[14]C8>0,クエスト!R[14]C[9],"-") -> #N/A | E31: =IF(クエスト!R[14]C8>0,クエスト!R[14]C[9],"-") -> #N/A | F31: =IF(クエスト!R[14]C8>0,クエスト!R[14]C[9],"-") -> #N/A | G31: =IF(クエスト!R[14]C8>0,クエスト!R[14]C[9],"-") -> #N/A | H31: =IF(クエスト!R[14]C8>0,クエスト!R[14]C[9],"-") -> #N/A | I31: =IF(クエスト!R[14]C8>0,クエスト!R[14]C[9],"-") -> #N/A | J31: =IF(クエスト!R[14]C8>0,クエスト!R[14]C[9],"-") -> #N/A | K31: =IF(クエスト!R[14]C8>0,クエスト!R[14]C[9],"-") -> #N/A | L31: =IF(クエスト!R[14]C8>0,LEFT(クエスト!R[14]C[9],2),"-") -> #N/A
A32: =クエスト!R1C6&" "&クエスト!R8C1&" "&クエスト!R8C2 -> ミラクルニキのコーデ試算表 バージョン： beta4
A33: =クエスト!R1C11 -> https://github.com/koala31/MiracleNikkiJp_chart

Sheet: 選択肢
A1: このシートでは選択肢を定義しています
A3: 種類リスト | B3: 単純選択リスト | C3: タグリスト | D3: タグの重要度リスト | E3: 色リスト | F3: 色の重要度リスト | G3: 評価条件1リスト | H3: 評価条件2リスト | I3: 評価条件3リスト | J3: 評価条件4リスト | K3: 評価条件5リスト | L3: スタイルのリスト | M3: 検索対象のリスト
A4: ヘアスタイル | D4: タグ重視+super | F4: 色重視+super | G4: 華麗+super | H4: エレガント+super | I4: 大人+super | J4: セクシー+super | K4: ウォーム+super | L4: ドレス | M4: リスト全体
A5: ドレス | B5: ◯ | C5: UV対策 | D5: タグ重視+++ | E5: 黒 | F5: 色重視+++ | G5: 華麗+++ | H5: エレガント+++ | I5: 大人+++ | J5: セクシー+++ | K5: ウォーム+++ | L5: トップス＆ボトムス | M5: 持っているアイテム
A6: コート | C6: ダンサー | D6: タグ重視++ | E6: 灰 | F6: 色重視++ | G6: 華麗++ | H6: エレガント++ | I6: 大人++ | J6: セクシー++ | K6: ウォーム++
A7: トップス | C7: 小花柄 | D7: タグ重視+ | E7: 白 | F7: 色重視+ | G7: 華麗+ | H7: エレガント+ | I7: 大人+ | J7: セクシー+ | K7: ウォーム+
A8: ボトムス | C8: 冬服 | D8: 評価しない | E8: 桃 | F8: 評価しない | G8: 評価しない | H8: 評価しない | I8: 評価しない | J8: 評価しない | K8: 評価しない
A9: 靴下 | C9: 英国風 | D9: タグ重視- | E9: 赤 | F9: 色重視- | G9: シンプル+ | H9: アクティブ+ | I9: キュート+ | J9: ピュア+ | K9: クール+
A10: 靴下・ガーター | B10: 指定のリスト | C10: 水着 | D10: タグ重視-super | E10: 茶 | F10: 色重視-super | G10: シンプル++ | H10: アクティブ++ | I10: キュート++ | J10: ピュア++ | K10: クール++
A11: シューズ | C11: バスタイム | E11: ベージュ | G11: シンプル+++ | H11: アクティブ+++ | I11: キュート+++ | J11: ピュア+++ | K11: クール+++
A12: ヘッドアクセ | B12: ◯ | C12: 和風 | E12: 亜麻 | G12: シンプル+super | H12: アクティブ+super | I12: キュート+super | J12: ピュア+super | K12: クール+super
A13: ヴェール | B13: NG | C13: ナイトウェア | E13: 橙
A14: カチューシャ | C14: ウェディング | E14: 黄
A15: つけ耳 | C15: ミリタリー | E15: 緑
A16: 耳飾り | C16: OL | E16: 水
A17: マフラー | C17: エプロン | E17: 青
A18: ネックレス | C18: チャイナドレス | E18: 紺
A19: 右手飾り | C19: メイド | E19: 藍
A20: 左手飾り | C20: フォーマル | E20: 紫
A21: 手袋 | C21: ネイビー | E21: 金
A22: 右手持ち | C22: エスニック | E22: 銀
A23: 左手持ち | C23: バニー
A24: 両手持ち | C24: お嬢様
A25: 腰飾り | C25: ロリータ
A26: フェイス | C26: ゴシック
A27: ボディ | C27: スポーティ
A28: タトゥー | C28: 原宿系
A29: 羽根 | C29: 学生風
A30: しっぽ | C30: 中性風
A31: 前景 | C31: 近未来
A32: 後景 | C32: メルヘン
A33: 吊り | C33: ロック
A34: 床 | C34: デニム
A35: 肌 | C35: 小動物
A36: メイク | C36: 女神
C37: POP
C38: 部屋着
C39: クラシックチャイナ
C40: インド風
C41: レトロチャイナ
C42: 中世ヨーロッパ風
C43: ワル
C44: 雨の日
C45: モダンチャイナ
C46: 森ガール
C47: ボヘミアン
C48: メディカル